onset	duration	trial_type	wav_onset	sample	value
3807.8017	3.7400	listening	3807.8100	4569362	一体警察なんてやつらは全員殺されるべきもんだ
3812.3777	5.7240	listening	3812.3860	4574853	俺が言いたいのはなそんなことが理由で団地を離れるならバカバカしいってことだけだ
3819.9925	5.0000	covert	n/a	4583991	そんなことが理由で団地を離れるならバカバカしいってことだけだ
3827.7697	2.5880	listening	3827.7780	4593324	とにかく一旦帰ってこい話をしよう
3838.5725	5.0000	covert	n/a	4606287	とにかく一旦帰ってこい話をしよう
3846.9377	2.6520	listening	3846.9460	4616325	深澤は一方的ニュートツラーを切った
3852.7442	5.0000	covert	n/a	4623293	深沢は一方的に言うと通話を切った。
3861.5937	3.3240	listening	3861.6020	4633912	話し合った末一旦団地に戻ることに決めた
3866.6208	5.0000	covert	n/a	4639945	一旦団地に戻ることに決めた
3877.1777	1.5960	listening	3877.1860	4652613	久しぶりに団地に戻り
3881.3450	5.0000	covert	n/a	4657614	久しぶりに団地に戻り
3888.6657	1.3080	listening	3888.6740	4666399	深澤の部屋に行く
3890.7777	2.7160	listening	3890.7860	4668933	そのリビングルームにや深澤の他にもさに
3895.4333	5.0000	covert	n/a	4674520	深沢の部屋に行くそのリビングルームには深沢の他にも3人
3902.4897	4.1880	listening	3902.4980	4682988	いずれもこの団地では顔の利く面々だ
3909.3377	2.8120	listening	3909.3460	4691205	勢ぞろいしてるね誰かのお誕生会なの
3916.2917	5.0000	covert	n/a	4699550	生揃いしてるね誰かのお誕生会なの?違うお前
3923.3537	2.8760	listening	3923.3620	4708024	お前たちを待っていたんだとにかくそこに座り
3930.7358	5.0000	covert	n/a	4716883	お前たちを待っていたんだとにかくそこに座れ
3937.7857	3.3880	listening	3937.7940	4725343	ソファを刺したが私たちは立ったままでいた
3944.5442	5.0000	covert	n/a	4733453	ソファーをさしたが私たちは立ったままでいた
3951.6097	3.3240	listening	3951.6180	4741932	よくこのメンバーで説教されたものだ
