onset	duration	trial_type	wav_onset	sample	value
5493.3275	5.3100	overt	5493.3600	6591993	遠回しにリカコさんに確認を取ったやはり予想は大体当たっていた
5547.8975	10.9500	overt	5547.9300	6657477	はつて藤吉という場所は狩猟で栄えた時期があり外来の漁師たちのケチとして多くの荒くれ者が集まった時期があったというそういったものが村の女を手より
5559.7775	2.6700	overt	5559.8100	6671733	女に手を出すことを防ぐために
5566.1075	3.9600	overt	5566.1400	6679329	藤吉はあらかじめ専門職を用意する必要があった
5572.8875	8.7900	overt	5572.9200	6687465	過酷な仕事に自らの結束をつかせることで上松家はその分野における支配力を確立したのだという
5582.4875	5.2800	overt	5582.5200	6698985	加えてそれ以前から上松家の先祖は何かしら
5588.3075	2.9100	overt	5588.3400	6705969	宗教的な権威を持っていたらしい
5591.7275	16.3650	overt	5591.7600	6710073	性の独占は性の神秘界とつながっていく出産や育児といった領域にも支配域は広がり演習の区引きでそれらを強く絞りつける人間が生きていれば必ず生じる安堵町家は
5608.0925	16.3650	overt	5608.1250	6729711	寝屋の橋田目という思いをあえてこうむることで支配することに成功したのだ表向けの神事や祭り事事を見ぐるま家が支配し井口家が職頭端字
5628.7775	4.5600	overt	5628.8100	6754533	野下家が医学とその他の学問を使さどる
5635.9475	7.3200	overt	5635.9800	6763137	これに対して上松家が独占すべき要素は何だろうと思っていたがなるほど聞けば納得するしかない
5643.8375	17.4000	overt	5643.8700	6772605	自在が流れ家業がやがて自流に合わなくなっていくと当然家は衰退していった折悪く戦争や狩猟行為の需要の低下さらに外部から持ち込まれた病気の蔓などで上松家やみるみるその存在感を失った
5662.8875	9.8400	overt	5662.9200	6795465	しかし寝屋の松江たちにはもう新たな活路に自分たちで見いだすような相違も熱意も残ってはいなかった
5714.5475	1.3800	overt	5714.5800	6857457	発想外
5729.5175	13.1100	overt	5729.5500	6875421	雲の家の当主 雲の巫女にはその称号にふさわしい陰鬱な背景が確かに存在したそして先行く運命もまた陰鬱である藤吉村の前時代的な
5743.7375	3.7500	overt	5743.7700	6892485	異物の塊である上マツケを切り捨てることで
5748.1175	16.0800	overt	5748.1500	6897741	おそらく他の産家は行くばくか現代化を果たしたことにできる望まれぬ命家の末裔として復興の希望もないのに九州通りに家の橋ためとして育てられたのが上松り加古という女性
5767.0475	17.4900	overt	5767.0800	6920457	その真珠を僕などが理解できるなんて言えるわけがない文字通り彼女とは住む世界が違った住む自在すら違った彼女の絶望を僕が受け止められることなど思うことすらおこがましいことだった
5786.9975	6.3600	overt	5787.0300	6944397	その言葉の意味が本気で分からず僕は数秒の瞬時の後意を通った
5802.0275	1.0200	overt	5802.0600	6962433	あしざま
5828.3075	7.6800	overt	5828.3400	6993969	どうしてこの人たちはヒゲを重ねて身を引くのが当たり前だと思ってるのだろうか
5838.1175	14.3100	overt	5838.1500	7005741	白曲の責任は全て女性側が持っていくとかあるいは逆に振るのはあくまで男の側であくまで女性側は思い続けるという対面を保つのがマナーだとか
5854.1975	9.3300	overt	5854.2300	7025037	そんな地域性でもあるっていうのかクソくらいだなしかしそんな女性を好きになってしまったのがそもそも間違いだったのかもしれない
5880.2675	4.2600	overt	5880.3000	7056321	沈黙はニ呼吸分も続かなかった
5896.1975	7.5600	overt	5896.2300	7075437	なるほど神秘を根拠にされてはもうどうしようがない
5909.0075	4.0800	overt	5909.0400	7090809	あなたは死なないわ私が守るからか
5929.9175	2.4000	overt	5929.9500	7115901	それでおしまい最後まで
5935.4075	5.4000	overt	5935.4400	7122489	木と干しのままつまらない挨拶をして分かる
5951.6375	3.6900	overt	5951.6700	7141965	最後まで木戸越しのままつまらない挨拶をして別れた
5956.7975	15.4200	overt	5956.8300	7148157	著しい疲労感とともに布団に倒れ込む薄い布団越しに床にぶつかり鈍い痛みを肩に受けたがリアクションするのも悔だった一晩でニ人と破局したのはさすがに初めてだ
5972.2175	15.4200	overt	5972.2500	7166661	サン連続ということになる失恋旅行でさらに失恋してどうするんだろうせで出られないなら前の時みたいにサラナ映画が経由で入って死ぬまでちえみに甘えるのが一番幸せなんだろうか
5988.1775	14.4300	overt	5988.2100	7185813	あるいは今回においてもっとうまくやるようがあったのだろうかそれはもうわからないオオカミが徘徊する夜だってのにこんなことを考えてる僕は神経がいくつか切れているのだろうかそれは否定しないが今回についてはちょっと違う
6002.6075	14.4300	overt	6002.6400	7203129	ただもう酒が見えただけだただ一つレカコさんが生き残るかどうかその疑問や心配がささくれのようにチクチクと思考を抑えなむのを感じつつ僕は意識を手放してしまおうと努力する
6027.1175	2.5200	overt	6027.1500	7232541	よしそうかな
6033.6275	17.0700	overt	6033.6600	7240353	やはりそうだったやはりそうだったあとはもうどのように型をつけるかどのように実態と心情の折り合いをつけるかそれだけの問題や問題はもうニつ宇宙まで狼が暴走しないかそして今日誰を弾えばいいのか
6051.9875	15.6000	overt	6052.0200	7262385	午前ゴ時気候は変わらずノーム視界は夜よりマシという程度肝臓さんは見回りを行っているだろうか昨日の朝のような雰囲気は最後にはなくなっていたからある程度は期待できる
6067.5875	15.6000	overt	6067.6200	7281105	僕にはもう銃がない確実に人側である彼が銃を持って巡回していると状況は実はかなり重要だったのだと思う僕は慎重に一歩を踏み出した一瞬
6084.7175	2.9700	overt	6084.7500	7301661	あとには霧の中からオオカミが
6088.8275	15.0200	overt	6088.8600	7306593	その緊張感から忍び足を試みるしかしここは切りと恐るべき沈黙に満たされた世界歩くたびに草は揺れ砂利はこすれ合いその音は休みず中に聞こえるんじゃないかというほどよく響きました
6103.8475	15.0200	overt	6103.8800	7324617	それどころか自分の鼓動さえ狼に筒抜きなんじゃないのかと疑念が湧く冷静になれそんなことがあるかもしそうなら相手だってそのはずだ今こうして立ち止まってる間にもおってのしの
6118.8675	15.0200	overt	6118.9000	7342641	何も聞こえない誰もいないもしくは皆潜んでいる脇の茂みからいきなり殺人者が飛び出してくるのではないかと疑い始めると足を進められなくなった
6134.7575	14.0100	overt	6134.7900	7361709	そっと道の脇によけこしようとした少し落ち着いて考えるニョミミの宴をゲームと捉えるとプレイヤーゲームの進行には基本的に
6150.8375	15.4800	overt	6150.8700	7381005	審判は介入せずプレイヤーの自治に任されているといえる一人より多く殺す行為と夜に出歩く行為に対してのみ超自然的なデスペナルティが発生するのがだ
6166.3175	15.4800	overt	6166.3500	7399581	これが最低限の介入しかし一方でニ人以上の犠牲者が出ないように守られるといったことはないそしてこれまで必ず追い詰められた側がデスペナルティ覚悟の殺人を試みてきた
6187.7375	19.9800	overt	6187.7700	7425285	必ずだつまりルールを順守させることは重視されていない余計な死人が出ても構わないということ人側が保護されていないばかりか晴天が正義としている狼だって汚れ確保の殺人からは守られない
6213.5975	10.5600	overt	6213.6300	7456317	こうなるといよいよゲームの主催者信頼明明神の狙いがわからない単に血が見たいだけなのだろうかだとすればなぜこんな上んな真似をする
6224.9075	13.1700	overt	6224.9400	7469889	信頼人は山の神汚れは山の起きて読み人は敵ただし読みに落ちたのは人かオカミかはわからないこの時点ですでにおかしいけがれがよみの力なら
6238.0775	13.1700	overt	6238.1100	7485693	山と読みの対立軸がすでにあやふやになっている逆に言えば山と読みは実はイコールで明確な対立軸など存在しないと考えるしかない
6255.6875	14.2500	overt	6255.7200	7506825	信頼み二面性を持つ神自らに使える藤吉村の住人を気まぐれに二次元へに分け会い争わせる
6273.7175	4.7400	overt	6273.7500	7528461	その流血自体を狙いとして霧で村を囲い込んで
6301.4675	18.3600	overt	6301.5000	7561761	まるで殺しやむか狩り場みたいにさすがに考えすぎだろうかしかしルールが厳密でなく審判の介入が少ないということは狙い目でもある最低限の犠牲で乗り切る方法はおそらくあるここを乗り切れば
6321.1475	1.9500	overt	6321.1800	7585377	竹に出ることにした
6343.3475	6.5100	overt	6343.3800	7612017	僕は大きく息を吸って腹の底から絶叫してみたそしてすぐに身を捨てる
6351.1475	6.1800	overt	6351.1800	7621377	肝臓さんや匠さんがその場にいたら助けに来てくれるはず逆に狼がいれば
6358.6475	4.8300	overt	6358.6800	7630377	自分たちの感知しないことが起きたことを怪しんで動くはず
6364.6175	2.4300	overt	6364.6500	7637541	それを隠れて見ていれば
6368.3675	2.3100	overt	6368.4000	7642041	気をつかれることはないはずだ
6373.2875	7.8000	overt	6373.3200	7647945	ゴ分待ってもっと一つしないもしかして全員すでに死んでるとかじゃないだろうなありえないはずだそれは
6382.3775	12.0900	overt	6382.4100	7658853	あるいはこっちの真意を見透かされて僕の存在を知られただけでいまだ待ち伏せをされているのでは全て臆測の班中霧の中では何が起きていてもおかしくない
6395.1275	1.1700	overt	6395.1600	7674153	次の手
6397.7975	5.1900	overt	6397.8300	7677357	ごく短い移動と潜伏を繰り返しながらとりあえず村の中心部を目指すか
6404.7575	15.6900	overt	6404.7900	7685709	忍び足で早くに短い道多少とは立つが他の潜伏者からすれば位置をつかみにくいはず置き場ごと隠れるなら間隔も適当で隠れるのにもちょうどいいよしこれだ
6423.0875	3.0600	overt	6423.1200	7707705	走る隠れる息を潜める何も起きない
6428.3375	3.9600	overt	6428.3700	7714005	いちいち疑問を持たずしばらく試そう
6438.2375	1.9200	overt	6438.2700	7725885	走る隠れる
6444.6875	9.1500	overt	6444.7200	7733625	隠れようとした巨岩の影から切りを突っ切って現れたのは義嗣くんだったとっさに横飛びに避ける
6454.5275	6.5100	overt	6454.5600	7745433	もともといた場所にざくりとつけ刺さったのは牧はありようと思わしきぶこつなおの
6466.0775	6.4800	overt	6466.1100	7759293	再び振りかけた小野を怒りに任せてあさっての方へぶん投げ彼は絶叫する
6473.1275	4.6500	overt	6473.1600	7767753	もはや隠密行動もクソもないしか知れたこともあるこれはおそらく
6516.9575	8.3700	overt	6516.9900	7820349	どうせお騒ぎをしたに違いない彼がこうして生きているということは恐らく資格何度潜んでいない
6531.6875	5.8200	overt	6531.7200	7838025	案の定何事もなく広場まで来た義都君は人も口を聞かない
6539.7875	11.1300	overt	6539.8200	7847745	彼はさっき襲いかかってきた時と同じく浅い呼吸を繰り返し見開いた目にはほぼ凶器と言える極度の興奮が宿っている
6575.1275	3.7500	overt	6575.1600	7890153	念のため注意して進んだが人の気配はない
6579.3875	1.3200	overt	6579.4200	7895265	あしらや
6582.4175	10.1250	overt	6582.4500	7898901	壁板にあちこち傷があるよしつぐくんはずいぶんむちゃをしたな村唯一の黒電話も見事にぶち壊す
6592.5425	10.1250	overt	6592.5750	7911051	壊された状態で床に転がっていたそれを横目に見た後何事もなく最悪の彼女の寝室へ
6604.5275	1.0500	overt	6604.5600	7925433	同じだ
6607.5575	3.3000	overt	6607.5900	7929069	はるちゃんの時と同一しそうの殺し方だ
6611.9675	9.1500	overt	6612.0000	7934361	にじんだ血の足跡ももはや定番狼の犯行で間違いはない牧殺ではなく残殺だということ
6621.6575	10.1700	overt	6621.6900	7945989	オルベカオリの遺体は地の海の中でめった切りにされてそこにあったバラバラになっているわけじゃないまた無秩序に切りつけたわけでもない
6632.4575	3.6600	overt	6632.4900	7958949	一番近い形容は輪切りだろうか
6637.9475	8.2200	overt	6637.9800	7965537	青向きになったネクタイには体軸と垂直なつまり横向きの無数の切り傷が刻まれている
6649.0775	7.8300	overt	6649.1100	7978893	傷は骨まで足しているようだが立たれているわけではない体の表を表側だけ
6657.8975	2.5800	overt	6657.9300	7989477	生すぎりにされている
6662.4875	7.5900	overt	6662.5200	7994985	死因は湿血しか喉にもニサン度とつけられた傷による窒息しかどうにせよ無残
6671.2475	6.3000	overt	6671.2800	8005497	急や丸最後には違いないそしてなぜか顔面だけきれいに残されているのだ
6682.4375	15.3900	overt	6682.4700	8018925	おびただしい凍結に沈む彼女の死に顔はいつか見たようなシラの層を宿していた死の瞬間意識があったのだろうか今濁ってしまった僧には志向の像を
6699.3575	4.7400	overt	6699.3900	8039229	注ぐべき狼たちの顔が焼け付けられているのだろうか
6705.8375	18.9300	overt	6705.8700	8047005	彼女の気象の激しい一面はこれまで何度も見てきたもしかしたらそちらの方が彼女の本性に近い姿だったのかもしれないしかしたとえ貴女の相があろうともまぎれもなく彼女は自母でもあった二人の息子のそして彼らが暮らすやすも
6726.4475	5.0100	overt	6726.4800	8071737	幼子の守り手タルフンドの層の起上神話
6732.4475	3.4500	overt	6732.4800	8078937	岸も人というのだったか
6738.1775	9.8700	overt	6738.2100	8085813	そんなことが無意味に想起される本当に無意味だここは信頼様のにはよその神などに力を及ぼすことなどできるものか
6751.0775	2.7000	overt	6751.1100	8101293	二人には傷がない
6754.2875	7.7400	overt	6754.3200	8105145	しかし注意深く見てみるとどうやら一連の傷口は下側床に接する面にある
6765.6575	8.8800	overt	6765.6900	8118789	手の甲が上に手のひら側が下になっているが一連の傷は手のひらについているということだなぜだ
6775.3175	7.8900	overt	6775.3500	8130381	疑問に思って観察するとどうやら手首向きずらしい手首より先に妙な点があることに気づく
6784.0775	10.6800	overt	6784.1100	8140893	印象的な形で指が握られている右手は薬指と小指を握り込んでいる左手は親指以外を握り込んでいる
6800.4875	6.0000	overt	6800.5200	8160585	指を床で押さえながら握り込んだそれは苦悶の
6812.0375	6.7800	overt	6812.0700	8174445	痕跡たるデタラメな最後の形なのかそれとも何らかのメッセージなのか
6820.5275	4.9500	overt	6820.5600	8184633	いつの間にか義嗣君が来ていたそして安永君も
6888.9275	3.1500	overt	6888.9600	8266713	突然彼は僕を押し抜けて進む
6892.7975	3.0600	overt	6892.8300	8271357	そして彼女の遺体に手を伸ばすと
6897.5975	7.5000	overt	6897.6300	8277117	涙を詰まらせるような絶叫とともに彼は母の遺体の口を指でこじ開けた
6910.1375	9.4200	overt	6910.1700	8292165	僕の遠いに安永君はハット目を見開き義継ぐ君は答えぬまま指を喉の奥へ喉の奥へ
6924.6275	1.3500	overt	6924.6600	8309553	喉の傷
6928.9175	10.2300	overt	6928.9500	8314701	彼がつまみ出したのは血まみれの小さい何か彼が指で脱ぐと透明な部分が顔出すどうやら食品用ラップで巻かれた何かだ
6950.2475	7.4100	overt	6950.2800	8340297	すまないね僕は本来この場にいるべきじゃないとは分かっているからその程度は役に立とう
6959.6075	16.8900	overt	6959.6400	8351529	罪の中には小さく丸められた紙が入っていたそれをほどくと葉書きより二回りくらい小さな紙となった鉛筆らしきものでびっしりと小さな文字が記されているラップのおかげで血や大きににじむのは避けられたようで鮮明に読める
7010.5475	10.5300	overt	7010.5800	8412657	私はニ人を他の何よりも愛していましたそのこと以外は全て忘れて二人仲良く楽しく生きてください
7022.8175	8.5200	overt	7022.8500	8427381	これは僕が代読していいようなものじゃない僕はそれを広げると訳にあった粗末な作りの兄弟の上に置いた
7037.3675	4.8600	overt	7037.4000	8444841	僕は彼女の遺体に近づいた下向きになっている手首側の傷
7042.8575	4.2900	overt	7042.8900	8451429	右手の指は親指一指指中指が立ち
7047.9575	13.5900	overt	7047.9900	8457549	左手の指は親指だけ立っているそして義嗣くんが包みを取り出した喉の傷を注視し指を伸ばす断面を観察する太い感が一本だけ
7065.8075	12.3000	overt	7065.8400	8478969	食堂の入り口には匠さんが立っていたその外には全員いる匠さんは農具で肝臓さんは飼料用のナイフで武装しておりニ人組で安水全体を守り回り全員
7078.1075	12.3000	overt	7078.1400	8493729	全員叩き起こして回ったそうだだから状況は大体つかめている僕とオリベ兄弟は彼らの旬巡回より先に家を出たために会わなかった
7101.2375	19.5600	overt	7101.2700	8521485	おそらくニ人は母のことをそれぞれ心配して早起きになったのだろう匠さんは無言で目を防ぐ目を防んでいた薫さんのもとへ駆けつけたい気持ちをあえて背負けを押さえつけていた彼らの父になることができなかったあるいは間に
7121.3075	6.8100	overt	7121.3400	8545569	間に合わなかった男は家族の時間に割り込むことを自らに禁じたのだ悲劇だ
7129.3775	2.5800	overt	7129.4100	8555253	何もかもが悲劇だ僕は
7138.3775	1.9800	overt	7138.4100	8566053	たっぷりイチ時間はかかった
7141.6775	5.4300	overt	7141.7100	8570013	会場からは特殴暴れたり叫んだりという物音は聞こえなかった
7147.8275	17.4600	overt	7147.8600	8577393	だからこそニ人が降りてきた時その泣き晴らした顔面からは彼らが声を押し殺して泣いていたことがさせられた僕の提案はみんなから言葉少なに受け入れられ全員がお堂に移動した
7167.1475	5.7600	overt	7167.1800	8600577	支配が一巡し年長者が切り出すさっと拒否したのは安永君だった
7218.4175	8.1000	overt	7218.4500	8662101	これで正体不明なのは上松陸名古名古それに知恵ともちだけになった
7242.0875	12.3600	overt	7242.1200	8690505	皆が頭を寄せ全文を見た声をつまらせ涙を流す者もいたしかし結局のところ今重要なのは兄弟に当てたメッセージの部分ではないということを全員理解していた
7306.7975	6.9300	overt	7306.8300	8768157	逃げ手は小指と薬指を握り込んでいた左手は親指がように握り込んでいた
7420.4975	5.8200	overt	7420.5300	8904597	また疑念の視線が降り注ぐどうやらどくししかけるくらいじゃ信用は得られないようだ
7453.7675	3.6000	overt	7453.8000	8944521	もちろん気をつけていたから覚えている
7469.8775	2.5500	overt	7469.9100	8963853	あんまっちぐらいやっても
7474.6475	9.8700	overt	7474.6800	8969577	確かに前の時は香織さんは刻んだ毒素をそのまま入れて出してたなそれで清之助さんに見破られてたっけか
7503.6875	2.1900	overt	7503.7200	9004425	空気が消む感覚
7506.5975	8.4600	overt	7506.6300	9007917	輸送艦すら漂わせる怒りを消防に宿してかつての信用にいらみつけるオリブヤスナが真顔で
7516.4375	3.0000	overt	7516.4700	9019725	相対する鴨志田近持ち
7524.4475	4.8900	overt	7524.4800	9029337	人が死にそうな鋭い視線にさらされるしかしここだここが全てだ
7533.8375	3.8700	overt	7533.8700	9040605	少なからず攻撃的な口調を受け流し
7546.3475	4.9500	overt	7546.3800	9055617	嫌なことを思い出させて申し訳ないが必要なことは言及しなきゃならない
7579.9175	4.8000	overt	7579.9500	9095901	この経過の場合は
7598.9675	4.1100	overt	7599.0000	9118761	だからそれもやめてここで話を聞きたいな野里さんです
7627.7675	2.1600	overt	7627.8000	9153321	腕の傷が下に
7660.3175	4.4700	overt	7660.3500	9192381	もちろん深いものだけど骨までは見えていなかった
7741.8875	7.1400	overt	7741.9200	9290265	少し疲れて一旦言葉を切るが誰も何も一言も発さない完全にゼックだ
7760.0375	4.3200	overt	7760.0700	9312045	なるほどストーリーにかみ合ってて良いくでんだな
7766.3975	1.4400	overt	7766.4300	9319677	あれは左手が反省
7789.0475	12.3000	overt	7789.0800	9346857	その言葉はゆっくりひどくゆっくりと発せられたミナの反応もゆっくりだったこれまでほとんど疑われてもいなかったチームへと皆の顔が向けられる
7810.9775	5.1300	overt	7811.0100	9373173	図星効果的メンバーに与えた衝撃の大きさは皆の表情を見れば分かる
7857.8375	6.7200	overt	7857.8700	9429405	いつになく常絶なメーカーをきっと話したくてたまらなかったんだろうな
7893.4775	5.6400	overt	7893.5100	9472173	隠したつもりの情報は必ず露見する
7909.3775	7.3500	overt	7909.4100	9491253	ゲームとしては間違いなく反則だしかし命がかかったゲームでルールの穴があれば底をつかない手はないのだ
7933.4075	9.8100	overt	7933.4400	9520089	それは確かなんだが相手がオカミジジシだったから結局理由はよく分からないままだこれは今回はもう仕方ない
7954.1375	2.4600	overt	7954.1700	9544965	ここではなく自分の糸を
7996.4375	4.5300	overt	7996.4700	9595725	オオカミをイチ人確定させても最後のイチ人が決まらんわけだ
8039.2475	1.9500	overt	8039.2800	9647097	分かった
8047.6175	4.6800	overt	8047.6500	9657141	あれは僕を狙ったんじゃなくて死ぬのは誰でもよかった
8059.0175	3.9600	overt	8059.0500	9670821	たまたま毒のもられた器が僕に回っただけ
8128.1375	5.4600	overt	8128.1700	9753765	しかしちょうど僕がヘビだと明かした直後で効果は的面でしたね
8139.6875	2.5200	overt	8139.7200	9767625	少し息をすぐ
8143.7675	6.4800	overt	8143.8000	9772521	全員黙るあの瞬間香織さんに対して抱いてしまった自らの疑念を反省しているのだろう
8169.2075	3.1800	overt	8169.2400	9803049	お違いがありません
8176.3775	1.1100	overt	8176.4100	9811653	サンつヨン
8184.1175	4.1400	overt	8184.1500	9820941	イチ日ニ人以上の殺人は汚れの対象
8208.7175	3.7200	overt	8208.7500	9850461	中で犠牲者を決めて突撃させる
8221.6475	6.8700	overt	8221.6800	9865977	だから今日香織さんのルールに従って送られる覚悟をしていたでしょう
8253.8675	4.8900	overt	8253.9000	9904641	すでに通り過ぎたロンギを持ち出すもうそれしか残ってないように
8267.0375	3.0600	overt	8267.0700	9920445	その場のみんなが期待していたのだろう
8270.9375	5.3100	overt	8270.9700	9925125	もう黒身を暴けば狼はそれを認めて投稿すると
8276.8175	17.5800	overt	8276.8500	9932181	よもやその後に及んで悪化などすまいよもや正面から襲ってきは済まいよもやそこまでの凶悪性と殺傷能力をかつての隣人が備えてはいまい無理からぬ落感だオリベ安永安永岡化した事例を知れようしない
8294.3975	17.5800	overt	8294.4300	9953277	しかし僕に慕って気をつかれたところはあったのだ今回のオカミの凶悪性は承知していたがそれは常人と駆け離れた感性と隠け離れた感性と悪的な感を有数かもしら近持ちに由来すると思っていた
