onset	duration	trial_type	wav_onset	sample	value
3240.1475	2.3700	overt	3240.1800	3888177	信じるかどうかはともかく
3243.0575	1.3500	overt	3243.0900	3891669	僕としては
3245.1575	2.7000	overt	3245.1900	3894189	結論の一歩手前には来ている
3251.3075	12.8100	overt	3251.3400	3901569	名古か雲だとバレるようなことは絶対に避けたいそれどころか名古の正体が生まれて命が危険にさらされた上で生き残ろうとすれば著しい品縮を買うと考えるべき
3270.8375	2.7600	overt	3270.8700	3925005	それだけ僕の立場は微妙なのだ
3278.0675	3.2100	overt	3278.1000	3933681	まあこの人がそこを受けにするのは当然か
3289.7375	1.3500	overt	3289.7700	3947685	どうしようかな
3305.4575	3.2400	overt	3305.4900	3966549	次男坊と連れ合うものじゃないのだよ
3319.3475	7.3800	overt	3319.3800	3983217	彼女を高めに支えている費用方片の全ては時代遅れの束縛でしかない
3349.0475	2.9100	overt	3349.0800	4018857	という流れでなんと名刺をもらった
3353.4575	2.0400	overt	3353.4900	4024149	野里清之助
3356.9075	6.1200	overt	3356.9400	4028289	大卒医師医学博士本物のエリート様じゃないか
3365.8175	5.5500	overt	3365.8500	4038981	勤務先とかじゃない姿勢の弁士のようだ給食中か
3373.0775	8.4600	overt	3373.1100	4047693	メールアドレスと電話番号が記載されたそれは久々に見た文明の産物な気がしてノスタルジーすら覚える
3383.4575	13.7400	overt	3383.4900	4060149	目やの橋ためについての相談でそれは彼のせっかいなのかそれとも耳を傾けるべき忠告なのかあまり突っ込んだことを聞ける雰囲気ではないし全員はありがたく受け取るべきだな
3424.7375	1.3800	overt	3424.7700	4109685	そう考えた
3428.4275	1.2900	overt	3428.4600	4114113	僕だったが
3437.3675	10.5300	overt	3437.4000	4124841	まさかイチ時間もしないうちに植松家の藤吉村のまだ底知れぬ闇の一端をかいまみることになるとは思わなかった
3450.3275	5.5200	overt	3450.3600	4140393	片付けが終わり短く終えた面々が帰ってくると食事となる
3457.0475	3.1500	overt	3457.0800	4148457	香織さんはとてもいい人だ真珠
3461.8775	9.6600	overt	3461.9100	4154253	全ては察しきれるものじゃないが人間関係を正しく健全に保がらかに人当たりよく接してくれる
3490.0475	11.3100	overt	3490.0800	4188057	たとえ白氷の上のものであっても全員は全員良識を良しまして彼女は今回まだ何も素手化してはいないのだ
3504.0575	14.4000	overt	3504.0900	4204869	ワンの中根黄緑色の混合物がないかどうかつい気にしてしまう自分はつくづく悪意的な人間だなと思ってしまう残念ながら少年は直せないのでせめて外空だけは完璧に
3518.4575	14.4000	overt	3518.4900	4222149	それが僕のような人間にとっての良識となるそんなことを考えながら適当に席に席についた適当に競技をつけた
3539.1875	7.0200	overt	3539.2200	4247025	いつもながら素朴だが獲物肉の味がしっかりと効いたおいしい雑炊だ
3549.0575	15.9600	overt	3549.0900	4258869	自分の咀嚼し飲み込む感覚に何か違和感がありやけどでもしたかなななどと最初は思ったのだが口の中の感覚がいきなり頬や頬が喉に詰まるような感覚がした
3566.0075	13.8450	overt	3566.0400	4279209	が襲った次の瞬間上下の感覚が消失した思わず身をよじり頭に鈍痛が走ったと思った時僕は床に転倒していた毒をもられたそのことだけは理解でくる
3579.8525	13.8450	overt	3579.8850	4295823	残る僕の処方処理能力は全て全身を覆うような症状に持っていかれてしまっていた視点を定められない息がほとんどできず声も出ない
3594.4175	14.4900	overt	3594.4500	4313301	にもかかわらず口から喉にかけてやけつくような痛み暑さ音感がこみ上げて苦悶を抑えきれない周囲の状況もわからない大騒ぎにはなっているのだろうが呼吸をするだけで精いっぱいに
3608.9075	14.4900	overt	3608.9400	4330689	しかも呼吸困難はますます悪化してここで背中に大きな衝撃が来て僕の体は直接的な衝撃に跳ねついで激しく撮射する
3626.3675	6.8400	overt	3626.4000	4351641	一時的に呼吸が楽になり声も聞こえた視界もぐちゃぐちゃになった床と
3634.0775	10.4700	overt	3634.1100	4360893	自分の手だけが戻るしかし音感は止まらない胸と腹がひっくり返るような経連地味た悪心とともに遺産と
3654.5075	3.7500	overt	3654.5400	4385409	梅木を再びぶちまけた
3685.1075	11.0400	overt	3685.1400	4422129	周囲の会話の内容を把握できない喉の焼ける感触だけがそれが致命的なものであることだけが現在理解できる全てだ
3703.9475	15.4800	overt	3703.9800	4444737	誰かが何かの措置を施してくれているそれは分かるがすでに手遅れだという確信を僕は妙に冷静に受け止めていたやはりヘビとして最後まで生き残るのは難しかったようだじゃあ次はどうしよう
3720.6875	11.8800	overt	3720.7200	4464825	この瞬間の記憶を可能な限り次へ持ち越したいネガークバー今周囲で交わされている理解不能なやり取りを次でで
3733.4675	6.5400	overt	3733.5000	4480161	冷静に分析するために全て記憶しながら死にたいきっと難しいのだろうな
3740.9975	12.2400	overt	3741.0300	4489197	これまでも死の直前の記憶は霧がかかったように曖昧なことばかりだったから死ねない運命何度でも死ねる運命それは大変興味深いことでもあるが
3753.7775	6.6300	overt	3753.8100	4504533	結局やがて戻ってくるものには死の瞬間の秘密など明かされはしないということか
3763.8875	4.7100	overt	3763.9200	4516665	もはや苦しみすら薄れ意識と感覚は途絶えつつあった
3780.1175	17.3800	overt	3780.1500	4536141	しばらく騒がしかった周辺が途端に静かになったので僕はとうとう感覚が断絶したものかと思ったしかし実際は感覚はむしろ復活していた
3797.4975	17.3800	overt	3797.5300	4556997	おそらくは死の直前の症候状態あるいはもちろん錯覚である可能性もあるまへしたまま死を迎えることはできないのだろうか死の苦しみを抑えた感覚で味わわねばならないのか
3814.8775	17.3800	overt	3814.9100	4577853	そんな思考を僕は自覚できないでいるふとまぶた越しに感じる光が弱まる光は段階的に弱まり最後にほとんど暗くなって窓が閉じられたのだと妙にはっきり理解できた恐れ恐る目を開いてみる
3834.4775	10.7400	overt	3834.5100	4601373	よく見えないというのは単に暗いからで締め切られた食堂は単純に薄暗かった首を動かすのはひどくだるすでに
3845.2175	10.7400	overt	3845.2500	4614261	血管はほとんど体を循環していない自分の脈拍がひどく鈍く弱く感じられたやはりこのまま死ぬのだろう
3857.7575	13.5000	overt	3857.7900	4629309	そう思い直した時リカコさんはそばへと近づいてきた表情ははっきりとは見えないただ息遣いが妙には妙にはっきりと聞こえる深呼吸というよりは押し殺した荒いと行きそう思えたのは
3871.2575	13.5000	overt	3871.2900	4645509	呼気と吸気の終端にかすかに震えがあったからそっと口元を隠す稲拭うような所さんの後彼女は倒れている僕に身を寄せてきた
3885.8375	15.4900	overt	3885.8700	4663005	いや違う彼女は僕の体にまたがったのだ馬乗りになって上から見下ろしているはずの彼女は恥ずかしげにうつむいたまま上目遣いに視線を向けるその表情はこれから何かひどく後ろめたいことを始めようとする
3901.3275	15.4900	overt	3901.3600	4681593	粗さを隠さなくなったと息を吐き出す口元からは唾液に潤った小さな舌がはみ出ていて全てがひどく戦場的だった
3916.8175	15.4900	overt	3916.8500	4700181	下腹部に彼女の体温がじっとりと広がっていく彼に彼女の血骨の硬い感触が幾重にも幾重もの布越しに肌を押す
3934.1675	15.0450	overt	3934.2000	4721001	死に瀕していながらいやだからこそ異性の感触は容赦なくつきようとする体の中の性を男性を刺激する彼女の声は知らない女性のようだった
3949.2125	15.0450	overt	3949.2450	4739055	年齢不相応に幼く見える彼女の字で抜けたことのある彼女神奇的な彼女全てがそこにはなく生々しくなめまかしくしたやかで
3969.2075	14.3100	overt	3969.2400	4763049	怪しく乱熟した女性がもはや見慣れた黒染の装束に押し込められ不自由そうに身をよじっているそんな認識を持ったあたりで彼女の指がシャツの押す
3984.2075	11.3100	overt	3984.2400	4781049	層を探り合ってそっとまくり上げると簡単に心理を果たした冷たい指の感触が肌を滑り抜け思わず声が漏れる
3997.1675	17.7700	overt	3997.2000	4796601	突然もう片方の手も侵入し無遠慮に老舗を働き出す 腕は深く差し入れられられ手のひらは胸をなでまおし指は敏感な反応を探り求めるかのように巧みにいやらしく這い回った
4014.9375	17.7700	overt	4014.9700	4817925	死に際に際した感覚の鋭さを持て遊ばれることに戸惑いとある種の息通りが湧いてくるしかして抵抗はできない
4032.7075	17.7700	overt	4032.7400	4839249	それは単なる言い訳かもしれないもて遊ばれる喜び捕食される興奮しかしその指が不意に僕のベルトにかかれ金具を外そうとどこにそんな力が残っていたのか僕は彼女をしのけよと右手をつぱっていた
4051.6475	5.3700	overt	4051.6800	4861977	それはひどく弱しい抵抗だったが彼女には糸が通じたようだった
4057.5875	6.9300	overt	4057.6200	4869105	僕ごく短いつぶやきはこちらの供説の井を得たという淡白な糸のみでなっていた
4065.7775	3.4500	overt	4065.8100	4878933	彼女は右白岸脇に脱いだ
4070.9375	8.6400	overt	4070.9700	4885125	ぬくもりと感触は起油性変わり西を予感させる空気の冷たさが速やかに全身に広がっていく
4082.0375	3.9900	overt	4082.0700	4898445	微笑んだままの彼女は田本から何かを取り出した
4088.1875	3.6900	overt	4088.2200	4905825	和風のこしらえは千枚同士と呼ぶべきか
4092.5375	2.7600	overt	4092.5700	4911045	それに目を通していよいよ分からなくなった
4095.8975	4.8600	overt	4095.9300	4915077	彼女は僕を愛す気なのかさいなのか殺す気なのか
4101.2675	17.1900	overt	4101.3000	4921521	おそらくはさっきの抵抗で残った体力も気力も底をついたのだろう急激に視界が暗くなり感覚が遠くなる左肩に小さな痛み彼女が千枚同士でついたのだろうか
4119.7775	5.5500	overt	4119.8100	4943733	それが意識を失う直前の僕の最後の思考及び感覚だった
4128.6275	2.8800	overt	4128.6600	4954353	ふと目が覚めて僕はそのまま目を起こした
4132.1075	8.1000	overt	4132.1400	4958529	なぜかそばに血みがいてというか僕の手は彼女の手に握られていて彼女はひどい泣き顔で
4141.0475	4.9200	overt	4141.0800	4969257	そのまま僕の手の甲は彼女の額置き場になり
4151.0975	7.9500	overt	4151.1300	4981317	彼女はサメザメと泣き始める周りに目を向ける食堂だみんないるようだが何だろう難しい顔だ
4159.7975	6.6900	overt	4159.8300	4991757	知恵美のようにあからさまに感情を出してくれるものはいない一体何があったんだろう
4171.9475	1.2300	overt	4171.9800	5006337	刈り上げるところ
4174.4075	4.5900	overt	4174.4400	5009289	一瞬そんな本気の思考停止に陥ったのち
4184.9375	2.7900	overt	4184.9700	5021925	そうか僕は死にかけたのか
4188.9275	13.7100	overt	4188.9600	5026713	なぜ来ているというか実際あんなことがあったのが信じられないくらい体調はよいたっぷり眠って目覚めたような気分だ
4213.0175	10.8900	overt	4213.0500	5055621	その口調はいつもの嫌な感じに似ていたがどちらかといえばそれは疑念や不安を覆い隠すためのように思えた
4225.1975	6.8400	overt	4225.2300	5070237	窓辺に立ち視線を落として迷子をあやしているリカコさんを彼は明らかに気にしていた
4234.7375	6.9600	overt	4234.7700	5081685	みんな他の大勢が彼女に注目していたキーと不信と同等の経営新選手
4243.4975	4.8900	overt	4243.5300	5092197	彼の素朴な感想が術のところ今いたってよい
4249.1075	4.3800	overt	4249.1400	5098929	全てだった
4255.7375	1.9200	overt	4255.7700	5106885	何でもよくはない
4261.5275	3.6900	overt	4261.5600	5113833	僕が何度死んでも死に戻るという謎に加え
4266.0575	6.6300	overt	4266.0900	5119269	宗教的な儀儀儀により石を回避したというのは一言で言ってもとんでもない話だ
4273.8875	6.4200	overt	4273.9200	5128665	お祈り宗教的な儀式あの生々しい体験はそういう類のものだったのだろうか
4281.2975	10.0950	overt	4281.3300	5137557	ふと肩に手を当てるとそこには新しいガーゼが当ててあった脱脂面には血がにじんでいるやはりここは彼女に刺されたのだろう
4291.3925	10.0950	overt	4291.4250	5149671	ヘビにかまれたとかならともかく口から入ったトリカブトの毒を肩から吸い出すなんて考えられない
4305.5975	4.9800	overt	4305.6300	5166717	あれは彼女が言ったのだよな病毒を引き取る
4326.4775	2.5500	overt	4326.5100	5191773	ありがとうございます
4330.6775	9.7500	overt	4330.7100	5196813	なるほどなるほど確かに植松系というのは怖いものだったしかし今この瞬間もっと大事なことがあった
4365.4775	2.9400	overt	4365.5100	5238573	そういえば今気づいたが彼女は黒染めの
4369.2275	1.9200	overt	4369.2600	5243073	これもどうしたのだろう
4379.0075	11.3100	overt	4379.0400	5254809	それだこの場にみんないると言ったがかおりさんだけ明らかに様子が違う部屋の一番奥で椅子に座らされている真っ青な顔で
4489.6775	2.5500	overt	4489.7100	5387613	バレた後に訳なんてしねえだろう
4498.8575	2.6400	overt	4498.8900	5398629	確かに彼女はその通りだ
4502.6975	4.4100	overt	4502.7300	5403237	それほどまでに彼女を理解していてその上で惚れているのか
4508.7575	9.3000	overt	4508.7900	5410509	匠さんは本気なんだな今僕は心の底から彼のことを応援したくなったならばやはり今日の夜は超えなくてはならない
4549.4675	3.0900	overt	4549.5000	5459361	親子を置いて皆が外に出る
4560.3275	3.4800	overt	4560.3600	5472393	猟充は食堂の壁に立てかけられていた
4565.3375	7.3800	overt	4565.3700	5478405	肝臓さんは復元層にうなるとモッチから銃をぶんだくりそのまま霧の向こうに歩いていってしまった
4573.4675	7.7400	overt	4573.5000	5488161	空笑いをしようとして松日が少しだけ涙の後遺症のしゃっくりでゆがむ
4599.2375	3.6300	overt	4599.2700	5519085	猿際匠さんは僕の肩を軽く叩いた
4605.7475	6.2700	overt	4605.7800	5526897	大きな手に一瞬ぐっと力を込めて話すと匠さんもまた去っていった
4621.2575	5.0700	overt	4621.2900	5545509	最後までリカコさんは声をかけるどころか視線さえ向けてはくれなかった
4627.7975	11.6550	overt	4627.8300	5553357	敷きっぱなしだった布団にあぐらをかいて座ったもう緊張はない慣れたのもあるしおそらく今日僕が死ぬことはない単に眠気がないだけだ本当に痛み
4639.4525	11.6550	overt	4639.4850	5567343	どうして僕は生きていられたんだろう本当にアリは鳥かぶとだったのか本当に鳥かぶとならまず助からないと僕自身も聞いたことがある
4655.5775	5.4900	overt	4655.6100	5586693	一時的に死にそうになるがケロッと治る謎の毒とかを盛られたんじゃないのか
4664.3075	3.9000	overt	4664.3400	5597169	ミステリーの新人賞なら下嫁の段階でアウトだな
4677.8975	9.9300	overt	4677.9300	5613477	両者の言い分には実痛のところどっちも共感できる起きそうにない偶然が起きたなんて信じがたいという清之助氏の主張ももっとも
4688.7275	7.5900	overt	4688.7600	5626473	リスクを犯す必要のない人物が疑われるのは理不尽だという安永君の主張もまたもっともだ
4704.8075	3.0000	overt	4704.8400	5645769	誰がやったかとなぜやったかの
4708.3475	5.7000	overt	4708.3800	5650017	伝統的な構想いよいよミステリー小説の世界一見てきたな
4723.2875	8.1300	overt	4723.3200	5667945	ただこれも香織さんを完全に容疑から外せる僕の視点からならば真相は大体見えるのだ
4734.6575	5.1600	overt	4734.6900	5681589	要は前提が間違っているだから僕が供すべきことも決まっている
4745.8475	16.4100	overt	4745.8800	5695017	手帳を取り出して迷うことなくオルベーヨシツグの名前を書き枕元にしまったそれと同時にとがノックされるはっきりと検知をしたこのタイミングで訪問者すでに一同死にかけているのにどうするか顔を見て決めることにした
4763.9675	8.1300	overt	4764.0000	5716761	覗き穴を覗こうとしてそんなしゃれたものはこのコマードの小屋の戸にはついていないことに気づくしかしながら
4772.6075	12.7200	overt	4772.6400	5727129	粗い作りの土には乾燥によるものか縮んだ板の合わせ目に隙間が生じていたそこから薄暗い外を除くちえみ再びとが叩かれ念のため聞いた
4835.5475	13.7400	overt	4835.5800	5802657	当たり前だが千恵美もまた僕の知らない情報をまだまだ持っていたハルちゃんが宴を買いまみたしかしそれだと読み耳の宇宙を見て生還したということになる今のところ切れの安水から出る術はない
4849.2875	13.7400	overt	4849.3200	5819145	入ることができるかはともかく入れば出られないと考えるのが自然普通に考えれば彼女は休みずに巡りついてなどいない
4863.0275	13.7400	overt	4863.0600	5835633	たどり着けずとも霧の中で何かをかいま見たとしたらそれを見たトラウマやあるいはあるいは表現されたといった事情で彼女は何か常人ならざるものを宿すようになった
4880.0375	12.0900	overt	4880.0700	5856045	彼女が会員に迫る手がかりだとすればすでに今回は手遅れかもしれないもちろんそうでないかもしれないが見つけるべき情報はまだ大量にありそうだしそもそもそも知っている
4892.1275	12.0900	overt	4892.1600	5870553	もちななければ戻らないはずだし何より僕は人であるみんなを救うと決めたのだからそれを最後まで目指すのだ無論それには彼女も含まれる
4932.7775	1.3500	overt	4932.8100	5919333	外したかな
4949.3075	4.1700	overt	4949.3400	5939169	これは愛情の告白じゃないSOSあるいはシノコンガンだ
4961.3075	16.5150	overt	4961.3400	5953569	結局彼女は安水を捨てた人間部屋は空いていてもすでに安水の暮らしのサイクルにはなじめなくなっていたし思考や思想も外れてしまっていたしかしきっと街の暮らしも順風満帆というわけじゃなかったのだろう
4977.8225	16.5150	overt	4977.8550	5973387	時に一末の希望を国家に見いだして里帰りをしたというところだろうか望むものは得られず暇と気まずさを持て余し甘つさいこんな事態に巻き込まれたその苦のおたるやイカばかりと思う
4996.7675	4.2300	overt	4996.8000	5996121	だから彼女は僕に最初から親しくしてくれたのか
5006.6675	1.9500	overt	5006.7000	6008001	その心にはずっと
5011.8575	3.8400	overt	5011.8900	6014229	居場所もないむなしさ空虚さがあったのだろう
5022.2375	4.1700	overt	5022.2700	6026685	だが今回僕はその思いに応えることはできない
5027.6075	2.4300	overt	5027.6400	6033129	彼女にも答えてしまったから
5043.7175	10.1100	overt	5043.7500	6052461	開けたってよかったしかしそれは間違ったメッセージを伝えてしまうぬか喜びは大きな絶望を与えるだから僕は塔を開けなかった開けられなかった
5064.1175	10.9200	overt	5064.1500	6076941	この後に及んで甘く見ていたのだろうか添い遂げることを諦めた相手の役に立ちたいなど無双家かゲゼン車の
5075.5475	19.7100	overt	5075.5800	6090657	破局の時は本場の別れの覚悟で迎えようでもそれは物理的に別れることができる時に限った話だ僕が唯一の逃げ場だったかもしれない彼女はこの霧の中もうどこにも逃げられない
5096.1275	4.8300	overt	5096.1600	6115353	僕を避難することで遠回しに自分を攻撃することしかできない
5101.7375	1.0500	overt	5101.7700	6122085	そして
5104.3475	15.7500	overt	5104.3800	6125217	その行き着く先はどう転んだって前向きなものにはなり得ないのだ最悪このまま彼女はまた霧の向こうに消えてしまうかもしれないそれをいかんとも死がたい男女の問題として片付けてしまえるのか僕は
5121.1775	1.7100	overt	5121.2100	6145413	口を開いた時だった
5124.1475	1.4400	overt	5124.1800	6148977	美香子さんの声
5167.4075	7.6500	overt	5167.4400	6200889	結局彼女はリカコさんを傷つけたいのではなかった傷つけたいのは鉄道手すび自分だ
5175.8375	4.5600	overt	5175.8700	6211005	彼女を傷つける材料しか持たない僕が何言えるだろうか
5208.0875	2.9100	overt	5208.1200	6249705	よすがに取り付く手も足も
5248.3175	4.2600	overt	5248.3500	6297981	そうだなそれが僕の取るべき最善の道だろう
5275.2875	3.9900	overt	5275.3200	6330345	正しくり返したのかも分からない
5280.4475	5.2200	overt	5280.4800	6336537	ただ僕が本気で不愉快な話をする気だということは伝わったのだろう
5287.3775	4.3500	overt	5287.4100	6344853	正式なり別の先送りが引き下がる条件
5293.0475	3.5700	overt	5293.0800	6351657	軽い足音はすぐに遠ざかり消えていった
5322.1175	5.1600	overt	5322.1500	6386541	どこか分別的なニュアンスについてもっと疑問を持っておくべきだった
5328.0275	6.3600	overt	5328.0600	6393633	上松家は文字通り藤吉村において夜を支配する家だったのだろう
5334.8975	12.5700	overt	5334.9300	6401877	夜にまつわる日ごとを全て扱う家それは夜晩や夜越しの弔いだけではなく夜に行われる男女
5347.4675	12.5700	overt	5347.5000	6416961	つまりは藤吉村という狭い社会における性的なサービスの担い手ということ加えて通したるりか子さんですらそういう
5364.0275	10.3500	overt	5364.0600	6436833	場での立ち振る舞いについて心得ていたということをおそらくは上松家の女性は皆そういった役割を担っていたと考えるべきだろうさらに踏み込むならば
5376.9875	8.1900	overt	5377.0200	6452385	病毒やら気軽やらを引き取るという行為は肌合わせる行為と密接に関わっていると容易に想像できる
5387.0675	12.7800	overt	5387.1000	6464481	日本古来の技術思想については詳しくないが中国では確か防虫術とか言って明確に衛生と健康を関連づける知識体系があった
5401.5275	6.4500	overt	5401.5600	6481833	まあそういうのがなくても人体の仕組みを考えれば悪い正規を出すみたいなロジックは
5409.1475	1.8900	overt	5409.1800	6490977	容易に成立している
5415.2375	5.9700	overt	5415.2700	6498285	獲物の殻の中身を紹介器で溶かして吸うことで
5422.2875	3.8100	overt	5422.3200	6506745	捕食するこの辺りもイメージと合致する
5434.2575	12.9900	overt	5434.2900	6521109	加えてジョログモという種の存在同盟の妖怪のなめまかし物語も多数あったはず西洋では後輩後にメスが襲を捕食する雲を
5447.7875	1.5300	overt	5447.8200	6537345	ウィドウと
5454.5675	5.4900	overt	5454.6000	6545481	小したゴケグも致命毒を有する種だ
5460.7475	8.7600	overt	5460.7800	6552897	不気味でありながら優雅でセクシーな外見巣を張り獲物を絡めとる独特な習性
5470.5275	3.1500	overt	5470.5600	6564633	ロクと消化液で接触する生態
5475.3275	10.0500	overt	5475.3600	6570393	もろもろの要素から雲を毒腐にあるいは妖艶な女性になぞらえる感性はには普遍性があるのかもしれない
5487.2075	1.7400	overt	5487.2400	6584649	僕はそのことを
