onset	duration	trial_type	wav_onset	sample	value
8313.8675	6.2700	overt	8313.9000	9976641	彼女が銃を扱えることは知っていたがまさか自前でそれを用意してくるとは思わなかった
8320.8575	6.1800	overt	8320.8900	9985029	あの時見えない神様に怯いつつも自分を置いて逃げるよう僕に言った彼女が
8328.5675	13.9350	overt	8328.6000	9994281	かなわの思いと承知しながら僕に気持ちを打ち明けてくれた彼女がまさかこの場でに自由を持ち込んでこの場全員を道連れにしようとするとまではああ思わなかった
8342.5025	13.9350	overt	8342.5350	10011003	彼女のことをろくに疑っていなかった者も動けない動けたのは結局瞬発力と判断力に優れた彼と誰も信じないと言っていた彼だけで
8357.5475	2.6100	overt	8357.5800	10029057	最初の銃声が響いた時
8360.6675	6.7500	overt	8360.7000	10032801	下座に向かって巻き散らされた三段を遮ったのは匠さんの体だった
8368.4075	1.1100	overt	8368.4400	10042089	香りに
8370.5075	4.6200	overt	8370.5400	10044609	崩れゆくくず折れゆく
8377.1675	4.7700	overt	8377.2000	10052601	彼の体の向こう彼女が浮かべるのは毛だものの笑い
8399.5175	5.9400	overt	8399.5500	10079421	殴りかかった肝臓死のラムが崩れる崩れるように倒れる
8415.5975	1.8000	overt	8415.6300	10098717	ちょっとリセクション
8419.9475	1.3800	overt	8419.9800	10103937	これに挑戦
8425.0775	1.2600	overt	8425.1100	10110093	ごめん
8430.4175	4.3200	overt	8430.4500	10116501	ごめんなさい
8436.5675	4.9800	overt	8436.6000	10123881	殴りかかった肝臓腫の顔面が吹く飛ぶ
8442.5975	6.7800	overt	8442.6300	10131117	飛散し交差するニ人分の血縁の向こう彼が巡らすのは猛金の目
8450.2475	8.4300	overt	8450.2800	10140297	次にチエミの銃が向けられたのが飛びかかろうとする義継ぐくんで同じく狙った近持を変身師の肝臓さんが
8459.6975	4.6200	overt	8459.7300	10151637	したたかに殴りつけたそこまでを呆然と見送った僕は
8470.0175	3.6600	overt	8470.0500	10164021	その声を聞いた気がした気がして
8474.2175	17.3700	overt	8474.2500	10169061	鈍化した世界から志向が覚めたそれは清之助氏も同時だったのだろう目があってその直後僕はすぐ隣のリカコさんと名子の手を彼は同じく隣の安永君の肩を取って第サンの重生の結果を見届けることなく出口に向かって駆け出した
8497.0175	19.3050	overt	8497.0500	10196421	下座の僕らの方が出口に近い敷居をまたぐ瞬間再びの銃声振り返る余裕はない手をひくりか子さんが転びくぐもった悲鳴を上げるが車線から逃れる必要からほとんど彼を引きずる形になってしまう追いついた清野助氏がそれを
8516.3225	19.3050	overt	8516.3550	10219587	それを目にして血相をかいて安永君の手を引きつつ開いた手で僕の肩をついたそこで無言の同意が形成されたと思う物言わぬまま彼は梨香子さんの手を取り直し僕は覆られた安永君の手を取る
8536.4375	1.6800	overt	8536.4700	10243725	どうして
8543.5475	11.6100	overt	8543.5800	10252257	しかし僕に彼女の手を引く資格はないという思いを引きずったまま思い切り走ることはできなかったのかもしれない清之助は迷わず彼女を
8555.1575	11.6100	overt	8555.1900	10266189	そこに習うべき姿を見た僕は迷子を小脇に抱えいまだ呆然実質の状態の安永君の手を引いて駆け出した
8568.3575	14.2800	overt	8568.3900	10282029	気のせいだろうかいつになく霧が濃いように思われるおそらくは走っているから視界の悪さがより危険なものとして感じられるからだそれでも砂利道をたどり坂の上へと走る
8585.4575	5.4600	overt	8585.4900	10302549	しばらく進んだところではっきりした声でそう言われ僕は手を離した
8597.3075	14.7900	overt	8597.3400	10316769	急に横出から漏らされた笑い声に縮み上がりそうになるのを必死にこらえ身を落とす同時に銃声はっきりと空気が飛来物に咲かれる感覚を頭皮で感じる
8613.7475	13.8900	overt	8613.7800	10336497	ここで初めてメイコが泣きだし僕はその手を左手でふさぎながら駆け出さざるを得なかった安永君が追ってくることを期待したが足音は追ってこなかった彼は説得をしようとしたのだろう
8629.9175	4.7700	overt	8629.9500	10355901	その短いやりとりと続く銃声は妙にはっきりと聞こえた
8636.0075	2.4000	overt	8636.0400	10363209	今回はここまでしかいけないのか
8641.1975	11.4000	overt	8641.2300	10369437	重火器がほぼ存在しない日本の社会においてその威力については課題にも過小にも評価され実感が湧かないというのが正直なところしかしこの霧でほとんど
8652.5975	11.4000	overt	8652.6300	10383117	どんど視界が利かず不意打ちの出禁断をもらう可能性がある状況で嫌というほど実感する銃は一撃必殺となり得る恐ろしい道具だと
8666.0075	2.5200	overt	8666.0400	10399209	山脇大山の家まで宿れた
8669.1275	1.8900	overt	8669.1600	10402953	までたどり着いた
8671.8575	7.8900	overt	8671.8900	10406229	僕は建物の陰に潜みやり過ごしを試みている僕の息が上がったことと道
8680.9475	2.4000	overt	8680.9800	10417137	中を整理する必要があったためだ
8684.9375	1.8600	overt	8684.9700	10421925	このまま坂を上がれば
8687.7275	2.8800	overt	8687.7600	10425273	崩落現場を経由して
8693.2175	4.1700	overt	8693.2500	10431861	猪里屋敷には最短距離だが本当にそれでいいのか
8710.2575	1.5000	overt	8710.2900	10452309	チャンスいる
8716.1675	1.8300	overt	8716.2000	10459401	どういうことですか
8740.5875	4.1700	overt	8740.6200	10488705	僕は高い
8759.6075	3.2700	overt	8759.6400	10511529	唯一の熱心声で言いながら
8766.8675	7.9200	overt	8766.9000	10520241	施錠されていない玄関と開く気配さっきのは全力で走ったのに追いつかれたのだ
8775.8375	10.2000	overt	8775.8700	10531005	彼女の検客と土地勘をもってすれば容易に先回りをされてしまうだろう迷子は必死に悲鳴を押し殺し続けているもう少し我慢してくれ
8797.8575	2.7000	overt	8797.8900	10557429	家に踏み込む気配を感じて
8816.4575	6.9600	overt	8816.4900	10579749	ゴ秒数え僕は忍び足で家屋から離れる追ってくる気配はない
8833.7375	4.2000	overt	8833.7700	10600485	気持ちいい
8844.9875	1.1100	overt	8845.0200	10613985	この間助けてください
8847.4175	1.2900	overt	8847.4500	10616901	覚えた時の勝ち
8849.2475	1.0800	overt	8849.2800	10619097	どう
8852.0975	1.6800	overt	8852.1300	10622517	手が入れます
