onset	duration	trial_type	wav_onset	sample	value
4698.8167	2.7900	overt	4698.7200	5638580	私は知らない本当ですか
4702.4167	2.4600	overt	4702.3200	5642900	先生何か隠していませんか
4705.9867	3.5700	overt	4705.8900	5647184	それってロク名簿の入手元と関係ありますよね
4710.3967	3.1200	overt	4710.3000	5652476	ロク名簿は
4715.1967	2.5800	overt	4715.1000	5658236	本当はどうやって手に入れたんですか
4719.0367	2.4900	overt	4718.9400	5662844	実は一刻を争っているんです
4741.8367	4.2000	overt	4741.7400	5690204	早くしないと大惨事になるんです何どういうことだ
4746.6967	5.7000	overt	4746.6000	5696036	今回の呪いを使って今日の日没に大虐殺をするという予告があるんです
4754.5867	8.0700	overt	4754.4900	5705504	その予告をしたのがニジュー年前に根島事件という事件を起こした犯人でなんだとそんな大変なことに
4763.2267	5.4000	overt	4763.1300	5715872	何百人という市民が辞祖で犠牲になる事態はさすがに見過ごせないです
4769.9467	4.1400	overt	4769.8500	5723936	阻止するためにできることがあったら何でもしておきたいんですが
4775.1667	3.3300	overt	4775.0700	5730200	先生お願いです知ってることを教えてください
4782.0367	6.6900	overt	4781.9400	5738444	すまんが本当に知らん実はこの六名簿はある女にもらったものなのだが女
4811.2267	2.7000	overt	4811.1300	5773472	いや声が女っぽかっただけで
4826.3167	2.4900	overt	4826.2200	5791580	実際に姿を見たわけじゃない
4831.5367	10.2000	overt	4831.4400	5797844	イチか月ほど前夜中に調査をしていると突然何の姿もないのに女の声が聞こえたのだ女の女性の声
4842.3667	4.9200	overt	4842.2700	5810840	いわくよみがえりの秘術について記された古文書を託す
4847.8867	4.2900	overt	4847.7900	5817464	今からイチか月間でできるだけこの術の噂を広めろと
4853.7067	1.7400	overt	4853.6100	5824448	そして気がつくと
4866.8167	2.5200	overt	4866.7200	5840180	足元に古い書物が落ちていた
4870.9567	1.1700	overt	4870.8600	5845148	イチか月
4872.6967	5.8800	overt	4872.6000	5847236	機関も指定してそうすればこの小文書は好きに研究に使っていいと言われて
4879.6567	4.2900	overt	4879.5600	5855588	真偽を確かめたい衝動もあり私は引き受けてしまった
4884.9067	3.7500	overt	4884.8100	5861888	それ以後その声は全く音沙汰なく今に至る
4891.8067	4.2900	overt	4891.7100	5870168	噂を広めさせたのは呪いの力を広めるためだろうね
4897.1467	8.5200	overt	4897.0500	5876576	平術を求める気持ちと呪いを結びつけるためのって考えるとやっぱりその声の主が黒幕
4911.7867	3.0300	overt	4911.6900	5894144	そして俺はロク名簿を公表したわけだが
4916.9767	3.2700	overt	4916.8800	5900372	すぐに被白やオカルト雑誌が食いついて
4921.5067	1.1700	overt	4921.4100	5905808	くれたのは
4923.7567	2.3100	overt	4923.6600	5908508	金銭的にも運が良かったな
4926.7867	8.1000	overt	4926.6900	5912144	飛白非白石鹸ですかああそれは関係ないぞ私個人の話だからな
4941.5767	7.3500	overt	4941.4800	5929892	その後きっとイチか月経てば何かあるのだろうと私なりにいくつか予想して待ち構えていた
4949.7367	4.0500	overt	4949.6400	5939684	そしたら今回の呪いが発生して
4955.4967	2.4600	overt	4955.4000	5946596	発動していたのだ
4971.8167	3.9000	overt	4971.7200	5966180	だから私はこれ以上の詳しいことは何も知らない
4982.8267	4.4100	overt	4982.7300	5979392	分かったここまで話したのだから特別にもう一つ教えてやろう
4988.2567	2.5200	overt	4988.1600	5985908	ありがとうございます何でしょうか
4991.7667	2.0700	overt	4991.6700	5990120	セーマンのロク名簿だが
4994.4667	3.8100	overt	4994.3700	5993360	実はその続編ともいえるもう一冊ロク名簿
4999.5667	4.3800	overt	4999.4700	5999480	陰の書が存在するらしい
5008.7767	1.5300	overt	5008.6800	6010532	続編
5043.6667	6.7200	overt	5043.5700	6052400	実は六名簿の巻末にはね後からかけ足されたような追記分があってな
5052.4567	10.5450	overt	5052.3600	6062948	それによれば本序事変の型がつきその惨状を嘆いた青万自身がこの悲劇が呪いとなった時のために用意した補足の書をこの書
5063.0017	10.5450	overt	5062.9050	6075602	この書とともに残すと本序事変の関係者が樹営となって再婚集めに使われてしまう可能性を予測していたようだ
5074.6267	12.6000	overt	5074.5300	6089552	よみがえりの秘術をめぐってトラブルが起こった場合の対処法などが書き記されているという対処法
5092.5367	3.7500	overt	5092.4400	6111044	いやいやいや待ってくださいそれはおかしくないですか
5097.6067	4.2900	overt	5097.5100	6117128	なんだ坂崎私の情報にケチをつけるのか
5107.9267	8.2800	overt	5107.8300	6129512	本序事変で生まんが死んでるならばそんな続編なんて書けるわけがないですお前は本当に分かってないな
5118.6067	1.8300	overt	5118.5100	6142328	私が間違ってるの
5121.3067	7.7100	overt	5121.2100	6145568	聖マンが持っていたのは何の術だったか忘れたのかそれはもちろんよみがえりの秘術ああ
5129.5867	1.9500	overt	5129.4900	6155504	まさか正門自身が
5140.2667	6.6000	overt	5140.1700	6168320	よみがえりの秘術は先に発動しておけば細根が集まった時に発動するようにできる
5154.6667	1.5000	overt	5154.5700	6185600	セーマン自ら
5157.1267	5.1300	overt	5157.0300	6188552	事態の後に秘術でよみがえったという可能性もありえなくはあるまい
5165.7367	4.4100	overt	5165.6400	6198884	でもよみがえりの秘術を使うには呪いで再婚を集めないと
5170.8967	3.9300	overt	5170.8000	6205076	だから死んでるのだろう生まん以外にハチ人も
5199.5767	3.5400	overt	5199.4800	6239492	じゃあ本庄樹片の死者って再婚のための
5203.9567	8.4600	overt	5203.8600	6244748	それって今の状況とそれを明記するために恨みの記憶を集めたいのだああなるほど
5233.0567	13.8300	overt	5232.9600	6279668	とにかく影の書はロク名簿とワンセットで残されることになったはずがロク名簿を受け取った際影の書はなく通記されたこの情報しか残されていなかった
5247.4267	13.8900	overt	5247.3300	6296912	どうやら青万の血を継ぐ者が代々受け継いで守り続けていくうちに長い歴史の中で血糖が細かく選ばれし別々になって居場所がわからなくなってしまったようだ
5277.4267	4.2900	overt	5277.3300	6332912	セーマンに松江が今もその血が流れているの
5282.2567	4.1100	overt	5282.1600	6338708	実はできるだけ追跡して調べてみたのだが
5286.8767	5.7300	overt	5286.7800	6344252	もともと音明寺の本流ではないので厳密な家系として残されてはいなかった
5295.7567	6.6000	overt	5295.6600	6354908	おそらく現代では訳も分からず残されている古文書みたいな存在だろうな
5302.9567	5.7600	overt	5302.8600	6363548	当事者に自覚がないならばそれを見つけ出すのは困難を極める
5309.5867	1.8900	overt	5309.4900	6371504	影の書についても
5312.4067	5.0100	overt	5312.3100	6374888	謎の声の主に聞けるのなら私が聞いてみたいよ
5338.1767	2.7000	overt	5338.0800	6405812	そうなんですねつまり
5342.3767	3.9900	overt	5342.2800	6410852	六名簿影の書には聖満自身が残した
5349.9367	8.0700	overt	5349.8400	6419924	秘術や呪いへの対処法が書かれているとああそうだずっと探しているが全く手がかりなしだ
5363.7067	1.3800	overt	5363.6100	6436448	だからお前たち
5365.8067	9.1500	overt	5365.7100	6438968	もし恨みの記憶や影の書の手がかりを見つけたなら私に報告してくれたまえこれだけ教えたのだから当然の義務だろう
5375.5267	3.6300	overt	5375.4300	6450632	今私から言えることは本当にもうこれで終わりだ
5384.4067	2.0700	overt	5384.3100	6461288	なるほど分かりました
5389.6867	3.1500	overt	5389.5900	6467624	いろいろとありがとうございました助かります
5393.4367	7.4100	overt	5393.3400	6472124	有益な情報を持ってこれたら成績についても多少は配慮してやってもよいぞ
5426.2567	9.7500	overt	5426.1600	6511508	いろいろ収穫あったねえっとつまり江戸時代にもよみがえりの秘術をめぐった呪い合いの惨事があって
5440.2067	11.2200	overt	5440.1100	6528248	その対処法を記した六名簿影の書ってやつに有意気な情報が書かれているかもしれないとそういうことかな
5451.4267	11.2200	overt	5451.3300	6541712	この書斎を見つければ今回の事態を回収収収する方法が分かるかもしれないでも新石先生でも手がかりなしなんだよねどうやって探せばいいのか
5463.3067	3.3300	overt	5463.2100	6555968	きっと今回の事態に関係している誰
5467.5067	3.0900	overt	5467.4100	6561008	かがからつながるんじゃないかと思う
5478.4567	5.9100	overt	5478.3600	6574148	七不思議の呪いを呼び起こした黒幕とも関係していると思うしなるほど
5489.5267	6.2700	overt	5489.4300	6587432	えっとミオちゃんこれからだけどどうするそうだねまずは今の情報
5496.9367	2.8800	overt	5496.8400	6596324	辻警部に共有しておきたいかな
5501.2867	8.5800	overt	5501.1900	6601544	六名簿影の書の話とか大きな手がかりも得られたしもしかしたらつづみさんなら心当たりがあるかもしれないし
5511.0367	5.4300	overt	5510.9400	6613244	じゃあ学校に戻るそうだねそこが今の連絡拠点だから
5520.6067	1.6500	overt	5520.5100	6624728	新井先生ね
5523.0667	3.2400	overt	5522.9700	6627680	六名簿を渡したという声の主が
5526.9067	4.1100	overt	5526.8100	6632288	多分今回の呪いを呼び起こした黒幕なんだろうね
5531.8867	3.1800	overt	5531.7900	6638264	そうだね女性っぽかったって言ってたけど
5535.7867	1.3200	overt	5535.6900	6642944	黒幕か
5538.0067	1.9800	overt	5537.9100	6645608	やっぱ怖い人なのかな
5542.5667	2.0400	overt	5542.4700	6651080	いつものやっちゃんなら
5548.4167	3.9600	overt	5548.3200	6658100	だったらその黒幕を取っ捕まえて吐かせりゃいいか
5553.3967	3.3600	overt	5553.3000	6664076	とか言いそうだけどねあれそう
5558.0767	4.5000	overt	5557.9800	6669692	さすがに今はそんなに元気でもないからかな
5567.9167	1.8600	overt	5567.8200	6681500	そういえばミオちゃん
5570.7667	1.3800	overt	5570.6700	6684920	この辺りさ
5573.9167	1.3200	overt	5573.8200	6688700	近くだよね
5575.9267	1.6800	overt	5575.8300	6691112	シュライスさんの
5578.1767	3.1500	overt	5578.0800	6693812	道代ちゃんの現場に
5582.0167	5.5500	overt	5581.9200	6698420	私毎日花を気に着てたからもう植えられたケンカは
5588.4367	6.6600	overt	5588.3400	6706124	片付けられちゃってるけどそうだねいつまでもその気持ちを思い出してつらいよね
5595.8467	9.5700	overt	5595.7500	6715016	あそうだやっこちゃんん何おとといかな私をこっくりさんに誘った日もこの現場に来てた
5610.0067	4.3800	overt	5609.9100	6732008	朝学校行く前に花を供えに来たけど
5615.1367	1.1400	overt	5615.0400	6738164	どうして
5617.2967	2.9100	overt	5617.2000	6740756	その日は何か変わったことなかった
5624.1067	1.3500	overt	5624.0100	6748928	どうしたの急に
5626.4767	1.0800	overt	5626.3800	6751772	ああでも
5628.7567	4.4100	overt	5628.6600	6754508	あの日は突然ちょっとだけ見舞いがして少し倒れちゃった日かな
5636.6467	5.8500	overt	5636.5500	6763976	すぐに気がついたから立ちくらみかなって思って気にしてなかったけどそっか
5643.7267	1.4700	overt	5643.6300	6772472	だよ自分
5646.4867	1.7400	overt	5646.3900	6775784	ありがとう
5681.9467	3.6300	overt	5681.8500	6818336	黒幕の女性と関係してるか分からないけど
5686.2667	8.3100	overt	5686.1700	6823520	セーマンと対立してたっていう御名寺の女性も気になるよねちょっとそこの君たちは
5697.7867	8.4000	overt	5697.6900	6837344	失礼するよ立ち聞きするつもりはなかったが気になる単語が聞こえてきたものでね
5706.8767	1.8600	overt	5706.7800	6848252	どちら様でしょう
5709.3667	2.5800	overt	5709.2700	6851240	僕はなむきゆうたろう
5713.1467	1.6500	overt	5713.0500	6855776	いや君たちには
5718.0367	5.5800	overt	5717.9400	6861644	昨日まで貸主だったものと言った方がいいかなえ貸主
5725.0567	6.5700	overt	5724.9600	6870068	おっとそんなに身構えなくていい足洗い屋敷の樹草玉を全て手放している
5733.3367	1.6800	overt	5733.2400	6880004	足洗い屋敷
5735.5267	2.7000	overt	5735.4300	6882632	じゃあ堤警部が言っていた人
5738.7667	8.5800	overt	5738.6700	6886520	おつづみ警部を知っているのかいだったら話は早いだろう安心してくれあいつ
5748.2167	4.6800	overt	5748.1200	6897860	運転席やっこちゃんあはいあれ
5754.0367	2.1900	overt	5753.9400	6904844	私今何かしてた
5758.1467	1.5000	overt	5758.0500	6909776	あああの
5760.3067	2.7600	overt	5760.2100	6912368	ナムキさんはどういったご用件でしょうか
5768.8567	9.3000	overt	5768.7600	6922628	実は君たちに相談したいことがあるもし時間があるならちょっと来てもらえないか相談私たちに
5779.2667	9.0900	overt	5779.1700	6935120	白石道夫の話をしていただろうそれに関する話だよ多分君たちにとっても悪い話じゃないと思うよ
5789.1967	9.2700	overt	5789.1000	6947036	今時間がないなら後でもいい僕は両国橋付近で待っているからなんか怪しいけど白石さんだってどうしようか
5840.8267	4.4700	overt	5840.7300	7008992	じゃあせっかくなので波磨きさんの話を伺います
5846.6167	1.9500	overt	5846.5200	7015940	そうかいありがとう
5858.7967	1.8300	overt	5858.7000	7030556	じゃあ少し移動しようか
5889.6967	2.7900	overt	5889.6000	7067636	それで私たちに相談というのは
5895.7567	2.5800	overt	5895.6600	7074908	ああそうだね何と言えばいいか
5898.9367	1.5600	overt	5898.8400	7078724	率直に言うと
5924.2567	5.3100	overt	5924.1600	7109108	君たちの呪詛玉で白石道をよみがえらせてほしいんだ
5930.0767	11.3850	overt	5929.9800	7116092	そもそも僕がよみがえりの秘術を求めたのもその願いを叶えるためだったんだが志半ばねして磯玉を手放さざざるを得なくなってしまってね
5941.4617	11.3850	overt	5941.3650	7129754	そしたら君たちも白石道夫と縁のあるか走り主だったようだから渡りに船とばかりにこうしてお願いしようと思ったんだ
5953.5967	13.7400	overt	5953.5000	7144316	えっとごめんなさいちょっと唐突すぎてよくわからないですダメガキさんは白石さんと関係のある方なんでしょうかああ彼女とはちょっとした縁があってね
5967.3367	13.7400	overt	5967.2400	7160804	そうなんですねえっと白石さんはよみがえらせたいのは山々なんですが白石さんをよみがえらせたいのは山々なんですけど
5986.2967	1.5900	overt	5986.2000	7183556	私たちはすでに
5989.8667	3.7500	overt	5989.7700	7187840	よみがえりの秘術を使うことは諦めていて
5998.9267	2.1600	overt	5998.8300	7198712	でも目的が同じなら
6002.9467	4.8600	overt	6002.8500	7203536	重曹を譲ってもらって僕が代わりに細根を集めてもいいけど
6010.2067	1.7700	overt	6010.1100	7212248	それもお断りします
6013.5967	4.6800	overt	6013.5000	7216316	私たちの目的はこの呪いを沈めることなので
6019.8967	7.2600	overt	6019.8000	7223876	なるほど分かったよ残念だがじそ玉は諦めよう分かってくれましたかありがとうございます
6035.7967	3.6600	overt	6035.7000	7242956	なんだか怪しかったけどおとなしく帰ってくれたね
6042.5767	1.8000	overt	6042.4800	7251092	でもどうして白石さんを
6046.3867	1.6200	overt	6046.2900	7255664	あれやっこちゃん
6049.2367	3.0900	overt	6049.1400	7259084	やばい話してる間にどっかに
6074.8567	1.9200	overt	6074.7600	7289828	フフ追いついたぞ
6077.4067	8.7900	overt	6077.3100	7292888	君が僕が君を追っていたのを知ってか知らずかわざこんな人のいない場所へ誘い込むとはいい度胸だね
6087.3667	5.7900	overt	6087.2700	7304840	悪いけどそのジュソ玉力ずくでもこちらに渡してもらうよ
6105.7567	1.3200	overt	6105.6600	7326908	なぜお前が
6110.2867	3.2100	overt	6110.1900	7332344	出たまた出たバカなどうして
6115.9867	3.4500	overt	6115.8900	7339184	ああ待てあれは事故なんだ
6120.9067	2.4600	overt	6120.8100	7345088	本当だわざとじゃない
6124.9267	3.6000	overt	6124.8300	7349912	だから僕もよみがえらせようとしていて
6138.2167	1.0500	overt	6138.1200	7365860	遅い
6192.9367	2.2200	overt	6192.8400	7431524	この後ねじま
6196.9567	1.2900	overt	6196.8600	7436348	クミン
6199.7467	1.0200	overt	6199.6500	7439696	覚えれない
6209.2267	10.3800	overt	6209.1300	7451072	根島文地下の樹素による大漁獲殺が実行され世間は未曾有の惨事に見舞われた
6221.4367	5.9400	overt	6221.3400	7465724	そして以後坂崎悪子の姿を見た者は一人もいなかったという
6233.2567	1.9200	overt	6233.1600	7479908	白石道代の
6254.7367	1.3800	overt	6254.6400	7505684	温州
6263.3167	1.1700	overt	6263.2200	7515980	うんうん
6318.4567	1.2900	overt	6318.3600	7582148	ごめんなさい
6328.0867	10.6500	overt	6327.9900	7593704	ごめんなさい用がありますので私たちは失礼させてもらいますそうかならば仕方ないね急ぎではないから後で両国橋に来てくれよ
6367.3867	2.1600	overt	6367.2900	7640864	続いてのニュースです
6371.4367	8.3400	overt	6371.3400	7645724	本日昼ごろ墨田区の白石敏子さんの自宅で新たに男性の遺体が発見されました
6381.8767	7.9200	overt	6381.7800	7658252	遺体は白石さんと内営の関係にあった無職岩井菊池郎さんとみられ
6391.8367	18.7800	overt	6391.7400	7670204	警察は本序地区を中心に発生している一連の連続開始事件と関連があるとみて調査を進めていますまた現場からは岩井市が昨年の男児誘拐殺害事件に関わっていたとされる証拠品も出てきており
6416.1067	1.2000	overt	6416.0100	7699328	さてマダム
6418.2367	8.9700	overt	6418.1400	7701884	迷宮売りしていた誘拐事件については人だらなくついたということでこれからの話をしようかそうね
6435.0067	13.5000	overt	6434.9100	7722008	公式発表があったということは岩井の手記の内容は真実性が高かったようだね誘拐犯もその共犯の少女も死んでいるがあとは警察が処理してくれるはずだ
6449.2267	12.0600	overt	6449.1300	7739072	割ってみればお粗末な事件あの式がなければわからなかったのね悪事がばれる時なんてそんなものだよ油断だ
6461.8567	3.2400	overt	6461.7600	7754228	しかし根島事件などもそうだったが
6466.4167	4.1100	overt	6466.3200	7759700	こんなふうに運良く発覚した事件に触れると
6471.6967	8.9100	overt	6471.6000	7766036	その裏でどれだけ発覚していない事件があるかわからなくてずっとするねそうね怖い話
6485.2267	3.6900	overt	6485.1300	7782272	では誘拐事件は完了で
6499.2667	8.8200	overt	6499.1700	7799120	僕らの目的としてはよみがえりの秘術に注力ってことでよろしいかなお願い
6515.5867	3.7200	overt	6515.4900	7818704	じゃあ呪いの状況を確認しよう
6520.7467	5.1000	overt	6520.6500	7824896	まさか呪いの対処で警察がしっかり動いていることは想定外だったけども
6527.4067	4.2900	overt	6527.3100	7832888	最も事情が情報が集まっているであろう
6533.7067	4.4700	overt	6533.6100	7840448	ツズメケーブと情報交換できたのは大きかったね
6538.8667	18.8700	overt	6538.7700	7846640	だいぶ貸し主たちの状況が分かった私が貸し主だということは気づかれてないのよね医療だけなら気づかれないと思うがあの警部はちょっと油断できないんだら回収されるだろうから今後も注意しておこうそうね
6559.2067	12.1200	overt	6559.1100	7871048	重曹を奪うにしても貸し主主であるということが必要かもしれないので行き続きマダムには重曽玉を持っていてもらいたいけどいいかな
6572.0767	2.1300	overt	6571.9800	7886492	もちろん塩は使わずに
6579.7267	18.6000	overt	6579.6300	7895672	話によると貸し主はあとサン人がまだ所在不明置いてけぼりおくり提灯津軽の太鼓のサンつだこれらのゆかりの場所にはまだ何度か足を運んでみてもいいかもしれない
6598.3267	18.6000	overt	6598.2300	7917992	そもそも黒幕の関係可能性も高いわけだがあの弓岡という男僕らの知らない飼い主を把握していたりするのだろうか弓岡のことは見張っておいてもいいかもしれないな張り込むの
6616.9267	18.6000	overt	6616.8300	7940312	こんな時他の調査スタッフがいてくれればいいのにいればいいのにくそ本当に一人でやってるんだゼロサイの厳しいところだねレー歳優秀なアシスタントは常時募集中だ
6638.2567	2.9400	overt	6638.1600	7965908	そして根島踏み地下も貸し主らしい
6642.0067	1.9500	overt	6641.9100	7970408	片葉の足だったか
6644.7367	12.3900	overt	6644.6400	7973684	再婚を集める可能性でいったら最も高いだろう今日の夕暮になったら大量に樹巣を使うっていうとはいえあの警部が本当に白石道から情報を手に入れたら
6665.0467	3.8400	overt	6664.9500	7998056	それより先に身柄を確保してしまう可能性もあるがね
6671.6767	3.5100	overt	6671.5800	8006012	でもどうして警部に隠れ家のことを教えたの
6675.7567	2.4000	overt	6675.6600	8010908	宗教を見れば分かる情報だよ
6679.0267	4.5600	overt	6678.9300	8014832	それにさすがに大量殺人と言われたら止めればなるまいよ
6685.3867	2.2500	overt	6685.2900	8022464	何人でも同じことでしょう
6688.2967	6.2400	overt	6688.2000	8025956	危険もそうなのでねただね島と警察の動向は注視しておこう
6701.4967	12.6900	overt	6701.4000	8041796	あの娘は唐のあやめとかいう実は貸し主である可能性もあるのではそうだねあの後誰かからじゅう玉を奪い取っていれば可能性はあるそれもあるけど
6716.1367	7.6200	overt	6716.0400	8059364	まだ確認できていない津軽の太鼓のゆかりの地は緑町公園の辺りでしょう
6724.5067	3.0900	overt	6724.4100	8069408	確かに彼女の住むアパートの近くだね
6728.2567	8.8500	overt	6728.1600	8073908	実はもともと貸し主だったという可能性はあるねだとしたら飛んだくわせ物だ探しておきたいところだね
6739.9567	4.5900	overt	6739.8600	8087948	怪しいなそんなところか誰かと会えればいいのだけど
6749.4967	3.0000	overt	6749.4000	8099396	なんだいあのああそうだ
6753.0067	10.7400	overt	6752.9100	8103608	ついででいいのだがちょっと寄りたいところがあるんだけどいいかい個人的な要件ですまないねちょっと駄菓子屋まで構わないけど
6771.0667	6.1200	overt	6770.9700	8125280	では行動開始といこうかこのパートはこれ以後調査を終えるコマンドを選ぶことで
6778.8367	5.6100	overt	6778.7400	8134604	いつでも終了できますそのまま次にも進みますこのパートを途中から再開する
6904.1167	3.6600	overt	6904.0200	8284940	ああああああああ
