onset	duration	trial_type	wav_onset	sample	value
1.8770	1.9800	listening	1.6020	2252	世界一の金持ちになった
4.3730	1.8200	listening	4.0980	5248	それで十分じゃないんでしょうか
8.5650	5.5320	listening	8.2900	10278	ニセンキュー年になりぎこちなくはあるが法的な和解がようやく成立した
14.7730	13.7240	listening	14.4980	17728	内容はこれ以上相手を非難しないまた今後はこのニ人とさらにはJBストラウベルマークターペニングイアンライトもテスラの共同創業者と呼ぶだ
29.4290	5.5320	listening	29.1540	35315	また当初の約束通りロードスターがイチ台エバーハードに届けられた
36.0210	6.5880	listening	35.7460	43225	マスクもエバーハードも最もらしい声明を出したがもちろんニ人とも本心などではない
43.9250	6.8440	listening	43.6500	52710	避難しないことと定められているにもかかわらずマスクは何か月かに一度は怒りを吹き上げている
51.4130	2.3640	listening	51.1380	61696	自分で自分が抑えられないのだ
54.8050	3.4200	listening	54.5300	65766	ニセンジューキュー年には次のようにツイートしている
59.8290	4.0600	listening	59.5540	71795	テスラはエバーハードなどものともせず今なお生きている
64.4050	6.6200	listening	64.1300	77286	だが彼はそれは自分の功績だと言い続けているしそれをまた認めてやるアホーがいる
72.6290	1.2760	listening	72.3540	87155	翌年も続いた
74.8050	4.7000	listening	74.5300	89766	彼は一緒に仕事をした中で文字通り最低最悪の人物だ
80.9810	3.5160	listening	80.7060	97177	ニセンニジューイチ年末になってもまだ収まらない
85.7490	4.5720	listening	85.4740	102899	エバーハードの語るテスラ創業の歴史がまやかしであることは明らかだ
90.9650	2.5560	listening	90.6900	109158	彼に会わなければどんなに良かったことか
95.7650	2.6520	listening	95.4900	114918	マイケルマークスとクソ野郎問題
100.5650	6.4280	listening	100.2900	120678	マスクもそろそろCEOと権力を分け合うタイプではないと自覚していい頃なのだが
107.5090	3.7720	listening	107.2340	129011	まだテスラCEOとなることには消極的だった
112.3730	5.5000	listening	112.0980	134848	このジューロク年後には大会社ゴ社のトップに自ら就任するのだが
118.3890	6.8120	listening	118.1140	142067	ニセンナナ年のこの頃はほとんどのCEOがそうであるように一社に集中すべきだ
125.9730	4.0280	listening	125.6980	151168	彼の場合はスペースXに集中すべきだと考えていた
130.9010	6.2680	listening	130.6260	157081	だからテスラに投資してくれているマイケルマークスに暫定CEOをお願いした
138.8370	18.4280	listening	138.5620	166604	マークスは電子機器の受託生産を主とするフレクストロニクスのCEOとして製造工程の様々な段階についてエンドツーエンドで抑えマスクが好きな垂直統合を推進して会社を業界リーダーにまで育て上げた人物だ
158.5810	4.1240	listening	158.3060	190297	マークスとマスクニ人の関係はいい感じでスタートした
163.7010	7.5160	listening	163.4260	196441	マスクは世界的な金持ちのくせに知り合いのカウチに寝泊まりさせてもらうのが好きないわゆるカウチサーファーで
171.9250	5.2120	listening	171.6500	206310	この頃はシリコンバレーを訪れるとマークスの家によく止めてもらっていた
179.0290	2.6200	listening	178.7540	214835	ワインを飲みながら雑談を良くしました
182.2610	1.6920	listening	181.9860	218713	マークスも語ってくれた
185.0130	6.2040	listening	184.7380	222016	だがそのうちマークスは自分なりの経営をしていいのだと大きな誤解をしてしまう
192.0210	2.6200	listening	191.7460	230425	マスクの願いを叶えるのではなく
196.3410	13.1160	listening	196.0660	235609	最初に衝突が起きたのは現実無視のスケジュールをマスクが押し付けるものだから車の組み立てはめども立っていないのに部品は発注も支払いも済んでいることにマークスが気づいた時だ
210.8690	2.5880	listening	210.5940	253043	材料が運び込まれているのはなぜなんだ
214.5810	3.8680	listening	214.3060	257497	就任間もない頃の会議でマークスはこう尋ねた
219.7330	3.6440	listening	219.4580	263680	イチ月出荷開始だとイーロンが言い続けているからです
224.8210	4.1240	listening	224.5460	269785	部品を大量に在庫していたらお金がいくらあっても足らない
229.6210	2.4920	listening	229.3460	275545	マークスは注文の大半をキャンセルした
233.4610	3.6760	listening	233.1860	280153	マスクの人当たりの悪さもマークスは何とかしようとした
237.8770	8.4120	listening	237.6020	285452	マークス自身は愛想のいいタイプで掃除係から経営幹部まで誰に対しても礼儀正しく丁寧に接する
247.6690	4.4760	listening	247.3940	297203	イーロンは性格があれで柔らかな人あしらいができないんですよね
253.5570	6.9720	listening	253.2820	304268	こういうマークスはマスクが妻ジャスティンの小説をほとんど読んでいないと知って目を向いたという
261.4610	2.8440	listening	261.1860	313753	礼儀うんぬというだけの問題ではない
264.8850	2.9400	listening	264.6100	317862	問題に気づくのが遅れてしまう恐れもある
269.1730	5.5960	listening	268.8980	323008	そうやって脅し上げていると誰も本当のことを言ってくれなくなるぞと忠告しました
275.3490	3.9960	listening	275.0740	330419	どこぞのガキ大賞かというくらい素暴になったりしますからね
281.3010	4.2520	listening	281.0260	337561	ああいう行動に走るのは頭の配線の具合によるもの
286.1010	7.5800	listening	285.8260	343321	つまり生まれながらの性格と本人の弁によるとアスペルガー症候群であることからで仕方がないのか
294.4530	2.6200	listening	294.1780	353344	マークスはいまだに判断しかねているそうだ
298.3890	5.7880	listening	298.1140	358067	個人の感情よりミッションを優先する会社の経営にはその方がいいのだろうか
305.8130	7.9320	listening	305.5380	366976	自閉スペクトラム症であることは間違いなくて他の人々とつながることが本当にできないのだろうとは思います
315.7970	4.7640	listening	315.5220	378956	今の逆をすれば弱いリーダーにしかならないとマスクは言いを唱えた
321.5890	7.2280	listening	321.3140	385907	みんなの友達になろうとすれば組織全体の成功より目の前にいる人の感情に配慮することになる
329.6210	4.3160	listening	329.3460	395545	そんなことをすれば最終的に傷つく人が増えてしまうと
335.6370	3.0360	listening	335.3620	402764	マイケルマークスは首を切れないタイプなんですよ
339.5410	1.0840	listening	339.2660	407449	とマスクは言う
341.4290	1.6280	listening	341.1540	409715	だからこう言ってやりました
343.6370	6.5880	listening	343.3620	412364	ちゃんとやれと言ってちゃんとしないやつに何もしないのであればちゃんとやれという意味がないと
351.9570	1.9160	listening	351.6820	422348	戦略の違いも浮上した
354.5170	6.6840	listening	354.2420	425420	ロードスターの組み立てはノウハウを持つ自動車メーカーと提携して進めるべきだとマークスは考えた
362.1330	4.8600	listening	361.8580	434560	これはマスクの本能的ともいえる望みと両極端ほども違う
368.0850	6.3960	listening	367.8100	441702	原材料を入れると反対側から完成者が出てくるギガファクトリーをマスクは夢見ていた
376.4370	7.8680	listening	376.1620	451724	ロードスターの組み立てを外部に委託するというマークス提案の検討でマスクはイラつき怒りを膨らませていく
385.2050	4.0600	listening	384.9300	462246	この怒りを外に出さないフィルターをマスクは持っていない
390.9330	2.7800	listening	390.6580	469120	これほどアホな話は聞いたことがないぞ
395.5730	2.5240	listening	395.2980	474688	ここまで行った会議も何回かあったそうだ
398.9010	3.2280	listening	398.6260	478681	これはスティーブジョブズがよく使った言葉である
402.9010	2.4280	listening	402.6260	483481	ビルゲイツもジェフベゾスも
406.3890	2.7800	listening	406.1140	487667	歯に着ぬ着せぬもの言いで勘に触る
409.8450	3.6760	listening	409.5700	491814	こういう言い方では誠実な対話など望むべくもない
414.7730	10.8120	listening	414.4980	497728	だがジョブズが言うAクラスプレイヤーのチームを作りたいときなんとなくしか考えられない人にいてほしくないと思う人を集めたいときには有効だ
426.9650	5.3720	listening	426.6900	512358	マークスは実績も自尊心もありすぎてマスクの言動が我慢ならなかった
433.8130	3.4840	listening	433.5380	520576	子供のように扱われましたからさすがにね
437.9730	5.5320	listening	437.6980	525568	私の方が年上でしたしニヒャクゴジュー億ドル企業を経営してきたわけですし
444.9810	3.0360	listening	444.7060	533977	マークスはほどなくテスラを去ることになる
449.3330	7.3240	listening	449.0580	539200	生産工程の全てを掌握すべきとしたマスクの考えは正しかったとマークスも今は考えている
457.5570	5.0200	listening	457.2820	549068	だがマスクの本質に対する疑問にはまだ答えが出せずにいる
463.5090	4.6040	listening	463.2340	556211	必ずオールインしてしまう気象だからあそこまで成功したわけだが
468.6290	5.8200	listening	468.3540	562355	あのひどい言動は全てその気象から来るものなのか関係ないのかだ
476.2450	3.3560	listening	475.9700	571494	マスクはスティーブジョブズと同じタイプだと思っているんです
480.1810	2.3960	listening	479.9060	576217	とにかくクソな奴はいるものだと
483.3490	6.1080	listening	483.0740	580019	ところがニ人ともすごい成果を上げていますでつい考えてしまうわけです
490.3570	4.1560	listening	490.0820	588428	もしかしてあの性格と成果はセットなのかと
496.1490	4.1560	listening	495.8740	595379	セットであればマスクの言動は許されるのかと突っ込んでみた
501.8770	7.7720	listening	501.6020	602252	これほどの業績に対して世界が払わなければならない対価がクソ野郎でなければ達成できないなのであれば
510.5810	4.7960	listening	510.3060	612697	そうですね多分それだけの価値はあると言えるのではないでしょうか
516.1170	2.2680	listening	515.8420	619340	私はそう思うようになりました
520.0530	3.0680	listening	519.7780	624064	ちょっと考えて一言追加が出てきた
524.3730	3.3880	listening	524.0980	629248	でも私自身がああなりたいとは思いませんね
529.7810	4.2840	listening	529.5060	635737	マークスの後任にマスクが選んだのはジードローリである
534.9650	10.9400	listening	534.6900	641958	イスラエル空挺部隊の士官からアントレプレナーに転じ半導体ビジネスで成功した人物で我慢強いはずだと思ったのが採用のポイントだという
547.5410	5.5960	listening	547.2660	657049	何も恐れない人でなければテスラCEOへの就任など承諾してくれません
553.7810	2.5560	listening	553.5060	664537	恐れるべきことがたくさんありますからね
557.9410	3.9000	listening	557.6660	669529	だがドローリは車の生産について素人だった
562.7410	9.0840	listening	562.4660	675289	わずか数か月で彼がトップでは仕事にならないとJBストラウベルを先頭に経営幹部が泣きを入れる事態になってしまう
572.9810	7.2600	listening	572.7060	687577	これを受けマスク自身がCEOになるよう取締役のアイダエーレンプレイスが説得に走った
581.5890	2.9720	listening	581.3140	697907	私が両手でハンドルを持たなければならない
585.1730	2.3640	listening	584.8980	702208	ニ人で運転することはできないんだ
589.0130	3.0680	listening	588.7380	706816	マスクがこう宣言しドローリは辞任
592.7250	6.1400	listening	592.4500	711270	こうしてマスクはニセンハチ年ジュー月正式にテスラCEOとなった
600.0530	2.7160	listening	599.7780	720064	イチ年でヨン人目のCEOである
605.3970	1.6600	listening	605.1220	726476	第ニジューロク章
609.3010	1.0840	listening	609.0260	731161	ニセンハチ年
612.7890	6.7160	listening	612.5140	735347	長男ネバダを亡くした後ジャスティンとイーロンはなるべく早く次の子供を作ろうと考えた
620.3730	6.4280	listening	620.0980	744448	対外受精のクリニックに通いニセンヨン年グリフィンとゼイビアの双子を設ける
627.4770	6.2040	listening	627.2020	752972	そしてニ年後にも対外受精によりカイサクソンダミアンの蜜語を得る
635.0290	11.2920	listening	634.7540	762035	結婚した時はシリコンバレーの小さなアパートでルームメイトサン人とトイレトレーニングのできていないミニチュアダックスフンとイチ匹と同居だったとジャスティンは言う
647.1570	8.1880	listening	646.8820	776588	それが今はロサンゼルスの高級住宅街ベルエアの丘に立つロッピャク平方メートルの大邸宅で
655.9250	4.9560	listening	655.6500	787110	おバカな男の子ゴ人に子どもの世話や家事をしてもらうスタッフゴ人
661.4930	6.1400	listening	661.2180	793792	結局トイレトレーニングのできていないミニチュアダックスフンとイチ匹と一緒に暮らしているわけだ
669.3650	6.9400	listening	669.0900	803238	夫婦ニ人とも気分が乱高下するタイプなのだがそれでも甘い時間を過ごすことはあった
677.3330	7.2280	listening	677.0580	812800	互いの腰に手を回してパロアルト近くのケプラー書店まで歩き買った本をカフェで読んだりしたのだ
685.9730	3.9960	listening	685.6980	823168	この話をすると今でも胸がいっぱいになってしまいます
690.7090	1.2120	listening	690.4340	828851	とジャスティンは言う
692.8530	4.9560	listening	692.5780	831424	ただひたすらに満たされていた時間があったんですそうひたすらに
699.7970	7.9000	listening	699.5220	839756	マスクは人と交わるのを苦手としているがセレブも来るようなパーティーは好きで明け方まで居残ることも多かった
709.0130	5.9800	listening	708.7380	850816	ハリウッドの一流ナイトクラブで開かれるフォーマルなドレスコードの資金調達パーティーに行き
715.5410	5.2760	listening	715.2660	858649	パリスヒルトンやレオナルドディカプリオと一緒にメインテーブルに座ったりしていました
721.6210	1.2440	listening	721.3460	865945	とジャスティンは言う
724.1490	8.0280	listening	723.8740	868979	Googleの共同創業者ラリーペイジはリチャードブランソンがカリブ海に持つ島で結婚式を挙げたのですが
732.7250	2.1080	listening	732.4500	879270	あの結婚式にも劣席しました
735.7970	6.0760	listening	735.5220	882956	ジョンキューザックも来ていましたしボノもファンの女性に囲まれてポーズを撮ったりしていました
743.6370	2.1080	listening	743.3620	892364	だがケンカも多かった
746.6130	4.5080	listening	746.3380	895936	マスクは嵐とストレスの人でその暴風に巻き込まれる格好だ
752.0530	6.5240	listening	751.7780	902464	あなたなんか大嫌いとジャスティンが言えば社員だったら首にするなとマスクが押収する
759.1570	2.0760	listening	758.8820	910988	そんな大言歌も少なくなかった
762.1010	3.5480	listening	761.8260	914521	マスクはバカだまぬけだとこきおろすこともあった
766.2610	1.5640	listening	765.9860	919513	父親そっくりである
769.3330	4.9880	listening	769.0580	923200	エロールに会って分かりましたああいう言葉は父親から学んだんだって
775.9890	9.6600	listening	775.7140	931187	キンバルは昔よく兄ととっくみ合いのケンカをしていたわけだがその兄が技師と口喧嘩をしている様は見るに忍びなかったという
787.2210	4.9560	listening	786.9460	944665	イーロンのケンカはすごく激しいんですでもジャスティンも負けていません
792.8210	4.2200	listening	792.5460	951385	横で見ていると思うんです勘弁してくれひどすぎるよって
797.9090	3.5800	listening	797.6340	957491	そんなわけでしばらく兄とは距離を置いてしまいました
804.5970	4.8280	listening	804.3220	965516	どうにも不安定な生き様でニ人の関係はどんどん悪化していく
810.7410	2.1080	listening	810.4660	972889	とにかく全部がぐっちゃぐちゃでした
813.3970	1.2120	listening	813.1220	976076	とジャスティンは言う
815.6050	5.7560	listening	815.3300	978726	自分は単なるトロフィーワイフだそういう身分に追い込まれたとも感じたそうだ
822.3570	1.7240	listening	822.0820	986828	そんなの向いてないのに
825.5890	8.9560	listening	825.3140	990707	髪をもっときれいな金髪に染めろプラチナブロンドにしろというのを断りジャスティンはだんだんと身を引き気気味になっていった
836.4690	3.9960	listening	836.1940	1003763	私が出会った頃の彼はほとんど何も持っていませんでした
841.2370	3.8360	listening	840.9620	1009484	その後の富と名声で関係がすっかり変わってしまいました
846.7410	6.5240	listening	846.4660	1016089	職場でもそうなのだがマスクは目からあんそしてまた命へと一瞬で変化する
854.0690	7.3240	listening	853.7940	1024883	ひどい言葉を投げつけてきたかと思うと表情が和らいで笑顔に変化ししょうもない冗談を言う
862.8370	3.1320	listening	862.5620	1035404	意思も力もクマかと思うほど強いんです
867.1890	4.0280	listening	866.9140	1040627	エスクアイア氏のトムジュノーにジャスティンはこう語っている
872.5970	2.6840	listening	872.3220	1047116	楽しく陽気にはしゃぎ回ることもあります
875.7970	2.5880	listening	875.5220	1050956	でもやっぱりクマはクマなんですよ
880.1810	4.9240	listening	879.9060	1056217	マスクは課題に集中するとゾーンに入り全く反応しなくなる
885.6850	2.1080	listening	885.4100	1062822	小学生の頃からずっとそうだ
888.6290	3.6440	listening	888.3540	1066355	夫婦の関係がおかしくなっていったニセンハチ年の頃
892.9490	5.8520	listening	892.6740	1071539	スペースXもテスラも不運の連続だった話をしたらジャスティンは泣き出してしまった
900.1170	2.3640	listening	899.8420	1080140	そんな話してくれませんでした
903.1250	3.6120	listening	902.8500	1083750	多分話した方がいいなど思いもしなかったのでしょう
907.6690	2.4280	listening	907.3940	1089203	世界とそんなに戦っていたんですね
910.6450	2.1720	listening	910.3700	1092774	そう言ってくれさえすればよかったのに
914.6130	4.0600	listening	914.3380	1097536	一番耐えられなかったのは共感がなかった点だという
920.1810	6.4600	listening	919.9060	1104217	いろんな意味ですごい人なんですよでも共感してくれないのでどうしても戸惑ってしまうんです
928.5010	6.3000	listening	928.2260	1114201	ドライブに出かけた時本物の教官とはどういうものなのかを説明しようとしたこともある
935.7010	10.1400	listening	935.4260	1122841	マスクはそれは大脳の問題だ自分はアスペルガーがあるので意識的に努力して心理面のアンテナを張るようにしていると公弁した
947.0290	6.5880	listening	946.7540	1136435	そうじゃないの相手のことを考えるとか分析するとか読むとかそういう話じゃないの
954.1970	2.6840	listening	953.9220	1145036	感じることなの相手を感じるの
958.5810	3.5800	listening	958.3060	1150297	それが人間関係で大事なのであろうことは分かる
962.9650	1.1800	listening	962.6900	1155558	マスクも認めた
964.8850	9.4680	listening	964.6100	1157862	だが同時に大きな成果を上げる会社の経営では自分の頭の配線が有利なのだといまいち納得していない感じでもあった
976.3730	5.8200	listening	976.0980	1171648	意思が強く感情的に距離があるのが夫としては付き合いづらかったわけですが
982.8050	4.9240	listening	982.5300	1179366	あんな風だから事業経営で成功したというのはあるのかもしれません
989.9730	4.8600	listening	989.6980	1187968	心理療法を進めたがイーロンはイラつくばかりで受信しなかった
995.5410	6.5560	listening	995.2660	1194649	ジャスティンの方はネバダをなくした少し後から通い強く興味を惹かれるようになっていた
1003.0930	10.1400	listening	1002.8180	1203712	心理療法のおかげでマスクが感情をシャットダウンするのは子ども時代のつらい体験と脳の配線具合からなのだと理解することもできた
1014.1010	2.7480	listening	1013.8260	1216921	親密な感情を抱きにくいことも
1018.3890	8.6360	listening	1018.1140	1222067	脳の配線が彼のような人や問題の多い育ち方をした人の場合親しさではなく激しさに流れてしまうのです
1028.7570	2.1400	listening	1028.4820	1234508	必ずしもそうとは限らない
1031.5730	4.2520	listening	1031.2980	1237888	子どもに対してはマスクも感情的なつながりを強く求める
1036.5330	3.3240	listening	1036.2580	1243840	そもそも誰かそばにいてほしいタイプなのだ
1040.5010	2.1400	listening	1040.2260	1248601	それこそ昔の恋人でもいい
1043.2850	6.5240	listening	1043.0100	1251942	ただ日々の暮らしに親しさが欠けていてその分激しいというのは間違いないだろう
1051.5730	5.5320	listening	1051.2980	1261888	結婚生活に対する不満からジャスティンは落ち込み怒りっぽくなっていった
1058.2930	4.4120	listening	1058.0180	1269952	気分が上下していたのがだんだんと怒ってばかりになりました
1063.6690	1.2440	listening	1063.3940	1276403	といい論は言う
1065.8450	7.7080	listening	1065.5700	1279014	精神科医が処方した認知機能改善薬アデロールのせいだと家の中を探し回っては捨てたそうだ
1074.4530	4.9240	listening	1074.1780	1289344	あの頃は落ち込んでいたしアデロールに頼ってもいたとジャスティンも言う
1081.1730	9.4360	listening	1080.8980	1297408	注意血管障害だと診断されアデロールがすごくよく聞いたのも事実ですでも私が怒っていた理由は別にあります
1091.3170	4.3800	listening	1091.0420	1309580	怒っていたのはイーロンが私のことを締め出してしまったからです
1097.9090	5.7240	listening	1097.6340	1317491	ロケット爆発が続きテスラもしっちゃかめっちゃかだったニセンハチ年の春
1104.2770	8.1240	listening	1104.0020	1325132	ジャスティンは車の事故に遭いその後は涙をためて膝を抱えベッドの上にずっといるようになってしまう
1113.4930	4.2520	listening	1113.2180	1336192	ニ人の関係を変えなければならないとジャスティンは訴えたという
1119.4130	3.4200	listening	1119.1380	1343296	何百万ドルもの賞のような人生を送る夫
