onset	duration	trial_type	wav_onset	sample	value
2653.8825	11.9550	overt	2653.9650	3184659	分の学習の特徴追加学習の改造性の特徴性のある学習性の代表の特徴性である脳には追加学習性があると言っている我々には学習によって記憶を作るその記憶を持たによっていく
2666.5875	8.9700	overt	2666.6700	3199905	入ってくる情報が強いと思うで受け取られる時情報が向上して記憶が書き換えられる現在の記憶をベースに入力情報によって記憶が書き換えられるので記憶に改造成ができる
2676.6075	17.1600	overt	2676.6900	3211929	記憶活躍するとも一気が高くなるが教育そのままだけしてきれないつまり我なのは一度は一度神経回路と表現した小育の活性化値観とともに位置が高くなるが神経回路表現その場合は一気が高くなるが神経回路表現そのものを信じないということでどんな気温度ものはどうなるかもしれない
2693.7675	17.1600	overt	2693.8500	3232521	脳の意識下に先代的に留まってたくないことが難しくないという通常の地域的では見出せないほどにしていないということでレッタしたカナダのフェイロドという名前のペイロットという名前の音響の張りを刺すもちろん穴を開ける痛みたみや感覚がないということが言われている
2711.7675	13.8150	overt	2711.8500	3254121	電気をかけない状態つまり覚醒からその人と会話しない事件が行わせない事件が行わせない時計を流すとソクトヨの一部が保安して活動するとすると自分でも全く忘れていた記憶が目の前にあり得てくるようになる
2725.5825	13.8150	overt	2725.6650	3270699	電極を通電して通電された人は昔お母さんとパン屋に行って買い物を行っている風景が見えすと話し始めるそんなことはもうニジュー年間にサンジュー年前記憶だので自分にはもう忘れたと思っているので本人もびっくりしてしまうさらに通電して
2739.9075	7.0200	overt	2739.9900	3287889	そのパイヤさんの周りのチェッチョを質問するとパイヤさんの前にライオンの像があります
2747.4675	19.1400	overt	2747.5500	3296961	脳の反応の形をしましたというように非常に調査に一瞬に説明すると思った過去の記憶が厳密に蓄まられているので脳の治療が検出すると行動観察上はその記憶が時間整えていくように見えるが脳の神経改良としたら決心機にも示されている
2769.7275	7.8300	overt	2769.8100	3323673	起演説までの間に強い刺激として受け取って長記憶として一度成立したものは全滅な契約として潜在感に創造され
2778.0675	13.1550	overt	2778.1500	3333681	それら通常の意識の知ったでは取り出されないので時間とともに忘れてしまったと思っていた機能の中に膨大な治療域の記憶があるしたがって記憶は普段意識上にほとんどなく意識的に取れ出せると思ってもいったのに脳はすべてが記憶であるから
2791.2225	13.1550	overt	2791.3050	3349467	その表現が意識のレベルとすると自分で意識してない記憶の方が圧倒的に圧倒的に多くのもありSチの上下にあるワーキングメモリであるワーキングによっても海面下にある潜在宿は強い刺激によって回生かされることもあり
2805.1575	4.1100	overt	2805.2400	3366189	また現在のワーキングメモル作る人として使われたため現在の脳の個性を決定しているのである
2810.7975	16.9200	overt	2810.8800	3372957	脳が学習によるメモリベースアキューターであるということが脳の個々の特性ならの国の特性能を作り外部世界から情報を引いた情報を引いたストリーガーであるということであるのであることは我々が自分が自分が生えていた外部世界の情報であるということであることは我々が自分が経験しているもの
2827.7175	16.9200	overt	2827.8000	3393261	自分が経験していないことには今まで自分が経験したことをもとにに何とか対処することをもとに何とか対処することができないしかして外部世界が同じだとしても人は生まれ育った形の経験がそれぞれの経験がすることなのである外部世界からの情報に対することなのである
2845.4475	12.3900	overt	2845.5300	3414537	科学がなく客観戦を第一にして自然原子を観察しきゅうように努力してきたしかし自然原子の観察の当事者である我々の情報の処理の仕方が本来の情報の処理をする必要があるかと思われます
2858.4375	10.4400	overt	2858.5200	3430125	したがって我ら方の人と情報よく通じ合うと経験を共有することに本質的に必要とすることに本質的に資料となる人たちは生まれない人とは根本的に分かれないのである
2869.4775	19.0700	overt	2869.5600	3443373	例えば外部世界が現在同じだったものの内部の世界から引き出せるものが違ってしまうからでも多く世界の人は同じ経験の人に生まれ育ってくるから多い姉妹姉妹だってもあり得ないともありえないで互い親父ともあり得ない人は関係の人間が分かり合えばしい動物なんだるだけどもありえないだけどもらしい動物だったらない
2888.5475	19.0700	overt	2888.6300	3466257	我に言われると言葉この脳の情報を特徴的に表しているものと表しているところにはコップがあるとなると認知するのでそう思えば実際するなら経験が調整するなら経験がちょうでは経験によってあると認知する認知神経路が能の中であると記録している時かこの記念なことによっている
2907.6175	19.0700	overt	2907.7000	3489141	確信が先回して認知系を活性化することが必要とされるとなると確信しないとはあると認識できないように脳内回路を働かないということであるしかし経験しないことは分から分からないということもよく覚えていくべきであるこの例かも理解されるように外部情報が異なるのである
2927.8875	3.0600	overt	2927.9700	3513465	終わりにのは全ての記憶は全てで
2931.6375	12.1500	overt	2931.7200	3517965	それは学習経験のそのタイプが決まるので我々の外科医を客観的に認識することは決める難しい自然科学についてその立場が本質的に考え直す必要がある
2943.7875	12.1500	overt	2943.8700	3532545	人から分かってもらわないと言ってもらえない動物でも使えないと生きることは難しいのでここでは無駄なかったのが分かっての情報を積極的に用いるコンピューターでもある
2956.5675	13.3800	overt	2956.6500	3547881	科学とは従来客観戦という存知をするために価値と一環の強い問題がつかないあるいはさすでに避けてきたとかいえる脳がメモリーベースアキュースティクチャー型のコンピューターが数年現象に救出するというのは既にしてきた
2969.9475	13.3800	overt	2970.0300	3563937	さらに能は価値を情報処理の中で積極的に持ちいるコンピューターであるいはまさに驚きだろきゃ情報通信の分野で先駆的な業績があるいの貢献を持たないと話している
2986.0275	1.3200	overt	2986.1100	3583233	ジョクチンのサイズンです
2987.9775	4.3500	overt	2988.0600	3585573	本論の一番目安西日本の条件の現状が今後濃厚ついて混参することだよ
2993.4975	13.1400	overt	2993.5800	3592197	僕メイティングの中心をヒャク年余りの近年の記憶を研究をした過去に現在までの動画をまとめてみたい科学的研究研究の始まりセンハッピャクハチジューゴ年を無意味見通りを記憶材料として自家に行動するように表した
3007.1475	15.0300	overt	3007.2300	3608577	記憶材料として有意味な物語などを使用した実験を行い早期とはスキーマによる最高性課程であると考えたその後記憶近畿はデジタルと心理学の影響を受け止める手法則が記憶にも適用された例えばレストロ福岡などがある
3026.9775	5.3400	overt	3027.0600	3632373	ネットワークモドル意味記憶研究の始まりそれぞれの枠組みホカトモドルに対してさせて
3033.3975	2.4300	overt	3033.4800	3640077	処理過程を出しした考え方を提唱した
3036.5775	15.0600	overt	3036.6600	3643893	このジュー年後ニつの記憶に続き記憶分からない複数記憶は分からないと複数記憶のシステムの転換してより本聴的な規模な問題を作ることができるようになった実験室的研究の不明性が解かる
3064.1175	18.3600	overt	3064.2000	3676941	センキューヒャクサンジューニ年記憶材料として有味な物語の試験を行いそうきた隙間による最高性化であると考えたこの頃記憶経編の影響で受け小読芸能力が記憶にも提供された例えばレストロフ効果などがある
3082.9875	2.7300	overt	3083.0700	3699585	動物事件から道整備された法則性を人間に適応している
3086.2275	10.7700	overt	3086.3100	3703473	センキューヒャクハチジューロク年最初の情報処理モデルニ年近く目に乗ったし人間の情報処理をナナプランに移動したものであるその後ブロードベントや
3097.9575	3.2100	overt	3098.0400	3717549	ノーマンジューキューマンロクセンナナヒャクキュージューメダルが提唱された
3101.8575	2.9700	overt	3101.9400	3722229	情報的処理的アプローチに最初の概論書
3105.6075	16.1250	overt	3105.6900	3726729	短記憶と小規模型モデル現在も記憶型モデル原型モデル意味記憶研究の始まりでそしてのワクモデルに対して処理課程を絶した考えが提供した考えが提供した基礎局と同時刻の部分このジュー年後にニつの意味覚悟クを充している
3121.7325	16.1250	overt	3121.8150	3746079	マーキングメモリーこの概念の道理により単記の研究の問題を使える実験視的研究の問題を使われた実験室的研究の自由性が解かれた仕事的研究の立場により言語学的研究の立場により言語学習の時代には研究の問題正面から取れ上げた
3140.4675	14.6400	overt	3140.5500	3768561	その後研修の機能としてコンピューター学園の方に関係する様々なモデルや研究家が切れるとBDPなりに代表するコンピーターシミュレーションのモデルが提唱されてあるいはキュージュー年代の記憶的な現代われている
3155.6775	4.4400	overt	3155.7600	3786813	記憶品の現状発端的な把握するための最新のジャーナーの見た国際学科に参加することである
3161.0475	15.9300	overt	3161.1300	3793257	ジャーナルライニングレーニングメモリーコグニッションメモリーになる記録品というロムが消されるジャーナーのロンブスを調べてみるとフィギュアワンのようにこの約半世紀にわたる認知関係の論物数を調べてみるとフィギュアーラーニングのロンブスに増加
3178.6275	1.1400	overt	3178.7100	3814353	してることは分かる
3181.1775	6.6000	overt	3181.2600	3817413	メモナニングディブプロセプション コグネティブプロジークロジーリジングレジングリジックロジーリングリティック
3189.6375	2.6700	overt	3189.7200	3827565	会社はこのニジュー年で毎年サッカーしてる最高
3192.9075	14.3100	overt	3192.9900	3831489	この学会選挙サイティの年始大会の最低の話題を見えていたこの学会選挙区人権心理学の関係の学者が大変占めていたAPAに対抗して学位を持つ実験心理学者が設立した学会である
3211.8975	14.4750	overt	3211.9800	3854277	フェリーの項目はニジュー年までとくらびることだったり年数とも研究者の関心が変わってきたら新しい横の視点の様子が分かるフィギュアニでは右のヨン項目の研究者の関係者らどの時に冬から研究されているというものである
3226.3725	14.4750	overt	3226.4550	3871647	右下のサン項目でインプリストメモリメタメモリワイチングメモリワイチングメモリプロスメモリプロスペクティブメモリアイフィットネスメモリオートバイオロジェクカルメモリはいわゆる日常
3241.3575	2.1900	overt	3241.4400	3889629	記憶中と称される懸念盛んになってきてある
3244.4175	9.2700	overt	3244.5000	3893301	前日記憶研究の中で今日の記憶研究の特質を持てたしのサン点というのは行動会認知で両手で両手研究家日常勉強者会社会事の
3254.3175	18.4600	overt	3254.4000	3905181	まずアプローチに言えば多くの研究者が認識アプローチを基本としているというこれは心理学全体の調理でもはさまざま認知モデルの提唱メークや潜在記憶の研究に象徴される意識の検討あるいは実行機能の視点重などいえば記憶記録の健康などいえば記憲観的な気温の
3272.7775	18.4600	overt	3272.8600	3927333	原告書の時代は帯連語学習や系列学習の研究が盛られたかその当時は反応の生語の分析を中心に研究が詰められ特に不合間に焦点が当たられていたそしてその後再生再任に関する議論に見られるように研究の時代理や定員適切処理の原理で
3291.2375	18.4600	overt	3291.3200	3949485	福岡と家庭でも検索課程に同時全体に伝えたともに認知活動をより全体的に深いレベルしかも濃度的なモトとして捉えられが今日の記憶緊急の特質であるいが今日の記憶モデルの一つの例としてはフィギューマーの一つの例としてある
3310.6575	17.1000	overt	3310.7400	3972789	何作の検索の認知活動にて不合化時においてはRPS意味記録イチキュージューニニ次にすことなシステムで不合化が行われその不合化されたものはそれぞれ平率的に処同され調査したものであるとするパフォーマンスで独立したものであるとするパフォーマンスである
3327.7575	17.1000	overt	3327.8400	3993309	再生や再任テストでパフォーマンスBは一般的テストパフォーマンスDは単語感性や知覚的同点などの企画的なものであるこのようなエスピアムのに対して主義義大学的研究の知見より今のおのである
3345.7275	14.1600	overt	3345.8100	4014873	記憶に分け理識の問題について言えば例えば潜在記憶による意識的汚染の問題がかつてあったプライミング実験の問題がかつてあったプライミング実験のテスト項目を処理する際現在記憶にも働いているのかないかというものであるこの問題を解決するために
3360.3975	14.1400	overt	3360.4800	4032477	手続や家庭分離手など意識的早期と分析や基礎を受ける人気や信頼的書を抱えされその種は問題とあるものを現在もゆくりをされている近年は我が国においても急速に研究者が増えている
3374.5375	14.1400	overt	3374.6200	4049445	記憶を加え記憶プロセスの主体性や能動性を注視する土地を取っているこの業界のランバーを見るとコントロールを見るとコントロールセレクティビスウィッチングフォーカスモーカスそれが全て実効機能的要素を表しているといえよ
3388.6775	14.1400	overt	3388.7600	4066413	ワーキングメモの研究が今もますます発展することにやり超記憶も含めた記憶のフォーカス的理論あるいは記憶に整わず注意言語知庫などの認知活動全般も統合する議論の提唱そして日常記憶研究としての性の人間に迫れる
3403.6875	12.6000	overt	3403.7700	4084425	アプローチに関して今日の記憶研究の特徴です毎日する企業医療という要的研究から質的研究へという項目を挙げたが別の言葉で言えば正当から答えという研究者の注目が変化しているようにともいえる
3423.1575	19.1400	overt	3423.2400	4107789	記憶の多く色性Y極性などの記憶ネガニテムの研究そのメカニズも解滅する研究が今日では多いということだとこれは現代の記憶情報の研究フォースメモリーの研究しかしソースモニタリング東京の研究の問題も記録の研究という
3442.9275	7.7100	overt	3443.0100	4131513	特徴を特徴する一つの絵時に北米でベストすらとなったイエスルセーフサインズオブルコの勝者ではとらんすん
3451.5075	13.6500	overt	3451.5900	4141809	物忘れ注意サン万度忘れ思い知らないアンジバイアスの一つのネゴティブな記憶の記憶の記憶を最近の記憶感覚めはネガティブな否定すべきことがある人間の心の適応性があるという深刻な複雑的な感触をした
3465.1575	13.6500	overt	3465.2400	4158189	この代表研究研究の第ニは異常技科現実作界の諸問内が研究対象となってもちろん伝統的な実験体験ではもちろん伝統的な統制の提供以降この代理の特質が経済化していることは確かだよ
3495.3375	14.7450	overt	3495.4200	4194405	自然的記憶や多くの研究がきれますます発展してきている自然的記憶の分布の一つの直径であるバンプあるいは自然的記憶点用の回想想期の方法など中来の研究ですきょうでは自然的記憶の機能に関する気温までその幅を広げている
3510.0825	14.7450	overt	3510.1650	4212099	研究の保護付けとして興味ある未開拓部分の多い分野などなるだろうな海藻記録と対する記憶と対する記録として発展的展望記録の研究も共鎖館である数時間後に行うように
3525.3375	10.9350	overt	3525.4200	4230405	そんな展望記録ではなく数か月セン年後の実婚を意図するような展望記録を考えると自然的記録のつながりも出てくるだろうそのあち電的記録とも過去記憶から徐来の時世紀にかかる天保記録を持つような場合である
3536.2725	10.9350	overt	3536.3550	4243527	現実際の問題から分析するような研究は大変少ないが今後必要になってくるである現実社会の問題から生まれてきた目標証言の研究の研究は望客が記憶の変容などの記憶の発信に関わるというものでもある
3547.8975	8.4300	overt	3547.9800	4257477	また現代の考慮社会におきら老年地方者の増大は自然的に記憶障害に関する記憶も盛んにしている
3558.9375	13.9800	overt	3559.0200	4270725	以上の他日常記憶とした恋の記憶が顔や名前の記憶のあるいは感情の記憶であるいは感情の記憶であるいはどの研究も生の人間あること対象として記憶の料理人間あるいは自然晩あるいは知恵学科医学
3572.9175	13.9800	overt	3573.0000	4287501	社会信頼学種類学の多量域の多様化が必要なってくることが多いこの点も記憶信中の記憶品の質とその特質で大切な知事の特質は研究法に関することでいろな点で方法が多様化しているといろいろいろいろいろいろが多様化していると
3587.4975	5.8500	overt	3587.5800	4304997	人点検疫症が頻繁に治療されるが質問視調査面接調査自然的
3593.9175	5.7300	overt	3594.0000	4312701	そして数的データ分析で研究のほかにケーススタディの室で検品を記念がかなり増加している
3601.4475	8.3700	overt	3601.5300	4321737	今後の動向さてこれまで記憶検査の検査の研究に関する促進を述べてきた今後どんな研究が行われるか
3610.7775	15.2250	overt	3610.8600	4332933	縦軸は研究する状況がいわゆる実験室なんか実験である実験室は通された状況という意味である自験室は人工的状況という意味である本来の状況である本来の研究である本来研究である本来の研究である
3626.0025	15.2250	overt	3626.0850	4351203	方法的にそれが不可能だったり要素分析的に研究が必要な場合は実験的な場合は実験的な証を取るざらを得ないこれはニ次元上に今日の証言に入るものが最も多いである
3644.7975	12.7200	overt	3644.8800	4373757	横軸は何のために研究するかという研究目的についていた議論研究か問題解決かの別現であるいは法則や原理を探すらむ研究である人間の本質に迫る順学問である現実社会での
3658.0275	15.0900	overt	3658.1100	4389633	問題解決や社会貢献は基本的に施行してねまた逆にある特定の問題を解決するとその技術を解決するとなる研究できればいいのである実際に私たちの研究を変わるとこのような研究の中心あたらに自分の中心があることになることになる
3674.1375	12.4350	overt	3674.2200	4408965	この二次元に今日の主張研究を分離した左目の証人の入り物が入るものが最も多いだろうとそして異論の打倒性は少ないのではないだろうか
3686.5725	12.4350	overt	3686.6550	4423887	また問題解決施行の研究についてはもともと理論追求思考の研究より少ないと思うか特に実験的な研究の研究がまだまだ少ないよりよりもすなち未業の証人に入る研究を今後はさらに増やし
3702.4575	15.9900	overt	3702.5400	4442949	問題解決施行の研究は理論面で弱いところがありこれがいまいつ成果の上げない業員ともいうより考えていくことが今後一体される研究は次の通し化される理論に入る研究を及び自分的に組織化された右上の証言に入るような研究
3719.1675	1.4100	overt	3719.2500	4463001	要するに
3722.2875	11.4300	overt	3722.3700	4466745	ディロン追求思考の研究者未来解決の基本してその最初もくださいそれぞれの研究タイプの着点を克服するの研究が今後望まれるということではない人間性を追求する研究として人間の方針の
3734.3775	19.7550	overt	3734.4600	4481253	本社の解明を目的に行うことで準学問的で議論追求有型の研究方の研究である今後は監督的に何かちの社会的つながりも求められるだろうと現実際に何かちの社会的に何かちろん解決調達する研究で今後はますます発展すると考えられる
3754.1325	19.7550	overt	3754.2150	4504959	BMの進歩に伴ったその時代の特異の研究現代のコンピッターの心配それを利用した機器機械の開発は認知事な性質や人のあるいはあり方に要なく影響を予防している今後も変化し続ける時代に環境的に生きる人間に対応できるような研究が必要とされる
