onset	duration	trial_type	wav_onset	sample	value
5.8275	19.0650	overt	5.9100	6993	記憶のメカニズムと表現されると最先端の研究とイメージされるかもしれないしかし記憶研究の歴史は古い超き記憶が形成されている
24.8925	19.0650	overt	24.9750	29871	もともに抽象的にしか表現でないかものも多い今度に抽象的にしか表現でないかもしたかって記憶メガニズムの研究では文学的に描写された現象をいかに現代生物学の言葉に置き換える課題であるこの挑戦は手強いもの魅力的であるこの観点にとって本校をご覧いただきたい
44.6175	14.8200	overt	44.7000	53541	記憶の日を様々できることの連続である記憶農家身の周りの記憶である記憶の記憶でありイチ時間ほど前チーズタームを買いに行こうとホテルの向かいに行ったがドアを開き落とした瞬間不安に襲われたそういえば去年キュー月ジューイチ日このマーケットに
59.4375	14.8200	overt	59.5200	71325	入ろうとした時に携帯が鳴らせたのだったのでその時長生きがしっかりに処理込まれたんだろう具体的な増員が強いチーズターモンを買う間も同期もなかなかお皿もかった
76.4475	5.5800	overt	76.5300	91737	サッカーの新潟秀敏選手の試合をイタリアで感染した際のエピソードで
82.5675	14.7300	overt	82.6500	99081	短い文章の中で記憶とはどんなものかつっぱり記憶の音が見事に表現されている我らの記憶で互感で感じたことと感情の動きがセットになっているそのち記憶とは情景に温度のみならずその時の感情までセットにした超高性の映像であったよ
97.8975	4.5900	overt	97.9800	117477	このようなエピソード記憶を明日の中にちょうどしてまた思い出している
104.6475	4.6200	overt	104.7300	125577	記憶カイラのモデルシナプスカイロレベルの会食の種子のタイプの
109.8375	6.6000	overt	109.9200	131805	これはニューロンはスナプスを介して神経回路を構築している記憶グルタミン酸を神経伝達物質するグルタミン酸
117.1875	18.8640	overt	117.2700	140625	酸性高分線ニューローによる神経回路に保存されていると考えられているしかし記憶を行動する神経回路を構成するニューロンの活性するニューナーの活躍化の広がりすなし記憶回路の実態は明らかになっていないしかし海バナの組織細胞の実態は明らかになっていない
136.0515	18.8640	overt	136.1340	163262	この変化は分子レベルの変化の一部はほぼ共通認診に出しているこの変化は二類のクルタミン酸値様体とNM酸重体であるNPA型グルタグルタミン酸中体であるNPN型グルトミン酸値溶体はD感度依存性ナトリムサネルである
154.9155	18.8640	overt	154.9980	185899	シナプス前膜からウルタミン線が放出されシナプス硬膜膜のNMA型グルタミン酸自応体に結合するとこの重体を解しての当面に流し脱分極を誘導して活動電流を誘導して活動電流を発生させシナプス電達が完了する
173.7795	18.8640	overt	173.8620	208535	通常のシナプス伝達には起用しない脳内の神絡回路に記憶が保存されるような強い刺激が伝達される場合には例えばシナプス全膜から自動的なグルタンミン酸放出MMMMMCCMが多く的なグルタンミン酸放出
192.6435	18.8640	overt	192.7260	231172	MDA型グルタミン酸性炎が活性化されスナプス膜内にカルシウムイオン乳乳を引き起こすアルファカルシウム乳乳もカルシウムカルモジュリン依存性な気温を中心とするリン酸化高速炎が活性化するNPA型自衛体に
212.3175	2.3700	overt	212.4000	254781	のサウヨネットを電算化して伝算型
215.3175	14.9850	overt	215.4000	258381	その結果シナプスの電圧効率が高めにスナプスコール転達がより強くなる大きな脱分極が誘導するようになるこの現象が強硬を保存されるこの現象が強硬されに心経過剰的変化つなどに誘導される神経過剰的変化つなど
230.3025	14.9850	overt	230.3850	276363	ATPの時代上手したシナプス項目上のグルエアワン数の増加であると考えられている以上の記憶が保存されたにシナプステンタスクが増強率が増強されることはセンキューヒャクヨンジューキュー年ヘビによって予想された
245.8875	6.0300	overt	245.9700	295065	地域検査の柔道する神経過剰的変化を説明する基本的な概念として考えられている
253.9275	13.0500	overt	254.0100	304713	上手なバイオスライスを用いたインビトロ系ではLPは観測されるもの技術的な困難さもあり記憶が形成される際に脳内神経過割に本当にNPPが誘導されている件は驚くほど少ない
266.9775	13.0500	overt	267.0600	320373	LPPと記憶計算の重かの相関性があることは間違いないLTPは記憶計算のメカニズミという仮説は今だ証明していない記憶研究を議会するとこのポイントは非常に重要であるさらに近年記録経路を二三カレーを固定し
281.2275	10.6200	overt	281.3100	337473	記録を保持するニューロンのアルケーションを明らかにする研究も進められている具体的には初級オート遺伝子の発見を使用にして記録計算値の総記事の両方で遺伝子が
292.3575	13.6800	overt	292.4400	350829	また転車因子のシークレブ活動が高いニューロンがより記録回路に参加しやすい記録割り当てやすいのの報告もある今後これらの論文で用いられた技術を改良してきょうからなと思うなの
306.9975	1.5300	overt	307.0800	368397	もう終われる
309.0975	9.0600	overt	309.1800	370917	実験心理学的には長期的に脳に保存される長期欲は安定であると適切される一方数時間程度の短記憶や一定的に保持されないような弱い記憶は不安定であると的にされ
321.4275	17.0250	overt	321.5100	385713	このような不安定な記憶を安定な長期記録で変換するための一番プロセスがメモリコンソリデーションである記憶でこのような手記でこのような手記でこのような手記録固定化がまずはこれその結果細胞レベルの固定化がまずはその後システムレベルの固定化を得てきてきた
338.4525	17.0250	overt	338.5350	406143	この時期に当たると現在までの記憶経済の記憶解明の極みのほとんが西部レブルの固定化を対象としているというやろう細胞レブの記憶固定化細胞レブの記憶化細胞レブルの記憶化にてもっとめ確な性格的表は新規遺伝を必要とする点である
355.4775	17.0250	overt	355.5600	426573	下痢ではニソンマイシンなどのタンパク質合成損害剤を用いて脳内の遺伝子圏を阻害すると学習してから数時間程度まで短記憶には影響を与えませんもののニジュー億時間程度経過した超記憶には障害が観測される
372.5025	17.0250	overt	372.5850	447003	単記憶と超記憶の科学的成情を明確に線引きできることが明らかになった以上な遺伝子発現の必要な遺伝子発言の成長の要する上で単純かず明確に明確な明確に使用となっているではどのようなメカニズムで記憶化に移動されるのである
392.3775	16.9800	overt	392.4600	470853	長期記憶が喫製されるような場合先にイチ歳のNMD型グルタミン酸性によりカルシウムイオンでよりさらに電位存性カルシウムイオンチャンネルチャンネルから強く活性化されるカルシウム濃度上昇によるカルシウムイオン上昇によりカルシウムが強化されカル化される
409.9575	13.0800	overt	410.0400	491949	カルムジュリに依存性なきにならせが活性されカルシウムイゾン型デニルシクラーゼも活性化されCNPが賛成される
423.7575	17.9400	overt	423.8400	508509	CNPKTBに共通する標的は点車調節因子CNNCCMに出ればこれらのキナチグによってヒャクサンジューサン番目のツリン酸化合計画となる以上に比べるにくればカルシウミオとCMの情報電子の電車を活性化する以上にくればかるにくればかるいろいろな
441.6975	17.9400	overt	441.7800	530037	ヒャクキュージュー年クレブの状態に対するクレブの情勢が注目され症状場や目振らしによって記録制御に対するクレブのエルフの解析結果からクレブ上記憶欠に必要なことが高等動物にしてあることが高等動物によって明らかにされた
460.3575	2.5500	overt	460.4400	552429	を用いた解析からクレビに開始する
463.4475	12.9600	overt	463.5300	556137	転移者を阻害するとニ時間の短期欲は正常であるものニジューヨン時間の長期欲に疎外が観察されることは明らかになったこの結果はタンポク質合成剤炎症害剤によって脳内の遺伝体験を創害した場合と類似した
476.4075	12.9600	overt	476.4900	571689	クレブが記憶固定化に必要であることを示すものであった一方症状媒を用いた依然学的解析のいてもクレボが超記記憶化に必要であることが示されている
490.0575	10.3350	overt	490.1400	588069	さらに上実際に対しても誘導個性の抑制化が起点とする細胞内情報伝達成の活性化で十分であるものATPの特徴にはクレブによる遺伝者
500.3925	10.3350	overt	500.4750	600471	このように強固定化に対するクレブの重要性は高等動物以外でも明確であり強固定化に対するクロブの影響性は高等動物以外で明確であり強固定化に対策の影響がある
511.4175	16.5300	overt	511.5000	613701	クレブが新に記憶固定化の中心的制御因子であるならばクレブを活性化すればキロコティカが促進されるはずだでヒッチランのグレーブであるいは電車コーティングレーターであるいは電車コーティーブデーターであるクレブ
528.5175	16.3500	overt	528.6000	634221	バイリングプロテインと抗生的に相互作用できるクレブDMM変異体を全能領域で発言するトランスジェニックマウスを作成しこの撮影を検証した
544.8675	16.3500	overt	544.9500	653841	以上の結果からクレブス活性化による記憶を低下能力が顕著に向上することすなちクレブがセラブが性の記憶固定化によることが明らかになったクラブの性能的遺伝子として神経活性や科記憶を制御を制従する初期応等遺伝子をよび
563.7375	2.5200	overt	563.8200	676485	アイティビティレジレジへと
566.8875	18.1650	overt	566.9700	680265	クレブはコロナの遺伝子が知られているイクラブはコロナの遺伝子発電性を開始とか記憶整理しているものと考えられている興味深いことには常実さを多くレブ活性化型型変異体が発生されたフランスジェニックラインの中でもクレブの活性が特に高まっている
585.0525	18.1650	overt	585.1350	702063	サンジュー分からニ時間程度の記憶の工場も観測されこの時はトランスジェニックマウスの分削減であることが明らかになったクレブは記録固定化のみならずBNBに関与にも関与しているさらにトランスジェニックマウスの解析からこう発現したBFFは
604.2675	6.3600	overt	604.3500	725121	ポジティブフィードグループ的にクレブ活性化による効率する超記憶済の良さに講座することも示唆された
611.4075	10.2600	overt	611.4900	733689	記憶制従時にクレブを活生活するクレブキナーゼの同点も心見られてこれすれに遅延ピーア及びしカルシウム調達経路に存在するピーチ
621.6675	10.2600	overt	621.7500	746001	両社の方法で両社の中でGMKIPIPIPIPはクレブと同様に記憶固定化の性の制御因子であることがマースの遺伝学的証をお持ちいただかにされた
632.5875	17.4300	overt	632.6700	759105	ニグループのCMKIVの遺伝子マースを呼びデルミナントディ型変異型変異型変異型の感染が解析されCMKIVの不正化により気温固定化に障害が生じることが示されたさらに避難能得意が的に野生型型CMMVDを課せることが示された
650.5575	11.3700	overt	650.6400	780669	過剰発現するトランスマンジェニックマウスが作成解析され解析されるシェンシー化に影響を固定化に影響することが明らかなった一応援マースのいた彼に伝わって脳内の刺激アップ
661.9275	11.3700	overt	662.0100	794313	さらに常実さしいCMDのTGMでは彼に伴う記憶能力の低下が観察されなかったしたかってCKアマイの発言低下から彼に企業力の低下の原因になっていることも示唆されている
674.2875	15.9600	overt	674.3700	809145	遺伝子の時間軽化で固定化するわけでは無種類の場合計数直後こそはこれそれの開場機能が必要であるがサン週間ほど時間が否定されると記憶の早期間保険化に対すると記憶の必要性が失われる
695.9475	10.9650	overt	696.0300	835137	このことは記憶形成直後に会話を切除すると記憶はしながら記憶がしても記憶が影響を与えないことを示した研究性が空きらいなことを示した研究性が過ぎない
706.9125	10.9650	overt	706.9950	848295	一方でジュー種類の実験から生きずに思い出すことができることが知られていた傾向積をましょうそこでジュー種類の実験から得られた危機がこの現象を理解するので極めて重要なものとなった一方で
718.3875	4.5600	overt	718.4700	862065	記憶は警察チョコに買い場に蓄えても時間経過の問題の品質で転送されてもいる
725.9175	14.2650	overt	726.0000	871101	しかしこの仮説は少ない事実エピソード記録など五感で感じた膨大な情報で記録すれば全の情報が小されることは考えが大切な会話のみ保存される事例の仮説ではエピソード記録を構成するのは僕大な中夕方法大の真実領域に分させてちょうちよる時間限界場を
740.1825	14.2650	overt	740.2650	888219	そういう神経ネットワークにおける会場の役割が小さくなると考えられて海部と大脳の様々な動きで構成される記憶回路の中心として全てのカイロンを統合するような役割のような役割を果たしているものの
755.4375	19.5900	overt	755.5200	906525	時間経過とともに大脳肥関のつながりが強くなる会話の情勢が低くなる最終的に記憶回路は一見大脳ヒットの目高減されるようなタグというものを機能レベルの固定化が起こっている時に大脳質ニューロンにクロマチンディングモディロンが起こっていることを示し大の日ニロンロン
775.6275	15.5100	overt	775.7100	930753	が記憶回路に参入していることを示すきも発表されているとこれまでのカイバー移動に関する時期能が成長されているともする意気を生ま出することだけを示した書きすぎないので古い記憶を戻することだけを示した書きすぎないので
795.5175	16.8600	overt	795.6000	954621	またアルファカルシウムMKニのテロケストンマウスの解析から組織レベルの固定化にCHMKニの機能が必要が必要あることとさらに古くなった機能の創設が必要全必要が必ずあることが示されている
812.3775	16.8600	overt	812.4600	974853	細胞に関係申請の記憶の解剤を失わせるメカニズムの一端に一体感染された若い二人論が既存の記憶回路をモディモディングするすなち解剖依存性を失わせることによって後見するとは考えやすいモディズムである
830.3175	4.3200	overt	830.4000	996381	しかし現状ではソッチレブの記憶固定化の意義やそのメカニズムの絵を進んでいるとは言い難い
835.1475	13.3900	overt	835.2300	1002177	そしてレベルの記憶を固定化してさらに固定化を受けることで記憶は歴史的に変化するのかさらなど解決する場合はまだやまじみである記憶はアップデート機構は永久に変なものでは例えば父の人物のエピソードに我々は自分の記憶に
848.5375	13.3900	overt	848.6200	1018245	現在記憶を装置した後の記憶制御プロスティングに注目があったようなフィスはこのような総切符の記録制御の基盤の基盤になっているとかがジュー年中でこのプロストグの制御基盤の解明を従事してきた
861.9275	13.3900	overt	862.0100	1034313	BNDFが促進短期記憶速信固定化長記記憶地区記録しくれみにより電車活性化が発生し固定化自体も促進する
877.0875	5.2800	overt	877.1700	1052505	早期後の記憶制上プロシスクの解明は首都してジュー類における恐怖記憶課題を用いてきた
884.3475	17.4300	overt	884.4300	1061217	まずこの課題を簡単に紹介する恐怖的な記憶と交感で近くした状況とか関連付け記憶付け記憶付け記憶付け記憶である従って恐怖体験した状態に再び走行する場所を再放するあるいは恐怖体験時の音や匂いにせすることによって恐怖記憶が装置される
903.0975	2.4900	overt	903.1800	1083717	恐怖条件付き文脈記課題では
911.7375	8.9700	overt	911.8200	1094085	床に電線を敷いた小箱の中で軽い電流を数秒間流してマウスに電力を出してマウスに電柱におきゃくさせるその後マウスをチャンバーに戻させてき
921.3375	13.6200	overt	921.4200	1105605	マウスが恐怖記記憶を消すとやっぱり最強化側に見動き一つ取らないすくみを判の示すこの反応の長さを示すこの強さに測定して恐怖記記録の強さを評価するとこの課題では文明区が常識識的に説明するとこの課題では文明
935.4975	9.4500	overt	935.5800	1122597	マースは非常検刺激と関連付けを記憶し条件刺激の再エクスポージャーによって記憶記憶を想知する冒険
945.5475	9.5700	overt	945.6300	1134657	冒頭に起死したエピソードじゃ人気を不明記憶定よく記憶最高低下ヒャクキュージュー年代から記憶が想知された時に記憶経済を阻害するような世紀が当たると記憶が沈まれている現象がかつおく
956.6775	13.0050	overt	956.7600	1148013	そしてニセン年内であらはその説明として装置後に記憶を再処するために再固定価が必要であることを提唱した
969.6825	13.0050	overt	969.7650	1163619	さらに遺伝子発言を阻害するとその恐怖記憶が失うことをしましたさらに遺伝子減少害しても早期後のヨン時間程度の記憶に影響が見られないのかから早期された記憶が初期段階と同様か
983.2575	5.9700	overt	983.3400	1179909	同様の成分科学的な症状を示すことが出された以上の結果から固定化された記憶であろうと思う記憶は
989.7975	19.5825	overt	989.8800	1187757	さらに飛車によると同様な変異な状態に不安定化されるには固定化と類似したプロセスなり遺伝子発現を必要とすると決論されたさらに非社によりクレブ遺伝子の保存の変異常化が必要とすると結論された
1009.3800	19.5825	overt	1009.4625	1211256	再構定価の分析機構が固定化と極めて類似している解析が進められたさらに必要によって再固定化の意義に関して解析が進められたその結果記憶が早期されてとしてもその最終度に関しても再構定化が必要がないことが示された
1028.9625	19.5825	overt	1029.0450	1234755	組織レベルの固定化が進んだ古い記憶記憶を掃除させた場合には遺伝子圧減疑に記憶の破壊を観察されなかった以上の事件結果が再固定化が誘導されなかった以上の事件結果が再固定化が誘導されることが明らかとなった
1048.5450	19.5825	overt	1048.6275	1258254	また細固定化を説明する場合記録が想知されると不安定化の理解を進んでいないこの不安定化の理解を進んでいない不安定化が創出されたのであれば総記から単記録と同様な状態すなわち不安定な状態だとに違いない
1071.4275	3.1200	overt	1071.5100	1285713	電子発電発言による記憶の破壊が起こらないものはずである
1075.1775	5.4300	overt	1075.2600	1290213	と考え不安定化のメカリンズムの解析を進めてきたその結果L型電位依存カルシウムチャンネル
1081.2675	11.6850	overt	1081.3500	1297521	カナビノイド中央型CBIの活性化が記憶不安定化に必要な必要であることが明らかに必要な分定化に必要な動定から不安定化概念上ものなく分析効率とアクティブなプローツェクトが示された
1092.9525	11.6850	overt	1093.0350	1311543	今後不安定化された記憶をニューロンシナプス分子レベルで提示する必要がある
1105.1475	7.7700	overt	1105.2300	1326177	この基点から以下に示す記憶消去も記憶アップデートの一例であると捉えられている最高固形状況の関係性の解析も進めている
1114.2675	15.8000	overt	1114.3500	1337121	実は恐怖記憶形成人の条件刺激に再生捕査をされることによって恐怖記が装置され恐怖反応が引き起こされるしかしこの場合共感の悪魔の条件発射でひたがってサイクスポージャー時にしなし乗船刺激が続けば動物は乱れなし撃が続けばればれば
1130.0675	15.8000	overt	1130.1500	1356081	恐怖条件付け文脈学習では再覆ポージャーにあこり戻された最初こそ高い恐怖感のして時間が経つのにつれて恐怖反応が低下するこの現象は記憶消去と呼ばれ恐怖恐怖を感じる必要がない
1145.8675	15.8000	overt	1145.9500	1375041	冒頭のエピソードに入れさればスーパーを重ね続いて主観アンスレティングがもと想像されるこの消負荷の原則が記憶チョウスである記憶消去の存在はイチマンキューセンニヒャクナナジューナナパブロヘヘネットしている
1162.2075	19.4400	overt	1162.2900	1394649	記憶消去が誘導されても時間が経た場合あるいは微弱な電気食を受けた場合上下のデンチェーに対する消去はサイコテージの遺伝子炎による消去破壊の場合となり消去が起こっても記憶が起こっても記憶感が廃増されるような聴去は記憶期は記は生かない
1182.1875	3.3600	overt	1182.2700	1418625	閉じ込めるような新しい神経済を加計すると考えられて
1186.2075	11.1600	overt	1186.2900	1423449	また我々の含む複数のグループによって長期の遺伝子にも遺伝子発言が必要であることが済む少女記憶を固定されることがあって最近記憶維持の遺伝子KPMが示唆されたKMMも
1197.3675	11.1600	overt	1197.4500	1436841	PKCCNNの抗生化合成化アイスフォームである気温部科医療の発生を阻害するペピシドジップのノナイチチューリにより貯蔵されていた記憶が失われる
1212.9975	12.4050	overt	1213.0800	1455597	大切なもの場合この場合装置させなくても記憶が失われることである記憶再固定化を損害した場合とメーカニズは明確に異なっているシナプスクオアット鋼型グルダミッサン自治療体の極材が維持されること
1225.4025	12.4050	overt	1225.4850	1470483	またジップによる記憶についてもLTPも維持できないことも示されているジップによる記憶を呼び出すの分からなければならば記憶維持もアクティブな記憶物資の一つと言えそうである
1238.4975	17.0300	overt	1238.5800	1486197	恐怖記憶制御の観点から比較すれば最古定化は恐怖記憶を維持するのに対して消去は恐怖記記憶を減弱する正反対なプロセスが存在しているフィッシャーはこの送付記号を制御する正反対なプロセスが存在するメーカニズム
1255.5275	17.0300	overt	1255.6100	1506633	この時計画と消去の関係性の解析を進めてきた
1272.5575	17.0300	overt	1272.6400	1527069	一方サイクシュポージャーにはサンジュー分延長するとその間にマウスの恐怖反応は低下し消去が誘導されるそのニジューヨン時間後の対象軍は変わらず低い恐怖反応を示し記憶消去が維持されていくものの再生ポジア時に遺伝値を阻していくと再び高評判のを示すようになり
