onset	duration	trial_type	wav_onset	sample	value
1291.6275	7.3500	overt	1291.7100	1549953	記憶消去の境が観測され消去遺棄できない以上のように恐怖条件次文翼記憶では恐怖記憶の
1300.4175	11.2800	overt	1300.5000	1560501	早期時間が短ければサイコテー化が誘導されば消去が誘導されば消去が誘導さればそれぞれ遺伝子が誘導される場合には会話返答体の一方消去が誘導される場合に変動だって全当当初期が誘導される場合には変動だって全当
1311.6975	11.2800	overt	1311.7800	1574037	以上の解析から最高手型表記は組織ニューロン分子レベルにおいても極めて対象的な症状に示すことが示されているしかし最後手形型強化症期はこのような
1323.5175	13.9500	overt	1323.6000	1588221	対処性を示すが独立したプロセスがいわば表現の関係である消費が進行すると恐怖記録が装置されているものもはや恐怖教育の再通度に遺伝者発見は必要されなくなる
1339.4775	15.3000	overt	1339.5600	1607373	この方は固定かな概念から見より恐怖反応する必要ないことと記憶できなかったと解釈できるしかしサン分はタイプ死亡者を止めてマスチャンバーから取り出せばより遅く記憶が破壊されるはずだいしたがって消去が破壊されるはずだい
1355.2875	12.2700	overt	1355.3700	1626345	恐怖記録の採造上には遺伝子発見が必要とされなくなっているこのようにサイコテカと消去は小兵器の関係性は高度レベルのみだなくても認められている
1411.5975	18.3000	overt	1411.6800	1693917	以上再固定型と消去の特殊などのみでは組織分子ロビで認められ細胞の記憶プトの記録属との間で組織から消防御により作業者の過程度が起こっているそのサンジュー分間の再構成分割じゃな過程でこのサンジュー分間の下症状態で外見直直前がこのサンジュー分の中で納で
1429.8975	18.3000	overt	1429.9800	1715877	また冒頭に移動した秋下記憶アプデートの制御機構の視点からは記憶がアプデートされる際には新規情報のみが固定化が必要である既存の記憶はうまく保護されるといった興味深いメカニズムが存在していると考えられる
1448.1975	18.3000	overt	1448.2800	1737837	あるいは全く新しいファイルを作成するかに脳内ではないのに状況に押して一瞬記憶を検出するのかあるいは既存の記憶は簡単ではないもの最高デーションの解析を進めることがこの解析の実行突破口になれないかと考えられている
1482.4575	2.2500	overt	1482.5400	1778949	脳会話が記憶力を保つメカニズム
1485.8175	14.0400	overt	1485.9000	1782981	介護は学習記憶に重要な能力の一つで人服も多くの動物種のいて教獲がある種の記憶の想知は最初の解剖の働きを必要としますが自関係界ともな徐々にその解剖性が検証していることが知られています
1500.5775	12.6900	overt	1500.6600	1800693	ジュー種類によっては数週間後の解剖を通じるようになり記憶の位置に能力が大の支出と抵抗しますと意外に比べて解剖は非常に小さい能力が小さいと想定されますところが脳は生涯海部を通じて新しいな力が小さいと想定されます
1513.2675	12.6900	overt	1513.3500	1815921	本地球で海馬のシナプス伝達を人為的に飽和させて新たな記憶を画策できなくなった状態を作り出してその状態から回復に神経申請が果たす役割を解析しました
1526.9175	13.4100	overt	1527.0000	1832301	高頻度電気地域を与え長期LPを繰り返し誘導を飽和状態にさせましたこの状態で文明規制恐怖条件付きを行ってもラフとは恐怖記憶を稼働することができませんでした
1540.3275	13.4100	overt	1540.4100	1848393	できるまたLDPが元の状態に戻っていましたこの結果LTPは自然水道体に回復したために新たに記憶を形成することができる状態に回復したために新たに記憶を形成することができる状態に回復したことを示しています
1553.7375	13.4100	overt	1553.8200	1864485	この事件申請が低下したラットとして東弁の薬草社をどこしたラットを持ち海部の推進したラットとしても足車のある環境で飼育したラットを持ちいましたこの事件により以下のことが明らかに出ました
1570.2075	19.2150	overt	1570.2900	1884249	X線症者を受けて海馬の神経申請がほぼ消費する後でRTF線に回路の飽和状態から起これておりジューヨン日後でも恐怖記録を獲得するからできずまたLTPPが減衰している方法状態を保っていました
1589.4225	19.2150	overt	1589.5050	1907307	ナナ日後にはLTPが元の状態に戻っていると同時に恐怖記録を獲得することができ放話状態からの回復が促進していました
1609.9575	19.2900	overt	1610.0400	1931949	今回の研究成果は精神社が使用開担当を用いているため今後は正常な彼に伴う記憶力低下要となる記憶力低下症をはじめ鎮日調の記憶障害等の改善を用いて検討の効果を用いて検診の促進性の効果を用的として想約研究等の改営が求められます
1636.9875	2.2200	overt	1637.0700	1964385	メモリープと記憶の最高低下
1649.7975	11.4750	overt	1649.8800	1979757	記憶は脳の工事機能の基礎な基礎の重要な機能であるその固定化のメカリズムの解明の研究への重要課題の一つである近年多数の電極密で新規活動を同時に記録する技術が進歩した結果
1661.2725	11.4750	overt	1661.3550	1993527	動物が課題を遂行した後の睡眠また安眠状態で課題と類似の心技活動が再生されることが分かってきたこれにはショーメリディプレイについては要する記憶の固定可能な関係について
1673.3175	10.0800	overt	1673.4000	2007981	メモリーDプレイの詳細に入る前に睡眠と記憶の分離について簡単に整理しておこう生物の進化と睡眠の様子も大変し朝礼と保に入れるような
1683.3975	10.0800	overt	1683.4800	2020077	レム睡眠とは急速管球運動を伴う睡眠で脳の活動は活動に近く夢を見ることが多い一方の乗組みにはないという意味で脳の活動化学生で低下深い眠れてない
1694.0175	10.3500	overt	1694.1000	2032821	人などの霊虫類の場合の年齢化に分離される動物事件で起こされるラットの下痢では霊長類ほどのレンウム睡眠の文化がはっきりしてね本総説では
1705.2075	18.8550	overt	1705.2900	2046249	ラットの実験から得られた知見を中心にまとめるためノーネーム睡眠とレムスイムのニ種類の議論を進めていく
1724.0625	18.8550	overt	1724.1450	2068875	一方動物の記憶を人の場合のように便利にすることは困難である
1744.3275	12.0000	overt	1744.4100	2093193	専業的記憶が解剖的な記憶であることからラットの罰細胞による記憶がその原型の原型に当てる改善に合わせている以下では記憶の固定感に対してラトのバスタイバーのメモロティープルを中心に議論進めていこう
1786.8675	2.6700	overt	1786.9500	2144241	記憶にはいっぱいに密の働きがあると考えられ
1791.6675	14.8350	overt	1791.7500	2150001	覚える働きを決め宅へ保持する働きを保持取り出す思い出す動きを再生また早期と呼ぶ非正人的記の覚えその名判が重要な書きに会話が重要なことが知られている
1806.5025	14.8350	overt	1806.5850	2167803	実前数年の記憶を失い実後の新しい戦略記憶を一切できなくなったことが報告されていることが報告されていることから実前ジュー年以上の宝庫で古い記憶を保持されていることから海部はセン人手記名の初期に応えていることを考えられるようなった
1824.4575	15.2100	overt	1824.5400	2189349	そして時間の経過とともに記憶が開増から必須に追加に移され最終的に解剖から独立されると考えられてそれに記憶がその時期に加えられそれが徐々に必須に移行し十分に時間が足すとなくなるという価値とか現代化に受けられて先人的な価値である
1842.4575	16.9650	overt	1842.5400	2210949	このカツの基礎がニューロン活動に影響を受けるというヘブのカースツがある新しい記憶に対応するニューロン群が相関して活動することによりそれらの間の結合が強化するそのニュロンがより高い相関で活動するようになりこのような
1859.4225	16.9650	overt	1859.5050	2231307	このようなニューロン軍をセラーセンブリと呼ぶそして外的な要因や邪発的に機関するニューロングが何度も再活性化することがメモリリプレに対応し記憶固定化に対応すると考えられている
1878.7875	10.5450	overt	1878.8700	2254545	さらに買えば必要期動機は長期ロク月のハチ円がヘブの解説そして一応不再固定化の仮説を支持する基礎と考えられており
1889.3325	10.5450	overt	1889.4150	2267199	現在は乾発な研究が行われることに注意されているという説明はノレスについてはノレム睡眠中のメモリリプレイから議論していこう
1901.5275	6.0900	overt	1901.6100	2281833	課題後の睡眠中にラットのバス細胞のメモリープレイが起きている可能性を最初に報告したのは
1909.9275	8.2800	overt	1910.0100	2291913	パブリですらの論文で彼らが課題中に興奮したラットの解剖CYネーキの場合は最後その後の睡眠中特にノレンスイッチの上昇してみました
1919.3175	6.5100	overt	1919.4000	2303181	またのネセイミンはビルムスイミンちゃんのバースト悪化に受けるスパイク数が増加し特にスパサンスパイからなるバストハッカー
1926.4575	10.2900	overt	1926.5400	2311749	さらにニからヨンマイクスケープのスパイク間隔を持つバーストアッカーの増加も観測しておりこれは長期増強効率的に誘発する条件とも合致している
1937.4375	3.8700	overt	1937.5200	2324925	しゃがって生体内にないで自然に
1941.8475	14.9700	overt	1941.9300	2330217	発生しているスパイク列がシナプスの過疎性を起こしているという結果として興味深いこの国はニューロン活動その後の睡眠中の流活動も影響を与えることをニューロンの発火率という一時統計量に注目して報告と
1957.4175	14.7000	overt	1957.5000	2348901	前節でも見てたように高い層感を持って発火するニューロン群群はセルアセンブリーを形成しそれらが再結成することがメモリープレイと関係していると考えられているそこでウィルソンらは課題中に記録されたニつのニューロン活動の相関
1972.1175	14.7000	overt	1972.2000	2366541	その後年齢セミニューで保持されるかどうかについて研究した彼らの多数のテトロードをラットの解剖を使用にすることにゴジューからヒャクのニューロン活動を同時計測することに成功した
1988.8575	12.7950	overt	1988.9400	2386629	彼ら一に高い活動で相関で活動する一方馬市場が重ならばし場所同士の相関低くなる彼らは課題中全中をそれぞれの期間においてニューロン活動の短期間の総合
2001.6525	12.7950	overt	2001.7350	2401983	重なったバッシュ腫瘍を持つバジ細胞はその後ナナ年も睡眠中にもおよそサンジュー分にあたって高い相関を維持することを見出した一方バシジオが重なる場所細胞同士の相関
2015.0175	8.1000	overt	2015.1000	2418021	ご関係は課題後も低いものであったこの報告はパジレスラーによって報告された発火率だけなくニューロハッカーの送還という日当計量も課題
2023.8375	3.7200	overt	2023.9200	2428605	ゴのノンラム水道に位置されているとはちにさきに言うと捉えることができる
2029.1475	1.0200	overt	2029.2300	2434977	その後平面は
2031.0675	12.4500	overt	2031.1500	2437281	新しい課題よりも慣れ親しいんだ課題において平均悪質相関の両方が課題後で睡眠でよく保存されることを確認してまたバターグラーはこのかによるメモリープレープレーを正確に検出する方法を提案しメボリープレーがノーハのうちでも
2045.4375	8.7900	overt	2045.5200	2454525	シャープウェーブリプル生成中に検出され後で課題終了ジュー分からニジュー分を超えると減衰することなど報告している
2054.8575	10.9800	overt	2054.9400	2465829	ここまで報告した研究でメモリリプレイにおけるニューロンの発火の順番は考慮されてないしかしたら例えばエピソーキャークの時間関係がメモリーリプレイの重要なアクターであることは明らかである
2066.4975	17.9850	overt	2066.5800	2479797	そこでスクワークスラーはノラットの海部周囲で場所重夜が重なっている場所細胞同士の相関関係の形をテンポラルバイスに検討しその日と対象性が課題後のノーレム水密に保存されることを見出したまた相関関係のピークの位置を比較するとノレム水道に見込み出した
2084.4825	17.9850	overt	2084.5650	2501379	スパイク時間順序がメモリープレイチに放射されて可能性より直接的に示した研究としてナーダースティーラーの仕事がある彼らテンプレートマッチング同時確率マッピング同時確率マッピングの手法もついて課題中に監督されたかいバイバシューのスパイク
2103.2775	2.7900	overt	2103.3600	2523933	時空間パターンがその後寝住み中に
2106.6675	3.9000	overt	2106.7500	2528001	エア発電中に圧縮された形で再現されることを
2111.5275	18.2400	overt	2111.6100	2533833	まずテンプレートマッチングより解析では実際に観測されたオリジナスパイク列の繰り返し回数とスパイクシャップリングによって生成されたランダムスパイク率の繰り返し有意さを限定してまた同時確率マップレッピングレーターを限定している
2129.7675	18.2400	overt	2129.8500	2555721	特にサン発のスパイからのあるスパイクトトリプレットの時空間ではパターンを詳しく解説した結果か手前と課題語ではゴ%増加したことを報告しているこの動きとほぼ同時期に説明分散による解析によってクドミモリラー
2148.7875	16.4200	overt	2148.8700	2578545	またこういう流れを組む研究としてリリーらはテンプレートマッチングを発展させて組み合わせ解析をもちることに課題中のスパイク時空間パターンがあちろん約ニジュー倍の速さで再生することを示している
2165.2075	16.4200	overt	2165.2900	2598249	ラット海部シーラーに起きるメモリープレイプレーが時間保持つつ圧縮された形で中に出現することが明らかになったただし脳波でノンレム睡眠中だけでなくラットが汚染していないのにも見られ安静時の脳波に起きるメモリプレーも観測されている
2181.6275	16.4200	overt	2181.7100	2617953	よりもエアの発生かメモリープレーの時期に必要な役を出すと考えられるさらにこれまで紹介したメモリープレーの地球間パターンすべて過大中のニューロンの発火と同じ時間的に再生であったがラットが課題数公中に呼吸している時に起こることが最近報告された
2198.7675	12.6300	overt	2198.8500	2638521	この逆転のメモリープレーは報酬に関連していると考えられる大の切り方からのババミサト線のニーロンの運ぶタイミングと含み合わせることに解敗バリゾン的な組みで行きそうか
2211.3975	12.6300	overt	2211.4800	2653677	さらにラットを用いた最新の研究量とトラックを走った後の呼吸中のエアでは逆転のメモリープレーがトラックを走る前の呼吸して中のエア派では順方向のメモリープレーが報告されている
2226.5475	3.9300	overt	2226.6300	2671857	今後は両方向に再生サンmの機能的に見ついて議論を進めていく必要があるだろう
2231.2875	1.0500	overt	2231.3700	2677545	レムスイミンちゃん
2235.3975	14.3100	overt	2235.4800	2682477	多く知られている人の夢の多くはレム睡眠中に多くはレム睡眠中で夢の意味を検出することが決めてより多くの研究者は聞きつけてきたまた近年はレムスイメンで教科の関係も議論されており例えばクリクラはによる必要な
2250.3075	12.4050	overt	2250.3900	2700369	記憶の消極化節は自治的であった大きなピンポクトを持って迎えられたしかながら電気整理事件によるレムセミンターのメモリーの研究は極めて少ないのが現状である本説は代表の研究を紹介する
2262.7125	12.4050	overt	2262.7950	2715255	彼らレッドをかえばCマンリオ機のバチ細胞の活動を同時記録し初めて訪れた場所で発火する場所で発火細胞のスパイカ科のタイミングとしていた派の位置を調べた
2276.0775	17.1400	overt	2276.1600	2731293	その結果初めての場所で発火する山で発火する傾向がある一方キスの場所で発火する傾向で発火する傾向があることを見出したこれまでの緊急流とシータハンの山付近のスパイクは長期臓器を引き起こしやすく逆にシーターの端付近のスパイクは長期待を引き起こしられている
2293.2175	17.1400	overt	2293.3000	2751861	次の新しい経験の固定が長期増強されることにと促進され古くが長期制によって抑制によって長期される可能性によってロブリーラによるまでラッタの海部Cのゴ細胞を同時記録しテンプレートマッチングによって課題水口のスパイクルーカンと
2310.3575	17.1400	overt	2310.4400	2772429	レムスイミンチョンのスパイク時空間パターの比較してだけその結果レムスイミン中よりもややゆっくりとして速されメモリリプレイが起きてることを発見したらこのメモリリプレイの多くが課題前のレムスイミに注意する必要があるこの異大な結果に注意する必要があるこの結果に注意する必要がある
2327.4975	17.1400	overt	2327.5800	2792997	前日の課題遂行時のメモリリプレイを検した可能性を指摘しているしかしそれではなぜ実験統一年生後にメモリリプレイが見つからないのか説明になっておらず不満が残るまた彼らしい課題の実験も行っているがまた彼らしい課題の実験を行っていなかった
2344.6375	17.1400	overt	2344.7200	2813565	下がってレム睡眠中のスパイクパターンのメモリリプレイのメモリリプレーのメモリリプレイの報告が必要である以上のりのロンレム睡眠中の報告に比べノレム睡眠の報告が少ないそのDのニつにラットを使った他年局記録実験では課題前後からイチ時間の数が数である
2361.7775	17.1400	overt	2361.8600	2834133	このような眠睡眠のサンプラーが得られないことが考えられるような現務睡眠中にそれぞれジューニ時間以上の連続記録を行いれ眠睡眠中のラットの内側前夜と会話の神経活動を解決する研究を進めているそしてレム睡眠中にあられるスパイク時空間パターンを進めている
2379.7275	9.6300	overt	2379.8100	2855673	テンプレートマッチングの地面が課題前後前後前後前後前後にかかわらず前後前と前夜でスパイク時空間パターン同士度が高いのに対し開場で類似度が引くことが分かってきた
2390.4375	10.5000	overt	2390.5200	2868525	この結果レムスイミン中の内藤前夜と会話異なる機能的なエクトワクに属していることをさせており興味深い最後に興味深いが今日この固定感が不明なというかウィーク現在活発な議論が
2400.9375	10.5000	overt	2401.0200	2881125	今後の動物事件のあるいも睡眠中の神経活動複数の流野から同時に継続しそれぞれのデュアでどれなメモリープレイが打っているかが楽にしていくのが重要である
2424.8475	6.7500	overt	2424.9300	2909817	脳の理科にための脳の物質科学的アプローチや脳型コンピューター開発の脳の効性論的アプローチの両者が重要である
2433.7875	4.7700	overt	2433.8700	2920545	これらのニつのアプローチェンスの特徴が明らかになったのはノーリピースのアキテクションの比べて
2439.2475	5.3100	overt	2439.3300	2927097	フォンの今型コンピューターであるこのことは脳の連想学習
2445.1875	13.6600	overt	2445.2700	2934225	脳とコンピューターの一番の違いは学習性である
2458.8475	13.6600	overt	2458.9300	2950617	自分で一生懸命作るの方で教えられて回路を作っていなく行くの方で自然に機関係からできながっていくのでこれを自己組織化でできるので学習によって自己組織化化させるわけである
2472.5075	13.6600	overt	2472.5900	2967009	神経回路が自己削生された原理を明らかにすることがノーのコンピューターとしての特性を解明する非常に重要なポケターとなってくるここでは脳の情報処理システムとしては脳は記憶ベースのアキューター型型であることを述べる
2486.7075	4.4100	overt	2486.7900	2984049	脳の学習記憶の学習学習ののは
2519.9475	2.6700	overt	2520.0300	3023937	もう外部情報処理する神経路を学習によって
2523.5775	5.4600	overt	2523.6600	3028293	私は脳が強い刺激として受け取った情報に関して成立するその感覚情報を受ける
2529.6975	1.1400	overt	2529.7800	3035637	おかんするか
2531.5275	19.0500	overt	2531.6100	3037833	学習に関しては情報の時間的関連付けがいかに神経回路の活動して表現されるかが重要であるこの能力が使われる能力が使われる能力が使われてその能力とその集団としての神経画が変わってくる神経細胞とその集団としてのような情報を得ているかというのを
2550.5775	19.0500	overt	2550.6600	3060693	こうしてに作られた脳から心という働きがあるのにのである科学の常識から見る心の働きもこのような視点から考える心の働きもこのような視点から考えると極めてよく納得できる脳はこのようにしてある感覚情報処理する陳系回路を自己組織し固定化するとこれを記憶の活性形成とすると
2570.3175	18.3800	overt	2570.4000	3084381	装置の記憶の意味ではなく固定化された情報の処理能力の形成という意味である記憶の再生や外部情報に固定化された情報にいたものが入力するとその固定化された神経路が活性化されるしたがって連想記憶であるこのような脳は確信の方法によって作成功である
2588.6975	18.3800	overt	2588.7800	3106437	学び情報による早期も神経細胞の臓器も神経細胞の連想の画期間となっている連想学習をもとにして行った記憶性をもっとに違う学習法あれば不完全な情報によっても適切な対応ができるのである脳は連想学習で調理する能力を自律的に
2607.0775	18.3800	overt	2607.1600	3128493	外部情報はこのように固定化して回路の活動を活性化し少しの推練を変えて外部に出力してこのような脳の情報種類の方はコンピューラークの科学のメモリーベースアーキテクチャ型型のコンピューターというものを記録として連想的に活用化すること
2628.1575	13.1100	overt	2628.2400	3153789	また外部情報は脳に強い影響を書き換える学習情報として受け入れられることが脳の学習情報として受け入れられることが脳の特徴性の強く反映される我々が原動習習を取りした結果でなく内部にある基本語
2641.9275	11.9550	overt	2642.0100	3170313	記憶が基本的に生み出された結果であるということでこれについて例を挙げることになり校舎の特殊をつないで学習や記憶が連想通して行われるということである脳が柔らかい特性の性的婚か
