onset	duration	trial_type	wav_onset	sample	value
32.9308	2.3100	overt	32.9400	39517	数か月が経ったいろいろあって
35.8108	1.1100	overt	35.8200	42973	死にそうになった
38.7508	1.0800	overt	38.7600	46501	役所って
44.6008	1.2600	overt	44.6100	53521	すいません
46.5808	2.8800	overt	46.5900	55897	住民票ってここで発行できますか
50.4208	1.4400	overt	50.4300	60505	こういう話は
53.8408	3.0600	overt	53.8500	64609	そういう話はここ県庁なんで
59.6908	4.7400	overt	59.7000	71629	大宮まで出てもろって市役所で聞いてください
78.6808	3.1800	overt	78.6900	94417	住民票みたいなのを発行したいんですけど
83.0008	4.0500	overt	83.0100	99601	それなら階段登って右の住民会行ってください
88.6108	4.1700	overt	88.6200	106333	住民係の窓口へどうぞ番号を取ってお待ちください
105.9208	4.1700	overt	105.9300	127105	女子大の近くのカレーエロー知ってるよ私行ったことあるもん
110.6908	1.5300	overt	110.7000	132829	ニジューサン番の方
114.7708	4.1100	overt	114.7800	137725	すいませんニ階の小関係の窓口でお待ちください
122.8408	6.0600	overt	122.8500	147409	証明ができないってですからハインさんの場合まず裁判所へ行ってもらって
129.5908	3.7800	overt	129.6000	155509	それから総合窓口の方へ行っていただいて
139.1608	11.0100	overt	139.1700	166993	継続証明書出生証明書住民票保険健康保険証国民健康保険証国民健康保険国民年金
151.2208	4.8600	overt	151.2300	181465	この世界は手続きであふれている気が狂いそうだ一人で行けるか
159.3208	1.9200	overt	159.3300	191185	仕事が見つかっただけました
168.6808	2.1300	overt	168.6900	202417	この街には至るところに
171.4108	1.5900	overt	171.4200	205693	不思議な遺跡がある
174.0208	4.6500	overt	174.0300	208825	調べるとこの国はセン年以上も前にここ奈良から始まったようだ
186.8908	2.0400	overt	186.9000	224269	この世界も大昔には
189.6208	2.6400	overt	189.6300	227545	スポングモインツのような戦争があっただろう
195.3508	3.2400	overt	195.3600	234421	きっと俺の足元には無限の死体が重なっている
199.6708	2.1900	overt	199.6800	239605	おいこら何してんねん
203.1808	2.4000	overt	203.1900	243817	すいませんホラー持てるか
214.2508	3.6600	overt	214.2600	257101	ある日近くの公園を歩いてたらやつを見つけた
218.7508	2.0700	overt	218.7600	262501	おいお前か乗せんと
222.5308	3.7800	overt	222.5400	267037	大仏マン使って俺を呼んだんだろうなぜだ
228.6508	1.0500	overt	228.6600	274381	ふざけやがって
231.8608	1.5900	overt	231.8700	278233	あっさり倒してしまった
234.5308	1.3500	overt	234.5400	281437	また一人になった
253.7308	3.9600	overt	253.7400	304477	もう疲れた謎は解けなかったがパオロのいない世界
304.9708	1.9800	overt	304.9800	365965	取得確認表
308.1508	2.1300	overt	308.1600	369781	清島さん何か忘れたんすか
311.1208	2.5500	overt	311.1300	373345	あれって年内に会社に送らなあかんよな
339.5008	1.2300	overt	339.5100	407401	コンビニから飛び
341.3008	2.2800	overt	341.3100	409561	できますよこんな良い音しよう
353.3008	3.7800	overt	353.3100	423961	最近仕事来てへんやんけいやもう疲れて
358.0708	5.8500	overt	358.0800	429685	何これロープカッターお前の話は信じるで頭おかしいやつだと思ってるでしょ
365.1808	3.3600	overt	365.1900	438217	いやあのなちょっと行くべきところがあるぞ
369.8608	4.6800	overt	369.8700	443833	少し前法隆寺で地震か何かで壁が崩れたんか
375.1108	2.1600	overt	375.1200	450133	中の茶碗がむけ出しになっとった
397.8808	3.9900	overt	397.8900	477457	それに触れた時やった一瞬やったけど体感したな
402.8608	3.7800	overt	402.8700	483433	この辺やったよな見ろ何を体感したんだ
407.8108	1.5000	overt	407.8200	489373	世界の一部に触れた
427.8808	4.1400	overt	427.8900	513457	全てはつながってんねんさっぱり分からん言葉じゃ無理や
437.0608	3.5100	overt	437.0700	524473	宗教のことはもういいよまあちょっと散歩しようぜ
441.6808	3.6300	overt	441.6900	530017	何か感じるかいや懐かしい感じはする
450.5908	1.2600	overt	450.6000	540709	平常
452.4208	3.7200	overt	452.4300	542905	急後でも行こうや好きなんやろあそこが
458.3908	4.5900	overt	458.4000	550069	おめでとうございます何か追ってきた日本誌買ってきたよ正月だから
463.7608	4.7100	overt	463.7700	556513	私もスポングもいいつこく行きたい
469.2808	1.5000	overt	469.2900	563137	お姫様なれんど
472.9108	1.9800	overt	472.9200	567493	戦争中なんでやめた方がいいですよ
506.1208	7.7700	overt	506.1300	607345	君は家族とか恋人はおるんいやつまりな今見えてる世界も脳の中の物質的な現象やろどういうことや
514.7308	8.2800	overt	514.7400	617677	だからな全てのものは実体がない俺もお前も異世界も神議によってあるだけの流動的などういうことや
523.5208	2.8500	overt	523.5300	628225	向こうの世界の友達に会えなくて寂しくない
527.5108	3.0300	overt	527.5200	633013	もうほっといてくれよもうやめてくれ
531.2608	4.3500	overt	531.2700	637513	だから信じる言うてるやんけ世界の話も大仏マンの話も
567.4708	4.1100	overt	567.4800	680965	経験したことはあんたらみたいな分かりゃしないんだ
572.4508	2.4000	overt	572.4600	686941	うらやましいよだからもう死ぬだけか
579.0208	3.9600	overt	579.0300	694825	ライブツマンが言ってたこの世界に実体がないなら
583.7308	1.2300	overt	583.7400	700477	生きてる意味もないって
585.7108	3.2400	overt	585.7200	702853	同じ汚染とはなんでならねえ呼んだんですか
589.7008	2.3400	overt	589.7100	707641	ハインさんは選ばれしい勇者ですよ
593.2408	3.8700	overt	593.2500	711889	やめろ俺はそんな特別な人間じゃねえんだよ
598.1908	1.1400	overt	598.2000	717829	本人なんだよ
599.9008	3.7200	overt	599.9100	719881	それも不器者の俺には何の価値も役割もない
604.9708	4.6500	overt	604.9800	725965	そんなことないよアイン君はいい人やから呼ばれたんよ
610.5208	2.1900	overt	610.5300	732625	もういいよ奈良に来た理由なんか
613.6708	2.5200	overt	613.6800	736405	もう行こう寒くなってきた
618.2908	3.4200	overt	618.3000	741949	帰る前に商店街行って餅でも食おうや
629.8708	3.2100	overt	629.8800	755845	お前らが絡んでくるからやろマイルドヤンキーが
640.9408	1.5900	overt	640.9500	769129	そんなばけ気持ち悪いね
643.4908	1.2900	overt	643.5000	772189	気持ちええわこら
647.9608	2.4600	overt	647.9700	777553	あのすいませんどっかで会いましたか
651.5608	4.8000	overt	651.5700	781873	雨宮さん昔対番やりましたねいや僕小山です
656.8708	3.2400	overt	656.8800	788245	けど僕音楽やってないんで違いますね
661.3108	1.5900	overt	661.3200	793573	音楽やってないんすか
664.4908	6.0900	overt	664.5000	797389	やりましょうやこいつもこの間ロックに目覚めたんすいやそんな気持ちも忘れたんでほな
672.9808	1.8900	overt	672.9900	807577	ロックは行き方なんだぜ
678.4408	2.4900	overt	678.4500	814129	いやちょ待ってくださいよ刺繍だけでも
681.6208	1.9200	overt	681.6300	817945	ニヒャク円俺が買いたやつ
685.2508	1.5900	overt	685.2600	822301	あいつ寒そうやったな
688.4908	4.6500	overt	688.5000	826189	刺繍買いこらって言うてた田舎のアホパンクや
694.1308	3.4800	overt	694.1400	832957	なんで笑ってんのいやなんかバカバカしくて
702.0208	4.2600	overt	702.0300	842425	もう行くんかいろいろありがとうホンマにもちらん
707.2408	5.7000	overt	707.2500	848689	ああさようならおいまた乗船頭探しに行こうぜ私も一緒に行くわ
717.7408	5.0400	overt	717.7500	861289	もしもし小山ですけど明けましておめでとうございます簡単からすいませんね
723.9808	4.6200	overt	723.9900	868777	あの連載のことなんですけどさっきふと良いこと思いついたんですよ
729.3808	5.1900	overt	729.3900	875257	どうですかいやなんかふと昔の気持ちを思い出してねそれやと年季が出ない
735.2008	5.7900	overt	735.2100	882241	てかそんなん関係いや俺をやりますよ今度は大丈夫だですよだって
894.5908	5.1600	overt	894.6000	1073509	その現実と一つの幻想的な世界から成り立っていることを指摘しています
900.6808	9.6600	overt	900.6900	1080817	現実的な世界は漫画家小山陸が生きる東京の現実現実的な世界には漫画家小山陸の故郷である奈良の現実
912.9208	5.5200	overt	912.9300	1095505	幻想的な世界サンは漫画家小山陸が想像するファンタジーの世界
920.8108	1.0800	overt	920.8200	1104973	また作者の
922.8508	8.7900	overt	922.8600	1107421	魂が別の人物を渡っていくことによって展開していくことでこの異なるサンつの世界がつながっていることを指摘しています
932.6008	5.4900	overt	932.6100	1119121	その魂の異常を文献という面白い言葉で表現されています
941.0308	1.5300	overt	941.0400	1129237	このサンつの世界の
943.9408	8.6100	overt	943.9500	1132729	また大山先生がこの文献による語りを長編作品を書くにあたって
953.1808	2.6400	overt	953.1900	1143817	選択した理由もなんとなく分かる気がします
1016.9008	6.9600	overt	1016.9100	1220281	異世界転生という昨今流行りのスタイルをめちゃくちゃな形でジャックして作品に取り入れてますね
1024.8208	6.4800	overt	1024.8300	1229785	こういう語りの多様さがとても楽しいですでも第ナナ話はゴページ目のベルナーの笑顔はひどい
1038.6208	4.3500	overt	1038.6300	1246345	メジャーシー行きたいなら歯ぐきを描くなこういうギャグを見ると
1044.0208	5.1900	overt	1044.0300	1252825	大山先生本人を思い出しますしかも彼は持ち込みの原稿も
1050.2308	2.5800	overt	1050.2400	1260277	にも歯ぐきを描くような人です多分
1055.7808	3.8400	overt	1055.7900	1266937	西村土香もやるけれど漫画の絵で歯ぐきを
1060.3108	1.2600	overt	1060.3200	1272373	描写することは
1062.3208	1.2900	overt	1062.3300	1274785	アイロネーなんです
1133.4808	6.6900	overt	1133.4900	1360177	これはとてつもない傑作だということで私は毒後しばらくの間拒絶していた
1140.7708	6.2700	overt	1140.7800	1368925	次に思ったのはこんな素晴らしい作品が世にあることをなるべく多くの人に知ってほしいということで
1148.4808	1.5300	overt	1148.4900	1378177	そこでいかに
1150.5208	4.3800	overt	1150.5300	1380625	私がこの作品をどのように読んだかについて記そうと思う
1161.3508	3.3000	overt	1161.3600	1393621	この作品の中には一つの現実的な世界と
1181.4808	7.5600	overt	1181.4900	1417777	東京都ならはどちらも今私たちが生きる現実を参照しているにもかかわらずこれをニつと数えるのは
1189.6408	3.6000	overt	1189.6500	1427569	このニつの現実にはどちらも際立った特色が
1194.7408	2.0400	overt	1194.7500	1433689	様子の違う世界だからである
1201.4308	3.0000	overt	1201.4400	1441717	どういう特色かというと現実
1209.9808	5.5500	overt	1209.9900	1451977	数字や論理が人間の生き方を決定する合理的な世界である
1233.3508	2.8200	overt	1233.3600	1480021	全ての価値は数字に置き換えられ
1246.7308	4.9500	overt	1246.7400	1496077	置き換えられない価値は認められないそのことに疲弊した小山陸は
1253.1808	2.0100	overt	1253.1900	1503817	うるさとであるならぬかゆが
1256.9608	2.4000	overt	1256.9700	1508353	距離であるならにカイルが
1283.6308	8.2500	overt	1283.6400	1540357	そこには東京と全く違った現実がありそれは感情と感覚が優先される非合理的な世界である
1293.8308	8.6700	overt	1293.8400	1552597	そのため暴力で物事が決まることも少なくなくまた恋愛というよりは色濃いと言った方がふさわしいような関係が
1304.7208	5.2800	overt	1304.7300	1565665	この世界ではしばしば見られるがそれは決まって弱い男と強い男と
1310.5108	2.1300	overt	1310.5200	1572613	女のサン社の関係であり
1313.4508	6.1500	overt	1313.4600	1576141	弱い男は必ず強い男に殴られて蹴られして女を奪われる
1323.2308	2.6100	overt	1323.2400	1587877	それは例えば第ヨン話当初
1328.4808	4.9500	overt	1328.4900	1594177	在住に顕著で一条とアンナの関係を疑い
1334.3008	3.2400	overt	1334.3100	1601161	雨降る東照大寺でアンナを攻めた
1338.0508	4.2900	overt	1338.0600	1605661	清島は後日一条に制裁されアンナは一条のもとに
1379.5708	4.0200	overt	1379.5800	1655485	つまりイチの世界で生きられずニの世界に行ったが
1384.2208	2.7600	overt	1384.2300	1661065	そこも行きやすい場所ではなかったということである
1387.7908	2.4900	overt	1387.8000	1665349	といったところでまた別の話をする
1391.0008	5.9100	overt	1391.0100	1669201	別の話をしなければならないのはじゃあ奈良に帰った小山梨子はどうなったのということで
1397.8408	8.4600	overt	1397.8500	1677409	この前のサン話には藤田という男も登場していて普通に読むと一体誰の話なのかという疑問を持ってしまう
1407.7108	5.0100	overt	1407.7200	1689253	というところがこの作品の特に素晴らしいところであり肝の部分で
1413.6508	3.4200	overt	1413.6600	1696381	もあるようにこの清島という男は
1418.0608	2.5800	overt	1418.0700	1701673	間違いなく作者の文春である
1423.7608	8.0700	overt	1423.7700	1708513	作者の分身などというとありきたりに聞こえるなのでもっと実感に即して言うとこれは作者の文言
1432.4908	5.4900	overt	1432.5000	1718989	のようなものではないかと私には思えたつまり作者大山海の
1438.5208	5.5500	overt	1438.5300	1726225	魂は初め小山陸の体についていたがサン話からヨン話に至る
1456.5808	6.5700	overt	1456.5900	1747897	時点で清島に着いたということであるそしてゴ話では近々
1464.8008	3.3900	overt	1464.8100	1757761	金金のなら崩壊を
1469.5408	2.8200	overt	1469.5500	1763449	信じそれを阻止しようとする狂った男
1473.2908	4.3800	overt	1473.3000	1767949	大仏漫画登場するがこれもおそらく作者の文言である
1478.4508	4.9200	overt	1478.4600	1774141	つまり清島に着いた文婚がさらに分かれた大仏マンに着いたのである
1484.7508	4.4400	overt	1484.7600	1781701	清島は弱さゆえに女を奪われ寺巡りに没頭する
1493.4508	1.1100	overt	1493.4600	1792141	もう一つの
1496.9608	6.3000	overt	1496.9700	1796353	獲得しようとするわけだが当然そこには不合理な現実に対する怒りや恨みがあり
1504.2808	3.9600	overt	1504.2900	1805137	ゆえ大仏マンが登場することするということは
1508.8108	3.1800	overt	1508.8200	1810573	守備が一貫しているそのように考えれば
1512.8608	2.3700	overt	1512.8700	1815433	大仏マンが一条の顔をして
1517.5108	3.0600	overt	1517.5200	1821013	声をかけこれを殴るのも合点がいく
1521.6208	4.2300	overt	1521.6300	1825945	そして殴り返されて射殺しようとしてやめるのも分かる
1527.0508	1.5900	overt	1527.0600	1832461	なぜならそれが
1532.0308	3.8400	overt	1532.0400	1838437	あることを作者の文献である大仏マンは
1539.3508	6.2400	overt	1539.3600	1847221	そしてその作者の魂が別の人物を渡っていくことによって
1546.5508	8.0100	overt	1546.5600	1855861	人それぞれ個性的な個別的な悲しみを不変的なものとして描くという経由の効果を上げているのである
1555.6708	8.1600	overt	1555.6800	1866805	さてそれでもう一つのハンタジー世界の話に戻るのだけれどもゆえにだからそのように作者の魂が様々な人物に分け入っているため
1564.3408	1.4400	overt	1564.3500	1877209	よく読むとさらね
1567.3408	2.4300	overt	1567.3500	1880809	繊細で複雑なのだけれども
1570.4308	6.5400	overt	1570.4400	1884517	ニの世界に絶望した小山陸はロク話で大仏マンとの緊張感を晴らむ対話を得て
1577.4808	10.2000	overt	1577.4900	1892977	日の世界に戻りその世界で勝負しようと決意する売れる漫画家を描こうとするそれがフィクションの中でのフィクションフィクション内でのフィクション
1588.3108	1.8600	overt	1588.3200	1905973	パンタジーの世界である
1590.9508	5.3700	overt	1590.9600	1909141	建前の世界で美しい言葉決めゼリフが人の生きる方を
1597.0408	7.7700	overt	1597.0500	1916449	決定する世界であるところがそこにも作者の魂が入り込んでくる作者の魂はハインという人物について
1606.1908	5.0400	overt	1606.2000	1927429	そのことによって金星の撮れたハンタジーの世界は傾いて危うくなる
1613.8708	4.7100	overt	1613.8800	1936645	そこでは美男美女が建前美しい言葉の管理者であり
1621.5808	4.3800	overt	1621.5900	1945897	これに配置する美しくないものは
1626.7108	2.1300	overt	1626.7200	1952053	陰微な制裁を加えられる
1629.6208	4.5300	overt	1629.6300	1955545	西洋流の人道主義の矛盾が容赦なく描かれ
1637.3308	11.2200	overt	1637.3400	1964797	人間が接種しないと生きていけないという現実の中で一方不全一方が悪と決めきれない被害者の悪のようなものまで
1649.6308	1.3800	overt	1649.6400	1979557	描いて切ない
1655.2408	1.6800	overt	1655.2500	1986289	サンポートという街の
1657.8208	1.5600	overt	1657.8300	1989385	宿屋の男は初め
1663.4908	2.2200	overt	1663.5000	1996189	竹類として殺害することに
1666.7308	2.4600	overt	1666.7400	2000077	心理的な抵抗感を持って
1669.7908	2.6700	overt	1669.8000	2003749	おらなかったが壁に埋め込まれた
1673.6008	2.1900	overt	1673.6100	2008321	当編を見てこの世界と
1677.3808	8.5500	overt	1677.3900	2012857	別の世界がつながっていることを知り突如として涙に暮れるそれはおそらくジェタの教会がなくなり全てと一体化する
1777.2508	6.0900	overt	1777.2600	2132701	悟りのような感覚であっただろうその直後に突如として世界の
1784.0308	8.1000	overt	1784.0400	2140837	世界ニの住人であった大仏マンがこの世界に現れるのは東京接点としてサンつの世界が通定しているからである
1802.7508	8.1600	overt	1802.7600	2163301	強い男と弱い男強い男に同調する女殴られる弱い男というモチーフがファンたちの世界においても繰り返される
1811.4808	4.0200	overt	1811.4900	2173777	現れた大仏満は作者の文献だからそのような
1816.1308	4.8000	overt	1816.1400	2179357	状況に苛立ちファンタジー内の人物を射撃する
1822.1008	6.4800	overt	1822.1100	2186521	その手つきはあたかも小説家が書き損じの原稿用紙を丸めて捨てる手つきのようである
1829.2708	10.9200	overt	1829.2800	2195125	しかしなぜ世界は通帝しているのかその影を握るのがニ話の時点ですでに登場している上線とでおそらくはその手によりベルナーは現実に
1840.7908	1.3500	overt	1840.8000	2208949	ニに送られる
1842.9508	5.3700	overt	1842.9600	2211541	ファンタジーに適合するように作られたベルナーはそこで生きられないそこでは生きられない
1849.2208	5.3100	overt	1849.2300	2219065	ファンタジーの世界で不適合であった範囲は死なないがギリギリの底辺を生き延びる
1873.6408	4.4100	overt	1873.6500	2248369	この作品においてどこに行ってもまともに生きられない範囲の魂は
1878.8608	6.5100	overt	1878.8700	2254633	広島の魂であり小山陸の魂であり作者の魂であると同時に私たちの魂であった
1886.2408	14.7900	overt	1886.2500	2263489	おそらく私が今生きているらしい現実も東編を通じてそしてまたその実態は空である情勢との手によってこの作品の世界に通じているそんなことを強く感じた繁華ファンタジーの世界で足を抜かれた
1901.8108	4.2000	overt	1901.8200	2282173	殻であるジョーセントはシカの足に包帯を巻いていた
1906.5508	3.0900	overt	1906.5600	2287861	ハインが奈良に呼ばれた理由を知ることを
1910.9008	6.8400	overt	1910.9100	2293081	諦めた時遠くに見えた幻影のような人影うち一人は無残に死んだ親しいものであった
1918.5208	10.4700	overt	1918.5300	2302225	作者の魂を通じてつながっていた者たちが最後は奈良に集結し去っていく範囲を一度見送ってまた描ける姿は駆け寄る姿は美しかった
1929.5608	1.3200	overt	1929.5700	2315473	私たちをつなげ
1976.4208	7.0200	overt	1976.4300	2371705	物は空であるそれでも生きる意味を模索することをやめない私はこの結末にそんな声を聞いた
1987.1908	8.1300	overt	1987.2000	2384629	ここでは結末こそが出発であるのである奈良の景色と言葉このニつに支えられてこの作品は
2004.2908	2.4000	overt	2004.3000	2405149	出立し続けるだろう
2025.7708	7.2600	overt	2025.7800	2430925	吉原の漫画の語り口は一年少と言いましょうか駒の右上か左上の湯白にナレーションをつけて
2036.9308	4.9800	overt	2036.9400	2444317	展開していくものが多いです私も現在も広く読まれている
2042.4508	10.0500	overt	2042.4600	2450941	月間漫画柄の作品は随筆的気候分的と評されることが多かったのですがそれは要するにこれまでの漫画とは違ったやり方で
2053.9108	4.1400	overt	2053.9200	2464693	生活を描くスタイルを編み出したということです
2058.5908	1.3500	overt	2058.6000	2470309	すげえ吉原の
2062.9108	1.1700	overt	2062.9200	2475493	的なスタイルは
2065.3108	4.9500	overt	2065.3200	2478373	安部真一鈴木王子をはじめがろの作家に
2071.3408	4.2600	overt	2071.3500	2485609	影響を与えました大山先生が初めて描きそして
2084.9908	5.5800	overt	2085.0000	2501989	大山先生は大山先生だから昭和ヨンジュー年代の作家と比較しても仕方ないのですが
2091.6208	6.3000	overt	2091.6300	2509945	長編作品への思考があることそしてデビュー作から島案外のスタイルで他人との出会いを
2101.9708	5.8500	overt	2101.9800	2522365	描こう者の志向がデビュー時からあるから第ニ話
2108.6908	1.6500	overt	2108.7000	2530429	ヨン話の軍上撃
2110.8808	3.9900	overt	2110.8900	2533057	普通のガロケーの主漫画だと
2115.6508	5.4000	overt	2115.6600	2538781	作者とおもしき登場人物の身辺生活がぐるぐると延々
2124.5908	1.4400	overt	2124.6000	2549509	描かれることになり
2130.5008	1.4100	overt	2130.5100	2556601	内島すみれの湯
2132.6608	7.5300	overt	2132.6700	2559193	トートロジーにとらわれることになるのでしょう少し微妙なところなのですが親の先生は初めからその危険性が
2140.8508	11.7000	overt	2140.8600	2569021	回避されていたように思えるのですだからからかろ界隈に居続ける人ではなくそのうち青年死に行くんだろうなと東部を読んだ時に思ったのです
2154.3208	3.3000	overt	2154.3300	2585185	長編漫画を描けていない理由もそこにあるのです
2174.4808	8.9400	overt	2174.4900	2609377	風景の執着がありますが露時代の杖吉原なら細かく畳の目を描く行為がそれであり大山においては奈良の風景にそれがあります
2185.2808	7.8600	overt	2185.2900	2622337	大山先生は有名な寺を描くにしてもどうでもいいような角度から描くでしょうそういうところがいいと思います
2201.0308	6.7800	overt	2201.0400	2641237	四万がというとまるで自己愛の強さからそうなっているようですがそれとは逆で事故を滅却させる方法でもあるのです
2208.6808	5.2500	overt	2208.6900	2650417	自分を素材として扱っているわけですから杉吉治の場合は例えば
2225.4208	2.2800	overt	2225.4300	2670505	もちろん奈良への冒頭のシネフィルト
2228.2408	1.5600	overt	2228.2500	2673889	私は別人ですよ
2234.7808	4.5900	overt	2234.7900	2681737	大山先生もあれは川勝じゃなくて別の人とおっしゃってました
2250.5608	5.0400	overt	2250.5700	2700673	私はカールドライヤ監督の話なんて人にしないのでその通りだと思います
2263.7608	4.4100	overt	2263.7700	2716513	それはともかくメジャー市に行くといいと言ったのは
2268.8008	1.3500	overt	2268.8100	2722561	大山先生は
