onset	duration	trial_type	wav_onset	sample	value
2272.2808	2.3100	overt	2272.2900	2726737	患病者で他人を描けるので
2275.3108	8.7600	overt	2275.3200	2730373	普通に読める文条劇に議題できると思ったのですだから正直当地よりも大手出版社の青年誌に行くのがいいと思ってました
2284.9708	14.3400	overt	2284.9800	2741965	たくさん稼げるだろうしでも漫画に描かれていることを信じるなら実際にメジャー市に持ち込みに行ったりしていたのかもしれません原稿を買ってくれないのは単に柄と仕上げの問題だけな気もするけれど
2466.4708	3.6300	overt	2466.4800	2959765	彼は東部の頃からし漫画でよく扱われる
2470.6408	1.6800	overt	2470.6500	2964769	ですよ
2473.3408	9.3600	overt	2473.3500	2968009	情勢や内省的な表現よりもグロテスクな起草や暴力への活望があったように思います
2485.4008	12.8400	overt	2485.4100	2982481	もっと分かりやすく派手なホラーアクション寄りのエンタメも描きたそうに見えたのでそこに長編への思考が加わるとどうしても語りの構造を複雑にしなければなりません
2498.9008	5.9700	overt	2498.9100	2998681	そこで市漫画の一年少の語りを複数使用することになったのでしょう
2505.8308	8.2800	overt	2505.8400	3006997	町田さんの言うところの文献となるのです
2515.4308	3.3000	overt	2515.4400	3018517	撮った方法論だと思います
2521.2508	3.4200	overt	2521.2600	3025501	バルガスでもいいし巨匠と
2525.2408	2.1600	overt	2525.2500	3030289	マルガリータでも最近なら
2528.3608	10.1400	overt	2528.3700	3034033	でもいいといいですけれどニつの世界を交互に描写していく語りはいろいろな可能性がありますね習え
2544.0508	5.4300	overt	2544.0600	3052861	交互にではないですがこの橋渡しのやり方が文学的だと思いました
2550.4108	6.6300	overt	2550.4200	3060493	文学的だというと何か難しいことを言ったり合間の表現を使うことだと取られる向きがあるのですが
2557.6408	2.7900	overt	2557.6500	3069169	現代文学の持つ堅老な構造
2561.0908	2.7900	overt	2561.1000	3073309	それ自体に私は惹かれることが多いので
2564.6008	2.3100	overt	2564.6100	3077521	とても好ましいやり方だと思いました
2573.9908	5.5200	overt	2574.0000	3088789	私は作者と知り合いなのでどうしても先輩風邪吹かしてるみたいな文章になってしまうのですが
2580.3508	5.6400	overt	2580.3600	3096421	ニジューゴ歳でこんな漫画描いてしまって本当の立派だと思います自分が恥ずかしくなります
2586.5908	2.8800	overt	2586.6000	3103909	本木ごもり立派な漫画を描いてください
2590.4308	5.5500	overt	2590.4400	3108517	予言ですが次回作の令和元年の
2596.7008	4.3200	overt	2596.7100	3116041	エズクロシーはそのうち映像化されると思いますとてもかなりません
