onset	duration	trial_type	wav_onset	sample	value
1.6258	4.4400	overt	1.5900	1951	緑色の手名探偵明智小五郎は
6.6358	18.0600	overt	6.6000	7963	博物館長の行方が知れなくなってから大変忙しくなりました警察の手助けをしてこの大事件の取り調べにかかりきりになっていたのですアメリカと日本に同じような円盤事件が起こったのでアメリカと
24.6958	18.0600	overt	24.6600	29635	アメリカの警察から数名の係官が飛行機で東京へ飛んできましたし日本の警察官もアメリカへ飛びましたそしてお互いに事情を調べ相談しあってこの星の世界の怪物を捉えようとしたのです
44.2858	11.0400	overt	44.2500	53143	赤市探偵はその東京での相談の席にたびたび呼ばれて意見を聞かれましたそんなことで事務所にいることはめったにないのです
56.8558	5.4000	overt	56.8200	68227	ある日明智探偵は助手の小林少年を呼んでこんなことを言いました
62.7658	17.1000	overt	62.7300	75319	僕は博物館の事件で少しも暇がないがあの平野君という少年のことがなんだか気がかりなんだあの少年にはバイオリンの天才と言われている美しいお姉さんがあったね君は
79.8658	17.1000	overt	79.8300	95839	君は平野君とお姉さんのことをよく注意してくれたまえ毎日平野君のうちへ遊ぶに行くんだねそして何か変わったことが起こらないか気をつけているんだ君は当分それだけやっていればいい頼んだよ
97.7458	6.7500	overt	97.7100	117295	小林少年はその日からせっせと平野少年のお家へ遊びに行くようになりました
105.0358	13.2300	overt	105.0000	126043	平野少年も小林君が大好きでしたから学校から帰ると小林くんの来るのを待ち構えていてお話をしたり理科の実験をしたりして遊ぶのでした
118.9558	5.8500	overt	118.9200	142747	近所の北村さんも時々やってきてニ人に面白い話を
125.3158	1.1400	overt	125.2800	150379	聞かせてくれました
127.2958	13.1100	overt	127.2600	152755	平原さんというのは丹沢さんの円盤の中に一月閉じ込められていたあの青年ですですからそのお話は自然宇宙海人のことになるのです
140.9458	5.7900	overt	140.9100	169135	ニ人の少年は胸をドキドキさせながら宇宙になってそれを聞くのでした
147.6958	14.0400	overt	147.6600	177235	平野君のお姉様のゆりかさんは音楽学校をまもなく卒業するのですが今は学校がお休みで毎日お家にいるものですから小林君が遊びに行くと
162.3658	7.9200	overt	162.3300	194839	弟の平野少年と一緒に自分の部屋へ呼んでマイオリンを弾いて聴かせてくれるようなこともありました
170.9758	5.6100	overt	170.9400	205171	小林君はこのゆりかさんとも直にお友達になってしまいました
177.1858	10.0500	overt	177.1500	212623	平野少年もきれいな顔の子供でしたがお姉様は小林君が今まで一度も会ったことがないようなきれいな人でした
187.8958	3.0000	overt	187.8600	225475	顔を見るのもまぼしいほど美しいのです
191.4058	8.1300	overt	191.3700	229687	そのゆりかさんがバイオリンを引き出すと小林くんはうっとりと夢を見ているような気持ちになりました
200.1058	7.8000	overt	200.0700	240127	ふわふわと五色の雲に乗って天へ登っていくような何とも言えない楽しい気持ちになるのでした
208.7158	10.8300	overt	208.6800	250459	イチ週間ほどそうしたそういう楽しい日が続きましたがある夕方のこと小林君は実に恐ろしいものを見たのです
220.1758	8.0400	overt	220.1400	264211	この美しい獲物を狙う悪魔の姿が夕闇の中に末廊として立ち現れたのです
228.8458	12.4800	overt	228.8100	274615	ある夕方ゆりかさんのバイオリンを聞きおいしいお菓子を呼ばれた後で小林少年は平野君と別れて平野君のおうちの門の外へ出ました
242.1358	6.0300	overt	242.1000	290563	夕闇が迫って昼でもない夜でもないというあのネズミ色のひとときでした
248.7058	11.4000	overt	248.6700	298447	その辺りは広い屋敷ばかりが並んでいる街で両側には行き書きやコンクリート塀がどこまでも続いていて人通りは丸でありません
260.6758	3.6000	overt	260.6400	312811	死因として海の底のような静けさです
265.0858	9.6600	overt	265.0500	318103	小林君がひょいと門を出ますと平野君のおうちの塀にぴったり身をつけて一人の男が立っているのに続きました
275.4058	3.8100	overt	275.3700	330487	まるでヤムリのように塀にくっついているのです
279.9358	14.6400	overt	279.9000	335923	変な奴だなと思ってじっと見ていますと男の方でも小林君に気づいてはっとしたようにいきなり向こうへ歩いていきます逃げていくのです怪しいやつです
296.8558	4.6500	overt	296.8200	356227	小林君は少し間を置いてその男の跡をつけました
302.1358	2.6700	overt	302.1000	362563	夕闇なの夕闇の中ですから
305.3758	6.3600	overt	305.3400	366451	お互いの姿もはっきりとは見分けられないほどで尾行してもさほど目立ちません
312.3058	6.4500	overt	312.2700	374767	その男はダブダブのネズミ色のオーバーを着てネズミ色のソフトをかぶっていました
319.2958	8.2800	overt	319.2600	383155	小林君が尾行をするのを知っているのか知らないのか男は後をも見ずにとっとと歩いていきます
328.1458	4.9800	overt	328.1100	393775	しばらく行くと一方の兵が途絶えて広い空き地に出ました
333.6358	6.1800	overt	333.6000	400363	その真ん中に古い菓子の毛が空いっぱいに枝を広げてそびえています
340.4758	11.4300	overt	340.4400	408571	小林君は気がつきませんがこれはいつかの夜トカゲ怪人が茶色の洋服を着て高い枝に腰掛けていたあの菓子の木です
352.4158	8.8200	overt	352.3800	422899	ネズミ色のオーバーの男はその菓子の木の方へ歩いていきましたがふと気がつくともう姿が見えません
361.9558	8.3100	overt	361.9200	434347	菓子の木の大きな幹の陰に隠れたのではないかと小林君はそっとその方へ近づいていきました
371.0458	9.5700	overt	371.0100	445255	広っぱの隅に街灯がついていてその光が苔の吐いた太い太いカシの木の幹をもんやりと照らしています
381.6058	14.1750	overt	381.5700	457927	小林君はその幹の前に立つとさっきの男はきっと向こう側に隠れていると思ったので向き足でそっと幹を回って向こう側を覗いてみました
395.7808	14.1750	overt	395.7450	474937	そこはまるでかくれんぼうでもするようにその幹の後ろに体をくっつけて立っていましたそして小林君が覗くのを待ち構えていたようにひょいとこちらに顔を向けました
410.7058	11.9550	overt	410.6700	492847	ああその顔小林君は頭の毛がさっと音を立てて逆立つような気がしましたそれは銀色の顔だったのです
422.6608	11.9550	overt	422.6250	507193	真っ黒な穴のような目三日月型に急と笑っている口そしてその口から人間の声とはどこか違った変な声が漏れてきました
435.1858	5.9100	overt	435.1500	522223	君小林だろ知ってるよ明智探偵の弟子だろそうだろう
441.7558	7.1700	overt	441.7200	530107	小林君はあまりの恐ろしさに舌が喉へくっついたようになって声を出すことができません
449.8858	14.2500	overt	449.8500	539863	北村が明智のとこへ行って話したことも知ってるよ何でも知ってるよ僕は地球の人間よりヒャク倍賢いよ分かるだろうだけど君かわいいね
467.4358	7.0800	overt	467.4000	560923	怪物はそんなことを言ったかと思うといきなり右手を出して小林くんの方をなれました
475.0258	1.1700	overt	474.9900	570031	ああその手
476.7058	13.3200	overt	476.6700	572047	カエルの手をセン倍も大きくしたような水かけのある緑の色の手でした冷たくてぬるぬるしてなんだか生臭いような嫌なにのする手でした
490.8658	9.0600	overt	490.8300	589039	震えているね怖いのか怖くないよ何もしないよ君には何もしないよさよならさよならさよなら
500.5258	7.2000	overt	500.4900	600631	怪物はそのままカシノキの幹の裂け目に足をかけて上の方へ登っていきました
509.7958	3.0300	overt	509.7600	611755	この葉の中へ姿を隠してしまいました
513.4258	9.6600	overt	513.3900	616111	しばらくずっと上の方でガサガサと音がしていましたがやがて木の上からサーッと恐ろしい風が吹きつけてきました
523.7158	4.5300	overt	523.6800	628459	オーバーを脱いでコウモリの羽を広げて羽ばたきしたのでしょう
528.9958	7.8300	overt	528.9600	634795	その頃になってコワシ君はやっと正規に帰り君の木の幹を離れて暗い空を見上げました
538.4758	4.7700	overt	538.4400	646171	空には宇宙海人が大きな羽を広げて飛び上がっていました
544.0558	6.7200	overt	544.0200	652867	ブーンという妙な音がしましたそして怪人の姿はだんだん小さくなって見る間に
551.7958	9.0600	overt	551.7600	662155	夕闇の空へ溶け込んでしまいましたさすがの小林少年もこんな恐ろしい思いをしたのは初めてでした
561.4258	10.0050	overt	561.3900	673711	人間ならばどんな悪者でも怖くはありませんしかし今度のやつは人間ではないのです人間のヒャク倍も賢く
571.4308	10.0050	overt	571.3950	685717	小林君は思わずほっとため息をついてその場にしゃがみ込んでしまいました
582.6658	5.2800	overt	582.6300	699199	名探偵の明智小頃でもこんな怪物にはかなわないかもしれません
588.4858	6.2700	overt	588.4500	706183	まして少年の小林君にはもう手も足も出ないような気がしました
