onset	duration	trial_type	wav_onset	sample	value
2203.5850	13.8900	overt	2203.5900	2644302	おろかだと思うだろうでも自分の人生に何の価値も感じなくなったやつらは応々にして小指の先ほどの快楽を得るためにためだけに全てをぶっ込むんだよ
2219.4250	7.1100	overt	2219.4300	2663310	私は階段を上りつつそう答える三好は暗い顔をしてうなだれている
2227.5550	12.8100	overt	2227.5600	2673066	この街で警察の仕事を真面目にやるつもりならそういう奴らばかり相手にすることになるぜあんたの想像なんかを及ばないような行動ばかりする連中さ
2251.4950	14.3100	overt	2251.5000	2701794	私の声に彼女は顔上げ彼はあなたの名をああちょっとした知り合いだ昔はちょっとした事情通でねよくヘドロ団地の情報を売ってくれたんだよ
2266.5850	13.6200	overt	2266.5900	2719902	あんたと同じくらいの年じゃないかな当時は売れっ子のゲイボーイであちこちの金持ちにチヤホヤされていたもんだよ偉い美少年だったんだぜまあ今は
2282.1250	2.9400	overt	2282.1300	2738550	見る影もないがそうですか
2287.9750	13.7400	overt	2287.9800	2745570	よしはちらと後ろの方を振り返りそしてまた私の方を見ると口を開きかけて何か言おとしたものの結局言わず口を閉ざした
2302.4350	19.1700	overt	2302.4400	2762922	建物の中は静かだった誰かと出会ったらややこしくなると考えていたが最初の男以外は誰ともすれ違うことなく目的のドアの目の前までたどり着いた表札は名前を記入したカードを差し込むタイプのもので一見すると真っ白に見えて
2321.6050	19.1700	overt	2321.6100	2785926	近づいて目を凝らすとインクの消えかけた文字で灰紙と書かれているのが確認できた間違いないな私がつぶやくと三好の連れの男がドアに耳を押し当て中に人気がないのを確認すると私たちに向かってうなずいた
2341.9150	8.0100	overt	2341.9200	2810298	そしてドアノブをひねるが鍵がかかっていて回らない代わりに私がドアノブを握る
2358.0850	4.5900	overt	2358.0900	2829702	中和剤によって能力が解放された私の手にかかれば
2366.5750	4.9500	overt	2366.5800	2839890	たとえ鍵がかかっていようともいなくとも同じようにガチャリと開く
2373.6850	5.1300	overt	2373.6900	2848422	それを見て加藤は感心したような飽きれたような視線を私に起こす
2379.8950	4.1700	overt	2379.9000	2855874	ドアが開かれると玄関の光景が目に入り
2389.7350	2.5200	overt	2389.7400	2867682	そして部屋の中の空気が
2394.7450	3.4200	overt	2394.7500	2873694	俺出てる匂いがわずかに鼻先にに酔った
2402.3650	7.7400	overt	2402.3700	2882838	私には堂島ほどの鋭い嗅覚はないけれども若い女の持つあの独特の匂いであることは分かった
2418.0250	8.3100	overt	2418.0300	2901630	ドアの内側には郵便受けがついている私はまずそこへ手を突っ込んで探ったが何も入ってはいなかった
2427.0550	12.3150	overt	2427.0600	2912466	手探りで電源スイッチを入れ土足のまま廊下へ上がるこのような集合住宅は大体どの部屋も同じような構造を知っているものだ
2439.3700	12.3150	overt	2439.3750	2927244	そしてこのヘドロ団地には一種類の間取りしかないかつて何度も訪れていた私は前もって調べなくともどこにどういった部屋があるのかを知っていた
2452.6750	2.9700	overt	2452.6800	2943210	玄関を入るとすぐ老化になっている
2459.7250	4.2900	overt	2459.7300	2951670	足を踏み入れてすぐ右手のドアは
2465.2450	6.1800	overt	2465.2500	2958294	ロク畳の洋室その奥の突き当たりにはさらに
2472.0850	1.8600	overt	2472.0900	2966502	サンつのドアがあり
2489.7250	7.1700	overt	2489.7300	2987670	右のドアがジューニ畳のリビングルーム正面のドアがもう一つのロク畳満
2504.1250	5.2800	overt	2504.1300	3004950	左のドアは洋室とトイレにそれぞれ通じている
2519.0350	3.2100	overt	2519.0400	3022842	私はまず一番手前のドアを開いた
2532.5950	13.6500	overt	2532.6000	3039114	廊下側の窓からぼんやりとした明かりが差し込んではいるが薄暗い部屋だったそこは寝室として使われているらしくニ段ベッドと
2549.5750	4.3200	overt	2549.5800	3059490	ニ脚の木製の学習机が設置されていた
2554.4650	15.3000	overt	2554.4700	3065358	いずれも使い込まれたもので子供自体に買い当たれたものを今でも使用しているのだろうそして小さな時と同じ姉妹で同じ部屋で暮らしているのか
2582.6950	11.7900	overt	2582.7000	3099234	机にミュージシャンの写真が飾られたりベッドの上にクマのぬいぐるみなどが置かれているのを見るとごく平凡な年頃の少女の部屋という印象を受けた
2596.9450	5.0700	overt	2596.9500	3116334	次に廊下を進んで右側リビングルームへ通じるドアを開いた
2602.8550	11.0700	overt	2602.8600	3123426	大きな窓からレースのカーテン越しに真昼の太陽の光が差し込み部屋全体を明るく照らし出している
2620.6450	8.0400	overt	2620.6500	3144774	普通の居住スペースとして使われているらしく食卓やテレビなどが設置されていた
2629.5550	12.0900	overt	2629.5600	3155466	次に月当たりの六畳窓部屋であるこの部屋はこちらの部屋にも窓があり電灯をつけなくとも部屋の中が明るい
2643.7450	9.2100	overt	2643.7500	3172494	この部屋はハンガーラックや全身鏡棚などが置かれている物置兼石お部屋といったところか
2654.0950	7.2300	overt	2654.1000	3184914	そして最後にバスルームへつながるドアを開くと洗面台の前に置かれたままの化粧道具や
2662.1350	6.8100	overt	2662.1400	3194562	洗濯機の横のカゴに縫いだ衣服が突っ込まれているのが見えたが特別なものはなかった
2674.1050	3.4800	overt	2674.1100	3208926	私はまずリビングルームから調べることにした
2679.9250	11.6700	overt	2679.9300	3215910	部屋の中は雑然としており床の上にスーパーマーケットで買ってきたままのレジ袋が置かれていたりソファーの上に通学用の
2692.8550	3.1800	overt	2692.8600	3231426	革カバンがそのまま投げ出されている
2697.8950	3.0000	overt	2697.9000	3237474	すぐに帰ってくるつもりで出かけて
2701.9150	3.1500	overt	2701.9200	3242298	そのままになっているといった様子だ
2718.3250	5.1300	overt	2718.3300	3261990	ケーブルの上にはストローが差し込まれた空のグラスが置かれており
2723.9950	11.2200	overt	2724.0000	3268794	太陽の光がうっすらと積もった誇りを目立たせているどう見ても普通のこの部屋ですね三好が独り言のようにつぶやいた
2740.5550	5.4600	overt	2740.5600	3288666	確かに彼女の言うとおりで必要最低限の生理整頓や
2746.6750	14.8950	overt	2746.6800	3296010	掃除は行われておりカーテンの柄や部屋のあちこちに置かれた可愛らしい小物などは精神に異常な偏りのある少女たちの部屋とは思えない履歴を見てもいたずらは多かったですが深刻
2761.5700	14.8950	overt	2761.5750	3313884	深刻な飛行はありませんでしたし何かたぶらかされて子姿と共に行動しているのでしょうかさあどうだろうね何にしてもこの双子が子市への協力者であることは変わりがない
2777.1550	14.5200	overt	2777.1600	3332586	それよりさっさと手がかりを探そうタブレットやパスコンなどの端末か携帯電話の請求書でもいいその手の個人情報があれば手っ取り早く必要な情報にアクセスできる
2793.2650	9.1500	overt	2793.2700	3351918	学生ならば何かしらの電子機器に囲まれそれらを利用して生活しているはずだ
2803.1050	4.3800	overt	2803.1100	3363726	それらの危機は常に持ち主の行動を記録しており
2825.2450	6.7800	overt	2825.2500	3390294	それらの危機は常に持ち主の行動を記録しておりそして私はそれらの危機から
2832.7150	11.7600	overt	2832.7200	3399258	持ち主でさえも観覧できないようなデータをに触れられる我々は棚に積まれたワイチクの若者が発行している
2846.2450	15.9900	overt	2846.2500	3415494	身に込み紙をめくったり少女向けのキャラクターのステッカーが貼られた棚を開けたりして部屋のあちこちを調べそしてテレビの横に置かれたミント色のトートバッグの中から薄型のノートパソコンを見つけた
2867.4250	6.7200	overt	2867.4300	3440910	そのパソコンにもやたらシールがやたらとシールがやたら
2874.8050	3.5400	overt	2874.8100	3449766	やたらとシールやらがベタベタと貼られている
2880.5950	5.4000	overt	2880.6000	3456714	学校の優等生といえばこうした無駄な装飾はしないようなイメージがあったが
2886.5050	3.2400	overt	2886.5100	3463806	双子はそれには当てはまらないのだろう
2933.1850	7.9200	overt	2933.1900	3519822	いやもうそうだが少女趣味というかどこか幼い印象を覚えていたバッテリーが切れていて
2942.0950	17.9400	overt	2942.1000	3530514	ボタンを押しただけでは起動しなかったので電気コンセントにケーブルをつなげて押し直す起動して現れた画面は外装のごてごてとした装飾とはうって変わってホルダーやショートカットが機能的に並べられたデスクトップだった
2961.5650	8.7900	overt	2961.5700	3553878	学校のレポートを作成したり授業のノートを取るのが主な目的らしくそれらのファイルやソフトが入っている
2971.5550	6.0000	overt	2971.5600	3565866	全く使用に使っていないのならばここから手がかりを得るのは難しい
2981.7550	11.0100	overt	2981.7600	3578106	しかしインストールされたアプリの一覧を表示させたところで携帯電話との連携機能を使うためのソフトを見つけることができた
2997.8950	6.6900	overt	2997.9000	3597474	それを起動させると本人年収を求める画面が表示されるいけそうだ
3005.6350	6.8700	overt	3005.6400	3606762	両隣に私を挟むように座って画面を覗き込んでいるニ人の警察官にそう言った
3017.8750	17.4900	overt	3017.8800	3621450	この画面が現れるということは一度でもこのソフトを使ったということだとなれば携帯電話が記録している様々な情報にこのパソコンからアクセスすることができるこのソフトで採用されている認証方式はひとみの
3035.8750	3.0900	overt	3035.8800	3643050	交際と指の静脈といった
3039.9250	7.3500	overt	3039.9300	3647910	バイオメトリックスを利用したもので
3048.9850	7.0800	overt	3048.9900	3658782	本来ならば本人以外が不正にパスするのは困難なものだろうが
3059.0050	10.2900	overt	3059.0100	3670806	私に対しては意味がないパソコンの乗脈スキャナーに人差し指を置きモニター上部に取り付けられた
3100.2250	1.5600	overt	3100.2300	3720270	本日は勝負
3102.6850	14.6700	overt	3102.6900	3723222	取り付けられたカメラを見つめると数秒でロックが外れたよしこれがあれば十分だろうメニュー画面を開き携帯電話の位置情報や通話記録の観覧可能なの
3118.3750	10.2600	overt	3118.3800	3742050	数学力が観覧可能なのを確認すると私はパソコンの電源を落とし上蓋を閉じた退散しよう長居してもろくなことはないパソコン
3128.6350	10.2600	overt	3128.6400	3754362	心を小分けに抱えると三好たちに見くばせをすると彼らもうなずけを返す私たちは部屋を出てドアを閉める
3139.4350	2.3700	overt	3139.4400	3767322	早足で階段を下り
3162.2950	14.5800	overt	3162.3000	3794754	一回まで来るとさっき会話を顔した男がさっきと同じような姿勢で会談に持たれてぐったりとしている今度は先ほどのように話しかけることもなく顔を上げようともしない
3200.4250	12.6300	overt	3200.4300	3840510	死んでしまったのか眠っているだけか私たちサン人は確かめようとはせずに無言でその秋を通り過ぎた建物を出て江泥団地の
3218.3650	7.7400	overt	3218.3700	3862038	さっき屋上にいた若者たちはどこかへ行っており帰りは誰とも出会うことがなかった
3237.6250	12.1200	overt	3237.6300	3885150	十分に団地を離れたところで三好は大きくため息をついたが私は気がつかないふりをした駅の反対側にある警察署の演出でパソコンの検証作業を行った
3249.7450	12.1200	overt	3249.7500	3899694	多くの刑事が私の能力の行使を見に集まってくるのが矢島のようで煩わしかったが気にしている場合ではなかった
3265.5250	7.1400	overt	3265.5300	3918630	携帯電話のGPS履歴は端末から主導で消去されていた
3275.6950	4.6500	overt	3275.7000	3930834	現在は昨日自体が停止しており所在地を確認
3306.5350	5.1600	overt	3306.5400	3967842	現在は機能自体が停止しており所在地を確認できない
3312.4750	11.4750	overt	3312.4800	3974970	ハイガミたちは万が一のことを想定して消したのだろうが私にとっては意味がなかったこのデータはユーザーが消去しても会社のサーバーにをしばらくの間
3323.9500	11.4750	overt	3323.9550	3988740	双子の携帯電話の製造番号さえ分かっていれば私にとっては自分の引き出しを開けて
3360.6250	18.4800	overt	3360.6300	4032750	双子の携帯電話の製造番号さえ分かっていれば私にとっては自分の引き出しを開けて雨玉をイチつ取り出すくらいの手まで観覧することができる昨日はイチ週間ほど前に停止したようだがそれまでのGPSリレッキは残されていた
3379.7950	9.3900	overt	3379.8000	4055754	そこから彼女たちが何度も足を運んでいる場所のうち学校や自宅などのすでに明らかになっているものや
3392.1250	6.4800	overt	3392.1300	4070550	飲食店などの利用目的が明白なものを除外すると一つの場所が浮かび上がる
3401.7550	3.4800	overt	3401.7600	4082106	ここに何度も足を運んでいるようですね
3406.1650	2.6400	overt	3406.1700	4087398	三好が画面の一点を指さす
3439.9750	13.2600	overt	3439.9800	4127970	三好が画面の一点を指すカストロ通りの北側の地域にある一軒家にここ最近の双子はなぜか頻繁に訪れ滞在をしているどうやらかし絵のようですね
3455.1550	3.9900	overt	3455.1600	4146186	その建物を調べた別の警察官がそう報告した
3460.0450	17.3700	overt	3460.0500	4152054	愛知区内で営業する不動産管理会社の自社物件で問い合わせてみると音楽家の女にイチか月ほど前から貸しているのだという音楽家の女私が尋ねると新藤瞳と名乗ったそうです瞳か
3479.4250	13.0500	overt	3479.4300	4175310	道島の話である程度の予期はしていたがここでこうつながってしまうと私も逃が苦しい思いを隠せなかった
3493.0450	12.5550	overt	3493.0500	4191654	あなたが出会ったことのある女ですね 三好がそう言ったので一瞬驚いたしかしよく考えれば彼らは堂島の疑願を通して通じて
3505.6000	12.5550	overt	3505.6050	4206720	彼の見聞きしたものを全て共有することができるのだつまり私が人見と寝てそこで漏らした情報からコッシェたちが私の家を襲撃したことも知っているというわけだ
3520.9450	3.8400	overt	3520.9500	4225134	この建物を調査しましょう
3525.4150	9.2700	overt	3525.4200	4230498	次の捜査対象が見つかった三好は私の内心の屈択には気づかず興奮気味にそう言った
3535.3750	14.4450	overt	3535.3800	4242450	現場の捜査には路地さんも同行していただけますね私の方を振り返りそう念を押すもちろんだ私はそうなずいた翌日の昼下がり早速人と
3549.8200	14.4450	overt	3549.8250	4259784	そこをその場所へ向かうこととなった今回はヘドロ団地と違ってコシチェ及びハイガミ姉妹との遭遇が予想される
3565.4350	10.3050	overt	3565.4400	4278522	捜査員たちは総勢ジューゴ名ほどで対サイキック用の装備を身につけているが私としては鼻肌心もとないサイキックと戦うためのための
3575.7400	10.3050	overt	3575.7450	4290888	特殊部隊のようなものは分にはあるが警察にはないとのことで今回の事件では動員の許可が出ていないのだという
3587.7850	6.6000	overt	3587.7900	4305342	その代わり私たちでも使用可能なもので最も効果的な装備が与えられています
3607.9150	10.5450	overt	3607.9200	4329498	三好が言うにはUT剤の噴霧器が対応されているというそれは私につき該当吉UT弾にも使用する
3618.4600	10.5450	overt	3618.4650	4342152	あのサイキックの能力を封じる薬剤を機体上にして周囲に噴霧する装置である
3630.4750	7.7700	overt	3630.4800	4356570	この装置を作動させれば周辺のタイプAは一切の能力を使えなくなる
3639.6250	5.7600	overt	3639.6300	4367550	政治家の国際会議の場などでも用いられる非常に高価な道具だ
3653.3950	14.6100	overt	3653.4000	4384074	素晴らしいがそんなものを振り巻きながら操作するとなると私も役立たずになるな外でおとなしく待っているということか路地さんにはマスクを装着して同行していただきます
3669.3550	8.6400	overt	3669.3600	4403226	突入時や現場の操作時にその能力が非常に有用だという話になりまして
3679.0450	9.3000	overt	3679.0500	4414854	OKそれでいいここで私を置いていくと判断するようならあまりにも無能だと怒ってやるところだった私学習すると
3688.8550	6.4800	overt	3688.8600	4426626	三好はあからさまに顔をしかめるともあれそうして我々は速やかに現場へと向かった
3701.8450	11.4000	overt	3701.8500	4442214	目的の建物がある地域にはかつてこの地に基地ができる前から北沼という地名がついているが
3713.9650	9.1200	overt	3713.9700	4456758	ついてはいるが現在はそれらしい地形は存在しない滑走路通りに近いが住宅の大い地域である
3732.0850	8.5800	overt	3732.0900	4478502	観光客はあまり入り込まず住民を相手にした飲食店や日常品店が目につく
3741.4450	9.7500	overt	3741.4500	4489734	私たちはヨン台の車へ分譲してそこへ向かったもちろんサイレンなどんな嵐をしない警察が多数集結しているということを
3757.1650	6.3900	overt	3757.1700	4508598	そうした大将はもとよりワイ地区の住民たちにもできれば知られたくはなかった
3773.7850	10.5600	overt	3773.7900	4528542	ヨン台の車をそれぞれ所定の位置に止めると捜査員たちは連絡を取り合いながら持ち場へと移動するこの辺りの建物はごちゃごちゃと揺るくんでいる
3784.3450	10.5600	overt	3784.3500	4541214	どこか遠くのビルから目的の建物を観察することもできずその状況を知るには直接近くまで行くしかなかった
3810.0850	3.2100	overt	3810.0900	4572102	私は突入係の捜査員たちと
3817.4650	1.1400	overt	3817.4700	4580958	ともにいた
3819.6850	9.9900	overt	3819.6900	4583622	建物は雰囲気のある洋館で比較的経済力のある外国人利用車を想定して建設されたものだろう
3839.2450	9.3900	overt	3839.2500	4607094	家賃はそう安くはないようだが支払いは適切に行われているらしく子市営は逃亡生活の割には豊かであるようだった
3849.2050	11.9100	overt	3849.2100	4619046	いつ急悪なタイプAたちと遭遇するかもしれないという極度の緊張感の中捜査員たちはひそやかに
3862.2550	9.1800	overt	3862.2600	4634706	建物を包囲するそして私が事前に手渡されたガスマスクを装着するとUT剤の噴霧が始まった
3872.0050	2.7900	overt	3872.0100	4646406	その装置はちょうど
3879.9850	11.8500	overt	3879.9900	4655982	消火器のような形状している風がない室内ならばサンジュー秒の散布でおよそゴ分間ほどはその場に薬剤が滞留するらしい
3893.4250	7.4700	overt	3893.4300	4672110	サン台の噴霧器でそれぞれ別の方向から建物に向かって噴霧
3901.8250	3.1200	overt	3901.8300	4682190	散布を行ったのち
3905.7850	6.8100	overt	3905.7900	4686942	三好がニ人の捜査員と共にドアの前に出てインターホンをした進み出て
3926.6350	3.9600	overt	3926.6400	4711962	移動して誰も出ない見押しの合図によって
3932.7850	1.1400	overt	3932.7900	4719342	すみ出て
3936.4450	16.6500	overt	3936.4500	4723734	私はドアの前に立ち他の捜査員たちが懐の拳銃を取り出したのを確認しながらそっとノブをひねるそうして開いたドアの向こうには鮮やかな模様の絨が敷かれた玄関ホールがあった
3953.0950	16.6500	overt	3953.1000	4743714	我々はその都度UT材を踏むしながら建物の操作学を行った建物はひっそりと静まり返りどの部屋にも人の気配が感じられない恐ろしく物のない家だった
3976.3150	12.6000	overt	3976.3200	4771578	家具はおそらく備え付けのものだろうそれらの棚はほとんど空っぽで利用されていないかといって生活感がないわけではなくコートハンガーに帽子と
4024.3150	18.5400	overt	4024.3200	4829178	コートハンガーに帽子と上着がかかっているのを見つけたり机の上に折り畳まれた英字新聞などを見つけることはできたここには誰が住んでいるのだろう彼はあの人見という女だが彼女もここに住んでいるのだろうか
4043.6950	5.9700	overt	4043.7000	4852434	その疑問はニ階にある部屋のドアを開いた時に解決した
4051.6450	1.2600	overt	4051.6500	4861974	そこは
4053.6250	3.9600	overt	4053.6300	4864350	寝室らしく部屋の中央にベッドがあり
4058.1250	11.4900	overt	4058.1300	4869750	そしてその訳に大きなスーツケースが転がっているそれはまさしくあの夜に女が持っていたスーツケースそのものだった
4070.8450	16.5900	overt	4070.8500	4885014	それは蓋が開いた状態で中には折り畳まれた黒いスーツがあったこれはコスチェの服だろうか結局建物はモヌケの殻で誰とも遭遇することはなかったしかしそれとは別に私たちは恐るべきものを見つけた
