onset	duration	trial_type	wav_onset	sample	value
5.6650	1.2000	overt	5.6700	6798	ああ
8.6350	1.9200	overt	8.6400	10362	ああああ
12.5350	3.4800	overt	12.5400	15042	あああ
20.2450	4.8900	overt	20.2500	24294	ああああ
25.9750	1.3500	overt	25.9800	31170	あああ
31.7050	1.5600	overt	31.7100	38046	ああああ
52.0150	13.6800	overt	52.0200	62418	相模姉妹の情報は知っていますか大体ねもともと有名人だがここ数日間私の方でも調べたが警察の持っている情報も知りたい
92.5450	10.1250	overt	92.5500	111054	そして三好が取り出す端末を受け取るそこにはハイガミ姉妹の調査報告書が表示されており生育環境から
102.6700	10.1250	overt	102.6750	123204	現在の状況やそれぞれのタイプAタイプB能力までが文字によって詳しく記されているようだ
119.7550	7.3500	overt	119.7600	143706	歩いたままでは揺れて読みにくいので私は足を止めてその細々とした資料にざっと目を通した
128.0650	1.3500	overt	128.0700	153678	姉の名は
136.2250	16.2000	overt	136.2300	163470	姉の名はリエコ妹の名はエリー子一蘭製ソーセージとして靴屋を営んでいたハイガミヤスヒコの家庭に生まれる
162.5950	10.7100	overt	162.6000	195114	幼いうちに不母を亡くし深澤佐藤市に拾われる深沢はヘドロ団地の取りまとめ役的な
174.5950	6.7800	overt	174.6000	209514	神仏でハイガミ乳と信仰があった模様
186.2950	13.6200	overt	186.3000	223554	それ以降ニ人はヘドロ団地で暮らす公務員として上京していた兄も職務中の事故によって亡くなってしまったため彼の遺族年金が現在も支給されている
200.8150	13.2300	overt	200.8200	240978	このために苦心はなく深沢の肥後科で生活中現在は地域外の学校へ通っている生成教授を取り立てて問題行動は見られない
224.7850	5.9100	overt	224.7900	269742	街での評判とは裏腹に優等生という評価しかし
231.9550	4.4100	overt	231.9600	278346	ここイチか月ほどは出席しておらず連絡もつかない
242.7550	13.6650	overt	242.7600	291306	姉のリエコはタイプA能力は離れたものを振れずに動かすというものいわゆるサイキッカー大きな力で動かすことはできないが距離に関してはかなり遠くまで影響を及ぶ
256.4200	13.6650	overt	256.4250	307704	ヘドロダンチナナ階の寿室の窓辺から路上で遊ぶ子どもの玩具を動かしからかったりしている様子が目撃されている
284.4250	10.0500	overt	284.4300	341310	肉体に特質変異は見られないため姉の霊子との識別が困難
296.4850	3.5400	overt	296.4900	355782	エリコかエリコはタイトB
305.2450	5.3100	overt	305.2500	366294	平行値は不明幻覚妄想などの症状は現在見られていない
311.6350	12.6600	overt	311.6400	373962	筋癖時の身体能力の向上が著しく片手で成人男性を投げ飛ばしたり素手で金属状を壁一時切って破壊したなどの報告がある
330.2350	1.2000	overt	330.2400	396282	ニ人とも
332.6050	13.7100	overt	332.6100	399126	論理的な思考能力を持ってはいるが精神面では同年代の症状と比較しても不安定であり特殊な生育環境の成果価値観の逸脱が見られる
348.6250	15.2850	overt	348.6300	418350	こういう関係はかつて町の不良グループに属し彼らと親しくしていたようだが高校に進学してからは彼らとの付き合いは薄れているこのグループにはYSのボスの息子のシャールをもいたが
363.9100	15.2850	overt	363.9150	436692	彼は町を出て大学へ進学したためやはり疎遠となった現在同時も殺害の共犯者として逮捕状が発行されているなるほど私は端末を名刺に返した
379.9450	19.3800	overt	379.9500	455934	はいがみ姉妹はコスチェにだまされているんでしょうかね可能性はある相手は百戦錬磨だからなしかしたとしても自分の行動に責任を持つべき年齢だ同情はしないさまあこの情報は役に立ちそうだでしょう
401.9050	2.8800	overt	401.9100	482286	何もしていなかったわけではないんです
405.6850	5.3700	overt	405.6900	486822	私たちだって行けるところにはあちこち足を運んで調べてはいるんです
417.8050	13.2000	overt	417.8100	501366	それよりコッシーの方はどうだ大島の旦那は能力もわからないと言っていたが今回の件で多少は情報が広いたろう現場をそのままにして逃げたんだからな
431.0050	13.2000	overt	431.0100	517206	トップシークレットだということを理解して聞いてもらえますかもちろんだ探偵はね依頼者の秘密は絶対に守るもんだ言ってから私は苦笑した
448.8850	18.1500	overt	448.8900	538662	もう廃業してから何年も経つのに今更探偵と名乗るのもおかしなものだ三好はそんな私の内心とは無関係に一人親准してそして加藤の方を見る
468.1750	1.1700	overt	468.1800	561810	よしは
470.3950	9.3900	overt	470.4000	564474	諦めて私に向き直った堂島刑事の右目が疑願だったのはご存じですかいいやはずの耳だね
483.3550	14.2500	overt	483.3600	580026	その右眼にはカメラが仕込まれていて彼が操作を行っている間その映像や音声は本書のサーバーに記録されています驚かれないようですね
498.2350	12.9000	overt	498.2400	597882	ニ人だけで話したことをあんたが知っていたからねそれに旦那はやたら一人で行動をしていたし前からそういった何かがあるんだろうとは想像していたよ
514.0750	11.7900	overt	514.0800	616890	そもそもね旦那レベルのサイキックはたとえ警察官だとしてもいや警察官だからこそ国家の監視対象にもなるもんだろう私は知りません
528.7750	8.2500	overt	528.7800	634530	不爽会しかし旦那も偉い鎖をつけられていたもんだ全く名実ともに国家の犬だったわけだね
543.8350	12.7800	overt	543.8400	652602	それでその偽眼によってあなたのアパートに足を踏み入れてから最後の瞬間まで全ての映像が記録されていたんですそういえば撃ったの旦那の様子がおかしかったな
558.5050	15.8700	overt	558.5100	670206	何か自信なさげだったそれと今までの犯行現場と状況が違うときにしていたそうでしょうね何が映っていたんだ時系列からするとまず堂島刑事は一人で部屋の奥に足を踏み入れた
575.5150	8.6100	overt	575.5200	690618	すると引き出しなどを物色するものがいて彼はその人物に対して発砲しますそして相手が倒れた後
586.0450	15.8700	overt	586.0500	703254	老島刑事はリビングに戻ってあなたと会話をしその最中に背中から刺されるわけですよねそうだったはずだったはずだがその時堂島刑事を刺しあなたのあなたと会話をしたのは白人青年でしたよね
606.1150	10.2900	overt	606.1200	727338	しかし堂島刑事が最初に部屋に踏み込んだ時に発砲したのは若い金髪の女でしたその映像は見られないのか
627.1150	5.9700	overt	627.1200	752538	この端末からはアクセスできません後でならちなみに服装は全く同じです
633.8650	10.0500	overt	633.8700	760638	それならやつの能力はその短い時間に入れ替わりを可能にするのかもするものなのかそれとも
644.4550	11.8050	overt	644.4600	773346	こちらの方が自然ですね断定はできないが可能性は高い大島の旦那は私が寝た女のタオルの匂いがコロコロ変化
656.2600	11.8050	overt	656.2650	787512	どうしたと言っていたそのことと複合するように思えるつまり越知恵が変身するたびに残りがも変化するんだ
671.0350	1.9200	overt	671.0400	805242	もし想像ぞれ
673.6450	15.3600	overt	673.6500	808374	変身がやつの能力だとすればあの女がその変身した姿だとすれば私は越地へ本人と寝たということになる事件が起こる前とはいえ堂島とみゆきを殺したその町本人と
689.9350	6.2400	overt	689.9400	827922	いや何でもない何でもないんだしかし変身能力を持ったサイキックか
696.8050	4.1100	overt	696.8100	836166	藤見がどうのと言っていたのも気になるな
701.5150	1.6500	overt	701.5200	841818	ただ言えることは
706.3750	12.6000	overt	706.3800	847650	相手がそういった能力を持っているなら君らがいくら道路を監視したところで相手をこの街に閉じ込めておくのは不可能だということだそれは
722.6950	4.7100	overt	722.7000	867234	それだけじゃないぞ我々の全く知らない姿で現れて
728.8150	18.3900	overt	728.8200	874578	一方的に攻撃してくることもありえるそうしたら我々は全滅だ対抗手段は存在しない多い生命保険にが入っているか家族のために今からでも入った方がいいぞ私がそう言うと三好は顔をしかめる
754.7950	13.3800	overt	754.8000	905754	あれだけの大けがをしたんだまだ動いてはいないだろうそれにコスチェは姿を変えられるとしても双子の方は不可能だからな少なくともあいつらはまだこの町にいる
768.8650	3.7200	overt	768.8700	922638	それが確実ならどうにでもなるさ
775.7650	12.7500	overt	775.7700	930918	江戸の団地やY地区の外苑にあるワイ地区にはにまだ基地があった頃はごく普通の市民が暮らす住宅として利用されていたが
789.4450	15.4350	overt	789.4500	947334	位置がなくなり今のワイ地区が形作られると地域の治安の悪化によってまともな住民は去ったそして代わりにワイチクの中心部にも住むことができないような立ちの悪い連中が集まり
804.8800	15.4350	overt	804.8850	965856	もうジュー年以上不法占拠している建物はひどくろを休かしており落書きだらけの壁にはひび割りや崩れが見られ多くの部屋はドアも
830.0350	13.4700	overt	830.0400	996042	ドアも窓ガラスもすでに失われていた半分廃墟のようであるが多くの人間が住み着き部屋のみならず廊下にも布や髪を経て寝転んでいる
865.1050	19.0800	overt	865.1100	1038126	建物の周辺もゴミが放置されおかしな髪型と服装をして目を金色に光らせたタイプBやら人間とも思えない特質変異を持ったタイプやら一目でまっとでないと分かる人間がへっきりなしに行き来している
895.9150	13.9650	overt	895.9200	1075098	まともな人間ならば遠くからその姿を見ただけでも恐れをなして離れたくなるような場所であるが今のワイチクの危険地域の多くが一見それほど危険とは気がつかない様子
909.8800	13.9650	overt	909.8850	1091856	予想をしているのと比べると見てそうと分かるだけまだマシなのだろう三好はその外観が見えたところで足を止め顔を蒼白にしている
932.6950	6.8700	overt	932.7000	1119234	街にまだなれぬ彼女もさすがにこの場所の悪標は散々耳にしているのだろう
965.5150	6.4500	overt	965.5200	1158618	彼女の年齢はどう見てもニジュー代そこそこといったところでその年齢で
972.7450	17.6850	overt	972.7500	1167294	捜査班長を務めているのだからいわゆるキャリアでしかも学校を出たての新米に違いないどうしてそうした身分で現場に出てきているのかは知らないが運のないことだ今回の事件は新米警視官でなくともノーマルには証明
990.4300	17.6850	overt	990.4350	1188516	少々にが重い仕事だかなりの確率で命を落とすことになるだろうもっともそれは私も同様だが行こうかもう暗いですよ構いえしないさ私が歩き出そうとしたところで彼女が引き止めるちょっと待ってください
1014.8650	6.9600	overt	1014.8700	1217838	身のしは言うとタバンから腕箱ほどの大きさの機械を取り出しそのスイッチを入れる
1022.9950	4.7700	overt	1023.0000	1227594	それは携帯型の指輪探知機だった
1030.5250	4.5600	overt	1030.5300	1236630	サイキック能力を感知するという触れ込みの機械だが
1037.8450	3.0300	overt	1037.8500	1245414	実際にはそれほど役に立つものではない
1041.5950	10.5450	overt	1041.6000	1249914	例えば見出すタイプのサイキックは全く感知できないミーダスというのはギリシア神話に登場する王の名前で彼は
1052.1400	10.5450	overt	1052.1450	1262568	王様の耳やロバの耳と医師によらず触ったものを全て金に変えてしまうという能力を授かったことで有名だ
1063.8550	3.5100	overt	1063.8600	1276626	もちろん校舎のエピソードが命名の由来だ
1078.6450	4.2000	overt	1078.6500	1294374	能力を行使しようと特別意識しなくとも
1083.5050	5.9400	overt	1083.5100	1300206	自動的に能力が適用されてしまうタイプのサイキックを見出すと呼ぶ
1090.7650	6.9900	overt	1090.7700	1308918	例えば堂島の超嗅覚もそうだし私の影焼けもそうだ
1098.4750	12.3150	overt	1098.4800	1318170	ルービー波巻機というものはサイキックが能力を使用するために特殊な集中をした時に発生する鉢を捉えるものであるだから集中を必要とせずに
1110.7900	12.3150	overt	1110.7950	1332948	まずに能力を発揮する発動する見出すタイプを発見することはできないコッシェの能力が見え出すかどうかは分からないおそらく肺が見え
1127.9950	4.8000	overt	1128.0000	1353594	リエコの能力を感知することはできるだろうが
1134.2050	14.1300	overt	1134.2100	1361046	感知器はあくまでも効果範囲内のサイキック本人に反応するものであって能力の作用そのものを感知するものではない
1153.1950	5.8800	overt	1153.2000	1383834	植木のそばの石ころを動かしたとしてもブザーはならないのだ
1159.7050	2.4900	overt	1159.7100	1391646	旦那はあまり使わなかったな
1164.8650	14.3700	overt	1164.8700	1397838	道島は不確かな道具に頼るより自分の超嗅覚や経験からくる直感を重視した私たちには彼のような特別な能力はありません三好が言うのも無理はない
1180.0150	14.1300	overt	1180.0200	1416018	それは分かった上でなおそんなものに頼るのは危険だと私には思いたしかしそれはあえて口にしなかったお守りの代わりでもそれで気持ちが落ち着くのならば構わない
1194.9850	11.6700	overt	1194.9900	1433982	三好の様子は大事な局面においてそんなものでも持っていなければとても使い物にならないほど緊張してしまいそうに私には思いた
1213.0150	12.7800	overt	1213.0200	1455618	暴行している加藤とか言う刑事は私と似た考えなのか彼も一応自分の完治器用の電源を入れたがろくに見もせずにバックにしまった
1233.6250	5.7000	overt	1233.6300	1480350	全くしゃべろうとはしないがこちらはある程度使える人間なのかもしれない
1243.1650	13.1100	overt	1243.1700	1491798	私に対して警戒の色を隠せないのもノーマルの身でサイキック担当の刑事を続けるにあたり私のようなサイキックに痛い目に合わせられ続けた経験からだろう
1257.9550	14.6400	overt	1257.9600	1509546	その点三好は私に対して無警戒にビラベラとしゃべりすぎる自分の年齢は固くなに隠そうとするくせにさあ行きましょう三好が固い表情でそう促して我々は再び歩き始めた
1282.3150	15.6150	overt	1282.3200	1538778	我々は団地の敷地に足を踏み入れた薄暗い地べたに座り込んで路上でカードゲームをしている若者たちがジロジロと物しつけな視線を送るのを浴びながら目の前を通り過ぎる
1297.9300	15.6150	overt	1297.9350	1557516	そんなにビクビクすんなよあんたら捜査員は上着の下に毛ブラベストやらを身につけているんだろう俺なんかこのペラプラのジャケット一枚だぞ
1340.3050	12.1650	overt	1340.3100	1608366	からかうと三好はムッとした表情で私をにらみつけるまああんな連中双子や個性ほど怖くはないさあのサン人だってもし現れてくれれば
1352.4700	12.1650	overt	1352.4750	1622964	君らがその銃で片付けてそれでこの事件は終了になるそうなればそれはそれで簡単でいい私たちは射殺するのが目的ではありません
1371.9550	6.0300	overt	1371.9600	1646346	逮捕が目的なんです虫が真面目な顔でそう言うので私は肩をすくめた
1378.7050	9.6900	overt	1378.7100	1654446	もちろん私には自分の大事な人間たちを奪った連中をただ逮捕するだけで済ませるつもりはもうとうなかった
1400.0050	9.3900	overt	1400.0100	1680006	今私のジャケットの内側にアミユキたちが殺害された翌日から街を歩き回って天に入れた拳銃が隠されていた
1410.5650	3.3900	overt	1410.5700	1692678	さすがにどうやっても警察の使う
1463.8750	7.0200	overt	1463.8800	1756650	警察のよく警察の使うUT弾とやらは手に入れることができなかったが
1471.9150	15.0100	overt	1471.9200	1766298	町のチンピラがよく使う共産国圏の国のどこかの農村で組み立てられたような怪しげな銃ではない正規ルートで販売されるはずだった米国製の銃である
1486.9250	15.0100	overt	1486.9300	1784310	この銃を握ってもらうのは私でも手間がいったあの日から胸には黒い像がずっと渦巻いておりこの銃を握ってヘドロ団地だろう
1501.9350	15.0100	overt	1501.9400	1802322	こっちへたちがいる場所を歩き回って相手を打ち殺したいという衝動を抑えるのは波大抵大抵ではなく食事は喉再録に取れなかった
1521.1450	10.4100	overt	1521.1500	1825374	カルロッタは私の体調の変化を焦そうと捉えたようだがそれは違う私はそうやってひたすら復讐のことだけを考えていたのだ
1532.2450	3.0600	overt	1532.2500	1838694	失ったものが戻るわけでも
1539.4150	3.7500	overt	1539.4200	1847298	私の落ち度がそれで解消するわけでもないが
1544.1850	9.3600	overt	1544.1900	1853022	彼らが世の中に存在している限りどういう場所にも感情を落ち着けることができそうになかった
1572.5650	13.3350	overt	1572.5700	1887078	ただ怒ってはいたが闇雲に銃を持って歩き回るやり方は私のやり方ではないと受精する程度の理性は残っていた
1585.9000	13.3350	overt	1585.9050	1903080	私は凡人でしかないが能力さえ戻ればどのように隠した情報も暴きどんな場所にも自由に入り込む誰にも真似できない超人となるのだ
1610.0650	15.3000	overt	1610.0700	1932078	たとえ私が足踏みしている間にどんなに遠くへ逃げようとも確実に追跡してみせる隠して私の予想通り警察からのオファーがありこうして
1643.8450	14.8650	overt	1643.8500	1972614	そして私の予想通り警察からオファーがありこうしてこのヘドロ団地に足を踏み入れた肺紙をたどれば甲子園にたどり着くのだろうそしてこの団地にはその灰紙の本拠地がある
1658.7100	14.8650	overt	1658.7150	1990452	この全てが情報化された社会でそれに伴いセキルティはコード化している例えば自分の端末から不正侵入して灰紙のデータを見つけ出すのは非常に困難だが
1702.5250	14.9100	overt	1702.5300	2043030	例えば自分の端末から不正侵入してハイガミのデータを見つけ出すのは非常に困難だが配紙の家に届いた通知書とか彼女たち自身の端末だとか具体的なものを手に入れることができるさえすれば
1717.4350	14.9100	overt	1717.4400	2060922	私には困難はないそして私の能力を持ってすればそういった具体的なものが隠された場所に出入りするのも容易なのだやっと革新に向かって歩き始めているそれを思うと高揚した
1733.1850	11.2800	overt	1733.1900	2079822	あの人殺したちを追い詰めてやつ先にしてやるこんな正面から正々堂々と足を踏み入れて裏の方に回ったりした方がよかったんじゃないですか
1744.4650	11.2800	overt	1744.4700	2093358	隣に並んである組をしかすをささやくヘドロ団地に裏側から足を踏め入れたなんてとんでもない勇気があるもんだ私は肩をすくめた
1760.9350	12.8700	overt	1760.9400	2113122	この団地では一見人目の届かぬような場所こそ最も危険なポイントであり深澤とはまた違う決して人には見つかりたくないような連中に
1792.7050	5.1300	overt	1792.7100	2151246	私は福沢より彼らを刺激する方が厄介だと考えていた
1798.9450	12.6750	overt	1798.9500	2158734	私たちが使っているこの道をこの開けた道ならば郵便配達員なども利用することができるのだ大体この団地に限らず危険な地域では狭い路地の方が
1811.6200	12.6750	overt	1811.6250	2173944	ほらあの塔だ私は歩きながら正面の建物を顎をしゃくって示した三好はそれを見上げ小栗とつばを飲む
1838.2750	14.1200	overt	1838.2800	2205930	相模姉妹の部屋はヨンヒャクニ号室だと三好が示した資料に載っていたが私も前もって調べてある建物はひびだらけだ足を踏み入れるとひんやりとしている
1852.3950	14.1200	overt	1852.4000	2222874	あとは切れたままで過労して生き残った傾向灯と思う寿命がく近くチカチカとまたいていたエレベーターはあったがダメです
1866.5150	14.1200	overt	1866.5200	2239818	彼女は不安を隠さず私を見上げるその顔は蛍光灯の黄色い光のせいで正気なく見える入ろう階段は建物の内側にある入りますか
1904.3950	10.8900	overt	1904.4000	2285274	三好はこの不快な建物の奥に進むのに気が進まなそうだったがうなずいたエレベーターの脇の通路を奥へ進んで
1916.4250	16.6800	overt	1916.4300	2299710	右手の方に階段がある電灯は全て消えており小さな窓から差し込む太陽の光が頼りだった薄暗く半分手探りで進まなければならない
1933.6450	14.2200	overt	1933.6500	2320374	階段を上がるところに何者かが段差に持たれるように怠わっていたボロをまといぐったりとしたその姿を見押しはしたいか何かと勘違いしたのかもしれない小さく声を上げる
1968.9550	1.0800	overt	1968.9600	2362746	ああ
1973.0350	2.4600	overt	1973.0400	2367642	それは死体ではなかった
1992.3550	2.2500	overt	1992.3600	2390826	私たちの立てる音で
1998.5950	19.0800	overt	1998.6000	2398314	その人物は弱々しくまぶたを開く通してもらうよ私は彼にそう告げてその隣を通り過ぎると汗の匂いと噴流用の匂いの入り混じった悪臭が鼻をつく三吉たちも男に十分の警戒を払いながら私に続いたろうじさん
2018.9350	13.4100	overt	2018.9400	2422722	立ち去る私に向かって男は震える声でそうつぶやいたやっぱりお前かなんとなくそう思ったんだ私は立ち止まってそう答えるへえへえ男はかすれた声で笑った
2041.8850	15.2700	overt	2041.8900	2450262	ひでえありさまだサン日も何も食ってねえんだよ立てなくなっちまった飯代を貸してやろうかいいよどうせ入れちゃうろじさんは仕事かいそうだあんたまた探偵になったのか
2058.5050	4.8600	overt	2058.5100	2470206	いや今はこの街のくだらない朝話ばかり聞いている
2064.5950	1.9200	overt	2064.6000	2477514	バイブやだよ
2068.5550	16.0500	overt	2068.5600	2482266	この街のことをどこかに乗せてくれるのかいそれは嬉しいね世間の連中に俺たちみたいな生き物もいることを教えてやってくれっていうのか俺も元気だったら手伝いたいところだが
2120.4550	12.1050	overt	2120.4600	2544546	気持ちだけで十分だ動くと毒だぞゆっくり休むといい私はそう声をかけ立ち去ったあれは階段を二つ上がったところで
2132.5600	12.1050	overt	2132.5650	2559072	登ったところで三好が私に小さな声で尋ねるローズのやりすぎだよ末期中毒だああなるとも何をしたって助からないのさローズ
2173.6750	10.0200	overt	2173.6800	2608410	驚くだろうもう誰も使わないようなあんなクソみたいな薬だがこの辺りではまだ乱用してくたばるやつが
2183.6950	10.0200	overt	2183.7000	2620434	何にしろ安く簡単に作れるからなySは麻薬の売人を目の敵にしていて
2196.2050	4.7700	overt	2196.2100	2635446	売ることはできないがこっそり作って仲間で回し合ってるのさ
