onset	duration	trial_type	wav_onset	sample	value
5.0820	3.3240	listening	3.3620	6098	妄想や陰謀論にとらわれたりすることもあった
9.8180	4.1880	listening	8.0980	11782	気分が突然変わるんですとトスカも語っている
14.9700	4.9560	listening	13.2500	17964	全て最高だと思うと一瞬で残酷になり虐待に走るんです
21.5300	1.6920	listening	19.8100	25836	まるで多重人格だ
23.8980	2.3000	listening	22.1780	28678	キンバルも同じことを証言している
27.5460	6.8760	listening	25.8260	33055	ものすごく優しいかと思えば次の瞬間には怒鳴り散らされ何時間も小言を聞かされるんです
35.1940	2.7800	listening	33.4740	42233	文字通りニ時間もサン時間もですよ
38.5220	1.6280	listening	36.8020	46226	ずっと立たされてね
41.1460	7.2280	listening	39.4260	49375	役立たずだみじめなやつだと傷つく言葉が雨荒れと降ってきます逃げることなんて許されません
50.8100	2.3320	listening	49.0900	60972	いとこも家にきたがらなくなった
54.4580	4.1240	listening	52.7380	65350	どうなるか分かりませんからねとピーターライブは言う
59.7060	7.2600	listening	57.9860	71647	新しいバイクを買ったんだ乗ってみないかって言われるかと思えばなんだかすごく怒っていて脅されるんです
67.6740	2.9400	listening	65.9540	81209	歯ブラシでトイレ掃除をさせられたこともあります
72.4420	7.1960	listening	70.7220	86930	ピーターは言葉を切るとイーロンもそんな感じに気分が揺らぐことがあるとためらいがちに語ってくれた
81.3700	10.4600	listening	79.6500	97644	イーロンも機嫌がいい時はこれほどクールで面白いやつはまずいないって感じだったりしますでも機嫌が悪くなるとすごく陰犬になるんです
92.4420	3.0680	listening	90.7220	110930	そういう時はとにかく逃げるが勝ちです
98.2020	5.6600	listening	96.4820	117842	ピーターが訪れたら下着姿のエロールがキッチンに座っていたことがあったという
104.7940	3.6760	listening	103.0740	125753	テーブルにはプラスチック製のルーレットホイールが置かれている
109.2100	3.5800	listening	107.4900	131052	電子レンジの影響を受けるかどうかを調べていたのだ
114.0740	6.5560	listening	112.3540	136889	ルーレットを回して結果をメモしたら電子レンジに入れて回してまた結果をメモする
121.4980	1.6920	listening	119.7780	145798	危機迫る光景だった
124.1860	6.2680	listening	122.4660	149023	ルーレットには必勝法がある自分ならそれを見つけられるとエロールは信じていたのだ
131.7380	5.9800	listening	130.0180	158086	ジューロク歳以上に見える格好をイーロンにさせてプレトリアのカジノで数字をメモらせ
138.2340	5.1800	listening	136.5140	165881	掛け札の下に隠した電卓の効果を調べるなどということもよくしていた
145.2740	7.4840	listening	143.5540	174329	イーロンはルーレットに関する本を図書館で調べコンピューラットをシミュレーションするプログラムも作った
153.3060	4.0920	listening	151.5860	183967	そして無駄なことをしていると父親に教えようとした
158.1380	5.1160	listening	156.4180	189766	だがエロールは確率の深煙を発見したと言って耳を貸さない
164.6340	1.7880	listening	162.9140	197561	後に私に対しても
166.9380	6.2680	listening	165.2180	200326	不規則性と呼ばれるものをもう少しで完全に解明できるところだったと語っている
174.0100	2.5240	listening	172.2900	208812	それはどういうことかと尋ねたところ
177.2100	8.9880	listening	175.4900	212652	不規則な自称や偶然など存在しないんだ全ての自称はフィボナッチ数列に従うマンデルブロー集合のように
186.9060	7.0680	listening	185.1860	224287	私は偶然とフィボナッチ数列の関係を解明したこれは科学論文の領域だ
194.6180	6.0120	listening	192.8980	233542	この発見を公にすると偶然に頼る活動が全てぶち壊しになってしまう
201.2100	3.4200	listening	199.4900	241452	だからそんなことはすべきでないのだと思う
205.2420	1.0520	listening	203.5220	246290	と帰ってきた
207.7700	2.9080	listening	206.0500	249324	何を言っているのか私にはよくわからない
211.3220	1.7560	listening	209.6020	253586	イーロンにも消せないそうだ
214.4260	6.9720	listening	212.7060	257311	どう転んだら高額を得意とした人が魔術を信じるようになるのか首をかしげるばかりです
221.9780	3.6760	listening	220.2580	266374	でも父はそういう進化を遂げてしまったんです
227.4500	4.9880	listening	225.7300	272940	エロールは時として固くなで説得力が感じられることさえある
233.7860	4.7320	listening	232.0660	280543	周囲の現実をねじ曲げる力があるんですとキンバルは言う
239.3220	6.3640	listening	237.6020	287186	話をでっち上げるんですが彼自身そのまやかしこそが現実だと信じてしまうんです
247.6420	7.9320	listening	245.9220	297170	米国の大統領は神で批判は許されないなど事実無根なあれこれを子どもたちに押し付けることもあった
256.4100	5.6600	listening	254.6900	307692	自分がヒーローだったり犠牲者だったりするおとぎ話を聞かせることもよくあった
262.8420	4.1880	listening	261.1220	315410	しかも毎回これこそが真実だという調子なのだ
267.7700	7.4200	listening	266.0500	321324	自分が見ている現実の方が間違っているのではないかとイーロンにもキンバルにも疑問を抱かせるほどに
276.3780	2.3320	listening	274.6580	331654	こんな子供時代最悪ですよね
279.2580	1.3080	listening	277.5380	335110	と金原は言う
281.6260	7.6760	listening	279.9060	337951	精神的な拷問ですよどうしても影響を受けてしまいます何が現実なのかわからなくなってしまうんです
290.5860	6.2040	listening	288.8660	348703	私自身エロールが雲のように放つ糸に絡め取られてしまったと感じたことがある
297.7540	6.3960	listening	296.0340	357305	ニ年にわたる電話や電子メールのやりとりを通じ子どもたちやメイギリの娘
304.8900	3.2920	listening	303.1700	365868	エロールは彼女との間に子供をニ人設けている
308.8580	1.5640	listening	307.1380	370630	詳細は口術
311.5780	3.6760	listening	309.8580	373894	との関係についていろいろな話を聞かされたからだ
316.7620	7.4520	listening	315.0420	380114	私がどんな風だったかイーロンもキンバルもそれぞれに主張があるだろうがいずれも事実とは異なるんだ
325.8500	8.0600	listening	324.1300	391020	そういう彼はニ人とも母親を喜ばせたくて自分が心理的に虐待したと語っているのだと主張する
334.5540	7.9000	listening	332.8340	401465	だが本当のところどうだったのかと重ねて問うと子どもたちの話を信じてもらって構わないと帰ってきた
343.8340	4.8280	listening	342.1140	412601	彼らにとってその方が幸せなら違う話でも私は構わない
349.4660	4.6040	listening	347.7460	419359	私の言葉と彼らの言葉どっちを取るかと問うつもりはない
354.5860	2.1400	listening	352.8660	425503	彼らの方を取ってもらっていい
359.0660	4.6680	listening	357.3460	430879	父親について語るときイーロンは時々笑い声を上げる
364.4420	2.7800	listening	362.7220	437330	せせら笑い気味で父親に似ている
367.8980	10.0440	listening	366.1780	441478	使う言葉も相手を見る視線も突然の暗転名店も父エロールの姿がちらついているように思うと家族は言う
379.5780	6.8440	listening	377.8580	455494	話してくれた昔話が言動に見え隠れするんですと最初の妻ジャスティンは言う
387.3220	8.2520	listening	385.6020	464786	そうなりたくないと思っても子ども時代の体験には影響されがちでそこをなくすのは難しいんだと思い知らされます
397.0500	5.1480	listening	395.3300	476460	だから父親になりかけているとおりおり指摘していたという
402.9700	5.2760	listening	401.2500	483564	暗黒界に落ちかけていると警告する決まり文句のようなものになっていたらしい
409.2420	9.4680	listening	407.5220	491090	そうは言っても基本的なところが父親と異なりイーロンは子どもたちに愛着を覚えできる限りのことをしたいと考えていた
419.9940	5.0840	listening	418.2740	503993	ギフエロールだと何か大変なことが起きるかもしれないと思ってしまいます
425.6900	1.2760	listening	423.9700	510828	とジャスティンは言う
427.9940	6.7160	listening	426.2740	513593	でもこの世の終わりでゾンビがうろつくようになった時にはイーロンの隣にいたいと思うんです
435.3540	3.3240	listening	433.6340	522425	彼ならゾンビを抑え込む手立てを考えてくれますから
439.6100	5.2440	listening	437.8900	527532	すごく厳しかったりしますけどでも最後は何とかしてくれると思えるんです
446.5860	3.6440	listening	444.8660	535903	だがそうなるには先へ進む必要があった
450.9700	2.8120	listening	449.2500	541164	南アフリカを離れる時が来たのだ
455.9620	1.1800	listening	454.2420	547154	片道切符
459.2900	2.8440	listening	457.5700	551148	自分と手前を米国に連れて行ってくれ
462.8420	2.0440	listening	461.1220	555410	イーロンマスクは何度も頼んだ
465.5620	2.6520	listening	463.8420	558674	だが父にも母にもその気はなかった
468.7940	3.4200	listening	467.0740	562553	仕方がないので自分で何とかすることにした
473.5620	7.1320	listening	471.8420	568274	まず母親の父親がミネソタ州の生まれであることを理由に米国市民権をもらおうとした
481.2740	1.1160	listening	479.5540	577529	これはダメだった
483.4180	4.8920	listening	481.6980	580102	母親がカナダ生まれだったし米国市民権を取っていなかったからだ
489.0180	4.5080	listening	487.2980	586822	であれば行き先をカナダにするのがとりあえず簡単でいいだろう
494.0420	9.6280	listening	492.3220	592850	というわけでカナダ領事館に行くとパスポートの申請用紙をもらい自分はもちろん母親と手前の分も書類を用意した
504.4740	2.2040	listening	502.7540	605369	父親の分は申請しなかった
507.8340	4.9880	listening	506.1140	609401	この申請はセンキューヒャクハチジューキュー年ゴ月末に受理される
513.6900	9.7880	listening	511.9700	616428	翌朝すぐに出発してもよかったんだけどあの頃ジューヨン日前なら割引航空券が買えたんですだからニ週間待つことにしました
524.8580	3.6760	listening	523.1380	629830	センキューヒャクハチジューキュー年ロク月ジューイチ日
529.1460	12.9240	listening	527.4260	634975	ジューハチ歳の誕生日までニ週間ほどの時父親とテーマイにプレトリアの高級レストランシアズで送別会を開いてもらった後ヨハネスブルグ空港まで送ってもらった
543.5460	8.0280	listening	541.8260	652255	一ニか月もすれば戻ってくることになるさ思ったようになんぞなるはずがないと父親には言われたそうだ
552.9860	3.8360	listening	551.2660	663583	例によって例のごとくエロールバージョンは異なる
557.6580	5.2760	listening	555.9380	669190	エロールによると高校の最終学年でイーロンはすごく落ち込んだという
563.6100	5.6600	listening	561.8900	676332	そこを打ったのはセンキューヒャクハチジューキュー年ゴ月サンジューイチ日の建国記念日
570.2660	5.2760	listening	568.5460	684319	この日は家族でパレードを見に行くはずだったがイーロンはベッドから出てこない
576.1860	14.2680	listening	574.4660	691423	だから彼の部屋の大きな机に座り使い込まれたコンピューターの前から米国で勉強してきたらどうだと声をかけるとうん行きたいと帰ってきてイーロンは元気になったそうだ
591.8980	2.0120	listening	590.1780	710278	あれは私の発案だったんだ
594.5220	13.7880	listening	592.8020	713426	あの時まで米国に行きたいと本人に言われたことはなかっただからだったら明日米国大使館の文化担当官に会いに行くといいロータリークラブの知り合いだからと教えてやった
609.7540	5.3720	listening	608.0340	731705	そんなのは自分をヒーローに仕立てるいつもの夢物語だとイーロンは言う
615.8660	3.4840	listening	614.1460	739039	実際エロールバージョンは作り話だと思われる
620.2500	8.8280	listening	618.5300	744300	センキューヒャクハチジューキュー年の建国記念日にはすでにカナダのパスポートも航空券もイーロンは手に入れていたのだから
631.5460	1.0840	listening	629.8260	757855	第ロク章
634.6820	1.8520	listening	632.9620	761618	センキューヒャクハチジューキュー年
641.3380	8.0920	listening	639.6180	769606	父親が成功した時期もあったからかセンキューヒャクハチジューキュー年北米についたマスクはお金をたくさん持っていた
650.1380	3.4200	listening	648.4180	780166	ポケットはエメラルドで膨らんでいたなどと言われている
654.4580	3.3560	listening	652.7380	785350	エロールなどはそう思わせるように仕向けることもある
658.5860	5.8200	listening	656.8660	790303	実際のところザンビアのエメラルド鉱山はその何年も前に価値がなくなっていた
665.3060	15.3560	listening	663.5860	798367	南アフリカを出たときイーロンが持っていたのは父親にもらったトラベラーズチェックニセンドルと母親がティーンエイジャー時代にもらったビューティーコンテストの賞金で買った株を売った現金ニセンドルだけである
681.7860	8.0600	listening	680.0660	818143	それ以外モントリオールに降り立ったイーロンが持っていたのは会ったこともない母方の親戚のリストくらいなものである
691.5780	5.3400	listening	689.8580	829894	母親のおじに連絡するつもりだったのだがモントリオールから引っ越してしまっていた
697.5620	4.6360	listening	695.8420	837074	仕方がないのでユースホステルに投宿ロク人の合部屋だ
703.6420	4.2200	listening	701.9220	844370	南アフリカだと知らない人は物か命を取っていくんですよ
708.3780	3.8040	listening	706.6580	850054	その感覚だったんでバックパックを背負ったまま寝てました
712.8580	4.4440	listening	711.1380	855430	しばらくしたら世の中人殺しばかりじゃないって分かりましたけど
719.1940	4.4120	listening	717.4740	863033	街を歩けば歩いたで窓に鉄格子がついていないと
724.7940	1.0840	listening	723.0740	869753	第ロク章
730.2340	3.3560	listening	728.5140	876281	第ゴ章に米国市民権をもらおうと
734.4260	2.3640	listening	732.7060	881311	ギフエロールだと何かっていう
737.7220	6.4920	listening	736.0020	885266	そうなりたくないと思っても子ども時代の体験には影響されがちで私でも私は構わない
745.0180	4.0280	listening	743.2980	894022	私の言葉と彼らの言葉どっちなくなってしまうんです
750.3300	6.2040	listening	748.6100	900396	私自身エロールが雲のように放つ糸に絡め取られてしまったと感じたことがある
