onset	duration	trial_type	wav_onset	sample	value
2.2458	14.7900	overt	2.2800	2695	今度の事件をよく考えてみると同じ石田家の家族の中でも犯人の襲撃の仕方がまちまちであったことに気づきます最も際立っているのはイチロー君のおばあさんだ
17.6058	3.6600	overt	17.6400	21127	あの方は全く一度も害を被っていない
21.8058	5.4000	overt	21.8400	26167	非常なお年寄りだから犯人が問題にしなかったのかもしれないが
27.7758	6.0300	overt	27.8100	33331	まるであの方だけ家族の一員でないかのような取り扱いを受けている
34.3458	11.7450	overt	34.3800	41215	一方これとは逆にもっともしばしば犯人に狙われたのは一郎君だ君だ真っ先に担当で刺されたのも君だしその後も
46.0908	11.7450	overt	46.1250	55309	麻酔剤をかがされて一晩中物置き部屋に物置き部屋に転がっていたりそうかと思うと夕日は古井戸の底に投げ込まれてもいた
59.5458	1.0500	overt	59.5800	71455	その他
61.5258	14.5200	overt	61.5600	73831	君の写真の目から血が流れたり犯人から電話がかかってきたり犯人はいつも君を最も憎んでいるように見えた彩子さんは恐ろしい権議をかけられ
76.7958	9.8700	overt	76.8300	92155	この事件では重要な役目を務めているのだけれど本当に殺人鬼に襲われたのは今度が初めてなんだからね
87.2958	4.7100	overt	87.3300	104755	だが君は幸運にも死を免れることができた
92.7258	17.8500	overt	92.7600	111271	いや君は幸運だったというよりも犯人の方が不手際だった例えば君に麻酔薬を嗅がせて一晩空き部屋へ放り込んでおくというようなやり方は僕には全く理解できないことだ
111.1458	7.6500	overt	111.1800	133375	その暇に君の命を奪おうと思えばいつだって目的を遂げることができたはずだからね
119.8158	11.3400	overt	119.8500	143779	犯人は君をおもちゃにしていたのだろうか人を思うに殺すのはもったいないので何とでもひどい目に合わせてやれというつもりだったのだろうか
131.8758	5.4900	overt	131.9100	158251	明智はそこで口を切ってじっとイチロー青年の顔を見つめた
137.9058	5.5200	overt	137.9400	165487	イチローは無表情な顔で別に言葉を挟もうとはしなかった
144.3558	15.2700	overt	144.3900	173227	探偵という仕事はどんなに不可能に見えることでも一応疑ってみなければならない僕はこの犯人の変なやり口に興味を感じたそれをそこまで研究してみようと思った
160.6758	6.7200	overt	160.7100	192811	僕はかつてアメリカのある非常に聡明な殺人犯人の話を読んだことがある
167.9658	7.3200	overt	168.0000	201559	その犯人は権威を悪がれるために自分自身をピストルで打って重傷を負ったのだ
175.8558	16.0500	overt	175.8900	211027	そしてある名探偵に自ら住んで事件の捜査を依頼したつまり彼は逆手を打ったのだ危険の真った中に身をさらすことがかえって安全だという論理を知っていたのだ
192.4458	4.5600	overt	192.4800	230935	そして名探偵に対して知恵比べを挑んだのだ
199.7358	12.9600	overt	199.7700	239683	ある種の性格にとってこういう実質的なスリルは何も増して魅力があるものだからねでそのアメリカの犯罪事件ではさすがの名探偵も
212.6958	12.9600	overt	212.7300	255235	長い間犯人の捨て身の先方に欺かれていたのだがしかし結局勝負はついた犯罪者が法律に勝つなんてことはありえないのだ
226.2258	6.9300	overt	226.2600	271471	その探偵は幾人かの生命を犠牲にしたが最後には真犯人を捉えたのだよ
234.1158	6.2700	overt	234.1500	280939	ちょっと待ってくださいそれはどういう意味なのですかその聡明な犯人というのは
241.2558	5.5500	overt	241.2900	289507	外形上今度の僕の立場となんだか似ているようですが
247.4658	4.3200	overt	247.5000	296959	先生に最初事件をお願いしたのも僕なんだし
252.4158	4.8300	overt	252.4500	302899	一郎青年はびっくりしたような顔をして探偵を見つめた
258.2058	3.6000	overt	258.2400	309847	外形ばかりじゃない実質的にも似ているんだよ
264.2358	6.4200	overt	264.2700	317083	ハハハハ何をおっしゃるのですこんな際につまらない冗談はよしてください
271.3158	4.5600	overt	271.3500	325579	一郎はとうとう腹を立てたらしく激しい口調で言った
276.4758	7.3200	overt	276.5100	331771	だが明智は別に出現を取り消すでもなくまた妙な例え話を始めた
284.5758	19.7100	overt	284.6100	341491	どこかの天文学者が暗黒星という天体を想像したことがある星というものは必ず自分で発光するか他の天体の光を反射するかして明るく光っているものだが暗黒星というのは全く光のない星なんだ
305.0658	8.4300	overt	305.1000	366079	宇宙にはそういう目に見えない小さな星があってそれがある場合に地球に接近してくるというのだ
314.1258	8.8500	overt	314.1600	376951	接近するばかりじゃない非常に小さい星なので地球の引力に負けて衝突することもあり得るというのだ
323.7858	6.5100	overt	323.8200	388543	これは怖い話だすぐ相場まで近づいていても全く目に見えない星
330.8658	4.8900	overt	330.9000	397039	夜空を見ていてそういう星を考えるとゾーッとすることがある
336.4458	10.2600	overt	336.4800	403735	小さいといってもやはり独立の星なんだから地球に接近すれば空全体を覆ってしまうほどの大好きを持っているに違いない
349.1358	6.3000	overt	349.1700	418963	僕は今度の事件を考えていてふとその暗黒性の話を思い出した
356.2758	5.1600	overt	356.3100	427531	今度の犯人はつい身の前にいるようで正体がつけまえない
362.1258	2.0100	overt	362.1600	434551	全く光を持たない星
364.6758	1.8300	overt	364.7100	437611	いわば邪悪の星だね
367.1358	6.6900	overt	367.1700	440563	だから僕は心の内でこの次元の犯人を暗黒星と名付けていたのだよ
374.6958	3.9300	overt	374.7300	449635	その暗黒性は何者だとおっしゃるのですか
379.4358	6.0900	overt	379.4700	455323	明智のもどかしい話を我慢ができないというように一郎青年画となった
386.6058	4.6800	overt	386.6400	463927	美しい顔が腹立たしそうにパッとあからんでいた
392.0958	4.5600	overt	392.1300	470515	君が考えている通りさ僕が考えている
397.1958	5.2800	overt	397.2300	476635	君が一番よく知っていると思うんだ君自身のことだからね
403.5258	6.4800	overt	403.5600	484231	それじゃあやっぱり先生は僕が犯人だと何か意義があるのかい
410.5458	3.3000	overt	410.5800	492655	明智は少しも声の調子を変えないでいった
