onset	duration	trial_type	wav_onset	sample	value
74.5459	4.8600	overt	70.2900	76335	ある日ある場所ある時間に現れる存在しないはずの路地
82.2259	1.5900	overt	77.9700	84199	誘われ入れば
94.7359	4.0200	overt	90.4800	97010	二度と出ることはかなわない
157.1359	2.3400	overt	152.8800	160907	恐ろしい悪霊が済むという
169.2559	1.4100	overt	165.0000	173318	怪我はないですか
171.8959	2.2500	overt	167.6400	176021	本当なんと俺言ったらいいか
175.4059	2.2200	overt	171.1500	179616	いえいえ通りがかっただけなので
267.1459	2.2200	overt	262.8900	273557	何かお礼をさせてください
270.5059	6.7500	overt	266.2500	276998	いや気持ちは嬉しいんですがでも時間がやばいなまた遅刻だよ
278.5459	1.4100	overt	274.2900	285231	ニの上上だ
281.1859	7.3200	overt	276.9300	287934	遅刻をするくらいならその日はもう休みたい悪い意味での注目は痛いしそもそもそんなのプライドが許さない
289.8559	1.8300	overt	285.6000	296812	高橋はまたいねえのか
293.7559	3.9300	overt	289.5000	300806	だから私は信じられないじゃあ授業始めるぞっす
304.7959	3.6300	overt	300.5400	312111	これは高橋ってまた遅刻だぞ何してやがった
309.4159	3.4500	overt	305.1600	316842	全と遅刻できる人間のことが寝坊しました
315.8059	1.5900	overt	311.5500	323385	採食顕微って
320.7559	1.5000	overt	316.5000	328454	おはようございます会長
323.7859	2.9100	overt	319.5300	331557	まるで私のために作られた言葉だわ
327.6259	2.1900	overt	323.3700	335489	多分日本で一番かわいいし
330.9559	4.4700	overt	326.7000	338899	勉強もできて生徒会長だものでも天才
351.5959	2.1900	overt	347.3400	360034	努力だってしてるのよ
358.2259	4.5000	overt	353.9700	366823	予習復習は絶対に別れまでやるしニジューニ時までには寝るし
364.0459	4.2900	overt	359.7900	372783	私はきちんとしてるものが一番好き
369.5359	1.8000	overt	365.2800	378405	だから私は許せないの
386.7259	4.5900	overt	382.4700	396007	寝坊しました寝坊しました
392.1559	5.0700	overt	387.9000	401568	毎日毎日遅刻してくる彼のことが別に良くない他人事なんだし
406.0759	3.9300	overt	401.8200	415822	彼が隣の席なんかでなければ気になってはいなかったでしょうね
411.3259	2.8800	overt	407.0700	421198	ただなんだろう枝木を見つけしまったというか
415.7959	1.6200	overt	411.5400	425775	時に質問なんだけど
418.0459	1.2000	overt	413.7900	428079	私ってかわいい
465.4459	2.3100	overt	461.1900	476617	相当かわいい方ではあると思うけど
470.0959	8.5800	overt	465.8400	481378	可愛ければ許されることって世の中たくさんあると思うんだけどこの可愛さで許される理不尽ってどの程度だと思う
480.4759	1.6800	overt	476.2200	492007	一体何する気なの
495.6259	1.9500	overt	491.3700	507521	おはよう
498.9859	5.6700	overt	494.7300	510962	それはさすがにアウトだろうあら何の話いやなんかとっさにきっと典型ね
505.8259	7.4400	overt	501.5700	517966	三組さんね用事は遅刻ばっかりするから迎えに来てくれたんだって外で待ってもらうのも悪いでしょだからね
514.5259	2.7300	overt	510.2700	526874	木更木恵です 幼児君いますか
518.0059	3.0000	overt	513.7500	530438	それにしてもあんたこんなかわいい子連れてくるなんて
522.0559	1.3500	overt	517.8000	534585	爪に置けないわね
524.0659	3.1800	overt	519.8100	536643	ちょっとマジで勘弁してくれ母さん行ってきます
550.1359	3.3900	overt	545.8800	563339	それはごめんなさい進められたからつい行為を
554.6659	3.3900	overt	550.4100	567978	無限にできなくてでマジで何のよ
559.5859	6.0900	overt	555.3300	573016	ああそうだわ私はあなたの遅刻の理由を知りに来たの寝坊ってことじゃダメダメ
566.5759	1.7100	overt	562.3200	580174	あんな我々の嘘ないわよ
568.8259	4.2600	overt	564.5700	582478	野菜や魚を両手に遅刻する人がどこにいるの
575.8159	4.4700	overt	571.5600	589635	俺も人の行為は無限にできないタイプでさ結構似てんのかもね俺ら
583.1059	4.1400	overt	578.8500	597100	ごめんなさい遅刻とかするだらしない人はちょっと
590.5459	1.3200	overt	586.2900	604719	それより理由は
592.5259	4.7400	overt	588.2700	606746	教えてくれないならこっちにも考えがあるんだから何するつもり
601.6459	2.0700	overt	597.3900	616085	ひどく罵してやるんだから
606.3259	1.1100	overt	602.0700	620878	絵だけ大名人
609.1459	2.1900	overt	604.8900	623765	育ちの良さが伝わってきやがる
612.4459	2.3100	overt	608.1900	627145	あんた絶対に悪口向いてないぞ
617.8159	4.9200	overt	613.5600	632643	わざわざ言うのもって何なんだけど仕方ないから教えるよ
625.5559	1.9500	overt	621.3000	640569	ってだけなんだけど俺は
629.9659	2.3700	overt	625.7100	645085	ごめん休養ができた場所は
640.8259	5.1900	overt	636.5700	656206	そういえば聞いたことあるこの区間ってさ出るらしいぜ何が
647.1259	9.1800	overt	642.8700	662657	幽霊だよ幽霊何でも最近人身事故があったらしくてその遺体は顔の損傷が激しかったらしいのかな
657.8359	5.5800	overt	653.5800	673624	もともとすげえ美人な人だったから代わりの顔探してさまよってるって話なんだよ
664.2559	3.9900	overt	660.0000	680198	何その物騒なアンパンマンみたいな話たとえ最悪かよ
672.1459	3.2400	overt	667.8900	688277	大体さ今朝だぜ出るわけねえじゃん
684.7159	2.2500	overt	680.4600	701149	おいお前のせいだぞどうすんだよ
687.6859	1.3800	overt	683.4300	704190	知るかよそんなこと
689.9059	3.5100	overt	685.6500	706464	てか今走ってるよね何何怖い怖い
705.1159	4.0500	overt	700.8600	722039	小学生と競うのもあれだけど私の方が顔はかわいいでしょう
710.3659	1.3200	overt	706.1100	727415	何言ってんだこいつ
715.1359	1.7400	overt	710.8800	732299	確かに確かに
719.3059	2.0100	overt	715.0500	736569	幽霊って朝でも出るのね
728.0659	1.0200	overt	723.8100	745539	殺されるのが
729.8959	1.7700	overt	725.6400	747413	あの子じゃなくてよかった
732.5059	4.1400	overt	728.2500	750086	よかったけど私だってまだ死にたくないだってまだ
738.1459	4.2900	overt	733.8900	755861	お姫様抱っこで命を救ってくれる私の王子様に出会えてないのに
743.8459	1.3800	overt	739.5900	761698	出会えてないのに
749.5459	2.1600	overt	745.2900	767535	遅刻寸前だったにゃんね
753.5359	3.7200	overt	749.2800	771621	お前やたガラスなのにゴビニャンナのさ
758.8459	2.7000	overt	754.5900	777058	しっかり滑っててはずいからやめた方がいいぞ
764.4259	1.4100	overt	760.1700	782772	高橋君
766.6459	1.9800	overt	762.3900	785045	あんたは生徒会長
770.3659	2.0400	overt	766.1100	788855	いや動機じゃないわよ私
778.4959	1.4700	overt	774.2400	797180	何してんのこんなとこで
782.9359	2.1600	overt	778.6800	801726	普通に通学中よバカなの
785.7859	2.3400	overt	781.5300	804645	わけがわからないんだけど
789.0259	2.1000	overt	784.7700	807962	あいつは何なのあと君も
795.0259	1.9800	overt	790.7700	814106	ごめん俺もよく知らない
798.2659	1.5600	overt	794.0100	817424	多分幽霊なのかな
812.0959	4.8900	overt	807.8400	831586	実はそういう家系の人だったりしないのリーバイシテキないや全然
817.8859	6.7800	overt	813.6300	837515	光一になりたての頃道歩いてたらこのカラスがいて君は選ばれたにあってそこからこんな感じ
825.8959	5.3400	overt	821.6400	845717	あああとなぜかこいつらは朝のこの時間によく出てくるお化けのくせに
836.6059	1.7400	overt	832.3500	856684	別にだろ朝寝てても
843.4159	3.0300	overt	839.1600	863658	ごめんちょっと下がっててよくねえよボケ
847.6459	3.7800	overt	843.3900	867989	毎朝毎朝誰がお前らの相手してると思ってんだ
852.5659	1.7700	overt	848.3100	873027	こんな朝の忙しい時に
856.4959	1.3800	overt	852.2400	877052	うろちょろしてんじゃねえ
858.7159	1.3500	overt	854.4600	879325	高橋君大変
860.7859	2.5800	overt	856.5300	881445	運転手さんがなんだか大変なことに
864.9259	1.9200	overt	860.6700	885684	カットバスはよ
868.2559	7.2300	overt	864.0000	889094	私が電車界のFイチレーサーおいしつこい女だなあのおっさん取り憑かれちまってら
876.5059	6.5100	overt	872.2500	897542	このままだとどっかのカーブで大事故だぜなんでゴビのニャンやめたの
885.0859	1.5000	overt	880.8300	906328	恥ずかしくなっちゃった
888.9259	13.3500	overt	884.6700	910260	だが厄介なことになっちまったな人に取り付いた礼を払うのは時間がかかる今お前にできるのはニつしかない知り合いだけ連れて逃げるか今すぐ車掌を殺すかだ
903.9859	1.3800	overt	899.7300	925682	いやサンつ目だ
908.1859	2.6400	overt	903.9300	929982	俺が正面から電車を止める
913.1359	2.7900	overt	908.8800	935051	運転手もみんなも誰も死なせない
923.6059	2.4900	overt	919.3500	945772	それはいいがお前は死ぬぜ
927.3259	6.2100	overt	923.0700	949582	確かにお前に与えた力は強大だが無敵ってわけでも不死身ってわけでもねえんだぜ
934.5559	3.7800	overt	930.3000	956985	今までにないレベルの脅威だとてもじゃないが耐えられねえ
946.4659	2.7900	overt	942.2100	969181	お前らしくはある
950.5459	3.1800	overt	946.2900	973359	もうやめとけって今までまさか
957.0859	7.9200	overt	952.8300	980056	高橋君はいつもこんなことをしてるの毎朝毎朝そんなふうに傷だらけになっていろんな人を俺はただ
965.8459	1.4700	overt	961.5900	989026	寝坊してるだけだよ
968.4859	3.0000	overt	964.2300	991730	そんなのダメなんて私には言えない
972.5359	1.9200	overt	968.2800	995877	助けられるだけの私ね
977.2459	1.5600	overt	972.9900	1000700	そんな卑怯なことは
980.1559	4.6200	overt	975.9000	1003680	でもこんなにも頑張ってる人が報われないのは絶対許せない
988.0159	4.2600	overt	983.7600	1011728	だからお願い遅刻したっていいから絶対来て学校に来て
994.0459	2.5800	overt	989.7900	1017903	会長先生に伝えておいてくれる
1000.8559	3.1200	overt	996.6000	1024876	伝えといてくれ会長俺が今日
1004.6659	1.9500	overt	1000.4100	1028778	特大のレブをしていくってさ
1008.2359	4.3200	overt	1003.9800	1032434	おいおいどうなってんだこりゃ人がいたように見えたけど避難指示
1013.2759	1.7700	overt	1009.0200	1037594	指示に従ってください
1016.3659	1.0800	overt	1012.1100	1040759	速報です
1018.0159	3.0600	overt	1013.7600	1042448	今朝ハチ時頃水山行きにて
1021.8859	4.8600	overt	1017.6300	1046411	電車が急停車し乗客が怪我をする事故が
1027.6759	4.0200	overt	1023.4200	1052340	ただ奇跡的に軽症者数名のみで
1034.0059	8.0400	overt	1029.7500	1058822	生きててよかったけどこんなとこで何してるの会長いや一方的にぶっ飛ばして終わりってのもありだしさ
1042.6459	2.1000	overt	1038.3900	1067669	一緒に探してるのこの人の顔
1052.5459	3.1500	overt	1048.2900	1077807	よかったじゃん本当にありがとう達者でな
1058.3659	3.9600	overt	1054.1100	1083767	さてと学校行くかいやいやちゃんと死んじゃいそうじゃん
1063.3759	3.2100	overt	1059.1200	1088897	病院行こういや傷は寝れば治るから
1067.3659	5.9400	overt	1063.1100	1092983	それより授業がやばい俺あんま成績良くないんだなら勉強は私が教えてあげるから
1073.9959	5.7600	overt	1069.7400	1099772	今日は家帰って休みなよ何が目的失礼ね言ったでしょう頑張ってる人が
1080.4159	2.4900	overt	1076.1600	1106346	報われないのが嫌なだけよそれに
1084.2859	4.0200	overt	1080.0300	1110309	それに私は遅刻をするくらいなら休む主義なの
1093.4659	2.5500	overt	1089.2100	1119709	有識自体だわ
1098.7759	3.6900	overt	1094.5200	1125146	どうしたのゆゆしき事態なの分かったって
1106.4259	4.0200	overt	1102.1700	1132980	私死ぬかもしれない悠々式事態だわなるほどね
1111.6759	5.9700	overt	1107.4200	1138356	つまり恵の話をまとめると高橋が隣にいると授業に集中できないと
1120.4359	4.9200	overt	1116.1800	1147326	アゲクの果てには名前を聞くだけでドキドキするから不整脈を疑ってると
1126.3159	2.2800	overt	1122.0600	1153347	じゃあバイバイバイと行きます
1129.8859	1.2000	overt	1125.6300	1157003	私の相談は
1131.7459	2.1000	overt	1127.4900	1158908	行為を捨てまくと勘違いしてる
1134.4159	3.8700	overt	1130.1600	1161642	面白くない人と話す暇は私の人生にないの
1139.6359	3.3300	overt	1135.3800	1166987	ひどいさきちゃんって妙に厳しい時あるよね
1143.8059	4.2600	overt	1139.5500	1171257	あんたがずれてんのよそもそもあの男のどこがそんなにいいの
1148.7859	2.9400	overt	1144.5300	1176357	さっきだっておい高橋嘘だろお前
1153.0159	1.9200	overt	1148.7600	1180688	今もう放課後だぞ
1161.8359	2.0700	overt	1157.5800	1189720	さすがに無理があるのは分かるよな
1166.8459	2.3400	overt	1162.5900	1194850	というかもはや何しに来たんだ
1170.9859	4.3500	overt	1166.7300	1199090	いい困る困る泣かれても困るって先生どうすればいいんだよ
1176.2659	3.9000	overt	1172.0100	1204496	もう今日は帰るなはい宿題だけ教えてください
1182.8959	6.9000	overt	1178.6400	1211285	あんなの良い悪い以前に意味がわからないでしょうそれは高橋君の頑張りゆえというかなんというか
1190.9659	1.9500	overt	1186.7100	1219549	いいところゆえなんだけどな
1193.5759	4.6800	overt	1189.3200	1222222	まあでもこういうのって一人でなら病んでる時が一番楽しいもんよ
1200.5659	7.5600	overt	1196.3100	1229379	恋なんて実乗っちゃったら本性を知って幻滅するか現実的でつまらない価値観のするやわせするしかないんだから
1211.8459	3.8400	overt	1207.5900	1240930	少女漫画知識披露してぬるっと帰ろうとしないで
1225.2259	4.0200	overt	1220.9700	1254631	ひどい私ちゃんと困ってるのに私はお金が必要なの
1230.1459	1.2300	overt	1225.8900	1259669	大学のために
1232.0959	1.5600	overt	1227.8400	1261666	先を見せててえらい
1240.8559	2.6100	overt	1236.6000	1270636	果たしてポツンと置いてかれすぎじゃないかしら
1244.4859	1.7100	overt	1240.2300	1274354	でも本当困ったな
1247.3359	2.3400	overt	1243.0800	1277272	濃い花の匂いがするわびっくり
1253.1259	2.1000	overt	1248.8700	1283201	あなたこの前の幽霊さん
1256.1559	3.9300	overt	1251.9000	1286304	なんで成仏してないのそれがいろいろあってね
1260.7759	6.3000	overt	1256.5200	1291034	私あなたたちに会うまで割とちゃんと悪いことをしてたから善光積むまで来るなって言われちゃった
1268.9659	3.2700	overt	1264.7100	1299421	それからいろいろ頑張ってるんだけどうまくいかなくてね
1283.7259	2.7300	overt	1279.4700	1314535	なんだろうね前って思い詰めてるわね
1287.6559	6.4800	overt	1283.4000	1318560	さあそんなことより恋バナよ私恋バナって大好き違うこれは恋じゃないわありえない
1294.8859	5.7000	overt	1290.6300	1325963	想像してみてきれいな夕焼けの中普段は一人の帰り道を一緒に帰るとことか
1301.7259	1.6200	overt	1297.4700	1332967	じゃあハレンチ警察
1306.0459	4.9500	overt	1301.7900	1337391	土健全異性こういう撲滅土健全だと思うけど
1311.8659	1.7700	overt	1307.6100	1343351	認めたくない
1314.2959	1.0800	overt	1310.0400	1345839	こくっちゃいなよ
1316.2459	2.6700	overt	1311.9900	1347836	今なんてだから告っちゃいなよって
1319.6659	4.5300	overt	1315.4100	1351338	私が告白ね女にかわいいのにかわいいから
1326.9259	2.5500	overt	1322.6700	1358772	あなたって本当なんかすごいわね
1330.1959	4.0800	overt	1325.9400	1362121	それに私には夢の告白のされ方があるの
1337.4859	11.7600	overt	1333.2300	1369586	世界が終わりそうな中白馬の王子様に優しくキスされた後にプロポーズされたいなんか凝々しくない世界もたまらないわよ個人の告白の材料にされたら
1350.1759	2.8500	overt	1345.9200	1382580	それ以外認めませんというかそもそもよ
1353.7159	4.1400	overt	1349.4600	1386205	高橋君って修行僧か何かだと思うの急に何の話
1358.8759	4.2900	overt	1354.6200	1391489	彼は私をお姫様抱っこしたの 触ったのよ私に
1363.8859	4.6200	overt	1359.6300	1396619	私も彼も年頃の高校生ドキドキしながら顔を見て驚いたわ
1370.1259	4.0200	overt	1365.8700	1403009	びっくりするほど無反応こいついつまばたきしてるんだろう
1377.6259	2.9100	overt	1373.3700	1410689	なんでやねん大急な関西弁
1381.1959	2.3100	overt	1376.9400	1414345	ちょっと傷つくでしょうそれはそう
1384.2559	4.6500	overt	1380.0000	1417478	確かに年頃にしては随分落ち着いてるわよね彼そうなのあと
1389.6259	2.3100	overt	1385.3700	1422977	なんか最近避けられてるし
1394.8459	3.4500	overt	1390.5900	1428322	遅刻してくるからそもそも話せないことが多いんだけど
1399.2259	4.9800	overt	1394.9700	1432807	お昼休みもどこか行っちゃうし勉強に誘っても断られるしなんでだろう
1405.4359	4.2000	overt	1401.1800	1439166	嫌われてるのかなってちょっと思ったりめぐみちゃん
1410.3259	3.4800	overt	1406.0700	1444174	確かにあなたはちょっと人を選ぶ性格をして
1417.8859	1.3500	overt	1413.6300	1451915	助けてほしいねん
1429.6759	5.7600	overt	1425.4200	1463988	何も響いてこんな信仰を失い力こそ弱まったが私は腐っても
1436.3659	3.2400	overt	1432.1100	1470839	おちがみ人の力なぞ何も聞かぬ
1440.6559	3.0300	overt	1436.4000	1475232	そこをどけ時間の無駄だ嘘だな
1445.8459	5.7300	overt	1441.5900	1480546	土地神なら何回か倒したことがあるみんなタフだったけど殴り続けてたらどうにかなった
1452.1759	1.3800	overt	1447.9200	1487028	そしてお前もそうなる
1455.9859	6.8100	overt	1451.7300	1490930	ニセンサンビャクジューロク年だニセンサンビャクジューロク年間脇目も振らずにただ強くなるため修行した
1463.5159	6.1800	overt	1459.2600	1498640	この土地を守るため捧げたみに単純な力押しは何に一つ聞かぬこれは本当だ
1470.4759	2.5500	overt	1466.2200	1505767	そして私は女子に興味津々だ
1473.8659	3.8700	overt	1469.6100	1509239	修行ばかりの人生だったもちろん恋などしたことがない
1478.2459	2.1600	overt	1473.9900	1513724	自分好みの女の子に一度
1480.9159	2.6400	overt	1476.6600	1516458	一目でいいから会ってみたいそうだな
1484.2459	3.0300	overt	1479.9900	1519868	美しさなかわいささんの比率の子が良い
1488.0559	3.8400	overt	1483.8000	1523769	そんなドンピシャな子が現れたらおそらく俺は消し飛ぶ
1493.1259	4.9200	overt	1488.8700	1528961	攻撃は効かぬが可愛さは聞く誰にも言えない私の秘密だ
1521.8959	3.0900	overt	1517.6400	1558421	この力を得てからいろいろできるようになってさ
1526.0059	4.5600	overt	1521.7500	1562630	この前なんか電車止めたりしてさ傷の治りも早いしすげえだろ
1531.4959	8.2200	overt	1527.2400	1568252	何が言いたい五感が鋭くなっててさ最近戦いの中迎え合ってるとこくまりに聞こえてくることが
1542.5659	3.5700	overt	1538.3100	1579587	すごく言いづらいんだけど心の声とか
1549.5559	1.3800	overt	1545.3000	1586745	気持ちは分かるよ
1553.4859	2.9700	overt	1549.2300	1590770	ここに高橋君がいるのねそうだにゃ
1557.8959	1.8000	overt	1553.6400	1595285	高橋君高橋君
1562.4859	2.5200	overt	1558.2300	1599986	そんな高橋君がこんなになるなんて
1566.9859	6.0000	overt	1562.7300	1604594	こいつが戦いの最中に泣いてるとこなんて初めて見るぜかなりの強敵だなこれは
1574.1559	1.5600	overt	1569.9000	1611936	自費を与えてやってくれ
1579.2559	1.3200	overt	1575.0000	1617158	どうかあいつに是非を
1588.3459	2.7000	overt	1584.0900	1626466	万事解決だね本当に
1592.8759	2.8200	overt	1588.6200	1631105	大丈夫怪我自体はマジで平気
1596.3259	1.4700	overt	1592.0700	1634638	確かに元気そうね
1599.1159	3.8400	overt	1594.8600	1637495	そして当然のように膝枕には無反応
1604.5459	4.5300	overt	1600.2900	1643055	私のことをどう思ってるんだろうなんかこれ聞くの怖いかも
1611.8359	2.5500	overt	1607.5800	1650520	高橋君って恋愛感情とかないの
1619.6659	6.7500	overt	1615.4100	1658538	悪口違う違うすごい大人びてるからどうなのかなってこんなことが言いたいんじゃない
1628.3659	8.0400	overt	1624.1100	1667447	違うのだからあのね高橋君って私のことを嫌い避けられてるようなことを私しちゃったあのさ
1637.3959	1.6200	overt	1633.1400	1676693	一旦話してもらっていい
1640.8759	1.5300	overt	1636.6200	1680257	ああごめん
1644.1159	4.1100	overt	1639.8600	1683575	高橋君って照れたりするのあるよ俺を何だと思ってるの
1649.0659	5.1000	overt	1644.8100	1688643	助けてくれてありがとうねあいえちなみに恋愛について聞いたのは
1654.8859	3.3000	overt	1650.6300	1694603	私が高橋君が好きとかじゃ全然ないからね
1658.9359	1.3500	overt	1654.6800	1698750	もう何回も聞いたよ
1662.5359	4.0500	overt	1658.2800	1702437	にしても恋愛感情恋愛か
1670.3359	2.6400	overt	1666.0800	1710424	なんかこういうの考えるの久々かも
1674.4759	5.6400	overt	1670.2200	1714663	まあ久々って言うと大げさなんだけどイチ年生のヨン月にあいつに会っちまって
1682.3959	3.3300	overt	1678.1400	1722773	今までのイチ年ちょっと日が出るうちには
1686.7459	2.9700	overt	1682.4900	1727228	いつも戦っててさなんというか
1690.6759	8.8500	overt	1686.4200	1731252	非日常が日常になって普通の高校生活なんて遅れないって思うようになった誰かを巻き込むのも嫌だし
1700.2459	7.8300	overt	1695.9900	1741052	あんまり人とは関わらないようにしてたんだだから特別に会長を避けてたわけじゃないよ嫌な気持ちにさせてたらごめん
1709.9059	2.1900	overt	1705.6500	1750944	高橋君はこのままでいいの
1714.1059	2.1000	overt	1709.8500	1755244	このままの高校生活でいいの
1716.8059	1.7400	overt	1712.5500	1758009	お父さんの受け売りだけど
1719.2959	4.8900	overt	1715.0400	1760559	青春って私たちが思う以上に取り返しがつかなくてとっても大事らしいよ
1725.2959	4.5600	overt	1721.0400	1766703	そっかでもそんなに大事ならなおさら誰かを巻き込むのは嫌だな
1734.4459	5.1600	overt	1730.1900	1776073	この人はどこまで行っても本当に質問です私の名前は何でしょう
1740.9559	1.1400	overt	1736.7000	1782739	さらに右上げます
1742.8759	1.6500	overt	1738.6200	1784705	草薙恵
1745.4259	2.0700	overt	1741.1700	1787316	私ってとてもかわいいの
1748.3659	6.6300	overt	1744.1100	1790327	かわいい私は日常を楽しめる日常も楽しめる自分が決めて関わる人のことを
1756.7059	4.8000	overt	1752.4500	1798867	迷惑だなんて思わないだから高橋陽次が望む青春を教えて
1763.0059	3.5400	overt	1758.7500	1805318	どんな青春でも私が最高のものにしてあげるから
1767.3259	3.7200	overt	1763.0700	1809742	というか私が一緒で最高じゃない青春って何
1773.5359	2.1000	overt	1769.2800	1816101	そしてゆくゆくは絶対
1776.3859	2.5200	overt	1772.1300	1819019	高橋君から告白させてやるんだから
1784.1559	2.2500	overt	1779.9000	1826976	なんだか随分ほっこりしてるわね
1787.0659	1.8600	overt	1782.8100	1829955	めぐみ分かる
1789.9159	5.3100	overt	1785.6600	1832874	ちょっと興味あったけど今ので聞きたくなくなった
1795.9759	4.7400	overt	1791.7200	1839079	ごめん冗談冗談聞かせてよ可愛くてめんどくさい人
1801.7359	13.3500	overt	1797.4800	1844978	真面目で真もある優しい人誰もが振り向くきれいな顔に傲慢だけど憎めないその姿みんなに好かれて愛される嫌でも目立つ木更木その隣にいることは
1816.4659	1.1100	overt	1812.2100	1860061	加藤さん
1819.7059	4.0500	overt	1815.4500	1863379	これ木更木に渡しておいてくれない実はたまに難しい
1824.9259	1.8000	overt	1820.6700	1868724	私は佐藤咲だよ
