onset	duration	trial_type	wav_onset	sample	value
3657.8959	3.3000	overt	3653.6400	3745685	まっとうな説教すぎる穴があったら入りたい
3662.0959	2.5800	overt	3657.8400	3749986	ごめんなさい分かってくれたのか
3667.0159	4.2900	overt	3662.7600	3755024	悔し恥ずかしいから殺します何も分かってなかった
3674.5759	3.0900	overt	3670.3200	3762766	本当に死にたい奴なんていないそうだよな
3682.1059	2.0400	overt	3677.8500	3770476	お前なんでここに
3685.0759	3.0600	overt	3680.8200	3773518	ちょっと待ってください許してやってくださいね
3689.3959	1.1100	overt	3685.1400	3777941	うわ何だお前
3691.3459	3.7500	overt	3687.0900	3779938	こいつは今ニジューイチキロをヨン分で走ってきたんだ
3696.2659	2.3700	overt	3692.0100	3784976	新幹線くらい出てないかそれ
3699.4159	2.7300	overt	3695.1600	3788202	あとお前ツッコミどころ多すぎ
3702.9259	2.6400	overt	3698.6700	3791796	先生正気に当てられたようだなにゃ
3707.2159	2.9100	overt	3702.9600	3796189	気をつけるようじあいつは手強いぞ
