onset	duration	trial_type	wav_onset	sample	value
7.2375	1.2300	overt	7.2600	8685	ああ
35.7075	3.0900	overt	35.7300	42849	大量殺人を犯したとされたが
39.7275	4.5300	overt	39.7500	47673	その記憶を消されている人型警備ユニットの
47.5275	4.5900	overt	47.5500	57033	自らの行動を縛る統制モジュールをハッキングして
53.0475	1.1700	overt	53.0700	63657	自由になった
55.7175	3.6000	overt	55.7400	66861	しかし連続ドラマの主張をひそかな趣味としつつ
60.3375	2.9400	overt	60.3600	72405	人間を守るようプログラムされたとおり
63.9375	1.2300	overt	63.9600	76725	所有者である
66.3675	2.5800	overt	66.3900	79641	保険会社の業務を続けている
70.6875	2.9700	overt	70.7100	84825	ある惑星資源調査隊の
74.4975	2.5200	overt	74.5200	89397	警備任務に派遣された兵器は
79.8675	3.8100	overt	79.8900	95841	ミッションに襲いかかる様々な危険に対し
84.6975	3.7800	overt	84.7200	101637	プログラムと契約に従って顧客を守ろうとするが
89.9175	5.7900	overt	89.9400	107901	ノベラー部門で集合賞ネビラ賞ローカス賞三冠安堂
96.7275	2.9700	overt	96.7500	116073	ニ年連続集合賞ローカス賞受賞
132.0675	6.0000	overt	132.0900	158481	統制モジュールをハッキングしたことで大量殺人ボットになる可能性もありました
139.5375	1.2600	overt	139.5600	167445	しかし直後に
141.8475	2.1600	overt	141.8700	170217	弊社の惑星から流れる
145.0875	5.6100	overt	145.1100	174105	娯楽チャンネルの全フィードにアクセスできることに気づきました
152.0175	4.5900	overt	152.0400	182421	以来サン万ゴセン時間余りが経過しましたが
157.5375	1.5900	overt	157.5600	189045	殺人は犯さず
160.1175	2.3100	overt	160.1400	192141	代わりに映画や連続ドラマや
163.7475	2.7000	overt	163.7700	196497	本や演劇や音楽に
167.3775	3.6300	overt	167.4000	200853	多分サン万ゴセン時間近く短電してきました
172.5675	2.7600	overt	172.5900	207081	冷徹な殺人機械のはずなのに
176.1075	1.9500	overt	176.1300	211329	兵器はひどい血管品です
186.5175	1.3800	overt	186.5400	223821	仕事はしていました
188.4975	1.7700	overt	188.5200	226197	新規の契約任務です
191.3175	1.5300	overt	191.3400	229581	ウォレスク博士と
193.9875	2.4600	overt	194.0100	232785	バーラドワジェ博士が今の調査を
197.2275	1.6500	overt	197.2500	236673	さっさと終えてくれれば
200.2875	1.7700	overt	200.3100	240345	ハビタットに戻って
203.3775	1.0500	overt	203.4000	244053	サンクチュア
205.3275	3.0000	overt	205.3500	246393	リムーンの清水の
211.0575	4.6200	overt	211.0800	253269	現在サンビャクキュージューナナ話を見られるのにと思っていました
218.7075	2.1600	overt	218.7300	262449	注意サン万なのは確かでした
222.2775	3.3000	overt	222.3000	266733	この契約はそれまでひたすら退屈で
227.1675	2.5800	overt	227.1900	272601	いっそ緊急情報チャンネルを
230.5875	1.7400	overt	230.6100	276705	非優先に落として
233.5575	3.9900	overt	233.5800	280269	ブラックフィードの音楽にアクセスしようかと考えてみました
238.9875	5.2800	overt	239.0100	286785	ただし機関システムに余計な活動を築かれないようにする必要があり
245.1675	4.8900	overt	245.1900	294201	それをハビタットではなくフィールドでやるのはやや困難を伴います
251.6175	1.4700	overt	251.6400	301941	この評価ゾーンは
254.4975	1.8900	overt	254.5200	305397	不毛な砂地が広がる
257.2875	1.3200	overt	257.3100	308745	沿岸の島でした
260.1975	3.1800	overt	260.2200	312237	低い丘が復帰復し
265.2975	2.4300	overt	265.3200	318357	緑がかった黒い草が
268.8975	3.8400	overt	268.9200	322677	足首まで半もしているばかりで
273.6675	1.5000	overt	273.6900	328401	同植物はまだらん
276.6375	2.5200	overt	276.6600	331965	大小の鳥のような動物と
280.5675	5.0400	overt	280.5900	336681	今のところ無害らしい空中をふわふわと漂うものがいくらかいるくらいです
287.4075	3.9000	overt	287.4300	344889	海岸には大きな砂のクレーターが点在し
293.0175	1.3800	overt	293.0400	351621	バラドワジト
295.0875	2.9700	overt	295.1100	354105	ボレスクはサンプル採取のために
299.0475	2.0400	overt	299.0700	358857	その一つに入っていました
302.5275	1.9200	overt	302.5500	363033	この惑星には輪があり
305.3475	2.4300	overt	305.3700	366417	現在位置から海を眺めると
309.8175	3.9600	overt	309.8400	371781	水平線上に大きくかかっています
315.8475	1.6500	overt	315.8700	379017	そんな空を見ながら
318.0375	1.1400	overt	318.0600	381645	頭の中で
319.8375	1.9500	overt	319.8600	383805	フィードを操作していた時
322.8375	1.7400	overt	322.8600	387405	クレーターの底が割れました
327.4875	1.0800	overt	327.5100	392985	ジューSで
329.4975	2.6100	overt	329.5200	395397	緊急連絡をする手間をかけず
333.7875	2.3400	overt	333.8100	400545	フィールドカメラの映像フィードを
337.1175	2.1900	overt	337.1400	404541	メンサー博士に送っただけで
340.3275	2.1300	overt	340.3500	408393	兵器はクレーターに飛び込みました
349.4775	2.4600	overt	349.5000	419373	砂の斜面を駆け下りている間に
354.6075	1.8000	overt	354.6300	425529	早くもメンサー博士が
357.6675	2.5200	overt	357.6900	429201	誰かホッパーを飛ばせと
361.0275	3.7200	overt	361.0500	433233	非常用の通信チャンネルで叫んでいるのが聞こえました
367.0875	2.7300	overt	367.1100	440505	彼らはジューキロほど離れた
370.4475	2.6100	overt	370.4700	444537	島内の別の場所で作業をしています
374.5875	2.5200	overt	374.6100	449505	そこからの救援は時間がかかります
378.7875	3.2400	overt	378.8100	454545	兵器の非道を矛盾した命令が飛び
388.2675	2.7900	overt	388.2900	465921	もし統制モジュールを止めていなかったら
397.5975	2.9400	overt	397.6200	477117	最優先になって混乱したでしょう
401.9475	3.7500	overt	401.9700	482337	機関システムは自動的にデータを要求し
407.3475	3.3000	overt	407.3700	488817	同時に不必要なデータを送ってきました
412.3875	1.9200	overt	412.4100	494865	メンサーからはホッパーの
415.7475	2.8200	overt	415.7700	498897	テレメトリーデータまで送られてきました
419.8275	2.5800	overt	419.8500	503793	これも不要なので無視しましたが
423.3975	1.7400	overt	423.4200	508077	対応はまだしも楽です
430.6575	3.8700	overt	430.6800	516789	答えを送るのと要求するのを同時にやってくる
435.3075	2.2500	overt	435.3300	522369	機関システムがむしろ厄介でした
442.0875	1.7100	overt	442.1100	530505	そんな混乱の中で
445.1775	1.0800	overt	445.2000	534213	クレーターの
446.9175	1.5900	overt	446.9400	536301	そこに着きました
450.9075	8.5200	overt	450.9300	541089	兵器の両腕には小型のエネルギー銃が組み込まれていますがより大光景の物理銃を背中から外しました
460.9575	1.8300	overt	460.9800	553149	クレーターの底を割って
463.5375	3.7800	overt	463.5600	556245	飛び出してきた敵はとても大きな口を開けていたので
468.6375	2.7900	overt	468.6600	562365	強力な武器が必要と判断したのです
473.8575	3.1500	overt	473.8800	568629	バーラド味をその口から引っ張り出し
478.1175	2.4300	overt	478.1400	573741	代わりに自分の体をねじ込んで
481.3275	1.7400	overt	481.3500	577593	まずのぞの奥へ一発
483.7275	5.8200	overt	483.7500	580473	やや重厚を上げて脳があると思われる辺りへも一発打ちました
490.6575	5.9400	overt	490.6800	588789	順序は曖昧で正確にはフィールドカメラの映像を再生して確認する必要があります
499.0575	2.8200	overt	499.0800	598869	とにかくバラド味が確保できました
503.5575	1.6500	overt	503.5800	604269	敵は確保できず
506.1675	1.8300	overt	506.1900	607401	穴の奥へ握られました
515.8275	2.0400	overt	515.8500	618993	バラド味は意識不明で
519.2175	1.9500	overt	519.2400	623061	主にスーツの右足と
521.9775	3.3300	overt	522.0000	626373	体側の大きな傷から出血していました
527.0775	3.1200	overt	527.1000	632493	兵器は物理銃を背中のハーネスに戻し
531.0375	3.2700	overt	531.0600	637245	開いた両腕で彼女を抱き上げました
535.7775	6.3600	overt	535.8000	642933	兵器は左腕のアーマーとその下の有形機械の大半を失っていましたが
544.1475	3.5400	overt	544.1700	652977	非有機部品によって行動可能でした
550.4175	6.0300	overt	550.4400	660501	統制モジュールから新たな命令が大量に流れてきますが一日読解せず
557.2575	1.7400	overt	557.2800	668709	有線に落としました
560.4675	5.1000	overt	560.4900	672561	バラドアジは兵器のような非有機部品を持たず
567.0075	2.7300	overt	567.0300	680409	簡単には修理できない体なので
570.8175	2.0400	overt	570.8400	684981	この場面では最優先です
574.7175	1.5000	overt	574.7400	689661	医療システムが
576.7575	3.9600	overt	576.7800	692109	緊急フィード経由で流してくるメール
581.4975	2.4300	overt	581.5200	697797	指示を主に聞きながら
585.3975	1.0200	overt	585.4200	702477	とにかく
586.9275	3.1200	overt	586.9500	704313	クレーターの外へ運び出さればなりません
591.9375	2.4000	overt	591.9600	710325	ボレスクはひっくり返ったように
595.2075	1.8300	overt	595.2300	714249	ずっとしがみついていました
599.0775	2.8200	overt	599.1000	718893	恐怖で固まってしまうのも無理はないでしょう
604.0275	3.4500	overt	604.0500	724833	兵器もこの状況ではかなり無防備ですし
608.2275	2.4000	overt	608.2500	729873	自由が聞かないので声をかけ
621.6975	3.0900	overt	621.7200	746037	ボレスク博士一緒に来てください急いで
633.3975	1.4700	overt	633.4200	760077	返事はありませんでした
636.5775	5.1900	overt	636.6000	763893	医療システムは鎮静剤を注射すよとか
642.6975	2.0100	overt	642.7200	771237	なんとか助言をしてきますが
653.0775	1.8300	overt	653.1000	783693	兵器は片手で
656.1975	2.6700	overt	656.2200	787437	バラドアジュ博士の死血のために
659.8275	1.3800	overt	659.8500	791793	そのスーツを押さえ
662.1975	2.5500	overt	662.2200	794637	反対の手でその頭を支えています
689.9175	1.4400	overt	689.9400	827901	残念ながら腕は
692.1675	1.8600	overt	692.1900	830601	ニ本しか装備していません
695.6175	3.2400	overt	695.6400	834741	そこでヘルメットを開いてアーマーに格納させ
699.9075	1.8300	overt	699.9300	839889	人間の顔をさらしました
703.9275	4.2600	overt	703.9500	844713	もしこの状況で敵が再び出現して噛みつかれたら
708.8175	1.3500	overt	708.8400	850581	最悪の事態です
713.9175	1.3500	overt	713.9400	856701	兵器もさすがに
716.2275	3.4800	overt	716.2500	859473	東部の有機組織は失うわけにいきません
725.8875	3.9300	overt	725.9100	871065	その姿で声に力を込め優しく穏やかに言いました
731.3475	2.2800	overt	731.3700	877617	ボレスク博士大丈夫ですよ
734.9475	4.1100	overt	734.9700	881937	立ってバーラドアジ博士を運ぶのを手伝ってください
740.1975	1.7400	overt	740.2200	888237	今度は反応がありました
742.8375	1.6200	overt	742.8600	891405	ボレスクは立ち上がり
745.2675	3.2700	overt	745.2900	894321	よろめく足でこちらへやってきました
749.8275	1.3500	overt	749.8500	899793	まだ震えています
753.1575	3.7800	overt	753.1800	903789	空気は噛まれていない右側の体をそちらに向けました
758.0775	2.6700	overt	758.1000	909693	腕につかまってくださいしっかりと
762.0075	3.0000	overt	762.0300	914409	ボレスクはなんとか兵器の肘に
765.6975	2.6700	overt	765.7200	918837	その腕を絡みつかせました
770.3475	1.7700	overt	770.3700	924417	そうやって彼を引っ張り
773.4675	2.6100	overt	773.4900	928161	わらど味を胸元に抱きかかえて
777.5775	2.3400	overt	777.6000	933093	クレーターの傾斜を登り始めました
783.5775	2.4300	overt	783.6000	940293	彼女の呼吸は荒く切迫し
787.2375	3.2100	overt	787.2600	944685	スーツからは生態情報を取得できません
792.2175	3.3000	overt	792.2400	950661	兵器は胸部アーマーをかみちぎられていたので
797.0775	4.4100	overt	797.1000	956493	太陽を上昇させて少しでも彼女の保温に努めました
803.7075	2.4000	overt	803.7300	964449	フィードはやや静かになっていました
807.3375	2.5800	overt	807.3600	968805	メンサーが体調権限で
811.2375	4.3800	overt	811.2600	973485	医療システムとホッパー以外のアクセスを抑制したのです
817.7775	5.6700	overt	817.8000	981333	ホッパーのフィードから聞こえるのは余計な発言を黙らせる声ばかりになっていました
832.0575	2.1600	overt	832.0800	998469	クレーターの傾斜は
834.9075	3.4800	overt	834.9300	1001889	緩い砂と小石で崩れやすく歩きにくいのですが
839.2575	2.9100	overt	839.2800	1007109	幸い兵器の足は損傷がなかったので
843.1275	3.3900	overt	843.1500	1011753	人間たちを無事に運び上げることができました
847.7775	2.1600	overt	847.8000	1017333	その場にへたれ込みそうになった
850.8975	1.3800	overt	850.9200	1021077	ボレスコをなだめ
856.4475	1.5000	overt	856.4700	1027737	縁から数メートル
858.4875	1.1700	overt	858.5100	1030185	離れさせました
861.1875	1.7700	overt	861.2100	1033425	大きな口の生物が
863.4975	3.6300	overt	863.5200	1036197	見た目以上に長い触腕を持っていた場合の用心です
874.2375	2.0700	overt	874.2600	1049085	バーラド味を下に下ろすのは
877.4775	1.1100	overt	877.5000	1052973	ためらわれました
879.6675	2.8200	overt	879.6900	1055601	兵器も下腹が大きく損傷しており
883.8375	3.0000	overt	883.8600	1060605	再び抱き上げられるとは限らないからです
897.5775	3.5700	overt	897.6000	1077093	フィールドカメラで自分の体を調べると
903.5175	2.4600	overt	903.5400	1084221	専門のようなものが刺さっていました
908.4375	2.7900	overt	908.4600	1090125	専門という表現で正しいでしょうか
912.8475	5.7000	overt	912.8700	1095417	マーダーボットにはまともな教育モジュールが組み込まれていません
919.9875	4.5600	overt	920.0100	1103985	あるのは殺人の知識くらいでそれも簡素な内容です
925.9575	4.5600	overt	925.9800	1111149	機関システムの言語をセンターで検索しようとしていると
931.5375	2.5500	overt	931.5600	1117845	小型ホッパーが近くに着陸しました
935.7975	3.4200	overt	935.8200	1122957	その隣で兵器は顔を再びヘルメットで覆い
940.5675	2.8500	overt	940.5900	1128681	フェイスプレートを不透明に設定しました
953.7075	3.6000	overt	953.7300	1144449	顧客の体は標準的なホッパーをニ種類持っています
961.5975	2.1600	overt	961.6200	1153917	緊急事用の大型と
966.2775	3.4500	overt	966.3000	1159533	評価ゾーンへの移動用のこの小型です
980.0175	1.8600	overt	980.0400	1176021	サン区画に分かれています
983.7675	3.4200	overt	983.7900	1180521	中央の広いところが人間のための
987.6975	2.1600	overt	987.7200	1185237	上院用キャビネット
1019.4075	3.1500	overt	1019.4300	1223289	機内はサン区画に分かれています
1023.6375	3.0600	overt	1023.6600	1228365	中央の広いところが人間のための
1027.8675	1.6200	overt	1027.8900	1233441	ジョイン用キャビンで
1030.7475	1.9200	overt	1030.7700	1236897	両側の狭いところが
1033.9275	1.8600	overt	1033.9500	1240713	貨物と補給品と
1036.9275	1.9200	overt	1036.9500	1244313	兵器を積載するための
1039.9275	1.2000	overt	1039.9500	1247913	貨物区画です
1042.4175	3.9900	overt	1042.4400	1250901	操縦席にはメンサーが座っています
1047.4875	2.0700	overt	1047.5100	1256985	兵器はそちらへ歩き出しました
1050.8475	3.4800	overt	1050.8700	1261017	ボレスクがついてこられるようにゆっくりです
1055.4975	2.7300	overt	1055.5200	1266597	ランプが下がってピンリーと
1059.3075	1.7100	overt	1059.3300	1271169	新田が飛び降りてきました
1062.4275	2.5500	overt	1062.4500	1274913	兵器は通信チャンネルで言いました
1066.4175	1.2300	overt	1066.4400	1279701	メンサー博士
1068.5475	1.5000	overt	1068.5700	1282257	今バラドアジ
1073.5875	1.1100	overt	1073.6100	1288305	手を離せません
1075.9275	1.3200	overt	1075.9500	1291113	意味を理解する
1078.4475	4.2000	overt	1078.4700	1294137	一泊の間を置いて博士はすぐに答えました
1085.6475	2.7000	overt	1085.6700	1302777	了解押さえたままキャベンに運びなさい
1089.4875	4.5300	overt	1089.5100	1307385	まだボットは人間と同じ区画に乗ることを許されていないので
1095.3375	3.3300	overt	1095.3600	1314405	口頭にせよ立ち入り許可が必要なのです
1099.9875	2.3700	overt	1100.0100	1319985	統制モジュールをハッキングする
1105.2975	2.7900	overt	1105.3200	1326357	物理的に行動は制限されませんが
1109.0775	2.9400	overt	1109.1000	1330893	兵器が実は自由契約の身であることを
1113.1875	3.3000	overt	1113.2100	1335825	契約中の顧客に知られるわけにはいきません
1120.0275	1.6500	overt	1120.0500	1344033	そんなことが分かったら
1122.9375	2.4000	overt	1122.9600	1347525	有機組織部分は破壊され
1127.0475	4.7400	overt	1127.0700	1352457	非有機構造は解体されて部品取りにされてしまいます
1139.5575	2.9700	overt	1139.5800	1367469	バーラド味を抱いてランプを上がり
1143.0675	1.4100	overt	1143.0900	1371681	キャビンに入りました
1147.8075	1.1700	overt	1147.8300	1377369	オバースト
1150.2975	3.1200	overt	1150.3200	1380357	ラッティが急いで座席を畳んで
1154.1975	1.4100	overt	1154.2200	1385037	場所を開けています
1157.4675	2.3100	overt	1157.4900	1388961	人間たちはヘルメットを脱いで
1160.8875	2.6400	overt	1160.9100	1393065	スーツのフードを後ろに倒しているので
1165.4775	2.1600	overt	1165.5000	1398573	その恐怖の表情が分かります
1169.0775	3.7800	overt	1169.1000	1402893	見ているのは兵器のスーツの裂け目から覗く
1174.4475	2.0100	overt	1174.4700	1409337	上半身の損傷ぶりです
1177.7175	1.5900	overt	1177.7400	1413261	兵器はヘルメット
1180.2975	2.4900	overt	1180.3200	1416357	閉ざしていてよかったと思いました
1188.4875	3.4800	overt	1188.5100	1426185	貨物区画に乗る方を好むのはこのためです
1193.5575	4.2000	overt	1193.5800	1432269	マーダーボットが人間や強化人間と一緒に密室に入ると
1198.5675	1.7400	overt	1198.5900	1438281	気まずい雰囲気になります
1201.1475	2.9700	overt	1201.1700	1441377	少なくとはもう兵器は気まずく感じます
1310.3475	3.2700	overt	1310.3700	1572417	肌土味を膝に乗せて床に座りました
1315.0275	1.2900	overt	1315.0500	1578033	ピンリート
1320.2175	2.8800	overt	1320.2400	1584261	ボレスクを引っ張って機内に乗ってきました
1327.0875	5.5200	overt	1327.1100	1592505	フィールド調査用の装備にセットといくつかの機材を外に放置しています
1333.7475	2.3400	overt	1333.7700	1600497	バーラドワジュとボレスクが
1337.2575	2.2500	overt	1337.2800	1604709	クレイターにサンプル採取に
1340.6475	1.1400	overt	1340.6700	1608777	降りる前に
1343.1075	3.1200	overt	1343.1300	1611729	草の上に置いてそのままになっています
1347.7275	3.8400	overt	1347.7500	1617273	通常なら兵器が取りに行くべきですが
1352.8575	2.3700	overt	1352.8800	1623429	バーラドアジの生態情報
1356.5775	3.9300	overt	1356.6000	1627893	しぎれたスーツ経由でモニターしている医療システムは
1361.9175	3.3300	overt	1361.9400	1634301	今その体から手を離すのは懸命でないと
1366.3275	1.8000	overt	1366.3500	1639593	明確に判断しています
1376.2875	2.6100	overt	1376.3100	1651545	そもそも誰も装備のことは言い出しません
1383.8175	2.4300	overt	1383.8400	1660581	曜日がいくらでもあるものを
1387.2375	2.5200	overt	1387.2600	1664685	このような非常時に放棄するのは
1390.5675	2.1300	overt	1390.5900	1668681	当然とみなされているのでしょう
1409.4675	2.1300	overt	1409.4900	1691361	しかし契約下にある兵器は
1412.7675	6.4800	overt	1412.7900	1695321	出血している人間を置いて装備を取りに行けと命じられたら従わねばならない立場です
1485.1575	2.7900	overt	1485.1800	1782189	この契約を指したらしい
1488.9075	1.5000	overt	1488.9300	1786689	ラッティ博士が
1491.5175	2.8200	overt	1491.5400	1789821	慌てて立っていましたケースを取ってくる
1502.5275	1.3800	overt	1502.5500	1803033	平気は叫びました
1505.0775	5.6100	overt	1505.1000	1806093	これは言ってはいけないことです兵器は常に顧客を尊重しなくてはなりません
1514.2275	4.8600	overt	1514.2500	1817073	たとえ顧客の行動が自殺行為であっても例外ではないのです
1520.7075	2.9700	overt	1520.7300	1824849	期間システムはこのような発言を記録し
1525.3875	3.3300	overt	1525.4100	1830465	統制モジュールを通じて罰を下します
1530.6075	2.4600	overt	1530.6300	1836729	平気のはハッキング済みですが
1544.8575	3.7800	overt	1544.8800	1853829	幸い他の人間たちも同時にやめろと叫びました
1550.2875	3.0900	overt	1550.3100	1860345	ピンリーに至ってはふざけるなラッティと叱りました
1554.8775	2.4900	overt	1554.9000	1865853	そうだね間に合うわけないかごめん
1559.1975	4.4700	overt	1559.2200	1871037	ラッティは答えてハッチの緊急閉鎖ボタンを押しました
1564.7775	4.1400	overt	1564.8000	1877733	おかげでホッパーはランプを失わずに済みましたというのも
1575.3375	5.4000	overt	1575.3600	1890405	裸専門高がずらりと並んだ大口を開けていって
1581.7275	3.3300	overt	1581.7500	1898073	真下の地面を上がって突然現れたのです
1587.3675	3.0300	overt	1587.3900	1904841	その様子をホッパーのカメラがはっきりと捉え
1591.3575	3.2100	overt	1591.3800	1909629	ご丁寧にも全員のフィードに送ってきました
1595.5875	2.6700	overt	1595.6100	1914705	おかげで人間たちは悲鳴を上げました
1599.3675	3.0000	overt	1599.3900	1919241	メンサーはホッパーを一気に急上昇させました
1603.9275	2.9400	overt	1603.9500	1924713	平気は危うく体が二つ折りになりかけ
1607.6475	3.9900	overt	1607.6700	1929177	床に寝ていない人間たちはみんな床にたたきつけられました
1615.6575	1.6500	overt	1615.6800	1938789	ようやく静かになって
1618.0875	3.4200	overt	1618.1100	1941705	全員が安堵のため息をついた後にピンリーが言いました
1622.3775	2.7900	overt	1622.4000	1946853	ラッティあんたが自殺行為をやらかしてたな
1626.4575	1.0500	overt	1626.4800	1951749	怒ってるよね
1670.5275	4.7400	overt	1670.5500	2004633	ラッティは壁際で小さくなり弱々しくピン類に手を振りました
1676.7075	3.6600	overt	1676.7300	2012049	命令をらって自分から死にに行くようなことはやめなさい
1686.5175	2.0400	overt	1686.5400	2023821	操縦席から面下がりました
1689.4575	1.6800	overt	1689.4800	2027349	口調は落ち着いていますが
1696.2075	2.8500	overt	1696.2300	2035449	警備担当としての有政権を持つ
1700.2275	3.1800	overt	1700.2500	2040273	平気にはその心拍数が高くなっているのを
1704.0075	2.0100	overt	1704.0300	2044809	医療システムで確認できました
1708.5675	2.7300	overt	1708.5900	2050281	あなたが救急キットを出してきて
1712.3775	4.2300	overt	1712.4000	2054853	バララド味の止血と容体を安定させる処置を試み始めました
1723.6575	3.6000	overt	1723.6800	2068389	兵器は付近の装置と同化しようと務めながら
1728.0075	2.0400	overt	1728.0300	2073609	指示された傷口を押さえたり
1730.7675	1.3800	overt	1730.7900	2076921	故障しかけている
1733.5575	1.6500	overt	1733.5800	2080269	体温調整機能で
1736.4975	1.7100	overt	1736.5200	2083797	漢字を温めたりしました
1750.7775	4.0500	overt	1750.8000	2100933	うつむいて人間たちの無遠慮な視線には
1755.4275	1.5300	overt	1755.4500	2106513	気づかないふりをしました
1759.0275	4.3500	overt	1759.0500	2110833	運用信頼性はロクジュー%で低下中
1764.8475	2.4600	overt	1764.8700	2117817	この体のハビタットは
1824.9375	1.8900	overt	1824.9600	2189925	僕標準的なモデルです
1828.0275	1.6800	overt	1828.0500	2193633	川が流れる
1830.2775	1.9800	overt	1830.3000	2196333	狭い種の上の
1834.1775	2.2200	overt	1834.2000	2201013	比較的平坦な土地に
1838.5875	5.5500	overt	1838.6100	2206305	総合接続されたナナ棟のドームが建っています
