onset	duration	trial_type	wav_onset	sample	value
3642.5475	3.1200	overt	3642.5700	4371057	灰色のニットのパンツと
3646.5375	2.3400	overt	3646.5600	4375845	長袖Tシャツとジャケット
3649.9875	3.6300	overt	3650.0100	4379985	人間と強化人間用の運動着のようなデザインで
3654.8775	2.1000	overt	3654.9000	4385853	さらに柔らかい運動物を
3660.5175	1.1100	overt	3660.5400	4392621	それらを着て
3663.6975	4.5300	overt	3663.7200	4396437	前腕の重厚を覆うように袖を下ろして
3668.9175	2.0100	overt	3668.9400	4402701	ハビタット内の廊下へ出ました
3680.4075	2.6100	overt	3680.4300	4416489	安全管理ドアをニカ所抜けて
3686.0175	1.1700	overt	3686.0400	4423221	人間たちは
3687.8775	3.7800	overt	3687.9000	4425453	この基幹区画について一つのコンソールに集まり
3692.6775	2.3700	overt	3692.7000	4431213	空中ディスプレイの一つを見ていました
3697.1175	4.2300	overt	3697.1400	4436541	医務室で治療中のバーラド味と
3702.4875	2.2800	overt	3702.5100	4442985	付き添っているボレスクが
3705.4275	1.0800	overt	3705.4500	4446513	不在ですが
3707.7375	1.9200	overt	3707.7600	4449285	あとは全員が揃っています
3711.1875	1.6200	overt	3711.2100	4453425	別のコンソールには
3714.0075	4.3800	overt	3714.0300	4456809	マグカップや空になった食事容器が残されています
3719.7675	2.2500	overt	3719.7900	4463721	しかし直接指示されない限り
3722.7075	1.5000	overt	3722.7300	4467249	兵器は片付けません
3726.4575	2.3100	overt	3726.4800	4471749	メンサーは多忙なようですので
3729.6975	1.0200	overt	3729.7200	4475637	様子なので
3731.8275	1.9800	overt	3731.8500	4478193	兵器は立ったまま待ちました
3736.6575	5.0100	overt	3736.6800	4483989	ラッティが横目で兵器を見てから驚いた様子で向き直りました
3743.0475	1.6500	overt	3743.0700	4491657	どう反応したものか
3745.8075	2.0400	overt	3745.8300	4494969	だから馬を着たかったのです
3749.3475	4.9500	overt	3749.3700	4499217	確かにハビタット内では無用に重装備で動きにくいのですが
3755.4075	2.1300	overt	3755.4300	4506489	人間の顧客は普通は
3763.7475	2.4300	overt	3763.7700	4516497	兵器をロボットとみなしたがります
3767.4975	2.1300	overt	3767.5200	4520997	外見をそれに合わせるには
3771.3675	1.7400	overt	3771.3900	4525641	アーマーがふさわしいのです
3776.2275	2.6400	overt	3776.2500	4531473	主戦を遠くへやって
3780.6675	3.8700	overt	3780.6900	4536801	診断プロセスか何かを走らせているふりをしました
3806.8875	1.5000	overt	3806.9100	4568265	困惑した様子で
3817.4175	1.6500	overt	3817.4400	4580901	聞きました誰
3819.9675	1.7700	overt	3819.9900	4583961	みんな一斉に振り向きました
3823.0275	2.5500	overt	3823.0500	4587633	メンサーだけはコンソールに座ったまま
3826.6275	3.3600	overt	3826.6500	4591953	インターフェースのパッドに期待を当てています
3831.3075	4.4700	overt	3831.3300	4597569	人間たちはボレスクのフィールドカメラ映像で見たはずなのに
3837.1275	2.9400	overt	3837.1500	4604553	ヘルメットを脱いだ兵器を見ても分からないようです
3841.2075	2.2200	overt	3841.2300	4609449	そこで彼らの方を向いていました
3844.5375	1.9200	overt	3844.5600	4613445	皆さんの警備ユニットです
3847.4475	1.1400	overt	3847.4700	4616937	みんな驚き
3849.7575	2.4000	overt	3849.7800	4619709	そして居心地悪そうな顔になりました
3853.5975	4.5900	overt	3853.6200	4624317	平気も居心地悪くなりますやはり時間がかかっても
3859.0275	2.9400	overt	3859.0500	4630833	予備のアーマンを引っ張り出すべきだったようです
3863.1075	2.2800	overt	3863.1300	4635729	居心地悪くなる理由の一つは
3866.2575	2.9700	overt	3866.2800	4639509	警備ユニットが招かれざる存在だからです
3870.3975	1.8900	overt	3870.4200	4644477	機関区画だけでなく
3873.0675	2.7000	overt	3873.0900	4647681	この惑星において招かれざる存在です
3876.8175	2.1900	overt	3876.8400	4652181	保険会社が警備ユニットの
3879.7275	2.0400	overt	3879.7500	4655673	態度を条件にするのは
3882.7875	3.9000	overt	3882.8100	4659345	それによって高額の追加料金を取れるということの他に
3887.7075	3.3900	overt	3887.7300	4665249	顧客の会話を常時録音できるという理由があります
3892.4175	1.7400	overt	3892.4400	4670901	兵器自身はこうして
3896.8275	1.3800	overt	3896.8500	4676193	勤務をする上で
3899.4075	3.3600	overt	3899.4300	4679289	必要なこと以外はモニターしていませんが
3903.7275	2.4600	overt	3903.7500	4684473	弊社は全記録にアクセスできます
3907.2675	3.1800	overt	3907.2900	4688721	そして勝手にデータマイニングをかけて
3911.2275	1.8600	overt	3911.2500	4693473	ライブに販売しているのです
3914.5875	4.0800	overt	3914.6100	4697505	これについて顧客の同意は得ていませんがみんな知っています
3919.6575	1.6200	overt	3919.6800	4703589	そして止めようがありません
3923.2875	1.6800	overt	3923.3100	4707945	週刊時間でサンジュー分
3927.0075	3.0000	overt	3927.0300	4712409	客観時間でサンヨン秒後に
3930.8175	4.6200	overt	3930.8400	4716981	メンサー博士が顔を上げて兵器を見てインターフェースを下げました
3937.0875	3.2100	overt	3937.1100	4724505	あの生物が危険動物リストに
3940.8375	2.2500	overt	3940.8600	4729005	乗っていない理由を調べるために
3944.3175	2.9700	overt	3944.3400	4733181	この地域の危険情報を見ているところよ
3948.9075	3.2700	overt	3948.9300	4738689	ピン類はデータが改ざんされていると言っている
3953.7075	1.0200	overt	3953.7300	4744449	あなたも見て
3957.5775	1.3200	overt	3957.6000	4749093	背面さ博士
3959.8875	2.8800	overt	3959.9100	4751865	調べるだけならキュービクルからでもできます
3963.8475	4.8000	overt	3963.8700	4756617	そうすればお互いに居心地の悪い思い寄せずに済んだでしょう
3969.9075	5.1600	overt	3969.9300	4763889	しかし言われた通りにメンサーが機関システムから取得しているフィードを得ました
3976.6575	4.1400	overt	3976.6800	4771989	危険情報は基本的に関連項目の長いリストです
3982.7475	1.0800	overt	3982.7700	4779297	学生と
3986.0775	3.1200	overt	3986.1000	4783293	特にこのハビタットがあるエリアの気象
3990.2175	2.9700	overt	3990.2400	4788261	チリ動物植物
3998.5575	1.4400	overt	3998.5800	4798269	交渉に関して
4002.1275	5.3700	overt	4002.1500	4802553	それらの一部または全体が絡む危険が列挙されています
4008.8475	3.1800	overt	4008.8700	4810617	リンクをたどれば詳細情報を記載した
4013.2275	1.5900	overt	4013.2500	4815873	サブレポートに飛びます
4016.4975	2.8500	overt	4016.5200	4819797	不愛そうなグラシン博士は
4020.3075	3.3900	overt	4020.3300	4824369	インターフェースをインプラントした強化人間で
4025.1675	2.6400	overt	4025.1900	4830201	彼がデータを調べているのが分かりました
4030.3575	5.6700	overt	4030.3800	4836429	他の人々はタッチインターフェース越しで遠い影のように感じるだけです
4037.9475	1.7400	overt	4037.9700	4845537	データ処理能力では
4040.7375	3.3300	overt	4040.7600	4848885	グラシン博士より兵器の方がはるかに強力です
4055.5275	2.9700	overt	4055.5500	4866633	ファーフェンスをインプラントした強化人間
4067.5275	2.7900	overt	4067.5500	4881033	人間たちの被害妄想だろうと思いました
4071.4275	3.6900	overt	4071.4500	4885713	インターフェースを使っても記述は読まねばなりません
4078.2075	2.5200	overt	4078.2300	4893849	望む楽は全文をです
4082.7375	3.5700	overt	4082.7600	4899285	非強化の人間はしばしば読み飛ばします
4087.2075	2.7000	overt	4087.2300	4904649	強化人間でもしばしば読み飛ばします
4099.6875	2.7600	overt	4099.7100	4919625	しかし一般警告セクションを見ていると
4103.8275	2.9100	overt	4103.8500	4924593	一部のフォーマットがおかしいことに気づきました
4108.3275	2.1000	overt	4108.3500	4929993	他のセクションと比較すると
4111.7475	2.5500	overt	4111.7700	4934097	確かに何かが消去されています
4115.6175	2.2500	overt	4115.6400	4938741	サブレポートのリンクも切れています
4122.7875	4.6500	overt	4122.8100	4947345	兵器は言いながらデータストレージを検索して消失部分を探しました
4132.3575	1.5000	overt	4132.3800	4958829	しかし見つかりません
4134.5775	2.4000	overt	4134.6000	4961493	単なるリンク破損ではなく
4139.2275	3.3300	overt	4139.2500	4967073	サブレポートそのものが何者かに消去されています
4143.9975	2.7900	overt	4144.0200	4972797	このような惑星調査パッケージでは
4147.6275	3.4800	overt	4147.6500	4977153	本来ありえないことですがどうやらあり得るようです
4152.4875	2.1600	overt	4152.5100	4982985	一般警告セクションと
4155.6975	3.6000	overt	4155.7200	4986837	動物分野の一部が消去されていますね
4160.9175	2.2200	overt	4160.9400	4993101	腹立たしげな反応が起きました
4164.0975	4.6500	overt	4164.1200	4996917	ピンリーとオバースは大きな声で苛立ちを表明し
4171.1775	3.6900	overt	4171.2000	5005413	ラッティは芝居がかった身振りで両手を宙に掲げました
4181.1375	2.0400	overt	4181.1600	5017365	帝国セクションと動物
4190.3475	3.3000	overt	4190.3700	5028417	彼らは全員が親しい友人同士なので
4194.6675	4.3800	overt	4194.6900	5033601	平家が前回契約した調査隊に比べて感情表現が
4202.7375	1.1700	overt	4202.7600	5043285	その点で
4205.2875	1.5000	overt	4205.3100	5046345	今回の契約は
4208.1975	4.3800	overt	4208.2200	5049837	割合に楽しく勤務できていると正直に認めてもいいでしょう
4213.4475	2.2200	overt	4213.4700	5056137	しかし謎の生物に
4216.8975	5.1600	overt	4216.9200	5060277	バーラドアジと一緒に食われかけてからは話が別です
