onset	duration	trial_type	wav_onset	sample	value
2626.7875	7.2600	overt	2626.8300	3152145	でこいちどんな貨物でもぐんぶん引っ張った力持ち国を作るのに精いっぱい働いた頑張りや
2634.7075	2.9700	overt	2634.7500	3161649	みんなに愛された元人気者だったそうだよ
2638.6375	7.3200	overt	2638.6800	3166365	僕は向こうの話を聞いて以来ずっとこいつに憧れてたんだこんな立派なやつになれたらいいなと思ってた
2646.7975	2.0100	overt	2646.8400	3176157	そうなるつもりで働いてきたんだ
2659.2175	3.6600	overt	2659.2600	3191061	それが僕たちを迎えてくれるんだからね最高だよ
2663.6275	5.3700	overt	2663.6700	3196353	僕たちが種積みの仕事を頑張ったからだろうな気まいがいいや
2671.3375	8.5800	overt	2671.3800	3205605	エルコ君は記者の話をいつまでも従ったけど私も記者のことはあんまり知らないし陽子ちゃんも知識がないらしく
2681.0575	1.3200	overt	2681.1000	3217269	博物館の
2682.9175	4.6500	overt	2682.9600	3219501	映像狩猟で見たことあると言っていたツムちゃんといくらか
2688.2275	1.8300	overt	2688.2700	3225873	盛り上がっていたけれど
2690.8975	4.7700	overt	2690.9400	3229077	女の子サン人相手では記者への思いを語り尽くせないようだった
2701.4275	2.5800	overt	2701.4700	3241713	かっこいいのにさ夢たち見る目がないな
2713.3975	1.6500	overt	2713.4400	3256077	なんて文句をたれるのだった
2719.1575	4.3200	overt	2719.2000	3262989	しばらく棚が続くよ海の大穴と呼ばれる次の国への
2724.1075	3.1200	overt	2724.1500	3268929	越境口まではなだらかなものさ
2728.1575	2.6700	overt	2728.2000	3273789	すまんないけど大変よろしくてよ
2732.8375	3.6900	overt	2732.8800	3279405	シャワーでも浴びてきたらさっきトイレ探してたらあったわよ
2754.6475	1.5600	overt	2754.6900	3305577	サインだよ
2758.3075	2.2200	overt	2758.3500	3309969	ゆっくりしてらっしゃい私
2761.3075	4.3200	overt	2761.3500	3313569	飲食の支度くはケッチンのぞいたら何かできそうだったから
2766.4375	1.6500	overt	2766.4800	3319725	手伝うよ僕も
2768.7775	4.3500	overt	2768.8200	3322533	マジ助かる洗濯は後でまとめてしようよ俺もったいないし
2788.3675	2.3100	overt	2788.4100	3346041	あれ込みつけたからさ缶詰の
2791.9675	1.5900	overt	2792.0100	3350361	野菜もお肉もあったし
2794.2475	2.4900	overt	2794.2900	3353097	これでも買ってるよ作っちゃったよ
2797.5775	5.4900	overt	2797.6200	3357093	この料理は最高だぜぜひ各国の伝統料理として伝えてほしいものだね
2804.8375	4.3200	overt	2804.8800	3365805	ご飯もジャポニカ米なんだよね春の国はインディカ系だったけど
2809.7275	5.1900	overt	2809.7700	3371673	華麗感も赤感だったしこの列車の中だけちょっと古めの日本って感じ昭和みたいな
2817.1075	1.2600	overt	2817.1500	3380529	戦前みたいな
2824.9075	1.8000	overt	2824.9500	3389889	ここまで古くなくていいけど
2981.0275	1.2900	overt	2981.0700	3577233	私が生まれた時代よ
2983.2175	3.3300	overt	2983.2600	3579861	良子ってそんな昔の人なの野生は長いから
2987.9575	7.9500	overt	2988.0000	3585549	あかんないこと言ってないで食べようぜ僕お腹すいたよ陽子がみんなでそろってだとかうるさくてさ
2996.8675	6.0000	overt	2996.9100	3596241	カレーなんてみんなで食べるからおいしいのよ一人で食べたってあっという間に終わっちゃってつまんない
3009.8875	6.2700	overt	3009.9300	3611865	マジもお腹すいたして顔変わりやる私カレーならサン倍とか余裕の人だから
3017.9875	2.6100	overt	3018.0300	3621585	釜が大きかったから一生耐えちった
3061.7275	3.2400	overt	3061.7700	3674073	みんな揃ったじゃないか早部行きをそう始めようぜ
3065.9875	3.6000	overt	3066.0300	3679185	汚いこと言わないのあんたにも教えなくちゃいけないわね
3134.5975	6.8100	overt	3134.6400	3761517	今更お祈り勘弁してくれよそっちの文化ならお好きにやってくれそんな長いものじゃないわよ
3143.1775	2.1600	overt	3143.2200	3771813	さあ手を合わせていただきます
3148.7575	1.1100	overt	3148.8000	3778509	さあ食べちゃって
3214.5175	3.8400	overt	3214.5600	3857421	さっきのいただきますさあ給食みたいだったねおいしい
3219.5275	2.9100	overt	3219.5700	3863433	全然濃くないよちょうどちょうど
3225.8575	3.8400	overt	3225.9000	3871029	袋をゆがいたやつもよかったがこいつはまた別格だな
3230.6275	2.2200	overt	3230.6700	3876753	うますぎて後悔が募るぜ
3235.0675	5.8200	overt	3235.1100	3882081	あんたには悪いことしたわねいやいやつまらない回逆と思ってくれうまいよ
3243.8875	1.9200	overt	3243.9300	3892665	よかったたくさん食べなさい
3252.7975	4.7400	overt	3252.8400	3903357	終わりそうはぎやあんたが熱きすぎよ女の子なんだからもう少し可愛く食べなさい
3262.3375	1.8000	overt	3262.3800	3914805	男も女もあるかっていうの
3265.5175	1.5300	overt	3265.5600	3918621	おかわりその質
3268.9675	3.0900	overt	3269.0100	3922761	自分で好きなだけやるし大盛りに
3276.2275	8.5800	overt	3276.2700	3931473	祭典の時も思ったけどあんたよく食べるわねもともと食べる方なんだけどさなんかこっち来てから腹減るんだよね
3285.3775	2.2800	overt	3285.4200	3942453	謎にやっぱよく動くからかな
3288.2875	3.0600	overt	3288.3300	3945945	スーパーパーも使うしカレーカレー
3292.6375	1.8900	overt	3292.6800	3951165	でもスタイルいいよねツムちゃん
3295.0375	2.4900	overt	3295.0800	3954045	私謎に太らない人だから
3298.3975	6.8100	overt	3298.4400	3958077	私結構デブりやすいんだよねママも言ってたそれ大丈夫パパはちょっとぽっちゃりしてるままが好きなんだって
3305.9275	3.4500	overt	3305.9700	3967113	それ絶対気使われてるやつだよ
3311.3275	1.8300	overt	3311.3700	3973593	ラビングママだから気にしないって
3314.6875	4.8600	overt	3314.7300	3977625	うますぎ王様の料理もさすがにうまかったけどさこっちもやば
3320.6275	5.3700	overt	3320.6700	3984753	てか陽光料理の才能あんじゃないバカ馬なんだけどあんたカレーが好きなんでしょ
3327.1975	4.8900	overt	3327.2400	3992637	いっかり食べなさい言われなくてもだしカレーはマイヘイバリットの一つだからね
3332.7475	3.9900	overt	3332.7900	3999297	あと唐揚げとかとんかつとか男の子みたいな好みね
3337.3675	3.3600	overt	3337.4100	4004841	人が褒めてやってるのにいちいちそういうことを言うよねあなた
3348.2575	2.7000	overt	3348.3000	4017909	ちょっとひるこ何をそのスプーンの持ち方
3352.3075	1.2300	overt	3352.3500	4022769	そんな持ち方してたの
3355.9375	3.3000	overt	3355.9800	4027125	そんなにぎるように持つんじゃないの指で支えなさい
3360.6775	4.1100	overt	3360.7200	4032813	手首がひっくり返るように持つなんてあんまり格好が悪いよ
3384.4075	1.4100	overt	3384.4500	4061289	くたってくれるからいいんだよ
3388.2475	2.2800	overt	3388.2900	4065897	よくないわよよそさまの前に出て
3391.2475	4.5000	overt	3391.2900	4069497	出たら恥ずかしいでしょみんなとご飯を食べる時に笑われちゃうわ
3397.4275	3.5400	overt	3397.4700	4076913	笑わせときゃいいさそれで飯の味が変わるわけじゃないし
3401.6875	1.8600	overt	3401.7300	4082025	いいから私の真似をしなさい
3405.4675	1.4100	overt	3405.5100	4086561	大変わりついてくれよ
3416.6575	2.3700	overt	3416.7000	4099989	紬の場合にしてくれ山ができちゃうよ
3420.1375	4.8000	overt	3420.1800	4104165	私もう一回これいけるからね全然僕だってニ回はいけるさ張り合うなよ
3426.9475	2.1300	overt	3426.9900	4112337	へえ頑張ってみるよ母さん
3429.8275	5.1300	overt	3429.8700	4115793	つむび卵があったから味に飽きたらかけて食べたりしなさい
3436.0675	5.0100	overt	3436.1100	4123281	私卵好きなんだよね王様の時も卵料理よく食べてたもんねバレてた
3441.7675	2.5500	overt	3441.8100	4130121	あんたも質の番してないで食べなさい
3445.4875	1.2900	overt	3445.5300	4134585	どうかありもしなさいよ
3447.2875	2.2200	overt	3447.3300	4136745	あと昼子あんたもシャワー浴びなさい
3450.8575	4.2600	overt	3450.9000	4141029	裾だとか泥まみれじゃない僕はいいよそういう文化じゃないんだ
3455.9575	1.1700	overt	3456.0000	4147149	文化に逃げるな
3603.0475	2.4000	overt	3603.0900	4323657	ご飯を終わり後片付けも済んで
3607.8175	5.6700	overt	3607.8600	4329381	残ったご飯で塩結びを作ってしまうと私たちは座席が並ぶ車両に移動して海を眺めた
3614.3275	4.9200	overt	3614.3700	4337193	サン人崖の席に並んで座りそれぞれの足を向かいの背もたれに放り出している
3620.1775	3.7800	overt	3620.2200	4344213	春の国にて歩き通した足を洗う
3624.5275	3.3000	overt	3624.5700	4349433	あられもない格好でねぎらっていたのだった
3629.4475	4.6200	overt	3629.4900	4355337	膨みまくってもうパンパンだったから靴の中で破裂しそうだったんだもん
3635.0875	2.4300	overt	3635.1300	4362105	裸になって現れた長い指を
3638.3575	4.4700	overt	3638.4000	4366029	ユニギュニと曲げながらつむちゃんが漏らす私の足より遠くにあるのは
3644.2075	2.0400	overt	3644.2500	4373049	それだけツムちゃんの足が長いのだ
3647.8075	6.3000	overt	3647.8500	4377369	石をなめて出さなかったら靴脱ぎはしなかったわよジャカジャカジャンジャカ出て止まらなかったから
3655.6075	3.9000	overt	3655.6500	4386729	言わんでいいもう線が抜けたみたいにジャージャー出ちゃって
3660.1375	1.3500	overt	3660.1800	4392165	だから言うなって
3670.4275	4.5900	overt	3670.4700	4404513	陽子ちゃんが窓際に放り出した足をたまに窓の向こう
3681.2275	4.2000	overt	3681.2700	4417473	それ危なくない岩とかにぶつかったら怪我するよ
3686.6875	4.6200	overt	3686.7300	4424025	大丈夫前方注意しながらやってるから水流が冷たくて気持ちいいわ
3692.2975	2.6700	overt	3692.3400	4430757	ロークもやろう私もじゃあ私も
3696.1975	3.9900	overt	3696.2400	4435437	後ろの席につけなさい私が引っ込めたらみんなも引っ込めるのよ
3701.7475	2.5500	overt	3701.7900	4442097	深海サメが来たらかじられないようにね
3707.8375	5.9100	overt	3707.8800	4449405	サメ来てるさ見なかった小さなサメたちが列車の後ろをついてきている
3715.1575	1.9500	overt	3715.2000	4458189	僕たちを狙っているのかね
3718.6375	4.8600	overt	3718.6800	4462365	列車の勢いを利用してるんだよヨットの後ろとかイルカがつくって言うもん
3727.2175	4.3500	overt	3727.2600	4472661	海底を進む列車の周りには冷めばかりでなく
3732.7975	2.6100	overt	3732.8400	4479357	大小の魚かまとわりついて
3738.1975	2.5200	overt	3738.2400	4485837	列車に並走したり離れて行ったり
3741.8875	1.8300	overt	3741.9300	4490265	また別のがやってきたり
3745.1575	6.5700	overt	3745.2000	4494189	それが車窓から漏れる明かりに照らされてウロコやヒレをキラキラさせていたから
3752.3575	6.5700	overt	3752.4000	4502829	なんだかショウインドを眺めているみたいでめくりめく警官にいつまでも開けないのだった
3771.1675	4.5000	overt	3771.2100	4525401	そんなところに足先を突っ込んでみるのもまたなんとも面白いのだった
3776.5675	3.7500	overt	3776.6100	4531881	みんなの足先が海の中でワキワキしているのもおかしいのだ
3790.4875	1.9800	overt	3790.5300	4548585	サン両引かれていく車両は
3792.9775	2.8500	overt	3793.0200	4551573	一つが客席一つが寝台車
3796.6075	4.3500	overt	3796.6500	4555929	最後の一つがキッチンカー寝台車にはヨン人ベッドの
3803.2075	3.2400	overt	3803.2500	4563849	ニ部屋ニ段ベッドが向かい合い
3806.9575	8.3100	overt	3807.0000	4568349	枕元には窓があって流れていく海が見えた私たちは一室に集まりニ階にはひるこくんと陽子ちゃんひるこくんの下に私
3816.1975	7.3200	overt	3816.2400	4579437	陽子ちゃんの下にはツムちゃんが陣取ったきれいになってお腹も膨れたけどその分疲れが出てきた体を横たえて
3824.2375	3.5700	overt	3824.2800	4589085	しばらくは流れる夜の海を眺めていた
3830.1175	2.0100	overt	3830.1600	4596141	さすがに窓を開かないわね
3833.5075	2.3400	overt	3833.5500	4600209	やめてよ寝ている間にサメとか
3847.0375	1.3200	overt	3847.0800	4616445	取り込んできたらどうすんの
