onset	duration	trial_type	wav_onset	sample	value
7.8475	1.6200	overt	7.8900	9417	あああ
30.4675	5.1300	overt	30.5100	36561	やることは身が十分あとはこれを受け入れるかどうか
37.5775	5.5200	overt	37.6200	45093	ふらふらするだろう休んでいてもいいぜいくよさすがにね最後は
62.3275	4.5300	overt	62.3700	74793	王様最後外に出たいと言った外はゆっくりと夜が明けつつあって
68.9275	5.3100	overt	68.9700	82713	夜明けの風を感じたいのだと言って王様は折れた足で立ち上がった
75.1075	3.2400	overt	75.1500	90129	陽子ちゃんに支えられながらでも自分で歩いた
84.6775	5.0100	overt	84.7200	101613	春の国をすべた王よ千年の繁栄を享受した一族の王様として
90.5275	1.8000	overt	90.5700	108633	大地との約束を果たせ
94.0375	5.8500	overt	94.0800	112845	さかずきの死を受け入れその命を古き友へと返せそなたを知らぬ子らを愛せ
100.5475	3.4800	overt	100.5900	120657	その献身を古き神の目前に示せ
105.9475	2.7900	overt	105.9900	127137	ゆるこくんから王様へと杯が渡る
109.5775	2.4900	overt	109.6200	131493	王様は杯を抱え見つめた
112.6075	1.0200	overt	112.6500	135129	恐ろしいかい
114.7975	5.4900	overt	114.8400	137757	王はただ心配なのだ彼女たちも彼女たちでその役目を果たすさ
122.6875	2.6400	overt	122.7300	147225	王様は酒漬を持ち上げて口につけた
126.6775	3.9300	overt	126.7200	152013	おびえる様子もなく急ぐ様子もなくゆっくりと一息に飲み干した
132.7975	2.6700	overt	132.8400	159357	杯を下げると長く息をついた
145.2775	3.7800	overt	145.3200	174333	第一が君を受け入れる君の勇気君の愛
149.7175	2.7600	overt	149.7600	179661	未来への愛を示した君を祝福しているよ
154.2175	2.8800	overt	154.2600	185061	悪かったねあんなことを言って君は立派だ
158.7175	5.6400	overt	158.7600	190461	頑張れ王は行こうそなたたちの父となれて王は楽しかった
172.7275	3.4800	overt	172.7700	207273	おさまは眠りについた横たわり瞳を閉じる王様
179.0275	2.7000	overt	179.0700	214833	その体に用意していた布をかけていく
183.9475	2.8500	overt	183.9900	220737	眠っているみたい静かに目を閉じ
187.5475	7.1400	overt	187.5900	225057	笑っていた口は再び開くことはなく朝焼けの中で何かが去っていった巨大な体が横たわっていった
199.1875	1.6500	overt	199.2300	239025	これが死ぬってこと
201.8875	2.1900	overt	201.9300	242265	これは一つの風景に過ぎない
205.0975	1.5000	overt	205.1400	246117	私は瞬間じゃない
208.3675	5.6400	overt	208.4100	250041	私は一つの出来事ではなく一人の出来事でもないとひるこくんは言った
214.8175	6.0900	overt	214.8600	257781	季節のようにいつからか始まりその色合いを濃くしていく時代なのだと
222.7075	3.9000	overt	222.7500	267249	王の死によってこの国はいよいよ死を体験することになる
242.2375	2.4600	overt	242.2800	290685	さあ行こう次の国に進まなくては
250.0075	2.9100	overt	250.0500	300009	始まる新たな一日に静養をされて
256.8475	1.7700	overt	256.8900	308217	私たちは王様と別れ
280.8475	1.5000	overt	280.8900	337017	アイデンから袋まで
283.4575	3.2400	overt	283.5000	340149	ニ日前に歩いた道を私たちは急ぎ戻った
288.3475	3.3300	overt	288.3900	346017	森を抜け平原の向こうに目黒が見える頃
298.3975	6.0900	overt	298.4400	358077	変化に気づいたのは行動を抜けたあたり抜けた先はもう日暮れだろうと思っていたのだが
305.5075	8.0400	overt	305.5500	366609	まだまだ散々と日が輝いていて行動の中で一日が経ってしまったかと錯覚したほどだった
316.1875	2.8200	overt	316.2300	379425	命が散りこの時代も終わり始めているんだ
319.9075	5.4900	overt	319.9500	383889	だんだんと巡りが遅くなり最後には本当の冬の中で止まる
327.2875	1.5000	overt	327.3300	392745	名言を進むと
330.4075	7.5000	overt	330.4500	396489	生き身は実っていた稲穂たちが刈り入れられ裸になった田が広がっていた
339.7675	4.2300	overt	339.8100	407721	ああ袋髪の前にそびえる頃ツムちゃんが見つける
355.2175	3.2100	overt	355.2600	426261	桜が散っていたハラハラと音もなく散って
359.3275	2.7600	overt	359.3700	431193	静まの火を反射しながら輝いている
398.6275	3.9000	overt	398.6700	478353	花びらが道に階段に水路に風車に積もり
403.4275	3.9300	overt	403.4700	484113	積もった花びらが慌ただしく生き返る人々の足元で
411.4675	5.6400	overt	411.5100	493761	青木見ると姉姫様の塔から縄が伝え
419.6275	1.9200	overt	419.6700	503553	裏の外へと降りている
425.5375	3.7800	overt	425.5800	510645	まるで大木を切り倒す前の準備のようにも見えたそんな
429.9175	3.2100	overt	429.9600	515901	あの姫様の塔からは次々と人が降りて
433.9075	2.3700	overt	433.9500	520689	それぞれ重たそうな荷物を抱えていた
437.2075	6.2700	overt	437.2500	524649	糖を切り倒して負けにするとおっしゃってな本当の冬が来れば塔が崩れ落ちることもあろうし
444.0175	5.7000	overt	444.0600	532821	まだあんなてっぺんにいては采配もできぬと言って急に発裂としなすったが
450.2875	3.2100	overt	450.3300	540345	いやどうしてなかなか見事な采配っぷりだ
454.5475	2.0100	overt	454.5900	545457	それに引き換え妹の方は
461.3275	2.1600	overt	461.3700	553593	私目の私目の花が
474.4075	3.2400	overt	474.4500	569289	何もかも終わり私が私でなくなっていく
479.1175	2.0700	overt	479.1600	574941	どうしてこんなむごいゆどい
485.4175	6.3000	overt	485.4600	582501	自信がある連中なんて案外もろいもんさよりどころがなくなりゃ立てやしないんだから
500.9575	1.5900	overt	501.0000	601149	美しさも賢さも
504.1675	1.0200	overt	504.2100	605001	珍しさも
505.8475	3.3900	overt	505.8900	607017	それを頼りにする人々の足腰を揺らくしてしまうよ
522.0475	3.3000	overt	522.0900	626457	それぞれ初戦博ない偽りだというのにね
535.4575	3.9900	overt	535.5000	642549	後にしようとしたところ覚えのある声が聞こえる
541.2775	2.9400	overt	541.3200	649533	そこはそっちじゃない向こうはあっちじゃ
545.5075	1.4700	overt	545.5500	654609	ミコドたちよ
548.8375	5.0700	overt	548.8800	658605	私たちに気づいてかけてくる見事種爪の大役
554.5075	1.5300	overt	554.5500	665409	果たしてくれたようだな
556.8175	3.3000	overt	556.8600	668181	彼女は私たちのそばまでやってきて私たちを見上げた
563.4475	1.8600	overt	563.4900	676137	角の桜がもう散っている
565.8775	3.9600	overt	565.9200	679053	そなたたちの黒ねぎらってやらねばならんの
570.7675	2.7600	overt	570.8100	684921	しかしすまぬよ笑わは今お忙し
574.3075	5.1000	overt	574.3500	689169	というのも妹のやつが寝込んでおってな迫る本当の冬に向かうこの国よ
581.0275	2.8500	overt	581.0700	697233	あらわがかじ取りせねばならぬゆえ
585.5875	4.1400	overt	585.6300	702705	姉姫様はそれが誇らしくて仕方ないように胸を張って言うのだ
592.6375	3.3000	overt	592.6800	711165	私たちものんびりしてらんないしこのまま海に向かうわ
597.1975	4.3200	overt	597.2400	716637	夏の国へ向かうか夏の国は手ごわいかもしれんぞ
602.2375	3.9000	overt	602.2800	722685	わらわたちのように素直ではないだろうからなあそこはあんた
606.6475	1.7400	overt	606.6900	727977	背のことを気にしなくなったわね
608.9875	1.6500	overt	609.0300	730785	角の桜も散っちゃって
611.7175	2.3400	overt	611.7600	734061	そんなさまつなこと気にしておれんよ
623.8675	8.2500	overt	623.9100	748641	それが本当の姉というものなのじゃよいかみ子たちよ本当の大きさ偉大さとは世代さとは
632.8675	3.9300	overt	632.9100	759441	心にこそ宿る一族を導かんとする心にな
643.6375	4.5300	overt	643.6800	772365	おうさまを心配してたけど今のあんたなら
649.3975	1.7400	overt	649.4400	779277	誇りに思うことでしょう
652.3675	4.2300	overt	652.4100	782841	その時姉姫様の瞳がはじかれたように開かれた
657.8575	2.4300	overt	657.9000	789429	眉の形がわずかに悲しくゆがんだ
665.2675	3.9900	overt	665.3100	798321	洗っていた口元が迷子の子供のように不安にスウォーム
670.8775	5.7600	overt	670.9200	805053	姉様たちは姉姫様は振り返って私たちに背を向けた当たり前であろう
677.5375	4.8300	overt	677.5800	813045	わらわは姉であったのだからな恥ずかしくないよ最後まで務めるつもりだ
684.8875	3.9900	overt	684.9300	821865	言わらないうちに姫様は大きな笑い声を上げて
689.8075	5.5800	overt	689.8500	827769	桜を巻き上げながら走っていったさらばだみ子たちよ健闘を祈っておるぞ
697.7575	3.6000	overt	697.8000	837309	あんな感じなんだ案外淡白なもんだね
703.0675	6.3600	overt	703.1100	843681	金姫様の背中を見送りながらつむちゃんがつぶやくそれをひるこくんはやっと首を振る
712.0375	7.7400	overt	712.0800	854445	彼女なりに立派な姉を務めようとしている姿だよ全ての者たちにとって未明の時代が訪れる
720.4075	3.2700	overt	720.4500	864489	その不安を忙しくして忘れようとしているんだ
724.3075	4.3200	overt	724.3500	869169	未だ残る何かに頼りながらただ最後にはそれも失われる
730.5175	6.0000	overt	730.5600	876621	誰もがそれぞれの形で未明の時に怯えているのさこれから訪れるこの国の終わりに
740.5075	10.3200	overt	740.5500	888609	種摘みの儀式が終わると終わり王が散ると一族は解散へと向かう一族として物語られていたらしさは失われノペラの種人へと戻っていく
751.8775	5.7900	overt	751.9200	902253	種一重と戻った神々は本当の冬の中で眠りにつき
758.8075	1.2600	overt	758.8500	910569	こっちへ帰っていくのだ
767.5375	6.0000	overt	767.5800	921045	以降目がだいぶ大きくなったそろそろ嘘をついた人がこの国を追う頃だ
841.1275	5.7000	overt	841.1700	1009353	立ち上がろうとするも力が湧かない水気でパンパンに膨らんだ体は重くよどんでいる
847.6375	1.8600	overt	847.6800	1017165	足の裏のむくみもひどい
850.4875	6.6600	overt	850.5300	1020585	綿の上を歩いているみたいに歩行の感覚が鈍かった疲れているわけじゃない体の中が循環していない
857.7775	2.8200	overt	857.8200	1029333	目の前の泥と同じでぬかるんでいるのだ
861.5875	3.1200	overt	861.6300	1033905	血液が巡ることをやめ詰まった体は
865.8475	2.3400	overt	865.8900	1039017	歩く力を生むことができなかった
869.8075	1.2600	overt	869.8500	1043769	破裂手相
872.5675	1.9500	overt	872.6100	1047081	体の異変は雨とともに始まった
877.6075	8.9100	overt	877.6500	1053129	なんか体だるくない最初に口にしたのはつむちゃんだったけれど私もすでに感じていた体がブヨブヨしてる水ぶくれしてるみたい
887.3575	2.9400	overt	887.4000	1064829	そこで私たちは思い出したのだった出していない
894.6475	4.6800	overt	894.6900	1073577	私たちはこっちの国に来てからずっと排出ができていなかった
902.4475	1.2900	overt	902.4900	1082937	もしかして
905.2675	3.4500	overt	905.3100	1086321	育子君が陽子ちゃんの腕をつかむ顔をしかめた
909.9175	3.9300	overt	909.9600	1091901	巡りが悪いまだ体が影響しきれ
914.9275	1.1100	overt	914.9700	1097913	っていなかったんだ
917.6875	3.3000	overt	917.7300	1101225	もっと塩を取る必要があった僕も気づいてやればよかった
922.6675	4.9200	overt	922.7100	1107201	またこの雨本当の冬の決心嘘をついた人による雨だよ
935.2975	2.9700	overt	935.3400	1122357	嘘をついた人の登場は防げたが雨はやまない
941.4175	5.8500	overt	941.4600	1129701	世代を終わらせる時を抜かるませていく重い雨だその重さが
948.1075	2.6400	overt	948.1500	1137729	君たちの体にたまっているのだろうぜ
952.5475	5.2800	overt	952.5900	1143057	排出されずたまり続けた水その重さに私たちはやられてしまったのだ
963.4375	2.6700	overt	963.4800	1156125	エリコ君が助け起こしてくれる
966.9775	1.8900	overt	967.0200	1160373	早いとこしようで下毒しよう
1000.5175	3.5400	overt	1000.5600	1200621	巡りを止めている君たちの体を塩で洗い流すんだ
1005.4075	6.3900	overt	1005.4500	1206489	塩焼きの浜が見えてくればもうすぐだそう言ってヒルコプンは何度目になるか慰めてくれた
1020.7075	2.5500	overt	1020.7500	1224849	塩には塩田のトマヤが並ぶ
1024.4275	3.0900	overt	1024.4700	1229313	しかし人々は去った後で廃墟と化していた
1028.3575	7.1400	overt	1028.4000	1234029	その中を塩を求めてさまよう砂だ壺の縁を脱ぐってなめても求める味はしてこない
1036.3675	3.1800	overt	1036.4100	1243641	濁った水のたまった水風船みたいなこの体
1040.2975	8.1900	overt	1040.3400	1248357	フォークで突き刺してプシュッと景気よく抜いてしまいたいこのパンパンに張った体から水を抜いたらどんなに気持ちいいだろう
1049.3875	5.7000	overt	1049.4300	1259265	もうそのことしか頭になかった排出したい水気を出したい循環させたい
1055.7175	4.8000	overt	1055.7600	1266861	その欲求だけに突き動かされながら私は廃屋の中をさまよっていた
1062.5875	3.3000	overt	1062.6300	1275105	まあまあ陽子外でつむちゃんの声が聞こえた
1066.6375	3.5400	overt	1066.6800	1279965	ミスズヨコおいですごいぜひるこくんも叫んでいる
1071.8575	2.7000	overt	1071.9000	1286229	早く来いって最高だよこんなの
1080.2275	1.0500	overt	1080.2700	1296273	見てくれよこれ
1081.7875	1.8600	overt	1081.8300	1298145	デゴイチだすごいだろう
1084.5175	6.2700	overt	1084.5600	1301421	波の向こう黒々とした鋼の塊が海の中にたたずんでいた
1091.7475	1.4700	overt	1091.7900	1310097	あるはずのない場所に
1094.2075	4.6800	overt	1094.2500	1313049	あるはずのない異物が長く横たわっている様子が私たちを引きつける
1099.4875	3.4200	overt	1099.5300	1319385	私たちは打ち寄せてくる波を分けて進んだ
1103.6575	4.9500	overt	1103.7000	1324389	足元は元より濡れてぐちゃぐちゃだったから海に浸かることなんて気に
1109.2375	1.1400	overt	1109.2800	1331085	もうしなかった
1112.3275	4.4700	overt	1112.3700	1334793	近づくとその漆黒の塊はますます海の中で異彩を放つ
1118.8675	3.3300	overt	1118.9100	1342641	その機関室からひるこくんが半身を乗り出し
1123.0375	5.6100	overt	1123.0800	1347645	本当に嬉しそうに手を振ってくるのだったすごいだろうかっこいいよああすごいや
1130.4775	3.9600	overt	1130.5200	1356573	私と陽子ちゃんはそれが何なのか分からずただ見上げていた
1135.0075	2.2200	overt	1135.0500	1362009	いや何であるか分かるのだけれども
1137.7975	2.4600	overt	1137.8400	1365357	なんでこんなところにこんなものがあるのだろう
1142.3875	2.8800	overt	1142.4300	1370865	戸惑っていると奥の車両からつむちゃんが顔を出す
1146.1075	3.6600	overt	1146.1500	1375329	ここキッチンかレストラン塩あるよ塩たくさんある
1150.5475	2.4600	overt	1150.5900	1380657	聞いた途端飛び乗った期間
1153.5475	3.8400	overt	1153.5900	1384257	後手に捕まり背後の車両に飛び乗る
1158.7975	1.3200	overt	1158.8400	1390557	廊下を駆け抜けた
1160.9875	3.3300	overt	1161.0300	1393185	座席の間を駆け抜け
1165.0075	1.5600	overt	1165.0500	1398009	最高日になだれ込む
1168.5175	3.6900	overt	1168.5600	1402221	白いクロスのかかった長テーブルがアールデコ調の
1173.1075	1.5900	overt	1173.1500	1407729	椅子に囲まれてある
1176.4375	2.1000	overt	1176.4800	1411725	その奥カウンターの向こう
1181.0875	3.8100	overt	1181.1300	1417305	つむちゃんが手を振っていない方の手をなめていた
1311.9175	4.8000	overt	1311.9600	1574301	ツムちゃんの声になめる姿に私たちははじけるような勢いで走り出した
1317.7675	2.7600	overt	1317.8100	1581321	きれいに敷かれたテーブルクロスに手をつけ
1343.9575	1.8600	overt	1344.0000	1612749	ミスト時計奥へ奥へ
1346.4175	5.8200	overt	1346.4600	1615701	つむちゃんが叫ぶ左手で呼んで右手をなめるその顔が染みて染みてたまらないという顔
1354.6675	2.9100	overt	1354.7100	1625601	瞳をきつく絞ると涙があふれていた
1358.2375	1.7700	overt	1358.2800	1629885	排水が始まっているのだ
1361.7175	3.3900	overt	1361.7600	1634061	水気を体から絞り出せているといううらやましたね
1365.9475	6.4800	overt	1365.9900	1639137	かける足も絡まりそう自らも味わいたくて仕方ない姿の姿を目の前にして
1372.9975	1.6800	overt	1373.0400	1647597	わずかな距離がひどく遠い
1393.1275	1.8300	overt	1393.1700	1671753	陽子ちゃんが私の手を引っ張る
1410.4375	3.9600	overt	1410.4800	1692525	未来の味わいを期待して口の中はよだれでいっぱいこぼれ落ちそう
1415.0575	2.6700	overt	1415.1000	1698069	塩をなめているつむちゃんが憎たらしいくらい気
1418.6575	1.5300	overt	1418.7000	1702389	気持ちが募った
1432.3975	2.4900	overt	1432.4400	1718877	ちゃんの足元に置かれた壺に駆け寄る
1435.5475	2.7300	overt	1435.5900	1722657	白い結晶少し洗いキス先が
1438.8475	1.8000	overt	1438.8900	1726617	明かりを跳ね返して光る
1554.8575	7.3800	overt	1554.9000	1865829	目をつかむとうれしくなっちゃうみつついてくる指を口元に持っていくとすでに出ていた下に濡れそうぼれそう
1562.7475	1.0500	overt	1562.7900	1875297	そこに
1565.5675	2.7600	overt	1565.6100	1878681	濡れそぼった底にこすりつけた
1624.7275	4.0200	overt	1624.7700	1949673	染み込む塩だ塩の衝撃が体に響き渡る
1629.7075	5.7000	overt	1629.7500	1955649	下から目の奥鼻の奥脳みその奥に潮が響き渡る
1638.5875	3.1800	overt	1638.6300	1966305	体の中心を取ってよどめ切っていた獅子に
1642.3075	3.2700	overt	1642.3500	1970769	セレンな響きをもたらす
1648.0075	1.1700	overt	1648.0500	1977609	口の中が
1649.7175	2.3400	overt	1649.7600	1979661	洪水目からは涙
1655.6875	7.2900	overt	1655.7300	1986825	隣の陽子ちゃんも泣いていた泣きながら目をかびらいて塩からそらさずよだれで
1666.5475	2.1600	overt	1666.5900	1999857	塩をまた握り指をなめる
1669.3075	5.0400	overt	1669.3500	2003169	なめるたびこらえきれないような表情で染み渡る塩に目を閉じていた
1675.6975	6.7800	overt	1675.7400	2010837	パンパンに詰まっていた水を類線からボロボロ毛穴からザブザブ音が出るほど絞り出しながら
1683.2875	4.6500	overt	1683.3300	2019945	手をベトベトにして獣のように私たちは死を囲み死をなみた
1689.6175	2.1300	overt	1689.6600	2027541	辛いのめっちゃ染みる止まんない
1692.6475	3.4200	overt	1692.6900	2031177	普通では考えられないくらい塩をなめている塩が止まらない
1697.8375	1.3200	overt	1697.8800	2037405	塩をなめるたび
1700.2075	6.3300	overt	1700.2500	2040249	血管の中ドロドロに汚れて詰まっていた壁を塩の結晶がゴシゴシとこそぎ落とし
1707.4075	6.1500	overt	1707.4500	2048889	ぬからみ鬱屈していた循環を活性化させていく音が確かに聞こえるのだ
1714.6375	2.2500	overt	1714.6800	2057565	塩の注入によって心臓がうなった
1757.5975	2.5200	overt	1757.6400	2109117	血が脳に獅子にかけ巡って
1761.4075	4.2300	overt	1761.4500	2113689	私の体の中をぐんぐん音を立てて回り始める
1767.4375	2.5800	overt	1767.4800	2120925	そしてそれはまずつむちゃんに訪れた
1787.5375	6.2700	overt	1787.5800	2145045	治水欲求咳の崩壊たまりきった毒素の排出下腹部に吐ち切れそうな重み
1800.4675	1.1400	overt	1800.5100	2160561	イチつしかないのも
1802.4175	1.9500	overt	1802.4600	2162901	親お嬢さん方どちらへ
1809.5575	4.0500	overt	1809.6000	2171469	言わぬが花の吉野山なるほどお花摘み
1822.9675	2.1600	overt	1823.0100	2187561	ゆるこくんの掛け声に合わせ
1826.4475	3.0600	overt	1826.4900	2191737	陽子ちゃんが列車の尻を引っ張る
1830.5875	4.5000	overt	1830.6300	2196705	本線からそれる補助線に車両を引け込むため
1835.9575	7.1400	overt	1836.0000	2203149	海の中腰まで疲れながら引っ張っていく陽子ちゃんの帰り機は私たちが乗る列車を雲なく動かすのだった
2128.3975	2.5500	overt	2128.4400	2554077	ヘルコ君が飛び降り
2132.1475	2.6400	overt	2132.1900	2558577	線路を切り替える両校乗ったわ
2138.5375	2.6400	overt	2138.5800	2566245	袖をまくりゆうこくんが手をすり合わせる
2141.9875	8.3700	overt	2142.0300	2570385	バルブや調整分圧力メーターが並ぶ機関室そこへ向かうヒロコ君の顔は音が聞こえていきそうなほど輝いている
2160.1375	4.3200	overt	2160.1800	2592165	これ燃料って何海の中を走るのに石炭ってことねえでしょう
2165.2975	5.0100	overt	2165.3400	2598357	そんなの考えたって仕方ないよこれはさおもちゃなんだから楽しい旅路が
2171.0575	4.1400	overt	2171.1000	2605269	東端で真っ黒透けてんじゃ面白くもないしね
2176.1875	4.0500	overt	2176.2300	2611425	でっきいおもちゃだことまねごとごっこ遊びだ
2181.2575	1.8300	overt	2181.3000	2617509	でもそれが一番楽しいんだ
2184.3475	3.2100	overt	2184.3900	2621217	ゆる子君がチェーンを引くと耳をつんざくような気的が鳴る
2188.3975	7.2300	overt	2188.4400	2626077	なんで石炭燃やしてねえのにスチームがあんのおかしいってロマンだよロマンライジなことだぜお嬢さん
2196.3175	2.9700	overt	2196.3600	2635581	私もやらせてとりあえず出発と行こうや
2203.4275	2.9400	overt	2203.4700	2644113	弁を壁絞るとメーターがぐんぐん上がっていく
2207.2975	4.1100	overt	2207.3400	2648757	足の下で車軸の回転が始まったのが伝わってきた
2213.3875	8.9100	overt	2213.4300	2656065	北条線に引き込まれていた汽車は今度は水平線に頭を向け本線に戻っていく
2223.3175	3.2700	overt	2223.3600	2667981	川林が押し寄せてくる波を断ち切って進む
2228.5075	3.1800	overt	2228.5500	2674209	進む先は何もない暴爆と広がる
2241.9475	2.0100	overt	2241.9900	2690337	ガタゴト速度を増していった
2246.8975	2.1000	overt	2246.9400	2696277	雨と風が私たちを叩いた
2253.1675	3.5700	overt	2253.2100	2703801	巨額取り留めがないほど広い様
2258.5075	2.6100	overt	2258.5500	2710209	ぼんやりしてつかみどころのない様
2263.1575	1.5300	overt	2263.2000	2715789	海の中を走ってる
2265.5875	2.4600	overt	2265.6300	2718705	危ないってママ陽子もやめな
2268.7675	5.1300	overt	2268.8100	2722521	取っ手につかまり吹きつけてくる雨と風を浴びているとツムちゃんに叱られる
2275.1875	1.5600	overt	2275.2300	2730225	てかさこれずっと
2278.9975	1.8000	overt	2279.0400	2734797	と朝が続くわけじゃないよね
2281.7875	1.6800	overt	2281.8300	2738145	海の中沈むんじゃないの
2300.6875	4.8600	overt	2300.7300	2760825	時期に棚が終わって一気に落ち込むそうなりゃ海の中を進むのだろうぜ
2312.2675	1.5900	overt	2312.3100	2774721	どうすんの溺れるじゃん
2314.6675	4.7700	overt	2314.7100	2777601	大丈夫さあの人の作ったものに海は浸食してこない
2320.0675	2.8200	overt	2320.1100	2784081	でもそうだねまず暗い締めた方がいいかも
2323.8775	1.3500	overt	2323.9200	2788653	魚が飛び込んでくる
2326.1575	5.7600	overt	2326.2000	2791389	いや魚ならいいが深海ザメなんかが踊り込んできたら車内めちゃくちゃにされちまうよ
2334.1675	2.2500	overt	2334.2100	2801001	まだ開いてないか見て回ろう競争
2478.0175	3.5100	overt	2478.0600	2973621	さあ急げ時期に朝せが終わるぜせかすなっての
2492.4775	4.5900	overt	2492.5200	2990973	ちょっと脱ぎを見てみなさいきれいよすごいよ海の中どんどん潜っていく
2611.6375	6.3900	overt	2611.6800	3133965	春の国の種摘みがうまくいったからかなあの人が僕に褒美をくれたんだよ
2619.1675	6.1200	overt	2619.2100	3143001	社長の帽子をいつまでもかぶってひるこくんはうれしそうにまた自慢げに記者のことを紹介してくれる
