onset	duration	trial_type	wav_onset	sample	value
2298.9142	11.4600	overt	2298.9600	2758697	それは確かにそのとおりねちょっと考えてみる考えの違いはあるにせよせめて個分の多様性を優先すべきっていう考えには同意してくれると嬉しいんだけど
2311.2742	11.9700	overt	2311.3200	2773529	私にとって重要なことの一つにエイザーナの遺体をどうするかってことがあるより多くの女性に魔女への扉を開放するというのはとても重要なことだと私は思う
2323.9642	6.3300	overt	2324.0100	2788757	だからこそ私はあなたについ最近古文に加入した魔女と会ってもらいたいの
2331.3142	6.6000	overt	2331.3600	2797577	本当に入ったばかりでまだ名前すら回っていないのよお願い彼女をここに呼んで道を示してあげて
2338.7842	8.2200	overt	2338.8300	2806541	そうすることであなたも多様性がいかにコブを豊かにするか感じられるはず構わないよいつでも来てって彼女に伝えといてありがとう
2347.7542	1.3500	overt	2347.8000	2817305	それじゃあ私行くね
2352.2542	5.1900	overt	2352.3000	2822705	選挙活動のためのチーム作りをしなくちゃいけないからまたねまたねダリア
2367.0442	4.3200	overt	2367.0900	2840453	大丈夫あなたに伝えなきゃいけないことがあるの訪れて
2372.6842	3.7500	overt	2372.7300	2847221	いい時があったら教えてちょうだいかしこジャスニー
2384.7442	7.4100	overt	2384.7900	2861693	こんにちはホルトゥーナ悲しい知らせがあるのどう話したらいいのかしらエイダーナが死んだ
2395.1842	4.6800	overt	2395.2300	2874221	ギエイダーなの遺体とあったからそうなのどんなようでここに来たの
2400.4642	11.6100	overt	2400.5100	2880557	やり残したことを処理するためにあなたの経験を取り消してくれたってことだったらよかったんだけどね自分の決断を正当化してたよこの宇宙の平和を守ろうままも
2413.4242	7.0500	overt	2413.4700	2896109	平和を守るためとかなんとかかわいそうなAだな私のルケーをどうするかは次の長が決めるみたい
2421.1642	7.2000	overt	2421.2100	2905397	そのことなんだけどまず最初に決めなくてはならないのはエイダーナの遺体をどうするかということ
2428.9642	2.8500	overt	2429.0100	2914757	ちょっと前にダリアが来て説明してくれた
2432.7142	8.0100	overt	2432.7600	2919257	ああそうなのね要は数は減るけどここは強くなる道を取るかここは弱くなるけど数は多くなる道を取るかってこと
2441.3242	3.5400	overt	2441.3700	2929589	あなたはどう思うの私は彼女を職すべきだと思う
2445.7942	6.0000	overt	2445.8400	2934953	今は指導体制が変わろうとしている時期だけにたくさんの信入を受け入れるのは得策じゃない
2454.5542	3.8100	overt	2454.6000	2945465	新たな方針を確立したりするのでいろいろ混乱してるしね
2459.1142	18.1200	overt	2459.1600	2950937	仲間の魔女たちのためにも私はこれまで以上に強くなる必要があると思うなるほどそこでなんだけど私長に立候補することにしたのすごいじゃない頑張ってありがとうエダーナの指導を経た今の子分には優しさと愛が必要だと思って
2482.6642	5.6100	overt	2482.7100	2979197	あなたの呪いのあなたの占いの力も大いに役立つと思う私に協力してくれる
2489.2042	1.0800	overt	2489.2500	2987045	まずはあなたの
2491.6642	6.1500	overt	2491.7100	2989997	指導方針を聞かせてああそうよねごめんなさい現在古分にはゴつの柱となる方がある
2503.0642	5.1600	overt	2503.1100	3003677	審判は古文内での衝突をしたわけであれに火があるかを等を決めるための
2509.9342	5.4600	overt	2509.9800	3011921	公文が目指す先や大きな出来事への対処方法なども決める最高部門的な要素もある
2519.5942	6.3600	overt	2519.6400	3023513	現在これはルーンの審判に委ねられているつまりエイザーナが聞く神々の声ってことね
2527.5142	3.9300	overt	2527.5600	3033017	私は魔女の裁きを外部の力に委ねるべきではないと思う
2531.9842	6.9900	overt	2532.0300	3038381	私の提案は古文で最も年長のヨン社と地方の話し合いによって
2541.5842	1.2300	overt	2541.6300	3049901	行うというもの
2549.8942	6.4200	overt	2549.9400	3059873	つまりあらゆる審判には古文で最も知恵のあるゴ人の魔女の同意が必要になるということよ
2558.3242	9.9600	overt	2558.3700	3069989	続いて処罰ね現在古文に危機を危険をもたらした魔女はその行為の重さに基づいた長さのルケーに処される
2568.9742	7.4700	overt	2569.0200	3082769	これは本当にひどい処置だと思う私の提案は違反を犯した魔女はその重さに応じて渓谷が加算され
2577.2842	4.2900	overt	2577.3300	3092741	それでも行いを改めなかった場合は古文をやめなくてはならなくなる
2582.4142	9.1800	overt	2582.4600	3098897	いかなる魔女にもあなたのような苦しみを与えるべきではないと思うから自分にあった新しい子分を探させる方がより人道的な解決策だと思う
2592.4042	5.1600	overt	2592.4500	3110885	続いて近畿についてすなわち危険の大きい魔法や知識ね
2599.3642	9.7800	overt	2599.4100	3119237	ウェヒモスの紹介やネクロマンシー等がこれに当たる現在古文は私たちの集団に危険をもたらすと判断したものを全て献起としている
2609.8342	5.0400	overt	2609.8800	3131801	そしてその方針に私も同意するよってこれに関しては今のままでいいと思う
2615.4442	14.4600	overt	2615.4900	3138533	次は有限生命体の扱いについてすなわち人間やその他の可動生物の扱いについてエイダーナは有限生命体は魔女の都合に合わせて作主可能な存在だと規定していた
2630.9842	6.9900	overt	2631.0300	3157181	私は全く好きになれない考え方よそもそも下等生物という呼び方自体がおかしいと思うし
2638.5442	4.4700	overt	2638.5900	3166253	私たちには人間たちの社会を守り導く責任があると思う
2643.9442	4.9800	overt	2643.9900	3172733	私たちは彼らの暮らしを良くする力があるのだからそれを役立てなきゃ
2651.1142	2.3100	overt	2651.1600	3181337	そして最後に魔女の務めについて
2656.0642	16.9800	overt	2656.1100	3187277	みんなが古文のために何をすべきかということね現在は悪名高いノルマ制度が採用されていてノルマを達成できなかった魔女はやがて古文から追い出されることになる私はこういうやり方で行動を監視するようなことはやめさせる
2674.3942	4.9500	overt	2674.4400	3209273	個々の魔女は常に自発的に子分のために努力してくれるものと信じてね
2680.0942	4.5900	overt	2680.1400	3216113	古文への貢献は個々のペースと判断で行われるべきだと思うから
2685.2842	3.9000	overt	2685.3300	3222341	それからエイダーナの遺体をどうするかという問題もあるわね
2691.0442	4.1100	overt	2691.0900	3229253	私は私たちで遺体を食してより強くなるべきだと思う
2697.5542	1.5600	overt	2697.6000	3237065	そんなところかしらね
2702.4742	3.8100	overt	2702.5200	3242969	どう思う私に協力してくれる悪いけどできないな
2707.3942	6.4800	overt	2707.4400	3248873	どうしてあなたの方針は私が好むものじゃないからそう分かった今すぐに決断しなくてもいいから
2714.6542	11.1900	overt	2714.7000	3257585	投票日までにあなたの信頼と主張を取り付けられるように私頑張るねよかったら私が紹介する魔女と会ってみない彼女と話せば私の方針への理解が深まるかも
2726.6542	3.4800	overt	2726.7000	3271985	巡礼者っていう数学者の魔女など魔女なの
2732.4442	4.5900	overt	2732.4900	3278933	彼女も私たちはエイダーナを吸収してより強くなるべきだと考えている
2772.7942	6.5700	overt	2772.8400	3327353	誰だがいなくなった今巡礼者は私たちの古文でも特に高齢で賢い魔女の一人よ
2792.6542	5.2500	overt	2792.7000	3351185	私たちがなぜ遺体を吸収するべきなのか彼女ならしっかりと説明してくれるはず
2823.2242	4.7400	overt	2823.2700	3387869	いいよじゃあここに来るように伝えといてそれじゃあ私はそろそろ行くね
2850.1642	4.3200	overt	2850.2100	3420197	候補者として他にも会うべき人がたくさんいるからまたね頑張って
2864.1742	5.4000	overt	2864.2200	3437009	政治の嵐が吹き荒れているようだな喜べホルというのはこれはこの上ない状況だぞ
2870.3542	2.8800	overt	2870.4000	3444425	我々が文字通り持てるカードを駆使するためのな
2876.2342	4.6200	overt	2876.2800	3451481	そうね下手するとやけどしそうだけどお前は政治についてどう思う
2885.8642	2.7600	overt	2885.9100	3463037	煩わしいけど必要なものではある
2890.1842	4.6200	overt	2890.2300	3468221	政治に関する話を息苦しく感じるものがいることは理解できる
2896.0942	5.6100	overt	2896.1400	3475313	現実に彩られた世界だからな自分の周囲の環境に無頓着でありたくなって
2903.5942	3.4500	overt	2903.6400	3484313	ある程度の関心を払うべきものだとは思う
2912.6242	12.2400	overt	2912.6700	3495149	でも全体的に言えば嫌いなことが多いかな母だろうなそれでお前は今回の選挙に対してどういうスタンスを取るつもりだなぜどちらにも協力しないことにしたのだ
2934.3442	6.9600	overt	2934.3900	3521213	私の方が良いおさになれると思うからなんだとお前は最高だないつだって自分に迷いがない
2942.2342	4.9200	overt	2942.2800	3530681	ならお前も長に立候補するのかルケの身でそれができるのか定かじゃないけど
2947.7242	5.8800	overt	2947.7700	3537269	可能だったらやるね間違いなくそいつは素晴らしいどんなお茶になるかぜひとも見てみたいものだ
2954.3242	4.6800	overt	2954.3700	3545189	私も見てみたいお前は強くて賢い素晴らしいおさになるだろう母
2959.9342	3.0900	overt	2959.9800	3551921	ありがとうところで一月になったことがあるのだが
2963.7442	6.4200	overt	2963.7900	3556493	なぜ自分の占いの本質を友人たちに伝えなかったお前が読み手ではなく書き手であることを
2971.1542	5.1900	overt	2971.2000	3565385	それは怖かったから彼女たちがどう反応するかそして自分自身のことも恐れている
2977.5442	6.8400	overt	2977.5900	3573053	この新しく発覚した能力の意味とそれをどう扱うべきかを私はまだ完全に把握していない
2985.3442	4.8600	overt	2985.3900	3582413	自分自身は何も変わった気がしないけどプレッシャーはものすごく大きくなった
2990.9242	6.5100	overt	2990.9700	3589109	なるほど私も恐ろしいだが私はお前の味方だお前がこの状況を進むために協力する
2998.0942	11.2500	overt	2998.1400	3597713	恐ろしいだけに私を味方につけておきたい何を言うかとは言え前にも言ったように私を真に恐怖させる者と出会ったのは初めてだ私がこれまでに得た
3012.0142	6.3900	overt	3012.0600	3614417	あまたの性を通してなだが私はこの感覚を楽しみつつある生きている実感とでも言おうか
3019.0342	6.2100	overt	3019.0800	3622841	私にもその歓声を分けてもらいたいものだわカードを使って勇気を引き出せばよいではないか
3027.3442	2.5500	overt	3027.3900	3632813	そうね自分のためにカードを弾いてみるか
3030.9442	4.0500	overt	3030.9900	3637133	待て待て私は冗談で言っただけだこいつは危険が大きすぎる
3037.4842	3.7800	overt	3037.5300	3644981	魔力に満ちたカードを引いて状況が悪化したらどうする
3043.5442	2.8500	overt	3043.5900	3652253	ああそうね下手な日遊びはしない方がいいか
3047.5042	5.7300	overt	3047.5500	3657005	ひやっとしたぞ私でもそんなことはしない全く我々は恐ろしいものを作り出したものだな
3053.8942	2.1600	overt	3053.9400	3664673	本当よ見ろ手紙が届いているぞ
3082.3942	6.2700	overt	3082.4400	3698873	例の難しい件で助けてくれてありがとうちゃんとお礼を言いたいからそちらに行ってもいいかしらグレーテー
3097.5142	11.4000	overt	3097.5600	3717017	こんにちはこんにちはグレイテ気分はどうあなたのおかげで最高の気分よそしてその要因はベヒモスだけじゃないとにかく私を助けてくれたお礼がしたくて受け取って
3116.5042	11.8800	overt	3116.5500	3739805	あなたは自分でカードを作ってるんでしょう私のベヒモスのエッセンスを上級アルカナの中に収容することに成功したのあなたの役に立つといいけどすごいじゃないグレーテどうもありがとう喜んでもらえて
3128.3842	11.8800	overt	3128.4300	3754061	選挙が近いからあなたは多くの魔女に助言を求められるんじゃないかと思ってその力になるかなと母そうねなんだか騒がしいことになりそう私たちの友であるダリアが
3141.6742	4.5300	overt	3141.7200	3770009	長に立候補するそうねあなたはカードを使って彼女に協力するの
3146.8342	7.3200	overt	3146.8800	3776201	私はダリアにもジャスミンにも協力しないえどうしていうかどちらの側にもつきたくないの
3154.7842	6.8100	overt	3154.8300	3785741	結局のところこれは彼女たちの戦いだから私がどちらかを平気すれば面倒なことにもなりかねないし
3162.6742	7.9800	overt	3162.7200	3795209	確かにそういったことは考えられるわねよく理解できるから気にしないででも最終的にはどちらかに投票するわけでしょう
3171.3142	4.8000	overt	3171.3600	3805577	どっちに投票するのまだ決めてないまずは選挙の行方を見てからなるほどね
3176.6842	1.5300	overt	3176.7300	3812021	枝名の遺体を
3178.9942	2.3400	overt	3179.0400	3814793	食べるか解放するかについてはどう思う
3189.8542	2.3700	overt	3189.9000	3827825	彼女の力を吸収するっていうの
3192.7642	1.3200	overt	3192.8100	3831317	魅力的だと思う
3195.5842	9.9300	overt	3195.6300	3834701	私がもっと強くなった時に占いの力がどうなるのか興味があるあなたが生きる意味を探す手助けになるにもなると思うし
3206.4742	16.1700	overt	3206.5200	3847769	確かにそれは魅力的だな誰やが聞いたら喜ばないでしょうけど私自身はまだ決めかねているどちらの選択肢も興味深いと思うだからまずは候補者たちにこの件に関してしっかりと主張してもらってその上で考えようと思うそれが賢いかもね
3223.2742	4.4400	overt	3223.3200	3867929	私はそろそろ行くわ政治について少し勉強したくなってきたしね
3228.7342	5.9100	overt	3228.7800	3874481	政治について学ぶことが生きる意味の発見につながると思うえっとわからないそうよね
3235.4242	2.5500	overt	3235.4700	3882509	それじゃあ失礼するわまたねバイバイ
3378.8542	2.9400	overt	3378.9000	4054625	恐怖症ジェムスカルブ
3382.4842	2.7000	overt	3382.5300	4058981	ルートの力はあるかなを祝福する
3386.0542	9.7200	overt	3386.1000	4063265	不安は活力へと転嫁するベヒモスは押し入る自らの思考との対話を確立する鏡は真実に相当しないものを消失させる
