onset	duration	trial_type	wav_onset	sample	value
6.5424	1.2600	overt	6.5400	7851	ああ
14.3124	5.3400	overt	14.3100	17175	あああ
23.3424	1.1100	overt	23.3400	28011	ああ
54.9924	1.3800	overt	54.9900	65991	今日も売れないね
58.4424	2.7000	overt	58.4400	70131	今田はグレートホールマンジュルの
62.2224	2.0700	overt	62.2200	74667	山を前に言う
78.8724	2.4000	overt	78.8700	94647	んざりとした顔をしている
81.9624	19.9800	overt	81.9600	98355	まあ仕方がない売れないでぼんやり何もせずに過ごすというのはなんとも言えずむなしいものだからねやっぱり商品名を変えた方がいいんじゃないだってこの滑走路通りに来るやつらがどういうものを買いに来てるか考えてみなよ
101.9424	19.9800	overt	101.9400	122331	外国の珍しいものや見たことないものを借りに来てるんでしょだからこんなやぼったい名前じゃなくて関東語風にするとかポルトガル語にするとかタイとかアジアンな感じにするとかとにかくもっとポップの方が良くない
126.5724	9.9000	overt	126.5700	151887	いやこのままで行こうじゃないの彼の言うことも分かるが俺には信念があるだってこれは日本で生まれた日本のお菓子なんだよ
136.9824	18.1800	overt	136.9800	164379	この街にはいろんな国の人間が住んでるけど紛れもない日本の街なんだそれを恨んがためにとってつけたような言葉を使うなんてできるわけないでしょう逆に申し訳ないもんよこれ日本のお菓子って言えるの
155.1624	18.1800	overt	155.1600	186195	年取ってリタイヤした中華料理シェフとかネパル人のシェフとかどこの国籍かわからないスティゴとかじゃん何語だっていいと思うよその言い分かるけどねみんな普段は日本語でしゃべってるだろう
173.3424	18.1800	overt	173.3400	208011	人種や国籍が異なる人々がこの日本のこの町で日本語で生活してるっていうのがまさに愛知区的だと思うしこの町の素晴らしさだと思うんだよだから日本語で名前をつけたいのさ
193.8324	18.3000	overt	193.8300	232599	北京語とか関東語とか英語とかスペイン語も日本語と同じくらい話されてるような気もするけど共通語は日本語でしょそれがいいんでホンターモヤモヤした顔で俺を見ながら道夫のこだわりがあるのは分かった
217.4724	10.9500	overt	217.4700	260967	共感するのはちょっと難しいけどとにかくそこまで言うなら日本語でもいいその代わりもっとキャッチーな感じの悪いなコンタの言いたい
228.4224	10.9500	overt	228.4200	274107	俺はこのネーミングは絶対将来定着すると確信してるんよ俺はもう一度首を横に振る
253.3524	1.3200	overt	253.3500	304023	とにかくさ
257.7924	2.7000	overt	257.7900	309351	まだ売り出し始めたばかりなんだから
261.3024	2.1600	overt	261.3000	313563	そう焦らなくてもいいじゃんか
264.0324	16.2450	overt	264.0300	316839	確かに多少見込みとは違うけれど全然売れないってわけでもない味は間違いないんだからそのうち評判が評判を呼んでワイチクの定番商品となるそうかなそうかなそう言ってからコンタはあくびをする
280.2774	16.2450	overt	280.2750	336333	あまりにも緊張感のないことだがしかしこのあくびを責めることはできない彼は早朝から放送作業をしてくれていてそしてずっと座りっぱなしで販売を行っている
300.1824	1.5900	overt	300.1800	360219	大人って生んだもの
302.4924	10.1100	overt	302.4900	362991	全くありがたいしそれに彼がこんなふうに頑張ってくれるのは何とも嬉しいことなのだちょっと前なら想像もできない
327.3624	10.3500	overt	327.3600	392835	あい地区随一の平民地区でタイプBとして生まれた彼は少婦の息子だった
346.2024	9.9300	overt	346.2000	415443	小さい頃から街角に立って客に声をかけポンビキみたいなことをしてお母さんの商売を手伝っていたんだ
363.0024	10.7700	overt	363.0000	435603	お母さんの体調が悪くなるとお母さん専用のポンビキだったコンタは売信宿の従業員となりプロのポンビキになった
375.2424	11.5500	overt	375.2400	450291	それだけでなく金に困った交渉官に紹介するなどという場外麻害の仕事にも手を染めてこの町の裏通りにはいくらで
386.7924	11.5500	overt	386.7900	464151	そうして病気のお母さんの面倒を見る傍らで夢も希望もなく日々を暮らしていた
400.0524	8.4600	overt	400.0500	480063	それが今は足を洗ってこうして俺と一緒に仕事を手伝ってくれている俺から誘ったんだ
409.2024	1.2000	overt	409.2000	491043	本当は
411.5424	9.5700	overt	411.5400	493851	子供の頃のいたずら仲間だからねこのままじゃ破滅するのは分かりきっていたしたとえそれが本人の望みだとしても
425.3124	1.5000	overt	425.3100	510375	俺は嫌だったんだ
427.9224	6.3300	overt	427.9200	513507	思ったよりあっさりと承諾してくれたのはやっぱり本人も何か夢を見たかったんだと思う
435.0624	2.2500	overt	435.0600	522075	悲しいことだけれども
437.9124	18.5850	overt	437.9100	525495	内地区の裏通りには彼女のような境遇の若者が多い希望を抱くことを諦めて犯罪まがいあるいは犯罪そのものに手を出しただその瞬間だけの切磋的な快楽をつなげ合わせてどうにか一日を消費して人生を避行させ
456.4974	18.5850	overt	456.4950	547797	今この仕事をしている俺の仲間はこんなやつばっかりだこういう苦しい境遇の人々が協力してくれているわけだからなんとしてもこの企画を成功させねばならないと俺は毎日考えている
477.3024	4.1100	overt	477.3000	572763	なんとしても俺は成功させねばならない
485.7324	10.6200	overt	485.7300	582879	人生というものは明日に期待を抱けるからこそ意義も感じられそして人生に意義があるからこそ幸せを感じることができるんじゃないか
573.6924	18.4200	overt	573.6900	688431	まず彼らに希望に向かってまっすぐ努力する機会を与えたいそしてその結果としてグレートホールまんじゅうが売れて希望というものは実現することもあるのだという体験をさせたい彼らは希望や願望が無ごいやり方で
592.1124	18.4200	overt	592.1100	710535	潰され続け子供の頃から踏みにじられたものばかりだからその喜びを知らないのだそうして俺は今日も万事を売っている俺たちの商売の場所は知り合いの花屋の店先だ
623.7024	11.5200	overt	623.7000	748443	何日か前からここを使わせてもらっているんだけど今日もいつもと同じように机を置きお手製の上りを立て朝から売り声を上げていた
640.7124	2.4600	overt	640.7100	768855	この商品のメインターゲットは
643.9224	1.6800	overt	643.9200	772707	やっぱり女性だ
650.1924	3.5700	overt	650.1900	780231	いくら男女の差がなくなってきたといっても
654.5124	7.4100	overt	654.5100	785415	やはり女性の方が甘いものをよく買うだろうし新しいものにも理解があるはずだからね
665.3724	3.9600	overt	665.3700	798447	声をかければ彼女たちは立ち止まってくれず
671.2524	3.5100	overt	671.2500	805503	そして試食させればおいしいとは言ってくれる
676.8924	3.3900	overt	676.8900	812271	しかし困ったことでなかなか勝ってはくれない
684.5724	14.7900	overt	684.5700	821487	さっきで女性をだますことをなりわいとしていたコンタでもそれとは勝手が違うのかなかなか思うようには売れない思うにあと一歩なのだあと一歩何かが足りないのだろう
700.1124	2.8500	overt	700.1100	840135	その一歩とは知名度じゃないか
703.5324	14.4200	overt	703.5300	844239	やっぱりわざわざこのワイ地区に足を運ぶっていうのは何かしら特別な体験をしたいって気持ちがあるからでしょう
717.9524	14.4200	overt	717.9500	861543	その中で全く有名じゃないこのまんじゅうを買おうって気にはならないとにかく食べれればおいしいのだからそしてこれはもう地道に評判を詰め重ねていくしかない
732.3724	14.4200	overt	732.3700	878847	そして少しずつ知名度を上げていけばいつか労力に見合う売り上げを達成できればというのが俺の考えだ何事だって地道が一番なんだよ
747.3324	15.7200	overt	747.3300	896799	そもそも今だってそこまで悲観するほどじゃないんだけど昼にさすかかろうというこの地獄用意したうちのヨン分のイチくらいは売れている
763.0524	15.7200	overt	763.0500	915663	最終的にナナ割くらい裁ければまあまあ順調批判する悲観するような事態ではないんじゃないかなだけどどうもコンターはその考えに賛同してくれない
778.7724	15.7200	overt	778.7700	934527	もっと目に見える成果が早く出ないと仲間たちのモチベーションが維持できないみんなそんなに気が長くはないんだ成功体験がないから根気強く頑張ることが苦手だ
795.4524	6.9600	overt	795.4500	954543	このままではいけないとそれがコントの主張だったまあまあ焦らないことだよ
804.7524	10.1100	overt	804.7500	965703	俺は試食用として小さく切り分けた一つをつまようじで突き刺して口に入れるほらやっぱり間違いなくうまいじゃないか
815.7624	2.1600	overt	815.7600	978915	すぐ入れるようになるって
824.2524	4.3500	overt	824.2500	989103	いいものは必ず売れるようになってるんだからね
830.0724	4.4100	overt	830.0700	996087	文千代君のその楽天的なところは好きだけれども
836.2224	9.0900	overt	836.2200	1003467	例えばさもっとあちこちに配布をしてとにかく誰でもいいからたくさんの人に食べてもらうなんてどうかな
847.2624	4.5900	overt	847.2600	1016715	そんなに自信があるならばらまいてでも味をしてもらわないと
855.3924	9.6000	overt	855.3900	1026471	それは悪いアイデアじゃないけどみんなが一生懸命作ってくれたあの無償で配ってしまうっていうのは気がとがめるんだよな
874.0824	10.7400	overt	874.0800	1048899	そういう問題じゃないでしょう最初はタダで配っても最終的に売れればいいんだからさいろいろ試してみようよいろいろね
885.3324	4.7700	overt	885.3300	1062399	コンタの異分にも一例あるのは分かっている
912.4524	12.4800	overt	912.4500	1094943	コンタの言い分にも一例あるのは分かっているただそういう売り方に力を入れるより変質な向上とかそういった部分に努力を割きたいという気持ちもある
928.4124	5.4900	overt	928.4100	1114095	こういう時にルオンがいればな考え込んでいるとコンターため息をつく
934.4724	6.3000	overt	934.4700	1121367	なんだコンタ俺じゃ頼れないっていうのか俺は復唱しながら言う
946.7724	10.3800	overt	946.7700	1136127	そんなことはないけど道夫君はこういう細かいことを考えるの向いてないからなルオンは道夫君の苦手なことは大体得意なんだよ
962.9124	11.2500	overt	962.9100	1155495	あの学校のお金だって家の感じじゃなくて自分で稼いだんでしょ知ってるあれすごいよな俺詳しくは知らないんだけどどうやったの
975.1524	14.3550	overt	975.1500	1170183	ルーンはなんかごちゃごちゃ言ってたけどめんどくさい話でよく覚えてないな最初から覚えできなかったでしょそうかもねまあ大丈夫大丈夫大丈夫そんなに不安そうにするなって確かにあいつが
989.5074	14.3550	overt	989.5050	1187409	これだけの商品ができたんだから何も心配してくれることないさ角のフランクレンさんのところでも売ってくれるって決まったばかりだろ
1020.9624	2.4900	overt	1020.9600	1225155	俺が笑って背中を叩くと
1024.9524	11.3550	overt	1024.9500	1229943	コンタは冴えない顔で本当にそういう明るいところはいいんだけどねまたため息をついた全く心配性な男であるともあれ俺たちはグレートホール万中
1036.3074	11.3550	overt	1036.3050	1243569	そしてコンタがニ人分の飲み物を買いに出た時のことだ道の向こうから制服を着た小学生の行列がやってきた
1048.9224	6.1200	overt	1048.9200	1258707	俺は北通りに最近できたインターナショナルスクールの児童だろうかな
1066.2024	7.4100	overt	1066.2000	1279443	これまでまっとうな教育を受ける機会が少なかった貧しい民の子たちに子たちのために
1096.9824	11.6400	overt	1096.9800	1316379	これまでまっとうな教育を受ける機会が少なかったまぶしい民の子たちのために安い学費で買えるように作られたと聞いている
1109.4624	13.5600	overt	1109.4600	1331355	俺もその話は知っていてなかなか好ましい施設だなと思っていたんだんだこういう施設がもっと増えてくれればこの愛知区も少しずつ良くなっていくんだろうとも思うよ
1127.5824	5.5500	overt	1127.5800	1353099	もう知らないっていうのはその不便さ以上にコンプレックスを作るのが良くない
1133.9124	18.2700	overt	1133.9100	1360695	まともな学校出てないって思うだけでとても学校に行ける状況じゃなかった自分の家庭関係を思い出したりまともな子どもが学校で給油と仲良くやっているはずの時間に自分がしていたことを思い出したり
1177.5324	11.7600	overt	1177.5300	1413039	自分をとった人間だと最初から思い込ませてしまうのさそういうものにとらわれない心を持った人間もいるけどなかなかそうはいかない
1189.2924	11.7600	overt	1189.2900	1427151	学校に行くべきだと思うその結果としていられる学歴も含めてねまあともな教育を全く受けてない俺が言うのもなんだけどね
1202.2524	1.3800	overt	1202.2500	1442703	だけども
1207.9224	8.4000	overt	1207.9200	1449507	上は一応なばかりは学校と着いた施設に通ったこともあるけれども生徒は気まぐれにしか登校せず
1217.4624	7.7100	overt	1217.4600	1460955	肌の色や出身国の近い友人と話したり何か食ったりゲームをやったりで前なんか見ちゃいない
1232.1924	12.0600	overt	1232.1900	1478631	教師は一人で黒板に向かってしゃべりつつ何かを書いて消して授業の時間が終わればいなくなる生徒はその教師の出入りにさえも気づかないほどだ
1255.9524	10.4850	overt	1255.9500	1507143	そこには教育なんてものはなくそもそも言葉が通じない生徒も多い話に聞くインターナショナルスクルではそんなふざけた光景はなくみな手く
1266.4374	10.4850	overt	1266.4350	1519725	適切に教育を受けているのだという学校行事なども盛んだそうだ
1285.0824	2.4600	overt	1285.0800	1542099	まさに夢のような施設だ
1288.5924	6.5700	overt	1288.5900	1546311	彼らの中から将来ワイチクを変えていこうと書いていくものが現れるから
1306.7124	3.1200	overt	1306.7100	1568055	その幸福な児童たち
1317.7524	14.9100	overt	1317.7500	1581303	彼らは保護者なのか学校職員なのか分からないが数名の大人に卒されている学校の先生たちかなしかし先生ってのも大変な仕事だねこれくらいの年頃の子
1350.2124	5.3400	overt	1350.2100	1620255	これくらいの年頃の子供は当然素直には言うことを聞かないもので
1356.2124	5.3400	overt	1356.2100	1627455	となりや後ろの子にちょっかいを出してすぐに列を目指してしまうんだけども
1362.9624	11.9700	overt	1362.9600	1635555	それをいちいち注意しながら汗だくになって列を進ませているああいう仕事って根気があって子どもが好きでなきゃ無理だと思うよ
1375.7424	5.8500	overt	1375.7400	1650891	それにしても肌や髪の毛の色が違う子どもたちが
1382.2524	2.7300	overt	1382.2500	1658703	ああやって一緒に
1409.1624	12.2700	overt	1409.1600	1690995	それにしても肌や髪の毛の違う色が違う子どもたちがああやって一緒に歩きながら平和にしゃれ合っているのは良い光景だな俺の理想の風景の一つだよ
1421.4324	12.2700	overt	1421.4300	1705719	制服を着せるってもののもなかなかいいな同じ服なら人種の違いや貧富の差なんかも分かりにくいし仲間って気がする
1435.3824	2.6100	overt	1435.3800	1722459	俺たちも制服作ろうかな
1438.5324	3.7200	overt	1438.5300	1726239	商売が軌道に乗ったらそれも考えるとするか
1442.8524	11.3550	overt	1442.8500	1731423	しかしどうせ売れないのならコンタの言うとおりあの児童たちにタダで配ってやろうかなさっき提案された時は断っちゃったけど子どもたちの笑顔を想像していたら
1454.2074	11.3550	overt	1454.2050	1745049	断ったばかりで何だかコンタに悪いような気もするけど反対はしないだろう道夫さん売れてますか
1466.3724	9.9000	overt	1466.3700	1759647	そして微笑ましく眺めていると曲がりさせてもらっている花屋の庭園であるバーバラに声をかけられた
1480.0824	3.4200	overt	1480.0800	1776099	彼女は顔の大部分を前髪で隠す
1484.8824	2.1600	overt	1484.8800	1781859	特有の髪型で
1505.5824	19.5600	overt	1505.5800	1806699	彼女の髪で隠された部分には普通の人間とは全く違う彼女特有の形状がある女性で顔に変異が現れてしまうのは不幸なもんだけれども彼女はそれを感じさせない明るくてけな女性だからとても素晴らしい
1525.1424	19.5600	overt	1525.1400	1830171	彼女もタイプAなんだよねと言っても能力はささやかなものしかないなのに得意体質だけが強く現れてしまっているなんだか不公平な話だけどそういうことはままあるんだばっちりだよ俺はそう言って胸を張ったけれど彼女は無言だ
1544.7024	19.5600	overt	1544.7000	1853643	その視線は机の上に積み上げられたままの商品を捉えているそれを見られちゃ売れてないっていうのがバレバレだアハハツが悪くて仕方がないので俺は笑ってごまかしたまあ今日はきっとこう有名だったんだよ
1565.7924	9.9900	overt	1565.7900	1878951	ほら見なよ向こうにかわいい子供たちが歩いている今日売れなかったのはさあいちゃんにおやつを食べさせてやるという点からの指令なんだなきっと
1595.6124	10.8450	overt	1595.6100	1914735	バーバラは一旦驚いてそれから指先を口元に当てて笑う水仕事で真っ赤になった指先だその労働者の証しである指を微笑ましく眺め
1606.4574	10.8450	overt	1606.4550	1927749	俺は子どもたちに配るべくまんじゅうの箱を開け始めたんだそこで異変が起きたそれを見たとき思わずあっと声が出た
1617.8724	11.0550	overt	1617.8700	1941447	俺から飛び出した白い何かが児童の一人をさらってそのまま滑走路通りの中央に踊り出たんだ目の前でバッチリ見ていた俺だった
1628.9274	11.0550	overt	1628.9250	1954713	だって何が起きたのか瞬時には理解できなかっただってこんな想像の範囲を全く超えているんだものこんなの
1640.8824	7.2300	overt	1640.8800	1969059	やがてその正体が明らかになっても自分の目が信じられないという思いの方が強いくらいだ
1663.3224	15.4350	overt	1663.3200	1995987	そこに現れたのは白い虎だったらこんなものを街中で見かけたら誰だって俺みたいに目を疑うだろうここはジャングルじゃないそりゃコンクリートジャングルって言葉はあるけれどそれはあくまでも比営であって虎が住んだりはしないだろう
1678.7574	15.4350	overt	1678.7550	2014509	そいつは先ほど列からさらった金髪の少年の首あたりを加えている少年の首は出来の悪い人形みたいにねじれて折れ曲がり手足をひくひくと経連させている
1698.6924	6.5400	overt	1698.6900	2038431	それはとてもさっきまで子どもたちとじゃれ合っていた子供だと信じられるような光景じゃない
1725.6924	8.3100	overt	1725.6900	2070831	虎が加え直すとおびただしい血液が動脈から流れ出してその服とアスファルトを赤く染める
1734.5424	14.0700	overt	1734.5400	2081451	その血液の赤が俺にもこれが現実の出来事なのだと再認識させたこの惨劇に勝つ俺のあちこちから悲鳴が上がり子どもたちは泣く
1749.7224	10.9200	overt	1749.7200	2099667	通行人たちは虎から離れようと駆け出すもちろん全ての人がすぐに事態を把握できるわけでもないから立ち止まってしまう人もいる
1780.2924	9.1500	overt	1780.2900	2136351	逃げ出す人と立ち止まる人がもみ合いし合いするようになると自然と群衆はパニックとなってしまう
1789.9824	18.6000	overt	1789.9800	2147979	看板や露店の机は人ごめに飲まれると並べられた商品を盛大に巻き散らしながら倒されるその土作さんに紛れて商品を懐に出径する太堂着物もいる
1815.3324	9.4800	overt	1815.3300	2178399	バーバラ慌てちゃダメだよ店の中に隠れて影を閉めるんだそれで大丈夫だからね俺は彼女にそう微笑みかけた
1871.5524	11.8500	overt	1871.5500	2245863	俺は彼女にそう微笑みかけてから逃げようとする群衆をかけ分けながらどうにか虎に近づく皆と一緒に逃げるわけにはいかない俺には皆と違う能力があるんだ
1883.4024	11.8500	overt	1883.4000	2260083	これは群衆から飛び出て虎と対峙した虎はもう動かなくなった子供の首から牙を離しその腹部に噛みつこうとしているところだった
1896.3624	8.1900	overt	1896.3600	2275635	おいやめないか叫んでも虎がやめるはずもないこちらを警戒する鳴り声を上げつつ食事を続ける
1909.1124	8.7900	overt	1909.1100	2290935	せっかく学校が用意してくれている制服はその鋭い牙によって容易く切れ裂かれ
1921.4124	1.2000	overt	1921.4100	2305695	腹は裂ける
1923.2124	8.3100	overt	1923.2100	2307855	そしてトラはそのちみどろの内臓から食べ始めた動けますか動けるなら他の子どもたちを逃がしてもらいたいんだけど
1932.0624	4.8600	overt	1932.0600	2318475	俺はとりあえず火傷った顔で立ちすくんでいる先生たちに
1942.5624	13.1100	overt	1942.5600	2331075	残った児童を避難させるよう伝えることにしたほら早く早くおっとしてちゃダメだってば同点してるのは分かるけど先生なんだから頑張ろう
1966.1124	9.9300	overt	1966.1100	2359335	何度か声をかけるとようやく割れを取り戻したのか先生たちは泣き出した児童たちに引きずるようにして現場を
1996.4124	14.1900	overt	1996.4100	2395695	しかし虎は目の前の獲物に夢中で逃げ去る者たちを追うとはしなかったひとまず安堵してそして気がつくとあれだけ人の多かったカストロ通りから人の姿が消えている
2011.8624	5.5200	overt	2011.8600	2414235	パニックを起こしながらもなんとか避難ができたんだねでも全員ってわけでもない
2017.9824	7.3200	overt	2017.9800	2421579	路上のあちこちに群衆に踏むつぶされたと思われる人々が体を押さえて転がっている
2027.2524	10.0500	overt	2027.2500	2432703	かわいそうだけれども今の俺はその人に一人を助けている余裕は今はない何にしろ目の前にその虎がいるのだ
2047.5024	9.3900	overt	2047.5000	2457003	逃げたといっても文集は血の果てまで逃げたわけでもないその何割かの人々は距離を取って遠化けに自体の成り行きを眺めている
2057.4624	7.7100	overt	2057.4600	2468955	建物のニ階などには携帯電話を構えてこのサンジューを録画している人の姿も見える
2066.2524	10.4700	overt	2066.2500	2479503	まあ安全圏から見物するにはワクワクドキドキのドキュメンタリーではあるだろうさて人のことよりも自分のことである
2087.6724	9.1200	overt	2087.6700	2505207	俺と虎との距離はそのめちゃくちゃとした虎の操射感が聞こえる程度には近かった
2101.6224	5.0700	overt	2101.6200	2521947	あの哀れな少年のネクタイが今は虎の足を足止めで着ている
