onset	duration	trial_type	wav_onset	sample	value
4222.1724	18.8700	overt	4222.1700	5066607	そして彼はシミドロの手に手のひらに何かを乗せて俺に差し出した一体これは何だろうその小さな肉片はピョコピョと踊るように身を食うねえらせているその大きさといい形といいまるでひるのようだった
4241.7324	4.6500	overt	4241.7300	5090079	こんなになっても死ねやしないんだよまだ生きてる
4290.5724	15.7650	overt	4290.5700	5148687	一体これはなんだろうその小さな肉片はぴょこぴょこと踊るように身をくねらせているその大きさといい形といいまるでヒルのようだったこんなになっても死ぬやしないんだよまだ生きてるだけどちょっと小さすぎたなもう少し大きく切れたな
4306.3374	15.7650	overt	4306.3350	5167605	まあ最終できただけよしとするか要はそれをハンカチに包んでポケットに入れた子供の頃とちっとも変わらずよく分からないものを持ち帰ろうとする男であるそれは何ですか
4365.7524	13.5600	overt	4365.7500	5238903	見守っていた一人が寮に尋ねるけれど彼はそれを無視して虎の死体からもう少し大きめなグレープフルーツほどの肉買いを取り上げるとそれを自分の上着で包む
4379.9124	18.0300	overt	4379.9100	5255895	それも持ち帰るのか一応ね追い歩けるかもう少しだけ待ってくれよそうは行かないそうして座り込んでいた俺の腕をつかんだ行こう警察のお仲間が来たら面倒が分かったよ
4405.4124	5.6100	overt	4405.4100	5286495	ルオンに支えられて立ち上がったところで遠くからサイレンの音が聞けこえる
4413.3024	3.3900	overt	4413.3000	5295963	通報受けとかとかがやっと来たのだろう
4432.1724	12.1800	overt	4432.1700	5318607	運はそう言って俺をごみ収集車の助手席に押し込んだそして彼が運転席側のドアのドアの周り辺り
4445.4024	13.7700	overt	4445.4000	5334483	ドアに回り乗り込もうとしたところでねあんたこのカストロ通りで働いているのかエプロンをつけた所の夫人が駆けつけて寄ってローンに声をかけるあんたクリステーの息子だろ
4459.8624	4.3200	overt	4459.8600	5351835	ルーンは表情をこわばらせて夫人の顔を見つめ返す
4467.6924	16.5600	overt	4467.6900	5361231	あんたのお父さん何とかしてくれよYSってのは最近ちょっとおかしくなっちゃってるんじゃないの昔はこういう時すぐに来てくれたじゃないなのに今を全然来てくれなくなって人違いだよ
4486.2024	5.3700	overt	4486.2000	5383443	右は相手の言葉を最後まで聞かずに爽快すと車に乗り込んだ
4492.2024	13.1700	overt	4492.2000	5390643	車を走り出すなさっきのあれこう言っておいてもよみがえったりしないんかねハンドルを握れるように俺はそう尋ねた大丈夫どうしてそう言える
4506.6024	9.0900	overt	4506.6000	5407923	あっちは死んだままだよそれは間違いない動いてる方を回収したからかそうだねそうかそれを何で話せば長くなる
4517.7924	3.1800	overt	4517.7900	5421351	ローンはあまり話をしたくないようだったが
4521.6924	18.0600	overt	4521.6900	5426031	しかしこいつが一人で理解していたって俺は一体全体何が起こったのかさっぱり分からないのだじゃあその動いてる方はどうするんだよそっちが本体ってことはまた復活したりするんじゃないか気持ち悪いからちゃんと処分してくんなきゃ困るよ
4542.8124	3.6600	overt	4542.8100	5451375	処分はするよただその前にいろいろ使わせてもらう
4550.4024	10.2300	overt	4550.4000	5460483	そんなものって言うけどこれは大変なものなんだしかも虎なんだぜ分かるかみちを虎なんだよ
4577.5524	10.4400	overt	4577.5500	5493063	虎は珍しいなそうじゃなくてさまあピンとこないならいいけれどルオンが言いたいことはやっぱりよくわからないしかし昔からそういうおかしなものを集めるの好きだよな
4587.9924	10.4400	overt	4587.9900	5505591	そうかなそうともボーダーの辺りでよく見つかる頭がニつあるバッターとかパイプBの帰るとか集め
4600.4724	1.6200	overt	4600.4700	5520567	集めてたじゃんか
4607.7024	3.2700	overt	4607.7000	5529243	そうだっけそうだよそれさ
4612.9224	9.0000	overt	4612.9200	5535507	何か使い道があるのかもしれないけれど変ないたずらに使わないでくれよいたずらなんかしないよ
4622.6124	1.9800	overt	4622.6100	5547135	ローンは肩をすくめる
4625.1324	17.6700	overt	4625.1300	5550159	正面から向かい合ってたお前にちょっと聞きたいんだがあの虎ただ興奮していたのかそれともタイプBの症状が出ているように見えたかそれは俺は首をひねり目がキンキンだからやっぱおかしくなってたんじゃないのかな
4670.4924	13.1400	overt	4670.4900	5604591	いや目が黄色でも症状が出ているとは限らないだろう他に何か特徴が出ていなかったかちょっと分かんないな人間ならともかく虎が正気かどうかそうかそれもそうだな
4683.6324	13.1400	overt	4683.6300	5620359	こいつは一度思考を始めるとこっちの言葉が聞こえなくなるので俺ら発言を控えたそしてお互い沈黙してしまい俺はさっきの光景を思い出す
4710.6324	14.5800	overt	4710.6300	5652759	子供の死体警察官の死体それを悲しむ女の姿壁切った顔でそれらを眺めるがらり路上に散らばった売店の残骸カストロ通りで人が死ぬのは久しぶりだな
4725.2124	14.5800	overt	4725.2100	5670255	さっきのトラはタイプBだったみたいだけどあんな怪物誰か飼ってたんだろうなどこかのバカが突然兵衛の虎を滅入したんかなさあ
4740.8124	10.3800	overt	4740.8100	5688975	不安はやっぱり不安の空のようだあの調子じゃ飼い主も襲われてるかもしれないな全くおかしなものを持ち込むのは勘弁してほしいもんだよこの町ってさ
4751.1924	10.3800	overt	4751.1900	5701431	こうやって世界中の変なものがしょっちゅう集まってくるから訳の分からないことばっかり起こるんだ退屈はしないが勘弁してほしいよな
4769.9424	17.6100	overt	4769.9400	5723931	俺はため息をついて自分の腕を上げて疲労を確認してみたいつもより重い感じがするまだ全然ダメだなチットも回復していない能力を使うのは久しぶりだったけれどいつ使ってもこの毛だるい感覚になれることができない
4789.7424	9.9000	overt	4789.7400	5747691	ルオンはポーカーフェースでハンドルを握っているこんなでかい車を普段運転しているはずもないだろうけどそれを気にする素振りもなく
4826.4924	5.7000	overt	4826.4900	5791791	車の軽造も安心して乗ってられるものだった相変わらず器用なやつだ
4833.8724	3.3000	overt	4833.8700	5800647	そういうバリをこの車どこに向かってるんだ
4838.7624	6.2400	overt	4838.7600	5806515	塩クリーンの本社だよ車を買いしに行くんだついでね
4848.6024	8.7300	overt	4848.6000	5818323	飯尾さんに挨拶してくる道をそこまでついてくるかい用事があったらその辺りで下ろすけど
4857.9324	1.4100	overt	4857.9300	5829519	そういえばよ
4860.6024	2.1600	overt	4860.6000	5832723	事務所で借りられると思うよ
4864.1424	7.7400	overt	4864.1400	5836971	じゃあそうさせてもらうか社長のところにも顔を出すよ久しぶりに松坊も見てみたいし
4878.3624	4.0200	overt	4878.3600	5854035	そういえばお前松本は合ってるのか合ってないな
4882.9524	6.6000	overt	4882.9500	5859543	じゃあきっとあいつ喜ぶぞどうだろう彼女は忙しいようだし今日は家にいないかもしれない
4891.1124	5.5200	overt	4891.1100	5869335	ずいぶんあっさりしてるなそうでもないよまあタイミングってのがあるからね
4897.7724	3.6300	overt	4897.7700	5877327	そういうものなんかね俺はため息をつく
4903.2924	5.0700	overt	4903.2900	5883951	車の滑走路を抜けると細い裏道に入っていく
4909.6524	7.8600	overt	4909.6500	5891583	この車の所有者である塩クレーンという会社はこの先のパラシュート通りの医学
4939.8624	14.5200	overt	4939.8600	5927835	この車の所有者である塩クリーンという会社はこの先のパラシュート通りの一角にあるゴミ収集業者の名前だたびたびのトラブルによって死のごみ収集車が撤退した代わりに
4955.4324	14.7900	overt	4955.4300	5946519	市区のごみ処理を一手に受け負っている家庭のゴミも企業のゴミも取り扱いの難しい各種廃棄物そして誰にも頼めないような処分の難しい秘密のゴミもいらない
4970.2224	14.7900	overt	4970.2200	5964267	いらなくなったものは電話一本で全て破棄してくれるというなんというか夢のような業者でおそらくこのY地区でも有数の売上高を誇っている企業なんじゃないかな
4985.0124	14.7900	overt	4985.0100	5982015	近隣の市町村をどんどん開拓して広げているらしいまさに鎮風満帆といったところだその創業者であり現社長でもあるのが
5001.8424	15.7500	overt	5001.8400	6002211	牛尾賢次郎って人なのであるこの人物とルオンは昔からとんでもなく親しく俺からすると実の父親に慕っているようにさえ見える
5019.1824	18.7500	overt	5019.1800	6023019	両の性格や考え方のかなり多くの部分がこの牛尾さんの影響を受けているよだから大学に何か行ったんだろう本当にそっくりでつまりどういうことかっていうと牛尾さんという人物も相当の変人なのだ
5037.9324	18.7500	overt	5037.9300	6045519	地味な地域で地元の住民が利用するこじんまりとした総菜屋や食料品店生活雑貨店など家族総出で涙が出るほど細々し道が立ち並んでいる
5072.2524	3.5400	overt	5072.2500	6086703	観光客はほとんど訪れないが
5076.7824	14.1200	overt	5076.7800	6092139	変化が少なく昔のワイチクらしい通りでかつてルオンが居候していた定食屋もこの通りにあった多分ルオンにとっては最も懐かしい場所だろうしかしハンドルを握るその横側相変わらず
5090.9024	14.1200	overt	5090.9000	6109083	普通の人間なら冷たいやつだと思うだろうけれど長い付き合いになる俺の目からするとその内心では光景に感じてるのが
5105.0224	14.1200	overt	5105.0200	6126027	こいつはそういうところでいつも損をしているんだよなもっと素直に生きるように昔から忠告しているのだけれどなかなか聞き入れないのだ
5120.0724	5.1000	overt	5120.0700	6144087	何十年も補修されていないアスファルトはところどころが激え
5126.5824	6.5400	overt	5126.5800	6151899	スピードを落としているにもかかわらずシートに接した尻が痛くなるほどガタガタと揺れた
5146.2024	1.1100	overt	5146.2000	6175443	やがて
5150.2224	3.8400	overt	5150.2200	6180267	やがて車は四億連本社に到着する
5154.8724	13.5900	overt	5154.8700	6185847	本社といえば応えそうな感じがするけれどそれを実際見るとしょぼい数台の作業車を置ける程度の駐車場とクレハブの事務所が一つあるだけの小さな施設だ
5168.4624	13.5900	overt	5168.4600	6202155	郊外の作業所にはもっと大きな駐車場と立派な車屋があってあっちは企業の規模に大して恥ずかしくないんだけれどそれとは全然違うこちらはほぼ創業当時の
5182.0524	13.5900	overt	5182.0500	6218463	いつだったかパラシュート通り一帯を写した古い航空写真を見たことがあるんだけれど全くそっくり同じ建物が写っていてたまげたもんだ
5209.9524	15.0150	overt	5209.9500	6251943	ルオンは空いていたスペースに車を止めると一人で事務所行きそしてすぐに戻ってきた高校でシャワーを借りてから借りてから振り返ると俺たちの育っていたところはちみどろになっていてこれはちょっと
5224.9674	15.0150	overt	5224.9650	6269961	俺たちは職員用の会員シャワーで汚れを落とし乾燥機から出したばかりのほかほかほかの作業着の着替え本社のすぐ目の前にある社長宅に向かった
