onset	duration	trial_type	wav_onset	sample	value
2118.1224	8.1900	overt	2118.1200	2541747	なんと言ったらいいのかとにかくあの哀れな子を食べている間は他に手を出す気配がない
2129.2524	12.6150	overt	2129.2500	2555103	けれど食べ終わったトラはすぐに次の獲物に強力な牙を向くだろう誰かが警察に通報してくれていると思うけどさらなる大惨事が発生する前に到着してくれるなんて保証はない
2141.8674	12.6150	overt	2141.8650	2570241	警察よりは騒ぎを決けつけたどこかのギャングが武器を持って助けに来てくれる方が早いかもしれないがそれだって当てにできるというものでもない
2156.4624	2.7600	overt	2156.4600	2587755	となれば待つのは得策じゃないな
2168.9724	3.1200	overt	2168.9700	2602767	俺は右手の手袋を脱げ
2173.5924	2.6400	overt	2173.5900	2608311	袖をヘジまでまくった
2197.4724	10.1550	overt	2197.4700	2636967	俺の右腕は黒いいやでもね日焼けやしてみといったようなものでもないのさ全く自分でも見てもほれぼれとする
2207.6274	10.1550	overt	2207.6250	2649153	ほどの漆黒で肘から酒がまるで光を反射しない劣体感を失うほどの黒色をしている
2250.3924	11.3400	overt	2250.3900	2700471	この黒い右腕こそが俺の特異体質変異だった策なしで虎を見たのは初めてだけどなんだか子供の頃で見たイメージ
2261.7324	11.3400	overt	2261.7300	2714079	先ほど子どもを軽々とさらった身のこなしからするにパワーだけでなく俊敏性も備えている
2275.8324	2.3400	overt	2275.8300	2730999	連勝戦
2280.6324	1.5000	overt	2280.6300	2736759	準備せー
2305.3224	10.0200	overt	2305.3200	2766387	俺はケンカの類は子供の頃から何度もしたけれどそのどの相手と比べてもちょっと比較
2315.3424	10.0200	overt	2315.3400	2778411	だからといってひるんでなどいられないやるぞと俺を自分にスイッチを入れる
2333.4924	1.8300	overt	2333.4900	2800191	緊張と興奮で
2335.8324	3.0300	overt	2335.8300	2802999	血が逆流するような感覚を覚える
2350.0824	6.1800	overt	2350.0800	2820099	俺のタイプBの血が活性した証拠だけど今の俺の目は乱々と
2356.8624	2.3100	overt	2356.8600	2828235	銀色に輝いているんだろう
2359.6824	19.0800	overt	2359.6800	2831619	この街には他の地域よりもタイプAやタイプBは多いけれど両方の特徴を備えた俺のは俺の他にはそういないだろう世間では安直にハイブリッドと呼ばれているタイプAのサイククの能力とタイプの優れた身体能力
2380.8924	16.9900	overt	2380.8900	2857071	この恵まれた力を使えばこんな化け物みたいな猛臭にだって勝つチャンスはきっとあるよ悪いがお前はここまでだお前にしてみればこんなものは悪行でも何でもない自分と異なる生命を襲っていく食べるのは
2397.8824	16.9900	overt	2397.8800	2877459	生物の当たり前な行動で人間だっていくらでもやっているだからこの虎が間違ったことをしているというわけではないし罪というほどのものでもないしかしだからといって仲間を殺されたこっちが黙っているわけにはいかない
2414.8724	16.9900	overt	2414.8700	2897847	仲間を殺したこの虎を速やかに排除するのもまた生物としての必然的行動だつまりこれは必然同士の衝突であり誇り高い生物の宿命的戦闘である
2434.1424	5.6100	overt	2434.1400	2920971	この場所にさえ現れなければと多少気の毒には思うが
2442.3024	10.6500	overt	2442.3000	2930763	俺は一歩踏み出すトラは顔を上げてこちらを警戒する目が合うと相手の瞳も金色だったこのトラもタイプビーなのだろうか
2453.4924	6.3300	overt	2453.4900	2944191	それともトラというのはもともとこういう目の色をしているのだっけ
2461.9224	5.2200	overt	2461.9200	2954307	そうなんだろうもともとタイプBの金目はトラメともいいもんな
2472.3324	13.2300	overt	2472.3300	2966799	でもどうもタイプBのような気がするいくら腹が減っているからって人間の集団に向かって突入し獲物を狙うなんて発症したタイプBでなければやらないだろう
2510.7324	4.6200	overt	2510.7300	3012879	獲物を狙うなんて発症したタイプBでもなければやらないだろう
2518.6824	8.9700	overt	2518.6800	3022419	動物は本来もっと臆病なはずだそれにさっきの尋常じゃない素早さもそう理解すればすんなり納得できる
2529.8424	12.0600	overt	2529.8400	3035811	そうだとしたら非常に厄介だモジュというのは本来人間では歯が立たない身体能力を持っているのだがそれがさらにパワーアップしているなんて
2546.2524	11.6850	overt	2546.2500	3055503	ここで考えていても仕方ない俺にはもう逃げるつもりはないだから相手がノーマルだろうとタイプBだろうとやることは同じだ周囲の群衆の視線が
2557.9374	11.6850	overt	2557.9350	3069525	俺と虎に集まっているのを感じる俺とあいつの対決に注目しているんだその視線の中さらなる一歩を踏み出したその時
2587.9824	1.5600	overt	2587.9800	3105579	一応やめろ
2590.4724	5.2800	overt	2590.4700	3108567	横綾から鋭い声がした売れ帰るといつの間にかルオンがいる
2596.6524	13.1400	overt	2596.6500	3115983	これから俺の見せ場だってのねあいつはいつでもいい場面にやってくるんだ遠くに立ちこちらに鋭い視線を送っている待つんだ無謀だこれを見ろ
2616.0324	2.0100	overt	2616.0300	3139239	目があると彼はそう言った
2618.7024	10.6200	overt	2618.7000	3142443	手には何かキラキラ光るものが握られているがなんだかよく分からない無謀なのは分かってるんだよねでもだからといって待ってなんかいられん
2630.5524	9.7800	overt	2630.5500	3156663	俺が言おうとしたのを遮るように銃声が鳴る見ると別の方向から飛び出した制服の警官が拳銃を構えていた
2643.7524	4.2300	overt	2643.7500	3172503	トラの方はその肩口から出血している
2649.4524	6.4800	overt	2649.4500	3179343	通報で駆けつけたにしてはあまりに早すぎるからその警察官をたまたも近くにいたのだろうね
2665.2624	9.9300	overt	2665.2600	3198315	緊張で草白にした顔に怒りのようなものをにしましているクソが彼は小さく口元でつぶやいた
2681.4324	2.7000	overt	2681.4300	3217719	多少子供の死に憤慨した
2688.9624	3.8400	overt	2688.9600	3226755	正義感と勇気あふれる素晴らしい警察官なのだ
2695.1724	1.1700	overt	2695.1700	3234207	だけど
2696.9124	4.8000	overt	2696.9100	3236295	地球の献上一丁でこの猛獣に立ち向かうのはあまりに無謀だ
2712.9924	4.0800	overt	2712.9900	3255591	ハイブリッドである俺がトラネータち向かうよりもずっと
2717.6724	6.1200	overt	2717.6700	3261207	明らかに冷静さを変えている正義感はあっても経験は少し足りないのかもしれない
2731.7424	1.6800	overt	2731.7400	3278091	やめろ逃げるんだ
2733.9924	4.8900	overt	2733.9900	3280791	今度あるように変わって俺がその言葉を口にする番だったが間に合わない
2740.4124	4.6500	overt	2740.4100	3288495	警官はニ発目を発砲しそれを確かに取るに満ち着した
2766.4824	5.2800	overt	2766.4800	3319779	しかしすでに攻撃機動車に入っていた虎の足留めをするほどの効果もない
2772.5124	6.8100	overt	2772.5100	3327015	虎は猫か得意のしのやかの背中を縮めそして伸ばすと同時に跳躍する
2781.1224	8.0100	overt	2781.1200	3337347	巨体がすさまじい速さで空を飛びそのたったひと飛びで発砲音の目前に迫った
2790.9624	9.8700	overt	2790.9600	3349155	景観は慌ててサン発目を発砲するがそれは素早く動くトラを捕らえきれず足元のアスファルトの
2827.2924	7.0800	overt	2827.2900	3392751	具体がすさまじい速さで空飛びそのたった一飛びで発砲車の目の前に迫った
2836.4724	6.1200	overt	2836.4700	3403767	警官は慌ててサン発目を発砲するがそれは素早く動くトラを捕らえきれず
2843.4924	3.1800	overt	2843.4900	3412191	足元のアスファルトの上ではじけるだけだ
2847.5424	18.0600	overt	2847.5400	3417051	虎は目前で冷えを吹く自由におびえも見せずのっそりと体を起こすと両前足の爪で景観の体を押し倒しそしてその首元にかじりついた
2869.0824	3.8700	overt	2869.0800	3442899	そして警官はニ人目の犠牲者となってしまった
2874.3624	5.4300	overt	2874.3600	3449235	敵頭を打った虎は食欲よりも怒りや興奮が上回ってるように見える
2891.5824	14.1900	overt	2891.5800	3469899	警官の頭にかじりつきながらエンジン音のようなうなり声を立てて周囲を見渡している大随分とイカレクルっていらっしゃるけれどこっちだって目の前でニ人も殺されて穏やかではいられないのさ
2907.0324	5.4600	overt	2907.0300	3488439	俺はさらに一歩前に出るほら食うのをやめてこっちを向いたぞ
2917.5924	3.5400	overt	2917.5900	3501111	何たる気迫に満ちため付けをしているのだろう
2921.6424	4.2000	overt	2921.6400	3505971	動物にも増額って感じはあるのかな
2926.3824	3.4800	overt	2926.3800	3511659	人間そのものを憎んでいるように見える見つけだ
2942.0424	4.4400	overt	2942.0400	3530451	これ次の絵物は一番近い場所にいるこの俺がいいんじゃないか
2970.7224	17.4450	overt	2970.7200	3564867	俺次の言い物は一番近い場所にいるこの俺がいいんじゃないかそれならば上等お前の憎む人間代表選手たるこの俺はもうこれ以上人間様を食わせたりはしない勝負の瞬間が近づいている俺の
2988.1674	17.4450	overt	2988.1650	3585801	おそらく飛びかかってくるであろうこの虎の爪と牙を顔しながらこの右手で相手に触れるそうすればまあ俺の勝ちだろう俺の勝ちだろう俺の右手より一瞬でも早く
3036.8124	11.5950	overt	3036.8100	3644175	お互い一撃必殺だからとてもシンプルな勝負になるだろうともすれば脳裏に浮かぶ自分の体がその牙と爪に引き裂かれるイメージ
3048.4074	11.5950	overt	3048.4050	3658089	俺は呼吸を整えたこういった時に一番いけないのは恐怖や緊張のあまり本来の動きができなくなることだ
3065.1924	12.8400	overt	3065.1900	3678231	ネガティブな感情は自分でも知らぬうちに全身を雲の糸のように絡め取ってしまう俺の体は今こわばっていないだろうかいや大丈夫心臓も不必要
3078.0324	12.8400	overt	3078.0300	3693639	汗のかき方も正常だそして程よい緊張感が集中力を高めている俺は万全の状態でその時間を迎えることができるだろう
3091.8024	3.4500	overt	3091.8000	3710163	ルーンが無謀だと言っていたのはそのとおりだけど
3111.7224	13.6100	overt	3111.7200	3734067	警察の豆鉄砲と違って俺の能力を当てさえすれば決定的な結果をもんだよね相手が虎だろうが先に触れさえすればこちらの勝ちだ
3125.3324	13.6100	overt	3125.3300	3750399	備えていたが虎はなかなか飛びかかろうとしないまさかこの虎がこの腕を見て俺がタイプAだと見ぬくはずもなく新たないものに見えてもおかしくないのだ
3138.9424	13.6100	overt	3138.9400	3766731	俺のおびえない態度が何か気づかせてしまったのだろうかだとすれば懸命なことだ虎は俺に注意を向けながら
3175.6524	14.3200	overt	3175.6500	3810783	虎は俺に注意を向けながら身を低くして猫か特有のあの警戒姿勢をとる俺は相手の攻撃を襲撃すべくさらに近づいたこちらからは手を出さないリーチに
3189.9724	14.3200	overt	3189.9700	3827967	どういうことかというと相手に先に攻撃をさせるのが一番だそこでサン度目の横やりが入ってしまうそれは文字どおり横愛から巨大な槍のように突き出されたどういうことかというとエンジン音音として
3204.2924	14.3200	overt	3204.2900	3845151	ともにもスピードでゴミ収集のトラックが突っ込んできたのである俺が思わず声を上げた直後その狂った像のように飛び込んできたトラクがトラは横ばいから跳ね飛ばす
3220.6224	3.6600	overt	3220.6200	3864747	おっさんによけようとして虎の下あたりに直撃けしたようだ
3224.7924	2.1000	overt	3224.7900	3869751	腹の端目
3248.3424	11.4600	overt	3248.3400	3898011	体の端にぶつけられたトラは回転しながら弾き飛ばされたがしかしすさまじく感情だ電柱にぶつかってアスファルトの上で倒れていたのは一瞬で
3262.6824	9.5700	overt	3262.6800	3915219	震えながらもすぐさま立ち上がろうとするが収集車はそれを許さないワックで戻ってくるとそのままもう一度突撃する
3274.1124	5.7300	overt	3274.1100	3928935	その車体の角のところがえぐい角度で空の横綱ね
3281.2524	12.6300	overt	3281.2500	3937503	直撃した血が舞って眠い音がしたがしかしそれでも虎は死なないたださすがに強烈なダメージを受けたようだ先ほどのように即座には立ち上がれず
3300.1224	2.5800	overt	3300.1200	3960147	地面の上でだらしなく横たわっている
3303.5124	6.0900	overt	3303.5100	3964215	収集車はサン度戻ってきて今度はゆっくりとトラの上にタイヤを乗り上げた
3311.2524	4.6800	overt	3311.2500	3973503	虎は身をよじるがその力も弱々しく逃れることはできない
3318.0624	14.2200	overt	3318.0600	3981675	タイヤに踏まれた体の中からバキバキと骨の折れる音がして虎は血を吐いたイチ対イチの真剣勝負をしようと備えている
3342.4524	3.0000	overt	3342.4500	4010943	今の盛り上がった俺の気持ちは何だったんだ
3346.6824	18.1500	overt	3346.6800	4016019	まるっきりバカみたいだ俺のスポーツマンシップというか正々堂々肉体勝負を挑もうとしていた気持ちをすべてあざわらうようにトラックは一方的にトラを打ちのめしてしまったそしてトラックは無情にもトラの上にタイヤを置いたままの状態で停止する
3365.5224	13.8300	overt	3365.5200	4038627	ドアが平らくとそこから涼しい顔で降りてきたのはやっぱりルオンだったお前むちゃなことするな俺が飽きれて声をかけるとむちゃくちゃなのは道夫だよ
3380.3124	6.8700	overt	3380.3100	4056375	何かっこつけてわけの分からん怪物と戦おうとしてるんだギリシャ神話の主人公のつもりかよ
3388.5624	4.4100	overt	3388.5600	4066275	ルオンはちらと俺の方を見るとすぐに虎に視線を戻す
3394.3524	3.8700	overt	3394.3500	4073223	うまいことお前が劣れになってくれたのはよかったけれど
3410.3124	4.4100	overt	3410.3100	4092375	パイヤの下敷きになったトラはシシを経連させている
3416.5524	1.4400	overt	3416.5500	4099863	いやしかし
3422.9724	7.0500	overt	3422.9700	4107567	なんだか後味悪いなこんなやり方それ動物を殺すのは後味が悪いが
3431.6424	1.7100	overt	3431.6400	4117971	外宿所だからな
3447.4224	12.3900	overt	3447.4200	4136907	そういう意味ではなかったけれども今の俺の気持ちを言葉にすると生成堂々生物としての誇りをかけて一体一で決闘すべきだったとなってしまうのでそれ以上は言えなかった
3461.1324	6.9000	overt	3461.1300	4153359	確かに俺の言ってることは不合理でこいつの言う通りではあるのだ
3468.6324	11.1450	overt	3468.6300	4162359	彼は苦い顔で言いながら車の下の虎を一別すると路上に落ちた何かを拾うそれは警察官が落とした拳銃だ念のため
3479.7774	11.1450	overt	3479.7750	4175733	ルーンは両手で構えて狙いをつけ全く抽象のないまるで熟殺したパートタイマーがレジに金額を落ち込むようなスムーズな動作で
3521.5224	3.5700	overt	3521.5200	4225827	スムーズな動作で虎の頭にサン発の
3526.2324	17.1000	overt	3526.2300	4231479	銃弾を瞬く間に撃ち込んだそれで銃拳銃の弾丸は打ち尽くしたようだったこの銃声は勝利を告げる合図となったようでそれまで片図を飲んで見守っていたギャラリーにざわざわとどよくが生まれる
3543.3324	17.1000	overt	3543.3300	4251999	戦闘に対する緊張感を解きほっとため息をついたところでなあ道を向こうでローンが俺を呼ぶ見ると彼は思わぬ固い表情で虎を見つめているんだ
3561.3624	1.2300	overt	3561.3600	4273635	どうしたんだ
3563.5824	9.4200	overt	3563.5800	4276299	彼に近づいてそう尋ねると彼は虎の方を見たまま全く驚きだよ見てごらんこいつどういうわけか死なないんだよね
3573.5124	10.9800	overt	3573.5100	4288215	言われて虎を見るとあこいつまだ生きたいてねえじゃねえかそれどころか自分を打ったルオンに対し怒りの視線を向け彼に襲いかか
3607.0824	2.1300	overt	3607.0800	4328499	それどころか自分を追ってる
3611.6124	15.5400	overt	3611.6100	4333935	に対して怒りの姿勢を向け彼に襲いかかろうともがくように手足を動かし威嚇の声を上げつつタイヤの下から逃れようとしているサン発の弾丸を額に受け胴体はほとんどペシャンコになっているというのに
3632.2224	2.0100	overt	3632.2200	4358667	なんという生命力だろう
3645.3924	11.2050	overt	3645.3900	4374471	うわなんだこれ藤見ってやつなのか俺がびっくりしてそう尋ねると道を最古騒動で頼むうよも短くそう答えたえ
3656.5974	11.2050	overt	3656.5950	4387917	その右腕で首を切断してくれよ肩じゃなくて頭部の付け根のあたりを狙うんだしかしそれは頼むは分かったとにかく異常事態なのは間違いない
3672.1524	4.8600	overt	3672.1500	4406583	俺は虎の後ろに回り込み首筋に黒い右手を添える
3678.1224	6.4500	overt	3678.1200	4413747	そしてその手のひらから見えない刃物が刺される映像を思い浮かべるとその映像通り
3686.1324	6.2700	overt	3686.1300	4423359	虎の巨大な頭部はゴロリと地面に転がって断面が大量の血を吐き出した
3698.6724	3.4200	overt	3698.6700	4438407	それは帰り地となり生温かく俺を濡らす
3707.7024	3.0900	overt	3707.7000	4449243	それと同時に俺の能力の
3711.4224	7.0200	overt	3711.4200	4453707	一番近くのサイキック発見機が反応してけたたましい警報音が鳴る
3719.1624	6.2700	overt	3719.1600	4462995	俺はため息をついたがしかし安堵するのはまだ早かったようだその直後
3729.9624	2.9700	overt	3729.9600	4475955	我が目を疑うような光景が現れたのだ
3734.8524	7.8000	overt	3734.8500	4481823	地面に転がった頭が盛んに顎を動かして俺の足にこいつこうとするのである
3748.6524	2.4000	overt	3748.6500	4498383	俺を慌てて足を上げてよけた
3751.5924	3.7800	overt	3751.5900	4501911	こいつはとんでもないねすごいぞ再生している
3756.2124	14.3400	overt	3756.2100	4507455	なんで楽しそうに目をキラキラさせているのか知らないが確かに両案の言う通りだった切れ離された虎の頭は衰弱するどころかさらにたけりくるい憎しみを浮かべた金色の目は
3770.5524	14.3400	overt	3770.5500	4524663	そしてその期待の重層はみるみるうちに塞がろうとしていたリオン一体全体こいつはどうなってるんだこのまま復活するのか
3785.5824	1.1400	overt	3785.5800	4542699	どうかな
3788.1924	9.0900	overt	3788.1900	4545831	ローンは腕組みをして考えてから道を進まないけれどそいつをもうちょっと切断してくれない
3797.9424	5.4600	overt	3797.9400	4557531	最後想像でもっと桂刻むこいつは危険だ
3823.7724	6.0300	overt	3823.7700	4588527	最高騒動でもっと細かく切り刻むんだこのままじゃ聞けんだ
3831.8424	18.0000	overt	3831.8400	4598211	そうだなもうよみがえりようがないくらいキレキザメってことなのだろうがこの必死で再生しようとしている生命力を見るとどうもいじましいような気もしてしまう
3915.0624	16.1400	overt	3915.0600	4698075	必死で生きている頑張っている何かを殺してしまうというのは嫌なもんだそれもそれにそもそも俺は血が苦手なんだこの時点でもうすでに目の前が暗くらとしていたのだよね
3932.1924	4.3800	overt	3932.1900	4718631	ただ分かるんだそんなことを言っている状況ではないと
3937.1124	3.9900	overt	3937.1100	4724535	俺は構れないように気をつけながら虎の頭を
3942.0024	1.9500	overt	3942.0000	4730403	真ん中で切断した
3951.7224	5.1300	overt	3951.7200	4742067	どっちの破片が動いている右側がまだ動いているように見えるな
3958.1424	8.3100	overt	3958.1400	4749771	素晴らしい生命力だこいつは間違いない本物だよなんでお前がそんなに喜んでるんだか分かんねえよ
3982.7724	4.7400	overt	3982.7700	4779327	俺は気分が悪かったが彼はますます目の輝きを強くする
3990.9924	10.1700	overt	3990.9900	4789191	じゃあそっちもう一度半分にしてくれ牙とかがうまく割れるようになようなそうその角度で
4002.3924	4.0800	overt	4002.3900	4802871	俺は両の主人に従いながら何度か切断する
4007.1324	11.3400	overt	4007.1300	4808559	もう気持ち悪くて吐き出してしまいそうだ今度はどっちが動いているそれはこっちが言われて確認してみるとあれどっちも動いてない
4019.0424	6.3900	overt	4019.0400	4822851	じゃあどっかで生きている方と死んでる方を死んだ方を間違えたんだな
4026.0024	3.8100	overt	4026.0000	4831203	うわ面目ないなんだか意識がもうろとして
4030.6224	1.7700	overt	4030.6200	4836747	いやしかたないよ
4033.7124	3.2100	overt	4033.7100	4840455	どの部分が動いているかちょっと調べる
4069.3524	18.5400	overt	4069.3500	4883223	そう言いながらルオンは肉の塊の上にしゃがみ込みその血み泥の中に手を突っ込むああ思わず俺はうめいてしまうそしてふらりとよろけてしまう俺の能力は体力を消耗しにくいのだけれど
4088.4024	11.0850	overt	4088.4000	4906083	これだけ連続して使えばさすがに応える全身に力が入らないほどフラフラになっていた倒れそうになるとギャラレイから誰かが飛び出て
4099.4874	11.0850	overt	4099.4850	4919385	その見知らぬ人が支えてくれたありがとうねと俺を支えてくれた男の言うが彼は引きずった笑顔を浮かべる
4111.3824	13.3950	overt	4111.3800	4933659	素手で切り刻む人間を見たら誰だってこんな表情にも表情になるってもんだむしろこうして支えてくれていることに感謝しよう俺は一息ついて周り
4124.7774	13.3950	overt	4124.7750	4949733	遠巻きに見守っていた人々はいつの間にか近づいて俺が死なない虎を切り刻むところを見物していたようだそして
4138.6824	19.0500	overt	4138.6800	4966419	ここには食べ残しとなった児童の体がありそれに引率していた女性がすがりついて泣いているそしてその近くでは勇気のある景観が倒れているニ人ともこんなところで命を落とすとは思わなかったろう彼らの気持ちや
4157.7324	19.0500	overt	4157.7300	4989279	まだその死を知らないであろう家族のことを考えてしまうとどうにもやりきれない子供が殺されるところは何度も見たことがあるが慣れるものでもない俺はどういった宗教も信じてはいないけれども心の中で手を合わせた
4177.4424	6.2400	overt	4177.4400	5012931	ふと気がつくとそんな俺をルーオンが見つめているなんだい
4187.1624	12.4800	overt	4187.1600	5024595	俺は恥ずかしかったので顔をぬぐったいや何でもないルオンはなぜか微笑んででもやっぱり道をすごいな何の道具も使わずにこんなに上手の頭を切り刻める
4199.6424	12.4800	overt	4199.6400	5039571	世の中に二人といないよありがとうと言いたいが別に嬉しかないよ褒めてるつもりなのかまあまあそれより見なよ
