onset	duration	trial_type	wav_onset	sample	value
3864.9950	3.9300	overt	3865.0800	4637994	ケイオンアレンジクリスマスの上に日産って怖くて熱唱してるから大気がいい
3870.2150	3.3300	overt	3870.3000	4644258	石川さん一帯一同じ来てた
3874.1450	2.9400	overt	3874.2300	4648974	すごくの勝負してそし取れないなあんな人となるまでした
3877.7150	3.3300	overt	3877.8000	4653258	ちょっといただいてどなたは全てにあったんだよ
3881.5850	2.1300	overt	3881.6700	4657902	じゃあ次の曲です
3884.6450	1.1700	overt	3884.7300	4661574	BBC
3887.3450	2.1000	overt	3887.4300	4664814	おびくりしたお堂下さんでくださいよ
3890.4650	6.8700	overt	3890.5500	4668558	ところがここに試合はイチ回戦突破しておめでとうございます
3898.2350	3.3300	overt	3898.3200	4677882	見方なくなりできてちょっといらいの退散してくれたので
3902.2850	5.2800	overt	3902.3700	4682742	誰か家のことをずっと位置づいてたの意味かないかって何も言わなかった
3908.7050	4.2900	overt	3908.7900	4690446	その苦しい後悔は今日少し受け入れたからだから大地君本当にありがとう
3913.6850	6.4200	overt	3913.7700	4696422	そんな俺なんて今岡さんいろんな影響を受けたみたいにロメンチな先輩が生きてるのでそのお返しをしたまでです
3942.1850	3.5700	overt	3942.2700	4730622	練習を見た時嬉しくて周りに信頼られて
3946.8350	4.1100	overt	3946.9200	4736202	この人は色々あってでもこの人なんとか買ってたんです大工だね
3958.9550	1.4700	overt	3959.0400	4750746	お待たせいた
3961.2350	1.7700	overt	3961.3200	4753482	これ一体験してるんですか
3971.1950	1.3200	overt	3971.2800	4765434	始まるとチョークの方が
3979.1450	2.5500	overt	3979.2300	4774974	お前もどのテレビ見せながら
3983.0450	3.4800	overt	3983.1300	4779654	先輩内藤さんの分かったこの沢木さんのおじさんがついちゃうんです
3987.4550	5.1300	overt	3987.5400	4784946	この前の大会が終わったのでハチ試合とかもしては決してなどを想像できるけど
3993.6350	3.2700	overt	3993.7200	4792362	何かに取れ込めてはそういう人と光るのかな
4000.0850	3.8100	overt	4000.1700	4800102	価値観とかそういう確かにそういったらかもしれない
4005.1250	3.4800	overt	4005.2100	4806150	邪魔すぎなからなあかかるとこりゃしててもらっていけない
4009.5950	3.0900	overt	4009.6800	4811514	私は思わないから私は思わないから
4014.3950	2.6700	overt	4014.4800	4817274	自分のために来てる人が光るんじゃないかな
4019.5250	1.4400	overt	4019.6100	4823430	お邪魔しました気をして
4036.9850	9.3300	overt	4037.0700	4844382	メジャーにもらったら多かったぞこれは出せばいいのまでちょっとお前に取材だ分けません大会別なので申し訳してニ回見ます
4048.4450	1.4400	overt	4048.5300	4858134	松岡先輩
4052.0450	1.3500	overt	4052.1300	4862454	特別ですよ
4054.2350	3.6900	overt	4054.3200	4865082	違い失礼だったイチ年いろいろあった次のイチ年もいろいろ起こるよ
4065.3050	6.6000	overt	4065.3900	4878366	よかったよかった 俺たちの先輩が似た見た目のチョコもあってでもたまたまにいたほそうすんでも誰が
4072.7750	1.1700	overt	4072.8600	4887330	ややさなはそう
4080.4250	1.5300	overt	4080.5100	4896510	あれが
4089.3050	1.9200	overt	4089.3900	4907166	あのお仕事をすんな妹です
4109.0750	1.8300	overt	4109.1600	4930890	プレスをこそこにやった
4111.5050	2.0400	overt	4111.5900	4933806	窓から入ってくるやつはどこに
4123.0850	2.6400	overt	4123.1700	4947702	先輩やって出してくれた第一君こっち
4128.4850	2.1300	overt	4128.5700	4954182	ジューナナ年生物をやって頑張れ
4132.5050	5.3100	overt	4132.5900	4959006	順番の間に使えただからあれは平等さん気持ちをついてごめんなさい
4139.1350	1.1700	overt	4139.2200	4966962	待ってくれたみたい
4141.2350	2.2800	overt	4141.3200	4969482	そこに行くつらーたら
4145.4050	1.7100	overt	4145.4900	4974486	ちゃんと聞いてください
4166.0450	1.2600	overt	4166.1300	4999254	失礼します
4183.7450	2.5800	overt	4183.8300	5020494	そうすればこう進み出すね
4187.4650	3.3000	overt	4187.5500	5024958	できるんちゃうかな
4191.5750	2.8800	overt	4191.6600	5029890	マスレンで足を鍛えている満足できない
4195.1150	2.7600	overt	4195.2000	5034138	本当に先生ティムザローション
4199.6750	1.0200	overt	4199.7600	5039610	ロク年生なんて
4201.5650	1.8300	overt	4201.6500	5041878	広く強く強調
4209.6650	4.5900	overt	4209.7500	5051598	青組リードです
4216.1150	2.9100	overt	4216.2000	5059338	遅れ辞児競技会員の要員で頑張れ
4221.9650	1.8300	overt	4222.0500	5066358	なってばすなわすな
4230.1850	2.1900	overt	4230.2700	5076222	ちょっと見てて何てなくそうだなって
4234.0250	3.3000	overt	4234.1100	5080830	情があったなあしてでもいいのかもどうやってやつです
4239.0950	1.9200	overt	4239.1800	5086914	振りてみるかどうしてこわらあった
4241.7350	2.4300	overt	4241.8200	5090082	ずるために話ができた
4245.3950	2.7900	overt	4245.4800	5094474	いいことだから何かあればそんなのくらいなありがとう
4248.8750	1.3500	overt	4248.9600	5098650	全てもらった方がいいか
4252.5950	1.6800	overt	4252.6800	5103114	喜ばしいことですよ
4259.9750	1.3200	overt	4260.0600	5111970	そういうのさっぱいとつ
4265.8250	1.5000	overt	4265.9100	5118990	と思い出は得意です
4270.6850	2.4600	overt	4270.7700	5124822	大勢頑張ろう
4274.2250	1.5600	overt	4274.3100	5129070	言えないってそういうことだよね
4284.7250	2.2800	overt	4284.8100	5141670	最近遅くなりました
4288.4750	3.0900	overt	4288.5600	5146170	お前がつまいちこうパイステーソーランド
4293.1550	4.2000	overt	4293.2400	5151786	ビビしては毎度バレてもいいですよだいぶ時間のことだったし
4307.5250	1.7400	overt	4307.6100	5169030	見つかるところでした
4310.6450	1.9200	overt	4310.7300	5172774	私のタイミングでいきましょうその代わり
4319.0150	1.0500	overt	4319.1000	5182818	そうはいましても
4323.9350	1.4400	overt	4324.0200	5188722	いきなり知ってあんまり分かんなかった
4335.0650	3.0000	overt	4335.1500	5202078	ここも頑張れ
4415.9150	3.2400	overt	4416.0000	5299098	素晴らしいが震えるねえタンタン役割の練習ね
4420.0250	3.1200	overt	4420.1100	5304030	俺はいらないよ次だね今度は敵なんだから
4432.2350	3.5100	overt	4432.3200	5318682	大切に教えてもいい練習ないですから
4436.8550	3.5100	overt	4436.9400	5324226	翔太郎さんの子もいるんだよね順調する気を楽しむ
4453.4150	1.2000	overt	4453.5000	5344098	節が巡ってきた
4456.7450	3.4800	overt	4456.8300	5348094	しかしビュージョン努力がやるとそう信じて絶対インターハイに行きたいと思います
4467.4250	1.2600	overt	4467.5100	5360910	そうなんじゃないんだ
4472.7650	2.4900	overt	4472.8500	5367318	今度は言ったですね
4479.8150	1.6800	overt	4479.9000	5375778	そういった場合は
4482.8750	1.3500	overt	4482.9600	5379450	先生がいるんで
4486.5050	2.1600	overt	4486.5900	5383806	できただけだったき
4490.5850	3.6600	overt	4490.6700	5388702	なんとなくそんな気がしてて頑張らせのためにしっかりやりなさい
4513.5050	4.0500	overt	4513.5900	5416206	後輩たちがただの平打ちをしに来たらしたら残念です
4518.1550	1.3800	overt	4518.2400	5421786	待ちませんよ
4520.8550	1.0800	overt	4520.9400	5425026	そんなことないですよね
4523.2250	2.4000	overt	4523.3100	5427870	ガンダンあって後悔したくない
4528.6250	1.6800	overt	4528.7100	5434350	これ自分も私の一部
4532.4050	2.5500	overt	4532.4900	5438886	珍しい何の話
4537.2050	1.2300	overt	4537.2900	5444646	私はそれが嫌だ
4539.0050	2.0100	overt	4539.0900	5446806	そんな思い私はそれに執着したい
4542.1250	2.0400	overt	4542.2100	5450550	あとは言えば
4552.3250	2.0700	overt	4552.4100	5462790	すっくり返したスマホまで
4557.0050	3.6600	overt	4557.0900	5468406	ここM体最小のジェスショナルソーと書いてある
4562.7950	2.1300	overt	4562.8800	5475354	ジュー%大丈夫かよかったです
4570.4750	1.3200	overt	4570.5600	5484570	お前の茶彼らやわね
4574.7950	1.4700	overt	4574.8800	5489754	まさか
4583.0750	1.6500	overt	4583.1600	5499690	最初一番止められなかった
4595.7350	6.9300	overt	4595.8200	5514882	ただいまバタバタ大丈夫おチンポおかじしてさわいて心配しないでまたウインターカップあるカフェに見て頑張るよ
4606.4750	2.1000	overt	4606.5600	5527770	こんにちは後ろ切り替えよう
4611.3350	1.2300	overt	4611.4200	5533602	あとより足はね本当
4615.5950	1.0500	overt	4615.6800	5538714	失礼します
4617.2150	2.9700	overt	4617.3000	5540658	大丈夫そんな少し疲れちゃう俺が行きたいところがあった
4622.1650	4.3500	overt	4622.2500	5546598	大地君の体幹もついたのでどうしてかに好きなレス水の塊
4627.8350	1.5300	overt	4627.9200	5553402	何でも吸収して
4697.7650	1.2900	overt	4697.8500	5637318	とこもってて
4701.3350	2.4600	overt	4701.4200	5641602	はいよし
4706.1950	3.4800	overt	4706.2800	5647434	風のすぐかもなっちゃって気にならない
4713.0050	1.2000	overt	4713.0900	5655606	続いて間にしちゃった
4722.5150	1.7400	overt	4722.6000	5667018	一度私はいけなかった
4725.9950	2.6400	overt	4726.0800	5671194	やつら練習にまた一句のうちの上心
4729.8350	6.5100	overt	4729.9200	5675802	協力してしたくなかったあるいは一番練習したの私の自身でも突如した人なんかやってきたことじゃない
4737.5450	1.2900	overt	4737.6300	5685054	終わり
4739.9750	1.5300	overt	4740.0600	5687970	そんなこと
4773.6350	1.0200	overt	4773.7200	5728362	すごいなすごい
4789.0550	2.4000	overt	4789.1400	5746866	ニ人ともすごいな
4793.4650	2.4600	overt	4793.5500	5752158	俺にも俺のやってきたことがある
4802.9150	3.4200	overt	4803.0000	5763498	テンチワールドスピードはありましょう
4808.6750	1.4100	overt	4808.7600	5770410	俺はそれが嬉しいんですよ
4830.6050	1.1100	overt	4830.6900	5796726	楽しかったよ
4835.0150	6.3300	overt	4835.1000	5802018	やっぱり時間が残ったような兄弟らしいがキリキレで甘くなって外から修士の方の体力を譲れていたから
4842.8750	3.7200	overt	4842.9600	5811450	カットをインターチャルと試合みたいなこれもやりたいな
4848.0050	1.6800	overt	4848.0900	5817606	大抵どんな聞こえなかった
4851.1850	4.8300	overt	4851.2700	5821422	疲れどうだったりしたかもラストの方もでも最後のカットとかもすいません
4857.0350	2.2800	overt	4857.1200	5828442	こっちのこと考えて誰にも待ちないくらいです
4862.6450	2.7900	overt	4862.7300	5835174	私たんどいですか
4866.8450	3.9000	overt	4866.9300	5840214	私はもういいの
4873.1450	2.0100	overt	4873.2300	5847774	おめでとう
4879.2650	2.2500	overt	4879.3500	5855118	見てきたからこんなに嬉しいどうしたの
4895.8250	4.8900	overt	4895.9100	5874990	その前にアリザベツヤペンお疲れになったら練習時間が
4901.4650	4.3200	overt	4901.5500	5881758	それが重複してます時間とも大会おかしいサン連休み近づいて
4907.0750	4.4700	overt	4907.1600	5888490	それは常戦犯含めて脳の前回してから救い上がってらないものを買ってくる
4912.0550	3.6900	overt	4912.1400	5894466	温かい方来ていこうね
4916.7050	3.2100	overt	4916.7900	5900046	サン三杯で全然転がしていた先生に残してたんですよね
4921.3850	1.6800	overt	4921.4700	5905662	そうだね強い人を持ってるからね
4936.1150	1.3800	overt	4936.2000	5923338	回復したみたいだね
4948.4450	1.6500	overt	4948.5300	5938134	じゃあ気にせずみんなでゆっくり
4954.5350	1.3200	overt	4954.6200	5945442	遅くなって
4962.0350	1.4700	overt	4962.1200	5954442	どうぞ
4968.7250	5.6700	overt	4968.8100	5962470	ほとぶのニ年生ではないいつ頃どう違うのやるのに早く行ってスペーサイトってよかったね
4980.5750	1.2300	overt	4980.6600	5976690	パンパン
4982.5850	1.7400	overt	4982.6700	5979102	なんでこんなことばらしちゃって
4987.5650	2.9100	overt	4987.6500	5985078	この前これからももう一度応援したい
4991.6150	1.6500	overt	4991.7000	5989938	これ何持ってるの
4994.0750	1.6200	overt	4994.1600	5992890	私たちなんですけど
4997.5850	2.3400	overt	4997.6700	5997102	自分の方がある意味で違いますけどいいか
5000.5550	2.1300	overt	5000.6400	6000666	家族が来られないしびちゅうか
5003.3150	1.0500	overt	5003.4000	6003978	最後のメカ
5005.0550	1.2300	overt	5005.1400	6006066	ちょっと絶対そう
5007.2750	2.7600	overt	5007.3600	6008730	気に入ったらいいかもしれない
5013.7550	1.6200	overt	5013.8400	6016506	あっという間でした
5022.7250	1.1700	overt	5022.8100	6027270	打開が始まる
5028.3950	3.2100	overt	5028.4800	6034074	でも気にしないでください
5033.4350	2.1000	overt	5033.5200	6040122	遅くに分かってイチ位で
5043.5150	1.1100	overt	5043.6000	6052218	やばろいな
5045.3750	3.1500	overt	5045.4600	6054450	ちょっと座りたくなったら千葉先輩いたお前田のところが
5054.8550	2.4600	overt	5054.9400	6065826	普通のペースで結構構わせて
5057.8850	1.3200	overt	5057.9700	6069462	こうやってもらえません
5060.1350	3.5400	overt	5060.2200	6072162	先輩が切り替えていく
5067.9350	1.6200	overt	5068.0200	6081522	ここまでの自信も落ちるのか
5073.8450	4.8600	overt	5073.9300	6088614	大人はバスチアや心臓が持たないのじゃったいけどほら前へ
5079.3650	1.1400	overt	5079.4500	6095238	これ単純プレゼント
5084.9450	3.1800	overt	5085.0300	6101934	この試合が最後からもしれない
5089.4150	1.0200	overt	5089.5000	6107298	そうやねくいはないが
5092.3250	2.7000	overt	5092.4100	6110790	この大会ベストヨンだったよ
5099.5850	2.6100	overt	5099.6700	6119502	大気をつかれこの輝き
5102.7050	4.4100	overt	5102.7900	6123246	太鼓の可能性についてですね
5109.7550	2.5800	overt	5109.8400	6131706	本当に長いサン年間楽しく出ていただいてます
5113.0250	3.0000	overt	5113.1100	6135630	私ジュー歳でこうしたと思って終わらないと
5117.4950	2.5800	overt	5117.5800	6140994	寝るなら部屋で寝なさい
5120.5850	3.9600	overt	5120.6700	6144702	お疲れ様覚えてたら後々じゃないもしかして
5128.7450	1.1700	overt	5128.8300	6154494	やっぱりそうか
5130.6650	1.8600	overt	5130.7500	6156798	生団とニ人の性全と違うけが
5133.1250	1.4700	overt	5133.2100	6159750	そうかやっぱり
5139.8150	3.1800	overt	5139.9000	6167778	だけどちゃんと最後言ったんちゃうのじゃないかもしれない
5144.6750	1.2900	overt	5144.7600	6173610	質なの行方を頼むぞ
5161.0850	2.4600	overt	5161.1700	6193302	ご覧さまで頑張った
5164.3850	1.4100	overt	5164.4700	6197262	そう言うやつね
5184.8450	1.0200	overt	5184.9300	6221814	おかしい
5193.3650	2.9700	overt	5193.4500	6232038	大丈夫私は望んでいなかったよ私は見せられなくて
5196.9650	3.2100	overt	5197.0500	6236358	最初は頭に光れて変わらないというか
5200.9550	1.4700	overt	5201.0400	6241146	まだ間に合うからそこにいて
5203.2650	1.1700	overt	5203.3500	6243918	何しようとしてんだよ
5205.9950	2.9100	overt	5206.0800	6247194	ごめんなさい
5211.7550	2.6400	overt	5211.8400	6254106	友達はダメ買ってくれなかった
5219.7350	1.4700	overt	5219.8200	6263682	そうだよ
5224.9850	1.1700	overt	5225.0700	6269982	よく似たみたいだけど
5240.3750	2.4300	overt	5240.4600	6288450	何とも思わないです
5244.0950	1.9200	overt	5244.1800	6292914	こういう風になるのに行ったら
5246.5250	3.5100	overt	5246.6100	6295830	最後に有名バトバの方をチェックして後ろも打ち打ちで散れていくし
5250.6350	3.3300	overt	5250.7200	6300762	これたまたまの私から見かけた時にはそらあそら嬉しい
5256.9650	1.2000	overt	5257.0500	6308358	スチェンジして
5259.3650	2.5800	overt	5259.4500	6311238	ありがとうございました
5268.9650	1.5600	overt	5269.0500	6322758	どうしてるんだ
5271.4250	3.1200	overt	5271.5100	6325710	私だから大事かなかったら見つけますって言っていると思う
5276.5850	1.1100	overt	5276.6700	6331902	いないですけどはい
5278.6550	1.0800	overt	5278.7400	6334386	先輩ですか
5280.7550	3.3900	overt	5280.8400	6336906	先日にスマホ忘れてたみたいでここにないんでしょうなんだ
5285.3750	4.9500	overt	5285.4600	6342450	こんなに連絡つかないなんておかしいとあったらご一緒で約束してたのに約束はない
5291.0150	1.0800	overt	5291.1000	6349218	一緒に守りたいのに
5292.6350	2.0100	overt	5292.7200	6351162	何して出しちゃったみたいな顔して
5295.6050	3.2100	overt	5295.6900	6354726	どうしたのかな
5300.9150	4.0500	overt	5301.0000	6361098	お金のことの手をつないでてお前も楽しそうで
5305.5650	2.0400	overt	5305.6500	6366678	先生のことはどうしてそんな嘘をつくの
5308.5050	2.0400	overt	5308.5900	6370206	そうなことしないんだんやできれそうな
5311.1150	1.2600	overt	5311.2000	6373338	そうこの鍵心
5314.8350	4.5900	overt	5314.9200	6377802	カナさん待ってそば何も大輝君何してるの出れなそうだったんでケントラ
5320.5950	2.5500	overt	5320.6800	6384714	デッドベラー少しは書くなった
5324.7050	7.1400	overt	5324.7900	6389646	そんな感じを持ってそんなことしているのかそんな感じを持ってそんなことしているのは時間のしたこと私やりさない
5332.8950	1.9800	overt	5332.9800	6399474	すいませんちゃんとやっぱり手にごめんね
5335.3850	1.2600	overt	5335.4700	6402462	全部成長でしょうか
5337.6050	2.4600	overt	5337.6900	6405126	ですってただかいできれいちんぱいですって
5341.3850	1.0200	overt	5341.4700	6409662	ここでやるやん
5343.2450	1.2900	overt	5343.3300	6411894	これで全部揃ったね
5365.7450	1.3500	overt	5365.8300	6438894	かわいい
5367.8150	2.0100	overt	5367.9000	6441378	彼の選手一転戦士本当だ
5370.8150	4.1400	overt	5370.9000	6444978	あれは失礼さね長い飛行機なんだ何か長いこともあるんですけどたくなりゃ
5377.2350	3.3300	overt	5377.3200	6452682	県が無事なわりそれは大事なオムネグミ食べるびくらが欲しいなとか
5381.8250	3.6000	overt	5381.9100	6458190	おたらかいにやがいだろうか
5389.3550	3.2400	overt	5389.4400	6467226	冗談でつけて言うと一つやめんなさいんだもんねそんな
5393.8550	5.1000	overt	5393.9400	6472626	俺だって返したいものをお出したいものは空気だったから聞いてみてください
5400.1550	1.1400	overt	5400.2400	6480186	今好きなわ言うな
5401.8350	1.9500	overt	5401.9200	6482202	こっちからさかどうしてられないと思っちゃだ
5405.1050	1.3800	overt	5405.1900	6486126	大活躍できますよね
5407.3250	1.2000	overt	5407.4100	6488790	大切にしてください
5415.2450	1.0200	overt	5415.3300	6498294	分かりやす
5424.8750	3.1500	overt	5424.9600	6509850	書いてみたいなシャツありがたい
5430.0650	3.8100	overt	5430.1500	6516078	感謝いくら言ってもいいからねそれじゃあまた一年よろしくお願いします
5437.5650	1.5600	overt	5437.6500	6525078	楽しみなお前たちの時代は
5439.9350	1.4100	overt	5440.0200	6527922	少し僕らは答えたぞ
5450.9750	1.1700	overt	5451.0600	6541170	最初驚いたもの
5454.4250	4.3200	overt	5454.5100	6545310	そうは俺言ってないような俺を今日もなみたいなことしてなかった
5460.5450	2.7000	overt	5460.6300	6552654	それは小さい頃から家が隣だから
5465.0750	3.5700	overt	5465.1600	6558090	そうではな上様にやつだった
5470.1750	1.2900	overt	5470.2600	6564210	この思わせぶりに
5472.1550	3.0900	overt	5472.2400	6566586	一緒にちょうだいまいでやつと思っちゃうのちゃう
5476.9850	2.0400	overt	5477.0700	6572382	元タンチの森谷さん
5479.6850	1.7100	overt	5479.7700	6575622	私は私ってもらってその
5546.9450	7.8300	overt	5547.0300	6656334	私のクラスタンプラリーからスタンプラリーで全部集めてあげてらっしゃるから大きくもりを考えておく
5562.1250	1.7400	overt	5562.2100	6674550	ヒャクキロ全部止めてやる
5566.1150	3.1800	overt	5566.2000	6679338	この子様たちのエスペリオが入った
5574.8750	2.2500	overt	5574.9600	6689850	今の方が入らないんだか
5578.5650	3.5400	overt	5578.6500	6694278	この中は一手に取りたかった青森の落ち着きが戻った
5586.7550	2.9700	overt	5586.8400	6704106	じゃあじゃあ見方味方私たちを落としてのもという高いなものだった
5590.7750	2.9400	overt	5590.8600	6708930	楽しくてまっすぐ伸びてして今日本代表だな
5595.3050	4.5600	overt	5595.3900	6714366	再開しても全く俺たちと楽そうとしなかったごみたす存在感が圧倒的
5600.5850	1.3500	overt	5600.6700	6720702	手元に失うのは技だ
5602.7150	2.8500	overt	5602.8000	6723258	ビクセブロジャストと頭につかせて火をつけた
5606.5550	5.5200	overt	5606.6400	6727866	毎のプレスがなくなったしまた秋山もつか秋山くるから
5616.5150	4.3800	overt	5616.6000	6739818	お前の気持ちになったんやから出してくるからなきゃ
5623.8350	2.0100	overt	5623.9200	6748602	ムチーパーしないから掘り込んでみせる
5628.4850	2.0100	overt	5628.5700	6754182	俺は落ち着かないこの線になってきた
5638.3850	1.7700	overt	5638.4700	6766062	お客様として
5640.8750	3.0600	overt	5640.9600	6769050	何か一人されるわけにはいかないな
5644.6850	1.5900	overt	5644.7700	6773622	ノーカーとなっちゃいになってきた
5649.4250	3.0600	overt	5649.5100	6779310	クロスハイカクストのことのチャイになってきました
5653.4750	2.8500	overt	5653.5600	6784170	ミスで困ったね
5656.9550	1.6200	overt	5657.0400	6788346	自分の方がつらかせ
5659.5650	4.2600	overt	5659.6500	6791478	本当についていかない
5666.4350	4.6800	overt	5666.5200	6799722	我々高校でストリーミング戦術に比べしのリースのサローメンの高さかという姿勢になる
5674.6250	1.5300	overt	5674.7100	6809550	今のファーで大丈夫か
5678.2250	2.2500	overt	5678.3100	6813870	そうです
5682.4250	3.0600	overt	5682.5100	6818910	僕大戦の俺の時のボロボロのプレミアデビューあれか
5686.6250	4.2600	overt	5686.7100	6823950	そのまで後悔したのは誰かと変わっていくのに大先にデビューさせてもらった
5692.0250	1.4100	overt	5692.1100	6830430	大丈夫大丈夫
5694.4550	1.3800	overt	5694.5400	6833346	ちょうど一緒に下さい
5701.7150	2.3700	overt	5701.8000	6842058	本当に苦手なコースでフィールドを見渡せる
5709.0650	3.2100	overt	5709.1500	6850878	力点なりカオスなそれのフィールを見えたする出番だな
5714.6750	1.9200	overt	5714.7600	6857610	分かってるじゃないいますよ
5717.4350	2.8800	overt	5717.5200	6860922	でもこいつがほぼ早めに届く
5721.0950	5.6400	overt	5721.1800	6865314	よしよしよいしょ私お前が手に回ったらお前さんにつに興味ないでる
5728.1450	3.1800	overt	5728.2300	6873774	捕まえボール広いの前にボールが行くんだよ
5732.5550	1.7400	overt	5732.6400	6879066	これらまた一本気になりますか
5735.5850	1.8600	overt	5735.6700	6882702	そらみたいなかしちゃうことができる
5740.9250	1.0800	overt	5741.0100	6889110	そういうことか
5745.8450	3.5400	overt	5745.9300	6895014	全然ちゃんと一緒なもらってもっとワイドの大きく使っていこう
5750.6450	2.7300	overt	5750.7300	6900774	これからゴール守らない
5754.8750	3.7500	overt	5754.9600	6905850	いいところにこの後ろから立て直す
5766.4550	3.1800	overt	5766.5400	6919746	なんで今嘘かずれてるの
5781.1550	1.4400	overt	5781.2400	6937386	かぶちよく撮れたぞ
5783.5850	1.6800	overt	5783.6700	6940302	一番背中にはたまらない
5788.8050	4.8300	overt	5788.8900	6946566	サイド人間はここで囲んだ
5798.6450	2.0400	overt	5798.7300	6958374	じゃあニ人のところに出した
5801.9750	2.4900	overt	5802.0600	6962370	本当にやっぱりそうですのかなんてやばい
5805.5150	2.8500	overt	5805.6000	6966618	俺は何としたら
5811.3050	1.9800	overt	5811.3900	6973566	よく止めて前に出てる全然でした
5814.1850	1.0800	overt	5814.2700	6977022	クレワーサイク
5824.7150	2.1000	overt	5824.8000	6989658	ここにつかまいつかない
