onset	duration	trial_type	wav_onset	sample	value
5832.0350	3.5400	overt	5832.1200	6998442	この所長かこいつの土壇場から関連視界が開いたね
5842.8650	1.0500	overt	5842.9500	7011438	ちょっと思ったれよ
5860.2650	2.6400	overt	5860.3500	7032318	聖地さんの前にバスパリ指したの選手を説そう
5863.5050	1.1700	overt	5863.5900	7036206	それにやつまらくそう
5866.6250	3.6900	overt	5866.7100	7039950	絶対見たいと思う絶対見てくれたから前だけ見てなきゃできる
5871.8150	3.5100	overt	5871.9000	7046178	後ろだパイスの方じゃないスペレンスは時間の問題
5876.4050	2.7900	overt	5876.4900	7051686	見たかりは持ってますしやがり本当の使い方
5880.0950	2.3100	overt	5880.1800	7056114	ポジションしてる立場の頭がいっぱいだ
5883.8750	3.0600	overt	5883.9600	7060650	馬場立村ちょっと来いお前らニ人に
5887.4750	1.0200	overt	5887.5600	7064970	やっぱり違う
5889.5750	1.6200	overt	5889.6600	7067490	最後まで最後までさようございます
5898.4250	1.2900	overt	5898.5100	7078110	休憩入ります
