onset	duration	trial_type	wav_onset	sample	value
1791.3050	2.1900	overt	1791.3900	2149566	毎日だから成果を見てみてよかった
1794.4550	1.7100	overt	1794.5400	2153346	さまに行こうなしも
1797.1850	3.1500	overt	1797.2700	2156622	自分行政界の場所にも終戦すると思います
1814.2850	2.2800	overt	1814.3700	2177142	こうでもしないと話あなたには必ず
1835.2850	2.2500	overt	1835.3700	2202342	スイッチ中から全て前の判断でやれ
1849.6850	1.4700	overt	1849.7700	2219622	かなりあるよかったんです
1852.5950	1.3500	overt	1852.6800	2223114	ジューサンに
1860.4850	1.6500	overt	1860.5700	2232582	私たちの中につくと
1867.7150	2.8800	overt	1867.8000	2241258	サン球はよし取ったそれの場所高い位置にサン人
1871.8250	1.0800	overt	1871.9100	2246190	またボール回して
1876.5950	2.2500	overt	1876.6800	2251914	お手なさんのことは俺のところに
1881.3350	2.2500	overt	1881.4200	2257602	このレンドこれなんか塗れる動いてる
1885.4450	3.2400	overt	1885.5300	2262534	あるわけだからこそあれとあれやるしな
1899.0050	4.4100	overt	1899.0900	2278806	この曲をいつも伝えてるぞここだ
1904.1350	2.4600	overt	1904.2200	2284962	こっちが違う
1908.0350	3.6300	overt	1908.1200	2289642	収積させたて例えばここだという通信術の言葉だけでなく
1913.1650	2.7900	overt	1913.2500	2295798	単的にしかし強く耐える
1917.2150	4.4100	overt	1917.3000	2300658	これはそうだが前も仙台ベラムに上がりのクエストを教えたのか
1923.1550	3.4500	overt	1923.2400	2307786	この辺で試合に出れなくて絶対にもう一度お願いします
1927.9850	4.8300	overt	1928.0700	2313582	静か延びながらずつ多く集まっている俺がお前たちを出してる気のがここにしかない
1933.7450	1.5000	overt	1933.8300	2320494	次はないかつために
1940.9450	5.4600	overt	1941.0300	2329134	無人像のスタミナ 疲れてきたジェットコースみたいに腰をつり替わってくる
1947.3950	2.6700	overt	1947.4800	2336874	よかっただからいい感じで作るボールを
1952.6150	2.5800	overt	1952.7000	2343138	長丸も全員戦車が落着してるフィールド
1971.3650	4.5600	overt	1971.4500	2365638	ジャノレーンのロングチェングニジューニ位青森フォドラムホラダルとJが完全に来た
1983.2450	4.9500	overt	1983.3300	2379894	ストレーニングを繰り返してるけどコントネタルやっぱりこれは俺たちが戻してリポールじゃないか
1990.2350	3.4500	overt	1990.3200	2388282	話元のアメージを勝ち方を俺らは続けるために
1995.2750	3.6900	overt	1995.3600	2394330	そしてもう一つの狙い
2000.3450	2.2500	overt	2000.4300	2400414	ヒャクジューロク年これじゃん
2006.0150	2.1000	overt	2006.1000	2407218	今セリラのここにも大丈夫
2010.1550	1.4700	overt	2010.2400	2412186	少し点から一方的に
2013.8750	2.1300	overt	2013.9600	2416650	先生の目を離せなかった
2022.6350	2.3100	overt	2022.7200	2427162	あいつはピュラに最高の言いつを持ってる
2026.3550	4.2600	overt	2026.4400	2431626	あいつ最高の足元に行かせて俺は逆や
2031.9050	2.9100	overt	2031.9900	2438286	あれがお金を持つ者としてそのプレースタイになれない
2036.6450	2.4300	overt	2036.7300	2443974	残酷な俺にはなれない
2039.6450	3.9000	overt	2039.7300	2447574	分かっただからどうするんだっけ
2045.3450	1.0800	overt	2045.4300	2454414	私の選手だったら
2047.5950	1.8300	overt	2047.6800	2457114	それじゃあみんな再度使われた
2050.9850	1.8900	overt	2051.0700	2461182	今の瞬間は大きくてここまでいける
2057.4650	1.9500	overt	2057.5500	2468958	どう戦うか話す人しかいない
2065.6250	2.6400	overt	2065.7100	2478750	自宅で完璧にアメタウマネサイズというのは正しいですね
2082.0650	5.0400	overt	2082.1500	2498478	最初に見ただけのが見てしまったそういうのにさっしゃらないでよかった戦う前に知れてるからそうじゃないのか
2088.5750	3.3000	overt	2088.6600	2506290	そんなことでお友達にならせや俺もあんな人戦いなとは告白する
2105.4350	2.4300	overt	2105.5200	2526522	彼らの部屋まで生まれ様に行ってみて
2109.1850	4.6800	overt	2109.2700	2531022	ケイマさんケイチさん小林さん小川さんに出るか出ないかも大きくちゃいです
2115.4250	2.4600	overt	2115.5100	2538510	そこではお世代対人がいると帰ったのに
2120.4650	1.6800	overt	2120.5500	2544558	これは絶対に一応
2125.8950	3.3300	overt	2125.9800	2551074	このうちにプロなら最後のチャンスを本当に登ってくる
2132.1050	1.3500	overt	2132.1900	2558526	必ずこのチャンスをお願いします
2135.7950	4.3500	overt	2135.8800	2562954	大変に強すぎる
2141.7350	1.8900	overt	2141.8200	2570082	お店で当たり前だろ
2144.3450	1.9800	overt	2144.4300	2573214	戦いたい
2150.1350	6.6000	overt	2150.2200	2580162	分かってもそういうようなことを考えてたかんの能力成した方でプリならうちじゃないだろあくまで行き詰めのための大会なんだ一例ありますね
2163.9950	1.9500	overt	2164.0800	2596794	頼むよお前の力がいる
2247.1250	1.0500	overt	2247.2100	2696550	ちょっと確かにですね
2250.1850	2.1000	overt	2250.2700	2700222	背負けたらダメならない
2253.2150	4.0200	overt	2253.3000	2703858	若干症状のところでこれを生まれ人生を信用した人もいないだろう
2258.0750	1.0500	overt	2258.1600	2709690	さて決戦だな
2259.9350	3.3300	overt	2260.0200	2711922	伝えた通りキリキと秋山が出場を続きとしてきました
2264.0750	2.2500	overt	2264.1600	2716890	最後は福田さんの実は
2278.1450	1.6200	overt	2278.2300	2733774	ただいまして
2282.4050	1.4700	overt	2282.4900	2738886	さてお前ら
2287.5950	1.5300	overt	2287.6800	2745114	これさあさか
2289.7850	2.2800	overt	2289.8700	2747742	寝てたらね
2294.1050	2.4300	overt	2294.1900	2752926	何て言ってくれば すごくはしてるのもっとだぜ
2298.3950	6.4800	overt	2298.4800	2758074	ファットフォートドンビスサッカーだろうな相手が何をやってくるか分からないからなおさら手のちが見えるまで引いて基本ロングボールを掘り込んでいく
2305.8050	5.1600	overt	2305.8900	2766966	技術は正直なBチームでありとしていたエデアの初めてだ
2312.1050	1.0500	overt	2312.1900	2774526	すぎゃあおかえられ
2316.9350	3.9900	overt	2317.0200	2780322	ちゃんと信濃が残っているツトニーコツで戦いたくない人がありました
2323.1450	2.0700	overt	2323.2300	2787774	どこまでも強すように教えてきた
2327.9450	1.5900	overt	2328.0300	2793534	サッカー スペニア多分さっかで
2334.3950	2.8500	overt	2334.4800	2801274	自身何的に近つそのところのことは将来は考えてない
2339.0450	1.2900	overt	2339.1300	2806854	自分のこと諦めた
2341.9850	3.2400	overt	2342.0700	2810382	この辺は無理だと本当にその話のシェンジでしたね
2346.1250	4.7400	overt	2346.2100	2815350	武器を勝てばポジションやりましょう
2353.6250	1.1100	overt	2353.7100	2824350	そうなったのやつたい
2367.7250	2.1000	overt	2367.8100	2841270	これがプレミサイズの合わせです
2377.1450	1.5900	overt	2377.2300	2852574	あざないがいらっしゃる
2380.0550	1.0200	overt	2380.1400	2856066	ごめんなさい
2383.1450	1.6800	overt	2383.2300	2859774	あらお前とこのことやるかったね
2386.3250	2.7000	overt	2386.4100	2863590	俺は一緒に行く限りちゃくちゃうからだったな
2392.2950	1.8000	overt	2392.3800	2870754	こっちも守れなかったポジションやる
2411.8250	1.7100	overt	2411.9100	2894190	そして始まりましたこの場合やるキャノ
2415.7250	2.2200	overt	2415.8100	2898870	探してた
2419.4450	3.6000	overt	2419.5300	2903334	先生とかよく前提だからお手に残りなさいお店のことだけを話す
2424.2750	4.8600	overt	2424.3600	2909130	どうしようもねえんだその父さんお前らもとにかく聞いてもそんなこと言えないとな
2430.6650	2.5200	overt	2430.7500	2916798	あいつの気持ちが電波した
2437.0550	3.8400	overt	2437.1400	2924466	普通の気持ち悪かった急に聞いてそんなこと言ってくるとか
2441.6450	3.0300	overt	2441.7300	2929974	俺は自宅フィードでしか書いてない
2448.2150	2.7600	overt	2448.3000	2937858	いや俺はあんたになりかかったか違うんです
2451.9650	3.1500	overt	2452.0500	2942358	あんたは俺の方向いてそこ足してくれるそれ以上はないわ
2456.4650	2.2500	overt	2456.5500	2947758	たった今からグランドリークです
2499.4550	1.1400	overt	2499.5400	2999346	決定者となりました
2503.5050	3.9300	overt	2503.5900	3004206	おめでとうございましてもキュージュー分に全ての決着がつきます
2509.6850	1.8900	overt	2509.7700	3011622	緊張するのよなこっちこっち
2514.8150	2.4000	overt	2514.9000	3017778	これがかなクオンは全然来られた
2518.0250	2.6100	overt	2518.1100	3021630	私の依頼かあれからこそに言わてなんでこんなことに
2521.5950	1.9500	overt	2521.6800	3025914	そうか私のせいかでも今日は
2526.6350	2.1300	overt	2526.7200	3031962	あんたに言われはないぞ
2531.6750	2.7300	overt	2531.7600	3038010	実は音しようじゃないか高波さん卵の頂きに
2536.1450	3.6900	overt	2536.2300	3043374	それじゃかなレスピリオンは若い質感の悩みがついに出てるそのせいで
2541.5450	2.5800	overt	2541.6300	3049854	大勢を見せればならなこの人選手がかわいそうだな
2546.0150	3.8400	overt	2546.1000	3055218	この人間に応援することができる
2551.8650	1.8000	overt	2551.9500	3062238	私も俺らがもらうぜ
2554.6550	1.5900	overt	2554.7400	3065586	同じ年代でしたね
2558.2250	10.7400	overt	2558.3100	3069870	ここにいるのぞみも一緒に
2576.9450	1.2300	overt	2577.0300	3092334	お見事です
2580.3650	6.2100	overt	2580.4500	3096438	クノカとかモレネさんがエスパニオリで俺がサバテルそして下島の地盛りだととまいちゃう
2587.7450	1.1700	overt	2587.8300	3105294	食事に
2590.2650	4.1700	overt	2590.3500	3108318	薄どもの息子に話になると誰もが言うんです
2606.0150	1.0200	overt	2606.1000	3127218	抵抗してみましょう
2611.7450	2.3400	overt	2611.8300	3134094	このチームが下に下が見えちゃなっちゃいですね
2645.8850	2.4300	overt	2645.9700	3175062	私が高校世代を制覇するべたい
2649.3650	1.8900	overt	2649.4500	3179238	実はだいぶ変わったなでも勝つ
2654.9750	1.1400	overt	2655.0600	3185970	テメラもそうしろ行くぞ
2656.8950	1.2900	overt	2656.9800	3188274	裏の通過でねしかない
2659.5050	3.7500	overt	2659.5900	3191406	そのためにスピロットの通常になっているそのためエスピレートラーの通過では最近
2665.0850	3.3300	overt	2665.1700	3198102	どうせに聞くんだポジション向かいに対して
2670.1250	3.6000	overt	2670.2100	3204150	セルキー場で一緒なんだから今からキュージュー分もスピールド上で青森が
2675.4650	3.9900	overt	2675.5500	3210558	この方が何でもとにかく応援してほしいんだと特にあいつの動きや
2687.4350	1.1100	overt	2687.5200	3224922	やっぱり俺のことを知ってる
2692.3250	1.2900	overt	2692.4100	3230790	なんでくなんてどうでもいい
2704.4450	2.7600	overt	2704.5300	3245334	最初は毒だ
2709.2750	1.0200	overt	2709.3600	3251130	何ペスに行かない
2711.3450	1.1400	overt	2711.4300	3253614	どう見てるわけでもない
2714.1650	1.0800	overt	2714.2500	3256998	ちょっと立ち上がり
2715.8150	3.2700	overt	2715.9000	3258978	こっちから行ってやらないかこの左サイドからよし
2723.6150	1.7100	overt	2723.7000	3268338	全てスピーダーの場合成
2732.6450	1.5000	overt	2732.7300	3279174	最初に戻っておかしい
2740.4150	1.6200	overt	2740.5000	3288498	絶対すごいな
2743.6550	1.2600	overt	2743.7400	3292386	私はこういうことか
2747.9150	5.1900	overt	2748.0000	3297498	俺が上がった当時ハチ分イチ分そもそもナナセン円がそもそも俺が出なかったサイドバックな
2756.5550	1.7100	overt	2756.6400	3307866	アフレンに入ってます
2766.9950	3.6000	overt	2767.0800	3320394	山田選手からでも振られないじゃないじゃない
2771.8250	2.3100	overt	2771.9100	3326190	若いつもみんな一応中でできてこれで行くって
2775.3050	1.6200	overt	2775.3900	3330366	みんなが腹をくくってる感じ
2785.4450	2.5800	overt	2785.5300	3342534	絵のクリアで全員のクリアで
2789.7650	1.9500	overt	2789.8500	3347718	これはプレッシャー作られていく
2795.4050	1.5900	overt	2795.4900	3354486	思い出した
2798.9150	3.8700	overt	2799.0000	3358698	ワンタッチのパスは見たくない技術教授目の前に見せられて
2803.8350	6.3300	overt	2803.9200	3364602	韓国は絶望それが今最高の見方優勝がかかったうちばん勝ついの最高の規模を勝てる絶対に勝てるぞ
2816.8250	2.1600	overt	2816.9100	3380190	ちょうどこの後でも足元のボールですもん
2836.2350	3.8400	overt	2836.3200	3403482	すごい反応できっぱいですね
2846.7050	3.9000	overt	2846.7900	3416046	とぷすみようって言ってたけど私ってボロストスとしてもとなりです
2852.4050	3.1200	overt	2852.4900	3422886	足元柄子さんは最初にジューmの加速力はない
2858.3150	3.3000	overt	2858.4000	3429978	ミジェルがどんどん実際にボールを出さない手を不思議なことに
2862.9050	4.4400	overt	2862.9900	3435486	全然詳しくないなあいつやくればしょ見た時は見た時は何でやろ
2869.4750	2.4600	overt	2869.5600	3443370	全然ないからですよ明日
2874.8450	3.2400	overt	2874.9300	3449814	今の前どうしてもどうしてディフェンステンコース
2879.2550	2.5800	overt	2879.3400	3455106	自分はお前にしかできなまいらきゃいけない
2884.0250	3.3300	overt	2884.1100	3460830	すみませんでした
2893.2350	3.5100	overt	2893.3200	3471882	私の子よかった放り込んできたりしたらすごくつまらない一日になるところだった
2907.0350	1.8300	overt	2907.1200	3488442	おいやいたなルース
2915.4350	1.2000	overt	2915.5200	3498522	パスピアボレースはいいんだ
2918.5550	1.4100	overt	2918.6400	3502266	ついちゃくちゃうかなっちゃって
2921.6450	1.5000	overt	2921.7300	3505974	なんか全員俺の方見てないか
2928.2150	1.5000	overt	2928.3000	3513858	全員俺の褒めじゃないか
2938.4450	3.2700	overt	2938.5300	3526134	今日のステージは俺のサイドの右側だ
2946.5150	8.0400	overt	2946.6000	3535818	お前のビルダップに生きる時だとパンツの時の時のパンツの時のようによしちょっと攻撃参加を押さやした
2957.5550	4.0800	overt	2957.6400	3549066	ジュー日ごもらえたら地区にプレスクレースが迫り出せるか
2963.4950	1.8600	overt	2963.5800	3556194	ここを中で一旦切り戻します
2966.9150	3.6000	overt	2967.0000	3560298	さっきから明日なんか寝られてないかそのあずはないと思うんですね
2971.5650	3.6600	overt	2971.6500	3565878	それは確かに山田君のポテンシャル見てもいい斎段しく願うかもしれない
2976.6650	4.2300	overt	2976.7500	3571998	いきなり青井君にあるのつくさすが試合前から手で決めてないと無理発動としたらばしいんだよ
2984.9450	3.7200	overt	2985.0300	3581934	今日この時間の試合定感をいくにマークをつくなんて考えられない
2999.5550	7.2300	overt	2999.6400	3599466	青森がいい大切に意識してるなら高速度は絶対山田さんが行く
3010.7450	1.3800	overt	3010.8300	3612894	やめるな
3021.6350	3.1800	overt	3021.7200	3625962	まだまだ戻すなきゃ置いてられるまで左に戻す
3026.1050	2.3700	overt	3026.1900	3631326	アイセンシャー戦争して戦っています
3032.3750	2.0400	overt	3032.4600	3638850	これはスペラングを変えらせようじゃなくみやすい
3042.2750	3.1200	overt	3042.3600	3650730	この組み合わせは今から伝える
3064.6250	1.2900	overt	3064.7100	3677550	でもありがたいなこれな
3261.0050	12.9000	overt	3261.0900	3913206	信じられないこれはハンサイレー選手を先日として狙っていますミサイルの山田君のパスコースを北西として狙っていますミサイルの山田君のパスコースを切っているなんで俺ないよ
3276.6650	1.7700	overt	3276.7500	3931998	俺はしかしちゃった
3281.8850	1.0500	overt	3281.9700	3938262	ここはライトに
3289.7450	1.0200	overt	3289.8300	3947694	お遠くにも
3292.2650	4.0800	overt	3292.3500	3950718	パール加工のカバーはグーズ前ボールになってくれた
3297.5450	3.5700	overt	3297.6300	3957054	その瞬間は何が一かせまでゴルマレして待ちたはずだ
3302.3150	3.9600	overt	3302.4000	3962778	まさにこうやってもアクセットだったことやな
3307.4450	2.2800	overt	3307.5300	3968934	私たちのマークについてる
3311.5850	1.3200	overt	3311.6700	3973902	大丈夫なのよ
3341.7650	2.1900	overt	3341.8500	4010118	先生じゃない
3347.7350	10.2600	overt	3347.8200	4017282	ゾーン主流の戦術が進化して現在にいたそんなくらい戦死にやって大丈夫だって大丈夫なのはこれまでの山田洋に組み合わせなかっただけだなぜかこの辺りは非常にアンボラスで異なるんだよ
3360.3050	2.1300	overt	3360.3900	4032366	最後はちょっと中落選手にするしかない
3367.6850	4.0500	overt	3367.7700	4041222	そこにさてもう足と左下に置くないい形でもいいかちよみんなよき足立つなじゃん
3372.3950	2.6400	overt	3372.4800	4046874	多めだったらピースから合わせてやむかい
3376.8650	1.5000	overt	3376.9500	4052238	中華ストのところに
3379.2950	3.3000	overt	3379.3800	4055154	分かったなんで寝なかしらこういうんですか
3384.9350	2.0400	overt	3385.0200	4061922	そうなんつもバスタータリオハイリスク
3388.6250	4.2900	overt	3388.7100	4066350	一番足の技術が一番下手のSUVCで俺が勝てるわけねえってことだ
3394.4750	3.2700	overt	3394.5600	4073370	気持ち患者のみかしたイチ点とパートナムになる
3398.9450	2.8200	overt	3399.0300	4078734	ヨンつかれてないのかつのマンツマンのに使い入れたんだ
3415.4750	3.5700	overt	3415.5600	4098570	こいつのスカディングはしたことない
3420.2450	4.0200	overt	3420.3300	4104294	ギリギリの目がいいんですから気をつけて気をつけるさ
3426.2450	2.1300	overt	3426.3300	4111494	本当に少なくなっちゃったよね
3429.0350	2.5800	overt	3429.1200	4114842	一方そいつの前にて俺を鏡見ててくれた
3433.4450	1.4400	overt	3433.5300	4120134	これが一緒にわせるわけに
3437.7050	2.6400	overt	3437.7900	4125246	あらゆら悪さない
3442.3850	3.1500	overt	3442.4700	4130862	下手な俺を狙われたので確かに爆裂されました
3454.0850	2.4300	overt	3454.1700	4144902	そういう間にないだろうなと思って
3463.4450	2.7600	overt	3463.5300	4156134	お前のような体育弱いとなりそうです
3473.4050	2.9100	overt	3473.4900	4168086	ロングフィートこの皿にゴレーキが巻き出してくれました
3477.2450	3.5400	overt	3477.3300	4172694	何であのアキアマってごりきゃあんないとびやすなんてこりゃいけない
3482.0450	2.7900	overt	3482.1300	4178454	私たち王子と母さんすごいのボボカなのか
3486.3050	1.2900	overt	3486.3900	4183566	フィランセーロー
3489.1850	1.0200	overt	3489.2700	4187022	今日のプランで行くぞ
3490.9250	2.7900	overt	3491.0100	4189110	最後プレッサーとしているというか確かに決めていくぞ
3509.7650	2.4000	overt	3509.8500	4211718	風船を反応してあるほど位置まで下がってくれた
3512.7650	6.4500	overt	3512.8500	4215318	さらに一人化して前にパスするなんて動機がありますね寺本さんそれ中も早速スペラを追い詰めたということです
3522.7850	1.6800	overt	3522.8700	4227342	社連れ込まれに暴れをごめんか
3528.3650	1.2600	overt	3528.4500	4234038	それでは忘れますのか
3546.2150	2.8200	overt	3546.3000	4255458	マーク外して待ってマーク外してない
3550.7450	1.5000	overt	3550.8300	4260894	なんていつも上がってくるんだ
3555.6650	1.6800	overt	3555.7500	4266798	ボールを変えた三瞬間
3558.1850	1.5900	overt	3558.2700	4269822	高市区のストラインでしたが
3561.0650	2.7600	overt	3561.1500	4273278	そういうのことやっぱり私もらっておりゃいけない
3571.8650	1.2900	overt	3571.9500	4286238	お分かりたいです
3586.2050	2.1000	overt	3586.2900	4303446	まだいいね分かり合ってそのまんでもながら
3599.8250	2.3700	overt	3599.9100	4319790	私は前を言わせてもらった方が
3603.0050	3.7200	overt	3603.0900	4323606	お前がいてくれることがでかいな来年予選手に紹介しても頼みますか
3607.7750	2.8800	overt	3607.8600	4329330	なんでそもちろん悪い方まではまだ心臓では
3611.1650	1.6500	overt	3611.2500	4333398	言わちゃわちゃってるだけ
3613.7450	1.0500	overt	3613.8300	4336494	ピスタチオシナイン
3618.5150	1.0800	overt	3618.6000	4342218	そういうこと言って
3622.9250	3.9600	overt	3623.0100	4347510	まだ仕込まれていたところに全体的なチャンスだったんです
3630.6050	3.8700	overt	3630.6900	4356726	なんていうと言うと
3636.3950	1.2300	overt	3636.4800	4363674	ニニジューヨン
3650.8550	4.0800	overt	3650.9400	4381026	ディフェンスラインの身長を殺さないスプライディング合戦である
3656.4050	3.7800	overt	3656.4900	4387686	ディフェンスラーになるような
3661.8350	1.6200	overt	3661.9200	4394202	とわしです
3664.8650	7.3800	overt	3664.9500	4397838	後ろからかみたったのは正解な気が出てきたことで一気にボールが蹴り出したけどやっぱりこういったの一応
3673.0250	3.7200	overt	3673.1100	4407630	これは明らかに制律する
3678.9650	1.6800	overt	3679.0500	4414758	これじゃないんだけど
3683.4050	1.4100	overt	3683.4900	4420086	本当に失礼します
3687.7850	3.6900	overt	3687.8700	4425342	すごいです
3693.8150	3.7500	overt	3693.9000	4432578	楽しめてしまったでも楽しめてるままやんだ
3699.3950	3.2700	overt	3699.4800	4439274	どうしたんですか
3712.4450	3.7800	overt	3712.5300	4454934	日本語力盛り盛り盛り盛り上がったらばいすみようなポジションを削渡する
3717.1550	3.0300	overt	3717.2400	4460586	何だけ来る砂を見えておかせをこそけちってくれ
3720.7850	4.4100	overt	3720.8700	4464942	たださまやいたら申し訳ていたらお前ら新調でエスペリースタートです
3727.2350	2.3100	overt	3727.3200	4472682	全身長が正解してしまったら
3731.2550	3.0000	overt	3731.3400	4477506	ごちそうです
3736.2650	3.0900	overt	3736.3500	4483518	確かにカザイカの気持ちでいてもどうする
3741.6950	1.0800	overt	3741.7800	4490034	ここからかに
3749.5850	1.2300	overt	3749.6700	4499502	こちらも残させてたからだ
3754.8650	2.1900	overt	3754.9500	4505838	心臓で私が大事な
3764.2550	3.5400	overt	3764.3400	4517106	それはそれとなら不調子をしかしているのそんな照明はつかない
3769.1150	2.5500	overt	3769.2000	4522938	身長もねて今夜のあるくらいか
3778.1450	1.0500	overt	3778.2300	4533774	何でもありません
3783.2750	4.6500	overt	3783.3600	4539930	だって前におかしくなるんですよくなるんですよくなって
3789.5150	3.6600	overt	3789.6000	4547418	そうだどうしてもどっちもジュー本もいってないだろう
3816.4550	1.6200	overt	3816.5400	4579746	私もだって
3818.5850	1.8600	overt	3818.6700	4582302	スティラもあってもっといっしゃい
3821.4650	3.7200	overt	3821.5500	4585758	はいどうぞそこをお楽しく降りてありがとうございます
3826.0250	3.4200	overt	3826.1100	4591230	お疲れさま
3829.9850	2.1600	overt	3830.0700	4595982	じゃあ渡りちゃうかだちでもさっきんとりするぞ
3833.7350	2.2800	overt	3833.8200	4600482	確かに声を出していますか
3837.2450	2.1000	overt	3837.3300	4604694	最高のクリスマス
3840.6350	1.3200	overt	3840.7200	4608762	これも楽しまないとブブー
3842.6750	3.7200	overt	3842.7600	4611210	このチケットの割りといて何だか苦手に入れたみたいな
3847.1450	3.0300	overt	3847.2300	4616574	バイスタートしようじゃあるから帰れないまた
3854.4050	1.0500	overt	3854.4900	4625286	どうでも変わりました
3857.1650	2.3100	overt	3857.2500	4628598	あらコミュニラも行ったのかしら
3861.0950	2.8500	overt	3861.1800	4633314	あれ鹿野さんじゃん今日試合じゃなかったちょっと忘れ物に
