onset	duration	trial_type	wav_onset	sample	value
1.6075	3.9300	overt	1.6200	1929	娘たち娘たちアナスタジーデルフィーヌ
6.1075	1.8600	overt	6.1200	7329	あの子たちに会いたい
8.9875	5.3400	overt	9.0000	10785	憲兵隊や軍隊を使って探して彼女たちを連れてきてくれ
14.9575	16.4100	overt	14.9700	17949	私の言うことが正しい何もかも私の言う通りだ当然だ民放典だ私は抗議するもし父親というものが土足で踏みにじられるようなら祖国は滅びてしまうだろう
32.1175	1.3800	overt	32.1300	38541	こんなことは明らかだ
34.0975	3.9600	overt	34.1100	40917	社会も世間も府県の上で動いているんだ
39.1075	4.5900	overt	39.1200	46929	子どもが父親を愛さなくなれば全部が崩れてしまう
44.3875	1.9200	overt	44.4000	53265	彼女たちに会う
47.1175	1.7700	overt	47.1300	56541	彼女たちの声を聞く
49.3975	2.7600	overt	49.4100	59277	彼女たちが何を言おうと構わない
52.8175	3.5400	overt	52.8300	63381	私が彼女たちの声を聞くことができるなら
56.9275	3.4500	overt	56.9400	68313	私の悲しみは沈められるのだが
60.9175	2.3400	overt	60.9300	73101	特にデルフィーヌだが
63.8575	1.6200	overt	63.8700	76629	彼女たちに言ってくれ
66.2875	2.2500	overt	66.3000	79545	彼女たちがそこにやってきたら
69.1675	4.1400	overt	69.1800	83001	これまでのように私を冷たい目で見ないでくれってな
74.1775	2.1600	overt	74.1900	89013	優しいルージェイノさん
77.0875	1.7400	overt	77.1000	92505	あなたにはまだ分かるまい
79.8175	6.5400	overt	79.8300	95781	鐘に見えたものが突然鈍い色の鉛に変わってしまうのがどういうことなのか
87.1375	6.1800	overt	87.1500	104565	私を見ても娘たちがもう目を輝かせることがなくなったその日から
93.9775	5.3700	overt	93.9900	112773	私のここでの生活はずっと冬のように凍りついたままだ
100.2175	5.6400	overt	100.2300	120261	そして私にはもう悲しみ以外に食べるものもなくなってしまった
106.6375	2.1600	overt	106.6500	127965	そしてそれを食っていたんだ
109.6975	4.7700	overt	109.7100	131637	私は実際に詐欺すまで恥ずかしめられた
115.6975	3.1500	overt	115.7100	138837	私は彼女たちをとても愛している
119.6575	3.4200	overt	119.6700	143589	だから私は全ての侮辱を飲み込んだ
123.8875	6.3300	overt	123.9000	148665	その代わりに彼女たちは私に哀れなちいちゃな快楽
130.7875	3.4200	overt	130.8000	156945	はずべきものだがそれを売ってくれてたんだ
135.0775	4.7700	overt	135.0900	162093	自分の娘たちに会うために父親がこそこそ隠れるんだよ
140.6575	3.6000	overt	140.6700	168789	私は彼女たちに私の人生をやった
145.2775	5.3100	overt	145.2900	174333	彼女たちは今日私のためにイチ時間すら裂いてはくれないだろう
151.5775	2.3700	overt	151.5900	181893	喉が渇いて腹が減った
154.6975	1.5600	overt	154.7100	185637	胸は焼けるようだ
157.6975	5.4900	overt	157.7100	189237	彼女たちが私の激痛を和らげるために来てくれることはないだろう
163.8475	1.1100	overt	163.8600	196617	私は死ぬんだ
165.7075	2.1900	overt	165.7200	198849	だから私にはそれが分かる
168.7075	3.4200	overt	168.7200	202449	だが彼女たちには自分たちの父の
172.7875	5.1900	overt	172.8000	207345	違いを踏んづけることがどんなことかということすら分かっていない
179.0275	2.5800	overt	179.0400	214833	天に増します神は私たち
182.2075	4.0500	overt	182.2200	218649	私たち父親の意に反して私たちを罰する
187.0975	2.1300	overt	187.1100	224517	彼女たちは来る
189.8575	1.6500	overt	189.8700	227829	おいで私の嬢ちゃん
192.1375	2.1000	overt	192.1500	230565	また私にキスしておくれ
194.8675	1.7100	overt	194.8800	233841	これが最後のキスだよ
197.1775	2.7000	overt	197.1900	236613	お前たちのお父さんへのロギンだよ
200.7475	3.2700	overt	200.7600	240897	お父さんはお前たちのために神に祈ろう
204.7975	3.8700	overt	204.8100	245757	神にお前たちは良い娘たちだったと伝えよう
209.5675	3.0000	overt	209.5800	251481	お父さんはお前たちのことを擁護するよ
213.4075	2.5500	overt	213.4200	256089	要するにお前たちに罪はない
216.7075	1.6500	overt	216.7200	260049	彼女たちに罪はない
220.5475	2.2800	overt	220.5600	264657	みんなにそう言ってやってください
223.5475	2.6400	overt	223.5600	268257	そしたら私のことで世間が
226.7575	2.7600	overt	226.7700	272109	彼女たちにとやかく言われないでしょう
230.4175	1.9200	overt	230.4300	276501	みんな私が悪いんです
233.1175	5.0400	overt	233.1300	279741	私が彼女たちに足で踏んづけられても放っておいたんです
238.8775	2.7000	overt	238.8900	286653	私はそれを好んでさえいました
243.8575	1.0200	overt	243.8700	292629	この私は
246.5575	3.9900	overt	246.5700	295869	あれで誰に同行ということはないんです
251.5975	4.0800	overt	251.6100	301917	この世でもあの世でも裁かれるようなことじゃないんです
256.4575	5.8200	overt	256.4700	307749	もし神が私のことで娘たちを有罪にするなら神は正しくない
263.0275	3.1800	overt	263.0400	315633	私は自分を処すすべを知らなかった
267.1375	3.9600	overt	267.1500	320565	私は自分の権利を放棄するような爆をやらかした
271.9375	4.1400	overt	271.9500	326325	私は彼女たちに値しなくなってしまった
276.7375	1.1400	overt	276.7500	332085	仕方がないんだ
278.8675	3.8700	overt	278.8800	334641	どんなに美しい気象で最良の魂であっても
283.4275	5.6100	overt	283.4400	340113	この父親の安一という堕落の前には抵抗できなかったんだ
289.9075	2.0700	overt	289.9200	347889	私は惨めな人間だ
292.6975	2.9100	overt	292.7100	351237	私は罰を受けて当然なんだ
296.4775	4.5000	overt	296.4900	355773	この私が一人で娘たちをかき乱す原因を作った
301.8175	2.4900	overt	301.8300	362181	私が彼女たちを甘やかした
305.3275	3.0600	overt	305.3400	366393	彼女たちは今日も快楽を求めている
309.2575	4.5600	overt	309.2700	371109	かつて彼女たちがボンボンを欲しがっていたのと変わらない
314.9875	6.9000	overt	315.0000	377985	私はいつも彼女たちが若い娘らしい夢を満足させることを許してきた
322.8775	1.4400	overt	322.8900	387453	ジューゴ歳の時には
326.6275	1.4100	overt	326.6400	391953	場所を持った
329.2675	3.1200	overt	329.2800	395121	彼女らに文句を言う者はいなかった
333.2575	2.5800	overt	333.2700	399909	この私にひたすら責任がある
336.6175	2.1300	overt	336.6300	403941	だが愛ゆえの責任だ
339.7975	3.9900	overt	339.8100	407757	彼女たちの声を聞くと私は心を開いてしまう
344.5975	2.7900	overt	344.6100	413517	私に彼女たちの声が聞こえる
347.9575	2.2800	overt	347.9700	417549	そして彼女たちが来る
350.8375	1.1400	overt	350.8500	421005	おおそうだ
352.8175	1.5300	overt	352.8300	423381	彼女たちは来るだろう
355.2475	7.0800	overt	355.2600	426297	法は誰もが死にゆく父親を見送るためにやってくることが望ましいと言っている
363.1375	2.5200	overt	363.1500	435765	私の言うことは法にかなっているんだ
366.5575	3.9900	overt	366.5700	439869	それにそんなのは一走りするだけのことじゃないか
371.2975	2.7000	overt	371.3100	445557	なんなら家賃を払ったっていいんだ
374.6575	1.9500	overt	374.6700	449589	一筆書いてやってください
377.4475	4.5300	overt	377.4600	452937	私には彼女たちに残す何百万かがあると
384.2575	4.4100	overt	384.2700	461109	私はイタリアからオデッサにパスタを動かすつもりだ
389.7175	3.2700	overt	389.7300	467661	私はそのやりかせに関しては知識がある
393.7375	3.5700	overt	393.7500	472485	私の計画ならヒャク万単位の稼ぎができる
398.1775	2.4600	overt	398.1900	477813	誰もまだ思いついてない計画だ
401.5975	5.7900	overt	401.6100	481917	あれは小麦や小麦粉のように輸送中に痛む心配が全くないんだ
408.1675	3.9600	overt	408.1800	489801	えっとえっとでんぷんだったから
412.9975	2.0400	overt	413.0100	495597	それで持ってヒャク万になるぞ
415.8475	3.0300	overt	415.8600	499017	あなたに嘘を言わすわけじゃないが
420.0475	2.5800	overt	420.0600	504057	彼女たちにヒャク万フランと言ってやれ
423.3475	4.5600	overt	423.3600	508017	そしたら彼女たちはよくに駆られてあっという間にやってくるさ
428.8975	2.9400	overt	428.9100	514677	私はむしろだまされた方が嬉しいよ
432.7975	2.2200	overt	432.8100	519357	私は彼女たちに会いたい
435.6175	2.3700	overt	435.6300	522741	私は娘たちが欲しい
438.8275	1.5900	overt	438.8400	526593	私の娘だったんだ
441.4075	1.9200	overt	441.4200	529689	彼女たちは私のものだ
444.4375	3.0000	overt	444.4500	533325	彼は起き上がって座り直しながら言った
448.3675	9.8700	overt	448.3800	538041	ウージェーヌには彼の頭の白髪が三腹になっているのが見えそこにありとあらゆる心配事が救っているように思われた
