onset	duration	trial_type	wav_onset	sample	value
4184.0833	8.3400	overt	4184.1600	5020900	現場で私を事情聴取したのはこのニ人男も若いが年齢はサンジュー程度ではあるだろう女はもっと若い
4198.9633	7.2900	overt	4199.0400	5038756	しかしどうやら女の方が警察内での役職は上のようで捜査本部でも指示を出す側のようだ
4209.8233	8.6700	overt	4209.9000	5051788	詳しい条件は書面にまとめてきましたあなたの能力制限については同島刑事と約束をしたようにアンプルを
4219.3633	3.9900	overt	4219.4400	5063236	その契約まで知っていたのかと若干意外に思った
4224.3733	9.3000	overt	4224.4500	5069248	道島は私に内密の契約だと言っていたが上にも報告していたということか家を引き受けるそれならサインよ
4237.0633	8.0700	overt	4237.1400	5084476	女は言いながらさっと一枚の紙とペンを取り出すこちらが契約書で条件について書かれています
4246.4833	12.8700	overt	4246.5600	5095780	今回の契約はあくまでも特例でその内容については決して公害してはいけませんこの項に対象となる事項と守られなかった場合のペナルティについてここに書けばいいのかい
4259.3533	12.8700	overt	4259.4300	5111224	私は指を差しながら説明しようとする女の言葉を遮ってそれらしい場所にサインをする結構です女は不況をあらわにして
4274.0533	1.8300	overt	4274.1300	5128864	その紙をしまう
4295.9533	6.7200	overt	4296.0300	5155144	よし早速だが中和剤のアンプルをもらおう能力がなくちゃ何も始まらない
4303.1833	5.1900	overt	4303.2600	5163820	使用する都度渡しますそこは堂島刑事の時とは
4309.0933	6.3300	overt	4309.1700	5170912	やり方を変えていただきます待ってくれよ一緒に操作をするつもりかいそのつもりですが
4316.6533	4.5900	overt	4316.7300	5179984	揺らないよ一人で十分だ中和剤と情報だけくれればいい
4321.8733	4.0200	overt	4321.9500	5186248	君たちはニ人ともノーマルだろはっきり言って足でまといだ
4326.7333	5.1300	overt	4326.8100	5192080	そうはいきません堂島刑事のような規約違反は行いませんから
4332.3733	15.3300	overt	4332.4500	5198848	女は厳しく言い放つ取り尽くしまう内容だやたらと高圧的な女だ私はその態度を苦々しく思いながらそれじゃあんたが今から私のパートナーってわけだ
4352.7733	1.9800	overt	4352.8500	5223328	三島
4417.5133	11.6400	overt	4417.5900	5301016	はい三好といいますこちらは部下の加藤です女に紹介されて男は頭を下げるずいぶん若いでいくつ台何年この仕事をしているプライベートに関する質問にはお答えできません
4429.1533	11.6400	overt	4429.2300	5314984	私は肩をすくめ私はただ新しい担当者がどういうやつなのか知りたくなっただけさ私の年齢を知る必要はないでしょうそうか
4444.4233	11.1900	overt	4444.5000	5333308	私の相手はどうにも危険なサイキックだ何かの弾み出てくわしたらギリギリのやり取りをしなくちゃならんそんな時そんな時隣にいるやつがたとや
4455.6133	11.1900	overt	4455.6900	5346736	例えば何の役にも立たないど素人だとしたら命がいくつあっても足りないねまあ私も旦那がやられた時は指を加えてみているだけだったが
4468.2133	17.5200	overt	4468.2900	5361856	よしはよしは黙っているあんたはここで待っている薬を全部私に渡してさっさと帰った方が身のためだと思うがね彼女は黙ったまま深いげに目毛にしわを寄せるその若さでそんな偉そうにしてるってことは
4487.4733	2.2200	overt	4487.5500	5384968	普通のおまわりさんじゃなさそうだな
4492.4833	4.0800	overt	4492.5600	5390980	イチ年目かニ年目の新米のキャリア様といったところか
4499.4133	2.8500	overt	4499.4900	5399296	よしは答えない図押しだろう
4503.6433	16.9200	overt	4503.7200	5404372	そのお嬢ちゃんがなんでこんな危険な場所に出てきたんだい普通は個別の捜査に参加なんかしないはずだぜ空調の効いた建物でデスクに座っていれば何もしなくたって自動的に出生できるんだろう
4521.7633	3.1500	overt	4521.8400	5426116	お答えする必要はありません
4525.9333	8.5800	overt	4526.0100	5431120	まあいい最近の警察はいかげんだからいろいろあるんだろうただ私は警告をしたからな後でどうなっても苦情は受け付けないぞ
4553.9833	19.0800	overt	4554.0600	5464780	三好は若干戸惑いを浮かべたが言葉は何も口にしなかったそうだもう一つ確認しておきたいんだが今回犯人をその場で殺してもいいんだろう郎島の旦那は状況によっては殺すつもりでいたがあんたらもそうだよなそれは
4573.6933	4.5000	overt	4573.7700	5488432	答えにくいかね言いたくないことか言えないことなのか
4580.9233	7.4700	overt	4581.0000	5497108	確かに捜査協力を依頼しましたがあなたには我々と同等の権利があるわけではないのを忘れにならないよう
4594.2433	5.4300	overt	4594.3200	5513092	分かってるよじゃあ早速イチ本中和剤をもらおうか
4602.0433	10.6800	overt	4602.1200	5522452	そしたらすぐに総裁出かけよう細かい話を歩きながらにする私はいても立ってもいられない気持ちを抑えてずっと中和剤が来るのを待っていたんだよ
4614.3433	1.7100	overt	4614.4200	5537212	私はそう言って
4617.8833	5.1600	overt	4617.9600	5541460	身を絞ね手を差し出したどこへ向かっているのですカツカツと
4624.0333	11.5800	overt	4624.1100	5548840	靴音を鳴らして歩く私に追いすがるようにしながら三好は尋ねるヘドロ団地だよ答える私の体には力がみなぎっていた
4636.8133	16.0800	overt	4636.8900	5564176	食べていないので栄養不足のはずだがしかし中和剤を手にしただけで記録が充実してくるのだハイガミ姉妹の住んでいるそうだよ共犯者の住まいだからね君らだってもう調べただろう
4655.2333	19.2600	overt	4655.3100	5586280	我々は古市そのものの調査区を中心で行っていますあの団地も捜査対象として予定されていますがまだ準備を行っている段階でなんだまだ言ってないのか三好は黙ってしまった
4676.6533	11.6400	overt	4676.7300	5611984	江戸の団地はワイ地区ではいくつか存在する危険な地域の一つであると言われているがこと警察にとっては間違いなく最も危険な場所である
4689.4933	9.8400	overt	4689.5700	5627392	ここに調査のために足を踏み入れた警察官が何人も行方不明になっているという岩つきの場所だ死体さえ見つからない
4701.2233	14.8200	overt	4701.3000	5641468	そして行方不明にならずとも住民は著しく非協力的で全く何の収穫も得られないのがほとんどだだから一般の警察はあまり捜査を必要
4717.3633	6.4200	overt	4717.4400	5660836	あまり操作をしないのだと堂島は言っていた
4724.3533	4.8300	overt	4724.4300	5669224	もちろん堂島は必要とあれば足を踏み入れ収穫を終えていたが
4730.9533	5.0400	overt	4731.0300	5677144	リーダーの深澤に交渉しようとしているのですが接触が取れません
4736.8033	14.4700	overt	4736.8800	5684164	かといって強硬操作となると反発が予想されるので大掛かりな装備などが必要になってきますししかしその割にY地区から外へ出る全ての道路には人員とカメラを配置して
4751.2733	14.4700	overt	4751.3500	5701528	外部への逃亡を監視していますそれは懸命だキミラのような連中が手を出しても得られるものは何もないキミラの上司はよく分かっているキミラの最も重要な仕事は犯人を使っている
4765.7433	14.4700	overt	4765.8200	5718892	わいちくの外に犯罪を持ち出させないことだそこに最大の人数を削るという判断は全く正しいよ
4786.2733	3.7800	overt	4786.3500	5743528	私は皮肉まじりにそういった情けないことです
4791.1033	5.6700	overt	4791.1800	5749324	このような我々の影響力が及ばない場所が存続ししかも放置されているだなんて
4798.2133	14.4600	overt	4798.2900	5757856	名義は怒りをあらわにしてうつむく仕方がないね今のあんたらにはそこまで力はないそれにあんたらの上司にはあいつらを潰したくない理由もあるだろうしな
4814.8633	10.0500	overt	4814.9400	5777836	江戸路団地の練習はあちこちに賄賂をばらまいている今や昔ほど健全な組織ではなくなった警察にも
4827.8533	11.1600	overt	4827.9300	5793424	そうでなければ復讐心の強い警察がいくら危険だとはいえこうも放置し続けるはずがない
4867.1533	6.5700	overt	4867.2300	5840584	その言葉には三好は何も答えない彼女も知ってはいるのだろう
4875.8233	10.9500	overt	4875.9000	5850988	あんた個人がいくら投げたって仕方ないさヘドロ団地とボーダーエリアは警察どころか町のギャングたちだって簡単には手を出せない特別な地域だ
4887.7333	10.5300	overt	4887.8100	5865280	路地さんは団地の人々とも交流があるのですか交流ってほどじゃないが昔に多少世話をしたりされたりはしている
4899.0733	2.7000	overt	4899.1500	5878888	探偵をなさっていた頃の話ですね
4902.6733	15.0000	overt	4902.7500	5883208	三好はそこまで知っているのかそれならまずリーダーの福澤に連絡をして捜査をする旨を伝えて交渉してみるのはどうでしょうおじさんが前もって寝回しをしておけば
4926.9733	16.6200	overt	4927.0500	5912368	いやあの親父を相手にそんなことしたって意味ないさどうぞどうぞと許可をしておいて入って行ったら待ち伏せされて行方不明にされちましてはましてや今回はあいつが可愛がってる双子の調査だからな
4944.4033	5.2500	overt	4944.4800	5933284	君らが深澤と接触しなかったのはかえってラッキーだよ
4951.3933	5.6100	overt	4951.4700	5941672	それじゃたとえあなたでも足を踏み入れること自体が危険なのでは
4958.1133	18.3600	overt	4958.1900	5949736	なに深澤本人やその古文に鉢合わせしなきゃ平気さ一応やつを名手にしているが別に団地全体が一致団結した一つの組織ってわけじゃないいろんなやつがいる福沢を嫌っているやつもね
4976.4733	18.3600	overt	4976.5500	5971768	今日人数でさっと入ってさっと調べればいいのさ私ならどんな場所でも極めてスマートに出入りできるそうですかだから本当なら本当なら一人の方が楽なんだ君らがいるとどうしても目立つまだ遅くないぞ薬を置いて帰ってくれないかそれはできませんあなたの感謝
4994.8333	18.3600	overt	4994.9100	5993800	ほら最低限の仕事はしてもらわないとな木村はちゃんとタイプAの対策をしてもらわないとな木村はちゃんとタイプAの対策をしているかほら旦那が持っていたあのサイキック殺しの銃だとか
5013.1933	18.3600	overt	5013.2700	6015832	何発一発かええ三好はうなずく全くなんてケチケチしているんだろうお嬢さん知ってるかいどこの国でもタイプA能力をよく出世する装置や薬剤の取り扱いが極めて慎重なのは
5032.0933	10.4700	overt	5032.1700	6038512	セープにタイプAのお偉いさんがいるからなんだってそれが一般に流出してその辺にあふれるようになってタイプAが無力化されたら
5043.8533	6.5100	overt	5043.9300	6052624	タイプBみたいに非差別的な立場に陥る可能性があるからね
5052.5833	1.9800	overt	5052.6600	6063100	それに怯えているんだと
5064.7633	6.2700	overt	5064.8400	6077716	それはただの噂ですそうかねでも治安を考えるなら自重に薬を
5075.7433	16.1400	overt	5075.8200	6090892	フンムして全部のサイキックの力を消してしまえばいいと思うよどんな能力のやつが何をしでかすかなんてわからないんだからさサイキックの私が言うんだから間違いないサイキックは現代社会の外役だ
5107.2733	1.1400	overt	5107.3500	6128728	ふむ
5110.6933	19.8600	overt	5110.7700	6132832	おっしゃるとおりタイプAは社会の秩序を乱す存在ですがだからといって乱れに能力が制限されていいわけではありません権利がありますからお堅いね私は肩をすくめ道具があるならいつでも取り出せるように準備しておくんだこの状況で早上がりたちが
5133.1333	13.2300	overt	5133.2100	6159760	のんきに自宅周辺をうろうろしているとも思えないが可能性がゼロとは言えない見かけたら即座に打て相手が子供だからって躊躇するな交渉なんて初めから選択肢に入れるな死にたい
5146.3633	13.2300	overt	5146.4400	6175636	私が言うと三好はその場に足を止める顔が蒼白になっている大丈夫かい振り返って私はそう尋ねる何でもありません
5167.8433	14.7000	overt	5167.9200	6201412	そんなんじゃ困るぜ新米だって現場に来る以上は銃の打ち方くらい習ってるんだろうそれもできないなら本当に何も役に立たないやっぱり帰った方がいいんじゃないか
5182.5433	14.7000	overt	5182.6200	6219052	妙子はきっと強気の表情を見せてそれはあまりにも失礼ですとんでもないこれは優しさだよ契約を結んだ以上我々はビジネスパートナーなんですよ信頼してもらわなければ困ります
5197.2433	14.7000	overt	5197.3200	6236692	ビジネスパートナーただの影焼け道具だろ違いますそうだろうじさんヘゾロ団地へ向かう前に我々はある程度情報を共有すべきですよね私の個人情報以外のそして端末を取り出すと
