onset	duration	trial_type	wav_onset	sample	value
2156.9533	2.2200	overt	2157.0300	2588344	空に浮かせることになる
2160.7033	12.5100	overt	2160.7800	2592844	しかしニ発の銃弾を体に受けたのは相当の痛手だったらしく第ニの射撃者の首なしの遺体のそばで小さく
2177.3233	7.5600	overt	2177.4000	2612788	うずくまってしまったことで第三の射撃車の車線から外れてしまったのかもしれない
2188.3033	9.6600	overt	2188.3800	2625964	あるいは資格を保ちながら撃つのに良い場所が見つからなかったために最初からそういう手はずで考えていたのか
2201.0833	6.2700	overt	2201.1600	2641300	とにかくサン人目は自らカーテンの裏から飛び出して症状射撃したのだ
2210.8633	6.7500	overt	2210.9400	2653036	これが最初から予定の行動でその通り実行しているのだとしたらなかなか勇気のある行動だ
2218.4833	3.6000	overt	2218.5600	2662180	いや正直言ってここまでの戦闘の中でも
2222.8033	3.9900	overt	2222.8800	2667364	すでに僕の想像を上回る勇敢さを見せているあ
2227.3633	7.9200	overt	2227.4400	2672836	と僕が思わず声を上げたのは同時にもう一人ソファの裏から飛び出してしまったのだダメだいけない
2236.7533	1.8000	overt	2236.8300	2684104	思わず言葉が漏れる
2245.0033	12.8700	overt	2245.0800	2694004	ニ人同時に攻撃すればなんとかなるという相手でもないそれより一人ずつでも物陰から一方的に射撃をしていった方が確実だ
2258.3833	10.3650	overt	2258.4600	2710060	こんなふうに飛び出してはいけない仲間が一人ずつやられていくのに焦りを感じたのかもしれない
2268.7483	10.3650	overt	2268.8250	2722498	最後の一人は現れたそう思ったその直後に僕が危惧していた光景が画面の上に展開される
2299.0333	6.5100	overt	2299.1100	2758840	姿を現したニ人はほとんど同時に少女の移動によって切断された
2306.6833	8.2200	overt	2306.7600	2768020	そして少少女の姿も消え画面の中に映ったのは盛大にぶちまけられたヨン人分の死体であった
2316.9433	4.7700	overt	2317.0200	2780332	銃弾や少女の移動攻撃によって破損した家具と
2322.3433	3.9000	overt	2322.4200	2786812	人の手足や内臓が交じれ合うように
2326.7833	3.3900	overt	2326.8600	2792140	床の上にばらまかれている
2331.2533	8.4300	overt	2331.3300	2797504	見ているだけで生臭い血の匂いがしそうだどこへ行った僕は天命に聞く
2341.1833	5.1000	overt	2341.2600	2809420	西へジューメートル程度移動しそこでじっとしています
2347.2433	3.0000	overt	2347.3200	2816692	彼女は悲痛そうな顔でそう言った
2352.1633	1.4100	overt	2352.2400	2822596	休憩室ね
2354.7133	7.6800	overt	2354.7900	2825656	佐伯が言う通りおそらく相手がいるのはロンタウのためのベッドがなどが置かれた部屋だろう
2372.5633	13.6200	overt	2372.6400	2847076	ジェフリー君たちはそこに隠れたまま待機我々はこのままビルを離脱する相手も負傷しているからおそらくすぐに退散するだろう隠れていれば見つからないはずだ
2386.1833	13.6200	overt	2386.2600	2863420	だが相手の奇襲も失敗と言えるだろう今回は痛み分けで手を打とうじゃないかこちらの会話が聞こえているはずのジェフリーにそう呼びかける
2401.0633	9.2100	overt	2401.1400	2881276	いえ我々はこれから攻撃に向かいますこのグランドタワーを襲撃してしたものを生きて返すわけにはいけません
2411.6833	2.7600	overt	2411.7600	2894020	塗りをするな君たちはよくやった
2415.9733	9.0300	overt	2416.0500	2899168	チェフリーが言うとおり皆勇敢だった胸を張って帰ってきてくれそうはいきませんダメだ帰ってくるんだ僕は怒鳴った
2425.7533	13.3650	overt	2425.8300	2910904	ここで不可を意するのは愚かな考えだぞ相手は負傷していますそして居場所も分かっているこの状況で怯えて隠れていろとそうだくだらないメンツなんか犬にでも食わせておけばいい
2439.1183	13.3650	overt	2439.1950	2926942	これはメンツではないですよ必要な仕事がまだ残っているというだけです休憩室ですね相手が移動したらまた連絡してください
2453.1733	6.3900	overt	2453.2500	2943808	それから先は僕が何を呼びかけてもジェフリーは返事をしなかった
2460.0733	3.5100	overt	2460.1500	2952088	父たちも移動を始めました
2468.8033	5.5500	overt	2468.8800	2962564	天命が老媒を押し殺しながらそう報告するそうか
2476.1533	18.3300	overt	2476.2300	2971384	僕は言って端末をポケットに入れたジェフリーは自分の部下を死に追いやった以上たとえ自殺行為でも自分が責任を取らなければならないと考えたのだろうかそれとも本当に称賛があるのか僕にはちょっと分からない
2497.3933	19.8300	overt	2497.4700	2996872	我々は移動速度を上げる皆足元には気をつけながら急いでくれ僕たちはガタガタと足音を立てながら階段を降り進める天命は築市最上階の生命の位置や数の変化を報告しそして僕らがサン階にたどり着いたあたりで
2518.5133	9.6900	overt	2518.5900	3022216	最上階に置いてきた全ての仲間が死にたい少女だけが残ったことを上ずった声で耳打ちしたご苦労さま
2622.6133	2.5500	overt	2622.6900	3147136	僕が天命をねぎらうと
2627.3233	17.5400	overt	2627.4000	3152788	アロンロンタウが不安げに僕を見る僕は彼ねえうなずきを返そうか刺してした唇を噛んだ一体何があったんですか声をかけたのはレイレーだったその向こうにはジェフリーの妻がいてこちらをじっと見ている
2644.8633	17.5400	overt	2644.9400	3173836	後で説明する今は先を急ぐんだ口ごもるロンタウの代わりに僕が答えたジェフリーの妻は何も言わない彼女にも他の家族同様何も説明していないが僕らの態度で全てを察したのだろう
2662.4033	17.5400	overt	2662.4800	3194884	目が合うと顔をこわばらせるロンタウ僕は足を止めてうつむく彼に声をかけると顔を上げるあなたはみんなを連れてビルの外まで逃してください僕らは少し引き返してジューゴ回で迎え撃ちます
2681.2033	2.6100	overt	2681.2800	3217444	しかし今ジェフリーはそのやり方で
2698.5733	4.0500	overt	2698.6500	3238288	彼は冷静じゃなかった僕はもう少しうまくやります
2703.6733	12.4800	overt	2703.7500	3244408	アーロンさっきも言ったようにお前を危険にさらすわけには今はそんな状況ではありませんジェフリーが言ったように相手が消耗している以上今がチャンスなのは確かです
2718.7933	6.4200	overt	2718.8700	3262552	僕の言葉に論太はうんとうなずこうとしないただ苦い顔で僕を見つめている
2726.4133	14.4900	overt	2726.4900	3271696	ジェフリーがいなくなった以上僕が唯一の補佐役のはずです僕の意見に従ってくださいレイレイロンタウを頼むよシブルロンタウに家族とともに下に行かせ僕は再起と
2742.5233	6.9600	overt	2742.6000	3291028	子姉妹そしてサン人の部下を借り降りてきた階段を登り始めた
2750.6833	2.1900	overt	2750.7600	3300820	大丈夫向きになってない
2754.0433	3.1800	overt	2754.1200	3304852	隣を行くさい木が不安げに尋ねる
2758.2733	1.9500	overt	2758.3500	3309928	僕は至って冷静だよ
2761.0633	1.9800	overt	2761.1400	3313276	自分でも恐ろしいほどだ
2764.5433	11.9850	overt	2764.6200	3317452	僕は自分の銃に弾丸が装填されているのを確認しながら答えるあの当たり方すると手当てをしない限り相手は出血でしょう
2776.5283	11.9850	overt	2776.6050	3331834	し続けるはずだジェフリーたちのやり方は無謀だったがそれを処理するのに相手もだいぶ能力を使った
2794.8733	5.5500	overt	2794.9500	3353848	相手はどこかに逃げて治療を受けることを優先するだろうそこを不一致する
2802.2833	4.5900	overt	2802.3600	3362740	相手は思考能力や重力も落ちているだろうしね
2807.9233	7.7100	overt	2808.0000	3369508	観察して想定よりも消耗がないようなら接触を避けて撤退するそれならいいけどでも
2817.0733	3.2100	overt	2817.1500	3380488	佐伯が言いかけたのを店名が遮る
2822.2033	3.3000	overt	2822.2800	3386644	シャーレオス様相手が移動を開始しました
2840.3833	18.9900	overt	2840.4600	3408460	冷静ではないのはむしろこの子姉妹だろう父が死んだショックでニ人ともその顔を青ざめさせてはいるが復讐の念は強いのかきっと違う感情のこもった声でそう伝える北の方へゆっくり動してあ
2862.0133	2.1600	overt	2862.0900	3434416	どうした見失いました
2869.0633	14.2500	overt	2869.1400	3442876	ビルの外に瞬間移動したんですそれでそのまま連続して瞬間移動しあるよあるよと地上までたどり着いてそのまま人ごみの中へそこで見失いましたすみません
2886.0433	2.7300	overt	2886.1200	3463252	連盟は悔しげにした唇を噛む
2889.5833	8.5800	overt	2889.6600	3467500	彼女の方は震えているもし彼女に普通の人間のように目があったら涙をこぼしていたかもしれない
2901.6133	2.3100	overt	2901.6900	3481936	君が謝る必要はないよ
2906.0233	2.1600	overt	2906.1000	3487228	僕はため息をつき
2908.6933	6.2700	overt	2908.7700	3490432	彼女を登る階段を上る足を止める一度もそれに習う
2918.3233	4.2300	overt	2918.4000	3501988	そうだ相手は瞬間移動を連続して使うことができるのだ
2923.0933	4.3200	overt	2923.1700	3507712	わざわざビルの中を伝って降りる必要などない
2932.3033	10.0500	overt	2932.3800	3518764	なぜ襲う時は同じように空中を連続移動して最上階直接最上階を狙わなかったのかどうしてわざわざ正面から攻撃して
2942.3533	10.0500	overt	2942.4300	3530824	ビル全体を制圧しようとしたのか考えようとしたが急に毛の抜けたような感じになってしまってうまく考えられない
2955.1333	3.0600	overt	2955.2100	3546160	とにかく僕は相手を逃がしてしまったのだ
2959.8733	3.9900	overt	2959.9500	3551848	部下たちを好き放題殺しジェフリーを殺した相手を
2964.5233	9.4200	overt	2964.6000	3557428	僕は階段の段の上に腰を下ろす大丈夫佐伯がそう声をかける大丈夫だよもちろん
2975.2033	7.1400	overt	2975.2800	3570244	大丈夫だよもちろん僕はため息をつきただ悪いんだけどほんの少しだけ休ませてくれないか
2982.9433	1.9800	overt	2983.0200	3579532	なんだかひどく疲れたんだ
2988.0133	10.1550	overt	2988.0900	3585616	ビルから退避した全てのものに襲撃者が去ったことを伝え僕は佐伯やロンタウとともに戦場となった西条
2998.1683	10.1550	overt	2998.2450	3597802	室務室は映像で見た通りの血の海が広がりそして隣の休憩室も同様だった
3040.4533	3.4200	overt	3040.5300	3648544	壁には銃弾によって
3044.5633	7.0200	overt	3044.6400	3653476	打たれた穴がいくつかあり最近は無言でそれに指先で触れていた
3052.6933	4.9800	overt	3052.7700	3663232	休憩室に転がる遺体も瞬間移動によって切断されている
3091.3033	8.2800	overt	3091.3800	3709564	ジェフリーは頭のてっぺんから右脇の下にかけて団員を描くような形で切断されていた
3101.4733	15.7500	overt	3101.5500	3721768	彼の握る銃の弾丸はニ発使われていた他の遺体が持つ銃もイチニ発は消費されているのを見ると一方的に返り討ちにされたのではなくそれなりに戦闘の形を取ることはできたようだ
3120.3133	5.1600	overt	3120.3900	3744376	父の遺体に直面した子姉は両手の手
3129.0133	1.6800	overt	3129.0900	3754816	両手のひらで
3202.5733	11.1300	overt	3202.6500	3843088	手のひらで顔を追った目などないはずだが匂いや雰囲気が生々しく状況を伝えたのだろうその方は細かく震えている
3225.0733	3.3300	overt	3225.1500	3870088	やがてロンタウとマーメンが共に到着した
3231.1333	2.8200	overt	3231.2100	3877360	マーメイは顔を真っ赤にして怒ったが
3236.9233	3.8700	overt	3237.0000	3884308	何も言わなかった普段はうるさいほど情絶なくせに
3242.8633	5.3100	overt	3242.9400	3891436	そして黙って僕を見ていた言いたいことがあるのなら言えばいい
3253.6633	7.3800	overt	3253.7400	3904396	エレベーターはすぐには治らないそうだ遺体は全力で下ろして殺し定長に埋葬しよう
3262.9333	5.1900	overt	3263.0100	3915520	ロンタウは沈鬱な表情でそう言ったジェフリーは死にたかったんだろう
3275.0233	1.5000	overt	3275.1000	3930028	僕はそうつぶやく
3279.1933	4.2900	overt	3279.2700	3935032	街中に知れ渡るような手ひどい恥を欠かされたし
3286.7533	5.2200	overt	3286.8300	3944104	この先僕とやっていくのも嫌だっただから戦いに固執したんだ
3293.3833	5.0100	overt	3293.4600	3952060	僕のことが気に食わないから死んだんだよ小貝の部下と
3298.9633	1.2000	overt	3299.0400	3958756	一緒にね
3305.0233	9.7500	overt	3305.1000	3966028	僕の言葉を聞いたロンターは困ったようにマーミンの方を見るマーミンは何も言わない口を一文字に閉ざして
3367.3933	2.6100	overt	3367.4700	4040872	岩尾のように押しだまっている
3372.4633	2.1000	overt	3372.5400	4046956	それを見てため息をつくと
3376.3633	4.0500	overt	3376.4400	4051636	アーロンには次のロンタウンになってもらいたいと言った
3385.0333	7.9500	overt	3385.1100	4062040	私にはこの混乱の中でロンタウを続けていく能力がないウォン君が死んでしまった今となってはなおさらだ
3394.6633	4.0800	overt	3394.7400	4073596	そしてロンタオの証しである酒を取り出す
3400.6333	12.1200	overt	3400.7100	4080760	これを持つのに一番ふさわしいのはアーロンだよ他のものがどう思うと私はそう信じている僕に向かって差し出した近いうちに儀式を行おう
3415.7533	5.1000	overt	3415.8300	4098904	私の時のように盛大な宴を用意することができないのが申し訳ないが
3422.6833	4.2600	overt	3422.7600	4107220	いや儀式なんか何もいらないそういうのは好きじゃないんだ
3429.2533	3.8100	overt	3429.3300	4115104	僕は首を振りその酒酒をその場で受け取った
3455.4133	19.3950	overt	3455.4900	4146496	少しくらい飲んだほうが気持ちが晴れるかもしれないわよカルロッタはそう言って私の前に透明な液体に満ちたグラスを置いた私は無言でそれを見る私からのサービスよほんのちょっぴりアルコールが入ってるわ
3474.8083	19.3950	overt	3474.8850	4169770	腹にはちょうどいいでしょ欲しくないなそんな気になれないのも分かるけれどもうすぐにニ週間じゃない前のようにというのは到底無理にしても少しは元気出さなくっちゃまるで敗人になったみたいよ武将棋だってそんなに伸ばして
3495.5533	3.5700	overt	3495.6300	4194664	私は言われて自分のヒゲに手をやる
3501.7333	14.3100	overt	3501.8100	4202080	自分では以前と変わらず身だしなみを整えるつもりだったが何日か忘れていたのか頬や顎の下にはコケのようにびっしりと固いヘゲが伸びている
3520.3033	3.7500	overt	3520.3800	4224364	大衆だってひどいわよそうかそれはすまなかったな
3528.7633	2.2800	overt	3528.8400	4234516	その腕の骨折は大丈夫
3533.3833	8.2800	overt	3533.4600	4240060	持ってる痛み止めでも出してあげようかギプスで固定して肩から釣っている左腕を見ながらカルロッターは言った
3543.0433	3.9000	overt	3543.1200	4251652	いや必要ないしかし迷惑をかけているようだな
3576.6733	8.1900	overt	3576.7500	4292008	プエルトの店内はそろそろ込み始めていた私は気を使って腰を浮かせかけたが
3586.3333	7.7400	overt	3586.4100	4303600	そういうつもりで言ったんじゃないわよほらそろそろ料理もできるから座ってなさいご飯も全然食べてないでしょう
3594.6733	8.2500	overt	3594.7500	4313608	彼ロッタはそう言うが私は別男食欲というものを感じなかったそもそもこの店に来るつもりなどなかったのだ
3604.8433	11.0400	overt	3604.9200	4325812	カルロッタが家までやってきて無理やり彼女の店の仕入れを手伝わせられそしてそのままこのカウンター席に座らせている
3617.9833	12.3000	overt	3618.0600	4341580	あなたがこんなになってるの初めて見たわ本当に美雪ちゃんのことが好きだったのねカルロッターはカウンターの中で細々と作業しながらそうため息をつくそういうわけじゃないさ
3633.5233	16.8900	overt	3633.6000	4360228	こしちえたちを追い払った後全身から力が抜けて拒絶した私はその血みどろの現場で気絶するようにぐったりぐっすりと眠り込み目が覚めると警察が私の周りを取り囲んでいた
3652.0333	3.4800	overt	3652.1100	4382440	そして現場検証を行う間私は
3657.6133	3.4800	overt	3657.6900	4389136	警察の車両の中で事情聴取を受ける
3663.9733	10.4400	overt	3664.0500	4396768	私を徴収したのはコシチェ捜査本部の刑事達で彼らは堂島と私の協力関係を知っているようだった
3675.1933	9.9300	overt	3675.2700	4410232	彼らは私から詳しく話を聞き出したが私の方からの質問には何も答えてくれなかった
3693.9733	13.0800	overt	3694.0500	4432768	そしてさるぎはまた連絡をするからそれまでは勝手な行動を勝手な動きは慎み動きを慎めぐれぐれも一人で操作を行わないでくれ場合によっては処罰
3707.0533	13.0800	overt	3707.1300	4448464	懸命に首を刺してから立ち去っていった気持ちは分かるけどボーッとしている場合じゃないわよこういう時こそあんたの仕事が忙しくなるんじゃないの
3720.7033	15.6600	overt	3720.7800	4464844	カルロッタは言いながら私の目の前にキノコの入ったお寺屋を置いてくれたレゾットではなく和風のおじ屋だメニューにはないいつだったか私が私の好物だと言ったのを記憶してくれていたのだろうか
3737.8333	2.4000	overt	3737.9100	4485400	何も忙しいことなんかない
3740.9233	5.7600	overt	3741.0000	4489108	私は湯気の立つ王子屋を眺めたままそうつぶやいた
3747.4033	1.2900	overt	3747.4800	4496884	知らないの
3752.4133	14.7300	overt	3752.4900	4502896	今にも街中で派手な構想が起きるんじゃないかってみんな噂しているわよカルロッタの話によるとクレスAなきゃとのYS内で緊張が生まれているらしい後継者として第ニ人ロンタウトの
3767.1433	14.7300	overt	3767.2200	4520572	座に着いたのはクレス製の王子にあたるマイケル杖だったしかしこのニ代目はお飾りのようなもので実際には先代の復讐であるジェフリーオンと
3781.8733	14.7300	overt	3781.9500	4538248	マーミンが執行部として権力を握っているのだそうだ彼らはいずれタイミングを見計らってニ代目を引退させクリスへの実種である車両をサン代目ロンタウに
3797.3533	1.3800	overt	3797.4300	4556824	据えようと
3801.0733	1.8600	overt	3801.1500	4561288	据えようといる
3804.0733	3.9300	overt	3804.1500	4564888	据えようといるのは明白だ
3825.6433	4.6500	overt	3825.7200	4590772	吸えようという吸えている
3837.2233	8.5500	overt	3837.3000	4604668	そうした結束内での権力の独占にYSの他の幹部たちが反発しているらしい
3870.5233	16.0650	overt	3870.6000	4644628	特に乱使命なんかは全然に代名を認める気がないみたいシャー系と両家の間で戦争が始まったらどうなるのかってみんな戦線供給としているわそうかつれないわねあんたが過去
3886.5883	16.0650	overt	3886.6650	4663906	書こうとしている原稿にとって格好のネタじゃないの調べなくていいの興味がないなその調子だとルーケン氏が殺されたのも知らないようねカルロッタはあきれてため息をつくそうか
3904.1533	13.4700	overt	3904.2300	4684984	誰がやったと思う占命じゃないわよ例のお坊ちゃんシャーローがやったって話よ流は香港派のはずなのに香港派の御曹主に娘もろとも殺されたのよ
3919.3033	5.2500	overt	3919.3800	4703164	カルロッタは大げさなそぶりで説明をするが私は興味を持ってなかった
3925.9633	4.7100	overt	3926.0400	4711156	新しい執行部は随分と過激な連中らしいわ
3932.4133	10.5600	overt	3932.4900	4718896	やはり興味は持ってなかったがふと古川のことを思い出した私にとって重要な情報源であるそのジャンキー女は
3943.7533	3.5400	overt	3943.8300	4732504	他ならぬその竜原子の情報である
3955.7233	2.6700	overt	3955.8000	4746868	パトロンがそんな死に方をしたと
3959.8333	2.7600	overt	3959.9100	4751800	なればさずかしこまってることだろう
3963.3133	3.9900	overt	3963.3900	4755976	多少の愛情でもあれば悲しみもしているかもしれない
3969.7033	9.1500	overt	3969.7800	4763644	しかしその辺りの関係性は私には伺い知れぬところだ元気があっていいことだ私がそうつぶやいて
3980.7733	10.7400	overt	3980.8500	4776928	おじやにも酒にも手をつけずその脇に置いてあった水の入ったグラスから一口飲むとカルロッタはもう一度ため息をついた
3993.3733	11.1000	overt	3993.4500	4792048	私はゆっくりとグラスの水を飲み続ける店は忙しくなりカルロッタは他の仕事の対応や仕事に追われて話しかけてこなくなった
4009.9333	12.2400	overt	4010.0100	4811920	水がなくなり冷え切ったおじやを申し訳程度の一口だけ食べてみたがまるで高熱が出た時のように舌がバカになっていて何の味も感じ取ることができなかった
4029.7333	5.1900	overt	4029.8100	4835680	代金を払おうともねポケットに手を突っ込んだが財布が見つからない
4035.9733	1.8300	overt	4036.0500	4843168	ツボンにも入っていない
4044.2833	13.6050	overt	4044.3600	4853140	付けにしてもらうか家から取ってくるか太いり口の方を見るとちょうどドアが開いて新たな客が入ってくるこの場に熱かわしくないけっちりとスーツを着こない
4057.8883	13.6050	overt	4057.9650	4869466	私の振る舞いを軽いものを作り直す私の振る舞いを狩った目指と組みていてそう声をかけたいや必要ない私は首を横に振ると
4075.1533	14.3700	overt	4075.2300	4890184	お前は俺がだらだらと家に閉じこもっているのを絶望に打ちひしがれているだけだと思い込んでいるようだがそうじゃない俺は今これまでにないくらいやりたい仕事があるそのために待っていた
4090.7533	9.0600	overt	4090.8300	4908904	そう死者は待っていたんだ俺が自分の力を取り戻すためにねどうやらやっと訪ねてくれたようだ
4106.3233	4.7400	overt	4106.4000	4927588	そう話しながら私は先ほど入店してきた男女を眺めていた
4112.4133	17.4600	overt	4112.4900	4934896	彼らはアルバイトがテーブルに誘導しようとするのを断って店内を見回しているそれに向かって手を挙げて合図をすると人ごみをかけ分けて目の前までやってきた今お時間大丈夫ですか女の方がショートカットの前髪を直しながらそう言った
4133.9233	2.4600	overt	4134.0000	4960708	そろそろ来るんじゃないかと思っていたよ
4140.5533	6.5700	overt	4140.6300	4968664	私はそう答えるそのニ人の顔は知っているニ人とも警察官だ
4147.7833	3.3300	overt	4147.8600	4977340	そしてこうして放送本部に所属している
4152.7933	4.2300	overt	4152.8700	4983352	道島の旦那が死んだ今あんたらだけじゃどうしようもないからね
4162.0333	7.5300	overt	4162.1100	4994440	私は苦笑する私としては単に思った通りに物事が運んだことがおかしかったのだが
4170.4633	10.5300	overt	4170.5400	5004556	女は侮辱されたと感じたらしく表情を固くしながら捜査協力をお願いし抜きましたその傍らで男は黙って立っている
