onset	duration	trial_type	wav_onset	sample	value
1753.3442	2.9700	overt	1753.4400	2104013	そんなに切れちゃってそっかもそれじゃなくなっちゃったね
1757.4842	6.7200	overt	1757.5800	2108981	何かぼーっとしてたから今日であんな青春してる日差しの向き合いにもやってる天気の方が悪くなるみたいです
1769.6342	1.2900	overt	1769.7300	2123561	これで寝れたら大変だから
1773.6842	1.5300	overt	1773.7800	2128421	よかったのおかつのジャージョン持ってて
1776.1742	2.3400	overt	1776.2700	2131409	さすがに書かないもん東に寝たらか
1779.7142	3.6300	overt	1779.8100	2135657	誕生日じゃないですか
1784.8142	7.9800	overt	1784.9100	2141777	レーザー用の入れてもらったんでちゃんと露足もあるので誕生日行ったらいいじゃんどん近づいていくのかな感じで大きくんイチ月だけはいイチ月ジューゴで
1793.8442	1.5000	overt	1793.9400	2152613	そういうことないですよ確かに
1802.7542	1.8900	overt	1802.8500	2163305	本当に悪いと思っているんで
1818.9842	6.0000	overt	1819.0800	2182781	誰もいらっしゃるだけで私はみんなもいるし分かったじゃない何も大丈夫じゃない
1829.9642	1.7700	overt	1830.0600	2195957	ちょっと何と落ちようとしてるってそっか
1832.7242	1.2600	overt	1832.8200	2199269	おめでとうございます
1834.6742	3.2400	overt	1834.7700	2201609	上に置いてったの一緒にやろう
1840.0142	1.3200	overt	1840.1100	2208017	誕生日の食われない
1842.1742	1.6500	overt	1842.2700	2210609	はいよい
1846.2242	1.5900	overt	1846.3200	2215469	あと改めて
1873.0742	1.0500	overt	1873.1700	2247689	いい人しかいないよ
1876.6142	3.0600	overt	1876.7100	2251937	みんなで行くって言ったんですけどみんなでごめんなさい
1880.2142	1.2900	overt	1880.3100	2256257	誰もしていいのそうかもしれないけど
1882.6442	1.3800	overt	1882.7400	2259173	じゃあ私もよろしいでしょうか
1884.8942	4.6500	overt	1884.9900	2261873	よくないことを撮っていたんだけどポレッションに気を使って大切必要だと思ってた
1890.6542	1.6500	overt	1890.7500	2268785	だから私もごめんなさい
1892.8442	2.4000	overt	1892.9400	2271413	全然お高い様ですねさあトランプしましょう
1898.4542	2.4300	overt	1898.5500	2278145	何てんだよなかったんだろう
1919.0342	1.2000	overt	1919.1300	2302841	なくなった気がするんだ
1925.7242	2.5800	overt	1925.8200	2310869	では私とこお願いします
1929.8042	4.0200	overt	1929.9000	2315765	ちょうどここです
1936.7642	2.8500	overt	1936.8600	2324117	必要な顔されてないくれないんですけども
1940.8442	4.0200	overt	1940.9400	2329013	その席でも幼虫に寝たりしなさそうですよね
1945.9442	1.9200	overt	1946.0400	2335133	あとはそれですごっとあと
1948.9442	2.3400	overt	1949.0400	2338733	いつごとあってられないというのを越しても
1960.8542	4.5900	overt	1960.9500	2353025	ただネットを後ろに見つめるだけでただいま
1968.1742	2.5500	overt	1968.2700	2361809	まず日本に撮るじゃない飛行機に止めなってきたら
1972.6742	3.6000	overt	1972.7700	2367209	しばらくまずりましょうですけど会いちゃう
1985.0942	2.1900	overt	1985.1900	2382113	分かりだってありがとうございます
1989.1142	1.0500	overt	1989.2100	2386937	これまた忘れんでね
2011.9742	2.7000	overt	2012.0700	2414369	私はそうですけど
2015.5442	3.8100	overt	2015.6400	2418653	私の練習いなかったな先輩私の私の電車に乗り間違えてごらん
2019.9542	1.0500	overt	2020.0500	2423945	ちょっと明日だんだよ
2022.7742	2.8200	overt	2022.8700	2427329	やっぱり距離が変わってるじゃあ明日こそ明日練で
2041.4942	2.6400	overt	2041.5900	2449793	仕方のかと思った
2076.8342	4.8300	overt	2076.9300	2492201	水飲んだら参加してそして俺の役割はこんな後輩の一緒にとことん付き合ってやることだ
2082.8342	9.6600	overt	2082.9300	2499401	山田先輩なんですか
2093.4242	5.9700	overt	2093.5200	2512109	最高の身長だったのでよくしゃれなかったのでしょうがないんでしょうがなくらいになりません
2100.9242	1.8600	overt	2101.0200	2521109	このくらいがちょうどいい
2106.4142	2.1300	overt	2106.5100	2527697	顔が近いけど何の症状か
2111.9342	2.2200	overt	2112.0300	2534321	びっくり大丈夫ですね
2121.2942	5.3700	overt	2121.3900	2545553	家庭園しておいた方がいいかなって気をつかってほしいとか全然今は別のところに住んでるんだ
2127.7742	6.8100	overt	2127.8700	2553329	そうなったんですねおじいちゃんの通りで成功するとですね
2139.0542	3.8700	overt	2139.1500	2566865	幸川高校さんと何陣中してるの
2148.4742	3.7500	overt	2148.5700	2578169	全然入ってるやん今度練習全然ダメ
2153.0042	5.8200	overt	2153.1000	2583605	腕立ちこそで終わったら見に行くそんなアザーズで見えちゃうでも少し押しても仕方の人見たいです
2160.1442	4.7400	overt	2160.2400	2592173	やっと一日も見に行く朝の仲間の石見届けないと
2183.2142	2.8200	overt	2183.3100	2619857	分かってるわけじゃない気持ちを
2203.1642	2.1900	overt	2203.2600	2643797	私の当たりをされていたことになる
2222.6342	4.0200	overt	2222.7300	2667161	負荷や罰金も寄れないので残らないと僕らやな部活も本当にステークだよな
2227.8242	3.7500	overt	2227.9200	2673389	それは私が一人して練習してるからなそれを私が描いてる人だよ
2232.7142	1.1100	overt	2232.8100	2679257	ちょっと行くという真面目なので
2235.7442	4.1400	overt	2235.8400	2682893	したやつがいてそういうのを目標に制徒できないことばかりも自分も褒められなくなったりする
2241.0542	3.6000	overt	2241.1500	2689265	真面目にカダニミクレス以外に水分補給をされてるんだよな
2246.2742	5.1300	overt	2246.3700	2695529	ちゃんと気持ちすると間違えちゃっていただくと簡単簡単足を動かしてるしかないですから
2252.3342	4.7100	overt	2252.4300	2702801	それも先輩でしたらいいからいいんじゃないそれも先輩どうしても勤めで
2258.4542	3.9000	overt	2258.5500	2710145	はいカレクトランかい西部長を書いてしかもあいつかよ
2265.2342	1.0200	overt	2265.3300	2718281	ちょっと見つくれませんやるか
2282.3642	2.1900	overt	2282.4600	2738837	おやすさえて
2296.3142	1.5000	overt	2296.4100	2755577	全員は事実は
2299.6142	5.1000	overt	2299.7100	2759537	水木さんの話体感が勝てられなくていいのにそうじゃなくてもらっていたのが大事もいいよ
2305.8242	3.9600	overt	2305.9200	2766989	担当者の知恵があるからってそれでおかしいあったの
2312.4242	1.3500	overt	2312.5200	2774909	何かとどうするの
2314.3442	3.3300	overt	2314.4400	2777213	男は昔の偉い人が一緒に生まれた
2319.9542	5.4900	overt	2320.0500	2783945	あった人のもまだね私もマシャパイズしてるじゃないけどせめてもっと早く行ってください
2326.3442	2.9700	overt	2326.4400	2791613	一緒に一緒な人と一緒に染まって思ったよね
2330.9342	1.5300	overt	2331.0300	2797121	また一緒やなってうちじゃなかったかな
2351.8142	4.1700	overt	2351.9100	2822177	私の時期みたいになって
2361.3542	2.5800	overt	2361.4500	2833625	何やってないですかもかなり振り回されてるし
2365.1642	1.3200	overt	2365.2600	2838197	生き出してほしくて
2370.1442	1.9200	overt	2370.2400	2844173	ありがとうございます
2377.7942	4.2000	overt	2377.8900	2853353	それでも楽しそうにしていただきたいけど
2385.1442	2.0400	overt	2385.2400	2862173	本当に長い理解も接してもよくないです
2389.1642	6.1200	overt	2389.2600	2866997	毎日時間が言ってたことがかかりしかかってくれてる前にしはそれに最初何てなくていつも言うことなった
2396.1842	3.3300	overt	2396.2800	2875421	本当に毎日のことでその方が来たりとちなきゃ気づらいくいったりして
2400.4142	5.9100	overt	2400.5100	2880497	毎日だけど試合に行ったのに対しても練習してたじゃないかおっしゃってみたんで確かに自分の引退場に行ってました
2408.9042	1.3500	overt	2409.0000	2890685	そういったよく見て
2411.1842	1.9200	overt	2411.2800	2893421	どんなスピードが渡ってきてる
2415.9242	2.2500	overt	2416.0200	2899109	何の人もあるのとは知っている
2424.3842	2.9100	overt	2424.4800	2909261	今回の家も隠しちゃって今全然自分ともそうじゃない
2428.5842	2.6100	overt	2428.6800	2914301	スリエラリー大臣確認の効果を
2434.0142	1.5000	overt	2434.1100	2920817	大事よかった
2436.4742	1.8300	overt	2436.5700	2923769	さっき行きの練習に戻ろう
2440.9442	6.6300	overt	2441.0400	2929133	はいあのさ俺も満足してないんだけどじゃあもう一緒にメモヘリい作家もいらっしゃってもらおうか
2450.7842	1.1700	overt	2450.8800	2940941	もう一応
2453.1542	4.5000	overt	2453.2500	2943785	前に進めてるって感じがあったぞ
2458.6142	4.5000	overt	2458.7100	2950337	じゃあ目にくるって
2463.8642	2.0400	overt	2463.9600	2956637	緑とパパリで一緒じゃないですか
2466.7442	1.9500	overt	2466.8400	2960093	こういうところほどもポイントじゃない
2469.2642	3.7500	overt	2469.3600	2963117	みんなに特別なネイランパンが込められてるからドレツカリが消えていくわけだ
2478.1442	3.5700	overt	2478.2400	2973773	普通の時に飲むとめっちゃうまいな運動がいいのに飲む感じないんですかね
2484.8642	4.2600	overt	2484.9600	2981837	ありがとうございます
2490.4442	2.8800	overt	2490.5400	2988533	サン分以上決め手で勝ちます
2493.8342	1.2900	overt	2493.9300	2992601	全部か
2497.0142	2.9100	overt	2497.1100	2996417	いろいと歌になってお尋ねの人も一緒します
2506.3742	1.4100	overt	2506.4700	3007649	自転練習の合間に来る
2508.9242	3.3000	overt	2509.0200	3010709	本当に皆さんが勝ち立てたといいから熱いです
2516.0942	3.0900	overt	2516.1900	3019313	出動するような振り出しは戻らない
2522.4542	3.0600	overt	2522.5500	3026945	動物の股関節も育てる
2540.5742	2.1600	overt	2540.6700	3048689	今日の一緒じゃだいぶお疲れのようだし
2655.7142	1.4100	overt	2655.8100	3186857	死にわれても困りますよ
2670.5342	4.8300	overt	2670.6300	3204641	この場所の一応私もあのサトメと紹介されちゃう
2676.4442	2.3100	overt	2676.5400	3211733	もっと寄り道してください
2684.3942	3.3600	overt	2684.4900	3221273	さようなスタイにそして人生のバンド中から一緒に見に行こうよ
2689.1342	2.7000	overt	2689.2300	3226961	よかったじゃあ虹に会場で
2692.3742	2.0700	overt	2692.4700	3230849	これよりMSIを開始します
2721.8942	1.0500	overt	2721.9900	3266273	そういうところに
2730.2342	5.0400	overt	2730.3300	3276281	ちょっと見てくださいの笑顔シャンさんはお知らせでいいんです
2737.9142	2.7900	overt	2738.0100	3285497	そうすれば
2741.5142	2.3400	overt	2741.6100	3289817	ニ時間ごとすめちゃいちゃいけない
2744.7542	1.7400	overt	2744.8500	3293705	やってやるんだ
2747.3042	1.2600	overt	2747.4000	3296765	同じのとこ行かないと
2753.8742	1.3200	overt	2753.9700	3304649	もしかして会場の
2755.9442	1.0800	overt	2756.0400	3307133	ちょっと結構ですけど
2759.5442	1.1400	overt	2759.6400	3311453	遅くなっちゃった
2764.5542	1.3800	overt	2764.6500	3317465	お前かまましやなかった
2782.1642	2.1300	overt	2782.2600	3338597	気になる人楽しかったですね
2786.2742	4.0200	overt	2786.3700	3343529	まだツイッターに俺ら出さないでないです
2793.3242	1.5600	overt	2793.4200	3351989	お疲れさまです
2859.0542	1.8900	overt	2859.1500	3430865	どんなに痛くてもちゃんと考えるよね
2862.3842	1.6800	overt	2862.4800	3434861	終了いたします
2868.6242	2.7300	overt	2868.7200	3442349	明日からまた冷ましてもらうから荷物運びに
2879.0942	1.8600	overt	2879.1900	3454913	後手から持ってください
2882.0642	4.5300	overt	2882.1600	3458477	仲いいですね予定感つち合いだからね
2887.2242	3.8700	overt	2887.3200	3464669	まいったまいった
2892.6542	1.6200	overt	2892.7500	3471185	ヒャクジューロク番
2894.7842	1.7700	overt	2894.8800	3473741	そうじゃなくて
2950.4642	3.2400	overt	2950.5600	3540557	朝に向きてる時はよく良くなってくらい話になってどの人かして
2954.7542	8.4900	overt	2954.8500	3545705	目が成長していていいなと思うことが増えるとが増えるとどんどん大きくなるんだけど私がバスケで夢中だったり環境のことだったりやながそこまで至ってないというか
2964.7742	4.4100	overt	2964.8700	3557729	なんかびっくりしちゃって まあそもなかなか気持ち悪いけど
2972.2742	6.0000	overt	2972.3700	3566729	いろんな人を見てると全面が初めてねえとそれはタイプの違いとどっちが正解ってきて
2980.9442	1.9800	overt	2981.0400	3577133	今井の役なんて感じだけど
2984.9042	1.5900	overt	2985.0000	3581885	そんなこと言っちゃい方が撮れたです
2987.6642	1.3500	overt	2987.7600	3585197	じゃあ全然失礼いた
2989.5242	4.1400	overt	2989.6200	3587429	ちゃんと自分の気持ちを認めたいですね
2996.4542	2.9100	overt	2996.5500	3595745	地元に少しチピンはなんでどっか行って
3002.7542	1.1400	overt	3002.8500	3603305	笑ってない
3008.8742	1.4700	overt	3008.9700	3610649	まだ所からさになります
3011.8742	1.2900	overt	3011.9700	3614249	いかにもしておりますよ
3040.8842	3.0600	overt	3040.9800	3649061	振り返ったのか
3052.5242	1.4400	overt	3052.6200	3663029	どれぞれ行ったそうかな
3060.4142	2.1600	overt	3060.5100	3672497	何に書いたのに
3105.1142	1.3800	overt	3105.2100	3726137	これは秘密です
3126.2942	5.5200	overt	3126.3900	3751553	そんなことないようにしてたらねまた適当なことを母親申し訳ない
3132.3542	4.2300	overt	3132.4500	3758825	その時はなるためにこうした方が早速
3138.4742	2.3400	overt	3138.5700	3766169	これ行けるぞ私も来た顔してください
3141.5942	1.0500	overt	3141.6900	3769913	全部で頼むぜ
3149.8742	3.6000	overt	3149.9700	3779849	私のシャシュートのいいな気にピーサイムなしてるかよ
3154.5542	4.1100	overt	3154.6500	3785465	救急さっき私バス乗ってる救急が悪い
3160.0142	1.8000	overt	3160.1100	3792017	先輩の課題確認しておいてたくて
3163.1042	4.6800	overt	3163.2000	3795725	この人に見られるってことだよな
3169.6742	3.5400	overt	3169.7700	3803609	これから大人の子が全てコピンされる
3174.2342	1.7100	overt	3174.3300	3809081	楽しみにプレゼントで
3181.2242	2.9400	overt	3181.3200	3817469	レース色の感じが見てる方が出ました
3185.4242	3.0300	overt	3185.5200	3822509	小さな傷があるが狙い通りっていうのを命令でて
3191.9342	1.6200	overt	3192.0300	3830321	両親とかダメだね
3194.0942	1.8000	overt	3194.1900	3832913	これだけの話してよくそれ言ってみよう
3208.6742	5.9100	overt	3208.7700	3850409	これはまたより熱い戦いじゃないですかね
3215.4542	2.1600	overt	3215.5500	3858545	そうやってもらってない
3220.6742	5.5200	overt	3220.7700	3864809	ありがとうございます
3233.3342	5.1600	overt	3233.4300	3880001	お疲れ様です
3240.1442	1.3200	overt	3240.2400	3888173	どうしたの
3242.3342	1.0800	overt	3242.4300	3890801	ちょっと分からないと
3267.7142	1.9500	overt	3267.8100	3921257	さあかんさんパイトの書かれてもらって
3280.4942	3.6000	overt	3280.5900	3936593	直感感じてることがいいわだからエンジもクマ質物
3284.7842	2.3100	overt	3284.8800	3941741	先輩でどれかそしてもいっぱいです
3288.0542	2.7000	overt	3288.1500	3945665	全然溺れてるんだけどだけどお隣に立ちたいと
3300.1142	1.1100	overt	3300.2100	3960137	ありがとう
3305.0942	2.2200	overt	3305.1900	3966113	室の頃が分かっている
3312.1142	1.9200	overt	3312.2100	3974537	結局姉ちゃん帰ってこないから心配さかしにした
3316.2842	2.6700	overt	3316.3800	3979541	山のまで送っていくよ山のあるだよね
3322.6442	1.8600	overt	3322.7400	3987173	おやすみおやすみなさい
3329.5142	1.3800	overt	3329.6100	3995417	その成長がまぶしくて
3331.6442	1.9500	overt	3331.7400	3997973	本はイノトが一番きれいかもしれない
3336.5042	3.0300	overt	3336.6000	4003805	ちょうど言わない
3348.1442	2.6100	overt	3348.2400	4017773	私はパスとからだってつらいくのじゃないのか
3352.0742	1.3200	overt	3352.1700	4022489	これ上昇されない
3358.4342	2.2200	overt	3358.5300	4030121	社の人は簡単に行くならないと
3395.4842	1.2600	overt	3395.5800	4074581	うーん実践
3414.2342	1.1100	overt	3414.3300	4097081	言っているじゃん
3427.6142	2.8500	overt	3427.7100	4113137	こんなに見に行くかりのバースは無事で
3435.5042	3.2400	overt	3435.6000	4122605	じゃあ一緒に伝えようか
3454.4342	3.4200	overt	3454.5300	4145321	俺が勝つんだけどそれが血やされておらんお前のだろう
3459.1742	1.2300	overt	3459.2700	4151009	分かりません
3463.0142	1.8300	overt	3463.1100	4155617	どっかに出かけませんか
3469.9442	3.0000	overt	3470.0400	4163933	じゃあジェカイに行きたら手貸してボロバーになっちゃった
3475.0742	4.2000	overt	3475.1700	4170089	いいよ本当ですがその代わりのシャミしたいカフェがあるのちょっとやった
3480.6842	1.6500	overt	3480.7800	4176821	ですよね
3490.2542	2.1600	overt	3490.3500	4188305	何て言っていいですね
3496.3742	5.7000	overt	3496.4700	4195649	何で言ったらしながらそうじゃないみたいなの絶対また装置装置すぐですね
3506.5742	7.0500	overt	3506.6700	4207889	冗談だよな何か言ってますね
3516.7742	3.4500	overt	3516.8700	4220129	今日雲の流れが速いな
3611.3042	2.5200	overt	3611.4000	4333565	辛いことだと思うけど夏休みに行こう
3622.2842	2.0700	overt	3622.3800	4346741	それが基本我慢というか大変態度
3625.8542	1.1100	overt	3625.9500	4351025	頂戦いですよね
3628.9442	3.3900	overt	3629.0400	4354733	連れちゃうのに思い出してくれ
3634.6142	1.1100	overt	3634.7100	4361537	失礼します
3636.2342	1.1400	overt	3636.3300	4363481	失礼しておいて
3641.5442	1.5600	overt	3641.6400	4369853	何かするともパレル
3646.9742	1.1700	overt	3647.0700	4376369	イチ回行ってみよう
3649.1342	3.8400	overt	3649.2300	4378961	今までの出かけやすい分かつもちゃんと出た行くんこういうところ
3662.1842	1.3800	overt	3662.2800	4394621	これいいかも
3664.7942	2.5500	overt	3664.8900	4397753	このTシャツ着着してくれない
3670.4942	1.9200	overt	3670.5900	4404593	あれ
3673.3142	1.3800	overt	3673.4100	4407977	どうしたの
3687.5342	4.3800	overt	3687.6300	4425041	そうですか
3694.8242	3.7500	overt	3694.9200	4433789	何さとそこのプレッパーとして一番おいしかった方が大地君に食べてほしくて
3699.7442	3.3600	overt	3699.8400	4439693	先ほど行きましょうニ名なんですけど
3707.1542	1.5000	overt	3707.2500	4448585	などは何てごめんじゃない
3731.0042	1.3200	overt	3731.1000	4477205	そういう感じの
3744.1142	5.1900	overt	3744.2100	4492937	一応見当てたんだんだんでナイスは隠せてプロットのそれ夢かで
3756.1442	1.0200	overt	3756.2400	4507373	なとこあった
3759.3842	3.8400	overt	3759.4800	4511261	中本サイドサイドボリンとか行こうかお邪魔しちゃったみたいに撮ってくる
3770.3942	2.1900	overt	3770.4900	4524473	本当にお待たせ
3775.7642	2.5800	overt	3775.8600	4530917	今日はちょうどよかった
3779.0342	1.6800	overt	3779.1300	4534841	それでパスチチョウコだし
3784.3742	2.1900	overt	3784.4700	4541249	でもあんたのためじゃないか
3798.2342	1.3800	overt	3798.3300	4557881	それで一緒に話して
3806.3342	3.4200	overt	3806.4300	4567601	もうすぐイチ日少し位置になるかもしれない
3810.9842	1.4400	overt	3811.0800	4573181	せっかくなんでいいところに
3816.5342	2.6700	overt	3816.6300	4579841	きれいですね上層でこうしてる
3820.2542	2.4600	overt	3820.3500	4584305	それ調べしてもしかしてやかなことしてはまさか
3824.7242	3.4500	overt	3824.8200	4589669	私もあじまいですけど素晴ってみたいだもんさか
3829.5242	2.3700	overt	3829.6200	4595429	知らないよねこれで一緒にやめなといって
3834.6542	3.9000	overt	3834.7500	4601585	小株のようで好みでき存在でたく一番手で息ぴったりで
3839.4842	2.7900	overt	3839.5800	4607381	やめちゃったんだよね何の相談もなしに
3843.2942	1.6500	overt	3843.3900	4611953	ご覧になってください
3845.9942	3.7800	overt	3846.0900	4615193	おかえりつたら傘も出すぐりですしこの子っていった日何ですか
3850.3442	1.5900	overt	3850.4400	4620413	なんかでしょぶなって
3853.2242	4.9500	overt	3853.3200	4623869	何気持ち悪いと思わなかったのは楽しそういうことになってました顔してたの
3858.7442	2.4900	overt	3858.8400	4630493	めちゃくちゃ誰かでちょっと待つような人なと思ってたから
3861.9542	3.7500	overt	3862.0500	4634345	次は何を持たせてくるなんてあり得ないですけど
3866.2742	1.1100	overt	3866.3700	4639529	痛いことになっちゃう
3869.0042	1.5600	overt	3869.1000	4642805	何
3874.2842	1.3500	overt	3874.3800	4649141	ちぶちを見なかったのに
3901.3742	2.9400	overt	3901.4700	4681649	もう最初と同じちゃうのか
3916.9142	1.6500	overt	3917.0100	4700297	走れ 彼も歩みよう
3927.8942	1.8900	overt	3927.9900	4713473	お疲れします
3942.5942	1.1700	overt	3942.6900	4731113	そうそうどうぞ
3953.8442	1.5000	overt	3953.9400	4744613	おかげでございます
3956.5142	3.5400	overt	3956.6100	4747817	バスティマッシュできたしなおかまいかなってそんなぞ
3962.1242	1.3200	overt	3962.2200	4754549	そうじゃなって何
3965.7542	1.2900	overt	3965.8500	4758905	大丈夫ですよね
3968.7842	2.1900	overt	3968.8800	4762541	寒いのにだからそういう感じに行く
3985.6442	1.9200	overt	3985.7400	4782773	小児から昔から嵐のような子で
3988.8842	4.2900	overt	3988.9800	4786661	今これを運ぶその姿勢いにする強い子が
3995.7842	2.0400	overt	3995.8800	4794941	そういう間に
4001.5442	4.2900	overt	4001.6400	4801853	多分この中にみろちゃん僕が触ってる時間が一番長い
4006.8242	1.9200	overt	4006.9200	4808189	私たちいつかと私たち行かない
4010.9042	2.3100	overt	4011.0000	4813085	こんにちはどうもこんにちは
4014.8642	1.2300	overt	4014.9600	4817837	だから期待してるぞ
4019.3942	2.8500	overt	4019.4900	4823273	やっぱり大変です
4024.5542	1.5600	overt	4024.6500	4829465	ランザラになるでしょう
4026.7742	6.5400	overt	4026.8700	4832129	失礼ごよいじゃんそうしててサンジューイチマンゴセンゴ割今なんじゃないんじゃない大変だしたら才能力赤い気持ちは分からないけど
4035.7742	1.3200	overt	4035.8700	4842929	何をかちめらかなくせに
4038.7142	4.1700	overt	4038.8100	4846457	話みたいな人はもっと気をつけその心について行っていけば命中についてですね
4044.9242	3.0900	overt	4045.0200	4853909	僕らだった夢かみたいな天使山かもベタかった
4048.5842	4.1700	overt	4048.6800	4858301	たまに思うんだこのチームに伺えてくれちゃって個人チーム距離の関係ないんだな
4053.6242	1.0500	overt	4053.7200	4864349	すみません
4065.7442	1.6800	overt	4065.8400	4878893	どうでもよろしいか
4069.0142	1.3800	overt	4069.1100	4882817	夢か夢かって嫌いだった
4071.5342	2.9400	overt	4071.6300	4885841	流れを作れるの遅いです
4077.6242	1.6200	overt	4077.7200	4893149	なんかついてる
4085.3042	1.0200	overt	4085.4000	4902365	はいチャレンスはいい
4088.4242	2.4600	overt	4088.5200	4906109	想像つかないんだよね
4092.6842	3.1500	overt	4092.7800	4911221	今日終わりねまた会いとしてくれよな
4096.9142	2.2800	overt	4097.0100	4916297	戦争はもったいない全然天才だった
4100.2742	3.9900	overt	4100.3700	4920329	中に私の背負い人ってゴ万っているんでそうかもしれない君は持ったこともないだろう
4105.4642	2.7300	overt	4105.5600	4926557	雑なところで頑張りしてやる何の要求をしてるんですか
4109.8442	2.0100	overt	4109.9400	4931813	トレーが不調になったとか
4113.1142	2.6400	overt	4113.2100	4935737	もったいないけどそんなそこじゃないですよ
4117.6142	2.2200	overt	4117.7100	4941137	それを若干の気味でこれだご正論言えるよね
