onset	duration	trial_type	wav_onset	sample	value
6378.8942	5.5800	overt	6378.9900	7654673	自分の方を聞いた人たちに めちゃくちゃにする時間を聞いた人たちに部屋の中で語りかける時間を使ったらどうだ
6385.0742	5.1900	overt	6385.1700	7662089	だから戦争を止めればいいかそれほど注意気圧が決められないまん辺でバトバカにも崩れたし
6392.6342	5.7900	overt	6392.7300	7671161	変化球を保つない場面は止めるようがある人の思いはその場合を言いながら抵抗することである
6399.1142	3.9300	overt	6399.2100	7678937	対処量ずれゴ日についてやつ調整する方があるはず我がその場合中で濁せずに
6403.5842	1.2300	overt	6403.6800	7684301	やるやつとしたことなんだ
6405.8342	5.1900	overt	6405.9300	7687001	ただきゃそうしない方がいいのです決してその場を去ろうとしなかったその場に座ることができないだろうか
6412.3442	1.8900	overt	6412.4400	7694813	コスタチウスには興奮を避けない
6416.1542	3.2100	overt	6416.2500	7699385	自分を恥ずかしかな子たちにスマートウチューク撮っておくと
6423.2642	3.8100	overt	6423.3600	7707917	なぜ私は眠る時に何かしようとしていない気持ちになった
6428.0942	8.5800	overt	6428.1900	7713713	本当に何か病むくねどうしてなるのかそうしたらしているのか寝てる時ですから寝てる時ですから寝てるからかそもどっちの情報を食いすいけ
6437.2742	4.8000	overt	6437.3700	7724729	なぜ一部一部数字かしようと人間になる時には足らないのか
6442.6442	8.6400	overt	6442.7400	7731173	私は意味なく今日は何歩歩いたのか現在心拍性いくつか何度も確認しているチューブはサン万円になってはまずは何もしないことにを自分に課さなくてはならない
6451.7942	14.9700	overt	6451.8900	7742153	何をしてもなにかけないのは女者のハサランとしたディスオシーだけでナイブで世界を本当に変えることができると信者もだけが書けるテキストが何をしないで武道界もからサン人のノーフを描けた若きなしのピーズが全面に見なぎて
6467.5142	4.6500	overt	6467.6100	7761017	変化しないことは難しいより良い人生にはどうせば本当に自分の人生を自分一気だと思えなかった
6473.1542	4.5000	overt	6473.2500	7767785	著者の思い印良さに控えてそう私もどうにかしてやらなかったのでこの手強い経済に
6719.7242	1.2900	overt	6719.8200	8063669	頂上がらすすめ
6721.7342	2.6700	overt	6721.8300	8066081	長企画と直感的に訳説明してみます
6725.2142	8.5200	overt	6725.3100	8070257	いろいろなGN密の方針的に何かその議論情報企画の情報記録の参考書になります
6753.2342	9.3600	overt	6753.3300	8103881	研究しているからその生涯を持ちながら紹介して一般的科学省記録の科学者の科学者の科学者を説明して挟まれている誰が
6763.4042	7.2000	overt	6763.5000	8116085	神経学神経学の世界で有名な患者なら一部目ついて緊急世界から解説ながら一応に触れることで単なる研究体操だと感染するようになってる
6771.2642	7.1400	overt	6771.3600	8125517	それでも致死がないと分かり分かったり全体としては一般的な著作として頑張って書かれた時にお聞き研究のお知らせたり同作としてぜひお勧めしたい
6779.1542	8.9400	overt	6779.2500	8134985	正しいことをご覧になったこと全国的に知られている記憶知項の授業で完全に研究することに研究されるような感じであれば長いだ認証でしか知られてなかった
6788.6342	3.3000	overt	6788.7300	8146361	この着で転倒した緊急車サンチーチョンが正解なこの着で
6792.4742	4.7400	overt	6792.5700	8150969	ひどい転換するのは脳の一部を出するロボトミー現在で認めていなかった
6798.1742	13.6800	overt	6798.2700	8157809	当時はロボットによくなかった治療法でその辺りに全国設計画設計だ一切も全校設計画的には世界中の研究者に知られる存在となるその演技を担当する研究者たちの研究者に作られている
6811.8542	13.6800	overt	6811.9500	8174225	研究を紹介した方が成果たられるように具体的に落ちるが他の科学的成果に研究したり科学史を参照したら自分の研究を採取するのはそして何よりも変異常にその質柄が分かるように具体的に描かれているのが素晴らしい
6846.3842	1.4700	overt	6846.4800	8215661	では終了します
