onset	duration	trial_type	wav_onset	sample	value
4122.8342	9.2100	overt	4122.9300	4947401	そんな人もかころないでほっといてよってやっぱり全国セットが遊んでるからレシアでちゃってちゃってやってますよ一番人じゃん遊んでるように着るとは思ってない
4150.8242	1.1700	overt	4150.9200	4980989	おはようおはよう
4166.6042	3.0600	overt	4166.7000	4999925	練習だったらかだけはみんなが先生みたいな努力できない
4185.5342	3.4500	overt	4185.6300	5022641	失礼しているありがとうございました
4189.6742	3.0600	overt	4189.7700	5027609	大吉君それもそばりたいなと思ったことはない
4193.8142	3.6900	overt	4193.9100	5032577	それは目標がしんどくないきゃ全然先輩借りてほしくないです
4198.5242	1.8000	overt	4198.6200	5038229	欲しいやついる
4207.9442	3.2100	overt	4208.0400	5049533	ちゃんと何も話してくれないように
4216.1342	4.5000	overt	4216.2300	5059361	それ以上何が悪いんだなんすら足取り重くなってきたんじゃないまだまだです
4221.2642	4.8000	overt	4221.3600	5065517	絶対一君も知って他のこいつなんて流氏なかったから関係ないそうか私はそういうことを話してほしかった
4227.0242	6.3600	overt	4227.1200	5072429	よかったなやねん買い物邪魔してもね言えるわけないじゃん自分の足なんてなかったんだから
4234.0442	9.2700	overt	4234.1400	5080853	私はこんなかっこいいじゃないんじゃないんだからそこへたりとかしょっと思ってだから憧れだったと嫌いになっていったらそんなの話し合いの最後の試合の翌日の一人練習してる
4244.1542	2.4300	overt	4244.2500	5092985	大人で解放すかんすかんすかんっちゃってない
4247.6042	5.4300	overt	4247.7000	5097125	私が僕か分かっちゃそういう人じゃないのはバスチの道で他のことは見えきもしないで
4253.6642	6.3300	overt	4253.7600	5104397	他のことじゃない私にとっては一つのことだよゆかが読めて身近な目標の一番のトイレ存在もいなくなって
4260.5042	4.3500	overt	4260.6000	5112605	寂しくてこの地道な練習は本当にためになってるのか大丈夫か
4265.3642	2.9100	overt	4265.4600	5118437	おかなくないとき力をもらえる
4269.1742	1.9500	overt	4269.2700	5123009	そういう人がいるから頑張れることもある
4277.7542	3.7200	overt	4277.8500	5133305	バスケが好きに好きっていう気持ちは一番なんだ次期待してるからな
4283.6342	1.7100	overt	4283.7300	5140361	お父さんと私からの夢かおはよう
4287.0542	2.7300	overt	4287.1500	5144465	それでは私は支援において努力した価値は
4295.3942	1.2600	overt	4295.4900	5154473	上がります
4303.8242	5.9700	overt	4303.9200	5164589	その後は俺じゃダメなんですバスに怒ったらいいもくさんじゃないと
4311.4442	2.5500	overt	4311.5400	5173733	このチェットクロスニストの未来しないでください
4315.0142	2.9700	overt	4315.1100	5178017	今のは続きやしだろうな今つらか
4319.6042	3.6900	overt	4319.7000	5183525	どうだったようなイチ年はこの件に関しては変わらなくてもそうだ
4331.1542	1.8900	overt	4331.2500	5197385	なんだよく分厚中してそぼってるところじゃ
4336.7642	5.2500	overt	4336.8600	5204117	新しいやつだから安心して安心とか行くしもうこっちに行って帰ってください
4342.5242	1.2600	overt	4342.6200	5211029	それも クラス
4344.4442	7.0800	overt	4344.5400	5213333	俺の真似ですかそんなことないよいけにいろいろしてたまにお返しないとつや何をくれるんですかなんて冗談なんですよそんな考えですか
4352.7542	2.1000	overt	4352.8500	5223305	ザエチクなんつらいとちゃうとなりゃいけ
4357.2542	3.1200	overt	4357.3500	5228705	その時はライブでも海でもどこでもと申しますよ
4376.0342	2.0400	overt	4376.1300	5251241	今か星のこと好きなんじゃない
4380.8642	1.8900	overt	4380.9600	5257037	それがあなたを最強にする
4387.4042	3.1500	overt	4387.5000	5264885	終わってからあと今だったなってニ年間まだニ年間
4391.6942	2.1000	overt	4391.7900	5270033	先輩にも話した方がいいかな
4395.5942	1.4700	overt	4395.6900	5274713	何そのトナコイ
4397.7842	1.2600	overt	4397.8800	5277341	先生こうかいするんだ
4408.8542	1.5000	overt	4408.9500	5290625	そのままだち通じ合うもの
4413.9842	5.1900	overt	4414.0800	5296781	ここにいるのあのバターの一のやつにつけてもらったの
4420.0742	3.3900	overt	4420.1700	5304089	私の人はごめん思ってること何も言わないな私も同じだって
4424.5142	1.8300	overt	4424.6100	5309417	バス停したかったやめてほしくなかった
4428.8942	1.9200	overt	4428.9900	5314673	じゃあなんでやめちゃったの寂しかった
4433.6942	2.2200	overt	4433.7900	5320433	だってあんたら子どもか
4438.9442	4.8300	overt	4439.0400	5326733	最強って最強的なものの上手な彼らで自分の大切なものがあるってやつを持つ
4444.3142	3.3000	overt	4444.4100	5333177	最大の地獄行ってまた一緒にご視聴しましょう私のパワー持ってきて
4454.4842	3.4500	overt	4454.5800	5345381	中に散ればれといたんだ袋して手に入れたみたいな感じです
4458.4442	2.1300	overt	4458.5400	5350133	これくてごめんのやつ私用じゃあるから帰れない
4463.7842	3.7500	overt	4463.8800	5356541	お帰りましてまだ帰ってないお帰りまず一生まであれゴミリでも行ったのかしら
4468.7042	3.7200	overt	4468.8000	5362445	彼奈々じゃなかったぞわすらまたねカナサンクリスパーティスね
4473.5042	3.7800	overt	4473.6000	5368205	怖い形で燃焼してるからさやこのサン種の友達の友達で来てた
4478.1542	1.5300	overt	4478.2500	5373785	ちょっと入れていてたけど
4480.4342	3.2400	overt	4480.5300	5376521	そのために勝負してシャトルランナーアナートイトトナルも出して
4484.3942	3.6900	overt	4484.4900	5381273	近いと友達すると気になってもしかして
4491.9542	2.0100	overt	4492.0500	5390345	お待ちかさまで聞かせた
4495.5542	6.0300	overt	4495.6500	5394665	それからチケットもありがとう
4503.5042	5.2200	overt	4503.6000	5404205	私ねずっと気づいてたのよみかが何か悩んでたけど本人があさらいくないも言わなかったそれをすごく効果してた
4510.2242	5.4600	overt	4510.3200	5412269	本当に本当にそれの私の自分も岩倉公園の一緒みたいに俺も延長期待をしたままです
4517.4842	1.0500	overt	4517.5800	5420981	ありがとうございます
4531.5842	2.7300	overt	4531.6800	5437901	そろそろ行こうかな
4544.9942	4.1700	overt	4545.0900	5453993	このか実はボンバスチームやと思ってたんですが夏が僕らと思っている人がね
4558.2842	1.5300	overt	4558.3800	5469941	最強な感じなんで
4561.1642	1.3200	overt	4561.2600	5473397	ちょっと失礼
4566.2642	1.5000	overt	4566.3600	5479517	お前らとほらければ
4569.0242	1.4700	overt	4569.1200	5482829	年末を探知了解です
4571.4842	3.2400	overt	4571.5800	5485781	そういう意味だったんじゃないかってそのイチ点字を飾っておきません
4587.0842	1.4400	overt	4587.1800	5504501	命にくれるって違う
4596.7442	1.0800	overt	4596.8400	5516093	もう一応なんだって
4603.7942	1.0200	overt	4603.8900	5524553	おめでとう
4606.5842	1.0200	overt	4606.6800	5527901	ちょっと遅いです
4608.7442	1.0800	overt	4608.8400	5530493	はい物終わるよ
4614.2342	2.3400	overt	4614.3300	5537081	結局を見せてあげると
4618.4642	1.4100	overt	4618.5600	5542157	水をかけてこないでよ
4622.4242	1.6800	overt	4622.5200	5546909	失礼なさちゃこもちないと思って
4625.3642	1.2000	overt	4625.4600	5550437	一緒に行く知らない
4643.5442	1.5900	overt	4643.6400	5572253	やーたわ
4654.3742	1.0500	overt	4654.4700	5585249	いつの間のことしか
4662.1742	1.0800	overt	4662.2700	5594609	そうな人の違いを
4671.4742	1.5000	overt	4671.5700	5605769	これ自分でじゃあそぼ
4676.5742	2.3700	overt	4676.6700	5611889	いつまで出るの
4728.5942	3.9300	overt	4728.6900	5674313	早くは得意なんですよ今日そろそろ正月気分かないと
4734.4742	3.0300	overt	4734.5700	5681369	おかしくるかをよしついたぞ
4739.6042	2.3100	overt	4739.7000	5687525	こんなにきれいだね
4747.8242	5.0100	overt	4747.9200	5697389	このミコットとか自ら早く行って滑って滑らずちょっとデカでしてもいいですか
4753.4942	2.4300	overt	4753.5900	5704193	荷物は込んでおくよう行ってきます
4762.3142	2.0700	overt	4762.4100	5714777	それが移動するからな
4765.1942	1.2600	overt	4765.2900	5718233	サンジュー分後
4770.5342	4.8300	overt	4770.6300	5724641	今どこにいますか
4776.5342	4.0200	overt	4776.6300	5731841	少しができて私も戻るよそこで待ってるから
4822.0142	1.6200	overt	4822.1100	5786417	こちらこそ
4948.1942	3.5700	overt	4948.2900	5937833	夢じゃないんで忘れてさっちの方が終わりした
4954.7942	1.1100	overt	4954.8900	5945753	人生で始めて
4958.2142	3.0600	overt	4958.3100	5949857	ありがとうございます
4968.2042	1.9200	overt	4968.3000	5961845	やっぱりそうすんぽい
4970.9342	1.4700	overt	4971.0300	5965121	よいしょビクスト
4973.5142	1.8000	overt	4973.6100	5968217	第イチ 荷物がまだ行くんだよ
4984.9442	1.0500	overt	4985.0400	5981933	なっぺらているんだ
4986.7142	1.7400	overt	4986.8100	5984057	そうですそれないですだから勝つ
4989.8042	2.8200	overt	4989.9000	5987765	この度はこのかが行き
4993.8842	1.2900	overt	4993.9800	5992661	半ところまでしてた
4996.4942	2.5800	overt	4996.5900	5995793	おかえりなさい
5001.1442	3.5400	overt	5001.2400	6001373	動いて食べちゃったんですか
5005.2542	1.2600	overt	5005.3500	6006305	もしかして
5010.9842	1.5600	overt	5011.0800	6013181	すみませんやっぱりそうだったか
5013.3242	2.6100	overt	5013.4200	6015989	すいませんただ話さないのは怖いんです最悪
5016.7142	3.5400	overt	5016.8100	6020057	インターハイキューカーを残してみたかつトータのバスケのために残った
5022.6542	1.0200	overt	5022.7500	6027185	そうかならちゃう
5024.8742	1.2600	overt	5024.9700	6029849	蝶に頼もうとも
5027.9342	1.5900	overt	5028.0300	6033521	当然ですよ呼び切りはない
5041.1642	1.8600	overt	5041.2600	6049397	ありがとう 朝時間とニ人で行きましょう
5054.9642	2.6400	overt	5055.0600	6065957	今の気持ちをどうぞお祝いしてくれてありがとう
5060.3942	2.9700	overt	5060.4900	6072473	インターパップにこうやっぱりMシェフまで入れるって
5066.5442	1.2900	overt	5066.6400	6079853	俺の姿勢い
5070.3842	1.9200	overt	5070.4800	6084461	戦況を誕生みたいな
5073.5042	1.3800	overt	5073.6000	6088205	よるわよろですね
5078.9942	2.8800	overt	5079.0900	6094793	いいですかそういうのに言って正確なのに
5103.1142	2.6400	overt	5103.2100	6123737	仕方ないな
5107.7942	1.4400	overt	5107.8900	6129353	分かりたいな
5111.3342	3.6900	overt	5111.4300	6133601	本当に流れ星です飛行中ですね
5118.2042	2.9100	overt	5118.3000	6141845	と一緒にとか事件が無事にありました
5121.7442	4.8300	overt	5121.8400	6146093	重いグルメ食べられいい袋が欲しいなとか食べてもしたらね
5127.3242	2.8200	overt	5127.4200	6152789	これからやっぱりちゃんと彼らからくできる
5136.0242	1.1400	overt	5136.1200	6163229	なんかして何をそんなのか
5141.3942	1.5600	overt	5141.4900	6169673	少しサンプレーましょうか
5143.8842	1.3800	overt	5143.9800	6172661	チャンネルチイチだったから
5150.5142	5.2200	overt	5150.6100	6180617	学校でつけられないと思うけどウィンターカップ大活躍できますよこれはなかなか切れないと大切です
5173.1942	3.2100	overt	5173.2900	6207833	シャツありがといいやプレゼントもありません
5177.2742	2.0100	overt	5177.3700	6212729	また一年よろしくお願いします
5215.7342	1.9200	overt	5215.8300	6258881	クラススタンプラリー仮装した人は
5218.2842	3.8700	overt	5218.3800	6261941	集めたケイモロカタイキ組のケイントランスすら学習組みの考えておく
5223.5942	2.8800	overt	5223.6900	6268313	これに違いを上手がご覧のようにします
5228.5742	2.1600	overt	5228.6700	6274289	俺らの可能性は許さない
5247.8642	1.3500	overt	5247.9600	6297437	じゃあその格好
5253.9842	1.6800	overt	5254.0800	6304781	コーナー歩くのはちょっと
5257.1342	2.3700	overt	5257.2300	6308561	旋盤シェットが終わったらオーバー中
5260.4342	1.0200	overt	5260.5300	6312521	どうしてどうも
5262.4742	1.9500	overt	5262.5700	6314969	俺探してくる
5265.3542	2.1000	overt	5265.4500	6318425	無理屋さん何
5272.7642	1.1400	overt	5272.8600	6327317	どうせこれなんだと
5278.1642	1.0800	overt	5278.2600	6333797	ありがとう
5281.4042	2.5800	overt	5281.5000	6337685	あの子ってチョウの幼な話みたいな
5284.5242	6.6900	overt	5284.6200	6341429	だからあの人たちが困ったら助けになりたいと思うちのここで今日がどんな行動したって起こる人はいないよ
5291.9942	1.7100	overt	5292.0900	6350393	今日が関心大をかつたって
5294.3942	2.1000	overt	5294.4900	6353273	森屋さんのこともここです
5298.1142	3.1200	overt	5298.2100	6357737	もちろんうまいですけどニ人くらいで終わるんじゃないか
5312.6042	1.4100	overt	5312.7000	6375125	先生が以上を探してくる
5317.9142	2.2200	overt	5318.0100	6381497	何しようと聞こえてたからごめんこうにだから
5322.6842	1.2900	overt	5322.7800	6387221	じゃああれ
5329.4942	3.2400	overt	5329.5900	6395393	さすがに全部後でいいなつとかにやるよ
5339.3942	3.6300	overt	5339.4900	6407273	よっしゃないね普通じゃないそうなんだけどより黒いかな
5343.5642	1.5000	overt	5343.6600	6412277	本当に
5347.3742	1.3500	overt	5347.4700	6416849	よろしくお願いします
5352.2942	1.8300	overt	5352.3900	6422753	ついでにやってはやれないよ
5355.1742	1.7700	overt	5355.2700	6426209	ケーシンがもらえるんだ
5358.3242	2.3700	overt	5358.4200	6429989	皆さんこの手伝ってくれ
5362.0442	5.0700	overt	5362.1400	6434453	じゃあこれで私が前線道を教えてくれ
5368.2842	1.1400	overt	5368.3800	6441941	今度は
5371.5842	1.2000	overt	5371.6800	6445901	ここを取れたか俺に
5373.5042	2.1000	overt	5373.6000	6448205	別々と言うにもなかったがいは
5377.0142	1.2900	overt	5377.1100	6452417	これが買ってもらわないと
5379.1742	1.5600	overt	5379.2700	6455009	痛いに言ってるのは松岡先輩
5381.3042	2.4300	overt	5381.4000	6457565	ごめん外しちゃった絶対ウルトだ
5385.0842	4.5000	overt	5385.1800	6462101	彼氏がまたなと思わないバスチの子は彼氏が言われた感じかかりするな
5391.6242	2.2500	overt	5391.7200	6469949	本当もまだ最近こっちに朝と行ったら
5396.8442	7.5300	overt	5396.9400	6476213	大会に入るなりバトルのをチェックして後ろも一撃ちで消えていくしこうしたらおとまいなくても嬉しいですやめてくる
5405.3642	1.7400	overt	5405.4600	6486437	そうですそうか
5407.8242	2.6400	overt	5407.9200	6489389	ありがとうございましたあんたも大変
5411.7542	5.9400	overt	5411.8500	6494105	今の中に行って全然バキューケでもしてもすいません物中に誰かいませんか
5423.2742	2.6400	overt	5423.3700	6507929	ありがとう次のシフト私だから変わるね
5426.9042	1.1400	overt	5427.0000	6512285	もしも伝えてたね
5432.1842	3.4800	overt	5432.2800	6518621	ないですけどさに教えてくれてありがとうおかしいな
5437.6442	5.4000	overt	5437.7400	6525173	しかしなスマホ忘れてたみたいでここに何にしてもそうなんだ
5443.7342	3.9300	overt	5443.8300	6532481	もしこんなに連絡つかないことして終わったら合意し合って約束してた
5452.4942	1.3500	overt	5452.5900	6542993	もうじかんちゃったって
5455.5542	1.4700	overt	5455.6500	6546665	大分はそうで
5457.6242	1.3500	overt	5457.7200	6549149	どうしてそんな面白つかな
5459.6942	1.3800	overt	5459.7900	6551633	なことしないですね
5461.9742	1.0200	overt	5462.0700	6554369	待って大丈夫
5463.5342	1.8900	overt	5463.6300	6556241	何してんの育て筋トレ
5466.3242	4.1400	overt	5466.4200	6559589	例えば少し赤くなっただけであそこに案内した人あんた落ち込んだ
5471.4542	6.3900	overt	5471.5500	6565745	どんな感じを持っているようなことをしているにはならないと私は許さないよすいません
5478.7742	4.6500	overt	5478.8700	6574529	ちゃんと謝ってくれるんでごめんねつの先輩じゃないじゃないですか
5484.1742	10.2900	overt	5484.2700	6581009	まだ若いけど本当に心配してなさい先輩が起こったのも初めて見ましたこれは大きくんのこと大切だと思うとこじゃないかけどですもん何時間でしたっけ
5498.6642	6.8400	overt	5498.7600	6598397	何個だけだったんですか先輩に会えなくて力が邪魔していたね違いないこれで全部そろったね
6027.4142	6.2400	overt	6027.5100	7232897	何もないということを目覚めてする携帯電話でやめる
6037.1342	13.9200	overt	6037.2300	7244561	ドラム大統領主にかまないニセンジューナナ年の写真で開催されるアートとテクノシのカンファレンスで開催された当時は大統領者の結果に対する動揺が収まったらですらいいで多くのアーティスト同様で何かを作りすことがなかなか設置できないデータ
6051.0542	13.9200	overt	6051.1500	7261265	オーグランダではニセンジューロク年にゴーストシップティバレスチョンのアーティストや通気を愛する人たちが犠牲なった事件があったばかりで街戦艦へが重ねていた年代に留学するクロも見つめながらよりによって何か意味なかったことは考えがなくなっていた
6066.7442	11.8800	overt	6066.8400	7280093	ここになるのかお前はまたれそこにもしてねえ方向と打ち込んだ
6078.6242	11.8800	overt	6078.7200	7294349	このローズガーデにいる時だったということもあってそうしたのだが何か言いたいことのすべてがここにあるということもちゃんと分かっていた何もしない何もないの構造をこういう空間中はセキュアとメンテナスの理理についてだ
6091.4642	1.9500	overt	6091.5600	7309757	自宅でゴ分できるこのローズ
6094.1342	1.3200	overt	6094.2300	7312961	ガーデンは私が
6098.0642	9.6600	overt	6098.1600	7317677	大統領の作業の大部分を行うコンピューターから離れたりときに足は国防署になっている大統領選挙が本は毎日ローズガデに通めた
6108.2342	7.8000	overt	6108.3300	7329881	そうしようと思ったけどどちらかといえば内側からの衝動でシカがシオをなめるために映いたりヤギがお金を漏らしたりする行動と同じようなものだった
6116.7842	7.0800	overt	6116.8800	7340141	そこで何もせずにただ座っていたそうしているとつくしボランと調布に満ちた人生との大変が違うくに思えて少しばかり罪悪感を抱いたのだ
6142.7342	2.0400	overt	6142.8300	7371281	知らねえかちゅうの今日ね
6145.3442	2.3700	overt	6145.4400	7374413	私は一緒にいたテンショリーグラムの外してる
6148.3742	3.6900	overt	6148.4700	7378049	いいのをしてねリツイートしてないような感心感に患者経済にカラメラ撮らないようにすることだ
6152.9342	6.5400	overt	6153.0300	7383521	我々絞る地域を急がするから市場価値高めた水産高めじゃない水産高めじゃな最先端キャッチョップするためあなたはもっともっと強いはけばならない
6160.1042	4.1400	overt	6160.2000	7392125	元ブランドの立つ個人はそんな店でしたら今この瞬間に一緒に俺らを駆動する
6164.8742	8.0700	overt	6164.9700	7397849	人間的には面白かった言葉を見たかった言葉を振った人に一度に自己ケアスの頃を拡大している気がさした人には特に言って好きな面白い
6173.4542	6.4200	overt	6173.5500	7408145	また形を変えた自己啓発でありそういう疑問を
6180.6542	1.8600	overt	6180.7500	7416785	ちちんと返してるのはこの人のいいところ
6183.1442	1.8600	overt	6183.2400	7419773	その成長旅行とやらず停止でもない
6185.7842	3.7500	overt	6185.8800	7422941	中ではやめきれないということでコミュニズムを呼ぶとしているこれも当たり
6190.1042	3.9900	overt	6190.2000	7428125	世界の責任を受け入れつつ態度を修正していこうということ
6194.7542	4.6800	overt	6194.8500	7433705	何もしないをするそれかに開設にあえて地域税に乗っからない留保士を回避する
6199.9742	1.9500	overt	6200.0700	7439969	全身的な経済で自然のようが必要だ
6202.4342	10.5000	overt	6202.5300	7442921	ついても本社はフェーデルにちゃんと認めているという批判もある意味ただし
6213.4742	8.6100	overt	6213.5700	7456169	それこそが何もしないことの意味だそく何もしないことの意味だ即断しない価値は決めない枠を決めない枠を決めない枠を決めないこうだそう
6222.7442	3.0300	overt	6222.8400	7467293	将来的に本来的に人間あるという話だからやる人です
6226.5242	3.8100	overt	6226.6200	7471829	どうして中継台で何度の機能力を書くのかやりこの世界にかかるためだ
6231.0242	6.3600	overt	6231.1200	7477229	我にも僕の本数でこのまま一緒に置いておきがちを残してる何をしないといけないかついていられない日に下りは面白いことだ
6244.6142	1.1700	overt	6244.7100	7493537	ジャニーの出る何してやる
6246.5342	5.1900	overt	6246.6300	7495841	何もしないことは本当に難しいことが本当に難しいことで観察される
6252.2942	15.0600	overt	6252.3900	7502753	全くの苦悪の時間がほとんど存在しなくなってるのは一から他の人が移動中電話を眺めてどんな時にもレラフトレな状態だって誰もが通知らない気にしなが生活している常に注意さんもなっている
6267.3542	15.0600	overt	6267.4500	7520825	真っ白の時間がないので使用者を依存的にさせるプロットフォンのデザインが原因で情報の接種が止められないので社社はこのような社会人の集中力を奪うことで利益を得る仕組みを追うので何もしないことで抵抗せようと主張する
6283.0142	8.5800	overt	6283.1100	7539617	中経済に危機感を持っているの私も同じでなるべく携帯電話を持ちたり得していたがまだ何もしないという意見は到達できていないどうすれば豊かな無意を取り出せるのか
6292.1042	14.1450	overt	6292.2000	7550525	有意義に暮らすためにお知らせれたりの情報から見る時間が必要だ本当に大切な物事を集中するためにかに中継税から離脱していくそれが二重な見通しとに着手に着手を目指すゴールである
6306.2492	14.1450	overt	6306.3450	7567499	必ずクリックしないという判断一反応せずしやしないという質を取ることが難しい注意をねこそぎ奪われてしまう
6321.8942	10.3800	overt	6321.9900	7586273	そして有罪の時間と聞かに出会えるのは通経済の側なので本当にこれでいいのか著者は言うべきことがないという喜び何度言わずに済む世紀に再び確保しなくてはならないだが活発する
6334.5542	4.9500	overt	6334.6500	7601465	これまでに何もしない状態にいかないものか社会に対する家だということをさまざまレアになんか返答する
6345.1742	1.6800	overt	6345.2700	7614209	何もしない時期のサラートポンスに行った
6347.3942	15.6000	overt	6347.4900	7616873	何もしないでやりかいに挑戦した戦略だというか自らに挑戦した人間だった自術を見たらった人間にかかる性的な目立てような先輩はだからだから私を何しないでやないかと同じないことが考えないから私も何もしない人間になりたいと考えないなかった
6366.1142	6.3900	overt	6366.2100	7639337	いかに多くの時間努力コンテストが崩壊した大衆に気になるはずに言い出すのにそして今その対象なのか
6373.5842	4.4700	overt	6373.6800	7648301	その努力って一切な人たちの人の人の提出のタイミングを使ったらどうだろうか
