onset	duration	trial_type	wav_onset	sample	value
17.3050	2.0100	overt	17.3100	20766	ロク月サンジュー日
25.1350	3.6300	overt	25.1400	30162	ヨンジューゴ人の来客に会うまるくんは
29.9050	6.1200	overt	29.9100	35886	私が太宰治を軽蔑せずにもっとよく親切に読むべきことを忠告する
44.4850	3.8100	overt	44.4900	53382	私が太宰治の文学に対して抱いている件は
49.5550	1.7400	overt	49.5600	59466	一周猛烈なものだ
52.9450	2.6400	overt	52.9500	63534	第一私はこの人の顔が嫌いだ
57.4750	3.6300	overt	57.4800	68970	第二にこの人の田舎者の肺からしみが嫌いだ
62.6650	4.5000	overt	62.6700	75198	第サンにこの人が自分に敵しない役を演じたのが嫌いだ
69.8650	5.8800	overt	69.8700	83838	女と心中したりする小説家はもう少し厳粛な風貌をしていなければならない
123.2650	4.5600	overt	123.2700	147918	私とて作家にとっては弱点だけが最大の強みになる
136.8250	6.6000	overt	136.8300	164190	最大の強みとなることぐらい知っているしかし弱点をそのまま強みへ持っていこうとする操作は
145.1950	2.5500	overt	145.2000	174234	私には自己疑問に思われる
148.6750	6.0000	overt	148.6800	178410	どうにもならない自分を信じるということはあらゆる点で人間として占越なことだ
160.8850	2.5800	overt	160.8900	193062	ましてそれを人に押し付けるに至っては
164.3650	2.8200	overt	164.3700	197238	太宰の持っていた性格的血管は
167.6950	1.6500	overt	167.7000	201234	少なくともその半分が
170.1550	5.6400	overt	170.1600	204186	冷水摩擦や機械体操や規則的な生活で治されるはずだった
177.2050	4.8000	overt	177.2100	212646	生活で解決すべきことに芸術を煩わしてはならないのだ
182.9950	2.8800	overt	183.0000	219594	みささか逆説をローすると
186.3850	3.4800	overt	186.3900	223662	治りたがらない病人などには
190.3750	1.9800	overt	190.3800	228450	本当の病人の資格がない
220.7650	6.2100	overt	220.7700	264918	私には文学でも実生活でも価値の次元が違うようには思われぬ
228.4450	3.6300	overt	228.4500	274134	文学でも強い文体は弱い文体よりも美しい
232.9450	7.2300	overt	232.9500	279534	一体動物の世界で弱いライオンの方が強いライオンよりも美しく見えるなどということがあるだろうか
241.4350	2.0100	overt	241.4400	289722	強さは弱さよりもよく
245.4250	2.8800	overt	245.4300	294510	今日この石は友人普段よりもよく
249.3850	2.6400	overt	249.3900	299262	独立好きは甘いよりもよく
252.8050	2.0700	overt	252.8100	303366	制服者は同期よりも良い
256.1650	2.3400	overt	256.1700	307398	太宰の文学に接するたびに
261.0850	3.6600	overt	261.0900	313302	フグ者のような弱々しい分体に接するたびに
266.0350	5.3700	overt	266.0400	319242	私の感じるのは強大な生息的特目に対して
272.7550	4.0500	overt	272.7600	327306	すぐ柔軟の表情を浮かべて見せたこの男の狡猾さである
289.9450	3.5700	overt	289.9500	347934	この男には生族的なものは芸術家を
294.0850	1.3500	overt	294.0900	352902	傷つけるどころか
296.6050	1.3800	overt	296.6100	355926	芸術家などに
298.7650	3.1500	overt	298.7700	358518	誤も与えないものだということがどうしても分からなかった
306.0250	4.9500	overt	306.0300	367230	自分で自分の肌に傷をつけて訴えて出る人間のようなところがあった
315.8950	1.7400	overt	315.9000	379074	被害妄想というものは
318.2050	3.5400	overt	318.2100	381846	敵の強大さに対する想像力を強めるどころか
324.1150	1.4400	overt	324.1200	388938	かえって弱めるのだ
326.8450	2.1000	overt	326.8500	392214	想像力を鼓舞するには
329.9950	3.3600	overt	330.0000	395994	直視せねばならない彼の被害妄想は
334.1350	2.1900	overt	334.1400	400962	目前の岩を化け物に見せた
341.6350	3.7800	overt	341.6400	409962	だからそいつに頭をぶつければ消えてなくなるものと思って
353.2450	4.0500	overt	353.2500	423894	頭をぶつけかえって自分の頭を砕いてしまった
358.4050	5.6700	overt	358.4100	430086	ドンキホーテは作中人物に過ぎぬセルバンテスはドンキホーテではなかった
364.9450	4.5600	overt	364.9500	437934	どうして日本のある種の小説家は作中人物足らんとする
370.1350	3.0600	overt	370.1400	444162	奇妙な衝動に駆られるのであろうか
456.3850	3.0900	overt	456.3900	547662	イチ月イチ日春晴れ暑い
461.0350	2.9700	overt	461.0400	553242	仕事で前夜から完全徹夜をした
464.9950	1.8600	overt	465.0000	557994	竜型文学在区
469.4350	5.2800	overt	469.4400	563322	アトリエ公演のモノドラマロク本をゴ時から一括してやるのである
475.5550	1.6800	overt	475.5600	570666	それを見に行ったのだが
478.0750	3.8100	overt	478.0800	573690	完全徹夜の後では眠らずに見ている自信がなかった
482.6650	3.9600	overt	482.6700	579198	もし眠ってしまったら作者にも演者にも失礼である
487.3150	3.4200	overt	487.3200	584778	思い切ってそこを出て死刑ゴ分前という
492.3250	3.9000	overt	492.3300	590790	エドワードジェロビンソンのギャング映画を見に行った
519.6850	2.2200	overt	519.6900	623622	この映画は眠る暇を与えなかった
523.6750	3.4800	overt	523.6800	628410	ニサン日前書いたオンチの自己弁護について
528.5650	2.5800	overt	528.5700	634278	書き足りないところがあった
532.5250	4.4100	overt	532.5300	639030	例えば人間精神の心円の縁で戯れているといえば
537.5050	2.7300	overt	537.5100	645006	優れた悲劇もそうである
541.0150	6.2700	overt	541.0200	649218	優れた小説もそうであるなぜ音楽だけが私に不安と危険を感じさせるかといえば
548.4250	6.6300	overt	548.4300	658110	私には音という無形態なものに対する異様な恐怖心があるのである
559.2850	4.5900	overt	559.2900	671142	他の芸術では私は作品の中へのめり込もうとする
564.6850	1.1700	overt	564.6900	677622	芝居もそうである
567.3550	1.6500	overt	567.3600	680826	小説絵画
569.9050	1.6500	overt	569.9100	683886	彫刻みなそうである
572.6350	4.7700	overt	572.6400	687162	音楽に限って音は向こうからやってきて私を包み込もうとする
578.2750	3.7800	overt	578.2800	693930	それが不安で抵抗せずにはいられなくなるのだ
583.1050	6.3600	overt	583.1100	699726	優れた音楽愛好家には音楽の建築的形態がはっきり見えるのだろうから
590.0350	1.5300	overt	590.0400	708042	その不安はあるまい
592.7650	3.1800	overt	592.7700	711318	しかし私には音がどうしても見えてこないのだ
600.8350	5.7300	overt	600.8400	721002	歌詞的なものがいつもかえって私に音楽的感動を与えるのは奇妙なことである
607.3450	7.0800	overt	607.3500	728814	美しい自然を見たり優れた芝居に接したりする時私は多分音楽愛好家が音楽を
616.1350	1.9500	overt	616.1400	739362	聞いている感じ
619.4650	9.6900	overt	619.4700	743358	聞いて感じるような感動を覚える名跡な美しい形態がまるで私を拒否するかのように私の前に現れると
629.7550	3.4500	overt	629.7600	755706	私は安心してそれに溶け込みそれと
635.8150	1.6500	overt	635.8200	762978	合一することができる
640.4050	3.7800	overt	640.4100	768486	しかし音のような無形態なものが迫ってくると
646.2550	1.4400	overt	646.2600	775506	私は身を引くのだ
904.4650	1.9800	overt	904.4700	1085358	優れた音楽愛好家は
908.1850	8.9400	overt	908.1900	1089822	音楽の建築的形態がはっきりと見えるのだろうからその不安はあるまいしかし私には音がどうしても見えてこないのだ
917.6350	5.0700	overt	917.6400	1101162	歌詞的なものがいつもかえって私に音楽的感動を与えるのは奇妙なことである
923.3650	8.0400	overt	923.3700	1108038	美しい自然を見たり優れた芝居に接したりする時私は多分音楽家が音楽を聴いて感じるような感動を覚える
935.4850	5.6400	overt	935.4900	1122582	名跡な美しい形態がまるで私が拒否するかのように
941.9950	1.9500	overt	942.0000	1130394	私の前に現れると
950.9050	10.2000	overt	950.9100	1141086	私は安心してそれに溶け込みそれと合一することができるしかし音のような無形態なものが迫ってくると私は身を引くのだ
961.7050	4.9800	overt	961.7100	1154046	昼間の面積な海は私を喜ばせるが夜の見えない
967.7650	2.9100	overt	967.7700	1161318	海の滞きは私に恐怖を与える
971.6050	4.8300	overt	971.6100	1165926	何か芸術の教授にサーディスティックなものと
977.0050	2.7900	overt	977.0100	1172406	まずフェスティックなものがあると
980.9650	6.9000	overt	980.9700	1177158	すると私は明瞭に前者であるのに音楽愛好家はマゾヒストなのではないだろうか
988.3750	7.4700	overt	988.3800	1186050	音楽を聴く楽しみは包まれ包容され刺されることの純粋なたしなみではなかろうか
996.6850	6.6300	overt	996.6900	1196022	命令してくる上官にひたすら受動的であることの喜びではなかろうか
1004.5150	4.7400	overt	1004.5200	1205418	いかなる種類の音楽からも私は開放感を感じたことがない
1010.6350	5.7900	overt	1010.6400	1212762	学生時代に応援歌を歌わされると私の俊神は
1017.7150	2.1600	overt	1017.7200	1221258	縮小するように思われるのであった
1021.4950	6.0300	overt	1021.5000	1225794	さて受動的な凶楽のうちでも映画となると私は安心してマゾヒストでいられる
1028.2450	2.1900	overt	1028.2500	1233894	このフィルムの上をうろつい
1031.7250	1.1400	overt	1031.7300	1238070	うつろいゆく
1035.4450	6.1800	overt	1035.4500	1242534	人間の発明した画像のうちで最も安全な最もその場限りのものである
1042.6150	1.0500	overt	1042.6200	1251138	今日の映画で
1044.1750	5.3100	overt	1044.1800	1253010	死刑ゴ分前にギャングどもが脱獄する有様は刺激的だった
1050.4450	3.7500	overt	1050.4500	1260534	しかし私は精神に毒を与えるような映画をかつて見ない
1057.5550	4.4400	overt	1057.5600	1269066	感覚を毒されるぐらいのことが何ほどのことがあろうか
1248.4450	1.7100	overt	1248.4500	1498134	ナナ月ニ日晴れ国賞
1250.9650	3.2100	overt	1250.9700	1501158	昨夜ジューサン時間眠り今日はイチ日
1276.4050	3.0000	overt	1276.4100	1531686	お迎えの委員の院長が
1281.4750	2.4600	overt	1281.4800	1537770	運長がナナジューハチ歳で
1284.8050	2.5500	overt	1284.8100	1541766	昨夜狂心症で亡くなった
1288.1950	5.2500	overt	1288.2000	1545834	ついにサン日前まで暑い日ざかりをノロノロ歩いて
1294.2250	4.9500	overt	1294.2300	1553070	いられるのに道であったものだ今夜はつやでハチ時ごろ急に
1300.1050	4.8000	overt	1300.1100	1560126	三美歌の合唱がその庭の子たちの影から起こった
1308.0850	1.3500	overt	1308.0900	1569702	少年時代から
1309.9450	6.0900	overt	1309.9500	1571934	青年期の初めにかけて私はいつも主の少年と顔を付き合わせていたような気がする
1316.9350	4.5000	overt	1316.9400	1580322	どうして死が急に私の脳裏から遠ざかってしまったのであろうか
1322.0950	4.5000	overt	1322.1000	1586514	私は恩長を信じていてむやみとニジュー歳で死ぬように思い込んでいた
1327.4050	10.9500	overt	1327.4100	1592886	ニジュー歳を過ぎてからもこの考えがしばらく糸を引いたしかし今では恩中も奇跡も一切信じなくなったので死の観念が私から遠のいた
1341.5650	9.7500	overt	1341.5700	1609878	いよいよ生きなければならぬと決心した時の私の絶望と幻滅はニジューヨン歳の青年の誰もが味合うようなものであった
1352.3050	6.2100	overt	1352.3100	1622766	青年の自殺の多くは少年時代の死に関する激しい共栄心の残影である残像である
1360.2250	2.9400	overt	1360.2300	1632270	絶望から人はむやみと死ぬものではない
1363.7350	4.7100	overt	1363.7400	1636482	私は青年期以後を初めて確固とした肉体的健康を得た
1369.2550	1.1400	overt	1369.2600	1643106	こういう人には
1372.7050	2.9100	overt	1372.7100	1647246	生まれつき健康な人間とは別の
1376.2450	1.9800	overt	1376.2500	1651494	心理的規制があって
1379.6950	5.1900	overt	1379.7000	1655634	自分は今や肉体的健康だから肉体的に健康だから
1385.9950	3.6300	overt	1386.0000	1663194	サジに対して鈍感になる権利があると考え
1390.3450	2.7300	overt	1390.3500	1668414	そんなふうに自分を鳴らしてしまうのである
1394.0050	10.0800	overt	1394.0100	1672806	活動的にもなり多忙にもなったが決してそのためだけではなく私には死について考えることに対するいわりのない軽蔑が生じた
1407.2350	5.2200	overt	1407.2400	1688682	世間の俗人のようにいつか多忙と生徒を混同しながら
1413.1450	5.0400	overt	1413.1500	1695774	一方私の死の欲求にはますます現実離れの下
1419.0250	2.2500	overt	1419.0300	1702830	子供らしい無双が絡まる
1422.1450	1.1700	overt	1422.1500	1706574	に任せた
1425.8350	5.6400	overt	1425.8400	1711002	ちょうどもう住まなくなった館にツタが生い茂るに任せておくように
1432.4350	5.1600	overt	1432.4400	1718922	そして私は私の哲学的思考から
1438.2550	2.5200	overt	1438.2600	1725906	すっかり身を引き離してしまった
1442.2150	5.8500	overt	1442.2200	1730658	今でも私は暇な折には望ましい死について考えることがある
1448.8150	4.4100	overt	1448.8200	1738578	それが私には望ましい生活について考えるのと同じことなのだ
1455.2050	4.3200	overt	1455.2100	1746246	晴れた朝私は幸福な気持ちで森の中を散歩している
1460.3650	5.8800	overt	1460.3700	1752438	念のために言っておくが私は午前中に目を覚ましたこともなく散歩したことは一度もなく
1467.0550	1.9800	overt	1467.0600	1760466	家の近所に森などはない
1487.2450	1.5300	overt	1487.2500	1784694	さて森の中では
1489.2850	2.3100	overt	1489.2900	1787142	誰かが銃の手入れをしている
1492.2250	2.7000	overt	1492.2300	1790670	私はもちろんそんなことは知らない
1495.7350	1.2000	overt	1495.7400	1794882	銃が暴発する
1497.4450	5.1000	overt	1497.4500	1796934	弾丸が全く偶然に私の背中から入って心臓に突き刺さる
1503.7150	3.6600	overt	1503.7200	1804458	私はころりと死んでしまう自ら死ぬとも知らずに
1508.4850	10.1100	overt	1508.4900	1810182	流れ玉による死ということはこの純粋な他殺のシチュエーションは私にとって考え抜かれたことで幸福な精神の態度の善的な
1519.4650	1.8600	overt	1519.4700	1823358	税人としての死なのである
1521.8650	1.5000	overt	1521.8700	1826238	少年時代には
1523.9050	3.8700	overt	1523.9100	1828686	私も自分の英雄的な死を夢見たこともあった
1556.2150	5.1600	overt	1556.2200	1867458	暑い小説の資料にいるので午後日本楽器へ
1562.4550	1.9500	overt	1562.4600	1874946	過激名曲集
1565.7250	2.3100	overt	1565.7300	1878870	男性編女性編を買いに行く
1568.8750	7.7400	overt	1568.8800	1882650	スタンダール例えばその各所風の短編バニナバニナバニニを撮ってみてもいい
1577.1850	8.3400	overt	1577.1900	1892622	目の輝きと漆黒の紙によって一目してローマの人と分かる一人の娘が女に
1587.8050	3.4800	overt	1587.8100	1905366	娘が父に連れられてセンハッピャクニジュー
1591.9150	1.1700	overt	1591.9200	1910298	X年の
1593.6550	1.2600	overt	1593.6600	1912386	春の酔い
1598.7550	3.1200	overt	1598.7600	1918506	B公爵の舞踏会へ現れる
1603.4050	6.1800	overt	1603.4100	1924086	その美人たちの中からそれは第イチ位の美人を決めようということになり
1611.5050	6.0600	overt	1611.5100	1933806	ついに漆黒の神と燃えるような瞳を持った戦国の娘バニナバニニ姫が
1618.1950	5.4000	overt	1618.2000	1941834	当夜の女王ということになったこうした物語性は小説における
1624.1050	7.7700	overt	1624.1100	1948926	描写の価値について絶望を感じさせるバニナバニにはその夜会でローマ第一美女となる
1632.5050	4.4100	overt	1632.5100	1959006	その説明は漆黒の神ともえるような瞳の他には何もいらない
1637.5150	4.8900	overt	1637.5200	1965018	たちまち物語はローマ第一の美女の周りに
1645.0450	2.7600	overt	1645.0500	1974054	いかなる貴重な男の行動も
1648.4950	3.8700	overt	1648.5000	1978194	この前提のもとにやすやすと是認される
1653.9250	4.3500	overt	1653.9300	1984710	ニジュー世紀ではラディゲがこの方法を取った
1659.7450	3.8700	overt	1659.7500	1991694	ドルジェル博の舞踏会のヒロインたる
1664.5450	4.5300	overt	1664.5500	1997454	真青についてどんな具体的な描写もないのである
1669.7950	4.8300	overt	1669.8000	2003754	私が数年前フランスの映画監督アンドレカイアッドと
1675.6450	2.2800	overt	1675.6500	2010774	議論したのもこの点であった
1678.7050	8.1300	overt	1678.7100	2014446	美女という時ある男は太った女をある男は痩せた女をある男は背の高い女を
1687.5550	2.1900	overt	1687.5600	2025066	ある男は背の低い女を
1691.9950	1.0800	overt	1692.0000	2030394	それぞれただ
1694.8450	1.4100	overt	1694.8500	2033814	こっちに想像する
1697.9350	1.4700	overt	1697.9400	2037522	小説は書くて
1700.8150	3.0000	overt	1700.8200	2040978	最小限の描写によって
1710.3550	3.1500	overt	1710.3600	2052426	感覚的想像力を無限に広げる
1715.3650	1.2600	overt	1715.3700	2058438	映画はしかし
1717.4950	1.6800	overt	1717.5000	2060994	それを限定してしまう
1720.4050	4.9200	overt	1720.4100	2064486	映画には植物的に一人の一定の女が
1726.1950	1.8300	overt	1726.2000	2071434	登場するに過ぎぬ
1730.6950	3.3300	overt	1730.7000	2076834	芝居のように紛争や照明や
1734.5950	2.3400	overt	1734.6000	2081514	観客との距離などによって
1737.5950	3.6600	overt	1737.6000	2085114	想像力の余地の残すことをしない
1741.9750	9.9000	overt	1741.9800	2090370	映画はイメージを限定して押し付けるだから小説の映画化には根本的な矛盾があると言ったのだがかいやっとは消復しなかった
1779.9250	3.6900	overt	1779.9300	2135910	私は今でもこの理論を撤回する気持ちはさらさらない
1784.2450	11.9100	overt	1784.2500	2141094	しかし読者の想像力を刺激するこのような懸命な方法は小説固有の方法かというとそこで私はまた迷わざるを得ない
1915.7650	4.1400	overt	1915.7700	2298918	映画の植物性と逆の植物映がスタンダールや
1920.8050	3.3300	overt	1920.8100	2304966	ラディゲの方法にはへそんでいるのではあるまいか
1927.0450	4.9200	overt	1927.0500	2312454	なぜかというとローマ第一の美女というふうに断定される
1934.7250	3.5100	overt	1934.7300	2321670	ことによって刺激される我々の想像力は
1938.9250	1.9500	overt	1938.9300	2326710	そっけない歴史の技術や
1941.7150	3.8400	overt	1941.7200	2330058	単なる科学的技術から呼び
1946.1850	3.0900	overt	1946.1900	2335422	冷まされるそれと同種のものではあるまいか
1950.2350	3.2100	overt	1950.2400	2340282	順前たる小説的世界の中だけの
1954.3750	2.1300	overt	1954.3800	2345250	人物のアクチュアリティを
1957.8250	2.1300	overt	1957.8300	2349390	保証する方法ではなくて
1960.7650	5.5200	overt	1960.7700	2352918	それは小説的世界をいつも現実に委ね
1967.1850	9.1800	overt	1967.1900	2360622	現実的存在のアクチュアリティを持ってそれを裏側から保証しようとする一種の歴史的方法ではあるまいか
1978.7650	2.3700	overt	1978.7700	2374518	バルザックははるかに思い切りが悪い
2001.7750	1.1700	overt	2001.7800	2402130	半を糸わず
2005.4650	1.0500	overt	2005.4700	2406558	引用するが
2007.7450	3.2400	overt	2007.7500	2409294	モデストミニオンの恐るべき描写
2070.9550	6.4200	overt	2070.9600	2485146	艶消しの金色の髪が人目を引く彼女は確かに言えばお懸念するための
2078.1850	2.4000	overt	2078.1900	2493822	ために言うのだろうと思われるが
2081.4550	1.5900	overt	2081.4600	2497746	あの天両にも
2083.6750	2.9700	overt	2083.6800	2500410	なせ欲しいと称される金髪の
2087.3350	5.1600	overt	2087.3400	2504802	肌はといえば肉の上に貼られた
2095.1050	1.2300	overt	2095.1100	2514126	ひぬ髪が
2098.2250	4.4700	overt	2098.2300	2517870	手に目をねたませて見る目の太陽に
2103.3250	1.6800	overt	2103.3300	2523990	当たると花やぎ
2108.6350	3.3900	overt	2108.6400	2530362	合うと震えるのにさも似た
2112.8350	3.5100	overt	2112.8400	2535402	シュスのような肌の女性の仲間に属している
2227.7050	1.3800	overt	2227.7100	2673246	スルの羽の
2230.6150	6.6000	overt	2230.6200	2676738	ように軽くイギリス風に巻き毛にしたその紙の下の額は
2237.9050	6.0000	overt	2237.9100	2685486	それこそ清らかな格好をしているのでコンパスで線を引いたかと思われるばかりで
2244.6850	2.6400	overt	2244.6900	2693622	主層の光で輝いて
2251.3450	4.8600	overt	2251.3500	2701614	いつも慎み深く静けさの極平穏なほどである
2257.2850	8.1600	overt	2257.2900	2708742	とはいうがいつどこでこれ以上に淡白なこれほど透明な明確さを持った額を見ることができたであろう
2266.2250	3.2400	overt	2266.2300	2719470	それには真珠のように艶があるように思われる
2270.3650	4.0800	overt	2270.3700	2724438	灰色がかった青の子供の目のように澄んだ両の目は
2275.2850	3.6300	overt	2275.2900	2730342	よみなりの眉毛の線に調和して子供らしい
2281.2550	3.9900	overt	2281.2600	2737506	いたずらけと無邪気さをすっかり見せていた
2286.1450	3.8700	overt	2286.1500	2743374	その眉毛の反りがまた筆で描いた品画の
2290.6750	3.2700	overt	2290.6800	2748810	人物の眉の根と同じような
2294.9350	2.2200	overt	2294.9400	2753922	上り方の根によって
2298.6850	3.0900	overt	2298.6900	2758422	わずかにそれと示されているだけなのだ
2303.4850	3.3600	overt	2303.4900	2764182	こういう最地に飛んだあどけなさはその上なお
2307.8050	1.0200	overt	2307.8100	2769366	目の周りや
2316.0850	3.9300	overt	2316.0900	2779302	米紙のこういう繊細な肌色に限ってみられる
2320.7050	2.7000	overt	2320.7100	2784846	青く網目の入った真珠
2370.1150	8.2200	overt	2370.1200	2844138	の指揮長によって一段と引き立っている顔立ちはラファイロがその聖母像のためにあれほどしばしば
2380.9750	9.2700	overt	2380.9800	2857170	卵形で頬骨の暗いうゆいしベンガルのバラのように甘美が色のせいで特に際立ってみえるる
2391.2650	1.4100	overt	2391.2700	2869518	しかもその頬骨の
2393.1850	1.4700	overt	2393.1900	2871822	色の上には
2395.2250	2.3100	overt	2395.2300	2874270	透き通ったまぶたの長いまつげが
2398.2850	2.8500	overt	2398.2900	2877942	光と揺れ混じった影を落としていた
2403.4750	3.5400	overt	2403.4800	2884170	首はその時曲げられていたが
2407.7950	5.3700	overt	2407.8000	2889354	ほとんど日弱いと言えるくらいで父のような
2413.7650	3.2400	overt	2413.7700	2896518	白さを帯レオナルドダビンチの好んだ
2417.5150	2.9100	overt	2417.5200	2901018	あの影に消えそうな線を思い出させる
2421.3250	1.2600	overt	2421.3300	2905590	ジューハチ世紀の
2423.9950	3.6900	overt	2424.0000	2908794	漬けぼくろのような細かいいくつかのそばかすが
2428.5850	2.8500	overt	2428.5900	2914302	モデストはまさに地上の娘で
2433.2050	3.0600	overt	2433.2100	2919846	イタリアの天使サンビハノが
2437.1650	4.8600	overt	2437.1700	2924598	夢見たあの生き物ではないということを語っている
2445.4150	1.4700	overt	2445.4200	2934498	彼女の唇は
2447.4250	2.3100	overt	2447.4300	2936910	少々人をバカにしているみたいで
2460.0550	8.6100	overt	2460.0600	2952066	最近走ってもいれば厚ぼったくもあったが肉の快楽を表している別の費用なわけではなく
2469.3250	7.1100	overt	2469.3300	2963190	柔軟な彼女の胴体はコルセットで病的な圧迫を加えることによって成功を超え
2477.0650	2.9400	overt	2477.0700	2972478	願うあの娘たちの胴体のように
2480.6950	2.5800	overt	2480.7000	2976834	母たることの脅威とはなっていなかった
2484.6250	1.1100	overt	2484.6300	2981550	麺まじるの
2486.9650	1.7400	overt	2486.9700	2984358	絹織田の
2490.8350	1.3200	overt	2490.8400	2989002	鋼だの
