onset	duration	trial_type	wav_onset	sample	value
2492.7550	1.5900	overt	2492.7600	2991306	締めひもだのは
2497.1050	1.1400	overt	2497.1100	2996526	風に揺られる
2498.8450	1.4400	overt	2498.8500	2998614	ポプラの上鍵の
2501.0050	2.1600	overt	2501.0100	3001206	優美さんにもなぞえられるべき
2504.9650	2.5200	overt	2504.9700	3005958	優美さの伸びつ
2508.8050	3.7200	overt	2508.8100	3010566	うねりつする線を巡化しているだけで
2513.7250	1.8900	overt	2513.7300	3016470	作成しているのではなかった
2521.4950	2.7300	overt	2521.5000	3025794	真珠のような灰色でさくらんぼ色の
2525.2750	2.1300	overt	2525.2800	3030330	組紐を飾りにつけた
2528.8450	1.9200	overt	2528.8500	3034614	立ち方の長いローブは
2532.8350	3.3900	overt	2532.8400	3039402	低粛層に銅の形を描き出し
2536.8250	4.3800	overt	2536.8300	3044190	まだ少々肉の薄い肩を肩に義ぬで多いそのおかげで
2546.1850	8.0400	overt	2546.1900	3055422	襟足が肩につくその付け根の最初の丸見しか見ることが許されなかった
2555.2450	2.2200	overt	2555.2500	3066294	バラ色の鼻口の開いた
2558.1550	1.3800	overt	2558.1600	3069786	小鼻の輪郭の
2560.2250	3.2400	overt	2560.2300	3072270	ふっかりしたギリシア型の花が咲きました
2564.7550	1.1400	overt	2564.7600	3077706	何か知らん
2566.6150	2.1000	overt	2566.6200	3079938	最適なものを放っている
2569.7350	1.0800	overt	2569.7400	3083682	このおぼろげで
2571.3550	4.2300	overt	2571.3600	3085626	しかもリハツそうな顔つき神秘的と言っていいくらいの
2576.3350	2.5800	overt	2576.3400	3091602	額に見上げる市場が
2580.2950	4.6200	overt	2580.3000	3096354	口元の肉欲的な表情によって半ばその偽りを
2585.9050	3.3600	overt	2585.9100	3103086	暴かれている顔つきあどけなさと何もかも
2589.8350	1.6500	overt	2589.8400	3107802	心得た長所とが
2592.2350	4.8000	overt	2592.2400	3110682	瞳の変化に飛んだ深々としたノズラを奪い合っている顔つきを見たら
2597.9050	3.4500	overt	2597.9100	3117486	観察者はこのあらゆる物音に
2602.4350	5.4000	overt	2602.4400	3122922	目覚ませられる油断のない敏感な耳を備え
2608.4950	2.8200	overt	2608.5000	3130194	理想の青い花の匂いに向かって
2612.6050	8.3400	overt	2612.6100	3135126	花の開かれている娘はあらゆる日の出の周囲で戯れる死と日中の労働の間
2621.6650	6.5400	overt	2621.6700	3145998	幻想と現実との間で行われる戦いの舞台であるに違いないと考えたことであろう
2657.7550	5.6100	overt	2657.7600	3189306	モデストは好奇心も周知心も強く自分の宿命を心へ
2666.6350	3.2400	overt	2666.6400	3199962	締結さに満ちた娘だったのだ
2670.5950	3.3300	overt	2670.6000	3204714	ラファイロの少女というよりむしろエスパー
2674.6750	2.3700	overt	2674.6800	3209610	ニアの少女だったのだ
2681.2750	1.0500	overt	2681.2800	3217530	投手役
2699.2750	2.5200	overt	2699.2800	3239130	なんと原稿用紙ヨン枚
2702.8750	2.5200	overt	2702.8800	3243450	ここを読む私に思い出されるのは
2765.5450	2.7600	overt	2765.5500	3318654	一夜物語の四辺のような
2769.6250	4.5900	overt	2769.6300	3323550	均等風の肉体的神秘主義であって
2774.9050	3.4800	overt	2774.9100	3329886	決してジューキュー世紀の実証主義ではないのだ
2788.5250	4.5300	overt	2788.5300	3346230	こういう描写をするときバルザックは恐ろしいほど現実を信じていない
2820.2950	1.2900	overt	2820.3000	3384354	この無双かの
2823.6550	8.5200	overt	2823.6600	3388386	魂は想像の義務と責任に課られ何もかも自分で作り出しそれも小説の
2837.0950	4.1400	overt	2837.1000	3404514	加工世界の内部で作り出さなければならないのだ
2841.9250	4.8300	overt	2841.9300	3410310	こういう描写を読むとバルザックがまるで一定の材料でしか
2847.3550	3.4800	overt	2847.3600	3416826	巣を作らない鳥のように現実への移任を
2854.2850	1.5000	overt	2854.2900	3425142	けっぺけに知りぞけ
2856.4750	7.6200	overt	2856.4800	3427770	言葉だけで丹念に巣を編み上げているその孤独な仕事が目に見えるようだしかもそのまるで勇気的
2864.8750	2.1600	overt	2864.8800	3437850	連冠を犠牲に起用した
2867.9950	1.3500	overt	2868.0000	3441594	各細部の
2871.9550	1.4400	overt	2871.9600	3446346	美詞的描写は
2874.1450	7.2600	overt	2874.1500	3448974	イチ個の人間の肉体的魅力の解明というよりは我々に私的感情をもたらす
2881.9150	2.4000	overt	2881.9200	3458298	物証の組織家であり
2885.0050	4.3200	overt	2885.0100	3462006	モデストミニオンの美しい髪額眉
2890.1050	3.2100	overt	2890.1100	3468126	すね唇胴肩鼻などは
2894.6950	6.0900	overt	2894.7000	3473634	徐々にモデストの所有を離れてバルザックの思想の継承になるのである
2901.4150	13.6500	overt	2901.4200	3481698	私はこの頃ではだからいたずらにスタンダールによって描写に絶望するよりもワルザックによって小説家が描写に対して持つべき信仰のようなものを少しずつ理解するようになった
2915.8450	2.3100	overt	2915.8500	3499014	しかしこの方法の困難は
2919.2050	2.8200	overt	2919.2100	3503046	覚も行き届いたイメージが何
2922.6850	3.0900	overt	2922.6900	3507222	読者に何ほどの共感を起こさせ
2926.5850	6.8400	overt	2926.5900	3511902	またよし起こさせたとしても細部に至るまで正確にそのイメージが読者の心のうちに
2933.9650	4.0200	overt	2933.9700	3520758	持続し得るかという問題であるナナ月ヨン日
