onset	duration	trial_type	wav_onset	sample	value
1336.9815	4.4120	listening	1336.9940	1604378	私はもうたくさん持っているので金貨は結構です
1342.4855	3.7720	listening	1342.4980	1610983	農家の奥さんは決して金貨を受け取ってくれませんでした
1347.8615	6.1400	listening	1347.8740	1617434	そこで悪魔の親分は別の家に行き金貨と魚を交換してもらおうとしました
1355.1575	4.6360	listening	1355.1700	1626189	お願いだからこの金貨と魚を交換してくれないかね
1360.3095	2.7480	listening	1360.3220	1632371	おなかがすいて死にそうなんだ
1363.7975	7.5800	listening	1363.8100	1636557	私のうちにはそんな金貨で遊ぶような子供はいないしもう家にはたくさんの金貨があるからいらないね
1372.1815	6.5880	listening	1372.1940	1646618	代わりにうちで働いてくれるんだったら魚のイチ匹やニ匹好きに持っていても構わないよ
1381.2055	6.7160	listening	1381.2180	1657447	悪魔の親分は働くことが何よりも嫌いだったのでこう言われたことに腹を立てました
1388.9815	14.1720	listening	1388.9940	1666778	俺様がお金をやるというのにどうしてお前たちはそろいもそろって受け取らないんだ金さえあれば何でも買えるし誰でも働かせることができるのにまったくバカな奴らばっかりだ
1404.6615	3.2920	listening	1404.6740	1685594	そう言って家を飛び出した悪魔の親分でしたが
1408.4695	3.2600	listening	1408.4820	1690163	おなかがすいてとうとう倒れてしまいました
1413.2055	3.6120	listening	1413.2180	1695847	するとこのことがイワンの耳に入りました
1418.1335	3.9000	listening	1418.1460	1701760	人々はイワンのところへ来て心配そうにこう言いました
1423.3175	4.9560	listening	1423.3300	1707981	王様どういたしましょうあの立派な商人が道で倒れています
1429.0135	5.5640	listening	1429.0260	1714816	あの人は山ほどの金貨を持っていますが働くのが嫌いで何も食べるものがないそうです
1435.3815	4.3800	listening	1435.3940	1722458	このまま放っておいてはそのうちお腹がすいて死んでしまうでしょう
1440.5975	5.4680	listening	1440.6100	1728717	それは大変だねじゃあみんなでかわりばんこにごはんをめぐんであげようよ
1447.7655	1.9160	listening	1447.7780	1737319	こうするしかありませんでした
1451.2855	5.9800	listening	1451.2980	1741543	悪魔の親分は代わり番子に家を回ってご飯を食べさせてもらうことになりました
1459.6695	3.6760	listening	1459.6820	1751603	そのうちにイワンの家にも順番が回ってきました
1465.1095	4.1240	listening	1465.1220	1758131	悪魔の親分がごちそうをもらおうとイワンの家にやってくると
1469.7815	3.5480	listening	1469.7940	1763738	ちょうど妹のマルタが食事の支度をしていました
1474.9975	6.5880	listening	1475.0100	1769997	マルタは自分の家にお客さんが来るとその人の手をじっくりと見るようにしていました
1483.2215	4.6680	listening	1483.2340	1779866	手を見ればその人がどれだけ仕事を頑張っているかが分かるからです
1489.5575	3.5480	listening	1489.5700	1787469	仕事を頑張っている人は手がゴツゴツしているし
1493.7175	4.5720	listening	1493.7300	1792461	そうでない人はまるで赤ちゃんのようなきれいな手をしているのでした
1499.9895	3.8360	listening	1500.0020	1799987	悪魔の親分の手は仕事をしていない人の手でした
1505.1095	3.0360	listening	1505.1220	1806131	すべすべして爪が長く伸びています
1509.4295	3.6440	listening	1509.4420	1811315	マルタは顔をしかめて心の中でこう思いました
1514.4535	3.7080	listening	1514.4660	1817344	この人の手は全然仕事をしていない人の手だわ
1518.9335	2.9080	listening	1518.9460	1822720	そんな人にごちそうするなんてお断りよ
1523.3495	4.8280	listening	1523.3620	1828019	マルタは悪魔の親分の前には食事を運んであげませんでした
1529.6855	3.9960	listening	1529.6980	1835623	それを見ていたイワンの奥さんが悪魔の親分に言いました
1535.4455	1.3720	listening	1535.4580	1842535	ごめんなさいね
1537.5255	5.1480	listening	1537.5380	1845031	マルタはごつごつした手を持つ人のところにしか食事を運ばないんです
1543.8615	1.7880	listening	1543.8740	1852634	でもお待ちくださいね
1546.6455	4.9560	listening	1546.6580	1855975	みんなが食べ終わったらあなたには後でその残りをあげますから
1552.9175	3.7720	listening	1552.9300	1863501	悪魔の親分はひどく気分を悪くし叫びました
1557.6855	3.2600	listening	1557.6980	1869223	残り物を食べるなんてまるで豚じゃないか
1561.8455	3.8040	listening	1561.8580	1874215	それからポカンとしている岩に向かって怒鳴りつけました
1566.7415	3.9320	listening	1566.7540	1880090	みんながみんな手を使って働くなんて全く馬鹿げている
1571.2215	5.1800	listening	1571.2340	1885466	こんなふうになってしまったのは王様のあんたがバカだからだ
1577.2055	2.1080	listening	1577.2180	1892647	賢い人は何を使うか知っているか
1579.9895	11.5480	listening	1580.0020	1895987	さあ僕たちはみんなバカだからそんなことは分からないよ僕たちの仕事は大体手を使ってするものだからねだからお前たちはバカなんだ
1592.1495	9.2120	listening	1592.1620	1910579	そうだ俺様が頭で働く方法を教えてやろうそうすれば手で働くより頭を使った方がどんなに得だか分かるだろう
1602.6135	4.8600	listening	1602.6260	1923136	イワンは手を使わないで働く方法があると知ってびっくりしました
1608.5015	7.7400	listening	1608.5140	1930202	そんな方法があるんだねだったらあなたが僕たちをバカだというのも無理はないかもしれないね
1617.2695	3.2600	listening	1617.2820	1940723	悪魔の親分は調子に乗ってしゃべり続けました
1621.2695	3.5800	listening	1621.2820	1945523	しかし頭で働くのは簡単なことじゃない
1625.4615	13.3720	listening	1625.4740	1950554	俺様の手がゴツゴツしていないからといってあんたたちは私に残り物を食べさせるようだが頭で働くことは手を使うのより何百倍も難しいということを知らないのかね
1639.6375	3.4520	listening	1639.6500	1967565	時には頭が割れるほどくたびれることもある
1644.5655	2.9080	listening	1644.5780	1973479	イワンはそれを聞くと不思議そうに言いました
1648.5335	3.9000	listening	1648.5460	1978240	どうしてそんなに大変な思いをしてまで頭を使うんだい
1653.3655	3.9640	listening	1653.3780	1984039	それよりも手を使ってもっと楽な仕事をすればいいのに
1658.0055	7.0040	listening	1658.0180	1989607	俺様が頭を使うのはあんたたちみたいなバカどもがかわいそうだからだよ
1665.7495	7.8680	listening	1665.7620	1998899	俺様が頭を使って仕事をする方法を教えてやろうそうすればあんたたちの暮らしも少しは楽になるだろう
1674.2295	7.8680	listening	1674.2420	2009075	そうなんだじゃあ僕たちに教えておくれよ頭で仕事ができるなら年を取っても平気だもんね
1684.8215	5.7240	listening	1684.8340	2021786	悪魔は人々に頭を使って働く方法を教えることを約束しました
1692.0535	5.5960	listening	1692.0660	2030464	早速イワンは国の人々に知らせるためにこんなお触れを出しました
1699.4775	7.0680	listening	1699.4900	2039373	みんなに頭を使った働き方を教えることのできる大変立派な先生がいらっしゃった
1708.2455	7.2600	listening	1708.2580	2049895	先生がおっしゃるには手を使うよりも頭を使う方がずっと仕事ができるそうだ
1716.9815	4.5720	listening	1716.9940	2060378	みんなはこの先生のところに行ってよく勉強すること
1723.4775	3.5800	listening	1723.4900	2068173	イワンの国には一つの高い塔がありました
1728.3415	6.3320	listening	1728.3540	2074010	イワンは国中のみんなに聞こえるようにその塔のてっぺんに立って教えるよう頼みました
1735.8615	6.0440	listening	1735.8740	2083034	そこで悪魔の親分は長い階段を登って塔のてっぺんに立ちました
1743.3175	5.1480	listening	1743.3300	2091981	人々は偉い先生の話を聞こうと唐の麓に集まっています
1750.4215	5.8520	listening	1750.4340	2100506	あの先生が頭を使って働く方法を見せてくれるらしい
1756.8855	1.3400	listening	1756.8980	2108263	それは驚きだ
1758.8055	3.1320	listening	1758.8180	2110567	一体どんなふうに頭を使って働くというのだろう
1763.7975	4.1560	listening	1763.8100	2116557	悪魔の親分は人々を見下ろしながら話を始めました
1770.6455	6.8120	listening	1770.6580	2124775	どうすれば働かないで生活することができるのかということを繰り返し繰り返し話すだけで
1778.0055	2.7480	listening	1778.0180	2133607	実際にやってみせることはありませんでした
1782.2295	4.8280	listening	1782.2420	2138675	みんなは悪魔が何を話しているのか全く分かりませんでした
1788.2775	1.8840	listening	1788.2900	2145933	まったくがっかりしたよ
1791.4455	7.4520	listening	1791.4580	2149735	やがて人々は悪魔の親分の話を聞くのをやめてそれぞれの人に戻っていきました
1800.5655	4.1880	listening	1800.5780	2160679	悪魔の親分は来る日も来る日もしゃべり続けました
1806.0375	10.8120	listening	1806.0500	2167245	頭を使って働くことができるなら当然パンの用意くらいはできているだろうとみんな思っていたので誰も悪魔に食べ物を持っていきませんでした
1818.4535	5.4040	listening	1818.4660	2182144	人々はすっかり興味をなくして誰も塔の近くに寄りつかなくなりました
1825.5255	4.5400	listening	1825.5380	2190631	お腹がすいた悪魔の親分はすっかり弱ってしまいました
1831.6055	6.4920	listening	1831.6180	2197927	足元がフラフラするので何もないところでつまずき頭を塔の柱に強く打ちました
1839.6695	4.0920	listening	1839.6820	2207603	その様子を見た近所の奥さんがイワンの奥さんに知らせました
1844.8855	2.5240	listening	1844.8980	2213863	イワンの奥さんはイワンに言いました
1848.5015	4.2200	listening	1848.5140	2218202	あの先生がとうとう頭で仕事を始めたようですよ
1853.5575	2.0440	listening	1853.5700	2224269	へえ本当かな
1856.5015	1.6920	listening	1856.5140	2227802	どうやっているのか見てみよう
1859.7655	3.4200	listening	1859.7780	2231719	イワンは早速馬に乗って塔の麓まで行きました
1864.4695	2.5560	listening	1864.4820	2237363	イワンが塔に着いたちょうどその時
1867.8615	3.8680	listening	1867.8740	2241434	悪魔の親分は力を使い果たして倒れてしまいました
1872.7895	7.1320	listening	1872.8020	2247347	そしてゴロゴロと階段を転がり落ち頭をガツンガツンとぶつけながら下まで降りてきました
1881.3655	1.1160	listening	1881.3780	2257639	すごいや
1883.1255	4.5400	listening	1883.1380	2259751	本当に頭を使って働いているねだけど大丈夫かな
1888.5655	2.8120	listening	1888.5780	2266279	頭が割れるほど大変だって言ってたけど
1891.9255	3.0360	listening	1891.9380	2270311	これじゃあ本当に頭が割れちゃうんじゃないかな
1896.0855	1.9480	listening	1896.0980	2275303	イワンは心配して言いました
1899.2855	5.6280	listening	1899.2980	2279143	悪魔の親分は地面に頭を打つとそのまま地面に吸い込まれてしまいました
1906.3255	1.4360	listening	1906.3380	2287591	そしてその後には
1908.2775	4.3160	listening	1908.2900	2289933	ぽっかりと開いた大きな穴がイチつだけ残りました
1914.4215	4.9880	listening	1914.4340	2297306	穴のそばに立ちイワンは頭をポリポリ書きながら言いました
1920.4055	4.9240	listening	1920.4180	2304487	また悪魔だったのかあいつは立派なことばかり言っていたけれど
1925.9735	2.3000	listening	1925.9860	2311168	結局全部嘘だったんだな
1931.3175	3.0360	listening	1931.3300	2317581	イワンは今でもまだ生きています
1935.7015	3.2920	listening	1935.7140	2322842	大勢の人たちがイワンの国に集まってきます
1940.2775	6.0120	listening	1940.2900	2328333	長男の指紋や次男のタラスもイワンを頼ってイワンの国へとやってきました
1947.0935	1.4680	listening	1947.1060	2336512	いいともいいとも
1949.8775	3.5480	listening	1949.8900	2339853	イワンはもちろんお兄さんたちを迎え入れてあげました
1954.7415	6.6520	listening	1954.7540	2345690	そして食べ物をくださいと言ってくる人には誰にでもこう言って受け入れてあげるのです
1962.5175	1.5320	listening	1962.5300	2355021	いいともいいとも
1965.1095	1.8840	listening	1965.1220	2358131	僕の国で一緒に暮らそう
1967.7335	2.1080	listening	1967.7460	2361280	食べ物ならどっさりあるからね
1972.3095	3.8040	listening	1972.3220	2366771	イワンの国には一つだけ特別な決まりがありました
1978.6775	5.2120	listening	1978.6900	2374413	どんな身分の人であっても手がゴツゴツした人は食事をすることができますが
1984.6615	1.5320	listening	1984.6740	2381594	そうでない人は
1986.8055	6.1400	listening	1986.8180	2384167	どんなに偉くても他の人の食べ残しを食べなければならないという決まりです
