onset	duration	trial_type	wav_onset	sample	value
4155.9992	3.3600	overt	4156.0200	4987199	居室へつながるドアの前に立つと
4159.8692	5.4600	overt	4159.8900	4991843	その向こうから人の気配がする彼らは眠ってはいないようだ
4186.7492	10.8450	overt	4186.7700	5024099	佐伯はニヤニヤと笑いながらそのおのごを握り私が好きなのはメスじゃないオスなんだってねあの男は犬をハックしていたんじゃなくて犬に
4197.5942	10.8450	overt	4197.6150	5037113	彼は僕らに見くばせをして合図を送ってから鍵を開けそして
4211.4692	1.7100	overt	4211.4900	5053763	ドアを開け放った
4218.8192	4.0800	overt	4218.8400	5062583	ライフルを構えた僕たちは一斉に部屋になだれ込む
4227.9392	4.5600	overt	4227.9600	5073527	部屋の中は薄暗かったマリファナの匂いが立ち込め
4233.0692	4.4700	overt	4233.0900	5079683	どこかのスピーカーがレゲーを鳴らしていた
4239.4892	1.2600	overt	4239.5100	5087387	レギーかこれ
4252.2692	3.4200	overt	4252.2900	5102723	彼らは揺らめくランプの炎を取り囲み
4256.4992	6.0000	overt	4256.5200	5107799	あるものはぐったりと背もたれによりかかりまた別のものは
4266.3092	3.4500	overt	4266.3300	5119571	煙の立ち上がるものを加えている
4274.1092	17.1900	overt	4274.1300	5128931	竜剣士は町のチンピラ上がりだが彼もその仲間たちも昔を彷彿とさせるラフな遺伝たちで安っぽいアクセサリーをジャラジュラと身につけ肌のレズミを露出させている
4296.3092	3.1800	overt	4296.3300	5155571	この中で僕が狙うのは竜拳士
4300.4492	3.3900	overt	4300.4700	5160539	彼はトレードマークのマスクをしていなかったが
4324.7492	3.5100	overt	4324.7700	5189699	そのおかげですぐに本人だと断定できた
4330.5692	8.3100	overt	4330.5900	5196683	危険な場所に立ちる時部下に自分のマスクをかぶらせて理想するのはよく彼が使う手だ
4345.3892	8.1900	overt	4345.4100	5214467	そうでなくとも蛇行で別の人間にかぶらせるなどしていたら僕たちは判断を間違える可能性がある
4412.7092	4.4700	overt	4412.7300	5295251	しかし特殊変異によって生じた額の口は
4417.7192	3.8100	overt	4417.7400	5301263	他の誰とも見間違えることのないものだった
4422.2792	3.7200	overt	4422.3000	5306735	僕たちは手にしたライフルを竜に向ける
4429.2992	3.6300	overt	4429.3200	5315159	彼はちょうどドアが視界に入る
4433.8292	2.0400	overt	4433.8500	5320595	場所に座っていて
4464.1892	7.2600	overt	4464.2100	5357027	彼はちょうどドアが視界に入る場所に座っていて僕らの姿は両目でしっかりと確認したが
4473.0692	1.8300	overt	4473.0900	5367683	何もできなかった
4477.2992	7.6800	overt	4477.3200	5372759	能力を使うことさえできたかどうかテーブルに置いた銃に手を伸ばそうとしたその体をいくつかの
4490.3792	1.7700	overt	4490.4000	5388455	銃弾が貫いた
4495.0292	2.8500	overt	4495.0500	5394035	僕らの手にした武器は
4500.2492	3.6600	overt	4500.2700	5400299	狩猟に使うプレチャージュ式の空気銃だ
4505.4692	3.4200	overt	4505.4900	5406563	事前にポンプで空気を圧縮しておき
4509.4292	3.7200	overt	4509.4500	5411315	雪金を引くとその圧力で弾が飛ぶ
4516.2992	6.1800	overt	4516.3200	5419559	海外製のシカヤクマさえも仕留めることができる大光景のものを
4546.0292	2.9100	overt	4546.0500	5455235	さらに改造励力を上げている
4550.0192	4.2900	overt	4550.0400	5460023	当然どこにも火薬は使われておらず
4556.0192	7.2600	overt	4556.0400	5467223	流の能力を使ってもいつものように暴発させようとしたところでできるものではない
4574.4992	4.3200	overt	4574.5200	5489399	彼のようなタイプAでもこうして銃弾の的になるしかない
4586.4092	1.2000	overt	4586.4300	5503691	かきを
4635.2492	1.8300	overt	4635.2700	5562299	必要
4662.3092	15.5700	overt	4662.3300	5594771	今日彼のような台北へでもこうして銃弾の的になるしかないその優れた能力で幾多もの修羅場をくぐってきたタイペイといえども肝心の能力が使えない上に
4686.1292	6.9900	overt	4686.1500	5623355	手の内を知り尽くした組織の同士が油断した時を狙えば負けないものだ
4695.5492	15.6300	overt	4695.5700	5634659	竜の体が後ろ向きに倒れるがそれが完全に倒れるのを待たず僕たちは彼のためだけに用意したエアライフルを捨てて第ニの武器を取り出したそれは小型のサブマシンガンだった
4717.0892	11.9100	overt	4717.1100	5660507	空気中のマガジンにはゴ発装填できた構造上一発撃つごとに威力が落ちるマガジンイチつ分程度の数の銃弾なら刺す
4728.9992	11.9100	overt	4729.0200	5674799	殺傷力を維持したまま打ち終えることが可能なのは前もってテスト済みだけれどもこうした室内の乱戦で使い続けるには心もとない
4743.2192	6.9300	overt	4743.2400	5691863	連射能力が低く一発打つごとにレバーを引いて新しい弾を
4752.2792	2.8200	overt	4752.3000	5702735	装填するという余計な動作もある
4761.0092	10.4700	overt	4761.0300	5713211	新しく取り出したサブマシンガンはそれこそ雨のように銃弾をばらむくことができ室内での制圧力は圧倒的だった
4773.3092	4.6800	overt	4773.3300	5727971	しかも相手はあまり鼻によって動きも判断力も鈍い
4778.6792	10.8600	overt	4778.7000	5734415	彼らを仕留めるのは銃でテルローリストを殺すコンピューターゲームレッドファイヤーのファーストステージをイージモードでクリアするよりはるかに簡単な仕事だ
4794.8492	15.3600	overt	4794.8700	5753819	瞬く間に竜のそばにいたもう一人スキンヘッドの南米人はハチの巣となってがっくりと崩れ落ちルーとしたテーブルの銃に手を伸ばした核狩りのアジア人が次の犠牲者となった
4813.8692	9.8100	overt	4813.8900	5776643	他のメンバーは銃弾の雨の中とっさにソファの裏に隠れるなどしてひとまず視界から姿を消した
4824.6992	4.1700	overt	4824.7200	5789639	僕は視界が光るで
4869.2492	6.0000	overt	4869.2700	5843099	僕は視界が光で満ちあふれなんとも魂が輝くような
4876.5392	2.0100	overt	4876.5600	5851847	水筒管を
4880.2292	15.2700	overt	4880.2500	5856275	糖水感を感じたそれは興奮剤のせいだけでなく脳内にドーパミンが分泌されているからだ例えばギャンブルで体筋をかけた時登山などをして
4898.1092	1.9200	overt	4898.1300	5877731	石の瀬戸際に
4900.7792	7.2300	overt	4900.8000	5880935	立たされた時そういった極限状態になると何とも言えない幸福感を覚える
4925.0492	11.7000	overt	4925.0700	5910059	その結果スルルというものが自分の生きている実感だと勘違いをする若がよくいるが単に脳内麻薬でらりっているだけのことだ危険のなく
4936.7492	11.7000	overt	4936.7700	5924099	この中でないと生きる実感がないとか格好をつけているやつは単にこの分泌物による中毒で日常が物足りなくなっているだけだ
4952.4392	5.5800	overt	4952.4600	5942927	僕ら人間はそもそもハッピーな気持ちで快感に満たされながら
4958.6492	5.1600	overt	4958.6700	5950379	危険を犯し殺し合うことができるように作られている
4971.1892	4.7700	overt	4971.2100	5965427	それは肉体の問題でありそこに思想的真実はない
4977.8192	4.3500	overt	4977.8400	5973383	この暴力を行使している瞬間の
4989.6992	1.5000	overt	4989.7200	5987639	透水管は
4995.8192	7.1400	overt	4995.8400	5994983	盗水管は何とも不快だ僕はどうしても好きになれない早く終わらせたくて仕方がない
5003.8592	15.1800	overt	5003.8800	6004631	姉妹の言葉によれば敵はロク人すでにサン人を倒したから残るはサン人佐伯のめくばせに従ったソファーに銃弾を送り込んだ
5023.3892	2.8200	overt	5023.4100	6028067	ソファーはなかなかに頑丈で
5027.1692	3.1800	overt	5027.1900	6032603	僕らの武器では貫通したか怪しい
5031.0092	14.4300	overt	5031.0300	6037211	僕が手を挙げ一旦銃撃をやめさせて気配を伺うと不意にソファーの向こうに一人が立ち上がり部屋の向こう側へ向けて逃げようとする
5069.1392	2.4300	overt	5069.1600	6082967	しかし最近はそれを許さない
5073.4292	4.9800	overt	5073.4500	6088115	銃を構えるとその背中に銃弾を命中させた男は
5079.1292	8.3100	overt	5079.1500	6094955	顔から床に倒れ胸に開いた穴から止めどもなく流れる血液がすぐに黒い水たまりを作った
5088.9392	13.8300	overt	5088.9600	6106727	それにしてもなんと素早く正確なことか彼の身体能力はタイプB顔負けであるのだがしかしその瞳は金色にはなっていない何か秘密があるのだと思うが僕はそれを知らない
5104.6592	4.3800	overt	5104.6800	6125591	再び部屋に静寂が戻るもう視界には動くものがいない
5112.9392	7.6200	overt	5112.9600	6135527	しかしまだ警戒が必要だお互いが目くばせをしたところでソファーの向こうから洗い呼吸音が聞こえてくる
5121.5492	1.8000	overt	5121.5700	6145859	まだ生きているが
5124.6692	16.8600	overt	5124.6900	6149603	このまま障害物越に銃撃を再開するか回り込んで確実にクリアリングするか判断を求めて再起に視線を送ったところでおいちょっと待ってくれソハーの向こうから恐怖に震える声がした
5150.4392	10.5300	overt	5150.4600	6180527	誰か知らないが助けてくれ俺は竜の部下じゃないたまたま遊べに来ていただけなんだもう怪我もしているとても抵抗なんかできやしない
5164.2692	4.2000	overt	5164.2900	6197123	僕はもう一度佐伯の顔を見た彼は顔を横に振る
5171.3492	6.3600	overt	5171.3700	6205619	分かったわ助けてあげるだから両手を頭の後ろに重ねて立ち上がってちょうだい
5178.3992	1.3800	overt	5178.4200	6214079	佐伯は
5365.6592	9.2700	overt	5365.6800	6438791	佐伯は労働と通る声でそう呼びかけた無理だ足に弾が当たってとても立ち上がれない
5376.2492	2.6100	overt	5376.2700	6451499	できないならいいわさようなら
5380.8992	4.3500	overt	5380.9200	6457079	待ってくれやってみるから待ってくれ
5387.7692	7.6200	overt	5387.7900	6465323	なんでこんなソファーの向こうの荒い木にうめき声が混じりそしてしばらくその人物は
5397.1292	1.2600	overt	5397.1500	6476555	そして
5400.8192	1.4700	overt	5400.8400	6480983	しばらく
5441.8892	13.8900	overt	5441.9100	6530267	そしてようやくその人物はよろよろと立ち上がったそこにいるのは筋肉の流々としたたくましい男でよほど痛むのか顔や肌にびっしりと汗を浮かべる
5455.7792	13.8900	overt	5455.8000	6546935	その苦痛にうがむ顔には金色に光るみがあったタイプBなのであろうやったぞだから命だけはやればできるじゃない
5471.4092	12.8400	overt	5471.4300	6565691	再起や無表情に銃を上げると正確な射撃で彼の顔面を打ち抜いたするともソファーの向こうに気配はなくなったしかし計算ではあとイチ人残っているはずである
5486.1692	8.2800	overt	5486.1900	6583403	佐伯はさほど緊張の見えない顔で僕に目くばせをすると軽い足取りでソファーの向こうを覗いた
5495.6792	4.6500	overt	5495.7000	6594815	そしてまた僕たちを見てどうやら終わってたよねと言った
5503.5692	3.0600	overt	5503.5900	6604283	僕はため息をつき彼に近づく
5507.6192	3.5700	overt	5507.6400	6609143	そして自分の目でソファーの裏を確認すると
5511.9392	4.3800	overt	5511.9600	6614327	そこに転がっていたのは若い女の死体だった
5517.3692	2.9400	overt	5517.3900	6620843	僕はその死体を爪先で
5521.7492	5.5800	overt	5521.7700	6626099	そしてゴロリと転がすと血まみれの顔がこちらを向いた絵
5529.9092	10.7400	overt	5529.9300	6635891	僕は言葉を失う頭がくらくらとする振り返ったのは僕が予想していたのと全く違う見覚えのある顔だったのだシュー
5542.4192	9.1800	overt	5542.4400	6650903	そうそれは僕の妹だどうしてこんなところになぜ死んでいる僕は彼女のためにこんなことをしているんだぞ
5553.6092	1.6800	overt	5553.6300	6664331	いやそんなはずはない
5559.1592	10.7700	overt	5559.1800	6670991	ここに妹がいるはずがない僕は目を閉じそして開くするとさっき妹の周期の顔に見えていたものが全く別の顔になっていた
5569.9292	10.7700	overt	5569.9500	6683915	僕はほっと内心でため息をつくどうしたの佐伯が僕を見つめているいや何でもない僕は同様を隠して冷静を予想
5583.8792	4.9200	overt	5583.9000	6700655	こいつは竜の娘だな確か竜がジューナナ歳の時に産ませた
5589.5492	3.1200	overt	5589.5700	6707459	娘だったはずだからジューゴ歳か
5598.9992	4.1100	overt	5599.0200	6718799	そうそれは随分と気の毒な場所に合わせてしまったものね
5603.6792	8.9400	overt	5603.7000	6724415	佐伯はそう言うと肩をすくめるともあれ全ての仕事はこれで終わった僕は緊張から解き放たれため息をついた
5618.0192	3.6900	overt	5618.0400	6741623	今日公共はタバコに火をつける
5622.3392	11.8800	overt	5622.3600	6746807	リントッケンは携帯電話を取り出して誰かにメールを打ち始めた部屋のマリハナの匂いは敵の撃った銃の消炎の匂いでだいぶ
5635.0892	6.1800	overt	5635.1100	6762107	打ち消されてはいたがゆっくりとしたレゲーのBGMは相変わらずだった
5641.9892	7.3800	overt	5642.0100	6770387	その一方で目に映る光景はさっきとは全く違う死体の転がる生産な殺人現場となっている
5656.0292	9.5100	overt	5656.0500	6787235	先ほどまでここでくつろいでマリファナアス部に汚じていたロク人もの人間は一瞬にして血を流す死体に変わっていた
5666.0792	8.4000	overt	5666.1000	6799295	彼らはもう人間としては存在せずこれらの日系は微生物たちの養分となって腐れ行く
5678.1092	15.7200	overt	5678.1300	6813731	こんな場面を犯行者がアップロードしたネットの映像や新聞の記事で見たことはあるが制作者の一人として現場に立つことになるとは思わなかった今僕はどういう心境なのだろうか
5694.9692	15.0000	overt	5694.9900	6833963	僕はどけない少女だった死体をじっと見つめた見事に頭を打ち抜かれ顔は全くわからなくなっているがその派手めの服装はこの辺りの少女の流行を取り入れたもので
5724.0392	3.9900	overt	5724.0600	6868847	普段は普通の若者として遊び歩いていたのだろう
5728.5392	6.1800	overt	5728.5600	6874247	ここに遊びに来ていなければ明日からも同じように遊べたに違いない
5739.1892	9.2700	overt	5739.2100	6887027	それからその父だった死体を眺めた百戦錬磨の彼にしてはあまりに油断しすぎているようにも思えたがまあ無理もないか
5756.1992	5.9700	overt	5756.2200	6907439	今はどこかと構想しているわけでもないし彼が頻繁にトラブルを起こす市民たちは
5762.7092	7.6800	overt	5762.7300	6915251	普通はイエスの名を恐れて復讐などしないまさか執行部が先代の場
5919.0092	3.3600	overt	5919.0300	7102811	まさか執行部が仙台の場
5923.3892	3.7500	overt	5923.4100	7108067	適した幹部である自分に
5929.8692	4.2000	overt	5929.8900	7115843	暗殺者を差し向けるなんて想像もしなかったろう
5935.8692	6.9300	overt	5935.8900	7123043	もっと警戒をしていれば僕らは襲撃自体を諦め彼もまた明日を
5943.3392	1.7400	overt	5943.3600	7132007	明日を生きれたろう
5946.0092	6.9300	overt	5946.0300	7135211	僕も自らの手で彼を殺すことになるとはほんの数日前まで想像していなかった
5954.3492	4.0800	overt	5954.3700	7145219	この竜剣士という人物のことはさほど嫌いではなかった
5959.2992	6.9900	overt	5959.3200	7151159	凶暴で頭は悪いけれどその直上的でシンプルな人間性はむしろ好きな方だ
5967.1892	15.7650	overt	5967.2100	7160627	子供の時からその豪快な人柄は噂として聞いていたあまり気にしないことです今日公共が僕にそう話しかけたこの世界はそういうものです理性を失った理由がいけない
5982.9542	15.7650	overt	5982.9750	7179545	何も気にしてないよ気にするかと思っていたけどそうでもないその代わりちょっと思い出した何をですか子供の時のことだよ昔八川の岬
6074.2292	13.9800	overt	6074.2500	7289075	八つ川のほとりにヌートリアが増えたことがあったでしょうあれを捕まえたことがあるんだヌトリア大きなネズミというかカピパラというかそんな動物だよ
6088.2092	13.9800	overt	6088.2300	7305851	みんなは肉に興味があった僕は哺乳類の内臓が教科書で見た通りになっているのか確かめてみたかった
6103.4492	3.7800	overt	6103.4700	7324139	それでみんなで自転車で繰り出したんだ
6150.1292	4.5300	overt	6150.1500	7380155	彼は僕の意図が読めず生返事をする
6157.9892	11.7000	overt	6158.0100	7389587	僕らは別に動物をいじめたかったんじゃなくて魚を食べるために釣りを行ったり食用ガイルが案外うまいと聞いてみんなで石を投げ込んだのと同じような雰囲気だったと思う
6171.2492	13.4700	overt	6171.2700	7405499	普段は猫や犬に石をぶつけたりといった弱いものいじめにはみんな抵抗があるような感じだったんだけれど食べるとなると不思議なものでそういう感覚はなくなるんだ分かる
6185.2592	10.7550	overt	6185.2800	7422311	僕は彼の返事を待たずに続けるそれで一匹捕まえることができたみんな偉い興奮してたよ押さえつけて棒で殴り殺してから
6196.0142	10.7550	overt	6196.0350	7435217	僕がナイフを手に取って解体したんだ今思い返してみればあれが僕にとって初めての動物の解剖実験だったんだな
6207.4292	17.2800	overt	6207.4500	7448915	まあそれはともかく腹を押さえたところでそいつがメスだったってのが分かったんだ何でかっていうと子宮から胎児がゴロゴロと出てきたんだよ僕は今日を振り返るみんな気持ち悪かったけど
6225.8792	4.5300	overt	6225.9000	7471055	焼いて見て味がうまいと分かると全部食った
6231.0692	5.2200	overt	6231.0900	7477283	なんとなくその時の気持ちを思い出してぼーっとしていたんだ今
6236.9192	17.6700	overt	6236.9400	7484303	彼は眉間に手話を寄せて困惑の表情を作るまあそれだけです別に遺体を解剖して人間の内臓を見てみたいと思ったっていう話じゃないよそれは分かってますが今日は生返事を返す
6255.2192	3.6300	overt	6255.2400	7506263	とにかく僕を心配する必要なんかないんだ
6261.6092	10.3950	overt	6261.6300	7513931	本当は僕は前に一度だけ人を殺したことがあるしその時計銃も使ったそして僕は傍らに倒れていた椅子を起こして
6272.0042	10.3950	overt	6272.0250	7526405	腰をかけようとしたが足のイチ本が銃弾で打ち砕かれていてうまく立たせることができなかった
6282.9692	2.0700	overt	6282.9900	7539563	僕はため息をつくる
6289.0292	5.6400	overt	6289.0500	7546835	とにかく作戦としては完全な形で遂行することができたわけだ
6295.5692	7.5300	overt	6295.5900	7554683	予定したことがその通り完了しただけでそれほど嬉しくもないが
6303.6392	3.3300	overt	6303.6600	7564367	一つの成果を出したことには変わらない
6310.4192	5.2500	overt	6310.4400	7572503	これは全ての始まりだこれで僕は正式にファミリーの一員となったのだ
6332.1992	3.3900	overt	6332.2200	7598639	腱腸が抜けるにつれてじわじわと
6338.4092	9.3600	overt	6338.4300	7606091	体内に疲労が満ちていく脳を麻痺させていたドーパミンの影響が消え世界に満ちあふれていた光が消えていく
6357.1892	10.4700	overt	6357.2100	7628627	そんな中気がつけば才木がデジカメを手に持って生産な部屋の前傾をそして死体の一つ一つを撮影している
6368.8292	3.7200	overt	6368.8500	7642595	もういいんじゃない作戦完了の報告写真は
6373.4792	14.0550	overt	6373.5000	7648175	もう十分撮れたはずだ僕が訪ねると彼は笑顔を作るこれは趣味趣味私は時間がある時はいつも殺した相手の写真を撮っているのよ大事なメモリーだからねいい趣味だそうでしょう
6387.5342	14.0550	overt	6387.5550	7665041	彼はくすくすと笑い撮影を再開したぼんやりそれを眺めているとだんだんまぶたが重くなってきたなんてことだろうこんな時に例の睡魔がやってきてしまったらしい
6402.3692	6.5100	overt	6402.3900	7682843	なんだか眠くなったイチ時間くらいここで眠っても安全だと思う最近に尋ねると
6411.0392	16.6600	overt	6411.0600	7693247	まあ大丈夫かなしかしこんな地獄絵図みたいな部屋の中で眠たくなるなんて初仕事だっていうのになんて開けれた人なのかしら僕だってそう思ういくら終わったとはいえ今さっきまで殺し合いの興奮の真っただな
6427.6992	16.6600	overt	6427.7200	7713239	まだ興奮在のピークだってまだケキ目が切れていないはずだどんな精神構造をしているのかと自分に通ってみたい眠くなったんだからしょうがないよそういうほかない実際それは嘘偽りのないそっ直な感想だ
6444.3592	16.6600	overt	6444.3800	7733231	僕は細気が驚くのを知り目に銃弾を受けて穴だらけになったソファーを手で払い血液で濡れていないのを確認してからごろりと横になるするとすいまはすぐに僕の意識を消し飛ばした
6462.9692	8.3700	overt	6462.9900	7755563	眠りから冷めた僕の目にまず入ってきたのはいつの間にか部屋にやってきていた子姉妹の姿だった
6471.9092	17.1225	overt	6471.9300	7766291	彼女らは青ざめた顔でこちらを見つめておりそして僕が何も口にするまでもなく初仕事を見事でした
6489.0317	17.1225	overt	6489.0525	7786838	相手によくぞご無事でと順番に口を開くありがとうでも夜中に完全武装して襲ったんだからまあ当然だよ相手が本気で警戒してたら分からなかったけどねご謙遜その時僕は子姉の表情が異常に怖ばっているのに気がついた
6506.1542	17.1225	overt	6506.1750	7807385	こういうのは慣れていないのかい僕が尋ねると彼女らは申し訳なさそうにうなずきかし姉妹で交互に話すお恥ずかしい話ですが私たちはいつもクリス様のそばで不審者の接近を見
6523.2767	17.1225	overt	6523.2975	7827932	このように襲撃に参加するのは初めてなのですそうか彼女らはその能力で敵の生命が一つずつ消えていく様を見ていたのだろうショックを受けるのは無理もないさ
6541.8092	3.6300	overt	6541.8300	7850171	不信徳者から守るために殺すのと
6546.9692	6.7500	overt	6546.9900	7856363	無警戒な相手を襲って殺すのは全然違うからね今日は早めに帰ってゆっくり休んだらいい
