onset	duration	trial_type	wav_onset	sample	value
4.8692	5.1600	overt	4.8900	5843	ああああ
31.2692	15.8400	overt	31.2900	37523	クリステの主産生理について話し合っていたところ何やら重要な電話が入ったと仙台の死後も引き続きロンタウの住者のような仕事をしている霊々が取り付いた
48.4892	11.0100	overt	48.5100	58187	相手は暗闇通りでいくつかの飲食店を営む有力オーナーである
61.0292	8.8200	overt	61.0500	73235	それは本当のことですか電話を受けたジェフリーが青数字の入った額にしわを寄せる
71.8592	6.6900	overt	71.8800	86231	酢がを切った後彼は苦い顔で自体を説明した
79.3292	6.4200	overt	79.3500	95195	どうも龍玄師が酔っ払って店で大暴れをしたようです
93.7292	18.8700	overt	93.7500	112475	暗闇通りのバーで一人で酒を飲んでいた竜研師が他の客を連れていた女にその客の目の前で声をかけ大喧嘩を叱し顔の特質変異を隠すためにいつもつけている仮面もせず
119.5292	10.6200	overt	119.5500	143435	仮面をせずに別のものでごまかしていたらしくその時点では客も店員も彼の正体に気がつかなかったのだ
131.0492	6.8100	overt	131.0700	157259	初めからケンカを吹っかけるつもりでトレードマークの仮面をしなかったのかもしれない
140.1692	13.3500	overt	140.1900	168203	とにかく若い頃からケンカの強いことで知られる竜剣士は散々に相手をやっつけ喧嘩相手は女を置いて命から逃げ出したということだ
162.6992	7.4700	overt	162.7200	195239	大立ち回りを演じた店の設備は散々に破壊され相手の血で汚れ
171.1292	3.7800	overt	171.1500	205355	大変なありさまとなった
190.5392	1.7700	overt	190.5600	228647	こう立ち回る
193.3892	1.8900	overt	193.4100	232067	お演じた
197.3492	3.6900	overt	197.3700	236819	それについて当然天使が苦情を言ったが
201.6092	10.6200	overt	201.6300	241931	彼はこの天使も殴り倒しそして堂々と自分の名を告げ奪い取った女をさらうようにしてその場を去ったという
213.9392	5.0400	overt	213.9600	256727	ひどいな被害者には気の毒だが竜剣師らしい話だ
219.5492	3.6600	overt	219.5700	263459	僕は思わず笑ってしまったがジェフリーは
224.3492	5.0400	overt	224.3700	269219	その師匠にため息をつき首を横に振る
234.4592	19.8900	overt	234.4800	281351	その店は昔からしっかり常納金を納めてくれていて仙台とも付き合いがあったその店でこんな大騒ぎをされたらYSに払う店はなくなるこれは懲罰者ですよ
255.2492	2.1300	overt	255.2700	306299	懲罰とは穏やかじゃない
262.6292	12.4500	overt	262.6500	315155	酒で酔って女を奪おうとケンカを吹っかけるなどありえないことですそもそも部下も連れずに一人でふらりと飲みに行くのがあまりに不用意です
275.0792	12.4500	overt	275.1000	330095	YSの重要な立場にある人間ですこんなくだらないことで騒ぎを起こすようではとてもその知恵にふさわしいとは言えません
290.2292	12.9600	overt	290.2500	348275	それは最もだけれど町の人間は竜圏師が昔どういう人間だかみんな知っている今更評判どうこうって話でもない
304.4492	15.0700	overt	304.4700	365339	そもそも彼は先代の死を悲しむあまり飲みすぎたんだろうある守備団みたいなもんじゃないかそれは理由にはなりません幹部としての振る舞いができないのならばふさわしい
319.5192	15.0700	overt	319.5400	383423	そもそも彼は最初から器ではなかったのですジェフリーが異様な緊張感で怖かった顔でそう言った
334.5892	15.0700	overt	334.6100	401507	この人間を降格させるとなれば大事だが本気でやるつもりらしいこれからは大変な時期になります彼のような無法物を重要な地位につけたをままにしておくのは危険です
352.3292	11.4000	overt	352.3500	422795	そしてジェフリーはすぐにロンタオでマイケルツエの名で竜研師を呼び出すとイチ時間ほどで本人が執務室に姿を現した
364.5092	5.8800	overt	364.5300	437411	この日はトレードマークの仮面を身につけておりその表情こそ伺えなかったが
372.1592	12.6300	overt	372.1800	446591	背を丸めてポケットに手を突っ込むという姿でマイケルスへの前に立ち自分の不機嫌さを隠そうともしなかったなぜ呼び出したか分かっていますね
385.4192	8.1000	overt	385.4400	462503	ジェフリーは感情の気を薄せた冷たい表情でそう尋ねたさっぱり分かりませんね
394.0892	2.6400	overt	394.1100	472907	竜がフテックされているようだった
403.2992	8.9700	overt	403.3200	483959	先日飲食店で老舗を働いた件に関してです記憶にありませんなどこからそんな話を聞いたんです
412.7792	10.3200	overt	412.8000	495335	随分派手にやったらしいですね我々としては無視できない案件ですああなるほどオーナーのヤンかやっぱりそうですか
423.0992	10.3200	overt	423.1200	507719	文句があるなら俺に直接来いと言ったのにあの野郎普段はおべっかばっかり使ってるくせにくだらない告げ口なんかしやがって
435.0692	4.4700	overt	435.0900	522083	暗露は話を漏らした人間への怒りを表にする
440.6792	12.1200	overt	440.7000	528815	自分の縄張りの店で老舗を働くだなんて我々の根幹を否定する行為です相応の責任を取っていただきます言い分があるならば聞きますが
454.6292	3.3900	overt	454.6500	545555	ジェフリーの冷徹な声に流は下打ちをして
458.8292	4.7700	overt	458.8500	550595	なんであんたばっかりしゃべってるロンタウの意見はないんですか
464.1692	3.0000	overt	464.1900	557003	私の言葉はロンタウのご意見です
468.0992	2.5200	overt	468.1200	561719	ロンターミューに聞いてるんですがね
471.9092	8.0700	overt	471.9300	566291	私はウォン君と同意見だ軽率だと思うマイケルツヤーはそれだけ言ってあとは困った顔で黙ってしまう
481.3292	6.6600	overt	481.3500	577595	これじゃ副話術の人形だよクリス様ならこんな情けない茶番はしなかった
489.6992	5.1600	overt	489.7200	587639	ルーケン氏ロンタウェの侮辱は口角だけでは済まないのを知ってますか
495.7292	6.0300	overt	495.7500	594875	これは失礼侮辱ではないんですよただ先代が懐かしくなっただけでしてね
502.2692	4.5300	overt	502.2900	602723	どんな理由であれロンタウの前では言葉は慎みなさい
507.6392	19.6200	overt	507.6600	609167	気に触ったとおっしゃるのなら謝罪しますしかし本人がぼーっと座っているだけで側近が全部決めるだなんて新しいロンタウはお飾りか何かなんですかね随分頼りないものですな龍賢師殿いや重ねが失礼
527.9492	2.4000	overt	527.9700	633539	竜は奥をそうに礼をする
532.1492	3.5100	overt	532.1700	638579	話がそれだけなら帰らせてもらっていいですかね
536.8292	7.7700	overt	536.8500	644195	もう寝服してる間にサボってしまった仕事がたまっているんですよ結構処分は後で連絡します
545.2292	14.6700	overt	545.2500	654275	竜はマスクから見える口元の引きつったような笑顔を浮かべるとそのままくるりと背を向けてカツカス足音を立てて室務室を出て行ったらいいかもしれないね
560.7392	3.3600	overt	560.7600	672887	ドアが閉まったあと僕はため息をついた
567.1892	8.1600	overt	567.2100	680627	そうですなしかしあのようなチンピラの理論でチンピラの論理で逆恨みとは全く人間が小さい
577.4492	4.7700	overt	577.4700	692939	先代が出世させるべきじゃなかったと言っていたがその通りだぞな
582.8192	7.5600	overt	582.8400	699383	チンプラの頃と何も変わっていないじゃないか今は構想があるわけでもないしあんな安いらないんじゃないか
604.7492	2.7300	overt	604.7700	725699	僕が疑問を口にすると
625.4792	4.6200	overt	625.5000	750575	先代にとっては従順で有能な料件だったのですよ
632.3192	5.3400	overt	632.3400	758783	それに我々の組織はおそらくシャール王が思っている以上に
640.0892	3.0000	overt	640.1100	768107	彼のような戦闘力が必要なので
650.4992	1.2000	overt	650.5200	780599	ジフリーは
652.6292	4.1100	overt	652.6500	783155	最後の言葉を口にする時暗い目つきになった
657.6992	5.3700	overt	657.7200	789239	彼は我々のために汚い仕事を受け負ってくれた功労者ではあります
676.2992	1.5600	overt	676.3200	811559	その言い方で
679.8092	3.3000	overt	679.8300	815771	僕は竜がどうやって出世したのか分かった
684.8492	2.7300	overt	684.8700	821819	それなら今後もやつに立つんじゃないか
689.9792	2.1000	overt	690.0000	827975	いろいろあるんだろうからさ
696.0992	7.7100	overt	696.1200	835319	難しいですね彼は我々を軽蔑していますしそれにどうも
713.3792	3.2100	overt	713.4000	856055	寮と接触しているという情報もあります
717.6692	16.0500	overt	717.6900	861203	ジェフリーを僕の知らなかった情報を口にした本来野心の強い男ですから我々よりも両指名の方を利用価値が高い相手と見ているのでしょう
735.0392	3.0900	overt	735.0600	882047	牙を我々に向いたと考えると
738.6692	3.5700	overt	738.6900	886403	力を持たせたままでいるのは危険です
760.5392	11.1600	overt	760.5600	912647	なあウン君あの竜という男がどうしても我々に従わなかったらどうするつもりなのかおとなしく降格を受け入れるようには見えなかったが
777.1892	5.5500	overt	777.2100	932627	僕たちのやりとりを横で聞いていたマイケルツエーは不安そうにそう言った
783.3092	3.8400	overt	783.3300	939971	不服だとしても拒否する権利はありません
789.4292	10.0050	overt	789.4500	947315	彼は他の幹部とは違ってあくまでも偽証の人間なんですから議長には儀章の規定があります
799.4342	10.0050	overt	799.4550	959321	その時はこちらも覆うことは絶対に許されませんその時はこちらも規定を通り振る舞うだけです
811.4792	6.2100	overt	811.5000	973775	神戸にはしようジェフリーのきっぱりした言葉に僕は顔をしかめた
818.4092	14.9400	overt	818.4300	982091	断固として処分をしなければ我々がYSを支配していくことなど到底不可能です彼はそう言うと座った椅子に背を預ける背もたれから聞いた音が鳴る
834.0092	3.8700	overt	834.0300	1000811	その目の下にはクマが浮かんでいる
841.7792	19.9500	overt	841.8000	1010135	彼はその部分を指先でもんでからご存じのように先代を失った今我々が過去のままの立場を維持するのは非常に困難ですからね他のファミリーは現状をよしとしないものばかりですからね主流派として欠然としたいよう
862.5692	2.3400	overt	862.5900	1035083	知らしめていくほかありません
866.4692	3.0000	overt	866.4900	1039763	あんただって気乗りしてるわけじゃなさそうだ
871.9292	2.8800	overt	871.9500	1046315	祈りするしないの話ではありません
875.3792	4.1400	overt	875.4000	1050455	やらなくてはいけないことなのですマーミンはなんて言ってる
880.6592	4.3500	overt	880.6800	1056791	昔に戻ったみたいだと喜んでいますよ理解できません
885.7292	11.0400	overt	885.7500	1062875	ジェフリーはキレたようにともあれ我々がYSの執行部にいる間はいかなる造版も許しません
897.5492	7.1400	overt	897.5700	1077059	それは我々が執行部としてあり続ける以上絶対に譲ってはならないラインなのです
905.9792	7.1400	overt	906.0000	1087175	まず流研師がどう振る舞うかその結果次第では私たちの仕事が増えることになりますね
915.9992	4.3200	overt	916.0200	1099199	ジェフリーの言う結果は思ったより早く形となった
924.0092	5.1900	overt	924.0300	1108811	それからニ日後のことだ暗闇通りの飲食店のオーナーであるヤンガー
929.7692	3.3600	overt	929.7900	1115723	自宅に妻と娘の
943.5692	6.2400	overt	943.5900	1132283	自宅にて妻とニ人の娘と共に死体となって発見された
952.6292	12.7200	overt	952.6500	1143155	発見者は彼の家に食料品を届けている業者の従業員で我々とつながりの深いミスだったため警察ではなくこちらに連絡が来た
968.7092	14.7900	overt	968.7300	1162451	竜の仕業とは限らんだろう強盗かもしれん何か証拠はあったのか分けつけてきたマーミンが訪ねるとジェフリーは引き出しから重いものを取り出しどさりと机の上に置いた
994.1192	15.6600	overt	994.1400	1192943	それは透明なビニール袋で中には血で汚れた自動拳銃が入っているヤンの死体が握っていた銃ですが弾が弾草の中で暴発しています
1014.3392	2.7000	overt	1014.3600	1217207	竜の能力で間違いありません
1023.0092	5.4600	overt	1023.0300	1227611	ジェフリーは物をうつげな顔でマーミンにそう説明すると
1040.4092	8.3700	overt	1040.4300	1248491	何かしでかすだろうとは思っていましたがまさか一家皆殺しにするとは思いませんでしたね
1049.3792	4.4400	overt	1049.4000	1259255	飼い主が死んで猟犬が強犬に戻ったのさ
1054.8392	1.4100	overt	1054.8600	1265807	さてどうする
1056.9692	3.9600	overt	1056.9900	1268363	奴は言い訳の聞かないことをしでかしてくれたわけだが
1063.5092	11.3250	overt	1063.5300	1276211	どうもこうももう他に方法はありません理由は我々のビーティアYSの誇りを傷つけました
1074.8342	11.3250	overt	1074.8550	1289801	ああ私からは何もないさすがのマイケルツエもこの時ばかりは顔を緊張でこわばらせている
1086.7592	19.5600	overt	1086.7800	1304111	シャーローの意見も聞いておきましょうか僕にしても言うことは何もない黙って方をすくめた誰も反対しないのならば決定ですねジェフリーがうなずき竜原氏の処刑はすんなりと決まれば次はどうやってその処刑を行うかだ
1108.4792	12.4500	overt	1108.5000	1330175	ヒットマンを彼の住まいに送り込みましょうですが相手が相手です前線は慎重に行う必要があります何と言っても相手はそうか
1133.4392	2.9400	overt	1133.4600	1360127	そうか高根
1154.9192	5.9700	overt	1154.9400	1385903	なんといっても相手はそうかフォアコンだからな
1161.9392	13.1100	overt	1161.9600	1394327	マーミンは腕組みをして考え込む普通なら寝込みを襲うだけの簡単な仕事だがやつはサイキックだしかもただのサイキックじゃなくてあの竜健師だ
1175.0492	13.1100	overt	1175.0700	1410059	あの竜剣士だ最近の若い連中はそれだけで恐れてしまうかもしれないほらいつだったか強盗を返り討ちにした件もある
1190.8592	2.6100	overt	1190.8800	1429031	その話事実なのかい
1195.3292	6.3000	overt	1195.3500	1434395	僕も聞いたことがあるがどうもまゆつばっぽく思っていた竜賢主の武勇伝だ
1324.7492	3.6300	overt	1324.7700	1589699	彼がまだYSに入ったばかりの頃の話だ
1328.9792	4.8300	overt	1329.0000	1594775	その日流は暗黒暗闇通りで女をかい
1337.9792	1.1400	overt	1338.0000	1605575	モテルに
1356.6392	5.4600	overt	1356.6600	1627967	女を買いホテルにして込んでまさに行為を致そうとしていた
1362.8492	4.2000	overt	1362.8700	1635419	そこに銃で武装した強盗が現れたのである
1367.6192	7.2000	overt	1367.6400	1641143	彼らの目的は金だったが彼らはそれを得るどころか自分たちの命を失うことになった
1376.1692	7.1100	overt	1376.1900	1651403	竜は相手が銃で武装しサン人もいたにもかかわらず逆に射殺してしまったというのである
1383.9392	4.3200	overt	1383.9600	1660727	超能力を用いたのだろうがささまじい戦闘力だ
1390.2992	7.1400	overt	1390.3200	1668359	そしてその上で行為を再開しその死体の転がる部屋で最後までやり遂げたということだ
1404.1592	2.2200	overt	1404.1800	1684991	まあ事実だと思う
1407.7892	8.2200	overt	1407.8100	1689347	その夜流の相手をした女はおかしくなってしまってなそのあたりでナンバーワンの稼ぎ頭だったし
1417.8992	4.6200	overt	1417.9200	1701479	ナンバーワンの稼ぎ頭だったし色々と大変だったんだよ
1423.2092	2.0100	overt	1423.2300	1707851	そりゃ豪傑だな
1435.7792	14.9700	overt	1435.8000	1722935	アーロン感心してる場合じゃないとにかくあいつはめっぽう強いんだそれを倒す勇気と能力があってしかも口の硬い男が必要だ責任者はいないのかい
1452.1292	3.3900	overt	1452.1500	1742555	ただ威勢のいいやつだけならたくさんいるし
1456.5992	4.0200	overt	1456.6200	1747919	竜験師に恨みがあるやつもいるしかし
1461.4892	5.7000	overt	1461.5100	1753787	確実に仕留められる実力の持ち主となるとなかなか思い浮かばない
1468.5992	7.7100	overt	1468.6200	1762319	今まではこういう仕事は全部竜に任せていたものだが今回はあいつ自身がターゲットだからな
1477.0292	5.3700	overt	1477.0500	1772435	あいつに自分を殺させるわけにもいくまいマーミンは渋い顔をする
1483.1492	3.3300	overt	1483.1700	1779779	ハーズを出しますか被害は出そうですが
1487.5592	3.0900	overt	1487.5800	1785071	ジェフリーが言うとマーミンはうなずき
1494.7292	2.6400	overt	1494.7500	1793675	そうだなやつは危険だ
1501.7792	4.3200	overt	1501.8000	1802135	久しぶりにこの俺が自由を持って現場にバカ言っちゃいけない
1538.9192	2.5500	overt	1538.9400	1846703	僕はマーミンの言葉を遮り
1541.9792	2.8500	overt	1542.0000	1850375	じゃあ今回は僕に任せてもらおう
1546.3892	4.4400	overt	1546.4100	1855667	突然何を言い出すんですかそんなことできるわけないでしょう
1551.6092	2.2800	overt	1551.6300	1861931	ジェフリーは驚いて否定する
1554.7292	7.9500	overt	1554.7500	1865675	そうでもないよもちろん僕一人ってわけにはいかないけれどしかしシャロンや話を聞いてみよう
1564.3892	3.9300	overt	1564.4100	1877267	反対しようとするジェフリーをしとどめたのはマーメンだった
1575.9992	6.7800	overt	1576.0200	1891199	彼は称賛もなくこんなことを言い出す人間ではない何か秘策があるんだろう
1583.7692	4.9200	overt	1583.7900	1900523	その問いに僕は肩をすくめ別に秘策ってほどじゃない
1589.9492	10.5000	overt	1589.9700	1907939	ただタイプAだからってそこまで恐れる必要はないと思うんだこちらは完全ではないにしろある程度は彼の能力について知っている
1608.5492	2.9100	overt	1608.5700	1930259	でいたって銃を使えないことは変わらない
1612.1192	2.2200	overt	1612.1400	1934543	刃物で襲うつもりですか
1615.6292	11.4000	overt	1615.6500	1938755	まあそれでも奇襲をかければ倒せるかもしれませんがこちらには被害が出ます私たちは今シャルを失うわけにはいかないんですよ
1629.0992	3.3300	overt	1629.1200	1954919	ジェフリーはため息をついて首を横に振る
1637.5592	14.1300	overt	1637.5800	1965071	あいつの能力は銃を使えなくするものだってみんなそう言うけど僕はちょっと違う能力だと思っているまあ任せてくれたら分かるよそんなに被害もなくしまつできるはずだ
1653.8192	5.9400	overt	1653.8400	1984583	そこまで言うならまず作戦を伺いましょうかそれは嫌だななぜですか
1662.6092	8.9700	overt	1662.6300	1995131	そして僕がここでしゃべったらそれを別の人間にやらせるつもりでしょう冗談じゃない今回は僕がやるんだ
1673.7392	6.1200	overt	1673.7600	2008487	そうは言っても言っていただかなければ我々としても危険かどうか判断できない
1680.6092	4.9200	overt	1680.6300	2016731	僕の考えを採点しようというならそれは余計なお世話だ
1687.5092	4.1400	overt	1687.5300	2025011	僕が率直に言うと彼はさすがにムッとしたようだった
1697.0192	4.8900	overt	1697.0400	2036423	そう言ってやるなアーロンジェフリーはただ心配しているだけなんだよ
1702.8992	3.3300	overt	1702.9200	2043479	マーミーは場の空気をやら上げるようにそう言うと
1707.0992	2.7300	overt	1707.1200	2048519	ジェフリー信じてやろうじゃないか
1711.0892	8.4900	overt	1711.1100	2053307	彼はこう見えてもケンカに関しては慣れているし無謀なことをできるという人間でもない称賛があるんだろう
1721.2292	3.0000	overt	1721.2500	2065475	しかしこれはあまりにも危険だ
1725.0692	5.0700	overt	1725.0900	2070083	アーロン本当に自信があるんだろうもちろん僕はうなずき
1735.3892	4.0500	overt	1735.4100	2082467	ただ人と道具は僕の言う通り集めてほしい
1740.1892	7.4100	overt	1740.2100	2088227	どんな人間を使うかもう決めているんだな僕は返事を代わりにうなずきを返す
1749.3692	10.1700	overt	1749.3900	2099243	いやいいじゃないかやらせてみよういやむちゃくちゃですアロンを参加させるわけにはいきません将来のリーダーなんですよ
1765.0292	2.1300	overt	1765.0500	2118035	ジェフリーはなおも食い下がる
1774.5992	2.1300	overt	1774.6200	2129519	人材は確保するし
1778.5892	2.9400	overt	1778.6100	2134307	バックアップは俺が全面的に行う
1782.5792	2.2200	overt	1782.6000	2139095	処刑は汚れ仕事だが
1786.8692	3.7500	overt	1786.8900	2144243	リュウは名高い豪傑であるしそれはあるが
1791.3992	3.6900	overt	1791.4200	2149679	始末したとなれば誰もが彼を認めるだろう
1795.7192	7.5900	overt	1795.7400	2154863	まさに姉貴の後継者の初仕事にふさわしい今みたいにぼんやりお前のそばにいるだけじゃ
1805.1692	11.0700	overt	1805.1900	2166203	本人のためにもファミリーのためにもならんよ将来ボスになるにしたって実績が何もなければ誰も認めはしないそれは分かっているだろう
1817.6492	3.0000	overt	1817.6700	2181179	おいまず人材は誰が欲しいんだ
1827.6392	3.8700	overt	1827.6600	2193167	マーミンは考え込むジェフリーから俺の方へ視線を移す
1843.1792	3.1500	overt	1843.2000	2211815	まず天明と天正が必要だね
1847.0192	6.8700	overt	1847.0400	2216423	あとはニサン人荒っぽいことに実績がある人間を貸してほしいそれと
1854.3992	2.1900	overt	1854.4200	2225279	サイケがいれば間違いない
1862.6192	2.5800	overt	1862.6400	2235143	おいアルン佐伯なんかを
1880.7392	18.7800	overt	1880.7600	2256887	約束したじゃないか君が何を言っても彼を枯れるからね葬儀の時に姿を見かけたから今は近くにいるんでしょう万全を消すには彼のような経験のある優秀な本館が必要なんだ
1900.0292	7.5900	overt	1900.0500	2280035	マーミンは渋い声でうなり声を上げる分かった認めようよしジェフリーこれなら心配はないだろう
1908.6392	2.0400	overt	1908.6600	2290367	いい人選じゃないか
1916.9492	3.9900	overt	1916.9700	2300339	お前のニ人の娘はこういう場合には誰よりも役に立つ
1922.1692	2.9400	overt	1922.1900	2306603	佐伯は葛田がいないよりはマシだろう
1925.7092	2.1000	overt	1925.7300	2310851	俺とお前と姉貴
1928.5892	3.2700	overt	1928.6100	2314307	サン人の子供で最初の仕事をやろうってわけだ
1933.0892	6.0300	overt	1933.1100	2319707	あとは経験豊富な部下を何人かつければある女ら立派にやり遂げるよ
1943.3492	11.5500	overt	1943.3700	2332019	そのメンツならば佐伯を実行部隊の隊長にしてアーロンは作戦だけ立てて結果を待てばよいのでは僕が乗り込まないと意味がない
1955.4092	3.6600	overt	1955.4300	2346491	それは認められませんよあまりにも危険です
1959.8792	10.4250	overt	1959.9000	2351855	チェフリーはしぶるがしかしマーミンは譲らなかった心配はもっともだがこいつは大丈夫姉貴だって危険を意図わず仕事をして登り詰めたんだ
1970.3042	10.4250	overt	1970.3250	2364365	アロンも同じ道を歩むべきだ何よりこいつなら誰よりうまくやるだろう再起を体調にするだなんてとんでもない
1981.5092	3.6000	overt	1981.5300	2377811	ルイを取り立てたのはもともと姉貴なんだ
