onset	duration	trial_type	wav_onset	sample	value
1985.8892	10.6200	overt	1985.9100	2383067	兄貴の息子であるアーロンの手で引導を渡すのが一番筋が通ってるし奴に対する慈悲効であることは確かだからな
1997.4092	4.2900	overt	1997.4300	2396891	御曹司が資格ならば誇りも傷つくまい
2004.9392	7.8900	overt	2004.9600	2405927	僕に私にはどうしても不必要なリスクを犯すようにしか思いませんがジェフリー
2028.9992	16.8600	overt	2029.0200	2434799	まだ迷いを見せる彼に僕は言った僕を将来のロンタウとして考えているならばやらせるべきだマーミンが言う通りこのままじゃ僕のことなんか誰も信用しないそれにこんなところで死ぬのならばそもそもYSのロンタウとしてやっていく能力
2045.8592	16.8600	overt	2045.8800	2455031	迷う理由はないそうだろう全くそのとおりだ大声で賛成したのはマーミンだしかしずいぶん積極的になったなこの間まで組織に入れたくないとごねていたくせに
2063.4992	14.1600	overt	2063.5200	2476199	今だって楽しかないがやるとなったら中途半端にやるわけにはいかげんなことをしていたら自分の寿命が縮むだけだからねクリスツAの息子なんかみんな殺したくて仕方ないだろうここにいるなら僕
2077.6592	14.1600	overt	2077.6800	2493191	僕が苦しく言うとマーミンはニヤリマーミンはニヤリと笑うそこまで言うならば仕方ありませんジェフリーは神経室に身限にしわいをせながら
2092.3892	3.9000	overt	2092.4100	2510867	分かりましたしかし絶対に無茶をしないでください
2098.3892	4.4100	overt	2098.4100	2518067	竜健師サンジューニ歳生まれたのはわい地区の外れにある
2134.8392	3.0900	overt	2134.8600	2561807	溝台がいいパンチ
2138.5292	3.4800	overt	2138.5500	2566235	通称ヘドロ団地Y地区の中でも
2143.8092	4.2900	overt	2143.8300	2572571	すまはじきにされるようなろくでなしたちが住みつく
2149.1192	4.2600	overt	2149.1400	2578943	半分廃墟となった建物が彼の故郷だ
2158.3892	12.1200	overt	2158.4100	2590067	両親はそろって救いがたいジャンキーで幼い頃から虐待されて育ちジューサン歳になると銃を持ってニ人を射殺した
2176.1492	3.1800	overt	2176.1700	2611379	これが彼にとって初めての殺人だ
2180.6492	11.5800	overt	2180.6700	2616779	そのまま団地を出て暗闇通りに住みつき能力を使って不良少年たちのリーザーとなる傍ら売春宿の用心棒なども務める
2196.5792	2.5800	overt	2196.6000	2635895	身長ヒャクハチジューサンセンチ
2200.5992	6.6900	overt	2200.6200	2640719	体重はハチジューゴキロ右利き好きな音楽のジャンルはレゲー
2208.6392	4.3500	overt	2208.6600	2650367	好きな映画はサーチェン監督の港町シリーズ
2214.2792	4.1100	overt	2214.3000	2657135	タバコとマリハナを好み酒は強くはなく
2219.2292	3.3600	overt	2219.2500	2663075	知らんの毛があれ普段は自重している
2224.7492	4.6800	overt	2224.7700	2669699	土下はチェック柄のものしか履かないエトセトラエトセトラ
2230.8392	6.9300	overt	2230.8600	2677007	彼の家は暗闇通りから路地を一つ入った場所のビルの中にある
2250.7292	4.5900	overt	2250.7500	2700875	古い雑居ビルを買い取ったもので中には彼の住まいの他に
2256.3092	7.2600	overt	2256.3300	2707571	いく人かの部下の住居も入っており他の階ではダーツバーやカジノも営業している
2267.3792	5.8500	overt	2267.4000	2720855	午前ゴ時日が明ける直前の時刻にその建物を襲撃することにした
2273.7692	7.4400	overt	2273.7900	2728523	今回の作戦のために旧儀償の中で暗殺において実績のあるニ人の
2285.6192	3.0000	overt	2285.6400	2742743	本館を借り受けた
2290.9892	4.1400	overt	2291.0100	2749187	一人は普段の精肉屋をやっている射撃の名手
2301.2792	1.6800	overt	2301.3000	2761535	公共
2304.6692	2.7900	overt	2304.6900	2765603	もう一人は学生時代
2308.2692	3.6600	overt	2308.2900	2769923	クレー射撃の選手だったリン
2313.3692	2.0100	overt	2313.3900	2776043	特権
2316.4292	4.0200	overt	2316.4500	2779715	という射撃機の腕前に定評のあるニ人だ
2324.4692	4.2300	overt	2324.4900	2789363	最近YSでは高層は減ったけれども
2329.4192	3.6300	overt	2329.4400	2795303	ニ人ともこうした仕事の経験が豊富だ
2334.7292	7.6200	overt	2334.7500	2801675	これに僕の選んだ人間を足した計ロク人がビルの近くの真っ暗な路地で
2347.7192	2.6400	overt	2347.7400	2817263	うずくまるだっけ
2384.0192	1.5300	overt	2384.0400	2860823	ずくまっている
2405.4392	5.7600	overt	2405.4600	2886527	周囲にはゴミ箱から漂う生臭い匂いが漂っている
2412.0092	2.7300	overt	2412.0300	2894411	周囲の不自然な
2415.4592	13.2300	overt	2415.4800	2898551	改築を繰り返した建物はまだ夜の明けきらぬ薄暗い空を背景にいびつなシルエットを作っている
2428.6892	13.2300	overt	2428.7100	2914427	僕は再び愛知区の真っただ中に戻ってきた感じ取れる僕がささやくように尋ねるとそれまでじっと集中して能力を使っていた
2442.8192	2.7000	overt	2442.8400	2931383	天命は顔を捨てたまま
2451.2192	2.8200	overt	2451.2400	2941463	龍幹部の部屋にロク人
2454.6692	3.6600	overt	2454.6900	2945603	部下たちの教室には誰もいません
2458.8392	5.9700	overt	2458.8600	2950607	ニ階のカジノにイチ人サン階のダーツバーは誰もいないようです
2465.4392	2.9100	overt	2465.4600	2958527	ジェフリーオンのニ人の娘
2471.3792	3.6900	overt	2471.4000	2965655	天明と天宗は共に台北で
2476.1792	10.4100	overt	2476.2000	2971415	その特質変異と引き換えにレーダーのようにある程度以上の生命体を感知する能力を授かっている
2489.2892	11.9400	overt	2489.3100	2987147	僕とは子供の時からの顔を見知りだが彼女たちは幼い頃からこの能力を使うために父のそばにいたのであまり顔を合わせる機会がなかった
2506.2092	9.3600	overt	2506.2300	3007451	普段はロンタウのそばに控えて招かれざる人物の接近を許さぬよう見張っているのを今日は特別に借りてきた
2516.6492	2.0400	overt	2516.6700	3019979	竜の部屋のロク人王は
2519.2292	2.3700	overt	2519.2500	3023075	何をしているか分かるかい
2522.4692	7.3800	overt	2522.4900	3026963	具体的な行動は定かではないですがロク人とも動きが少なく部屋でじっとしています
2530.5392	13.9500	overt	2530.5600	3036647	彼女たちの感知能力は個人の姿形を見分けるようなものではなくローッドローソクの炎のように生命の存在を感じ取っているのだと聞いたことがある
2554.6892	2.0400	overt	2554.7100	3065627	だから移動しているか
2557.2992	5.1000	overt	2557.3200	3068759	止まっているかが分かるくらいでそれ以上の詳しい動作はわからないのだろう
2570.9192	11.6400	overt	2570.9400	3085103	他の部屋に誰もいないとなると部下たちを自分の部屋に呼んで酒でも飲みそのまま雑魚寝でもしているのかもしれない
2583.1592	5.1900	overt	2583.1800	3099791	またまだ起きて話し込んでいるということも考えられるが
2588.9192	6.1500	overt	2588.9400	3106703	いずれにしろ一箇所に集まっているというのは僕らにとってこの上なく好都合だ
2597.7692	7.4700	overt	2597.7900	3117323	ゴ分ほどそこで待機して彼らの動向を伺ったがやはりほとんど動きがないことから
2613.5792	4.6500	overt	2613.6000	3136295	眠っていることが確認できた彼らが置け出す前に
2618.8892	2.2800	overt	2618.9100	3142667	計画通りへ突入する
2625.5492	17.1300	overt	2625.5700	3150659	シャール王様やっぱり危険ですよ今は寝ているとはいえ相手はあのルーケンシなんです突入なんかしないで例えば毒ガスでいぶり出すとか爆弾を投げ込むとかそういう方法はないんでしょうか
2645.2592	2.7900	overt	2645.2800	3174311	天命が心配そうに言う
2654.9192	2.1300	overt	2654.9400	3185903	君は面白いことを言うね
2657.7392	18.1200	overt	2657.7600	3189287	街中で白の毒ガスをばらまくとか派手に爆発させるとか近隣住民ごと吹っ飛ばそうってのかいなかなかダイナミックで素敵なアイディアだと思うけど残念ながら僕らはテロリストではないんだ
2676.7592	2.9100	overt	2676.7800	3212111	すみませんでもシェアログ
2680.4792	2.4300	overt	2680.5000	3216575	シャリオ様が心配で
2684.0192	3.8400	overt	2684.0400	3220823	天命は謝りながらもなお不安そうにしている
2696.7392	9.2700	overt	2696.7600	3236087	よく警察とかが犯罪を起こしたタイプAを逮捕するために能力を抑える薬を使いますよね
2706.5492	2.6400	overt	2706.5700	3247859	ああいうのは手に入らないんですか
2714.1692	3.5400	overt	2714.1900	3257003	妹のテンショーが控えめに提案する
2719.1792	1.5300	overt	2719.2000	3263015	確かにあれは
2721.2192	2.3700	overt	2721.2400	3265463	確かにあれがあればベストだ
2724.5192	1.8600	overt	2724.5400	3269423	でも無理だってさ
2727.8492	1.8000	overt	2727.8700	3273419	エリーが言うには
2732.6192	3.9900	overt	2732.6400	3279143	重機や麻薬よりもよほど入手しにくい白物らしい
2749.8992	2.0700	overt	2749.9200	3299879	僕は肩をすくめて
2761.5392	3.2400	overt	2761.5600	3313847	まあそんなものなくても楽勝だと思うよ
2767.4192	14.4300	overt	2767.4400	3320903	今は不安かもしれないけれど終わってみれば僕の言う通りだったと分かるさここにはかつて将来を植防された若き高校もいるんだしそれ私のこと
2783.6192	2.9400	overt	2783.6400	3340343	佐伯がなぜか癒やそうな顔している
2788.0292	2.0100	overt	2788.0500	3345635	そうだよ期待しているんだ
2791.3592	4.8000	overt	2791.3800	3349631	嫌になっちゃうわ私期待されるのと信頼されるのは苦手なの
2798.3492	3.5700	overt	2798.3700	3358019	彼は顔をしかめ肩をすくめた
2803.8692	12.6750	overt	2803.8900	3364643	まあ私もあんたには期待してるわよ噂はいろいろと聞いてるしこの間の滑走路通りであのミドが人食い虎をやっつけた時もあんたがいたんでしょう
2816.5442	12.6750	overt	2816.5650	3379853	僕は顔をしかめるそりゃそうよでも面白いものよねここで寝ている竜はルーロンタウンの猟犬って呼ばれてたわけでしょ
2829.8792	4.8600	overt	2829.9000	3395855	虎に続いているとはよくよく猛獣退治に縁なることね
2835.9092	6.6600	overt	2835.9300	3403091	佐伯はおほほと笑うこれがまあ佐伯という男だ
2844.0992	16.7700	overt	2844.1200	3412919	どうしてあのマーミンからこんな人間が生まれたのかよくわからないがしかし能力があることは知っているくだらないおしゃべりはやめようビジネスの時間だ僕はそう宣言しそして作戦を開始した
2861.6492	6.3600	overt	2861.6700	3433979	姉妹はその場に残し残りのヨン人が突入部隊と決めてあった
2868.8192	6.3300	overt	2868.8400	3442583	襲撃を前にこの突入部隊は黄色と白色の黄色の
2876.3492	3.1500	overt	2876.3700	3451619	ニトンカラーのカプセルをイチ畳ずつ飲み込む
2890.3292	5.9100	overt	2890.3500	3468395	これはピークという興奮剤で集中力と筋力の増強が見込める
2897.1392	3.2100	overt	2897.1600	3476567	軍隊のために開発された薬で
2901.2492	10.2600	overt	2901.2700	3481499	今は町の不良の喧嘩からギャングの高層までよく使われるありふれた薬だ効果が切れた後に軽い拒絶感があるが
2912.4692	5.9100	overt	2912.4900	3494963	今回のような短い作戦ならば十分に役立つだろう
2921.3192	6.9900	overt	2921.3400	3505583	そして僕たちは裏口の側に移動する
2938.4492	17.6700	overt	2938.4700	3526139	建物に特別なセキュリティシステムはなく鍵はあらかじめ合鍵を作ってあるのでそれを使ってこの裏口から普通に侵入するだけだ僕はこの場面でふとこの作戦中に例の発作が訪れて眠れこけてしまわないかと心配になった
3000.9392	12.1800	overt	3000.9600	3601127	いつもは大体全長が現れてから意識を失うまでに失うまでゴ分くらいかかり予兆もなく突然たぼれてしまうのはめったにないが
3014.4692	8.0400	overt	3014.4900	3617363	ありえないことではない高専中に倒れてグースか眠り始めては何もかもが台無しである
3037.7492	10.9650	overt	3037.7700	3645299	可能性としては極めて薄いとしても最悪のトラブルというものは最悪のタイミングで起こるものだまあその時はその時だその場でも
3048.7142	10.9650	overt	3048.7350	3658457	持ち物の最終確認をしてお互いが無言でうなずき合うそして僕は佐伯に突入の合図でをめくばせした
3168.1892	18.8700	overt	3168.2100	3801827	彼が帳板がサビついたドアを聞いた音を鳴らしながら開くという堂々が薄暗い緑色の光で部屋を照らす裏玄関となるビルで営業する店舗の販入口として使っているのだろう
3191.0492	8.2500	overt	3191.0700	3829259	このホールの片隅には段ボールや飲料水のタンクが積まれているそしてすぐ目の前には
3199.8992	2.7600	overt	3199.9200	3839879	細く狭い階段があった
3207.1892	4.9800	overt	3207.2100	3848627	目的の流の部屋は一番上の
3213.8792	8.2500	overt	3213.9000	3856655	ヨン階にありエレベーターは設置されていないからそこにたどり着くにはこの階段を登るほかない
3223.0892	5.6400	overt	3223.1100	3867707	ニ人が肩を並べると窮屈になるこの階段を僕らは一人ずつ登った
3229.4792	4.9500	overt	3229.5000	3875375	僕らはそれぞれの肩にライフルを担いでいる
3235.6892	12.5400	overt	3235.7100	3882827	これは竜拳士を倒すために用意した特別な武器だ普通の賭けでは彼を倒すことが困難であるためエリーホワイトの協力によって急遽奪された
3251.1092	18.3900	overt	3251.1300	3901331	竜拳士はその台北へとしての能力によって遠くに設置した爆弾や重要ニ位のタイミングで動作させて目撃を攻撃したり敵対者の持つそれらを暴発させて無力化させることができる
3282.2192	11.7600	overt	3282.2400	3938663	一般的には重機や爆発物を遠隔操作する能力だと思われているようだが僕が分析した限りではちょっと違う
3295.3592	1.8900	overt	3295.3800	3954431	彼の能力は
3298.2692	2.4900	overt	3298.2900	3957923	火薬に着火するというものだ
3301.8092	10.0350	overt	3301.8300	3962171	タイプAが自分の能力を告白することは命取りだから彼自身がそう明言したことはないし僕以外でそれに
3311.8442	10.0350	overt	3311.8650	3974213	それに気がついているものがいるのかどうかも分からないが彼が能力を使った場面を考えるとほぼ間違いがない
3341.4392	18.0600	overt	3341.4600	4009727	今回の仕事が決まってから彼が能力を使った記録に当たったのだが着火するといっても何にでも火をつける能力ではないようで木材やガソリンに火をつけたという例は見られなかった大使は火薬限定なのだろう
3366.0692	17.5200	overt	3366.0900	4039283	相手が振り回す拳銃の断層内に収められた銃弾の火薬を発火させ思いのままに暴発させているところなどを見ると能力の素晴と精密性はすさましいものがあるらしい
3391.3292	7.2600	overt	3391.3500	4069595	もしかしたら彼の能力にはただ着火させるだけでなく特定の範囲内の火薬を
3399.2492	3.6900	overt	3399.2700	4079099	感知するような力も含まれているのかもしれない
3404.6492	5.1600	overt	3404.6700	4085579	その感知した火薬の中から選んだものを自由に発火できるのかもしれない
3433.9892	1.7400	overt	3434.0100	4120787	その感じた
3436.2992	14.1600	overt	3436.3200	4123559	火薬の中から選んだものを自由に発火できるのかもしれないいずれにしろ非常に優れた能力でお互い自由を手にして戦うような場面ではほとんど無敵と言っていいだろう
3451.0892	13.0200	overt	3451.1100	4141307	そうでなくとも近代兵器というのはその多くに火薬を使用しているこれらを特別な仕掛けもなしに肉体一つで操られるということは
3471.6692	7.7700	overt	3471.6900	4166003	あらゆる場面で役に立つに違いないが能力の内容さえ分かっていれば対処自体は可能だ
3479.9492	11.8500	overt	3479.9700	4175939	世間の多くの人は優れたサイケックを相手にするとなると常人とは違うというだけで必要以上のそれを抱いてしまうものだけど
3492.6992	4.7700	overt	3492.7200	4191239	誰が相手でもどんな場合でも同じことをするだけだ
3498.1892	9.0000	overt	3498.2100	4197827	そこにあるものだけを見てればいい今回用意したこの銃ならば彼の能力でも無効化することはできない
3508.6292	4.4400	overt	3508.6500	4210355	それでもその場にある他の銃は彼の思いの
3513.7292	2.9100	overt	3513.7500	4216475	ままでやるため油断はできないが
3530.2892	15.7200	overt	3530.3100	4236347	軍隊や警察の最新装備として配備されているタイプA能力を無効化にするガスを用意できればもっとよかったがこれはエリーホワイトの調達ルートを持ってしても手に入れることは不可能だった
3556.2092	19.9800	overt	3556.2300	4267451	両県で思い出したんだけどあるおかしパラシュート通りに住んでたオズワルドという男を知ってる戦闘を行く佐伯が足取れ重く空空に階段を上りながらそのすぐ後ろに行く僕に話しかけた
3582.4892	2.7900	overt	3582.5100	4298987	言いたような名前だけれど誰だっけ
3585.9692	3.8700	overt	3585.9900	4303163	萩田白人の男よ犬をたくさん飼ってた
3615.5492	19.3050	overt	3615.5700	4338659	父とちっともにないスリムな体を黒いスーツに包んだその挑発の八男男は父の強く男らしくあるべしという教育方針で物心で物心つく前から様々な流派の武術教師を雇われ
3634.8542	19.3050	overt	3634.8750	4361825	いずれも高いレベルで習得していたいや高いレベルなどという名前優しいものではなくほとんど常人離れした才能を発揮したのであるしかし肝心の男らしさは全く目につかず子供の頃から女言葉を使う
3656.8292	13.6200	overt	3656.8500	4388195	人に同性愛者とが疑われても否定をしないが実際には角の女好きでしかも女に容赦がない彼によって破滅した女は多い
3673.1192	2.9700	overt	3673.1400	4407743	そもそもYSの若き
3676.9892	4.5300	overt	3677.0100	4412387	婚婚として頭角を表していた彼を父の
3683.1992	8.6700	overt	3683.2200	4419839	マーミンが自ら苦手姓に願い出て組織から追放した理由も女絡みのトラブルだった
3698.3792	11.7150	overt	3698.4000	4438055	ちなみに今日は彼に限らず全員を黒いスーツを着ていたが全員が黒いスーツを着ていたがそれは彼の断固たる主張によるもので
3710.0942	11.7150	overt	3710.1150	4452113	汚れ仕事を行う時は無服を着るのが彼にとって死に行く者への経緯だとかポリシーだとかよくわからない美学をごちゃごちゃと語っていた
3722.5592	12.9300	overt	3722.5800	4467071	それなら覚えてる有名人じゃないかでか犬を何匹も一変に散歩させてすれ違う人が怖がるのを見てニヤニヤしていたやつだろう
3740.1992	8.9100	overt	3740.2200	4488239	そうよ事前活動という名目で駅場のない犬を引き取って犬屋敷みたいにして住んでた男
3782.9192	9.4200	overt	3782.9400	4539503	彼がそういったところで差し掛かろうとしていたニ人のドアがギリと開いて従業員が姿を現した
3800.7992	5.4000	overt	3800.8200	4560959	ひょっとするおどこに佐伯はドラが開きかけた時点で
3810.3092	12.0600	overt	3810.3300	4572371	無造作でありつつ素早い動作で老人合わせライフルの引き金を引く暗闇の中で勝ち合わせ
3822.3692	12.0600	overt	3822.3900	4586843	という銃自体の作動音とフシュッと空気の抜ける音が同時になり相手が悲鳴を上げる間もなく倒れた
3835.6892	4.5900	overt	3835.7100	4602827	出血は確認できなかったがクーションに命中したのだろう
3852.6092	4.2600	overt	3852.6300	4623131	このライフルは拳銃よりもさらに威力が劣る武器だが
3858.3992	9.3900	overt	3858.4200	4630079	当たりどころが良かったとはいえ自撃で倒したところを見ると近距離で用いる分には威力がないようだ
3869.8892	4.5300	overt	3869.9100	4643867	ただ反響する階段で使うと思ったより射撃音が大きい
3888.1292	1.0200	overt	3888.1500	4665755	私
3893.2292	3.1800	overt	3893.2500	4671875	あのイギリス人と結構親しかったのよね
3897.4892	5.5800	overt	3897.5100	4676987	僕が自分のライフルを差し出すと
3903.6092	4.8000	overt	3903.6300	4684331	佐伯は今一発打ったライフルをそれと交換し
3917.0792	5.6700	overt	3917.1000	4700495	何事もなかったかのように会話を続けながら階段を上るそれは初耳だね
3926.7392	11.5800	overt	3926.7600	4712087	僕たちは床に倒れた男の死体を踏まぬように足を置くが何しろ暗く靴底で流れ出た血液を踏んでしまった
3939.1292	3.9000	overt	3939.1500	4726955	あの男最後は奥さんに殺されてしまったんでしょう
3943.9292	2.7000	overt	3943.9500	4732715	その理由が全く傑作なのよ
3947.9792	4.5900	overt	3948.0000	4737575	飼い犬と成功してるのがバレて逆上されたんだっけ
3954.0092	6.8100	overt	3954.0300	4744811	それそれ私実はその趣味について彼が生きている時から聞いて知っていたのよね
3961.4192	2.7000	overt	3961.4400	4753703	妙なつながりがあるもんだ
3965.6492	3.0900	overt	3965.6700	4758779	僕は階段の先を見上げた
3971.0792	5.1600	overt	3971.1000	4765295	目指す階まであとわずかそこで僕の目的の人物が待っている
3980.5892	3.8700	overt	3980.6100	4776707	特殊な性癖の人って昔からとても興味があるのよ
3989.7692	2.6700	overt	3989.7900	4787723	人間の豪の深さを感じるでしょう
3996.0092	1.4400	overt	3996.0300	4795211	それである時ね
3998.1992	5.3700	overt	3998.2200	4797839	彼の性壁が気になって尋ねたことがあるの
4012.9592	17.9700	overt	4012.9800	4815551	それである時ね彼の性壁が気になって尋ねたことがあるのここにメスのシバケンシバイヌシェパードゴールディトリーバー千葉は何かがいたとしてどれが一番そそるんですかってそしたら彼首を振ってこういうの
4031.4692	12.5700	overt	4031.4900	4837763	その中には私の好みの犬はいないって私はじゃあ他のどんな犬種でもいいので好きな犬をあげてくださいって言ったのねすると彼はもう一度
4044.0392	12.5700	overt	4044.0600	4852847	一度首を振って犬種の問題じゃないんだというのよその後好みの犬を教えてくれたんだけど結局彼が好きな犬というのはどんな犬だったと思う
4058.4692	4.0200	overt	4058.4900	4870163	犬犬種の問題じゃないなら境遇かな
4063.8692	5.4900	overt	4063.8900	4876643	ボランティアで不幸な犬を拾っていたから虐待されていた犬ほど好みだとか
4071.6392	6.0600	overt	4071.6600	4885967	そして僕たちようやく目指す階のドアの前にたどり着いた違うわ
4078.8692	3.1800	overt	4078.8900	4894643	佐伯は声を落としドアノブをひねる
4085.4092	4.9500	overt	4085.4300	4902491	その向こうには廊下があるが真っ暗だった
4091.8592	5.1300	overt	4091.8800	4910231	佐伯がペンライトで照らすと奥の右手にドアが見える
4099.2992	2.4000	overt	4099.3200	4919159	あのドアの向こうにターゲットがいる
4102.2092	4.2000	overt	4102.2300	4922651	僕たちはドアをこぐり抜け廊下に足を踏み入れた
4128.7292	4.0200	overt	4128.7500	4954475	少し広くなったのでニ人ずつ肩を並べて歩く
4133.2892	5.0400	overt	4133.3100	4959947	じゃあどんな犬が好みだったのさ僕は潜めた声でそう尋ねる
4139.3492	2.6400	overt	4139.3700	4967219	そんなに難しい話じゃないわ
4148.3192	2.5200	overt	4148.3400	4977983	あのね彼はこう言ったの
4152.1292	1.1400	overt	4152.1500	4982555	例の
