onset	duration	trial_type	wav_onset	sample	value
2278.0350	19.0125	overt	2278.0275	2733642	親を産むのは最初から筋違いなんだ母さんたちだって素敵な将来を夢見て結婚して子供を産んだわけでしょやはり母の反応はないが寮は続けるまあとにかく僕はいろいろと学んだんだよ
2297.8875	16.0800	overt	2297.8800	2757465	この街は人間について学ぶには良い場所だと思う世間の大半の連中はワイチクにはクソみたいな人しかいないと思っててそれは確かにそうなんだけどでもじゃあそれを言っている人間はそんなに立派なのかなって思うよ
2313.9675	16.0800	overt	2313.9600	2776761	僕は誰だってそこまで変わらないと思うんだ根っから悪いやつなんかそこまでいないし間違いを起こしたやつが特別愚かだったわけでも行かれているわけでもないただちょっとうまくいかないだけなんだ
2345.3775	17.9200	overt	2345.3700	2814453	無料の言葉はずいぶん熱を帯び始めているそのボタンの掛け違いみたいなところでこの街の人間は本当にくだらなくてバカバカしい死に方をするしなんだかいつもうるさくわめき合っているそういうのは好きじゃないけどでもおかげで
2363.2975	17.9200	overt	2363.2900	2835957	自分すぎる暗い間なんだよいつかこの街を出たいんだずっとここにいたからずっとここにいたから僕も街にいる遺体の知れない何かに振り回されてしまいそうだから
2381.2175	17.9200	overt	2381.2100	2857461	まあもしかしたらどこへ行っても同じようなものかもしれないけれど時計はもうずいぶんと遅い時間を差し締めしているCQはもう寝ただろう寮も明日のためにそろそろ寝る支度をしなくてはいけない
2400.0075	9.2100	overt	2400.0000	2880009	僕は何でもやってみるつもりだよたとえ短い命だとしても生きるだけの価値は十分にあると今は感じているんだ
2418.0075	9.8100	overt	2418.0000	2901609	寮は立ち上がりそして母に向かってこの日最後の言葉を口にした母さんこんな素敵な場所に僕を産んでくれてありがとう
2444.0475	9.1800	overt	2444.0400	2932857	燕町サン丁目の大きな松がある屋敷といえば木村守護の家として近所の者にはよく知られていた
2455.9575	16.3800	overt	2455.9500	2947149	木村は酒癖が悪いところのぞけばのぞけば他に欠点もない優れた大工で彼に頼めばまず間違いがないと付近では評判だったひっきりなしに仕事が舞い込んでいたがしかし生活ぶりはさほど派手とは言えなかった
2553.6975	12.3450	overt	2553.6900	3064437	というのは金がないものからは金を取らず代わりに安酒酒の一杯でも構わないというような性質の人間であったためほとんど一線にもならない仕事とも
2566.0425	12.3450	overt	2566.0350	3079251	そうも言えぬ雑用ばかりに追われていたからだ彼は連絡を受けるといつでも道具を持ってひょいひょいと一人で出かけてスラム街のごろ家に
2578.8975	8.4900	overt	2578.8900	3094677	ボロ屋に上がり込み雨漏りを直したり外れたドアを取り付けたりしてそしてその報酬として
2588.2275	12.0600	overt	2588.2200	3105873	臭い蜜臓酒を浴びるほど飲んで真っ赤な顔で帰ってくるイチ日のうち大体ヨン日くらいはこのような調子であるのだから金がたまるはずもない
2608.7775	6.4200	overt	2608.7700	3130533	酒の上での失敗も多く暴力沙汰なども数え切れぬほど起こしていたが
2615.7675	9.2100	overt	2615.7600	3138921	憎めない人からのせいか人々に愛されていたただいつもその後始末をする細工には合法
2627.8575	1.0800	overt	2627.8500	3153429	積極
2652.1275	1.5300	overt	2652.1200	3182553	後方来楽
2657.8575	1.8300	overt	2657.8500	3189429	合法大リラック
2661.0075	1.8600	overt	2661.0000	3193209	知られた木村も
2665.7475	2.8800	overt	2665.7400	3198897	修正頭が上がらないという
2671.0275	2.5800	overt	2671.0200	3205233	こうした木村の性格は
2676.1875	2.8200	overt	2676.1800	3211425	当時彼の家で居候をしていた
2681.6475	7.5300	overt	2681.6400	3217977	御堂にも大きな影響を与えたのは間違いがない乱暴であるところや弱いものに対する愛称
2689.8075	11.4750	overt	2689.8000	3227769	それから愛嬌のある人柄など彼の性格の基礎となる部分が木村譲りのものであるのは間違いないだろう当時ニ人で一緒にいると仕事
2701.2825	11.4750	overt	2701.2750	3241539	仕事や話具性などもまるでそっくり同じだったという話だから実の親子よりも親密だったというその関係性が目に浮かぶようだ
2716.9875	10.4250	overt	2716.9800	3260385	幼い頃に母親を殴っていた孤児だったというエピソードから日曜のことは愛情に恵まれなかった情緒欠落の人物としてイメージし
2727.4125	10.4250	overt	2727.4050	3272895	だから成長した後に八流解放軍のような組織のリーダーになって過激な事件を起こして道を誤らせたという評価もあるが
2740.3875	14.9100	overt	2740.3800	3288465	それは彼の人間像を正しく捉えたものではないように思う確かに幼少期こそ殺伐とした環境にいたかもしれないが少なくとも木村家に引き取られてから
2755.2975	14.9100	overt	2755.2900	3306357	彼が酒による内臓疾患で病死するまでは愛情に恵まれた生活を送っていたのだ事実その時期道はかなり真剣に大工になることを考えていた
2770.9275	10.4100	overt	2770.9200	3325113	道法八流会の老人たちによってこの時すでに八流会幹部になることが約束されておりその養育費も組織から出ている
2782.7175	10.3500	overt	2782.7100	3339261	だから木村も特別彼に技術を教えるようなことはなかったのだが道は自発的に大工になるための修行を行っていた
2796.3975	8.0400	overt	2796.3900	3355677	その日も朝晴れているとみるや庭に出てその辺に転がっていた
2805.0375	14.6400	overt	2805.0300	3366045	材木の切れ端を使って工作に精を出していた彼の真っ黒な右手に秘められた能力は熟練した職人の木材も羨むほどの優れたもので
2820.2775	9.1800	overt	2820.2700	3384333	手を当てて捻じるだけですっぱりとあらかじめ閉いたライン通りに切断されるどんな柔らかい素材でも硬い素材でも
2830.1175	8.6100	overt	2830.1100	3396141	一つも周りの菊池も出すこともなくそして断面はまるでカンナをかけたように滑らかだった
2841.5175	9.9300	overt	2841.5100	3409821	もし道をが本当に職人への道を歩んでいたら他に誰も真似のできない仕事を成し遂げていただろう
2853.4875	12.9000	overt	2853.4800	3424185	そして彼は設計図を確認しながら材木を道具もなくスパスパと細かく切り分けていたそしてそれを見守るのはそっくり同じ姿をしたニ人の症状だった
2869.5975	3.2100	overt	2869.5900	3443517	水道をそれつまんないからもうやめなよ
2874.6375	2.4600	overt	2874.6300	3449565	カストロ通りに遊びに行こう
2881.4175	8.8800	overt	2881.4100	3457701	縁側に座って足をブラブラさせながらしきりに文句を言っているのはハイガミリコとハイガミエコ
2890.8075	4.9800	overt	2890.8000	3468969	江戸路団地に住むこの双子は道をよりもサンつ年下だった
2897.1375	6.7200	overt	2897.1300	3476565	道をもはじめは無視して黙々と作業をしていたがあまりにもしつこいのでとうとう値を上げた
2904.7575	9.6300	overt	2904.7500	3485709	なんでお前ら俺の邪魔をしてるんだよ遊べに行きたいならニ人で行けばいいだろうそれか団地の子なんだから団地の誰かを誘えばいいじゃないか
2915.5575	10.0800	overt	2915.5500	3498669	日曜はにらみつけて抗議をしたが双子はやっと自分たちへ注意が向いたという点しか見ずその言葉は完全に無視をした
2926.1475	3.9300	overt	2926.1400	3511377	見てよミドミチよこのブローチかわいいでしょ
2931.6375	5.4600	overt	2931.6300	3517965	私たちの大好きなバラの形をしているのお姉ちゃんが送ってくれたんだよ
2940.3075	13.8000	overt	2940.3000	3528369	双子はそうはしゃいで自分たちの胸で大量を照り返して真っ赤に輝く花をかたどったお揃いのブローチを見せるよ
2957.1675	11.0100	overt	2957.1600	3548601	不満気な表情ながらもそう答えてしまうのが未知を出会った姉はタイプA妹はタイプBの双子は能力を使って同過ぎたいたずらを繰り返し
2973.5175	14.1000	overt	2973.5100	3568221	孤児ながらも後見を高いヘドロ団地の大物だということでこんなに幼いながらも有名な悪道として周囲の人間に疎まれていた
2988.5775	12.9000	overt	2988.5700	3586293	他の子どもにちょっとでも嫌なことをされると容赦なくやり返し時にどう越えてしまうのだが一度それを通りかかった道をに潜められたことがある
3002.7075	8.0700	overt	3002.7000	3603249	いつでも自分たちが正しいと信じている双子中は注意をした道を反発して攻撃を加えたが
3011.4375	10.3650	overt	3011.4300	3613725	タイプAとタイプB両方の性質を持ち合わせた上に基礎となる身体能力もはるかに高い道をにはニ人が彼でもかなわなかった
3021.8025	10.3650	overt	3021.7950	3626163	古電パンにたたきのめされ能力者が能力を使ってノーマルをいじめることがいかに悪いことか卑怯なことか星座をさせて
3032.8875	3.2100	overt	3032.8800	3639465	こんこんと説教をしたのである
3036.9375	7.3500	overt	3036.9300	3644325	やりたい放題やってきた双子が他人に怒られるのは実の親が死んで以来初めてのことだった
3088.3275	15.7200	overt	3088.3200	3705993	結局ニ人でお泣きして謝り子分となることを誓ったのだがなぜかそれ以来道を懐いて道を懐いてきては彼をからかっているもちろん二人で泣いて子分にされたことなど完全に忘れた様子である
3104.7075	12.6300	overt	3104.7000	3725649	なんだかんだで甘くしてしまうのが悪いのだ遠道も分かっているが自分と同じように老心がなく能力者である双子の心情には共感できる部分もあり無限に扱うこともできない
3117.3375	12.6300	overt	3117.3300	3740805	私たちにはこうやって大事にしてくれるお兄ちゃんがいるんだからね頭のおかしいお母さんが死んじゃって本当に誰も家族がいないミドミチオとは違うんだからね
3132.0075	8.1000	overt	3132.0000	3758409	しかし双子の方がこのように容赦ない言葉をかけてくるとさすがの道をもう一変殴ってやろうかと思わんでもない
3151.8975	5.1600	overt	3151.8900	3782277	お兄ちゃんはすごいんだよ立派なところで働いていてねいつも
3157.6875	11.7150	overt	3157.6800	3789225	おもちゃとかお小遣いを送ってくれるんだよ今度はゲーム機を買ってくれるんだよみどみちよはゲーム機を買ってくれるような人いるいいんだよゲームなんてやらないから
3169.4025	11.7150	overt	3169.3950	3803283	実際のところは友達から最新のゲームを買ったなどという話を聞くと真っ先に駆けつける程度には好きである
3182.7975	9.3600	overt	3182.7900	3819357	まあでもよかったな届いたらちゃんとお兄さんに丁寧なお礼しなきゃダメだぞ分かってるよそんなの大きなお世話だわ
3193.1475	2.4900	overt	3193.1400	3831777	双子は木戸は威楽が激しく
3197.8275	2.3400	overt	3197.8200	3837393	道をのちょっとした糸を
3201.0975	4.9500	overt	3201.0900	3841317	指図にでも感じたのか急に方を膨らましてもくれてしまう
3206.9475	7.7400	overt	3206.9400	3848337	全く相手にしていられないということで道夫はため息をついて作業を再開しようとしたのだが
3215.3475	10.6200	overt	3215.3400	3858417	ねえ見ど道を菅原寮と決闘するって本当一対一でやるんでしょう意外なことを聞いてきたのでまた手を止めるどこで聞いたんだ田中子
3225.9675	10.6200	overt	3225.9600	3871161	赤子たが言ってた明日だって聞いたけれど双子たちの言う通り未中はこの翌日菅原寮と決闘することになっていた
3243.9375	6.9000	overt	3243.9300	3892725	先日チームを譲り受けるという話をしたもののやっぱり道はどうしても納得がいかない
3251.4375	8.1300	overt	3251.4300	3901725	リーダー同士みんなの前で決着をつけた上でなければすっきりしないと寮にしつこく粘ったのである
3263.4375	10.8600	overt	3263.4300	3916125	無料とすれば別に道を縄張りが欲しいわけでもなく負けて縄張りを失うことにもこだわりがなく全く戦う理由がないと断り続けていた
3278.4675	10.0500	overt	3278.4600	3934161	しかし豪雨や下御が腰抜けだなんだと罵倒し続けていたら意外と短期なようで腹を立てて挑発に乗ってきた
3292.3575	11.5200	overt	3292.3500	3950829	僕が飼ってもお前の縄張りはいらないその代わり裸になって逆立ちでカストロ同僚を往復してもらう寮が提案した条件はこのようなものだった
3306.6975	11.5800	overt	3306.6900	3968037	彼が勝ったとしても何かを手に入れるわけではなくただ未知夫が恥をかくだけの条件にやっぱりこいつは性格が悪いと確信しながら未知を了承した
3319.3875	11.7600	overt	3319.3800	3983265	ということで明日ジューサン時にパラシュート通り裏の空き地でお互い武器も能力も一切使わずに一体地で戦うということが決まったのである
3331.8675	7.7700	overt	3331.8600	3998241	思えば悪いことをしたかもしれないあいつは見るからね腕よりも頭を使うタイプなんだろう
3340.3275	14.0400	overt	3340.3200	4008393	それは分かっていたんだけどやっぱり血糖なしに縄張りを受け取ることなんかできなかったんだ道を頭に血が上って挑んでしまったことを少々後悔していた
3360.6375	8.0400	overt	3360.6300	4032765	それにきっとあの仲間も何にもいらないって態度がなんだか気に入らなかったんだ俺としたことが大人げない
3370.2675	17.1300	overt	3370.2600	4044321	日曜がため息をつくと双子はくすくと笑った何がおかしいんだけげんな顔で問い返すと油断してると道を負けるよあいつ見かけに揺らず結構強いんだって双子は予想外に詳しそうなことを言う何か知ってるのか
3387.9975	3.9300	overt	3387.9900	4065597	あいつシューとのケンカの時強かったそうだよ
3396.1575	4.8600	overt	3396.1500	4075389	それにあのまあ佐伯と仲がいいみたい同じのを習ってるんじゃないの
3405.2175	5.1300	overt	3405.2100	4086261	再起といえばYSの幹部にして武術の達人でもある
3410.8575	7.6500	overt	3410.8500	4093029	あるマーミンの息子として憲法の英才教育を受け町の空手大会では何度も優勝していた
3425.0175	12.0450	overt	3425.0100	4110021	佐伯は偉いギャングの息子であるから町の不良少年に混じって行動することがなかったがもし街に出たら自分の勢力を持っていただろう道をもその姿を大会で見たこと
3437.0625	12.0450	overt	3437.0550	4124475	道を自分でそういうものに参加することはなかったが町にどんな強い人間がいるのか見てやるつもりで見学に行ったことがある
3450.0675	19.0800	overt	3450.0600	4140081	その時優勝したのがまあサイキだったサイキはタイプBではなく体格も細身であったにもかかわらず恐ろしい強さで他の選手を投げ倒しおそらくサイキックだろうという感想を持ったものだその細機と親しげに話しているのを見たのだという
3469.9575	9.7800	overt	3469.9500	4163949	憲法をやってる団地の子がさわいち区の大会で見かけたんだって菅原郎が佐伯の応援に来てたみたいだよ
3483.1575	2.3700	overt	3483.1500	4179789	ちょっとはやるのかもしれないが
3486.3075	5.2200	overt	3486.3000	4183569	佐伯と知り合いってだけで同じくらい強いとは限らないさ
3496.5375	7.2900	overt	3496.5300	4195845	道は腕組みをして強がってみせるが同様隠しきれず双子に笑われてしまう能力使っちゃえば
3504.4875	6.9900	overt	3504.4800	4205385	金色の目を使うそれとも右手の力でスパッと首を蹴り落としちゃう
3512.5275	2.6700	overt	3512.5200	4215033	バカそんなことできるわけないだろう
3528.6075	10.3500	overt	3528.6000	4234329	でも腕が立つようなら帰ってよかったよ勝つにしろ負けるにしろ相手が強い方がいいその方がすっきり戦えるからな
3540.2175	14.9100	overt	3540.2100	4248261	それは強がりではないようで爽やかな表情をしている母変なやつ気持ち悪俺は真剣だぞお前らはがけだし女だからこういう気持ちがわからないんだ
3621.9675	12.9000	overt	3621.9600	4346361	私たちも明日見に行くからね来んなよ男の真剣勝負なんだ嫌だよミドミチ王が負けるところを見るんだからそれで裸で逆立ち歩く
3634.8675	12.9000	overt	3634.8600	4361841	歩きしてるところを写真に撮ってあげるね双子はおかしそうに笑い道を深く深くため息をつくと木片を一つ手に取ってようやく作業を再開した
3652.3275	12.7200	overt	3652.3200	4382793	翌日双子は朝から団地を出て道夫の血統時間までをカストロ通りで遊んで過ごしたヘドロ団地には彼女たちと同年代の子どもも多く住んでおります
3665.0475	12.7200	overt	3665.0400	4398057	彼らと遊ぶこともあったが最近淡い地区にやってくることの方が多かったとにかくニ人は毎日違うことをしてその日が少しでも変化のある
3680.5275	3.6300	overt	3680.5200	4416633	他の日とは違う一日になることを求めていたのだ
3685.6275	17.0100	overt	3685.6200	4422753	双子は一応小学生であったが学校には一属二度顔を出したきりで全く行っていないただこれに関して言えばニ人が特別だったわけではなく団地やY地区の子どもにはよくあることだ
3704.1375	1.4100	overt	3704.1300	4444965	犯罪者や
3710.6775	13.7250	overt	3710.6700	4452813	不法滞在者の子どもがまともに教育を受けることは難しい物好きな大人が子どもを集めて読み書きなどを教えていてそこである程度知識を身につけることもできたが文字も読めない子どもも多かった
3724.4025	13.7250	overt	3724.3950	4469283	とにかくそういうわけで双子はよく平日の真っ昼間から街をうるをついていた子ども自体は珍しくないが全く同じ顔したニ人が並んで歩くと目立つ
3749.4675	5.1300	overt	3749.4600	4499361	そして彼女たちに痛い目に合わされた経験がある路上の者たち
3755.7075	1.4700	overt	3755.7000	4506849	物売り
3759.4575	1.3200	overt	3759.4500	4511349	物たちは
3761.4675	3.1800	overt	3761.4600	4513761	その姿を見るとしかめ面になって
3769.5975	18.3300	overt	3769.5900	4523517	売り物に追いをかけたり目が合わぬよう目を背けたりするのだった双子はそういう反応をニアニアと眺めながらスカートをひらめかせて通り過ぎていくつかの不良少年のグループがあった
3787.9275	18.3300	overt	3787.9200	4545513	そうした不良少年たちも双子には手を出さない未知をほどの能力があれば別だがそうでなければ能力を使うことに全く戸惑いのない双子に散々にもて遊ばれて恥をかくだけの結果に終わってしまうのは分かっている
3814.8975	18.7650	overt	3814.8900	4577877	実際にそうしたことは何度もあった今では不良少年の方がこそこそ姿を隠すような状況であるあのクソ生きな怒りたが当主少年などはよく口にしたが彼もやはり実際に遭遇すると目をそらしい気づかぬふりをする
3833.6625	18.7650	overt	3833.6550	4600395	これは双子にとって全く退屈な状況でねえ今日は遊ばないの遊ぼうよ習を見つけるたびにその目の前に回り込んで挑発的に笑うだが主は無言で視線をそらし相手をしないで去っていくつまんないバカ
3853.5075	4.4700	overt	3853.5000	4624209	双子は頬を膨らましその背中に小石を投げるのだった
3861.7575	1.6200	overt	3861.7500	4634109	このような調子で
3864.1875	5.1000	overt	3864.1800	4637025	カストの通りですっかり晴れ物扱いをされている双子だが
3869.9775	4.8900	overt	3869.9700	4643973	優しく接する者はいた日曜もその一人ではあるが
3877.2375	5.7300	overt	3877.2300	4652685	ハストロ通りの橋でソフトクリームを売るメリッサというフリピン人の若い女も
3883.6875	4.9200	overt	3883.6800	4660425	双子を見かけるたびに好きなソフトクリームを選ばせてニ人を可愛がった
3910.0575	12.0000	overt	3910.0500	4692069	今は立派な店舗を構えジュー人もの従業員を抱える繁盛店のオーナーとなっているメリッサだがこの頃は小さな販売車を一人で切り盛りしていた
3922.0575	12.0000	overt	3922.0500	4706469	あのニ人のことはね本当に大好きだったんですよつい先日筆者は取材のために彼女を訪ねたミリッサは目の周りに
3934.5675	18.2400	overt	3934.5600	4721481	深い笑いじわができた優しげな表情の女性で筆者が這い姉妹のことを尋ねると懐かしそうに語っていたのはあれはご両親が亡くなってくらい顔していたくないという気持ちが強かったからでしょうね
3954.8175	12.0600	overt	3954.8100	4745781	人に心配されたり同情されるととっても申し訳なくなるから嫌だと言っていました
3966.8775	12.0600	overt	3966.8700	4760253	話が越しへのことに及ぶと顔をわずかに暗くしたがそれでも双子のことを一言も悪くは言わなかった
3982.3875	5.7300	overt	3982.3800	4778865	とにかくどんな相手にも公平で平等なんです偏見がないというか
3991.1775	10.5600	overt	3991.1700	4789413	だからそのような恐ろしい人間が相手でも何か一つでも興味が持てるところがあれば仲良くなってしまうんでしょうねそんな人と関わればどうか
4001.7375	10.5600	overt	4001.7300	4802085	どうなるのかというのは本人たちもよく分かってたんでしょうけどそういう打算で行動するのを何よりも嫌う子たちでしたから
4016.1675	9.2100	overt	4016.1600	4819401	彼女はそう言って深いため息をついたさてそこで話はまたアリシヒの幼かったハイガミ姉妹に戻る
4026.1575	12.6300	overt	4026.1500	4831389	その日も双子はミリッサのワンボックスを改造した販売車の前で客様に並べられた丸椅子に腰掛けミリッサからもらったソフトクリームをなめてみどみち落とすがらるような血糖も
4038.7875	12.6300	overt	4038.7800	4846545	メリッサが双子を可愛がっていたように双子もメリッサには名付いておりその近くでは商売の邪魔になるような振舞いをしない
4058.6175	13.6800	overt	4058.6100	4870341	あるいことをしなければ非常に愛くるしい要望を持つ子どもである双子のことをよく知らない通行人などを話しかけることもあり双子はその度にメリッサの店で何か買うよう進めた
4244.2575	17.3700	overt	4244.2500	5093109	そして時間が近づくとニ人はメリッサに礼を言って決闘の場所へと向かうどっちが勝つかな分からないけどどっちかが負けそうになったら邪魔する面白そう遠くから足とか引っ張って転ばせちゃおうか
4298.3775	12.4800	overt	4298.3700	5158053	水道はきっと真っ赤になって起こるよニ人がくすくすと洗い合いながら通行しているの方普通の路上ではなく堀の上だった
4311.4275	11.1000	overt	4311.4200	5173713	彼女たちはあまり道を使わず片方はサイキックの能力を借りてもう片方はタイプBの脚力で
4346.5875	4.7100	overt	4346.5800	5215905	彼女たちはあまり道を使わず片方はサイキックの能力
