onset	duration	trial_type	wav_onset	sample	value
4351.9875	15.7800	overt	4351.9800	5222385	民家の屋根の上などを伝いぴょんと飛び跳ねて猫でも使わないようなルートで移動するそのためどこにでも進出鬼没で現れそしていたずらをするのだ町の人々にとっては厄介にもほどがあるだろう
4460.4375	2.6100	overt	4460.4300	5352525	そのためどこにでもし
4466.3175	11.7000	overt	4466.3100	5359581	ただここは他でもないわい地区であるそんな場所をふらふらとしていると見てはならないものを見てしまって危険なことに分け込まれることもある
4532.3475	3.4500	overt	4532.3400	5438817	今までのものとは全く性質が違っていた
4556.4075	13.0350	overt	4556.4000	5467689	タイプBの発作で叫び声がするボロ屋のトタン屋根を踏み越え素人の手によって板を貼り付けただけの雑な補修が目立つ古い木造アパートの裏にトント着地
4569.4425	13.0350	overt	4569.4350	5483331	細い路地を並んで歩いている時だった二人の頭上何か大きなものがかすめ飛んでその黒い髪をふわりと回せる
4584.2175	15.6300	overt	4584.2100	5501061	びっくりして足を止めたニ人の目の前にストーンと着地したのは見たことのない怪物だった奇妙な姿をしていたものが多数存在するこの街でもこれほどおかしな生き物をニ人は見たことがない
4609.9275	5.0100	overt	4609.9200	5531913	一見すると巨大な雲や高足金のようだった
4615.7475	1.8900	overt	4615.7400	5538897	キューの字に折れ曲がる
4618.2075	6.2100	overt	4618.2000	5541849	ヨン本の足は長く細く小さなニ人が顎を見上げて
4625.0475	8.2800	overt	4625.0400	5550057	顎を上げて見上げるほどだそしてその足につり下げられるように胴体がついている
4634.0775	3.3000	overt	4634.0700	5560893	全身は茶色く短い毛に覆われ
4638.2475	8.4300	overt	4638.2400	5565897	頭には大きな腹が一つその下に窮屈に押し込められたように小さな口と鼻がついている
4647.8175	19.3500	overt	4647.8100	5577381	ずたぼろになった白いシャツと黒いズボンそして胴体に斜め掛けになっているのは川の黒カバンだ全く怪物という他にない醜い姿だがこのようなものを身につけているということはおそらくこれでも人間なのだろう
4668.1575	4.8600	overt	4668.1500	5601789	しかしこんなにひどい特殊変異を双子は見たことがなかった
4675.2675	11.5350	overt	4675.2600	5610321	Y地区の外れのボードアイリアには醜く変わり果てた姿のタイプAたちが固まって住んでいるがそこにもこれほど人間離れした者はいない
4686.8025	11.5350	overt	4686.7950	5624163	さらにその怪物の大きな覆眼は金色に輝いているつまりこいつはただのタイプAではなくタイプBの様子も兼ね合わせたハイブリッドなのだ
4700.9775	7.6200	overt	4700.9700	5641173	どこからかニ人の頭の上を飛び越えてきたこの跳躍力もそのタイプBならではのものなのかもしれない
