onset	duration	trial_type	wav_onset	sample	value
34.5375	11.1150	overt	34.5300	41445	これだけ一生懸命世話をして何にも思ってないなんてことあるわけないさ弾みの顔を見ながら道は微笑むがいつものように自然に笑うことができず
45.6525	11.1150	overt	45.6450	54783	少し引きつっていたどうした寮が尋ねると命は首を横に振りいや何でもない俺今日もは今日はもう帰るよ
57.2775	4.3800	overt	57.2700	68733	おばさん今度お礼メロン持ってきてやるよ
63.0075	6.8100	overt	63.0000	75609	マスクメロン食べると症状が良くなるって最近話題なんだぜそんなのよくあるデマさ
70.8075	5.5200	overt	70.8000	84969	デマでも何でもいいだろうよ効果がなかったとしても毒になるわけでもない
77.0175	4.1100	overt	77.0100	92421	道はベッドのそばを離れ寮に近づいた
86.7375	12.9000	overt	86.7300	104085	両そんなに悲しむことばかりじゃないんだぜお前みたいな意地っぱりが母親に優しくするなんてこんなチャンスでもないとできないだろう逆に考えるんだよ今まで離れていた
99.6375	12.9000	overt	99.6300	119565	寂しかったのに今は思う存分構ってあげられて嬉しいなってバカやろうが顔を真っ赤にして飛び乗くと道は声を立てて笑った
114.6075	11.3850	overt	114.6000	137529	和美に食事を食べさせるところを見届けると道は帰っていった寮は道を門まで送ってそして母親のそばに戻るとため息をついた
125.9925	11.3850	overt	125.9850	151191	騒がしくてごめんねあいつは僕の友達なんだこの間連れてきたマツコの次に仲良くしてるやつだよどうしてもお母さんに会ってほしくてね
138.3675	10.5900	overt	138.3600	166041	寮の声は普段友人たちには見せたことがないくらい穏やかで優しかったしかし和美はその語りかけには反応を示さず
150.6975	2.6700	overt	150.6900	180837	口の中で何かをつぶやいている
154.1775	13.1400	overt	154.1700	185013	こういう姿を見られるのは嫌かもしれないけれど会ってほしかったんだ僕らはあまりにもずっと離れていてお互いのことを全然知らないからね少しでも普段の僕の生活が分かるからね
167.3175	13.1400	overt	167.3100	200781	ニ人とも面白いやつでしょ定食屋で暮らせてよかったよだから僕は誰のこともちっとも恨んでいないんだ寮はこんな状況でもきっと
181.2075	14.1000	overt	181.2000	217449	言葉は和美の心のどこかに染み込んでくれるのではないかと思って二人きりの時はよく話しかけるけれども母からは何の何の何も帰ってはこない
197.8875	14.7300	overt	197.8800	237465	今の処方になる前は暴れたりもしたが外部の変化に対する反応はもう少しあった薬が効いておとなしくなってからは自分の世界からほとんど帰ってこなくなってしまっている
225.2775	13.2150	overt	225.2700	270333	発症したタイプBを完全に治す薬はないだから今処方されている薬も治すためのものではなく症状を抑えるだけのものだ飲み続けている間だけだけかずみの乱暴な気持ちが抑えられる
238.4925	13.2150	overt	238.4850	286191	確かに暴れていれば事故が起こりやすいけれどしかしこれは本人のためではなく周りが暑くするために飲ませているだけじゃないだろうかとルーは疑問に思うこともある
253.6575	10.3200	overt	253.6500	304389	愛知区ではよく行われているがこのように家庭のベッドに縛りつけるのは本当は違法だ資格を持った医師や看護師が見守れる環境でない
263.9775	10.3200	overt	263.9700	316773	患者の拘束を行ってはいけない患者本人の人権の問題でもあるし事故が起こってしまうこともある
275.1675	9.9300	overt	275.1600	330201	だから本当はどこかの病院に入れるのが良いのだろうけれど親戚たちは反対している
285.9075	13.3200	overt	285.9000	343089	クル室へもあまり乗り気ではないタイプB専用の施設は病院とはなるばかりで監獄のような場所も多いそれにまともな病院を探そうとすればY地区の外になってしまうが
304.4175	6.7200	overt	304.4100	365301	YESの影響の及ばない地域では病気以外の脅威を防ぐのが難しかった
311.8275	14.6700	overt	311.8200	374193	平和な時ならばそれでもいいが現在クリスの身の周りはあまり落ち着いているとは言えないそのことは量もある程度は把握しているクリスとしては介護のためのヘルパーを増援したいらしかった
328.6275	8.4900	overt	328.6200	394353	しかしそれに関しては寮が反対していた彼にしては珍しくはっきりとした理由の言えない反発だった
338.4975	18.1200	overt	338.4900	406197	今いるヘルパーにあまり印象がないというのもあるだろうがこれ以上知らない人間が家に入ってくるのがとにかく嫌なのだそれに人手を増やして手が足りたら父やまた自分を母から遠ざけようとするかもしれない
381.6075	1.2300	overt	381.6000	457929	かといって
383.3475	14.0300	overt	383.3400	460017	いつまでもこのままじゃ得られないだろうと大人たちに言われれば返す言葉はないのだが寮は母の言葉にそっと耳を傾ける陽子ちゃんとしっきりね同じ人名
397.3775	14.0300	overt	397.3700	476853	風の言葉の中でよく登場する名前だどんな人物なのだろう母の話はいつも飛び回って知り滅裂でその光景を把握するのは難しいが仲良く遊んで
411.4075	14.0300	overt	411.4000	493689	子供の時の遊び仲間か友人だろうか寮は道夫が飲み干したコーラの缶を捨て結局手をつけなかった自分のためのコーラを
426.2175	1.7700	overt	426.2100	511461	冷蔵庫に戻した
430.0575	9.9900	overt	430.0500	516069	自分はいつまで母の面倒を見るのかということについて考える何やらどうもこのままずっとこのような生活でもいいような気がする
441.9675	8.4600	overt	441.9600	530361	学者になりたいとかとにかく街を出たいとかそんなことばかり考えていたのに自分でも不思議な心境の変化だった
451.4175	14.2650	overt	451.4100	541701	泣いてばかりいる妹と暮らし話の通じない母の世話をしているだけなのになぜか心はおどやかなのだ大人たちは大変だねと同情してくれるが本人からすればむしろ前よりも居心がいい
465.6825	14.2650	overt	465.6750	558819	いつも感じていたあの焦りのような無性に胸がそわそわしてベッドの中で眠れなくなるあの未来へ駆け立てる活望がなぜか眠ってしまった
481.8975	6.4500	overt	481.8900	578277	俺が施設でアルバイトを始めたマツコがよく言う人のために何かをすること
495.0675	3.8700	overt	495.0600	594081	何かをするということの安らぎなんだろうか
500.0775	12.0900	overt	500.0700	600093	それとは違うような気もするが例えばここに寝ているのが自分の母親でない赤の種だったらと想像してみると決して同じ気持ちではいられないような気がする
514.5375	6.9900	overt	514.5300	617445	マツコのようにとにかく他人に手助けできればいいというわけではなく母親であることが大事なんだろう
529.2675	12.6750	overt	529.2600	635121	そして道夫がさっき自分に対して行った分析を思い出し寮は顔をしかめた泣けばいいって言ったけれどそんなことできるもんかみちよはいつも思いつきでいい加減なことを言う
541.9425	12.6750	overt	541.9350	650331	母の上言を聞きながらしばらくぼんやり考え事をしていたそして時間になると彼は立ち上がりベッドの足元にぶら下がる導入バッグの中身を確認する
556.1475	16.5000	overt	556.1400	667377	カズミの尿道に差し込まれたチューブはパジャマの内側を通ってこのビニール製のバッグにつながれており尿が落ちる仕組みになっているバックの黒いカバーをずらすと中に黄色い尿がたくんと揺れた
575.0475	10.2300	overt	575.0400	690057	量はベッドを脇の棚の上に置かれた紙箱から使い捨てのビニール製の手袋を装着する
586.3275	6.9600	overt	586.3200	703593	そしてベッドの下に置いてあったプラスチック製農業機を取り出すとバッグのそばに設置する
593.9775	12.1200	overt	593.9700	712773	バックには注ぎ口がついていてそれをつまむと尿が勢いよく飛び出して尿気に注ぎ込まれるバックが空になって全ての尿が移動すると
606.0975	12.1200	overt	606.0900	727317	寝起きのメモ帳をその数値をベッドにぶら下がっているメモ帳に現在の時刻と一緒に記録する
618.9075	3.0300	overt	618.9000	742689	白年に取りかかった失礼するよ
624.0375	6.0000	overt	624.0300	748845	全く無関心なカズミにそう声をかけると体にかかっていたメオフをめくる
631.0575	14.5800	overt	631.0500	757269	拘束された霧だがベッドの上でやたらと体を動かすのでそこまでに筋肉は落ち切っていない風や毛布をめくられたことにも気づかぬようだった
647.3475	4.3800	overt	647.3400	776817	高速は手足と体幹のゴカ所で行われている
657.7875	5.9700	overt	657.7800	789345	量は腰の上あたりで固定された体幹の高速を緩めズボンを引き下ろす
664.8375	7.2900	overt	664.8300	797805	そして水色のおむつがあらわになると慣れたしぐさでバリッと音を立てて両サイドの
672.6675	2.3700	overt	672.6600	807201	面ファスナーを剥がしてめくる
676.0275	5.7900	overt	676.0200	811233	そしてカズビの下半身は丸裸になりチューブの差し込まれた陰部があらわになった
683.2275	14.5200	overt	683.2200	819873	看護師によるとそろそろ生理がくるという話だったので心配していたが汚れておらず便もなかったそれを確認すると寮を外した時と同じように手際よくおむつを装着しズボンを引き上げた
709.1775	7.6800	overt	709.1700	851013	体幹の高速を緩めたついでに背中の裏に当てがっているマットの位置を変えて体が少し
782.3775	1.8600	overt	782.3700	938853	カンセル
784.8075	12.3900	overt	784.8000	941769	場合によってはそこから感染症になって最悪命取りになることもあり得るということなので折を見てはこのように体の向きを変えてやっている
798.0675	14.5700	overt	798.0600	957681	一通り作業を終えた寮は尿を捨てるために寝起きを持って立ち上がったドアを開けるとちょうど部屋に入ろうとしていた集球と出くわす
812.6375	14.5700	overt	812.6300	975165	おっと急に立ち止まると尿器の中で尿が揺れるああごめんなさい周期は慌てて謝ると両の手元を見てそれ捨てるのうん私がやるよと言って尿気に手を伸ばす
827.2075	14.5700	overt	827.2000	992649	いいよ僕は手袋しているからちょっと待ってて週休は言うとすぐに右手のドアを開けるその小さな空間は床が耐える時期で掃除用の流しが設置されていた
855.4275	10.4400	overt	855.4200	1026513	カズメがベッドから起き上がりなくなってからクリスが金を出して作ってくれたもので排泄物を流したり汚れ物を洗うのに便利だ
866.7975	7.3800	overt	866.7900	1040157	そこの棚にも手袋の箱があってCQはそれを急いそと両手に装着する
875.8875	11.5200	overt	875.8800	1051065	尿を流して洗うだけの簡単な作業だからこうしている時間に終えてしまえるのにとるようは思ったが幼い妹の全員を無駄にしないためにはなかった
922.4175	19.8300	overt	922.4100	1106901	シューキューが手袋をはめた手で寝起きを受け取るやり方は分かるかいうんお兄ちゃんや看護師さんのやるところを見てたからその黄色い液体を洗い場のシンクに流しそしてデジャグチからの流水を当ててエツキブラシでこすった
946.2075	2.8500	overt	946.2000	1135449	それくらいで大丈夫だようん
950.1675	11.5500	overt	950.1600	1140201	週休はそれで手を止め蛇口を閉めるありがとう助かるよ涼が微笑み猟虚を受け取ろうと手を伸ばしたが私が持っていくよ
961.7175	11.5500	overt	961.7100	1154061	寮の目の前を通り過ぎて一見の部屋のドアを開けた珍しいこともあるものだ家族のことが全くわからなくなって言葉も入らない母を見るのに
974.1975	1.1400	overt	974.1900	1169037	見るの
977.1675	13.4700	overt	977.1600	1172601	あんなに恐れていたのに週休は部屋に入ってすぐのところで一人ごとぶつぶつつぶやく母の姿にひるんだがすぐに気を取り直してスタスタと歩き直す歩き出す
991.6875	7.3800	overt	991.6800	1190025	そのベッドの下に敷いてあるビニールシートの上に置いて分かった他に何か手伝えることある
1028.9175	4.8300	overt	1028.9100	1234701	そう言って周球は強い死のこもった瞳で兄を見る
1034.2575	11.0250	overt	1034.2500	1241109	特にないかなもう一通りのことは終わったから急に積極的になった妹を不思議に思いながら寮は答えるもっと早く来ればよかったごめんなさい
1045.2825	11.0250	overt	1045.2750	1254339	いつもお兄ちゃんにばっかりやらせちゃってそれはいいよでも大丈夫なのかいもう大丈夫今まで何もしなくてしないでごめんなさい
1061.9775	9.5700	overt	1061.9700	1274373	ずっとこんなのじゃお母さんにもお兄ちゃんにも悪いってシューが嫌な子だって分かってたんだけど怖くて仕方なくて
1072.1475	4.4100	overt	1072.1400	1286577	そして週休の大きな瞳にじんわり涙が浮かぶ
1083.3375	12.2100	overt	1083.3300	1300005	自分を責める必要はないよお前は僕より母さんのことを大切に思っているから耐えられなかったというだけのことだよ
1095.5475	12.2100	overt	1095.5400	1314657	週休の庭園にはめたままの手袋を剥がしてやり自分のものとまとめて丸めて部屋の隅にあるふたつきのゴミ箱のペダルを踏んでその中に捨てた
1110.3075	10.9350	overt	1110.3000	1332369	まだ小さいんだし僕や看護師さんと同じことはやらなくていい代わりに母さんのために泣いたり喜んだりしてあげてほしい僕の分までねそれだけでいいんだ
1121.2425	10.9350	overt	1121.2350	1345491	お兄ちゃん僕は平気なんだよ汚れたおむつを見たって症状がひどいのを見たってそんなにつらくはないだからやってるだけだよ
1134.7275	15.7650	overt	1134.7200	1361673	子供がニ人で両方とも僕みたいだったらお母さんがかわいそうだろうだからこれは役割分担だ僕はこういう世話をするからお前はいっぱいお母さんのことを考えてあげてくれでも私何かしたい
1150.4925	15.7650	overt	1150.4850	1380591	それなら料理とか掃除とか他のことでもいい僕が教えるから週休は週休で複雑な思いがあるらしくうなずきはした者の兄の提案を素直に受け入れられないようだった
1169.7675	14.6700	overt	1169.7600	1403721	どうしてもって言うなら解除も教えるよでも自由にできる範囲のことでいい兄の優しい言葉にしゆきはうつむき本当にごめんなさいずっと一人で暮らしてたお兄ちゃんにこんな時ばっかり
1225.3275	4.5600	overt	1225.3200	1470393	ほとんど泣きそうになっている妹を見て両握手をする
1244.2275	9.4200	overt	1244.2200	1493073	別に一人ってわけじゃないむしろすごくににぎやかに言いかけたところでポケットの中の携帯電話が振動する
1355.7375	11.5500	overt	1355.7300	1626885	言いかけたところでポケットの中の携帯電話が振動する取り出してみるとクリスへからのメールを着信したという通知が表示されていたすぐにポケットにしまい何でもない
1367.2875	11.5500	overt	1367.2800	1640745	その動作を見つめていたシュウにそう言うととにかく僕は本当に大丈夫なんだだけどシュウが手助けしたいって言ってくれたのは嬉しい
1380.2775	8.0400	overt	1380.2700	1656333	何かしなくちゃいけないと心から思ってくれたのならしたのと同じことなんだよ
1406.1975	18.3400	overt	1406.1900	1687437	お姉ちゃんシューは悪い子だったけどもう頑張るから嫌いにならないでねお姉ちゃんに嫌われたらシューQの目から涙がこぶれ落ちるそれを見て寮は深くにも胸が詰まった大丈夫安心して絶対に嫌いになることな
1424.5375	18.3400	overt	1424.5300	1709445	寮は週休の頭をくしゃりとなでた夕食を取り入浴を済ませると寮はまたかずみの部屋に戻ってきたそして風味のおむつの中を確認すると便が出ていたのでそれを処理する
1442.8775	18.3400	overt	1442.8700	1731453	かずみは目を閉じてすやせやと寝起きを立て始めたなまるで赤ん坊のようだな寮は心の中でつぶやいてからそういえば自分が赤ん坊の時はまだ母親のそばにいて彼女がおむつを変えてくれたりしていたんだなと思い出す
1464.3075	13.7100	overt	1464.3000	1757169	自分は母とは縁がなかったような気がしたけれどまだ物心のつく前記憶もない時代確かに彼女には世話をかけていたのだ結局昔にして
1480.1775	5.2800	overt	1480.1700	1776213	昔にしてもらったことをしているだけのことなんだな
1487.2575	5.4600	overt	1487.2500	1784709	何にも特別なことじゃない借りたものを返しているだけの当たり前のことなんだ
1495.5975	2.7600	overt	1495.5900	1794717	そう思うと妙に納得ができた
1499.8275	17.9550	overt	1499.8200	1799793	一通り作業が終わるともう今日はしてやることがない寝息を立てる母を見ながら寮は椅子を見ながらリスネコシかけ先ほど父から来たメールの存在を思い出して携帯電話を取り出したクリスは明日この屋敷を訪ねることになっていたのだが急きょう
1517.7825	17.9550	overt	1517.7750	1821339	いつも母さんの面倒を目させてすまないと最後に謝っていたので驚いたクリスにこんな言葉を投げかけられるなんてこれまで一度もなかったからだでも別に謝ることなんかないのになと寮は思う
1536.4575	11.7300	overt	1536.4500	1843749	その頃はローズの副作用が知れ渡ることによって繁葉者はだいぶ減ったがその爪痕はまだ町に残り街には中毒者があふれていた
1550.7375	12.9900	overt	1550.7300	1860885	彼らは頻繁に事件を起こしまたは彼ら自体の事件の被害者となり裏通りを歩けばイチ日イチ人くらいはジャンキーの死体を発見できる
1926.8175	16.0500	overt	1926.8100	2312181	その頃はローズの副作用が知れ渡ることによって反用者はだいぶ減ったがその爪痕はまだ町に残り街には中毒者が彼らは頻繁に事件を起こしまたは彼らら
1942.8675	16.0500	overt	1942.8600	2331441	事態が事件を被害者となり裏通りを歩けばイチ日イチ人くらいはジャンキーの死体を発見できるこの荒れた状況の中ローズを売って組織と小金を作った
1958.9175	16.0500	overt	1958.9100	2350701	YSはそのままギャングになって自分のチームを作った彼らは街の外のヤクザなどと組んで別の薬を路上で売り始めているYSはその対応しなくてはいけないがYS自体もローズ中毒に虫まれており
1974.9675	16.0500	overt	1974.9600	2369961	ロンタオであるクリスは寝る時間がないほど忙しい寮はそうした状況を理解していた僕でもきっと父さんと同じように仕事を優先するだろう自分に置き換えてみれば父の行動には責めるべき点は何もない
1997.7675	13.5600	overt	1997.7600	2397321	YESはロンタウの判断なしにはこの時期を乗り越えることができないが発症したタイプに対してはいかにクリスへといえどもなすすべがない仕事を捨てて帰ってきて例えば和美に
2011.3275	13.5600	overt	2011.3200	2413593	それに優しい言葉を投げかけたところで病に対しては何の意味もないのだこの状況はそうした行為で何かが改善するようなものではないそれに
2026.0575	8.8800	overt	2026.0500	2431269	実際のところクリスが帰ってきて例えば一緒に食卓を囲むようなことになったらどんな顔したらいいのかわからない
2038.5975	19.6500	overt	2038.5900	2446317	そうした意味では両にとってはむしろクリスが来ないという情報はむしろ安藤をもたらしたでも母さんは会いたいのかなそうしてふとかかずみの方を見るといつの間にか母が目を開けているのに気がついた母さん眠れないのかい
2058.2475	19.6500	overt	2058.2400	2469897	示さずぼんやりしか視線がさまよっているそれは寮の顔を見ているようにも見えたし何も見ていないようにも見えた明日父さん来れないんだってさ寂しいそう尋ねても母親は何も何も語ろうとはしない
2080.0575	15.9300	overt	2080.0500	2496069	僕はぼーっとしている会うと緊張するからね寮は立ち上がって風見の布団の裾がめくり上がっているのを直した人のつながりっていうのは何だろうね僕らはみんな地でつながっている
2095.9875	15.9300	overt	2095.9800	2515185	僕だったらマツコとか道をとか他の仲間の方がずっとしたしなのに彼らとの約束や時間を捨ててここに来てずっと母さんの面倒を見てるんだ不思議なものだと思う
2113.2675	17.1550	overt	2113.2600	2535921	未知夫が言うように僕の感情はどこか幼稚な部分があるのかもしれないだからどこかちょっと無条件に親に従ってしまうんだ赤ん坊とかそうだろうはまた腰椅子椅子に腰掛けた正直ずっと母さんを恨んでたんだ
2130.4225	17.1550	overt	2130.4150	2556507	母親の心にはもうどんな言葉も届かないのかもしれないしかし寮は何か言わずにはいられなかったそれとも届かないから言えるのだろうかもし母が正気であったならあるいはこんな話は一生口にせず終わっていたかもしれない
2147.5775	17.1550	overt	2147.5700	2577093	それはこの世の中自体が好きじゃなかったからだ世界自体があんまり好きじゃない悲しいことばっかりでどんなに頑張ったって報われないことの方が多いろんなことを知れば意見が変わるかと思ったけれど
2164.7325	17.1550	overt	2164.7250	2597679	何を見ていたってがっかりさせられるばかりだ僕らは苦しむためだけにこんな場所に生まれたんだと思ってたでも今はそう思わない本当に何も届いていないのだろうか母が黙っているその顔を見ていると
2181.8875	17.1550	overt	2181.8800	2618265	とてもそうは思われない何か理由があって発症したふりをしているのかそんなふうにも考えたくなる何しろこの母は若い頃は研究者としてグレートホールの研究に携わっていたくらい賢い人間だったのだ
2199.0425	17.1550	overt	2199.0350	2638851	昔はグレートホールに対して大掛かりな調査が行われておりそこには塩健次郎もいた塩健次郎は同僚だった和美のことをほとんど語らない調査に関わった人間は多く
2220.9975	19.0125	overt	2220.9900	2665197	同僚としての付き合いはあったにしろそこまで親しいわけではなかったのだろうと両は考えているとにかくそんな聡明な人間がこのように何もわからなくなるとはそういうものなのだと知識では知っているが感情の面からすると納得できない部分があった
2240.0100	19.0125	overt	2240.0025	2688012	今はね割と素直に楽しめているんだ周りの連中はバカだけどいい奴らだしいつだって僕を信じてくれる世の中は不思議に満ちていて新しい発見がたくさんある悪いことの中にもいいことがある
2259.0225	19.0125	overt	2259.0150	2710827	人生は短いかもしれないしこの先ひどいこともたくさんあるかもしれないけど今のこの楽しいっていう感情は永遠に消えないものだろうそれにそもそも母さんたちだって苦しめるために僕らを生んだわけじゃないからね
