onset	duration	trial_type	wav_onset	sample	value
1711.6061	2.7600	overt	1707.3600	1752685	必要に同じようなことを言う彼を見かねて
1716.1961	4.4100	overt	1711.9500	1757385	こういう場所では店員のプライベートを聞くようなマネ屋物水だと攻めると
1721.6561	4.2900	overt	1717.4100	1762976	少し彼との間で口論になった後で彼を最終的に立ち上がって
1727.0561	4.5000	overt	1722.8100	1768505	そんな話をしているんじゃねえよだったら血の通った人間だと証明しろと
1733.2961	3.5100	overt	1729.0500	1774895	店員がレモンを切っていた果物ナイフを指さした
1738.3661	5.7000	overt	1734.1200	1780087	それを見て防衣が明らかに警戒心と不穏な雰囲気を醸し出し始めたので
1745.3861	3.8700	overt	1741.1400	1787275	彼の首根っこをつかんで逃げるように現金を置いて退店したのだった
1750.3361	3.4800	overt	1746.0900	1792344	彼とはそのまま言葉もなく別れたもう会うこともないだろう
1754.5961	3.7800	overt	1750.3500	1796706	とはいえその経験は自分にとってそれほど苦い経験でもない
1759.4261	4.2600	overt	1755.1800	1801652	喉も遠すぎてみれば貴重な体験というか大学やバイトでも
1764.3161	1.8300	overt	1760.0700	1806660	良い雑談の種になっている
1767.1361	5.4300	overt	1762.8900	1809547	今思えば彼の言っていたことはあの訪問者の言うチューリングテストにも重なるのだろうか
1773.5261	5.4000	overt	1769.2800	1816091	自分からすればそのお店の店員たちが人間であることを疑う余地もなかったけれど
1779.9461	3.2700	overt	1775.7000	1822665	彼には何か人間ではない存在に見えていたらしい
1784.0861	3.0000	overt	1779.8400	1826904	あの訪問者の言った本物とは何を指しているのだろう
1795.2461	2.2500	overt	1791.0000	1838332	Tシャツも買い物袋の中に入れておくね
1798.6061	4.6800	overt	1794.3600	1841773	あのさねちょっといいかなすぐに切り出すつもりだったけど出番をくじかれてしまった
1804.4261	2.7900	overt	1800.1800	1847732	荷物と一緒に郵便受けの中を見たんだけどさ
1808.5661	3.6300	overt	1804.3200	1851972	どうして女の子とお酒を飲むようなお店のハガキが入っていたのかな
1815.4961	4.7100	overt	1811.2500	1859068	ところかまわず入ってるポスティングのチラシじゃないの
1821.1661	5.0100	overt	1816.9200	1864874	この前のことは気にせずまた来てくださいねとかわざわざ手掛けで書いてたけどあの店か
1828.2461	8.7300	overt	1824.0000	1872124	この状況では気遣い取りちぎさがまるで報復にすら思えるわざわざ連絡先なんて書くんじゃなかったそういえば確かにそういうお店で住所を書いたよ
1838.0561	9.7200	overt	1833.8100	1882169	この前一回だけ友達の木晴らしに付き添っていったんだ友達何年も会っていなかった友達で誰か距離の遠い人としゃべりたかったと
1848.3761	1.0800	overt	1844.1300	1892737	言われて
1850.3861	5.7900	overt	1846.1400	1894795	それでそういうお店に行こうって誘われたのそうだよ申し訳ないけれど彼には罪をかぶってもらおう
1862.7161	2.4000	overt	1858.4700	1907421	嘘は重ねるとほころびが出てくるんだよ
1866.7661	2.7300	overt	1862.5200	1911568	私本当は君が誘ったって知ってるよ
1870.8761	3.9300	overt	1866.6300	1915777	老生なら行ったことがない場所に行ってみようとか
1972.2461	1.4700	overt	1968.0000	2019580	意味が言い訳しながら
1974.8561	2.4900	overt	1970.6100	2022253	君自身が興味があって誘ったんでしょう
1982.5961	1.2600	overt	1978.3500	2030178	どうしてそんな嘘つくの
1985.2061	3.7500	overt	1980.9600	2032851	正直に言うならまだしも本当のことを隠そうとするのはさ
1990.3661	3.4200	overt	1986.1200	2038135	隠さないといけないようなやましい気持ちがあったってことだよね
2004.7061	3.3000	overt	2000.4600	2052819	話をそらさないで私は今君の話をしているの
2009.2661	5.2500	overt	2005.0200	2057488	君が私以外の女の子の興味なんかもってしかもそんな他の女なら誰でもいいみたいに
2016.2261	4.0500	overt	2011.9800	2064616	まさか最初で最後の興味本位の行動がこんな話につながるなんて
2021.5661	2.0700	overt	2017.3200	2070084	それにしても彼女の激行は何なんだ
2027.1761	3.6300	overt	2022.9300	2075828	水知らずの人間がどんな目的を持っていたらこうなるんだ
2031.8861	2.6100	overt	2027.6400	2080651	どうして私じゃそんなに不満なの
2035.9361	5.0700	overt	2031.6900	2084799	私はこんなに君が見ている時も見ていない時も君と幸せになるために頑張っているのに
2043.8261	1.1400	overt	2039.5800	2092878	ちょっと落ち着いて
2046.0161	1.6200	overt	2041.7700	2095120	そんなことくらいでおかしいよ
2052.2861	3.7500	overt	2048.0400	2101541	そんなことくらいって何でそんなひどいことばっかりするの
2056.9061	4.9200	overt	2052.6600	2106272	今日だってそうだよ私君のためにせっかく可愛くしようとして思って
2062.7561	4.0200	overt	2058.5100	2112262	せっかくせっかくいっぱい準備してきたのにそれならなおさらおかしいよ
2068.2161	14.1900	overt	2063.9700	2117853	おかしくなんかない私の何がおかしいの本当はもっとおんべんに切り出したかったでもこんな状況からを穏やかに修道権を握ることはもはやかなわないだろう今この場で静かな夜から踏み出す覚悟を決めた
2086.9361	1.9800	overt	2082.6900	2137023	病院なんか行ってないんじゃないか
2090.7161	3.5700	overt	2086.4700	2140893	隠さないといけないようなやましい気持ちがあるのは君なんじゃないのか
2095.2461	1.8300	overt	2091.0000	2145532	何言ってるの意味わかんないよ
2099.1161	1.6800	overt	2094.8700	2149495	本当は何を隠してるんだ
2102.9261	4.7100	overt	2098.6800	2153396	病院に行っていたはずの夕方に受付橋であったことを知っているはずがない
2109.8861	2.1600	overt	2105.6400	2160523	もしかして私のことを疑ってるの
2113.8161	3.8100	overt	2109.5700	2164548	ひどいな私はこんなにも君のこと大好きなのになんだ
2119.1561	4.7700	overt	2114.9100	2170016	急に人格が入れ替わったかのように彼女の子はいるが唐突に穏やかになった
2125.2761	2.6400	overt	2121.0300	2176283	その穏やかさがかえって不気味というか
2129.1161	4.3800	overt	2124.8700	2180215	どこか異様な雰囲気をまとい始めたように感じる
2135.5961	2.0700	overt	2131.3500	2186850	質問に答えてよそんなの
2139.4061	3.5700	overt	2135.1600	2190752	リタッチしてもらってる間にSNSで読んだだけだよ
2145.5561	1.5000	overt	2141.3100	2197049	だったらどうしてさっきは
2148.8561	1.7700	overt	2144.6100	2200429	病院に行ったのが嘘だった
2151.1661	3.2400	overt	2146.9200	2202794	だって思うんだったらさドア開けてみてよ
2155.6961	3.7500	overt	2151.4500	2207433	髪の毛ツヤツヤだよ君に見てほしくて可愛くしてきたんだよ
2163.3161	6.2100	overt	2159.0700	2215236	そんな話をしているんじゃない君が今日ずっと釣れない感じだったのはそんな勘違いしてたからなんだね
2171.4761	4.8900	overt	2167.2300	2223592	しょうがない人だなでもちょっとくらい抜けてるところもいとおしいよ
2177.0261	1.4100	overt	2172.7800	2229275	私は怒ってないし
2179.3961	6.6600	overt	2175.1500	2231702	傷つけたんじゃないかとかって気にしなくてもいいからねでも君は優しいからだから私の
2212.6061	1.2000	overt	2208.3600	2265709	ポーチの中に入れて
2218.3661	6.1500	overt	2214.1200	2271607	感染なんか気にしなくていいよ私君から感染するウイルスなら背中の爪痕くらい
2230.1561	4.6500	overt	2225.9100	2283680	穏やかな声に反して激しく叩かれるドアの音がまるで自分の心音のようだった
2236.3661	2.2200	overt	2232.1200	2290039	いきなり話を合わせて落ち着か
2239.9361	1.8600	overt	2235.6900	2293695	せられないというか
2243.6261	2.6100	overt	2239.3800	2297473	話が通じる状態ではなくなってしまった
2247.4661	1.6800	overt	2243.2200	2301405	でもどう
2273.0261	2.4300	overt	2268.7800	2327579	やりすぼうすばかりじゃ
2276.6261	2.7900	overt	2272.3800	2331265	どうせなだめてやり過ごすばかりじゃ拉致が開かない
2280.2261	8.8200	overt	2275.9800	2334952	彼女は病院に行っていたと言っているけれどそのまま信じていいとは思えないとはいえ彼女が受け付け場しにいたとしても
2290.6661	1.9500	overt	2286.4200	2345642	そこで何をしていたのだろうか
2294.2961	3.9000	overt	2290.0500	2349359	それね結局彼女はどうしてガールズバーの一見の経営まで知っているんだ
2299.5161	4.9200	overt	2295.2700	2354704	それに限らず見ず知らずの彼女が自分の話を聞き出すとしたら誰からだろう
2420.8661	4.9500	overt	2416.6200	2478967	自分から誘ったなんて経緯もそのお店にいた子なら聞いていたかもしれない
2427.0161	2.1000	overt	2422.7700	2485264	君はあのガールズバーの店員か
2430.4661	1.8300	overt	2426.2200	2488797	なんでそれが家まで来るんだよ
2434.6361	4.4400	overt	2430.3900	2493067	何わけ分かんないこと言ってるのもしかして私のこと分かってないの
2440.4561	5.3700	overt	2436.2100	2499027	というかそうじゃなくてもそんなふうに私のこと想像してたのに私はこんなにも君に尽くしてきたのに
2447.6561	2.4000	overt	2443.4100	2506400	今の音は幻聴かもういいよ最低
2459.5661	2.3100	overt	2455.3200	2518596	唐突な出来事に立つくしてしまい
2462.6861	2.3400	overt	2458.4400	2521791	最後に迫った彼女に何もできなかった
2465.9261	3.2700	overt	2461.6800	2525108	でも確かに彼女は見ず知らずの人間のはずだった
2470.1861	6.8400	overt	2465.9400	2529471	レールズバーであったなんて想像したのは間違っていたかもしれないだからといってどうしてこんな目に薄れゆく意識の中で
2477.7461	2.7900	overt	2473.5000	2537212	何も言わずに立ち去る彼女の足音を聞いていた
2554.4861	2.4300	overt	2550.2400	2615794	アルスバーの件の経緯を知っているとしたら
2557.6361	6.3600	overt	2553.3900	2619019	友人本人でなければ自分から話した相手くらいだそしてそれを自分から雑談で話した相手といえば
2564.8061	2.1900	overt	2560.5600	2626361	大学の友人とバイト先くらいだ
2573.9561	5.2200	overt	2569.7100	2635731	それとちょっと聞きたいんですけど今日お店で誰かに僕のことを聞かれたりしましたごめん
2579.8961	4.6800	overt	2575.6500	2641814	また恋人さんが差し入れ持ってきてくれたんだけどいつもの調子でついガールズバーの話もした
2586.0461	5.1300	overt	2581.8000	2648111	もしかしてそれで契約になったりしたすまん今度また埋め合わせするわいつもの調子で
2592.8861	2.7000	overt	2588.6400	2655115	背筋をなで回されるようなおかんが走る
2596.5461	3.6900	overt	2592.3000	2658863	確かにバイト先には頻繁に差し入れが届いていた
2604.9461	3.3000	overt	2600.7000	2667465	でもその送り主が彼女だったどころか
2609.2361	4.4700	overt	2604.9900	2671858	彼女は知らない間に周りからは自分の恋人として認識されているのか
2647.0061	5.1000	overt	2642.7600	2710534	もしかしてやっぱりお部屋の掃除が住んでいないから気にしてるだから言っておいてあげたのに
2652.9761	3.6300	overt	2648.7300	2716648	でも大丈夫だよそのくらいのことで幻滅したりしないから
2657.8361	6.1200	overt	2653.5900	2721624	君があんまりお片付けが得意じゃないのも知ってるし私君の代わりにお掃除もしてあげるよ
2664.7661	1.8000	overt	2660.5200	2728720	まるで天使みたいって思わない
2667.8561	5.3400	overt	2663.6100	2731885	甘い声で航空に向かって話すその様子はもはや人間のものですらないように思えたなんで
2674.2161	4.4400	overt	2669.9700	2738397	なんでバイト先でまで君や普通に恋人として受け入れられているんだ
2679.9161	5.9400	overt	2675.6700	2744234	急にどうしてバイト先の話が出てくるのそれに恋人が恋人として受け入れられて何がおかしいの
2687.2061	3.9600	overt	2682.9600	2751699	もうたくさんだこっちの頭までおかしくなる君は言ったいな
2696.2661	1.1400	overt	2692.0200	2760976	そんなことって
2698.9961	2.6700	overt	2694.7500	2763772	そんなことあるわけないじゃんだって
2703.0161	2.6400	overt	2698.7700	2767888	私は今まであんなに何を言ってるんだ
2712.2261	2.0100	overt	2707.9800	2777320	そういうことなんだねそっか
2716.2161	1.8900	overt	2711.9700	2781405	頭上の糸が切れて地面に降り立って
2738.5961	6.2400	overt	2734.3500	2804322	モニターの向こうで何かを悟ったらしい彼女の姿からはそんな光景が連想された
2745.7961	6.6000	overt	2741.5500	2811695	神様は意地悪だよね何をしてくれても何をしてあげてもその後ろにある石なんて想像しかできない
2753.1761	7.1400	overt	2748.9300	2819252	それなのに言葉にできることだって考えてることのほんの一かけらじゃあ私も君も何を信じたらいいんだろうね
2761.6061	2.7300	overt	2757.3600	2827885	自分の心温の高まりと対照的に
2765.2361	4.1700	overt	2760.9900	2831602	彼女の声はさなぎのように穏やかだったずっと何を言っているんだ
2770.3961	3.7200	overt	2766.1500	2836886	君はどこの誰なのか誰が目的なのか教えてくれよ
2776.8461	3.0000	overt	2772.6000	2843490	どこの誰って君の恋人だってずっと言ってるじゃん
2781.2561	4.3800	overt	2777.0100	2848006	君もそのうち気づくはずだよ私と君はそうしそう愛なんだって
2787.0761	4.4400	overt	2782.8300	2853966	そんなこと言われても意味がわからないだろう意味を分かりたいなら焦っても仕方ないよ
2792.5961	6.9900	overt	2788.3500	2859618	ゆっくりお話ししようよ朝焼けもまだまだ来ないんだから一度生まれた輪郭はゆがむことはあっても消えることはないの
2825.5661	2.6100	overt	2821.3200	2893380	築橋ってさ嫌な町だよね
2829.1361	3.8400	overt	2824.8900	2897035	それは病院に行ったのはやっぱりそれ本当は浮き橋に行った
2833.7561	1.3800	overt	2829.5100	2901766	認めるってこと
2836.4261	4.3500	overt	2832.1800	2904500	さあどうなんだろうね後で私の頭をなでてみたら分かるよ
2842.1561	4.2900	overt	2837.9100	2910368	そんなことより君や受付橋のことが気に入ってるの急に何の話
2847.7661	6.8400	overt	2843.5200	2916112	僕は君が誰なのかをそんなイライラしないでよ私とお話ししないと君だって何も分からなくて困るんじゃないの
2864.2061	3.9600	overt	2859.9600	2932947	会話で大事なのはしゃべり方じゃなくて聞き方だよ
2881.0961	4.4100	overt	2876.8500	2950242	実際彼女自身の素性に関わることを向こうから話してくれるというのなら
2887.6361	9.4500	overt	2883.3900	2956939	彼女のペースでも聞いてみる価値はあるかというかもはやもはや自分から問い詰めたところでまともに会話が成り立つ気がしない
2898.1661	3.0900	overt	2893.9200	2967722	僕は別に嫌な街だとまで思ったことはないよ
2902.5761	1.8000	overt	2898.3300	2972238	というか君は何が嫌いなの
2905.2461	3.7800	overt	2901.0000	2974972	あの街で楽しくお買い物してても監視カメラが目に入るたびに
2909.8661	3.9900	overt	2905.6200	2979703	悪いことする気なんかなくて悪いことするなよって叱られてるみたい
2914.9961	3.7200	overt	2910.7500	2984956	そんな気分になることないそんなふうに思ったことはないけど
2919.7361	3.7200	overt	2915.4900	2989810	それにそれで悪いことする人が減ってるなら別にいいんじゃない
2924.8061	5.1600	overt	2920.5600	2995001	実際最近は受付橋での事件なんて一つも聞かないしさ
2930.8661	4.0500	overt	2926.6200	3001207	それにさっき君だって大家さんに監視カメラをつけた方がいいって言ったじゃん
2997.7961	3.8700	overt	2993.5500	3069743	それはそうだよ私と受付橋には監視カメラでつながれ
3006.0461	2.4300	overt	3001.8000	3078191	つながりないといけない関係性はないけど
3009.2861	3.5400	overt	3005.0400	3081509	私と君には監視カメラでつながれてもいい関係性があるもの
3014.5661	5.8200	overt	3010.3200	3086916	その僕と君の関係性っていうのは何なのさ君はさ大学の勉強って楽しい
3021.4961	1.2600	overt	3017.2500	3094012	だから僕は君の
3025.8161	1.9500	overt	3021.5700	3098436	下のねくらい乾かさせてよ
3028.9961	3.5100	overt	3024.7500	3101692	ちゃんと君にも関係ある話をするために聞いてるんだよ
3034.1261	4.1400	overt	3029.8800	3106945	すぐに結論だけ聞こうとしても大抵は分かったつもりにすらなれないよ
3039.2861	3.6600	overt	3035.0400	3112229	まあ大学は自分で選んだ学部だしそれなりに楽しいよ
3044.0861	1.1400	overt	3039.8400	3117144	それなりになんだね
3046.3661	4.2600	overt	3042.1200	3119479	だんだん勉強よりも実験みたいに手を動かす方が好きだって気づいたんだ
3051.7661	3.1200	overt	3047.5200	3125008	もちろん実験するためには勉強しないといけないんだけどね
3056.2061	4.1700	overt	3051.9600	3129555	ちょっとうらやましいな君にはいろんな選択肢があってさうらやましい
3061.2461	2.2500	overt	3057.0000	3134716	選択肢から何かを選ばないといけない
3067.0361	3.0000	overt	3062.7900	3140645	自分の欲しい選択肢がないと嫌になっちゃうよね
3071.4461	3.7800	overt	3067.2000	3145161	大体の場合は自分で新しい選択肢なんて作れないし
3082.4561	2.6700	overt	3078.2100	3156435	それは君の進路とかの話
3086.1461	4.8600	overt	3081.9000	3160214	私も君と同じで細胞とかに興味があってそういう研究の仕事をしたかったの
3093.3161	5.4900	overt	3089.0700	3167556	でも両親に学費は頼れないどころか学校に行くこと自体も反対されてさ
3101.4461	4.3800	overt	3097.2000	3175881	学費も奨学金で払って自分で返すって言ってもそういう問題じゃなくて
3106.8161	3.4200	overt	3102.5700	3181380	女流学部なんかに行ってどうするんだって何回言われたの
3111.1961	5.0100	overt	3106.9500	3185865	そんな両親と毎日のようにお喧嘩してたんだけど話はずっと平行線だったの
3124.2161	1.2600	overt	3119.9700	3199197	借金借りるにも
3126.5561	4.5600	overt	3122.3100	3201593	入学手続きするにも親の許可って必要だからね
3133.4861	7.0500	overt	3129.2400	3208690	結局は両親も私の将来を心配してくれてるんだって無理やり納得して諦めたの
3158.2961	5.0700	overt	3154.0500	3234095	であるって事実と運でやるべきって主張は違うはずなんだけどな
3164.8961	3.2700	overt	3160.6500	3240854	自然主義的ゴビューってやつだね
3189.3761	3.6600	overt	3185.1300	3265921	言葉は知らないけど不信者のはずの私に同情してくれてるの
3194.8961	9.6000	overt	3190.6500	3271574	不審者のはずの恋人のつもりなんじゃないのか言ってることが知り滅裂だまあ今はよく分からないというか分からないことが多すぎる一旦話を続けよう
3205.6661	2.0400	overt	3201.4200	3282602	そういうわけではないけどちょっとね
3212.7761	7.4700	overt	3208.5300	3289883	まあ確かに君の言う通り私の両親はさ今の世の中には男性と女性では付けやすい仕事に差がある
3224.8961	3.6000	overt	3220.6500	3302294	だから女性は女性の好きやすい仕事に
3230.0261	2.0400	overt	3225.7800	3307547	つくべきって思ったんだろうね
3259.4261	3.5400	overt	3255.1800	3337652	両親も私の幸せを邪魔したくて言ってるわけでもなかったし
3264.2561	3.9000	overt	3260.0100	3342598	まして政治的な心情で言っているわけでもないのは分かってたからね
3271.3961	2.0400	overt	3267.1500	3349910	それで妥協ってわけじゃないけど
3276.6161	3.3300	overt	3272.3700	3355255	せめて少しでも近い道に進めないかなって思って
3283.1861	4.0800	overt	3278.9400	3361983	就職先にも両親が納得しそうな専門学校で勉強して
3287.9861	2.2200	overt	3283.7400	3366898	今は臨床検査技師をしているの
3291.0461	3.5100	overt	3286.8000	3370031	炎症検査着して細胞の検査とかする仕事だっけ
3296.1761	5.3100	overt	3291.9300	3375284	病院から届いた患者さんの血液とかを検査して診断データを作ったりするの
3303.4061	1.2000	overt	3299.1600	3382688	結構楽しいんだよ
3306.1361	4.6200	overt	3301.8900	3385483	暗い部屋の中で細胞顕微鏡で見ていろんな反応させたりするんだけどね
3312.5561	10.7400	overt	3308.3100	3392057	そうやってると言葉にできないような生命の意思みたいなものを感じるのそれは少し分かる気はするよんでしょうそうやって私はいろんなことに満足して暮らしていたつもり
3323.8061	4.7700	overt	3319.5600	3403577	別に人生を妥協したとも思ってなかったよでも検査だけじゃなくていろいろ
3329.5961	2.8200	overt	3325.3500	3409506	実験もいろいろしてみたかった気持ちもあったの
3333.7961	4.5600	overt	3329.5500	3413807	だから自分の血を採血して菌がどうやって繁殖していくのかなって
3339.5561	4.2300	overt	3335.3100	3419705	シャーレで培養して観察してみたりとかそんなことを勝手に試したりもしてたの
3344.6261	3.0900	overt	3340.3800	3424897	自分の体でできることなんて遊びくらいのものだけどね
3358.1261	1.6800	overt	3353.8800	3438721	知らない不審者じゃなくて
3360.5561	1.8600	overt	3356.3100	3441209	私のことに興味が出てきた
3365.8661	3.9900	overt	3361.6200	3446647	今のところ自分と彼女の間のつながりに関する話は出てきていない
3371.1761	3.7500	overt	3366.9300	3452084	でもそれはそれとして彼女の話目は興味を惹かれるところがあった
3378.5261	2.0700	overt	3374.2800	3459611	でもそれは現実的に難しいよ
3387.8861	4.0200	overt	3383.6400	3469195	生活費も払いながら勉強して学費を貯金して
3392.6561	3.4500	overt	3388.4100	3474080	しかも大学に通う間の生活費だって必要になるから
3397.3361	3.2100	overt	3393.0900	3478872	私の人生は今いる場所で十分幸せ
3412.0361	5.2500	overt	3407.7900	3493925	何月の夜に犯罪が増えるって言われているのはどうしてなんだろうね
3419.1761	5.9700	overt	3414.9300	3501236	今日は満月がきれいだね窓に目をやるといつの間にか月を覆っていたほこりが消え去っていて
3425.9861	5.9400	overt	3421.7400	3508210	赤身が勝った月は満月だったことに気がついた君って結構抜けてるところが多いよね抜けてる
3432.7961	2.4000	overt	3428.5500	3515183	さっきの親さんと君の会話だよ
3436.5161	4.5600	overt	3432.2700	3518992	モーグラも監視カメラで見つけられたらいいのにねそれはさすがに難しそうじゃない
3441.6761	4.5900	overt	3437.4300	3524276	モグラの顔認証なんかできるのかは知らないけど小さすぎるよまあそれもそうだね
3448.4561	8.0400	overt	3444.2100	3531219	実際のところ最近の気づき橋の監視システムも全然当てにならないしうちのマンションも監視カメラつけた方がいいかしら
3459.2861	4.3500	overt	3455.0400	3542309	自分で想像して輪郭を与えないとダメだってさっきも言ったじゃん
3471.4361	5.3400	overt	3467.1900	3554751	私君が気づいてくれるのをずっと待ってるんだよ何を言ってるのか全くわからないけれど
3477.6461	3.9300	overt	3473.4000	3561110	でもさっきまでの親さんとの会話で彼女は何かに気づいているらしい
3486.7961	3.0000	overt	3482.5500	3570479	事故とか経験の予防ってあんまり評価されないんだよね
3491.7161	3.3300	overt	3487.4700	3575517	ガードレールがなかったせいで起きた事故は数えられても
3497.2961	4.0200	overt	3493.0500	3581231	ガードレールがあったおかげで起きなかった事故は数えられないからね
3507.3161	3.9000	overt	3503.0700	3591492	ところでガードレールがあって一度も事故が報告されてなかったら
