onset	duration	trial_type	wav_onset	sample	value
3512.6261	2.4600	overt	3508.3800	3596929	それは事故が起きていないってことになるのかな
3517.2161	4.3500	overt	3512.9700	3601629	まあそんな事故があっても事故の当事者にしかわからないかもしれないけどね
3573.7661	2.7300	overt	3569.5200	3659536	輸送してた珍しいモグラが逃げちゃったみたいで
3577.8761	2.5500	overt	3573.6300	3663745	ハチコツ通行止めにして探してたみたいです
3583.0061	3.0900	overt	3578.7600	3668998	そうなんです私もモグラ見てないかって聞かれたりして
3596.6861	2.7300	overt	3592.4400	3683007	それに受け付けばして今は監視カメラだらけだし
3602.5361	1.1100	overt	3598.2900	3688997	監視カメラかない
3707.1161	2.6700	overt	3702.8700	3796087	宮さんの姿はモニターに映っていなくても顔が
3781.9061	1.7100	overt	3777.6600	3872672	OKなこと言っちゃったんだな
3785.5961	2.7900	overt	3781.3500	3876450	どうして事件が一つも報道されていないのね
3789.9761	2.4600	overt	3785.7300	3880936	監視カメラが当てにならないなんて言えるのか
3794.4161	1.4700	overt	3790.1700	3885482	ってことが言いたいわけか
3866.4461	3.5400	overt	3862.2000	3959241	放送されていないのに監視カメラが当てにならない
3880.6961	10.7400	overt	3876.4500	3973833	気づき橋で殺人魔害のことを知っている世に潰れていたり一人で無防備に歩いていたりする人を狙って背後から麻酔を投与してそのまま懇水していく様子を見ているんだ
3892.8761	1.3800	overt	3888.6300	3986305	でもそれは仕方ないこと
3896.5961	4.9500	overt	3892.3500	3990114	どうして急にそんな早口サイコパス独白白書を始めるの
3902.2361	6.5700	overt	3897.9900	3995890	私は君が何してるかなんて知ってるんだってば私はそんな当たり前のことが言いたかったんじゃないよ
3910.5461	4.3500	overt	3906.3000	4004399	それなら何よねえねえどうして君の犯行ってまだバレてないのかな
3919.8461	1.6800	overt	3915.6000	4013922	いくら資格を探しても
3922.4861	2.4900	overt	3918.2400	4016626	監視カメラが大して当てにならなくてもさ
3927.2561	6.0600	overt	3923.0100	4021510	麻酔の打ち逃げなんて適当な通りもなんかして事件の一つにもなっていないのって変じゃない
3935.5061	8.4600	overt	3931.2600	4029958	正直おかしいとは思っているよ実際初めの犯行を行った時の数日の間すぐにバレてしまうことを怯えて眠れなかった
3944.8961	5.3400	overt	3940.6500	4039574	船も何日経っても自分に捜査が及ぶどころか事件の報道すら見当たらなくて
3951.1361	4.1400	overt	3946.8900	4045963	その成功体験に安心して今日今日に至っている
3956.3261	4.1100	overt	3952.0800	4051278	私はねさっき言った通りお仕事でやる検査と
3961.3661	3.1200	overt	3957.1200	4056439	自分の体でできる実験くらいで十分楽しかった
3967.3061	5.5800	overt	3963.0600	4062521	でもさ自分に現れなかった選択肢に出会えたらどうしても我慢できなくなっちゃうよね
3974.3861	2.4300	overt	3970.1400	4069771	君や勉強より実験の方が好きなんでしょう
3978.2861	1.7700	overt	3974.0400	4073765	それも普通ならやっちゃダメな
3980.8061	2.4000	overt	3976.5600	4076345	すごく激しい実験がしたいくらいに
3984.5561	3.9900	overt	3980.3100	4080185	だからようなようなそんなことしてたんだよねそうだよね
3989.1161	1.6200	overt	3984.8700	4084855	それはそうかもしれないけど
3994.1261	4.3800	overt	3989.8800	4089985	犯行の事実とか内心を言い当てて君は何がしたいんだ
3999.6161	1.9200	overt	3995.3700	4095607	君は僕を捕まえに来たのか
4006.6061	1.2900	overt	4002.3600	4102765	座右下しているから
4008.7661	2.8200	overt	4004.5200	4104976	まだ分かってないの君は本当に鈍感だね
4012.3661	5.9700	overt	4008.1200	4108663	もう少し私の気持ちも分かってほしいな言ったじゃん君があんまりお片付けが得意じゃないのも知ってるって
4019.6861	1.7100	overt	4015.4400	4116159	それが同関係あるって言うんだ
4022.5961	2.7000	overt	4018.3500	4119138	私たまたま仕事遅くなっちゃった日があってね
4026.8561	6.4500	overt	4022.6100	4123501	でも満月がとってもきれいできっと素敵な何かがあるような気がしたのどうせ家に着くのは日をまたいじゃうし
4034.0861	5.6100	overt	4029.8400	4130904	もうどんなに遅くても同じかなって思っていつもは電車で帰る道を歩いて帰ることにした
4042.2761	2.7000	overt	4038.0300	4139291	そしたら嫌いな受付場を通ることになって
4045.5461	2.2200	overt	4041.3000	4142639	少し後悔したんだしてたんだ
4049.2661	5.1900	overt	4045.0200	4146448	私は何も悪いことなんてしていないのに月がきれいだっただけなのに
4065.8261	1.4400	overt	4061.5800	4163406	いいことしちゃいけないって
4068.4961	2.5800	overt	4064.2500	4166140	監視カメラの目線に叱られてるみたいで
4072.7561	5.9100	overt	4068.5100	4170502	でもそのおかげで私はそんな目線に付き合う気なんてないっていたげなクロフードの君に出会えて
4079.7461	5.8200	overt	4075.5000	4177660	そのそばで倒れていく誰かを見て運命みたいって思ったの君は私に新しい選択肢をくれたの
4114.0361	3.8100	overt	4109.7900	4212773	そういうことか最悪のつながりだ彼女が何が浮いたかったのか
4119.5861	4.4400	overt	4115.3400	4218456	そしてどうして自分の犯行の証拠が今まで見つからなかったのか
4130.8061	5.0700	overt	4126.5600	4229945	だけど私はお母さんじゃないんだから理由もなく君のお片付けなんてしてあげないよ
4136.8961	5.0700	overt	4132.6500	4236182	ところで同じものを目の前にしても人によって違う興味を向けられるのって楽しいよね
4143.3461	3.9300	overt	4139.1000	4242786	最近は美術館でもアートコミュニケーターって人が作品を見た
4148.2961	2.3400	overt	4144.0500	4247855	人の個人的な文脈みたいなものを
4155.5561	2.8800	overt	4151.3100	4255289	みんなでしゃべるためのコミュニケーションをデザインしたりもするんだって
4159.7261	1.7400	overt	4155.4800	4259560	君は意識に興味があるんだね
4162.7261	4.0200	overt	4158.4800	4262632	私は血液とか細胞とかそういうウェットなものの意見があるの
4319.8361	3.8700	overt	4315.5900	4423512	その日からずっと君が増すよってそのまま残していった人たちを
4324.7861	1.9500	overt	4320.5400	4428581	私が持って帰って使ってるの
4327.3661	6.9900	overt	4323.1200	4431223	自分は運良く犯行がばれなかったわけでもまして監視や警備が不十分だったわけでもなかった
4335.4661	4.1400	overt	4331.2200	4439517	知らない共犯者がいて勝手に証拠を持ち帰って再利用されていたんだ
4346.4461	2.7300	overt	4342.2000	4450761	さすがに死体が一つも見つからないんだからさ
4351.1561	3.0000	overt	4346.9100	4455584	君と両思いの相手がいるってことくらい
4355.2961	1.7700	overt	4351.0500	4459823	気づいてくれてもよかったのに
4357.6061	1.9200	overt	4353.3600	4462189	行為の裏の石どころか
4360.2761	3.0000	overt	4356.0300	4464923	こういうにすら気づいてなかったんだねごめん
4364.5661	5.1900	overt	4360.3200	4469316	恋人が黙って家事をこなしてくれていたようなものを言いに思わず謝ってしまった
4371.0761	6.0000	overt	4366.8300	4475982	彼女自身の行為もその目的も紛れもなく異常者のものなのに
4378.4861	5.1600	overt	4374.2400	4483570	でもだったら僕らは単に理外外一しただけの知らない共犯者同士じゃん
4393.6961	2.4900	overt	4389.4500	4499145	それがどうして僕の出場まで迫って
4397.8061	2.9100	overt	4393.5600	4503353	バイト先に押しかけて恋人なんて話になるんだ
4402.2461	3.2700	overt	4398.0000	4507900	さっきも言ったでしょ私運命みたいって思ったの
4406.1161	3.8700	overt	4401.8700	4511863	だからその日からまた君が現れてくれないかなって願いながら
4410.8561	6.8400	overt	4406.6100	4516717	もしかして一回きりなのかなって不安になりながらイチか月ぐらいずっと夜中の受付橋で君を待ってたの
4418.9861	4.7700	overt	4414.7400	4525042	そうしたらやっぱり君にまた会えたの運命なんだから当たり前だよね
4425.0161	4.6800	overt	4420.7700	4531216	確かにニ回目の犯行までにイチか月ぐらい感覚が空いていた気がするけれど
4430.8361	3.6600	overt	4426.5900	4537176	また監視カメラよけの黒フードをかぶってたからすぐ分かったよ
4435.7861	4.5300	overt	4431.5400	4542245	でも君その日は狙いやすそうな人が見つからなくて誰も襲わずに帰ったよね
4441.6661	5.5800	overt	4437.4200	4548266	ずっとドキドキする恋愛もいいけど少しや堅実なところもある方が長続きするからさ
4448.6861	5.9100	overt	4444.4400	4555455	やっぱりこの人しかいないよねって思ってどこに帰るのかなって一緒に帰ったのスストーカーってことじゃん
4455.5561	2.3100	overt	4451.3100	4562489	違うよ一緒に帰ったの何を言って
4458.8861	3.9300	overt	4454.6400	4565899	そのおかげで君のお家にどうやったら帰れるのか分かったけど
4468.5461	3.0000	overt	4464.3000	4575791	君が直接しゃべったら怖い人だったらどうしようって
4472.3561	1.6800	overt	4468.1100	4579693	延長してそのまま帰っちゃったの
4476.3161	3.4500	overt	4472.0700	4583748	君は優しい天使なのに
4480.9061	1.8600	overt	4476.6600	4588448	勝手に不安になったりしてごめんね
4483.3061	3.4200	overt	4479.0600	4590905	そんなの私の中にとどめればいい気持ちなんだけど
4488.6461	8.1300	overt	4484.4000	4596374	やっぱり謝らないといけないことは謝りたいなってなるで話がかみ合う様子がない彼女は一人で話を続けている
4497.9761	4.5900	overt	4493.7300	4605928	だからお昼とか普段の君も見てみようって思って
4503.8861	2.2500	overt	4499.6400	4611979	しばらく君と一緒にお出かけしていたの
4507.9361	4.1100	overt	4503.6900	4616127	ケミが大学で生物のことを勉強しているって分かった時は
4513.0661	1.9200	overt	4508.8200	4621380	ますますシンパシーを感じちゃった
4518.4061	1.6500	overt	4514.1600	4626848	やっぱりストーカーってことじゃん
4522.1561	2.2500	overt	4517.9100	4630688	違うよ一緒にお出かけしてたの
4531.5161	2.5200	overt	4527.2700	4640272	何より私にとって大事な思い出は
4535.0561	3.5100	overt	4530.8100	4643897	君がウキズッキ橋でバイトをしているのが分かった日
4552.2461	2.1000	overt	4548.0000	4661500	君と一緒にお出かけしてたら
4555.3361	1.9800	overt	4551.0900	4664664	君はカフェに入っていったよね
4570.2761	4.8600	overt	4566.0300	4679963	はじめは一人で読書とかするのかなって思って外に出てくるまで待ってるつもりだったの
4576.3061	5.5200	overt	4572.0600	4686137	でもそうしてるうちに通り雨に会っちゃって私慌ててカフェ一緒のカフェに入っちゃったんだ
4582.8161	3.2400	overt	4578.5700	4692804	私っていつも準備が足りないからさ
4587.9761	8.6100	overt	4583.7300	4698088	ちゃんと天気予報を見てたら雨が降るかもって分かってたはずなのに傘くらい持って出かけたらよかったなぶしょびしょの私を見ないでほしいなって
4597.6061	6.6600	overt	4593.3600	4707949	泣いちゃいそうで震えてたのそうやってずっと何も頼まずにいたらあったかいキャラメルラテが運ばれてきたんだ
4605.3761	2.4300	overt	4601.1300	4715905	私そんなの頼んでないって言ったんだけどね
4609.0361	4.3200	overt	4604.7900	4719653	雨に打たれたお客さんに出してあげてってキッチンのスタッフが言うからって
4613.8961	5.4900	overt	4609.6500	4724630	レイターさんが教えてくれたのキッチンのスタッフなら私の顔なんか見ていないはずなのにさ
4620.9761	4.9800	overt	4616.7300	4731880	後から知ったのはその日にいたキッチンスタッフが君だったことと
4626.7661	5.0100	overt	4622.5200	4737808	君はウェイターさんとの雑談で通り闇に打たれて逃げてきたお客さんがいるって
4632.4661	2.7900	overt	4628.2200	4743645	ちょっと話を聞いたくらいでそんなことをしたんだってこと
4636.2161	3.4800	overt	4631.9700	4747485	確かに自分はバイト先のカフェではケッチンのスタッフをしてるし
4640.5661	4.2600	overt	4636.3200	4751940	雨に打たれたお客さんに温かい飲み物を独断で出すようなことも時々ある
4645.9961	4.3200	overt	4641.7500	4757500	でもそこには彼女が期待するような強い意思なんてない
4652.0861	2.0700	overt	4647.8400	4763736	彼女の凶器を追い隠すような
4655.1461	1.4700	overt	4650.9000	4766870	よい話のような
4657.1561	1.5000	overt	4652.9100	4768928	話なんてどこにもない
4700.9561	5.0400	overt	4696.7100	4813779	私は確信したの君は顔なんか見なくても言葉なんかに頼らなくても
4706.7761	3.4800	overt	4702.5300	4819739	優しくしてくれるし私にいっぱい自由と幸せをくれるんだって
4711.4261	3.7800	overt	4707.1800	4824500	だから私もずっとずっと君のためなら何でもしてあげたいって
4716.4661	1.8900	overt	4712.2200	4829661	私こんな世界大嫌いなの
4719.1061	4.0200	overt	4714.8600	4832365	何も悪いことなんてしてないのに悪いことをするなって見張られたり
4724.0561	4.1400	overt	4719.8100	4837433	今の世の中の女がどうかなんて私には何の関係もないのに
4729.0061	2.8500	overt	4724.7600	4842502	女だからってお父さんとお母さんにまで言われたり
4732.7861	4.9200	overt	4728.5400	4846373	かわいいお洋服を着てワタームみたいにお話ししたいっていうだけで
4738.9961	3.2700	overt	4734.7500	4852732	みんなのイメージするか弱い女の子であるべきにされちゃう
4743.8561	4.1100	overt	4739.6100	4857709	私のお庭に土砂物をまき散らした口で
4748.8661	2.2500	overt	4744.6200	4862839	置かれた場所で避けなさいって言われてるの
4772.6561	2.7300	overt	4768.4100	4887200	私の方からだってみんなにご利用しつけてもいいの
4776.6461	3.7800	overt	4772.4000	4891286	きっと私は殺人鬼ですって堂々と白状したって
4782.4361	2.2200	overt	4778.1900	4897215	かよい女の子がそんなこと言っても
4785.5261	2.0400	overt	4781.2800	4900379	ただの不思議ちゃんであるべきだから
4788.5561	3.9300	overt	4784.3100	4903481	本当に殺人鬼だなんて誰も思わないのだからって
4793.9561	4.3800	overt	4789.7100	4909011	だったら私は君以外の誰との関係性の中でも
4799.2061	2.2500	overt	4794.9600	4914387	何をしたって殺人鬼にはならない
4811.8961	3.8400	overt	4807.6500	4927382	私たちだけにしか見えない透け通ったボニーとグライドみたいね
4819.3661	1.2000	overt	4815.1200	4935031	ボリーとグライドは
4821.8561	2.7000	overt	4817.6100	4937581	クライドは誰から見たって殺人鬼だろ
4825.8461	6.6000	overt	4821.6000	4941666	僕を巻き込まないでくれ負け込むって何にそもそもクライドがいないとボニーや悪い子にならなかったんだよ
4833.8861	5.5500	overt	4829.6400	4949899	それに君には人なんて殺されない自由もあったのにねそれは
4840.5461	2.2200	overt	4836.3000	4956719	君のバイト先の人たちだってそうだよ
4843.7861	2.4000	overt	4839.5400	4960037	私は本当に君の恋人だけどさ
4847.2661	2.6100	overt	4843.0200	4963600	それでも初めて君のバイト先に行った時から
4850.5061	3.8700	overt	4846.2600	4966918	私が君の恋人ですって顔を赤くしながら言えば
4855.5161	3.2400	overt	4851.2700	4972048	誰も疑わないし君のことだって何でも教えてくれるの
4877.0561	3.2700	overt	4872.8100	4994105	スマホのデータ消えて連絡取れなくてって泣きそうな顔したら
4881.2861	4.7100	overt	4877.0400	4998437	みんなの中の私は囲碁すべきか弱い女の子であるべきだから
4887.0761	3.0600	overt	4882.8300	5004366	何の疑問も抱かずに連絡先も教えてくれたの
4898.2961	6.5100	overt	4894.0500	5015855	ねえねえ私はみんなにとって本物の人間なのかな君は私にとって本物の人間なのかな
4907.8361	5.7600	overt	4903.5900	5025624	何をしてくれても何をしてあげてもその後ろにある石なんて想像しかできないそれどころか
4914.6161	3.0600	overt	4910.3700	5032567	私がみんなにとってどうあるべきかが私になるの
4919.2961	3.4800	overt	4915.0500	5037359	じゃあ私も君も何を信じたらいいんだろうね
4923.7961	3.6600	overt	4919.5500	5041967	血液を全部抜いてさキャラメルラテを流し込もうよ
4928.8661	2.7000	overt	4924.6200	5047159	君も一緒にそうしてくれるよね
4932.4961	4.5000	overt	4928.2500	5050876	待って待ってくれ僕はきっと君が期待するほどの意思は持っていないんだ
4937.8661	5.1000	overt	4933.6200	5056375	ただ軽はずみの興味本位とか繊細な善意でやってきただけなんだ
4944.6161	6.8700	overt	4940.3700	5063287	自分は心のどこかで自分の繊細な狂気を分かってくれる相手を探していた気がする
4952.6861	5.7900	overt	4948.4400	5071551	でも彼女は自分の反りとは違う深淵から引きずり出した象物のようなものだ
4959.5261	3.3900	overt	4955.2800	5078555	ウイルスのせいではない汗が全身にあふれていく
4969.1261	1.3800	overt	4964.8800	5088385	そんなことは分かってるよ
4987.7261	1.0500	overt	4983.4800	5107432	むしろ君は
4989.5861	3.9900	overt	4985.3400	5109336	私が大嫌いなこの土砂物まみるの世界で一緒に暮らしているのに
4995.9461	6.5700	overt	4991.7000	5115849	常識とか規範に関係なく自分の意思をかけ込めてうらやましいなって思ってたの
5019.4061	3.1800	overt	5015.1600	5139872	言葉とか説明とか姿形なんて
5024.4461	2.8800	overt	5020.2000	5145033	勝手に決められちゃうものに頼らなくても
5035.2161	4.1700	overt	5030.9700	5156061	きっと何回も一緒に犯行を繰り返してたら
5040.2561	1.7100	overt	5036.0100	5161222	君と愛し合っていたら
5051.5961	2.9400	overt	5047.3500	5172834	私のことに気が続いて心が通じるよね
5056.5161	3.4500	overt	5052.2700	5177872	自分から輪郭を与えてくれているよねって思ったの
5086.3961	3.3000	overt	5082.1500	5208470	気づけるはずがないまして恋人なんて思えるわけがないよ
5116.8161	3.2100	overt	5112.5700	5239620	君は自分の意思でそうしてくれるって思ってたのに
5121.4361	6.8400	overt	5117.1900	5244351	恋人だって名乗ったら全部分かってくれると思ってたのにだったらこんなことも諦めてくれないか
5130.0461	6.7500	overt	5125.8000	5253167	でももう君の意思は関係ないの分からないの君の周りの人たちは私のことを恋人だって思ってる
5137.8761	4.8600	overt	5133.6300	5261185	そんなこと関係ないそれに君だってもう私のことを手放すわけにはいかないでしょう
5144.9261	1.3800	overt	5140.6800	5268404	そうかそうだね
5147.7461	3.5400	overt	5143.5000	5271292	彼女は自分の犯罪を隠蔽した天使であると同時に
5153.2061	3.5700	overt	5148.9600	5276883	自分の犯罪の証拠を握っている悪魔でもある
5157.6461	2.5200	overt	5153.4000	5281430	彼女は本当に人間ではないのだろうか
5161.7561	3.4500	overt	5157.5100	5285638	言葉にできることは考えていることのほんの一かけだ
5166.0161	4.4700	overt	5161.7700	5290000	それなら他人の言葉なんかから選ばないに越したことはないのにね
5172.7661	5.1300	overt	5168.5200	5296912	でも知らないうちに頼んでもないのにいつの間にか選択肢なんか与えられちゃうみたい
5180.3261	4.3800	overt	5176.0800	5304654	それでも君は幸せだよね残った選択肢がハッピーエンドなんだから
5194.0961	2.4900	overt	5189.8500	5318754	うれしいなやっと恋人って認めてくれて
5202.6161	2.6700	overt	5198.3700	5327479	じゃあこの後どうする
5206.5761	4.0500	overt	5202.3300	5331534	満月の夜は犯罪が多くあるべきだってことにしてもいいんじゃない
5211.7661	4.9800	overt	5207.5200	5336848	いや今日は気分じゃないんだじゃあ予定どおり今日と明日は一緒にいようね
5217.8561	4.0200	overt	5213.6100	5343085	お出かけしたら君の写真もいっぱい撮ってスマホの待ち受けにしたいの
5241.4061	8.5200	overt	5237.1600	5367200	君の写真もいっぱい撮ってスマホの待ち受けにしたいのこのまま彼女を返すわけにはいかないだったら一層おとなしく招き入れて彼女のことも
5250.5561	4.0500	overt	5246.3100	5376569	どうしたのいやちょっとめまいがしてなウイルスの影響かなそうじゃないよ
5255.5061	3.9000	overt	5251.2600	5381638	きっとストラグルをぐるぐるしているんだよ彼女の言ってる意味はわからない
5260.5161	4.2300	overt	5256.2700	5386768	でも言ってる意味が分からないと思われたくない君のことも心配だし
5271.4961	2.4000	overt	5267.2500	5398012	もちろん今日はももちゃしないからいいでしょう
5287.1561	2.3400	overt	5282.9100	5414048	ちょっと待ってほしいみなりがしているんだ
5296.8161	5.3400	overt	5292.5700	5423940	落ち着いてから考えたいいいよいくらでも待ってあげるところでイヤホンのノイズキャンセルで
5305.1261	1.4400	overt	5300.8800	5432449	ウミナリオは消せるのかな
5307.4061	1.5300	overt	5303.1600	5434784	どれだけ耳を伝えでも
5309.9561	3.3900	overt	5305.7100	5437395	外線車が天気予報を売りに来るじゃない
5317.6661	2.4600	overt	5313.4200	5445290	あれって何時から再放送されるんだっけ
5323.8461	3.3600	overt	5319.6000	5451618	全言撤回だ君の話はわからないことが多すぎる
5334.5561	3.3300	overt	5330.3100	5462585	その前言は私には聞こえてないからさ
5339.1461	3.7800	overt	5334.9000	5467286	きっとそれは内言の全言だよ内言の全言だよ
5343.9461	2.4600	overt	5339.7000	5472201	でも無駄だよちゃんと前を向いていないと
5347.2761	4.9500	overt	5343.0300	5475611	首輪がカーティンアニメの強そうな犬みたいに鉛色でトゲだらけだったらさ
5369.5961	1.0200	overt	5365.3500	5498466	向いているべきなんじゃない
5371.6961	2.7600	overt	5367.4500	5500617	どうなんだろうね君の世界を
5378.9561	8.5800	overt	5374.7100	5508051	君の世界も僕の世界も分からなくなってきたんだと思うでもちゃんと分かることができるようになるよ
5410.2461	1.7100	overt	5406.0000	5540092	首は外せないことを知って
5414.2061	3.0300	overt	5409.9600	5544147	鎖の長さよりも遠くまで行く石を持つことと
5420.7161	1.1400	overt	5416.4700	5550813	鎖の長さ
5424.9161	4.7400	overt	5420.6700	5555114	広がる距離を愛することが自由だと誇ることはどっちが君の自由なの
5474.4161	1.9500	overt	5470.1700	5605802	どっちが君の自由なの
5477.6861	7.5600	overt	5473.4400	5609151	それは答えられない聞かれていることの意味は分かるよでもまだ決めかねているんだ自分探しの旅が終わらないのは
5486.3261	4.2000	overt	5482.0800	5617998	本当の自分なんていないからだよ旅の話は君がしたんじゃないか
5492.2361	5.9400	overt	5487.9900	5624050	そうだった旅の話は君がしたのか私はただ君がちゃんと爪を切ったかどうかを聞いたんだよ
5499.3461	6.5100	overt	5495.1000	5631330	でも夜に爪は切るなって言うじゃないかそれは夜に明かりがなかった時代に指を切ってしまわないための知恵だよ
5507.0561	1.5600	overt	5502.8100	5639225	言葉にできることは
5510.5961	2.5200	overt	5506.3500	5642850	考えてることのほんの一かけらだけど
5514.0461	3.8700	overt	5509.8000	5646383	それでも言葉には糸や石があるの
5519.3561	3.3300	overt	5515.1100	5651821	爪を切った直後は指先の感覚が来るからだよ
5526.9761	2.7000	overt	5522.7300	5659624	ジョージの最中なんか元から狂っているよ
5536.9361	4.3500	overt	5532.6900	5669823	正規よりも私のことを大事にするべきに決まっているじゃない
5542.2761	4.6500	overt	5538.0300	5675291	定規で線がまっすぐ引けるのはデカルと座標形の中だけだもの
