onset	duration	trial_type	wav_onset	sample	value
5548.1561	6.3000	overt	5543.9100	5681312	それなら首輪の鎖が窮屈かどうかもノルームにしないと分からない
5556.1661	2.9400	overt	5551.9200	5689514	それは一理あるけれど一理あるだけだよ
5560.8461	5.4600	overt	5556.6000	5694306	そもそも自分の首にある鎖に犬は気づいているのに人間は気づかないふりをしているの
5573.8361	3.1800	overt	5569.5900	5707608	違うんだ何が違うの違うとにかく違うんだ
5578.0361	3.9900	overt	5573.7900	5711909	そうだとすれば人間は犬なのそれを決めるのは犬の都合です
5583.8861	4.5000	overt	5579.6400	5717899	私が嘘をついてるって言いたいわけそうじゃないよそう思っていないなを知ってるよ
5589.3161	4.3200	overt	5585.0700	5723460	怒っているわけじゃないのか弱い女の子であるべきの
5594.4461	3.3600	overt	5590.2000	5728713	影格好で鍵をかけられているのは本当は私じゃないの
5610.9161	1.5000	overt	5606.6700	5745578	フロイデの隙間には
5613.5261	2.2800	overt	5609.2800	5748251	きっとビル風も通らないからね
5672.6261	2.7900	overt	5668.3800	5808769	だから本当に必要なのは首輪じゃなくて虫かぼ
5677.0361	4.2900	overt	5672.7900	5813285	そういえば受付橋の駅前には新しい研磨剤が立つんだっけ
5689.0961	1.8900	overt	5684.8500	5825634	そうだねそうだった気がする
5692.1261	4.4400	overt	5687.8800	5828737	彼女に皇帝や否定をされることはなぜだか無性に嬉しかった
5697.6761	2.1900	overt	5693.4300	5834420	確かベランダにはぬるがまだあったはず
5701.1561	3.4500	overt	5696.9100	5837984	日が昇るまでに集め込んでさがどうしよくらにしようよ
5705.6861	3.0900	overt	5701.4400	5842623	手伝うよいいの君はそこに座っておいて
5711.0561	2.8800	overt	5706.8100	5848121	私がやってあげるからあれ今どうかした
5717.2961	5.6400	overt	5713.0500	5854511	いや昔の夢を見ていた気がしたんだ夏がまだ来たことないくらい昔の夢
5723.8361	2.6100	overt	5719.5900	5861208	飼っていた犬がさいやあれはマウスだったかな
5761.8761	8.4600	overt	5757.6300	5900161	そうあれはコオロギだった夏は来ないのに冬になると寒いから家の中で暖房に当たったりしていたいつも一緒の布団で眠っていたんだ前朝
5770.9661	7.7700	overt	5766.7200	5909469	目が覚めるたびに自分だけが生きていてみんな冷たくなっていないかが怖くて友達が呼吸をしていることを何よりも先に確かめることから
5779.3061	2.1600	overt	5775.0600	5918009	あの頃の人生は始まっていたんだ
