onset	duration	trial_type	wav_onset	sample	value
32.2661	4.5000	overt	28.0200	33040	食べられそうな和洋肉ができて食べてみたのはサンか月前くらいだよ
37.9961	4.2900	overt	33.7500	38908	正直なところそんなにおいしいものだとは今も思ってないよそれでも
43.2161	6.9300	overt	38.9700	44253	この世で自分だけがあの子の味を知ってるってことがさどうしようもなく特別なことのようなねえ君さ
51.0761	9.7500	overt	46.8300	52302	あの子のことはよく知らないとか協力してくれる相手でしかないと言いながら人間の味への興味があの子の味への興味にすり替わっているのを自覚している
62.3561	4.7700	overt	58.1100	63853	一般化して人間の味は述べられないから正しく言葉を使っただけだよ
68.5961	5.6400	overt	64.3500	70242	まだ誰も人間の味の個人間の不変性も得意性も知らないんだから
75.4361	5.4300	overt	71.1900	77247	人間の味の一例としてあの子の味を自分は深く知っているって話をしているんだ
95.2061	5.9400	overt	90.9600	97491	本当に自覚がないのかわざとそんなふうに言ってるのかが曖昧だねああいう話を続けて
102.9461	4.2300	overt	98.7000	105417	あの子にも培養がうまくいって食べてみたことは伝えたけれど
108.0161	2.5200	overt	103.7700	110608	そのこと自体への反応はそっけないものだった
111.7661	7.7100	overt	107.5200	114448	興味が満たせたのならよかった唐だけでどんな味がしたのか何が見えたかなんてことは聞かれることはなかった
120.4661	1.4700	overt	116.2200	123357	それより気が済んだなら
128.4461	6.0600	overt	124.2000	131529	それ以来僕もあの子に培養肉の話はしなくなった
135.8261	6.9300	overt	131.5800	139086	でも培養肉を作ったのはそのイチ回だけじゃないんでしょうだって君の家にはまだ培養肉が残ってるんだから
144.0161	3.6000	overt	139.7700	147472	そのとおりだよその後も僕はあの子に言わなかっただけで
148.7261	2.0100	overt	144.4800	152296	培養肉を作っては食べていた
151.8161	7.4700	overt	147.5700	155460	繰り返すうちに培養も効率化されたしあの子の味への理解も深まっていく気分だった
161.9861	3.7800	overt	157.7400	165874	ここで僕の興味を避けるのに関係性も途切れない
166.5161	14.9700	overt	162.2700	170512	あの子自身が何を持っていたかは徐々に分からなくなっていったよそのギャップからそれだけじゃ満足できなかったそういうことなのかな確かにそうしているうちにあの子にも自分の見ている世界を分かってほしくなった
182.5361	4.8300	overt	178.2900	186917	それで一度くらいは実物の培養肉を見に来ないかって誘ったんだ
188.3861	16.9800	overt	184.1400	192907	はじめは僕がまだ培養を続けていたことに相当驚いていたって表現で合ってると本州で思っているいちいちつっかかってこないでくれるかなとにかく売用を続けていたことは言っていないだけで隠していたわけでもなかった
206.0861	8.0400	overt	201.8400	211032	それで最終的にはしぶしぶって感じだったけど夕方までちょっと夜だけならってことになった食べさせようとしたのまさか
217.4561	2.5800	overt	213.2100	222675	君のしたことを思えばまさかじゃないよ
221.2061	14.4900	overt	216.9600	226515	でもそうでなくともあのことはやっぱり見ているものは重ならなかった記憶を少しずつ掘り返していく自分でも取り返したくない記憶だあの子を家にあげてからしばらく足いない話をしていたんだコーヒーでも入れてさ
236.9261	6.3300	overt	232.6800	242612	それで一杯目のコーヒーが空いた頃に僕は冷蔵庫の中の培養肉を見せようとした
244.2161	4.6500	overt	239.9700	250077	するとあの子はまあそんなこといいじゃんそれよりソツアルとか見せてよなんて言ってた
249.7961	9.7500	overt	245.5500	255791	そんなことって言葉が何かのスイッチになった気がするその時に気づいたんだよ自分だけがあの子の味を分かっているなんてこと自体が勘違いだと
260.0561	4.2600	overt	255.8100	266297	僕がいつまでも満足できなくてあのことを見ているものがかみ合わないのは
265.2761	4.7100	overt	261.0300	271643	偽物の培養肉から本物の味を想像しているにすぎないからだって
342.8561	4.9200	overt	338.6100	351085	その日が本物を知ることができる最初で最後のチャンスだろうと思ってしまったんだ
349.1561	2.5500	overt	344.9100	357536	だから入れ直したコーヒーに睡眠薬を持って
354.4061	4.3800	overt	350.1600	362912	ソフトテニスは今でも時々サークルなんかでやると言っていたから
360.2561	4.5600	overt	356.0100	368902	ラケットは握れる方がいいだろうななんてことを漠然と考えながら
365.5661	4.6500	overt	361.3200	374340	あの子が意識を失った後でできるだけきれいに痛みも残さないように
371.3261	3.8700	overt	367.0800	380238	まるでそこに初めからなかったかのように
376.0361	1.6800	overt	371.7900	385061	あの子の片足を奪った
378.2561	4.7400	overt	374.0100	387334	そのまま目を覚ます前に持ち物から住所と鍵を見つけて
383.9261	6.5700	overt	379.6800	393140	一人暮らしのアパートまで運んでベッドに寝かせたひどい目を覚ましたらいつの間にか自分の家にいて
391.9061	5.7300	overt	387.6600	401312	肩足を失っていることに気づいたあの子の恐怖はどれほどのものだったのだろうか
398.3561	3.7500	overt	394.1100	407917	今もまだ震えているのか心が壊れてしまったのか
402.9461	2.4900	overt	398.7000	412617	それこそ何も話せなくなってしまうほどに
408.7961	6.4200	overt	404.5500	418607	あの子から奪った体は少しだけ食べた後でできるだけ防腐処理を施してきれいにして残している
416.0561	3.1500	overt	411.8100	426041	へと口食べた後それ以上食べる気がしなかったんだ
420.7961	4.5600	overt	416.5500	430895	培料肉と本物の肉を比べたところであの子の本当の味どころか
426.9161	3.1200	overt	422.6700	437162	別人の細胞だったことにすら気づけなかったんだな
431.4461	3.0000	overt	427.2000	441801	これで自分が話せる真相は全部だよ
437.1161	2.6100	overt	432.8700	447607	空は少しずつ白見始めていた
441.1061	2.6400	overt	436.8600	451693	さっきの君はさあの子は
444.3761	3.7500	overt	440.1300	455041	僕のことをなんて言ってたなんてどうして聞いたんだろうね
452.3261	4.8900	overt	448.0800	463182	別に大した人なんてなかったよそれねその質問には答えてくれなかったじゃん
458.3861	3.1500	overt	454.1400	469387	あの子にそこまで取り返しのつかないことをしておいて
462.7961	7.1400	overt	458.5500	473903	そんな恋する中学生みたいなことを結構厳令君にはないよそんなつもりじゃあの子の世界では何が見えていたんだろうね
472.3061	9.1500	overt	468.0600	483641	サイエンテストとメンヘラはせめてどっちか片方にしてよ僕の見てる世界を分かってほしくなったとか言って
482.8661	5.1600	overt	478.6200	494455	とか言ったけどあの子の世界を分かろうとすることはいくらでもできたはずだよ
488.8961	3.1500	overt	484.6500	500630	あの子はさこっそり代わりを用意するほどに
492.5561	3.3000	overt	488.3100	504377	受け入れられなかったけど投げ出せなかったんだよ
496.9661	7.5300	overt	492.7200	508893	それが行為なのかおびえなのか責任感なのか慈悲なのか受費なのか執着なのか行為の裏にあった意思が何だったのかわからないけどさ
505.7561	9.8400	overt	501.5100	517894	少なくともあの子は投げ出せなかったそうだねその通りかもしれないその果てにあの子は結局この家もできてしまったんだな逃げ出すことだってできたのに
516.4061	5.4000	overt	512.1600	528800	認められなくなっただけでしょう人間への興味はただのきっかけにすぎなかったことも
533.3261	4.8300	overt	529.0800	546126	偽物と見比べて知りたかったのはあの子の本物の味なんかじゃないことも
539.4161	3.6300	overt	535.1700	552362	ただでさえ他人の意思なんか想像しかできないのにさ
545.8661	5.9100	overt	541.6200	558967	受け入れてもらえない側面があるって分かれきっているのに中が続いていただけでも
553.8461	4.2600	overt	549.6000	567138	もっと想像すべきことがいくらでもあったはずだよそうだね
559.1261	3.6900	overt	554.8800	572545	最後にあの子に会った日は高校時代によく行った
563.5661	3.4500	overt	559.3200	577092	風丘のカフェでアイスを頼んだの
568.0061	2.8500	overt	563.7600	581638	あの子はその後君の家に行くって言って
572.7461	2.5500	overt	568.5000	586492	大丈夫かなって少し怯れていた
576.2861	5.1300	overt	572.0400	590117	男の人の家に一人で行くことへの心配とかそういう雰囲気とは全然違ったよ
582.2861	4.4100	overt	578.0400	596261	でも細胞だけ渡すのと違って私が変わってあげることもできないし
644.2061	4.5300	overt	639.9600	659667	私は溶けていく愛想を眺めてることしかできなかったの
650.8961	3.9000	overt	646.6500	666518	彼女の声は話を続けるにつれて震えを増していった
730.1261	2.7000	overt	725.8800	747649	でも本当は優しくて楽しい人だし
733.5761	4.8000	overt	729.3300	751182	むしろ彼の興味に気が済んだら私たちだけの心の中にしまって
739.1861	3.9000	overt	734.9400	756927	前みたいに何も気にせず楽しくお話できるようになるかもって
743.8061	3.5700	overt	739.5600	761657	自分にケカするように言ってたそれでその後
747.9161	6.1800	overt	743.6700	765866	引き止めたり不安があったりする方が大事だと思わせちゃいそうで私はカフェであの子を見送った
755.5961	4.9500	overt	751.3500	773730	そのせいでそのせいで不思議と心は浅なぎのようだった
761.4461	5.0400	overt	757.2000	779721	もういいでしょう早く出てきてよ彼女の声は感情を流し切ったかのように平坦だった
767.3261	5.4000	overt	763.0800	785742	分かったよ今そこを開ける興味本位で踏み込んでしまったのは自分も同じだいや
773.5661	5.3100	overt	769.3200	792132	自ら踏み込んだ自分と踏み込まされたあの子は違うそのせいで他人の意思も
779.6861	6.7800	overt	775.4400	798399	自分が本当に持っていた意思も見誤ってしまったその気づかないふりをしていた医師に輪郭を与えられて
787.5161	4.7100	overt	783.2700	806416	過ちを罪として裁かれる日が来ることをむしろ望んでいたのかもしれない
793.0961	3.9600	overt	788.8500	812130	警察でもどこへでも連れて行ってくれ自分から全て話すよ
800.6861	3.2400	overt	796.4400	819903	恋人を名乗った意図は結局わからなかったけど
805.2761	8.5200	overt	801.0300	824603	仕事を彼女は成し遂げた自分が言えたことではないけれど二人は少しでも日常へ戻れることを願いたい
814.3661	2.1900	overt	810.1200	833911	朝焼けまであとどのくらいだろう
821.7161	4.6200	overt	817.4700	841437	連れて行く何言ってるの彼女の姿を見るや冷や汗があふれた
826.9361	4.0800	overt	822.6900	846783	その手には包丁が握られている復讐のために殺すつもりだったのか
832.3361	7.4100	overt	828.0900	852312	罪を受け入れるつもりではいたけれど殺されるとなれば話は別だしかし彼女は予期しない言葉を続けた
840.9161	3.2700	overt	836.6700	861098	言ったじゃん私は君のことが大好きだって
845.2961	6.5100	overt	841.0500	865583	私は君に愛してもらうために来たんだよ私のこと細胞の底まで覗け込んでくれた君にさ
860.3261	5.9400	overt	856.0800	880974	急に何を言い出すんだ罪を追求した彼女とは別人のようにまとう空気が変わっている
867.4661	4.1700	overt	863.2200	888285	言葉にできることは考えていることのほんの一かけら顔とか
872.3261	1.1400	overt	868.0800	893262	何が好きとか
874.9661	2.1000	overt	870.7200	895965	今まで何を見てきたとか
877.6061	4.9800	overt	873.3600	898669	体温とかどこが気持ちいいとかそんな普通の恋人程度のことじゃなくて
883.2761	2.5800	overt	879.0300	904475	本当に君にしか分からないような私を
892.9661	3.0300	overt	888.7200	914397	それもただ見るだけじゃなくていっぱいいじり回した上に
896.8961	1.6800	overt	892.6500	918422	君の中に取り込んじゃった
900.3761	4.9200	overt	896.1300	921985	そんなことをされたら私のことを君より分かってくれる人なんてもう会えないじゃん
906.3461	4.9200	overt	902.1000	928098	もう私には君しかいないし君にも私しかいないはずそうでしょう
912.6761	4.8000	overt	908.4300	934580	あの子は君のことを受け入れられなかったしそのせいで君は悲しい気持ちになった
918.3161	2.9100	overt	914.0700	940356	でも私は君のことを全部受け入れられるんだよ
923.5961	2.4000	overt	919.3500	945762	それなのに私にも分からないような
932.8061	2.4000	overt	928.5600	955193	私の細胞の底まで食べてくれたのに
936.0761	4.6200	overt	931.8300	958542	君が見てるのはあの子じゃないって違うってずっと気づいてなかったなんてひどいよ
958.6061	4.9800	overt	954.3600	981613	本当は気づいてほしかった愛してくれたのは私だと気づいてくれると信じてた
978.7361	3.1200	overt	974.4900	1002226	君はあの子のことを本物と勘違いしたまま
982.8461	2.1300	overt	978.6000	1006434	あの子を間違って愛してる
993.0161	3.7800	overt	988.7700	1016848	本当の私の細胞のそこまで覗け込んで食べてよ
998.1161	2.7000	overt	993.8700	1022071	あの子がなり変わるなんてずるい
1002.0761	3.6600	overt	997.8300	1026126	偽物じゃない本物の私を見て君の中に入れて
1007.2961	6.8100	overt	1003.0500	1031471	私も何されたっていいよ痛いのも気持ちいいのも全部受け止めるからだから待ってくれ
1015.3061	5.0700	overt	1011.0600	1039673	君を愛してるとかそんなつもりじゃないそんなつもりじゃないじゃあどんなつもりなの
1021.6061	4.2600	overt	1017.3600	1046125	君は混乱しているんだあの子にしたことは謝っても許されないけど
1026.6461	5.6100	overt	1022.4000	1051286	意思をかけて償うそんな話はしてないよ君こそ混乱しているんじゃない仕方ない人だね
1033.7561	6.4200	overt	1029.5100	1058566	でも少しくらいダメなところがある方が愛おしいよ彼女の声はすでに自分へ向けられたものではなかった
1041.3461	6.2700	overt	1037.1000	1066338	分かった分かった君の言う通りだ僕は確かに君のことを愛してるよその良さと
1048.4561	6.0300	overt	1044.2100	1073619	狂気の恐怖から逃れるために彼女に寄り添う言葉が本能から出たそっか
1055.6261	5.1900	overt	1051.3800	1080961	さっきは愛してるって言葉が大事なわけじゃないって言ったけどちゃんと言ってくれるとすごく嬉しい
1061.7761	9.1200	overt	1057.5300	1087259	私のことずっと見ててね細胞の底までずっとずっとそういった彼女の言葉は今も自分を素通りして航空へ向けられている
1071.9761	6.1800	overt	1067.7300	1097704	しかし彼女自身は何かに納得したのだろうか口調に穏やかさが戻ったようだった
1078.7561	1.5000	overt	1074.5100	1104646	まず助かったのだろう
1081.4261	2.0100	overt	1077.1800	1107380	瞬間アイスクリームが溶けて
1085.8961	1.1100	overt	1081.6500	1111958	感触があ
1087.6061	2.7900	overt	1083.3600	1113709	でもさ私ばっかり愛してもらったらダメだよね
1091.2061	13.8300	overt	1086.9600	1117395	恋は一人でできるけど愛し合うのは一人じゃできないもんね遠のく意識の中で彼女の上言のような言葉が耳鳴りのように響いていた大丈夫だよ私も本当に君のこと愛してるよ
1106.0261	3.9900	overt	1101.7800	1132571	だから私も私も君のこと細胞の底まで分からなきゃ
1111.1261	7.4700	overt	1106.8800	1137793	でも私うまくできるかな理科の科目って興味はあるし講義に潜ってたけどどうしても向いてなくてさ
1119.7961	7.8900	overt	1115.5500	1146671	数式で書かれるメカニズムみたいなことってあんまり現実味がないというかでも君はそういうふうに世界を見ることができるんだろうね
1128.9461	5.3100	overt	1124.7000	1156041	いいな私も君がどうやって世界を見てるのかちょっとずつ分けてくれたら
1134.8561	1.5000	overt	1130.6100	1162093	きっと彼女の心はもう
1140.2261	2.1900	overt	1135.9800	1167592	これはどういう状況だったんでしょうね
1143.6461	4.6500	overt	1139.4000	1171094	利益が込み上げるのを飲み込んで隣にいる先輩刑事に話しかけた
1154.9261	1.4700	overt	1150.6800	1182644	返ってこなかった
1158.0761	5.6100	overt	1153.8300	1185870	異変を指して通報した親は気が動転しているらしく証言が得られない
1164.6461	2.0400	overt	1160.4000	1192598	ただ私があんなことをしなければ
1174.8761	3.1200	overt	1170.6300	1203073	世話ごとのように繰り返している地上のもつれですかね
1178.9261	5.5200	overt	1174.6800	1207220	この状況をニ人でどうやって作るんだ部屋には火上に冷房が効いていた
1186.1561	4.9800	overt	1181.9100	1214624	そこには誰のものか分からない左足と男性の遺体が一つ
1191.9761	2.6700	overt	1187.7300	1220584	足は根元から丁寧に切断され
1195.9961	3.9600	overt	1191.7500	1224700	うちももの表面が少し
1200.4961	3.0600	overt	1196.2500	1229308	そがれた後に暴風処理が施されていた
1205.0561	3.7500	overt	1200.8100	1233977	それらの低調に扱われた形跡にもかかわらず
1209.8861	3.6600	overt	1205.6400	1238923	その足は床へ乱雑に放り出されていた
1214.6261	3.7500	overt	1210.3800	1243777	男性は全裸で腹部を刃物で刺された痕跡と
1219.3361	5.9400	overt	1215.0900	1248600	顔や腕腹や内股の肉がまばらにひけちぎられたようなくぼみがあった
1226.4461	4.5900	overt	1222.2000	1255881	遺体の周辺には褐色のガラス瓶が乱雑に転がっていた
1231.9361	7.5600	overt	1227.6900	1261503	テーブルにはかわいらしい丸文字で買い物に行ってきます温めて食べてくださいと書き残された付箋が貼られていた
1293.1061	5.7000	overt	1288.8600	1324141	開けっぱなしの冷蔵庫では自然のものとは思えない火色の生肉が溶け出していた
1311.3461	3.6600	overt	1307.1000	1342818	いつの間にか眠ってたみたいださすがに体力の限界だったらしい
1354.3061	8.4300	overt	1350.0600	1386809	まさか自分の身辺を探られているのだろうか好意を持った恋人を名乗って何かを受け出そうとしているとかそんな周りこういう
1363.4561	2.5500	overt	1359.2100	1396179	不当な警察だということはないだろうけど
1367.1761	1.3500	overt	1362.9300	1399988	警察じゃないのか
1374.2561	2.0700	overt	1370.0100	1407238	いずれですよ今はまだ何も分からない
1377.4061	4.3800	overt	1373.1600	1410464	焼け付けの場所とかこういう関係くらいなら勝手に調べられるのかもしれないけど
1382.8061	9.1500	overt	1378.5600	1415993	バイト先で聞いたなんてことまではそう簡単に分からないんじゃないか単に心配を探られているだけじゃなくて知り合いにも接触されているんだろうか
1397.9861	5.9400	overt	1393.7400	1431538	ドアを開けた瞬間に家の中に踏み込んで家探しされたりしないか
1404.8861	7.1700	overt	1400.6400	1438603	それはさすがに心配だからやめとくよ自分の身がだけどそっか早く治ったらいいねというかいつから具合悪いの
1413.0761	5.3400	overt	1408.8300	1446990	今日も無理して出かけたの具合悪くなったのも今日の今日だよ朝から少しずつ
1419.1661	2.7600	overt	1414.9200	1453226	ちょうど昨日までが潜伏期間だったんだろうね
1424.1161	1.7100	overt	1419.8700	1458295	嬉したわけじゃないならまだよかった
1426.6061	1.9200	overt	1422.3600	1460845	もちろんそんな思い出はないけど
1430.1161	11.0400	overt	1425.8700	1464439	もっともらしい記憶を語れば気を許すかもしれないとでも思われているならずいぶんといい加減な未定というか少なくともやっぱり警察とかではない気がするというかそのテーマパークは何なんだ
1442.3261	6.3600	overt	1438.0800	1476942	そうだね今月中にはまだ行けるように安静にするよ手がかりが得られているようでそうでもないような
1453.4561	3.0000	overt	1449.2100	1488339	頼み事でもしてみれば何かヒントが得られるかもしれない
1457.1161	5.6400	overt	1452.8700	1492087	もし自分の身品を探ることが彼女の目的ならこれをきっかけに何かしてくれるかもしれない
1467.9761	4.0800	overt	1463.7300	1503208	それにここを一旦離れてもらっている間に少し頭を整備したい
1473.1061	2.4900	overt	1468.8600	1508461	というかごめんね楽しくていっぱいしゃべって
1476.2261	5.7000	overt	1471.9800	1511656	人の気持ちを考えようってみんな小さい頃から言われているはずなのにいまだにうまくできないや
1555.4561	4.6800	overt	1551.2100	1592787	月月橋の網裏騒動に巻き込まれたと言っていたな
1560.9461	4.9800	overt	1556.7000	1598409	でも彼女は今日カーザオケ町の美容院に行ってそのまま家に来たんじゃなかったか
1566.7961	4.2600	overt	1562.5500	1604399	本当は病院じゃなくて受付橋に行ってしかもそれを隠そうとした
1571.8361	6.7500	overt	1567.5900	1609560	考えすぎではないよなもしそうだったとしたら何のために彼女が嘘をついているなら隠さないといけないだけの理由があるはずだ
1582.5461	2.8200	overt	1578.3000	1620527	いずれにせよこのままおしゃべりを続けているわけにもいかない
1586.2961	5.2500	overt	1582.0500	1624367	彼女に踏み込むべき疑念があるならこちらから行動を起こさなければいけない
1599.3161	3.1500	overt	1595.0700	1637700	こちらから踏み込むと覚悟を決めた
1603.1561	2.6100	overt	1598.9100	1641632	やることはただ質問を一つするだけだ
1606.6061	6.0300	overt	1602.3600	1645165	それにもかかわらず心はどこか落ち着かなくて気を紛らわすために再び窓の外を見ていた
1613.5661	4.2000	overt	1609.3200	1652292	通りに人影はすっかり見えなくなっていた風ひとつない静かな夜だ
1618.4861	3.2100	overt	1614.2400	1657330	自分にはそれが嵐の前の静けさのように思えてならなかった
1623.4361	2.2800	overt	1619.1900	1662399	時計の針やまだ日付もまたかずにいる
1626.8561	3.7200	overt	1622.6100	1665901	目線を変えた先に捨て忘れたチラシの山と
1631.1761	3.0300	overt	1626.9300	1670324	その山頂のやたらきらびやかな名刺を見つけた
1635.0461	3.9300	overt	1630.8000	1674287	一度だけ行って二度と行くことのないガールズバーで受け取ったものだ
1639.6661	5.3400	overt	1635.4200	1679018	つい先日やたら遠征的な友人から数年ぶりに連絡が来た
1645.9361	4.3800	overt	1641.6900	1685439	とにかく現在の自分を知らない人間としゃべりたいと彼は言っていたので
1651.1261	5.7300	overt	1646.8800	1690753	それなら機会があれば一度行ってみたかったのでガールズ場合でも足を運ばないかと提案した
1657.8161	3.0000	overt	1653.5700	1697604	その提案が結果的には最悪だったのだけれど
1662.5261	5.7600	overt	1658.2800	1702427	男に気持ちよく自分語りをさせる技術を学習したNPCとしゃべってるようで
1679.3261	1.2600	overt	1675.0800	1719630	空間にない空間も
1681.5161	3.3900	overt	1677.2700	1721872	それで世の中の人間が気持ちよくなっている世界も
1692.9761	4.6200	overt	1688.7300	1733608	彼はそんなことを自分にだけ聞こえる小声でこぼした後手入の女性に
1700.6261	5.6400	overt	1696.3800	1741441	俺の話より君が何者で何を面白いと思って生きているのかをしゃべってくれと言った
1708.4261	2.1300	overt	1704.1800	1749428	店員が困ったようにしていても
