onset	duration	trial_type	wav_onset	sample	value
2992.0785	5.0520	listening	2992.0660	3590494	考えているのも好意的に受け止められられているんじゃないどうでしょうか
3010.2550	5.0000	covert	n/a	3612306	考えているのも好意的に受け止められているんじゃない?どうでしょうか?
3019.1505	1.4360	listening	3019.1380	3622981	アイサー分かってないな
3021.1025	1.1160	listening	3021.0900	3625323	たとえだけあくね
3024.4517	5.0000	covert	n/a	3629342	アイサーわかってないな例えば逆に
3034.9905	1.4680	listening	3034.9780	3641989	女性を折り返する耳
3212.5525	5.0000	covert	n/a	3855063	女性を理解する身分
3221.5185	3.0360	listening	3221.5060	3865822	アーロンには彼らを何とかしてくれるんだなって期待する
3229.5292	5.0000	covert	n/a	3875435	アーロンには彼らを何とかしてくれるんだなって期待されて
3236.5585	2.5560	listening	3236.5460	3883870	それにね
3243.7042	5.0000	covert	n/a	3892445	されてるところもあるんだよそれにねまだあるんですか
3252.4945	1.1480	listening	3252.4820	3902993	お待たせなぞき
3254.4145	1.3080	listening	3254.4020	3905297	アーロンが子供の頃
3257.6775	5.0000	covert	n/a	3909213	トーマスターの好きアーロンが子供の頃
3264.8145	4.5720	listening	3264.8020	3917777	その子どもと同じように裏通りを走り回っていたというのもプラスだよね
3271.4783	5.0000	covert	n/a	3925774	よその子どもと同じように裏通りを走り回っていたというのもプラスだよね
3279.8865	3.5800	listening	3279.8740	3935864	かつて一緒に遊んだ仲間たちがこの街にはたくさん
3285.5383	5.0000	covert	n/a	3942646	かつて一緒に遊んだ仲間たちがこの街にはたくさん存在していた。
3292.5905	2.1720	listening	3292.5780	3951109	存在するんだよ親近感がある
3295.8545	1.6920	listening	3295.8420	3955025	あとお父さんみたいに人間
3298.9642	5.0000	covert	n/a	3958757	存在するんだよ親近感があるあとお父さんみたいに
3306.4465	4.5720	listening	3306.4340	3967736	それに何と言っても顔がかっこいい女の子の年季は高いね
3312.6308	5.0000	covert	n/a	3975157	それになんといっても顔がかっこいい女の子の年季は高いね
3319.6305	1.3720	listening	3319.6180	3983557	違いなく
3322.8945	1.7240	listening	3322.8820	3987473	だからはISの古い人や
3326.2983	5.0000	covert	n/a	3991558	ああだからYSの古い人や
3336.7185	1.5960	listening	3336.7060	4004062	そういう側面もゼロではない
3340.4350	5.0000	covert	n/a	4008522	ないかなぁ そういう側面もゼロではない
3347.6305	4.0600	listening	3347.6180	4017157	アイスも無限に否定するつもりはないのだけれど
3353.7158	5.0000	covert	n/a	4024459	のかもしれませんがアイスも無限に否定するつもりはないのだけれど
3360.8465	4.8920	listening	3360.8340	4033016	主人が寮に揺れ込んでいるのを常々心配しているだけに
3368.7800	5.0000	covert	n/a	4042536	主人が寮に入れ込んでいるのを常々心配しているだけに
3376.0465	3.7080	listening	3376.0340	4051256	なのかは判断がつかないところですよ
3465.4458	5.0000	covert	n/a	4158535	裏返しなのかは判断判別がつかないところですよ
3473.5185	3.9320	listening	3473.5060	4168222	初代は人気もありましたが敵も多かったわけですし
3482.6200	5.0000	covert	n/a	4179144	初代は年季もありましたが、敵も多かったわけですし、
