onset	duration	trial_type	wav_onset	sample	value
3.1142	4.6200	overt	3.1800	3737	いよいよ破るればますます奮闘努力を続行する
8.3642	18.3000	overt	8.4300	10037	我が輩はいつでも人にできないようなことを自分で一つやってみたいという希望を持っているそのために今日までにもだいぶ失敗したこともあるけれども失敗したからとて断じてことを排するような育児のない振る舞いをしたことはない
27.6242	16.3500	overt	27.6900	33149	いつでもいよいよ失敗すればいよいよ奮闘努力を続行するしかしてこういう場合にさらに新しい元気を得るにはどうかして我が輩の一生を最も有益に送りたいという希望のあるためである
44.6942	15.4200	overt	44.7600	53633	いやしくも社会に立って何事かをなそうというほどの人である以上一度や二度の失敗で悲観するようなことのあろうはずがないもしそういう人があるならば共に人生を語るに足るべき人とは言えない
60.8642	16.8750	overt	60.9300	73037	核のごとき精神を持っているのでいかなる場合でも我が輩の生活は常に希望が輝いているしたがって我が輩はいつも愉快に楽天的でいることができる
77.7392	16.8750	overt	77.8050	93287	優位の生活をなすべく長く送ることが必要であるそれにはどうしても道の理想にかなうところの生活が必要である我が輩の長寿節に何ほどの科学的の根拠があるとすればそれは論理的
95.8142	12.7500	overt	95.8800	114977	倫理的道徳的生活と結びついている点であろうしかるに今日の富豪などの中には生きながらに地獄の苦悶をしているのが決して
111.2942	8.3400	overt	111.3600	133553	彼らの生活には何ら道徳上の安心がなく両親の満足しえるほどのものを持っていないからである
120.1742	11.1600	overt	120.2400	144209	したがって彼らが調整するには苦悶の時を腸から絞るまでのことで祝すべきことではないむしろ哀れむべきものである
