onset	duration	trial_type	wav_onset	sample	value
3910.8058	8.7900	overt	3910.7100	4692967	なぜか知らんがあいつのジュソが効かない状態になってたようなクッあれボス大丈夫ですか
3921.1258	3.8100	overt	3921.0300	4705351	磯玉をニつ持っててまた呪われたりしてます
3925.5058	3.3600	overt	3925.4100	4710607	実はこっちの呪いも来てる
3932.1658	6.9000	overt	3932.0700	4718599	足洗い屋敷の呪いの条件や恨みの妬みの条件
3940.5058	2.1000	overt	3940.4100	4728607	寝たみの記憶も見えた
3962.8258	10.7550	overt	3962.7300	4755391	恨みの記憶も見えたなるいやなるほどな七不思議の中でもこれだけやたらと頂上的な内容だと思っていたがそういうことか
3973.5808	10.7550	overt	3973.4850	4768297	確かにこいつはやばいどういう内容なんですが後で確認しとけひときは呪いが強い先に回収できて助かったかもしれん
3994.0258	4.5900	overt	3993.9300	4792831	まずはイチ個回収できましたけどこれからどこに行きましょうか
3999.1258	14.3500	overt	3999.0300	4798951	夜のうちに七不思議のゆかりの地を回って同じように借り主探しだな今見たいのをまた繰り返すわけですかあんな積極的なやつばっかじゃないと思いたいが大切な人
4013.4758	14.3500	overt	4013.3800	4816171	どうせどうもこのジュスト玉を持つと恨みの念に染まって人を呪い殺すことにためらいがなくなるようだえっボスは大丈夫なのだ
4027.8258	14.3500	overt	4027.7300	4833391	ああ俺は霊感はないがこういう体勢だけはなぜか強いらしくてなそれだけは身体でも重宝されてたよなんだよやっぱり持ってる人じゃないですかじゃあ次行きましょう
4057.0558	1.0500	overt	4056.9600	4868467	ああ
