onset	duration	trial_type	wav_onset	sample	value
12.3958	3.1500	overt	12.3000	14875	ああああああああ
30.9958	4.8600	overt	30.9000	37195	ボス鑑識も撤収して現場の復旧が完了しました
41.5258	3.4200	overt	41.4300	49831	ゲーラ隊も解散して我々が最後です
48.3658	4.0800	overt	48.2700	58039	これで明日からは公園も元通り再開できそうですね
55.0558	11.1600	overt	54.9600	66067	事件のあった直後の公園なんざあんま期待とは思わなそうだがないや逆にそういうの好きな人が集まってくるかもしれないじゃないですか
66.8758	6.4500	overt	66.7800	80251	今オカルトブームがすごいオカルト系がすごいブームなんですよ知らないんですかボス
74.4058	4.1700	overt	74.3100	89287	くだらねそれは非科学的な話ですけど
79.8658	8.2500	overt	79.7700	95839	まあ本当に幽霊なんて出るなら殺人事件の犯人なんてすぐ教えてもらえそうですね
89.9158	3.5700	overt	89.8200	107899	都合よく話が聞けるもんでもねえだろうが
95.2558	5.4600	overt	95.1600	114307	でも最近コックリさんというのが女学生を中心に流行ってるらしくて
101.5258	2.1000	overt	101.4300	121831	何でも礼を呼び出して
105.0058	3.8400	overt	104.9100	126007	文字盤で対話ができるんだとかすごいですよね
110.5558	4.5900	overt	110.4600	132667	低迷そんなの気になるなら低迷で試してみたらどうだ
115.6858	4.3500	overt	115.5900	138823	いいですね今度一緒にやりましょうよボス
121.0858	5.9700	overt	120.9900	145303	冗談じゃねえ俺とお前で向かい合って座ってジュー円玉に仲良く指のせろってのか
127.8358	1.9500	overt	127.7400	153403	めちゃくちゃ詳しいじゃないですか
137.0458	6.2400	overt	136.9500	164455	でもこれからの時代はきっとそういうのも受け入れる柔軟さが必要ですよとんだ笑いもんだ
147.6658	1.6500	overt	147.5700	177199	そもそもなエリオ
151.5658	4.7100	overt	151.4700	181879	お前の同期の巡食をオカルトで処理しようとすんじゃねえよ
157.5658	8.2200	overt	157.4700	189079	神霊だろうがオカルトだろうが何だって頼りますよそれだけなりふり構っていられないんですからこっちは
167.0158	10.4100	overt	166.9200	200419	あいつを殺した犯人は絶対俺が捕まえてみせます心がけはいいがまだ今回の事件が殺人と決まったわけじゃねえ
178.4758	6.6000	overt	178.3800	214171	先入観はハンダーをにぶらせるあまり入れ込むと周りが見えなくなるぞOKボス
187.7458	5.4300	overt	187.6500	225295	それじゃあ現場検証も終わったんでこれまでの情報をまとめておきましょう
199.3258	7.6200	overt	199.2300	239191	今からかもう遅いして撤収する流れだったろ今ほら正しい情報を確認しておかないと
207.8458	6.0300	overt	207.7500	249415	現場にいるうちにやった方が臨場感があって気分も盛り上がるでしょう
214.8658	5.2200	overt	214.7700	257839	いやあかんねえよもう一度言うぞあがんねえって
220.5958	1.7400	overt	220.5000	264715	そんなんでもり上がるの
222.9058	1.6200	overt	222.8100	267487	よっぽどろの
225.0358	1.8900	overt	224.9400	270043	オカルト付けだけだぞ
232.2358	4.2600	overt	232.1400	278683	分かんないんですかボスまさかそんなどうして
248.9458	3.7200	overt	248.8500	298735	いやいや俺がおかしいみたいな空気にするんじゃねえよくそ
266.6158	3.4500	overt	266.5200	319939	分かったよもうじゃあさっさとやるぞ
270.9658	1.2600	overt	270.8700	325159	OKボス
286.8658	2.6700	overt	286.7700	344239	ここすみなく横はめっちゃ目にある
290.2558	17.3700	overt	290.1600	348307	安田庭園は江戸時代に大名庭園として増援されたもので何年か前に区の管理する公園になって全面回収が行われたばっかりです夜中なので人の姿もなく辺りは完全に静まり返っていますね
313.2058	1.6200	overt	313.1100	375847	昨日は
315.6658	2.9700	overt	315.5700	378799	最初は昨日の早朝に
320.3158	14.7600	overt	320.2200	384379	この公園の敷地内で男性が倒れて死んでいるのを管理人が発見し通報しました目立った外傷は目当たらなかったものの被害者が現職警察官であったことと
336.1558	4.6800	overt	336.0600	403387	現場に争った形跡があったため事件性が高いと判断
341.7658	12.5400	overt	341.6700	410119	警察官の変死事件として墨田所に捜査本部が置かれ本庁からも出動し捜査が行われることになりました
354.9058	9.6000	overt	354.8100	425887	我々の任務は被害者に何があったのか事件性がないかを調査することです事件の概要としてはそんなところでしょうか
367.8358	10.4850	overt	367.7400	441403	被害者は墨田省生活安全課少年係の警察官である吉見はじめニジューナナ歳独身
378.3208	10.4850	overt	378.2250	453985	主に少年事件や少年育成に関わる案件に携わっていました会計は巡査長です
390.3058	3.6600	overt	390.2100	468367	そいつのことはお前詳しいんだろうどんなやつだったんだ
396.1258	3.2100	overt	396.0300	475351	吉見とは警察学校の同期で
400.3258	4.0200	overt	400.2300	480391	今でもイチニか月にイチ度は飲みに行く間からでした
413.0158	7.7100	overt	412.9200	495619	態度はやや素暴ですが同期の中でも兄気分でとにかくナムカマ思いで面倒見のいい男でした
421.3258	9.6600	overt	421.2300	505591	よくも悪くもお堅い警察官タイプじゃなく人情派だったので市民からも人気があったようですね
431.7058	17.4600	overt	431.6100	518047	問題を抱えた少年たちに対しても一人一人親身になって接して厚生に導いた実績も豊富ですそりゃまた惜しい男を亡くしたもんだなはい本当に真相こそ思います
453.5458	4.8600	overt	453.4500	544255	警察も危険な仕事なので俺もある程度覚悟していましたが
462.5458	12.5400	overt	462.4500	555055	分かっててもやりきれねえよなこればっかりはよあいつ昇進には興味なさそうでしたが実績で行ったら同期の中でもピカイチでした
476.0158	5.3400	overt	475.9200	571219	ただ問題のある行動も多くて始末書の数もピカ打ちでしたけど
482.8858	6.0300	overt	482.7900	579463	そういう型破れな男こそ多様な犯罪への対応に必要だと俺は思っていましたよ
492.1858	9.0300	overt	492.0900	590623	安心しなお前さんも十分型破りだよ俺なんて同期の中でも至って常識的な人間ですよ
502.9258	1.0800	overt	502.8300	603511	それね
504.6958	5.6100	overt	504.6000	605635	同期で圧倒的に型破りだったのはすでに退職しちゃったあいつですし
510.8158	2.4000	overt	510.7200	612979	まだそれ以上のやつがいるのかよ
518.4058	3.3000	overt	518.3100	622087	吉見自身学生時代はだいぶ荒れてて
525.9658	3.3000	overt	525.8700	631159	頻繁に警察の世話にもなっていたそうですが
530.0158	12.4500	overt	529.9200	636019	当時の担当警察官が親身に向き合ってくれて更生することができたんだそうですその恩返しをしようと警察官になるために初めて真面目に勉強したと言ってました
543.2158	5.4900	overt	543.1200	651859	もういい話だなそういう話は大好物だいっぱいやりたくなってきた
550.2358	3.7800	overt	550.1400	660283	残職した同家の経歴を魚にしないでくださいよ
555.0658	8.7600	overt	554.9700	666079	ケンパイだよけんぱいお前も殉職するまでに惜しんでもらえる逸材になるよなんで残職する前提なんですか
565.0558	6.0600	overt	564.9600	678067	それに俺が殉職したらまずはボスが惜しんでくれるんで大丈夫です
571.9258	15.1350	overt	571.8300	686311	そこで引くのやめてもらえますこっちの指揮に関わるんでまあ俺が惜しむかどうかはこれからの操作次第だな俺には見えますボスがみっともなくエリオ死ぬなって泣き叫ぶす
587.0608	15.1350	overt	586.9650	704473	俺にはお前の中で今どんな時代が起こってるのかが見えねえけどなもうすごいですよその時が楽しみですいや自分の巡食を楽しみにすんなしっかりしろ
603.8458	4.6500	overt	603.7500	724615	たく大したい伝えだよお前さんはありがとうございます
611.2558	6.5700	overt	611.1600	733507	被害者の死因についてはまだ検視化が終わっていないので確定はしていませんが
619.0258	3.2700	overt	618.9300	742831	おそらく急性の心筋梗塞による
625.0858	4.2900	overt	624.9900	750103	いわゆる心臓麻痺による突然死だとみられています
631.6258	8.4300	overt	631.5300	757951	死病もなく目立った外傷もないので毒物や薬物による死の可能性も考えられます
641.6758	5.3400	overt	641.5800	770011	公園の真ん中でそんな状態だったならそりゃ確かに不審死だろうな
648.6358	14.2800	overt	648.5400	778363	現場には争った形跡があり周囲の足跡等からも誰か別の人間がいたものとみられています別とその人物の捜索が進められています
663.6958	4.3800	overt	663.6000	796435	そいつさえ見つかれば話を聞いて全部解決すんだけどな
680.3758	3.1500	overt	680.2800	816451	そうですねそれで終わればいいですけど
691.3858	7.9500	overt	691.2900	829663	あと吉見の持ち物は財布と警察手帳が衣服のポケットに入っていただけです
700.6258	7.0200	overt	700.5300	840751	物取りの犯行じゃねえとモノトリがわざわざこんながたいのいい警察官を狙うとも思えんが
708.9658	7.8600	overt	708.8700	850759	ちなみによしみですけど若い頃はケンカでかなり腕を鳴らしていたそうです警察官になってからも
718.0558	4.5900	overt	717.9600	861667	なってから始めた柔道でもすごいスピードで弾を取ってました
727.1158	6.4500	overt	727.0200	872539	生身で立ち向かうのはよほど腕に覚えがあるやつでもないとありえねえか
740.5858	12.5700	overt	740.4900	888703	いやそれにしてもボスが捜査一課に戻ってくれて俺すごく嬉しいです昔からまさに天の上の人ですごく尊敬してるんですよそもそも俺
753.8758	1.2300	overt	753.7800	904651	ツズメ
755.6758	3.4800	overt	755.5800	906811	警部に憧れて刑事になったようなもんですから
759.9358	9.0900	overt	759.8400	911923	お前さんそれな警察学校に入った頃から周りにもそういうふうに触れ回ってるようだがはいだって本当ですから
771.5758	5.3100	overt	771.4800	925891	ヨン年前俺が捜査一課に配属されるのと入れ違いで別の部署に
778.8058	2.1900	overt	778.7100	934567	移動しちゃってショックでした
782.0458	5.8500	overt	781.9500	938455	今回こうしてペアで操作できることは未だに夢みたいだって思ってます
788.4958	12.5400	overt	788.4000	946195	それはまあ嬉しいことなんだがらがその割にはなんだ何ですか敬意っていうかよあるだろう叱るべき態度ってもんがすごく尊敬してますけど
813.8458	5.1300	overt	813.7500	976615	ボスもうろくしちゃいましたいやそれだそれそういうところ
819.5758	6.5700	overt	819.4800	983491	もう夜も遅いから眠いんですね大丈夫ですボスできるだけ早めに切り上げますから
826.8658	3.0000	overt	826.7700	992239	ああ分かった分かったいつもすまんな
839.5258	3.8100	overt	839.4300	1007431	そういやオカルトって言えばボス知ってますかねなんだ
844.5058	4.4100	overt	844.4100	1013407	今地元で話題になってるよみがえりの秘術っていうやつです
852.3658	2.4900	overt	852.2700	1022839	うわ出たお前までその話か
855.5758	2.8500	overt	855.4800	1026691	知ってるんですか意外ですね
859.8658	4.6200	overt	859.7700	1031839	世間が騒ぐのは勝手だがそういうのを仕事にまで持ち込むんじゃねえよ
874.1758	7.2000	overt	874.0800	1049011	ですけどこの件は他のオカルト話よりも何だか具体的というか現実にあるというか
882.0358	5.8200	overt	881.9400	1058443	どうやら話の発祥となったのがここ墨田区本庄らしいのでもしかするとって
893.7658	4.2900	overt	893.6700	1072519	やめろやめろそんな秘術だとかロク名簿だとか
914.8858	6.2700	overt	914.7900	1097863	ロク名簿だとか関わったってろくなことになんでめちゃくちゃ詳しいじゃないですか
921.9658	6.6000	overt	921.8700	1106359	ボスもしかしてそういうオカルト好きなんじゃないですかやめてくれいや本当冗談じゃねえ
931.3858	6.9900	overt	931.2900	1117663	仲の良かった同期が死んでよみがえりの秘術に希望を感じる気持ちも分からなくはねえが
939.0058	7.0200	overt	938.9100	1126807	死者が行き帰るなんてそんな都合のいい秘術が当てたまるかそんなもんに頼るんじゃねえいいな
957.5158	1.8600	overt	957.4200	1149019	それにしてもボス
960.5458	16.9800	overt	960.4500	1152655	本件はいきなり捜査本部が設置されるほどの重要事件だったのでしょうかそれは俺にとっては同期が巡職するっていう重要事件ですけどおかみの判断だがまあいろいろあるんだろうよボス何か知ってますね
978.1258	2.4000	overt	978.0300	1173751	事情はおいおい分かってくる
990.1858	1.0500	overt	990.0900	1188223	忘れんな
994.2358	6.8400	overt	994.1400	1193083	でも考えてみれば今はまだ被害者の身元くらいしか発見した情報がないわけですから
1002.3658	1.2300	overt	1002.2700	1202839	意外者ね
1010.7958	3.7200	overt	1010.7000	1212955	被害者に何か特別な事情があったってことですよね
1015.8958	4.3800	overt	1015.8000	1219075	例えばあいつが何かしらの重要な秘密を握っていたとか
1020.9358	1.5300	overt	1020.8400	1225123	そうなんですよね
1028.8558	2.2200	overt	1028.7600	1234627	お前ドキドキ鋭いな
1032.7258	4.4700	overt	1032.6300	1239271	そこまで理解できてるならおいおいって言ってるんだから少し差しとけ
1049.0158	1.6200	overt	1048.9200	1258819	被害者の家族は
1106.4058	5.9700	overt	1106.3100	1327687	室清の実家は足立区の北千住ですがご両親はすでに他界されていて
1117.2658	5.8500	overt	1117.1700	1340719	今はそこに一人で住んでいました兄弟もいないので完全に一人です
1123.6858	14.8500	overt	1123.5900	1348423	何度かよしみの家で飲んだこともありますがそこそこ古い伝統ありそうな大きな家で驚きましたなんていうんですかねお化けとかが出てもおかしくないようなそんな家に一人で住んでいたのか
1139.1658	8.0400	overt	1139.0700	1366999	なんか格式高そうでよしみが学生時代に荒れていたという話と結びつかない印象でした
1147.8058	2.3100	overt	1147.7100	1377367	そういうのが戦流感っていうんだ
1151.1958	5.5200	overt	1151.1000	1381435	古い家柄ならなおさら複雑な事情があったりするもんだろう
1167.4558	8.7600	overt	1167.3600	1400947	それも潜入感じゃないですかでもその辺りの事情はどんなによってもはぐらかされて詳しいことは知りません
1176.7258	1.7400	overt	1176.6300	1412071	それと
1179.3058	2.3700	overt	1179.2100	1415167	よしみには婚約者がいました
1188.6358	6.3300	overt	1188.5400	1426363	学生時代からジュー年以上も付き合っている女性でそろそろ本気で結婚を考えていたようです
1195.6258	2.2800	overt	1195.5300	1434751	名前は何て言ったかな
1204.4458	3.0000	overt	1204.3500	1445335	一度写真を見せてもらったことがありますが
1207.9858	4.9200	overt	1207.8900	1449583	かなりの美人でしたそうかそいつには気の毒なことだな
1214.6158	5.4300	overt	1214.5200	1457539	だが最近の良純の背後関係に詳しいかもしれん話を聞いておきたい
1220.8858	8.4900	overt	1220.7900	1465063	そうですねよしみのみうちと呼べる人は今はその婚約者だけなので多分墨田賞
1231.3558	4.3500	overt	1231.2600	1477627	ないの誰かが連絡してるはずです明日確認してみましょう
1242.0058	5.7300	overt	1241.9100	1490407	死亡推定時刻はニ日前の夜ジューイチ時
1257.1858	7.0200	overt	1257.0900	1508623	死亡推定時刻はニ日前の夜ジューイチ時前後もちろん公園の開園時間外です
1264.8958	2.5500	overt	1264.8000	1517875	で発見されたのが昨日の
1269.6058	1.7100	overt	1269.5100	1523527	早朝になります
1272.0058	9.3300	overt	1271.9100	1526407	おとといの夜ジューイチ時前後そもそも吉宮こんな時間にここで何をしていたんだはいそこなんですよね
1282.2358	4.2900	overt	1282.1400	1538683	公園の入り口は閉園寺は閉じられていますが
1287.9358	4.6800	overt	1287.8400	1545523	小さな門扉なので侵入しようと思えば入るのは容易です
1300.2058	3.0900	overt	1300.1100	1560247	もちろん不法侵入になるわけですから
1313.6758	2.4600	overt	1313.5800	1576411	何が考えられますかね
1337.5858	13.8300	overt	1337.4900	1605103	警察官のよしみが自分の都合で不法侵入するとは考えにくいわなここには別の誰かもいたようだからそいつに呼び出されたとかじゃねえかなるほどその可能性を高そうですね
1367.4358	4.8000	overt	1367.3400	1640923	ってことは密会だなこんな場所でこっそり会う必要があったなら
1373.3758	6.9600	overt	1373.2800	1648051	よしみはここで誰かと秘密の取り交わしをしたいだってことになる
1388.0158	2.1900	overt	1387.9200	1665619	その結果争いになって
1391.5258	6.8100	overt	1391.4300	1669831	いや真の剣と腕っぷしの話もある衝動的な行為による自信症じゃねえだろ
1401.4858	15.3300	overt	1401.3900	1681783	何かしらの準備はあったはずだなら計画的な犯行ってことはその犯人は最初からよしみを殺すためにこの公園に呼び出したってことですかまあまだ事故の可能性も捨てきるねし
1420.5958	3.8400	overt	1420.5000	1704715	老化物での脅迫による取引が決裂して
1425.5158	1.1700	overt	1425.4200	1710619	カー
1431.5758	8.0100	overt	1431.4800	1717891	意図せず殺してしまったという線もある支援が分かればもう少し絞れそうだがなるほど
1445.7658	4.4400	overt	1445.6700	1734919	俺今日もずっとボスのベーマンプレーにしぶれっぱなしですから
1462.5658	5.0400	overt	1462.4700	1755079	そうか気遇だな俺もお前のスレスレの態度にしぶれっぱなしだ
1472.3158	3.7200	overt	1472.2200	1766779	そうだ家族といえばボスの家庭ってどうしてるんですか
1490.5858	3.5400	overt	1490.4900	1788703	いきなりプライベートに踏み込んでくるとびっくりするじゃねえか
1494.8158	8.9700	overt	1494.7200	1793779	これまで一緒に操作してきましたが家に連絡したりとかそういう素振りもなかったんでもしかして独身ですか
1504.2958	14.9400	overt	1504.2000	1805155	うせえよ大きなお世話だいや俺警察に入って思ったんですけど警察組織ってやたら若い警官に結婚しろ結婚しろってすごいやつ目で進めてくるじゃないですか
1523.2558	3.6000	overt	1523.1600	1827907	あれ何なんですかねボスは言ってこないですけど
1535.1058	9.0300	overt	1535.0100	1842127	知るかよ俺だってその後に負けてニジュー数年前に一度結婚してんだからよあれそれじゃあ
1545.2158	10.2300	overt	1545.1200	1854259	うるせえなヨン年くらい前に娘を連れて出て行っちまったんだよ言わすなよこれは失礼しましたボスと別れるなんてもったいない
1556.0158	5.7600	overt	1555.9200	1867219	まあ俺も仕事中心で家庭は完全に部屋おったらかしだったからな
1565.6758	7.5000	overt	1565.5800	1878811	毎日遅くまで帰らない急に呼び出されるそれで常に命の危険がつきまとう
1573.7458	4.5900	overt	1573.6500	1888495	そんな夫に付き合わされてたらそりゃ身なんて持たねえだろうよ
1579.3858	2.1900	overt	1579.2900	1895263	ああそういうもんですか
1582.2658	2.6100	overt	1582.1700	1898719	命張ってるのに切ないですね
1589.2258	5.3700	overt	1589.1300	1907071	もしかしてボスが以前に捜査一課から移動したのってそれで
1611.0658	1.7400	overt	1610.9700	1933279	もう手遅れだったかな
1615.9258	2.8500	overt	1615.8300	1939111	お前もせいぜい気をつけろよエリオ
1623.6058	1.2300	overt	1623.5100	1948327	と言われても
1646.2558	2.8500	overt	1646.1600	1975507	この仕事してたらどうしようもなくないですか
1651.0258	5.9100	overt	1650.9300	1981231	こんな仕事を理解してもらえる相手なんて警察関係者かその親族でもないと
1657.7158	3.3000	overt	1657.6200	1989259	そういえば娘さんがいたんですか
1661.6758	3.2400	overt	1661.5800	1994011	その流れで娘の話を出すんじゃねえよ
1665.8758	3.1800	overt	1665.7800	1999051	タイミング最悪すぎんだろやんねえよ
1670.3158	10.8900	overt	1670.2200	2004379	いやいや決してそんなつもりじゃないですけどおい踏み込んでる踏み込んでる興味が津々すぎるもう少し覚醒
1682.8858	4.1400	overt	1682.7900	2019463	いや冗談抜きでちょっと訳ありの娘だからな
1688.9158	4.6500	overt	1688.8200	2026699	そこよらの男じゃ立ち撃ちできねえか
1696.2058	8.3700	overt	1696.1100	2035447	今は大学に通うために一人暮らししてるらしいが女子大生今年期ですもんね女子大生
1705.2358	3.4800	overt	1705.1400	2046283	おいやめろそうやってすぐラベルで判断するな
1709.5858	8.2200	overt	1709.4900	2051503	でも一人暮らしですかそれは心配でしょうにもどこに住んでるかも知らねえやりさまだしな
1719.3658	5.7300	overt	1719.2700	2063239	ああ教えてもらえてないんですねしつこくつきまとったりするからですよ
1725.6058	2.2800	overt	1725.5100	2070727	隙間取ってねえよ多分
1728.9058	5.3700	overt	1728.8100	2074687	いやいやまたまた素直じゃないんですからもうあのな
1734.9058	14.4600	overt	1734.8100	2081887	ボスそんな見た目で照れちゃって可愛いところもあるじゃないですか何の話だよ急に持ち上げんじゃねえよ感情の持って行きどころが迷うじゃねえかもうこの話終わりだ終わり
1755.2758	7.7400	overt	1755.1800	2106331	ああそうだボス最近吉見が担当していた案件についても確認してありますけどそうだよ
1765.7458	2.1900	overt	1765.6500	2118895	そういう情報が欲しかったんだよ
1781.1658	6.7500	overt	1781.0700	2137399	事件当日吉見はどんな事案を担当していたんだえっとですね
1788.6958	9.6000	overt	1788.6000	2146435	事件前日の報告書によると事件の当日はニ件の少年案件を抱えていたようです
1799.4658	6.9600	overt	1799.3700	2159359	イチつ目がイチ週間前に上沢で起こった女子高生の等身自殺です
1807.0558	1.5300	overt	1806.9600	2168467	あああったな
1810.1458	12.0600	overt	1810.0500	2172175	自殺したのは駒型高校ニ年の白石道夫という少女なのですが吉見はそれよりも前に何度かその子と接触をしていたみたいですね
1824.6358	5.7300	overt	1824.5400	2189563	かねてから問題を抱えていた娘だったわけかいやそれがわからなくて
1831.5958	13.3800	overt	1831.5000	2197915	先月町でたまたま見かけて思い詰めた様子なのが気になって良しみから声をかけたそうですが何かあるのは間違いなさそうなのに何も教えてもらえなかったようです
1847.7958	2.6700	overt	1847.7000	2217355	何やら家庭内に問題ありそうだな
1851.9658	1.8300	overt	1851.8700	2222359	よしみもそう思って
1865.7358	5.5200	overt	1865.6400	2238883	一度白石道の自宅に行って親御さんとも話したそうですが
1872.0058	1.5600	overt	1871.9100	2246407	真剣したね
1890.6058	10.0500	overt	1890.5100	2268727	真剣者に大丈夫だと言われてしまったのでもうそれ以上は踏み込めなかったということですでそんな矢先にその子が自殺をしてしまった
1901.4958	10.6200	overt	1901.4000	2281795	なるほどなよしめとしても防げたかもしれない案件だったと悔しかったでしょうね
1912.1158	10.6200	overt	1912.0200	2294539	この事情を改めて詳しく調べていたようです自ら命を絶つまで追い込まれるほどの少女の身に何が起こっていたのか
1923.2458	5.8200	overt	1923.1500	2307895	その調査結果についてはまだ報告はされていませんでしたがなるほど
