onset	duration	trial_type	wav_onset	sample	value
46.3833	3.5100	overt	46.2600	55660	これから締めのシーンとなるわけだ
102.9333	1.3500	overt	102.8100	123520	何でも生きらけたいんだから
107.4633	1.4400	overt	107.3400	128956	私たちと終わりです
142.2633	18.1500	overt	142.1400	170716	しかしこれからは手を取り合っていきましょうそれが我々の真の発展のためなのですミスターアノルドはそう言った後数日以内にグランドタワー内に新しい本部を設け新体制を発足することを発表する
165.2133	5.6400	overt	165.0900	198256	最後はサン人の老人と僕が手を重ね合わせそれで動画は終わりだ
177.2133	14.5800	overt	177.0900	212656	僕はふーとため息をついたいかがでしょう氷川は僕を振り返るいいよこのまま行こう僕が言うと氷川はほっとため息をついたよくできた動画でしたな皆さんお上手でそばに
192.3933	5.0100	overt	192.2700	230872	さつ佐伯がからかうように言う茶番だよ僕は肩を
198.1233	6.4500	overt	198.0000	237748	すくめると背筋の力を抜いて椅子の背もたれに体を預けた
214.9233	8.1000	overt	214.8000	257908	この動画は後でカスソロ通りにモニターを出しそこで群衆に披露するそして同時に
224.9133	3.3900	overt	224.7900	269896	動画と同じ内容をまとめたビラをばらまく
229.2333	16.0500	overt	229.1100	275080	自分があんなふうにしゃべっているのをみんなに見られていると思うとゾットしないが仕事だから仕方がないしかしよくあのプライドの高いご老人たちがこの提案を飲んでくれたものですね佐伯は信じられないといった顔をしている
245.7933	10.7550	overt	245.6700	294952	だってこんなの実際のところはISの軍門に下るのと同じことじゃないですかおじいちゃんたちだって全部分かってるでしょう
256.5483	10.7550	overt	256.4250	307858	だったら屈辱的じゃないんですかねそもそも彼らが失脚するきっかけとなった蛍光地のデータを解放軍に渡したのは
267.8733	2.5800	overt	267.7500	321448	佐伯それは事実じゃない
286.8333	3.3000	overt	286.7100	344200	僕が言うと才気は機嫌な顔をする
298.4733	5.2200	overt	298.3500	358168	事実はさっき老人映像で老人たちが言ったとおりさ
304.4733	10.2750	overt	304.3500	365368	競技のデータを認めちゃうがでっち上げ老人たちはノーマルだというぬれ着せられ追放されたんだそれ以外の何者でもない
314.7483	10.2750	overt	314.6250	377698	あのじいさんたちからそう言い出したんだからそれでいいじゃないか全くみんな悪い人たちね佐伯はあきれたようにため息をつく
328.5633	13.1700	overt	328.4400	394276	バカ言っちゃいけないこの結果解放軍は崩壊して失われるはずだったいくつもの命が助かるんだ人の命ってのは何よりもかけがいのないものだこれほどの善人はいないよ
342.9033	1.4700	overt	342.7800	411484	分かりました
345.5133	13.7100	overt	345.3900	414616	でもロンターを老人たちと組むのは危険じゃないですか彼らをこのグランドタワーで引き取るのは監視にはいいけれどこっちだって何をされるか分からないネオローズのレシピだっていつ
359.2233	13.7100	overt	359.1000	431068	そうしたら彼らはもう私たちに束縛される理由はなくなる何か彼らも今からワイルスと争うという気にはならないさそうだといいけれど最近は苦いけど
372.9333	13.7100	overt	372.8100	447520	ネオローズを得た彼らは完全にノーマルを見下してるわそして実際彼らは肉体的に完全には回っている絶対に心から服従なんてしない
387.3033	3.9300	overt	387.1800	464764	シシシン中の虫ってことにならなきゃいいけど
395.5233	5.4300	overt	395.4000	474628	天下のまあ再起が随分心配性じゃないか僕は苦笑する
436.5633	6.3000	overt	436.4400	523876	心配しようじゃないとノーマルのみでこの仕事は務まりませんからねでも大丈夫
450.7533	1.3800	overt	450.6300	540904	一緒に仕事
478.9833	12.7500	overt	478.8600	574780	一緒に仕事をすれば老人たちもすぐに理解するだろう僕らと組むのがいかに頼もしいかということをね
536.5533	12.3000	overt	536.4300	643864	相変わらず自信過剰ねまあいいわそこまで言うのならじゃあ行くわねサウルちゃんに会いに行かなくちゃ佐伯はちょっと笑ってそして部屋を出て自分の
551.7933	2.2500	overt	551.6700	662152	自分の仕事へ戻っていった
555.2133	8.4300	overt	555.0900	666256	ラリアボネットにはサウルという一人息子がいる彼もまたニ世として僕らと交流がありトミーや才木
565.0833	10.2600	overt	564.9600	678100	そして死んだ命名やアウロラたちと同じように子供の頃からの付き合いだった父が死んだ今彼の意思を確認する必要がある
578.8833	12.9600	overt	578.7600	694660	サウルは女と美職にうつつを抜かしていて仕事に関してはさほど熱心ではなかったがこうなった以上は彼がボネットハミリーのボスであり決定を下さなくてはならない
594.6333	7.4400	overt	594.5100	713560	父の無念を晴らすためにYSに立ち向かうかそれともおとなしく組織に従うかどっちだろう
607.1433	13.0800	overt	607.0200	728572	彼の復讐たちはおそらく従うよう新しいボスに助言するだろうが本人がどう判断するかは僕にも読めないそれを確認するために佐伯は今から彼のところに行くのだ
622.1133	14.0250	overt	621.9900	746536	もちろん僕はそれをぼんやり待っているわけではなく他にもいろいろな仕事があった今日完成した映像を見せる準備についても指示をしなくてはいけないし以前として開放軍とのトラブルは継続
636.1383	14.0250	overt	636.0150	763366	ネオローズ製造と販売についてのプランも練らなくてはいけない細々とした作業は部下に投げてしまうがそれでも僕が決定しなくてはいけないことは多い
671.1633	8.1900	overt	671.0400	805396	そうしてデスクワークをしていると出発した佐伯から電話が聞きた全然話にならないわ
682.2633	10.6200	overt	682.1400	818716	話は完結だったサウルは父の死によってすっかり逆傷しており銃弾でもって佐伯を出迎えたのだそうだ
693.7233	10.9800	overt	693.6000	832468	こちらもそれに応戦し彼の自宅を制圧サウル自身とゴ人の部下そしてサウルの妹と母を殺害したとのことだ
705.9033	11.3100	overt	705.7800	847084	これで事実上ボネットの家族は消滅したことになるボネットハミリーの他の幹部たちはサウルの愚かな判断にはれたんですね
720.2733	8.2200	overt	720.1500	864328	組織事はイエスに吸収されることを望んでいますなるほどおおよそ思った通りの結果になったようだ
729.3333	15.3300	overt	729.2100	875200	僕はその後の処理を指示して佐伯との通話を切ると別の部下に連絡してボネットハミリーを組織に組み入れるためのいくつかの準備について伝えたその指示が一通り終わると
744.6633	15.3300	overt	744.5400	893596	思わずため息が漏れたレイレイが新しいコーヒーを入れて僕の前に置いてくれるありがとうだが今日はもうカフェインをやめておこうと思うんだすみませんでしたじゃあ別の飲み物をお持ちします
761.1333	16.6950	overt	761.0100	913360	慌ててコーヒーを下げるレイレイの姿はぼんやり眺めながら僕は小さく席をした最近あまり眠れない父と同じ病気を宣告されてから免疫力を高める必要があるということで栄養バランスに気を使ったり酒を
777.8283	16.6950	overt	777.7050	933394	眠って給与が取れなければ何の意味もない民罪でも処方してもらった方がいいかもしれない僕に残された寿命は短くともそれとは無関係に目の前にはロンタオとしての仕事が山積みになっている
795.6933	7.9200	overt	795.5700	954832	少しでも多く片付けねばこんな仕事がもう時間のない僕を考えるとうんざりするが
805.3233	3.5100	overt	805.2000	966388	父さんもこんな気持ちで質もしていたのだろうか
809.4033	13.2600	overt	809.2800	971284	いや彼の場合は自分で作り上げた組織だからまた違うやりがいがあったろう僕はただ受け継いだだけであるからいけないのだな守るべき人も全て僕のもとを去った以上本当にする
822.6633	13.2600	overt	822.5400	987196	しかし僕は僕で何かやりがいを見つけなくてはいけない椅子の背もたれによりかかりしばしばする目を閉じたこうしている
836.9133	11.2650	overt	836.7900	1004296	眠いなのに寝ようとするとイライラして眠れないそして疲れの残る体で仕事ばかりしている
848.1783	11.2650	overt	848.0550	1017814	その結果誰かを殺したり殺されたりすることも少なくないサウルの顔も顔を思い浮かべる
860.5533	12.3900	overt	860.4300	1032664	また昔からの知り合いを一人殺してしまった全く殺してばっかりだそういえば子供の頃をマツコにあれを殺させて命がどうだとか偉そうなことを解いたっけな
874.0533	5.5800	overt	873.9300	1048864	今僕がやっていることはあの時のマツコがやっていたことと変わらない
880.1433	12.4800	overt	880.0200	1056172	逆らう力もない弱いものをプチプチと殺しているだけだ僕は何でも思い通りにしてきたような勘違いをしていたけれど自分の行動だけは全く思い通りになっていない
904.9233	7.9800	overt	904.8000	1085908	一人でちょっと洗ってそして目を開くと部屋の隅の方の子姉妹が心配そうに僕を見ている
916.9533	17.1750	overt	916.8300	1100344	お疲れですか天正がそう尋ねるいや別に僕はうっかりあくびを仕掛けたがすぐにかみつぶして肩をすくめなんだか最近仕事が面倒だなってごたぼうですからねそういうわけじゃないんだが僕が言うと天命が首をひな
934.1283	17.1750	overt	934.0050	1120954	大事な時期だしもっと収集しなきゃいけないとは分かっているんだけどねどうも身が入らないんだそうだ君たちは納豆を食べるかいその問いにこう姉妹はふいをつかれたように虚としている
959.4333	1.5900	overt	959.3100	1151320	あんまり食べませんがい
963.0333	7.6200	overt	962.9100	1155640	そうかい僕は子供の頃からの好物なんだ納豆を食べる時はみんなまずかき混ぜると思うんだけど
971.1633	3.9300	overt	971.0400	1165396	僕は小さい時からどうも力の
978.4533	1.6800	overt	978.3300	1174144	加減が下手くそでね
1032.7833	6.1800	overt	1032.6600	1239340	買ったままの発泡スチロールの中でかき混ぜるとどうしても箸で突き破ってしまう
1040.1933	4.4100	overt	1040.0700	1248232	だからさらに入れてかき混ぜるようにしてるんだ
1045.1133	5.2200	overt	1044.9900	1254136	こうしまいは戸惑い浮かべたまま生返事を返す彼の
1068.4233	9.5400	overt	1068.3000	1282108	彼女らの気持ちは分かるけれど僕はしゃべりたかったので勝手にそのまましゃべるでも一人暮らしをするようになったある日ね
1078.7433	3.0000	overt	1078.6200	1294492	洗い物が増えるのが面倒だったから
1082.8533	11.6850	overt	1082.7300	1299424	ケースの中でかけ混ぜてみたんだんだそんなのいつ以来だったか分からないくらいだったんだけどそうしたら破らないでうまく混ぜられたんだよ
1094.5383	11.6850	overt	1094.4150	1313446	大人に大人が慎重にやればね別にそんな難しいことじゃなかったんだそういうことってあるだろう今おそらく
1110.8733	8.0700	overt	1110.7500	1333048	だけどそれで皿を使うのをやめるってことにはならなくみを入れるなら大きな皿の方がやりやすいし
1121.7933	16.2000	overt	1121.6700	1346152	それに僕は気がついたんだけど慎重に丁寧にかけ混ぜるより皿の中で思いっきりかけて混ぜる方が爽快感があって好きなんだよだからそれからはいつも皿を使うか使わないか考えるようになったんだ
1138.9233	6.7800	overt	1138.8000	1366708	僕は今ダイナミックにかき混ぜたい気分なのか皿を洗う面倒がそれを上回るのか
1147.5633	12.5700	overt	1147.4400	1377076	でも今は皿なんか全部人が洗ってくれるそれどころか頼めばシェフがきれいにかけ混ぜて持ってきてくれるしなんならスプーンで口まで運ばせることだってできる
1163.0433	5.5500	overt	1162.9200	1395652	なんといっても僕はロンタオだからねここでは王様みたいなものさくだらない
1169.3133	4.2600	overt	1169.1900	1403176	困惑する姉妹の前でハートため息をつき
1181.3733	7.7100	overt	1181.2500	1417648	それでしばらくその葛藤を忘れていたんだけどこの間一人の時納豆ご飯を作って食おうと思った時にね
1190.0433	8.6400	overt	1189.9200	1428052	ふと昔の悩みがよみがえったんだよサラで混ぜようかなそのまま混ぜようかなって悩んでたんだニサン分は迷ったかな
1199.2533	12.7500	overt	1199.1300	1439104	ずいぶん長いだろう僕は仕事のことだったらそんなに矛盾不断になったりしないのにおかしいと思わないかい人が死ぬか死なないかって決定をあっさりくだすのに
1228.4733	3.6000	overt	1228.3500	1474168	納豆の皿を使うか使わないかで悩むんだ
1232.8833	6.9000	overt	1232.7600	1479460	人間の価値観ってのは面白いものだなと思ったよ結局さ我々の行動なんてものは
1245.6033	7.9500	overt	1245.4800	1494724	話はまだ途中だったが語ってしゃべっている途中で急につまらなくなってため息をついた
1254.0633	5.3100	overt	1253.9400	1504876	まあどうでもいいややっぱりお疲れなんでしょうか少しお休みになられては
1259.9433	5.5500	overt	1259.8200	1511932	姉妹はニ人して僕を心配してくれるありがとうでもその必要はない
1272.1533	12.0600	overt	1272.0300	1526584	そう断ったところでレイレイが別の飲み物を持ってきた爽やかな香りがするハーブティーだったこのお茶一応にいいんですってレイレイは意味ありげな視線を僕に向ける
1285.6833	6.9600	overt	1285.5600	1542820	同じ病気で死んだ父の末期に付き添った彼女は何か感づいているのかもしれない
1308.6033	11.9400	overt	1308.4800	1570324	まあ身の回りにいる人間に隠し通すのは不可能なんだろうなそのうち彼女のや伝えておかなければいけない早ければ早ければ早ければ早いほどいいのだろうけれどやはり抵抗がある
1320.5433	11.9400	overt	1320.4200	1584652	自分だけで抱えて周りの誰もそうと知らずに接してくれているうちはなんだか悪い夢のような感覚でいられるが
1336.2333	12.4500	overt	1336.1100	1603480	人と話して周りがそれを意識することで嫌をなく現実の一部になってしまうような気がするこれは僕の弱さだなそう思いながら一口のみ何も
1348.6833	12.4500	overt	1348.5600	1618420	何も気にしないでいい僕はきっとこの仕事が向いているなんといってもあのクリスツエの息子だからねこんなに一生懸命働いているんだから彼も地獄で喜んでいるだろうと言った
1362.3633	3.9300	overt	1362.2400	1634836	ジューキュー時まで質問を行うと乾いた石が出た
1368.5733	6.9600	overt	1368.4500	1642288	僕の体を虫ばむ病気が進行すればやがて内部の組織からボロボロと崩れ
1376.0733	3.2400	overt	1375.9500	1651288	喉に肉辺や血が混じってくる
1386.6333	9.2400	overt	1386.5100	1663960	現時点で僕の症状がそこまで進行していることはありえないのだけれど口元に当てたハンカチをつい確認してしまう
1396.6233	15.0000	overt	1396.5000	1675948	その時もじゅっとハンカチを見つめていると幼児のために訪れていた富が風邪ですか気をつけないとダメですよロンタウが倒れたら代わりはいないんですからと心配そうに言ってくる
1415.5233	7.5900	overt	1415.4000	1698628	最初はぎこちなかった僕への敬語もだいぶこなれたものだ僕は何とでもないと答えたが
1423.8033	12.6600	overt	1423.6800	1708564	実際にはだいぶ体が重かった今日はそこで仕事を切り上げることにしてスーツから私服へと着替えたまだお出かけですか誰かを連れになられた方が
1439.7633	8.6100	overt	1439.6400	1727716	一人で外へ出ようとする僕をこう姉妹が心配するが僕は無言で肩をすくめてそれを断った
1449.3033	10.0200	overt	1449.1800	1739164	僕がぞろぞろと人を壁連れて歩くのが好きでないことを好きではないことを彼女たちは知っているからそれ以上は何も言わなかった
1460.6733	4.7400	overt	1460.5500	1752808	雨は降っていなかったが夜風が少し湿っている
1472.0733	8.0400	overt	1471.9500	1766488	僕は裏の小さな通用口からグランドタワーを出ると夜道を歩いた
1482.5433	5.8800	overt	1482.4200	1779052	変装にもならない気休めとして帽子と眼鏡をかけてはいるけれども
1493.6733	3.2700	overt	1493.5500	1792408	無用順といえば確かにその通りかもしれない
1498.2633	5.5500	overt	1498.1400	1797916	外歩きが好きなトミーでさえいつもサイキックのアイスをそばに置く
1508.9433	18.6600	overt	1508.8200	1810732	これが僕の悪い癖なのは自覚しているしかしこれくらいは好きなことをしたっていいじゃないかそうやっと執務から解放されたのだこれからはやっと自分のために時間を使えるそうにわかに元気になってくるのだから厳禁なものだ
1528.1133	5.1000	overt	1527.9900	1833736	ここ数日僕には仕事の他に個人的に興味のも
1535.4033	15.2900	overt	1535.2800	1842484	興味を持っていることもあるいや仕事につなげられることではあるのだが今のところまだそこまで具体的に考えてはいない趣味の班中と言っていいだろう秘密裏に行っていることだからYSの誰かを伴いたくはない
1550.6933	15.2900	overt	1550.5700	1860832	それに今日向かっている場所の主はギャングとかかる割り合うことを嫌っているだから僕もそこへ向かう時はサン代目のロンタウではなく一戸人としての車両あるいは菅原寮として訪れることになるのだ
1565.9833	15.2900	overt	1565.8600	1879180	今日はそこへ訪れる前に用事があってカストロ通りに寄った日本でも有数の繁華街であるこの通りには平日も週末も関係がなくこの街は人であふれている
1589.0733	8.1300	overt	1588.9500	1906888	夜の闇に無数のネオンがまぶしく輝きそので赤な光が
1598.1633	1.6200	overt	1598.0400	1917796	人々の顔を
1601.5833	2.9700	overt	1601.4600	1921900	極彩色に塗らしている
1621.2333	1.6500	overt	1621.1100	1945480	極彩式に
1627.1133	7.6200	overt	1626.9900	1952536	濡らしているしょっちゅう事件が起きるこの通りによくもまあ恐れもせずにこれだけの人々が足を運ぶものだ
1635.7533	12.8100	overt	1635.6300	1962904	まるで夕方に釣られて集まるハムシのように危険そのものをも人を引きつけるのだろうかまあ理屈に合わぬことをしているという点では僕も同じなのであまり偉そうなことは言えないが
1649.0733	8.2200	overt	1648.9500	1978888	結局のところ人間というものはどんなに賢いふりをしたって自ら優雅に近づいてしまうものなのだろう
1658.1633	6.5700	overt	1658.0400	1989796	自分を懸命だと勘違いしている人間が自滅していく人々をあざわらう
1666.5333	5.8500	overt	1666.4100	1999840	しかし笑っている方だって自らが大事にしているものにそれほどの価値があるわけでもない
1672.9833	3.4200	overt	1672.8600	2007580	命だって一番大事なものとは限らない
1684.9833	9.2100	overt	1684.8600	2021980	水の入ったグラスを鍵のついた金庫にしまったところでいつか蒸発して消えてしまうのと同じように
1698.7233	5.4300	overt	1698.6000	2038468	何にも使わなかったとしても命はそのうち消えるのだ
1735.2933	5.3100	overt	1735.1700	2082352	カストロ通りの雑踏は僕にとっては居心地がいい
1742.3433	11.4900	overt	1742.2200	2090812	人混みに入ってしまえばもう誰かが僕に気づく可能性はほとんどなくなる僕は名もなき群衆に同化してしまうのだ何者でもなくなる
1760.1933	3.6600	overt	1760.0700	2112232	だから僕は昔からこうしてざっとを歩くのが好きだ
1764.5133	3.6900	overt	1764.3900	2117416	いろいろなしがらみが絡みついた
1769.1033	15.8400	overt	1768.9800	2122924	自分ではなくなって顔のない背景にそしてこの街に同化したような気がするこの街のことが好きじゃなかったのになぜそれが心地よかったのかおかしな話だこうしているとその頃のことを思い出す
1785.9333	9.0900	overt	1785.8100	2143120	屋台で売る声と買う声が聞こえる雑然とした街中で自分の声を届かせようと思う
1795.8333	4.8900	overt	1795.7100	2155000	客も店員も相方荒っぽい大きな声で会話をする
1801.2633	14.5800	overt	1801.1400	2161516	北京の断片が聞こえる英語の断片が聞こえる関東語の断片が聞こえる韓国語の断片が聞こえる花屋の前を通ると見かけた顔が店先にあった
1817.4333	7.5000	overt	1817.3100	2180920	前髪を垂らして顔を隠したその女庭院は子供時代の仲間の一人だ
1827.1233	3.3600	overt	1827.0000	2192548	元々道親コンタたちのグループにいた子で
1838.7933	13.1700	overt	1838.6700	2206552	手癖が悪いゆえに容量も悪くちょいちょい店先のものを盗んでは見つかって殴られていた前髪の下には特質変異による経営系がありそれが原因で家族から疎まれていた
1873.4433	1.3500	overt	1873.3200	2248132	今割れていた
1949.4033	6.9000	overt	1949.2800	2339284	生まれていたためほとんど家に帰ることがなかった僕らのグループが大きくなり始めた頃に
1959.8133	3.1500	overt	1959.6900	2351776	彼女の家には新しい父親がやってきた
1967.1333	7.2600	overt	1967.0100	2360560	いい父親だったらしく彼によって学校に通えるようになり僕らのところにはあまり顔を出さなくなった
1985.7633	6.5700	overt	1985.6400	2382916	だからその姿を見るのは実に少年の頃以来なのだがこんなところで働いていたのか
1994.3433	13.2600	overt	1994.2200	2393212	黒っぽいポロシャツにデニムのズボン足にはスネーカーという動きやすそうな服装ね店のロゴが入ったイプロンをしているそしてドレスを着た女の客と何か話していた
2008.1733	7.0200	overt	2008.0500	2409808	僕は声をかけようと思ってけれど考えてみたら別弾話すことなど何もないことに気がついた
2016.0933	6.0600	overt	2015.9700	2419312	今の僕がこんなところで出し抜けに声をかけても驚かせるだけだろう
2026.3833	2.0100	overt	2026.2600	2431660	今の僕がこんなところ
2028.9933	19.4100	overt	2028.8700	2434792	そのまま立ち去ろうとした時彼女がこちらをちらと見て口を丸く開いて気づいたそぶりをしたのがかすかに見えたけれど何も言わない僕はそのまま歩き去ったそしてすぐ近くの雑貨屋に入ると白いチョークを購入したそうこれが重要なのだ
2049.3033	1.4700	overt	2049.1800	2459164	何か食うか
2052.4533	12.7200	overt	2052.3300	2462944	塩栗員の社長塩健次郎は無言で僕を部屋に招いた後ポツリとそう尋ねた外情部さっきカストロ通りの屋台で食べてきたんだ
2065.1733	12.7200	overt	2065.0500	2478208	僕はメガネをケースにしまいながら答えたかけ慣れないメガネのせいでフレームの当たった鼻の付け上がりが痛み人差し指と親指でもつまんでも見ほぐす
2080.4733	14.4000	overt	2080.3500	2496568	塩さんはくるりと背を向けて廊下を進む僕はそれについて歩くよく気づかれなかったな歩きながら塩さんはそう尋ねるみんな明るい寝音に気を取られてるんだ他人の顔
