onset	duration	trial_type	wav_onset	sample	value
2094.8733	14.4000	overt	2094.7500	2513848	それより預け者の様子はどうだい相変わらずだ知りたいことはデータを見てくれ称さんはドアドアを開けて奥の部屋に入る僕はその後に続く
2111.0133	12.1800	overt	2110.8900	2533216	男一人初体になったこの家は以前よりも掃除が行き届かず乱雑に物が散らばっているテーブルの上にはウイスキーの瓶がサン本並びうちニ本は
2123.1933	12.1800	overt	2123.0700	2547832	さっきまでそこで飲んでいたらしくグラスにも紅白色の液体が注がれているそしてその隣にはアルバムが開いたままになっていた
2135.9433	3.8100	overt	2135.8200	2563132	そこに貼り付けられていたのはこの家で
2141.4933	7.5000	overt	2141.3700	2569792	この家の前で撮った写真で珍しく笑顔の塩さんと無表情の僕とマツコが映っている
2150.6733	13.2600	overt	2150.5500	2580808	まだ小さな僕と松子は手をつなぎ後ろに立ったしおさんがニ人の方に手を置いていたこんな写真をいつ撮ったのか何で撮ったのか僕はちっとも覚えていない
2164.8033	7.3200	overt	2164.6800	2597764	シロさんはそのアルバムをパタンと閉じ椅子に腰掛けるとまたグラスを手に取った
2173.4733	14.9100	overt	2173.3500	2608168	俺はすぐ出かけなくちゃいけないがお前は好きな時に帰ればいい塩さんはポケットに手を突っ込むとカードキーを僕に向かって放り投げた余裕による手元の狂いとつながれたキーホルダーが重心を狂わせてあらない
2188.3833	14.9100	overt	2188.2600	2626060	あらの方向へ飛んでいくそれを僕は右手を伸ばしてどうにかキャッチする帰る時は郵便受けに入れておいてお前も飲むかこれから仕事のはその息は酒臭かった
2203.2933	14.9100	overt	2203.1700	2643952	いいくさどうせ向こうでも飲むんだ今日は接待を受けるだけなんだ気が進まないがこれも仕事だからな女も用意してくれるらしいうんざりするよ
2220.5133	15.2400	overt	2220.3900	2664616	四億林は順調に授業を拡大しY地区外に拠点を移設らしその際Y地区での授業を売却あるいは委託するのではないかと噂になっている
2235.7533	15.2400	overt	2235.6300	2682904	その授業を引きその授業を受け継ぐとなれば瞬く間に地域の資産家の仲間入りだ表社会の人間も裏通りの人間も
2252.3733	4.5000	overt	2252.2500	2702848	多少資金があるものは我こそはとちまな子になっているようだ
2263.4133	3.8400	overt	2263.2900	2716096	僕は話を聞いた時すぐにそのことが思い浮かんだ
2270.3733	12.4200	overt	2270.2500	2724448	ロンタオとしては何か言うべきだっただろうでもそんな気持ちになれるはずもなくそのまま聞き流した最近は少し動いただけで節節が痛む年は取りたくないものだな塩さんは顔
2282.7933	12.4200	overt	2282.6700	2739352	顔をしかめながら腰の辺りをたたきそうぼやいた少しアルコールを減らしたらどうだい僕の言葉に彼は無言で首を横に振るとグラスに唇をつけた
2301.0033	7.9500	overt	2300.8800	2761204	もともと彼は酒が好きで若い頃に研究者を辞めた直接的なきっかけも酒によるトラブルだったと聞いている
2310.5133	8.2200	overt	2310.3900	2772616	何も起こさなくても続けられる仕事ではなかっただろうからそれが運命を変えたということにはならないだろうけれど
2319.3633	5.0700	overt	2319.2400	2783236	マツコがいなくなってから止めるものもいなくなりますます量が増えたようだった
2327.6733	16.8600	overt	2327.5500	2793208	勤め先でマツコが襲撃にあったことが彼の心にどういう影響を与えたのかは僕も知らない彼女がいなくなってから僕は以前のようにちょくちょくここに来るようになっていたが一度もそのことを話題にしたことがなかったからだ
2348.4033	19.1700	overt	2348.2800	2818084	彼にとってマツコというものはもともと拾ってきた不思議な肉片でしかなく父親のふりをすることになったのも行きがかり上のことで望んだものではなかったろうがしかし松子といる時は本当の父親のように見えた
2369.0133	7.7400	overt	2368.8900	2842816	そして不思議なもので彼女がいなくなった今はちっとも父親らしくなくなく主老の独身男にしか見えなくなった
2378.7333	6.6600	overt	2378.6100	2854480	お前こそ目の下のクマがひどいぞ眠れていないんじゃないかそんなことはないよ
2386.4733	3.6600	overt	2386.3500	2863768	影の具合でそう見えるだけさそうか
2393.2833	4.5900	overt	2393.1600	2871940	僕は無言で酒を飲み始めた塩さんをその場に残し
2398.7133	5.0100	overt	2398.5900	2878456	地下室へ向かうそして歩きながらあの夜のことを思い出した
2404.9833	11.4150	overt	2404.8600	2885980	夜遅くこうしまいも礼礼も帰らせた執務室で一人うつらうつらしていた時のことだ警察からの連絡で目が覚めた
2416.3983	11.4150	overt	2416.2750	2899678	個室へに関することでYSと警察は連絡を取り合うことになっており要件を聞く前からすぐにそのことだと気がついたまたどこかで新しい犯人を殺したのだろう
2429.0733	6.6600	overt	2428.9500	2914888	電話をかけてきたのはあの時路地と共に訪れた三好という女性警官だった
2442.9933	10.6800	overt	2442.8700	2931592	彼女の言葉は途中まで僕の思った通りの内容を述べていたけれどもコスチェイが事件を起こした場所に触れ被害者の名前を告げたところで僕は凍りついた
2459.7633	17.1900	overt	2459.6400	2951716	私は自動養護施設被害者は当直の職員一名です死を松子という女性職員で体中の血管からさっと血が引くその存在するはずの音さえ聞こえそうなほどの驚きだった
2478.4533	14.4400	overt	2478.3300	2974144	まだ現場はそのままですか今から私が行きます見せてください僕は言葉が終わる前にそう言ったそれは見せてくれないのならYSは今後一切警察と協力しませんよ
2492.8933	14.4400	overt	2492.7700	2991472	もう片手にそうしゃべりながら立ち上がりもう片方で上着をつかんでいたしかしそれは身を戸惑ったらしくそこで言葉を途絶えさせる中秋の向こうでかすかにしゃべる声がする近くにいる誰か
2507.3333	14.4400	overt	2507.2100	3008800	相手は低い男の声でどうやらそれは路地のようだった分かりました相手がようやくそう答えた時僕はもうすでに部屋を出てエレベーターのボタンを押していた
2523.9633	15.6300	overt	2523.8400	3028756	その辺にいた部下を捕まえて車を運転させて現場にたどり着いた僕を出迎えたのは三好路路樹のニ人だった僕が来るということで現場検証を一時中断させ捜査員をよそへ行かせてくれたらしい
2540.1033	11.4300	overt	2539.9800	3048124	僕と警察の付き合いは全ての警察官が知っているわけではないのかそれとも僕に気を使ってくれたのかは分からない現場となったのは施設内の管理棟の応接室だ
2551.5333	11.4300	overt	2551.4100	3061840	ここで暮らす子どもたちはまだ異変に気づかず眠っているようで施設の中は静まり返っていた当時到着をしていた職員たちは
2563.8333	5.1000	overt	2563.7100	3076600	警察のパトカーの中で事情聴取を受けていると三好が言った
2569.5333	9.3300	overt	2569.4100	3083440	そのうち一人の田辺という職員はマツコと共に訪れたコッシュに出会っており彼女の口から事件の概要が明らかになったのだそうだ
2580.2433	8.0700	overt	2580.1200	3096292	子知恵は最初女の姿で現れたインターホンを押し児童の母親だと名乗り面会を求めた
2588.9433	10.3200	overt	2588.8200	3106732	時間外だからと一度は断ったが門の前から動こうとせず仕方なく施設内の応接室に招き入れるそこで相手は礼によって変身しニ人を驚かす
2599.2633	10.3200	overt	2599.1400	3119116	本性を見せた越知恵はニ人に襲いかかり松子は田辺だけを建物の外に寝がすと冷えに引き返したそうだ
2612.9733	9.8700	overt	2612.8500	3135568	しばらく経って何の音もしなくなってから田辺やバットを片手に管理棟に戻り果てた姿になったマツコを発見したという
2625.8733	6.6900	overt	2625.7500	3151048	その田辺って職員はすごい勇気だなコッシェにバットで立ち向かおうとしたのか
2636.6733	6.9000	overt	2636.5500	3164008	応接室までのサンつから説明してくれた三好に対して僕は冗談めかしてそう言ったつもりだったが
2645.1933	3.8700	overt	2645.0700	3174232	自分でも驚くくらい偉だった声になってしまった
2655.1233	10.8300	overt	2655.0000	3186148	正義感の強い女性のようですそして部屋に戻った彼女はそれからもういいです続きは見た後で聞きます
2665.9533	10.8300	overt	2665.8300	3199144	もう僕らは殺人現場となった応接室の前に到着していたあまり触らないでください
2677.2933	4.8600	overt	2677.1700	3212752	鑑識がある程度は見ていますがまだ完全には終わっていないんです
2683.2933	6.0600	overt	2683.1700	3219952	三好は懐中電灯と白い手袋を手渡しながらそう言った
2704.8333	12.8400	overt	2704.7100	3245800	僕は返事をせず黙ってそれを受け取ると自らの手にはめるそして彼女が持っていた怪獣電灯を借りると自ら応接室のドアを開いた
2721.3033	8.3100	overt	2721.1800	3265564	真っ先に目に飛び込んできたのは部屋の中央のローテーブルの上で仰向けに倒れる女の姿だった
2732.6133	10.8000	overt	2732.4900	3279136	下半身には何も身につけておらず真っ白な足が左右に大きく開かれておりその陰部がちょうどこちらの入り口の方を向いていて
2745.0333	7.1400	overt	2744.9100	3294040	海中電灯の光の輪で照らすとテラテラと液体が漏れているのが見えた
2754.4533	2.7900	overt	2754.3300	3305344	ああこの服装には見覚えがある
2758.5333	10.5600	overt	2758.4100	3310240	それに気がついた瞬間僕は数秒そこで立ち止まってしまった頭の奥がつんとまへしてほとんど何も考えられなくなったのだ
2769.6333	6.5700	overt	2769.5100	3323560	吐き気がする体の周りを取り囲む空気がピシピと音を立ててひび割れてしまいそうだ
2777.5833	10.3950	overt	2777.4600	3333100	僕はまるで深海の底に突き落とされてしまったような圧迫感を全身に感じながらぎこちなく体を動かしてその女に近づく
2787.9783	10.3950	overt	2787.8550	3345574	靴底にジャラリとガラスのようなものを踏む感触がありそこで初めて僕は部屋が恐ろしくあり果てているのに気がついた
2798.8833	6.0000	overt	2798.7600	3358660	近づいて仰向けに天井を見つめている被害者の顔にライトの光を当てる
2808.8733	10.5000	overt	2808.7500	3370648	服装や体つきでほとんど確信していたがしてはいたがその顔を見たことでもう完全に他のどんな可能性も存在しないことを認めざるを得なかった
2822.4933	6.3600	overt	2822.3700	3386992	死んでいるのは塩松子だった彼女はここでコッシエに殺されそして死体を療熟されたのだ
2829.6033	3.8400	overt	2829.4800	3395524	コスティは自分がシオさんの母
2835.0933	10.7400	overt	2834.9700	3402112	塩さんの母だと名乗ったらしいそして女の姿になって彼女と会話を交わしたそうだおそらくローズクラブにいた東洋人の女だろう
2845.8333	10.7400	overt	2845.7100	3415000	俺が出会った女だいつの間にか路地が僕に並んでいた読み下ろしていた触るなと言われましたが僕はジャケットを脱いで
2860.2633	2.5800	overt	2860.1400	3432316	夏子の下半身を隠してやった
2863.7733	4.0500	overt	2863.6500	3436528	いくらなんでもこの格好はあまりにも哀れた
2871.6633	2.4600	overt	2871.5400	3445996	路地は漢字を押さえた声で言う
2876.4633	2.9700	overt	2876.3400	3451756	塩さんとコスチェに何かの
2880.8433	8.1600	overt	2880.7200	3457012	関わりがあるのは俺も知っていた彼女にもっと気をつけるよう言っておけばあるいはその言葉を僕は遮る
2911.7133	11.4150	overt	2911.5900	3494056	それは私も同じですよ少し考えれば襲撃は想定できましたし何か忠告も言えたでしょうでも話によると彼女は握られたのに舞い戻って決着を
2923.1283	11.4150	overt	2923.0050	3507754	それの例ならば結局何を忠告したところで結果はそう変わらなかったかもしれませんこいつは妙なところが頑固でしたから
2936.8533	2.7900	overt	2936.7300	3524224	僕は振り返って口調をしてみせた
2940.6633	9.9000	overt	2940.5400	3528796	あなたと被害者の関係は路樹さんから伺いました子供の時から親しかったんですねこんなことになってしまってなんと悔やみを申し上げていいのやら
2952.1833	10.7250	overt	2952.0600	3542620	三好が少し離れた場所から僕を見ている悪いが彼女との関係は調べさせてもらった路地は妙に目をギラギラと光らせて僕を見ている
2962.9083	10.7250	overt	2962.7850	3555490	それが探偵の仕事ですからね僕は肩をすくめそれよりも問題は彼女がどうやって死んだのかってことです
2975.1633	4.5900	overt	2975.0400	3570196	この死を待つ子っていうのはね普通のやり方じゃ死ぬはずがないんだ
2982.8733	13.8900	overt	2982.7500	3579448	父がローズクラブを襲撃した時不死身のはずの女たちが大量に殺されていたといいますが同じ手を使ったんだと思いますがそれが何なのかあんたは冷静だな
2996.7633	13.8900	overt	2996.6400	3596116	僕を見ながら言う大事な人間をなくしたのにそんなふうに振る舞うことができるのか俺はとてもそんな風には語尾が感情で乱れた僕はその時初めて
3011.6733	8.4600	overt	3011.5500	3614008	彼の目の奥にあふれ出てきそうなほどの象と怒りが渦巻いているのを感じた
3021.4533	4.7400	overt	3021.3300	3625744	きっとさっきからこの表情をしていたのだろうけれど
3026.8533	4.2300	overt	3026.7300	3632224	僕は目の前のことに夢中で全く気がつかなかったのだ
3032.1933	5.9700	overt	3032.0700	3638632	そうですか冷静に見えますかそれならよかった僕は薄く笑ってみせた
3042.2433	3.5700	overt	3042.1200	3650692	世の中に憎しんのようにずっと暮らしてきた
3047.4033	5.6100	overt	3047.2800	3656884	大事な人間がこんな目にあって平気でいられる人間などいるのだろうか
3058.4433	5.4300	overt	3058.3200	3670132	マーミンの時に僕はだいぶこういった感情になれたつもりだったが全然ダメだ
3065.0133	11.6100	overt	3064.8900	3678016	口の中が乾き米紙の辺りがジンジンとするマツコをこんなふうにした骨子へのことを思うだけでどろどろと暗い暴力的な感情が湧く
3077.5833	5.5800	overt	3077.4600	3693100	僕はめったに他人にこんな感じを持つことはないがこれが象なのだろう
3085.9233	3.7800	overt	3085.8000	3703108	こういった感情が態度に出ていないのはよかったと思う
3097.8933	9.5100	overt	3097.7700	3717472	僕はギャングのボスでたくさんの罪もない高層相手を殺している身内が死んだからといってメソメソ泣いていたら人はなどるだろう
3108.7833	6.9900	overt	3108.6600	3730540	いや父さんならば身内が死ねば涙を流して泣き敵を殺せば大いに喜んでいたのだろうか
3116.9433	7.0500	overt	3116.8200	3740332	そういうやり方もリーダーの魅力にはなるのだろうが僕はできないお前は可愛い気がないな
3126.4233	1.5000	overt	3126.3000	3751708	小さな頃
3128.5533	11.2350	overt	3128.4300	3754264	たまに会う父さんがそう顔をしかめたのを思い出した僕は家族と離れても一言も寂しいと言ったことはなかった
3139.7883	11.2350	overt	3139.6650	3767746	いろいろと確かめたいことがある僕はそう言って最後にマツコの髪をなでてからその痛ましい現場から顔を背けた
3151.9533	3.5400	overt	3151.8300	3782344	そして入口の方へ数歩歩いたところで
3156.4833	2.2200	overt	3156.3600	3787780	つま先に何かを
3159.8733	1.0800	overt	3159.7500	3791848	けれどバス
3164.7933	6.3600	overt	3164.6700	3797752	拾い上げるとそれは白濁したプラスチックでできた使い捨ての小さな注射器だった
3183.4533	5.7600	overt	3183.3300	3820144	先端には細い針が取り付けられかすかに薬剤薬液が残っている
3189.7533	8.6100	overt	3189.6300	3827704	この施設には似つかわしくないものだから事件と関係したものだろう検識が見落としたのだろうか
3199.2933	6.3000	overt	3199.1700	3839152	無能というより僕が訪れるということでバタバタとさせてしまったのかもしれないどうしました
3206.6133	8.0400	overt	3206.4900	3847936	みのしが僕に尋ねる怪獣弁当を持っているのは僕だけで何をしているのかよく見えなかったのだろうボタンが取れて
3215.4933	2.0700	overt	3215.3700	3858592	僕はそうごまかし
3220.2033	4.7400	overt	3220.0800	3864244	ささぬ容器をつけながら注射器をポケットに隠し部屋を出た
3226.0233	3.9300	overt	3225.9000	3871228	僕はすぐに塩さんを訪ねた
3231.3933	8.7300	overt	3231.2700	3877672	僕の立場からすればそう頻繁に訪れるべきではない場所だがマツコがこうなってしまった以上危惧している
3240.8133	1.4100	overt	3240.6900	3888976	場合ではない
3317.6133	9.5400	overt	3317.4900	3981136	僕は警察に見せられたものについて話しそして注射器に入っていた薬液の成分をニ人で調べた
3334.5933	3.0000	overt	3334.4700	4001512	するとそれがねオローソであると判明した
3346.0233	9.9300	overt	3345.9000	4015228	コスチーが現場で使用したのだろうかと当初は思ったが注射針についた血液を分析すると全く別の状況が明らかになった
3358.0533	9.0600	overt	3357.9300	4029664	この血液の消災を突き止めるには警察のデータと照合するなどなかなか手のかかる作業があるのではないかと考えていたが
3368.2833	10.5750	overt	3368.1600	4041940	その必要はなかった万が一のことを考えて最初に手持ちのデータと照合したらその時点で誰の血液なのか判明してしまったのである
3378.8583	10.5750	overt	3378.7350	4054630	これはマツコのものだったこの塩底の地下室のコンピューターに保存された遺伝子情報と寸分たがわず一致したのである
3390.4833	3.9300	overt	3390.3600	4068580	現場でコスチェはマツコに寝ようぞを使用したのだ
3402.9933	4.9200	overt	3402.8700	4083592	その目的はいくつか考えられたが僕と翔さんのよう
3408.6333	1.8900	overt	3408.5100	4090360	予測は一致していた
3411.6933	7.1100	overt	3411.5700	4094032	つまりこのネオローズこそがマツコの再生能力を奪いしめるための道具なんじゃないか
3446.5233	10.2600	overt	3446.4000	4135828	この薬がタイプBの様々な症状を取り除くことは知られているそれがどういう理屈で作用しているのかその記事は
3457.3833	6.9300	overt	3457.2600	4148860	全く不明なのだけれど再生能力がもしタイプBの症状の一つであるならば
3478.0533	11.5200	overt	3477.9300	4173664	あるいはそれを打ち消すこともできるのかもしれないこの仮説はすぐに証明する機会が訪れた地下室に足を踏み入れる明かりが大灯
3490.5333	4.8300	overt	3490.4100	4188640	部屋の中は真っ暗だがところどころに装置のランプが光り
3495.9933	15.2700	overt	3495.8700	4195192	低い作動音を鳴り響かしている何度足を運んだかわからないこの部屋で照明のスイッチの場所を体を覚えていてほとんど無意識に人差し指が探れ当ててパチリと押し込む
3511.8933	4.8300	overt	3511.7700	4214272	青みがかった光の照らされたその部屋はあちこちに書類が
3518.7633	9.6900	overt	3518.6400	4222516	開いたままになっていたり片付け忘れた器具が机の上に置いたままになっていたがそれでも上のリビングルームよりは片付いていた
3529.4733	10.0500	overt	3529.3500	4235368	奥の方にかつて塩松甲肉片から再生した培養機が設置されているあまり頻繁に使われることのないその大きな装置に今は
3539.5233	10.0500	overt	3539.4000	4247428	赤いランプが点灯し時折ゴポゴポと気泡が音を立てていた
3561.3033	10.8600	overt	3561.1800	4273564	その中に彼はいたいやあるいは彼女といようかいくつもの姿を持つその人物の性別を問うのは無意味かもしれない今は金髪の今は金色
3572.1633	10.8600	overt	3572.0400	4286596	金色の髪をほっそりとした白い肌を持つ少年の姿で胎児のように膝を抱えて丸くなった姿れば医療機の中で目を閉じている
3584.0733	7.7100	overt	3583.9500	4300888	アレクサンドルヤコブレビチシェルヌイフというのがその名はらしい
3592.3233	9.9300	overt	3592.2000	4310788	調査の結果の内容が正しければこれが顔のない不死身の殺人鬼越越へのオリジナルとされている姿だ
3609.2733	8.9100	overt	3609.1500	4331128	仙台エリーホワイトはもともとロシアで活動しており今のエリーホワイトもそのスタッフとコネクションをつなや受け継いでいる
3620.3433	5.3100	overt	3620.2200	4344412	つまりロシアの裏社会とは少なからずつながりがあり必要とあれば
3627.3333	6.0900	overt	3627.2100	4352800	銃や弾薬などの物品だけでなく情報も調達することができた
3639.2733	3.8700	overt	3639.1500	4367128	その情報によるとコッシェはあのフラス
3643.9533	3.6000	overt	3643.8300	4372744	フセスラフ計画の被験体であったという
3681.9333	3.8100	overt	3681.8100	4418320	フラッセフ計画というのはミュータントの解明
3686.7933	11.7300	overt	3686.6700	4424152	お呼び利用のためにロシア政府と製薬会社が共同して立ち上げたプロジェクトのことで常に人体実験の黒い噂がつきまとう悪夢を高いものであった
3704.1933	5.8800	overt	3704.0700	4445032	この昔に計画は中止され今となっては半ば都市前説のようになっており
3714.7233	5.8800	overt	3714.6000	4457668	ロシアで異常なミュータントが生まれるたびに何の根拠もなく関係が取り
3721.3233	12.0300	overt	3721.2000	4465588	さたされたりもするコッシュに関してもその類の世間の好奇心が生んだ噂でしかないのかもしれないがしかしいくつか具体的な情報も含まれていた
3734.3133	9.1800	overt	3734.1900	4481176	アレクサンドルヤコービレビチチェルヌイフという名もその情報の一つである世間で知られているフラッセ風
3744.6933	3.8400	overt	3744.5700	4493632	不正スーラフ計画の表ましはこうだ
3753.6933	10.6650	overt	3753.5700	4504432	かつてロシアの田舎町にチェルヌイフ家という一家が住んでいたその家族は不死身の吸血鬼で古い時代では漁師として権利
3764.3583	10.6650	overt	3764.2350	4517230	地域では体操を恐れられていたその一家にアレクサンドルという子供がいてこれが町から連れ去られ
3777.3033	16.5450	overt	3777.1800	4532764	政府の研究所で危険体として実験に使われることになったこれが後に不正数ラフ計画と命名されたというのだ一種の伝説であろう
3793.8483	16.5450	overt	3793.7250	4552618	吸血鬼というのは僕と塩さんが調べた特殊タイプBの性質とによったものがあるしいかにもそれらしい物語であるが実際に詳しく調べさせたところをそのチールヌイフ家の存在を発見することはできなかった
3811.6533	6.9000	overt	3811.5300	4573984	伝説によるとチェルネイフ家はロシア西部のグレートホール府県の街に存在したということになっている
