onset	duration	trial_type	wav_onset	sample	value
3838.2333	14.0100	overt	3838.1100	4605880	コシチェが不死身の一族の松江というのは結局ただの物語だったと考えるのが自然だろう一族の話が噂だとしてもその土地の出身であるというような
3853.5933	16.0500	overt	3853.4700	4624312	形でのつながりはあるのかもしれないがそれに関しては証明するものが何もないしかしだからといって骨子自体がフラス不正数ラフ計画と全く関係無関係だったとは断言できない
3869.6433	16.0500	overt	3869.5200	4643572	いやむしろ彼のサイケックとしても異質な能力やネオローズという一般には知り得ない薬の製法を知っていることを思うと関わっていたと考えた方が自然かもしれない
3904.3233	6.3000	overt	3904.2000	4685188	フセスラフ計画はそのプロジェクトに関わるものは研究者から掃除係まで全ての
3911.3733	5.9400	overt	3911.2500	4693648	全ての役職において積極的にミュータントを採用していたという事実がある
3927.1233	1.4700	overt	3927.0000	4712548	伏せすらふ
3929.1033	12.4050	overt	3928.9800	4714924	計画は差別を受けているミュータントの地位向上のためのプロジェクトであるというのが政府の建前でその一環としてミュタントを取っていたのだ
3941.5083	12.4050	overt	3941.3850	4729810	計画には関わっていたのだろう僕たちも調べてみたけれどさすがに国家の極秘プロジェクトの詳しい内情までは知ることができなかった
3961.4433	10.1100	overt	3961.3200	4753732	何にしろチェルヌイフ家のストーリーが崩れてしまった以上コッシエのオリジナルがアレクサンドルイヤコビレビチェルヌイフという名前であるという
3971.5533	10.1100	overt	3971.4300	4765864	という話さえ信用できなくなってくるその姿も彼の想像が作り出した返信先の一つなのかもしれない
3988.2033	5.5500	overt	3988.0800	4785844	つまり結局コスチェは正体不明の怪人のままでしかないということだ
3997.5933	13.7400	overt	3997.4700	4797112	オリジナルの姿は結局どれなのか分からないヘスと名乗る八流界に近づいたユダヤ人風の老人なのかアレクセイという快楽殺人鬼の声人白人か
4012.5333	15.0000	overt	4012.4100	4815040	恐るべきサイキック能力を持った少女マリアかロジャーアダムスをそそのかした瞳という東洋人の女かそれとも噂通りアレクサンドル少年なのか確定させる情報はない
4028.7333	16.5300	overt	4028.6100	4834480	生まれた時にそれが男であったか女であったのかも分からないあるいは最初から複数の姿を持っていたのかもしれないいつ生まれたのかも分からないそれこそゴジュー年どころかもっと遠い昔に生まれたのかもしれない
4046.7933	3.9900	overt	4046.6700	4856152	そのなんとも知れない存在が今このガラス
4051.2933	2.1900	overt	4051.1700	4861552	塔の中で眠っている
4054.4433	9.0300	overt	4054.3200	4865332	僕はこれに同接するべきだろうこいつはジェフリーやマツコーそして多くの部下たちを殺した
4064.6133	2.1600	overt	4064.4900	4877536	憎きやだてきである
4071.6633	6.9000	overt	4071.5400	4885996	この手で引き裂いたって飽き足らないここであらゆる実験の対象としていたぶり続け
4099.6533	1.2000	overt	4099.5300	4919584	あだ肩
4104.2733	10.9800	overt	4104.1500	4925128	僕の復讐心とそしてギャングになってからは親しく久しく忘れていた科学的好奇心を同時に満たす道具とするのもいい
4115.2533	10.9800	overt	4115.1300	4938304	警察には今でこそこのような協定を結んでいるけれど将来的にはこの関係は崩れてしまうだろう
4127.3733	17.2500	overt	4127.2500	4952848	今回僕らは八流会という長らく最大反抗勢力だった組織を取り込もうとしているこれが無事に成功すればYSの支配力はかつてないほど強硬なものとなりY地区での争いは激減する
4146.0933	11.4000	overt	4145.9700	4975312	つまりそれはY地区の繁華街としての価値をさらに高めるということだそうなればこれまで躊躇していた企業や組織もこの町に進出しようとするだろう
4166.9133	11.4300	overt	4166.7900	5000296	そしてそうした一般企業が街に入り込めば最初はいいだろうがいずれはYSの存在が邪魔になるはずだその時警察がどっち
4178.3433	11.4300	overt	4178.2200	5014012	どちらの味方につくかなんて想像するまでもないことだ今腰へ打ったからといって恩義に感じた判断を変えてくれるような連中でもあるまい
4194.0933	12.2100	overt	4193.9700	5032912	それに警察に言わり売り渡すよりもっといい条件で取引できる相手はいくらでも存在するなんと言っても彼はネオローズの秘密を知る貴重な存在であり
4206.9333	4.3800	overt	4206.8100	5048320	その肉体自体にもミュータントの秘密が詰まっているのだ
4219.6533	12.7800	overt	4219.5300	5063584	ただおかしなところに売りつければコスチーは自らの力で脱出し再び僕らの脅威として現れることになるだろうから相手選びは慎重にしなくてはいけないが
4233.9033	7.1400	overt	4233.7800	5080684	僕は椅子に腰掛け眠るように水中に浮かんでいるコッシチェの姿をぼんやりと眺めた
4242.8433	11.6100	overt	4242.7200	5091412	いろいろと考えてはいたが実際にはまだコスチェには大したことはしていない八流海のネオローズ工場で回収してからずっと培養機の中で寝かせている
4256.1933	8.9400	overt	4256.0700	5107432	おそらくネオローズのレシピを吐かせるために行われたと思われる拷問の傷はもうすっかり言えている
4266.1233	2.1600	overt	4266.0000	5119348	されては面倒なので
4270.6833	9.5400	overt	4270.5600	5124820	微量の麻酔薬を投与し続け眠らせたままデータを取っている今のところコスチェーンに行った実験は一つだけだ
4282.0833	4.6500	overt	4281.9600	5138500	ネオローズが本当に不死の力を奪うのかその確認である
4291.7133	11.2200	overt	4291.5900	5150056	松子の遺体のそばでねおろうず入りの注射器を拾った時僕と師匠さんはこの薬が不死を奪うのではないかと予想しそしてたまたま目の前にこのごし知恵がいた
4307.9733	6.1800	overt	4307.8500	5169568	だから仮説の確認のためにネオローズを彼に投与したのだその結果はドンピシャだった
4317.5133	11.6400	overt	4317.3900	5181016	投与する前はどんなに深い傷もあっという間に再生してしまっていたのに投与後に彼の子につけた切り傷は今でもまだ治っていない
4330.1733	2.8800	overt	4330.0500	5196208	やはりネオローズは再生力を奪うのだ
4333.5933	11.2500	overt	4333.4700	5200312	彼らの仮説は正しくマツコを確実に殺すためにこの薬は使われたのであるそれともう一つ個室には変化があった
4348.9533	2.9700	overt	4348.8300	5218744	それともう一つ個室には変化があった
4352.8833	9.5100	overt	4352.7600	5223460	彼は培養液の中で眠りながら女の姿やら老人の姿やらその姿を目まぐるしく変化させていたのだが
4363.9833	8.5500	overt	4363.8600	5236780	いたのだがネオローズを投与した途端それがなくなって投与時の歩くサンドル少年のまま固定されている
4373.1333	9.9000	overt	4373.0100	5247760	ネオローズの効果が本当にタイプBの症状を消すというのならばその変身能力も彼のタイプBとしての性質から生まれたものだったのかもしれない
4393.5333	4.8600	overt	4393.4100	5272240	そのうちネオローズの効果が切れ彼はまた変身をするようになるだろう
4407.2433	10.7850	overt	4407.1200	5288692	そうしたら今度はかつてこの町王に蔓延した旧ローズの方を使ってみたいおそらく同じような結果が出るだろうと考えている
4418.0283	10.7850	overt	4417.9050	5301634	ローズクラブで不死のはずの女が大量に殺されていた時に使われていたのは時代的に考えるとネオルではなく旧ローズの方でしかありえないからだ
4430.2233	7.9200	overt	4430.1000	5316268	このコスチを実験材料として使えば特殊タイプBに関する様々な事実を解明することができるだろう
4441.1733	7.5300	overt	4441.0500	5329408	もしかしたらこの使い方がYSのために交渉材料とするよりもよほど正しい個指定の使い道なのかもしれない
4450.5333	4.6500	overt	4450.4100	5340640	コースチーによって僕らはマツコのことをより深く理解するのだ
4455.8433	5.0400	overt	4455.7200	5347012	これより正しい復讐の仕方もないだろうそれに何より
4463.5533	2.6100	overt	4463.4300	5356264	こいつは失われたマツコの
4466.9133	1.8300	overt	4466.7900	5360296	敵であるとともに
4473.6333	2.9400	overt	4473.5100	5368360	肉親なのだこうこう
4477.9533	3.3600	overt	4477.8300	5373544	このままここでそばに置いておくのも悪くない
4489.8333	15.9000	overt	4489.7100	5387800	ちょっと前まではそう考えていたのだがしかし今の僕は研究材料にするでもない交渉材料にするでもない第三の使い道のことを考えていたそれは現実する可能性がどの程度あるのかもわからないおぼろげなプランである
4505.7333	15.9000	overt	4505.6100	5406880	もしかしたらただの妄想で全く実現の余地などないのかもしれない他のことならどんなことでも実現性を確率として予測できるのだけれどこれに関しては全く通用しない
4523.6733	13.2000	overt	4523.5500	5428408	推測する材料がないからじゃないいつも通りならある程度の推測はできる状況だと思うのだがどうも今回ばかりは自信がないそれは僕の思考に強烈な感情が脳
4536.8733	13.2000	overt	4536.7500	5444248	濃密に絡みついているからだ人間というものは完全に理性的にはなれない市場が入ると冷静に判断しているつもりでもどうしても普段と違ってしまう
4550.6133	10.2900	overt	4550.4900	5460736	知らず知らず甘い予測をしてしまったり逆に悲観的になって全くそんなことはありえないと思ってし思ったりしてしまう
4589.8833	11.4000	overt	4589.7600	5507860	今まで聡明な人間が駆裂な山地を繰り返すのを何度も見てきた学生時代も名誉もある学者が若い女の肉体に溺れて全てを失ったのを見たり
4601.2833	11.4000	overt	4601.1600	5521540	この仕事に就いてからもいつも冷静な人間が一家族一人失っただけでほとんど自殺同然の行動で死んでいくのを見た
4613.6433	5.0100	overt	4613.5200	5536372	どんな人間でも感情にまとわりつかれたら判断力を奪われてしまう
4634.2233	6.3000	overt	4634.1000	5561068	自分だけは違うと言いたいがそれこそ科学的ではない思い込みだ
4641.0333	11.9700	overt	4640.9100	5569240	僕も他の人々と同じように不合理な感情の獣だと考えるべきだろうで今の僕の思考にどんな感情が絡みついているのかという
4653.0033	11.9700	overt	4652.8800	5583604	ああ全く何ということだろうただただ子供のようにそうなってほしいという願望ばかりが心をいっぱいにしているのだ
4677.6933	15.1800	overt	4677.5700	5613232	それについて考えるだけで胸がさざめきだって落ち着いていられなくなる日中はなるべくこのことを考えないようにしてロンタオとしての仕事に没頭しているがこうしてオフになるともうダメだ全く落ち着かない
4695.2733	8.8500	overt	4695.1500	5634328	うまくいくように僕もいろいろと手を打ったがちゃんと思い通りになってくれるだろうかそれともやっぱりダメなのだろうか
4704.7533	10.8600	overt	4704.6300	5645704	試験の後はいつももう済んでしまったことだからあとは結果を待つだけだと冷単で入れられたのにどうしても同じようには振る舞いない
4716.3333	17.6700	overt	4716.2100	5659600	まあ何でもいいさやるべきことはやったんだ僕の予測とやり方が確かならばそれは今夜にも実現するはずだ今夜何も起こらなくてもまたしたそのそして次の日もある諦めやしない
4740.4833	9.1200	overt	4740.3600	5688580	僕は机にかじりついてパソコンのモニターに映るデータを眺めていた特別な変化はないがとにかく目がしょぼしぼとして画面がねじむ
4774.2933	3.3000	overt	4774.1700	5729152	ここのところずっと寝たく
4780.7433	10.3800	overt	4780.6200	5736892	とも眠ることなどできないのに眠りたくない時に眠気がやってくるものだ僕はインスタントコーヒーを作って一口するしけった味がするこの
4791.1233	10.3800	overt	4791.0000	5749348	子供の頃はワイースの会合で出されるどんなにうまいごちそうよりもこの地下で飲むまずいインスタントコーヒーが
4802.8833	4.7700	overt	4802.7600	5763460	何よりうまく感じたっけ思えばここから全てが始まったんだ
4808.8233	10.2150	overt	4808.7000	5770588	ここで僕は塩さんからいろんなことを教わり待つことで会いみんなで街で遊んでいつからこんなことになってしまったんだろう順を追って考えようとしたけれど考えが
4819.0383	10.2150	overt	4818.9150	5782846	カフェインが大して効いていないみたいだ睡魔が思考の隙間をこじ開けて入り込もうとしている
4836.3633	17.4300	overt	4836.2400	5803636	僕はなんとか抵抗しようとしたけれどうつらうつらまぶたを閉じて開くたびに時間が飛んでそして何回か飛んだ後に目の前に一人の人物が現れてくれたんだ
4883.0433	11.9100	overt	4882.9200	5859652	僕はその人物に声をかけたよく来たねでも随分と感じが変わったじゃないか部屋の向こうに立ちじっとこちらを見つめている少女に眠い目をこすりながらそうい
4894.9533	11.9100	overt	4894.8300	5873944	長い髪の毛は最近あまり手入れがされていないのか乱れている僕が情報で確認している限り倉庫から逃げ出した時は違う服装だったはずだが
4909.2633	6.0000	overt	4909.1400	5891116	どこかで間に合わせたのかゆったりとした服を着てそして金色の目を光らせていた
4917.0933	5.2800	overt	4916.9700	5900512	ここが秘密基地なの少女はそう口を開くそうだよ僕と
4930.8333	6.4200	overt	4930.7100	5917000	塩健次郎さんそして松子もここで過ごしていた時期があったんだとても懐かしい気分だ
4937.9433	1.3200	overt	4937.8200	5925532	それね
4940.4033	12.1200	overt	4940.2800	5928484	エリコお前を見るのもなんだか久しぶりだないつ以来だエリコハイガメエリコは軽減な顔で言う違うのかでもどう見たってエリコじゃないか
4952.5233	12.1200	overt	4952.4000	5943028	違うわ私たちは私たちをだってここにはニ人いるんだから一人にしか見えなくてもニ人いるのよ彼女は戸惑いながら言うが僕には何を言ってるのかよくわからない
4967.3433	11.9400	overt	4967.2200	5960812	一人にしか見えないよでもお前はニ人でいるように感じているってことだって私サイキックの力が使えるしタイプBの腕力もあるこれってニ人が一人になったからでしょう
4980.8433	9.2100	overt	4980.7200	5977012	そんなことはありえないよニ人が一人に合体するなんてまあこんな世の中じゃそういうことが起きても不思議じゃないけれど
4991.2533	6.7200	overt	4991.1300	5989504	僕は苦笑してからだけど少なくとも僕にはお前はエリコにしか見えないだから
4998.7233	4.3200	overt	4998.6000	5998468	リーコが死んだ時にサイキック能力が使えるようになったんだろう
5005.3533	6.2100	overt	5005.2300	6006424	それとももともと能力が抑えられていたのが解放されたのかまあなんだっていいさ
5018.8233	10.6050	overt	5018.7000	6022588	何を言ってるんだそんなことないよでもそうかもしれない本当にどうなってるのかよくわからないのだから菅原亮が言ってることが全部正しいのかもしれない
5029.4283	10.6050	overt	5029.3050	6035314	やけに素直だなお前らしくない前だったら僕が双子のどちらかを言い当てるたびに気持ち悪い気持ち悪いって怒ってたろう
5042.5233	16.3100	overt	5042.4000	6051028	からかってみても彼女は乗ってこないそんな気分じゃないのだろうかいやこんな場所でこんなふうにからかう僕の方がおかしいんだ今の僕と彼女はそんな枯口を叩くような間からじゃないはずだそれにしてもよく僕のメッセージが分かったね
5058.8333	16.3100	overt	5058.7100	6070600	分かるよでも私たち以外の人が見つけたらどうするつもりだったのあれだけの情報で他の誰が来るというんだい僕らが話しているのは今日僕がここに来る前にカストロ通りに寄って仕掛けた暗号のことだった
5075.1433	16.3100	overt	5075.0200	6090172	かつて僕らが不良少年だった頃全てのメンバーが携帯電話などの連絡手段を持っているわけではないという理由と単純に子どもがそういうものを好んだという理由でよく自分たちにしか分からない暗号を用いていた
5094.7233	3.8100	overt	5094.6000	6113668	街角の決まった場所にチョークでマークを書いて
5099.1933	4.1100	overt	5099.0700	6119032	集合場所を決めるというのもその
5104.5633	1.2900	overt	5104.4400	6125476	一つである
5118.7233	8.1300	overt	5118.6000	6142468	集まるべき場所と指示を出した人間のニつの内容を示すマークを書いてチームメンバーに集合を呼びかけるんだ
5139.4533	5.9700	overt	5139.3300	6167344	決まったタイミングに伝達することができないからあまり合理的な方法ではなかったけれど
5147.9133	7.2600	overt	5147.7900	6177496	例えば一日中空き地を使って何かをするようないいつでも来ていいような場合なら使えないこともなかった
5157.7533	6.8700	overt	5157.6300	6189304	今回僕が仕掛けた暗号は場所を待つ子の家呼びかけに言われようという内容のものだ
5173.5933	12.4200	overt	5173.4700	6208312	当時のチームメンバーなら呼びかけ人が僕であることは読み取れるがこの場所を示すマークは見たこともないだろうマツコの家を示すマークは作るだけ作ってみてからすぐに使用禁止にしたのだ
5186.0133	12.4200	overt	5185.8900	6223216	それを塩さんに迷惑がかかっても嫌だからと僕が決めただから実際には一度も使われていないこのマークを知っているのは作った時にその場にいた人間だけだ
5202.9633	8.8200	overt	5202.8400	6243556	そしてその時そこにいたのは僕と道夫とそれとチームメンバーでもなく呼んでもいないのに勝手にやってきていた
5212.6833	1.4400	overt	5212.5600	6255220	張り紙しまいだ
5214.6633	13.2600	overt	5214.5400	6257596	つまり道代がいない今僕の出した暗号を解読できるのはこの灰紙エリコしかいないことになるエリコは自分しか知らないことを忘れていたようだがマークの意味は覚えていてくれてよかった
5232.8733	6.5400	overt	5232.7500	6279448	それにしても正直来るとは思わなかったよ僕がお前をおびき寄せる罠だと思わなかったのか
5241.7233	10.4400	overt	5241.6000	6290068	菅原亮と知恵比べをするつもりはないわどうせ勝てないしそれに私たちも会いたかったからそうかそれはよかった
5252.1633	10.4400	overt	5252.0400	6302596	もっと早く来てほしかったよ眠くてたまらないすっかり目が覚めた今は本当に眠いわけではなかったけれどそう言って笑ってみせた
5266.2933	6.4200	overt	5266.1700	6319552	さて大事なのはこれからだ僕は確かに彼女の利用があって呼び寄せただがか
5273.3133	4.5900	overt	5273.1900	6327976	エリコが例のものを持っていなければ全く無意味なことをしたことになる
5283.3933	14.7300	overt	5283.2700	6340072	警察に呼ばれマツコの無残な遺体を見たその場所で僕は田辺という従業員に話を聞いた彼女はマツコによって助けられたが別れ際にマツコに手渡されたものがあった
5298.7233	4.8900	overt	5298.6000	6358468	それは田辺にとって全く意味不明でしかもギョッとするようなものだった
5309.0133	12.5100	overt	5308.8900	6370816	もしかしたら後でこれが動き出すかもしれないそしたら私に何かがあったということですその時は絶対にここには戻らないでこれをお父さんに渡してください
5331.0333	7.4700	overt	5330.9100	6397240	マツコは最後にそう言ったが田辺にや理解できなかったそれは勝手に動き出すようなものではなかったからだ
5339.1633	12.9600	overt	5339.0400	6406996	その後田辺は施設を出て近くの家に飛び込んで電話を借り警察に通報したそして一息ついてから預かったものを見ると本当にそれが動き出していた
5355.7533	17.5650	overt	5355.6300	6426904	花火は動いたら何かあったということだという言葉を思い出し他のことを忘れてしまったマツコに何かあったのなら助けなければならないとそれで頭の中がいっぱいになりその家でバットを借りて施設に舞い戻ってしまう
5373.3183	17.5650	overt	5373.1950	6447982	そして殺人現場となった応接室に足を踏み入れマツコの死体を発見したそこで呆然自室となっていると目知らぬ双子が部屋に入ってきた双子の遺体を見て涙を流し松子の友人だと言った花部はそれを信じ
5392.6833	4.9200	overt	5392.5600	6471220	彼女たちとの会話の中でマツコから預かった絵品のことを話し
5400.0033	3.1200	overt	5399.8800	6480004	それをそのまま引き渡してしまったのだという
5408.0433	11.8800	overt	5407.9200	6489652	そう僕が気にしている例のものとはつまりマツコが田辺に手渡しそして田辺がこのエリコに手渡したはずのもののことだ
5423.6733	3.3600	overt	5423.5500	6508408	ゆり子はその遺品の意味を理解できるはずない
5427.5733	7.1400	overt	5427.4500	6513088	理解できるはずだからここに持ってきているかそうでなくとも何らかの交渉の材料にしてくると思うのだが
5436.3633	5.8500	overt	5436.2400	6523636	これは生きてるの僕の背後の培養液に目をやっているエリコワソをつぶやいた
5444.3433	9.2700	overt	5444.2200	6533212	もし持っていたとして彼女はタダでは僕に渡さないだろうこの甲子園ならばその駆け引きの材料になるかもしれない
5454.5133	2.4900	overt	5454.3900	6545416	だがこれが
5458.0833	10.3650	overt	5457.9600	6549700	YSのために売り飛ばすものでもなく僕の復讐のために実験材料にするわけでもないコッシェの第サンの使い方だった
5468.4483	10.3650	overt	5468.3250	6562138	今彼女はもともとのタイプBの力の他にサイキックの力も手に入れたと言っていた
5479.6233	18.6600	overt	5479.5000	6575548	そのことは彼女が脱出した倉庫のシャッターの破損の状況でもしやとは思っていたけれど実際にそうと分かってしまっただとすれば厄介だそれほど強力な力を持った人間が素直に交渉に応じるかどうか生きているよ問題なくね薬で眠中
5498.2833	18.6600	overt	5498.1600	6597940	どう切り出そうか考えている僕の目の前で彼女はムース大さにポケットに手を突っ込むと何かを空中に放り投げたそれは落下することなく放物線の頂点あたりでピタリと止まりその後はゆっくり
5517.8433	6.8700	overt	5517.7200	6621412	空中を浮遊して僕の目の前でくるんと回ってから着陸する
5542.7733	12.3600	overt	5542.6500	6651328	彼女が掘り投げたのは小さな瓶その中に白い肉片が動いているのが見えた僕は心臓は静かめにされたような驚きとともに彼女の顔を見た
5555.1333	12.3600	overt	5555.0100	6666160	それが欲しいから私たちを呼んだんでしょうエリコは何でもなさそうに言う僕は興奮を隠しながら小瓶に手を伸ばしそして手元でそれを確認した
