onset	duration	trial_type	wav_onset	sample	value
2157.9317	4.6800	overt	2157.9900	2589518	彼はハンモックに横になりながら言ったなんて呪い人生なんだ
2163.9917	4.4100	overt	2164.0500	2596790	屋敷は世紀の初めまでは町の誇りとなる建物だった
2169.4517	2.1000	overt	2169.5100	2603342	しかし今ではすっかりいたんで
2172.9017	3.9600	overt	2172.9600	2607482	陰鬱に沈んでおり大きな空っぽの空間があったり
2178.8717	1.2300	overt	2178.9300	2614646	また外れの
2197.5917	2.2200	overt	2197.6500	2637110	大きな空っぽの空間があったり
2201.1317	3.2400	overt	2201.1900	2641358	的外れなカゴがあちこちにあったりするために
2205.6917	3.4800	overt	2205.7500	2646830	いつでも引っ越しの最中のような印象を与えた
2211.0317	6.2700	overt	2211.0900	2653238	大広間の床にはまだ市松模様の代理石が残されており
2218.3217	5.8500	overt	2218.3800	2661986	涙の雫系の装飾シャンデリアも下がっていたが
2225.7917	2.0100	overt	2225.8500	2670950	そこには今では雲の
2229.4217	1.0500	overt	2229.4800	2675306	測っていた
2231.7617	4.7400	overt	2231.8200	2678114	利用されている部屋はいずれも分厚い石壁で仕切られている上
2239.7717	1.6500	overt	2239.8300	2687726	長年にわたって
2267.5817	1.0200	overt	2267.6400	2721098	いやそれを言う
2270.1917	8.4000	overt	2270.2500	2724230	どんな天気の時でも涼しく壁の亀裂からはジューニ月の風が音を立てて吹き込んでくるのでなおさらひんやりとした
2279.5517	4.0200	overt	2279.6100	2735462	全てがだらしのない宝的と暗闇の重たい
2284.5017	2.3400	overt	2284.5600	2741402	湿り系に侵されていた
2291.2817	5.7900	overt	2291.3400	2749538	初代皇爵の頃の貴族的な蹴取りで唯一残されているものといえば
2301.3917	1.8600	overt	2301.4500	2761670	夜間の警備をする
2304.0917	3.1800	overt	2304.1500	2764910	後藤の狩猟用のマステーフ犬だけだった
2314.8317	5.1000	overt	2314.8900	2777798	シエルバーマリアのお誕生会が行われている奴隷たちの屋敷は
2321.2817	1.8600	overt	2321.3400	2785538	初代降釈の頃には
2325.5717	6.1800	overt	2325.6300	2790686	一つの街の中にもう一つ別の街があるというようなにぎわいを見せた場所だった
2335.5917	3.3900	overt	2335.6500	2802710	あと次の代になってからもベルナルダが
2341.0517	1.8600	overt	2341.1100	2809262	マーティスの
2343.8717	4.2600	overt	2343.9300	2812646	砂糖農園にじんどって泥と小麦粉の
2378.6117	5.6700	overt	2378.6700	2854334	シエルバマリアの誕生会が行われている奴隷たちの敷地は初代工作の頃には人
2385.6317	4.7100	overt	2385.6900	2862758	一つの街の中にもう一つ別の街があるというようなにぎわいを見せた場所だった
2391.5417	2.9400	overt	2391.6000	2869850	後次の代になってからもベルナルダが
2395.9517	7.4700	overt	2396.0100	2875142	マーテスの砂糖農園にじんどって奴隷と小麦粉の悪らつな貿易を抜かれなく取り仕切っていた
2403.9617	1.5600	overt	2404.0200	2884754	うちはそれが続いた
2407.4417	8.8500	overt	2407.5000	2888930	しかし今では全ての輝きが過去のものだったベルナルダは果てしなき悪臭ゆえに輝きを失い奴隷の庭も
2426.5517	2.7900	overt	2426.6100	2911862	縦小屋がニつ残るだけとなって
2430.7817	4.4700	overt	2430.8400	2916938	ニ大差の最後の名残もなくなってひさしかった
2439.0017	1.4100	overt	2439.0600	2926802	かつてはドミンガで
2441.6717	3.3600	overt	2441.7300	2930006	アドビエントという血水の黒人女が
2451.8117	1.1400	overt	2451.8700	2942174	死の前の日まで
2454.8417	1.2300	overt	2454.9000	2945810	鉄拳によって
2457.0617	2.7300	overt	2457.1200	2948474	居屋敷を取り仕切っていたもので
2461.4717	1.9800	overt	2461.5300	2953766	彼女が白人と黒人の
2465.9717	2.7300	overt	2466.0300	2959166	ニつの世界を結ぶ絆となっていた
2471.6417	4.8600	overt	2471.7000	2965970	シエルバマリアを育てたのはこのノッポで
2477.7017	4.0800	overt	2477.7600	2973242	骨張ってほとんど千輪岩的なまでに
2482.8017	1.7400	overt	2482.8600	2979362	知恵が働く女だった
2485.2917	4.7400	overt	2485.3500	2982350	彼女はヨルバ族の信仰を捨てることなくカトリック信者になって
2490.9317	1.9500	overt	2490.9900	2989118	両方の進行を
2493.9017	3.0000	overt	2493.9600	2992682	秩序も調和もなく同時に実践した
2499.6317	7.9500	overt	2499.6900	2999558	彼女が言っていたところでは一方に欠けているものをもう一方が補ってくれるので
2508.6617	5.2200	overt	2508.7200	3010394	自分の魂はこの上ない平安のうちにあるとのことだった
2516.7317	1.1700	overt	2516.7900	3020078	彼女はまた
2521.5917	2.2200	overt	2521.6500	3025910	夫人との間を
2524.8017	4.0200	overt	2524.8600	3029762	調停するだけの権威がある唯一の人間で
2530.9517	3.8400	overt	2531.0100	3037142	両者とも彼女の言うことには従ったものだった
2581.4417	5.5800	overt	2581.5000	3097730	使われていない部屋で奴隷たちがおぞけもなく暖色にふけていたり
2588.1917	5.4000	overt	2588.2500	3105830	それぞれの女を取り替えて交わっていたりするのを見つけるたびに
2594.3417	2.5200	overt	2594.4000	3113210	砲気を振り回して追い出すことが
2597.9117	1.7400	overt	2597.9700	3117494	できたのも彼女だけだった
2600.9117	4.6200	overt	2600.9700	3121094	しかし彼女が死んで以来奴隷たちは真昼の暑さを逃れて
2606.3417	5.5800	overt	2606.4000	3127610	奴隷小屋から抜け出しては屋敷内に居心のいい片隅を見つけて
2612.8217	2.9700	overt	2612.8800	3135386	ところ構わず寝転んだり窯に
2616.9917	4.5900	overt	2617.0500	3140390	焦げついた米をこそいで食べたり風と推しの良い通路で
2622.1817	4.9500	overt	2622.2400	3146618	掛け事をしたりうなりごまを鳴らしたりして遊ぶようになっていた
2628.2117	3.6900	overt	2628.2700	3153854	誰も自由でないこの抑圧された世界にあって
2632.9817	1.9800	overt	2633.0400	3159578	シエルバマリアは自由だった
2636.3117	3.3600	overt	2636.3700	3163574	ただ一人彼女だけがそしてここに置いてのみ
2640.8717	4.2600	overt	2640.9300	3169046	だから彼女の誕生会はここで開かれているのだった
2646.1517	6.3900	overt	2646.2100	3175382	彼女の本当の我が家である場所において本当の家族である人たちのもとで
2733.2417	5.5500	overt	2733.3000	3279890	これほど音楽に満ちていながらこれほど沈んだ踊りの会は他にいなかった
2739.5417	2.6700	overt	2739.6000	3287450	屋敷の奴隷たちと他の
2743.2617	5.1600	overt	2743.3200	3291914	名家の奴隷数名ができる限りのものを持ち寄って開いている会だった
2749.5017	1.4100	overt	2749.5600	3299402	そうじゃ本性の
2751.8717	4.9500	overt	2751.9300	3302246	ママに振る舞っていたアフリカに生まれたアフリカ人よりももっと優雅に
2757.9017	7.0500	overt	2757.9600	3309482	もっと元気よく彼女は踊り自分の声とは違う声で様々なアフリカの言葉
2765.4617	1.5000	overt	2765.5200	3318554	の歌を歌い
2768.1617	5.3400	overt	2768.2200	3321794	また鳥や動物の声を出しては動物たち自身を戸惑わせた
2775.3617	8.4600	overt	2775.4200	3330434	ドミンガでアドビエントの命令によりいつも一番若い女女女たちが少女の顔をすすで黒く塗って
2784.9017	1.5300	overt	2784.9600	3341882	せんで
2812.8017	1.4100	overt	2812.8600	3375362	の上から
2814.9617	5.7600	overt	2815.0200	3377954	サンテリアの術を首にかけ髪の手入れをすることになっていた
2822.1617	1.4400	overt	2822.2200	3386594	その紙は一度切って
2824.1717	1.9800	overt	2824.2300	3389006	一度も切られたことがなく
2826.9617	1.5000	overt	2827.0200	3392354	日ごとに幾重にも
2829.3017	1.2900	overt	2829.3600	3395162	甘なければ
2831.3417	2.4900	overt	2831.4000	3397610	歩く妨げになるほどの長さが
2836.4117	5.7000	overt	2836.4700	3403694	彼女は対立する力が交差するところで花開き始めていた
2843.6117	6.6600	overt	2843.6700	3412334	母親から受け継いでいるものはごくわずかだったそれに対し父親から受け継いでいる者には
2850.9317	3.1200	overt	2850.9900	3421118	貧弱な体つけと救いようのないうち
2855.9417	1.2300	overt	2856.0000	3427130	ない規制
2858.2517	1.0800	overt	2858.3100	3429902	そう白な肌
2860.4117	2.5800	overt	2860.4700	3432494	ゆうつげな青い瞳そして
2863.8017	1.8900	overt	2863.8600	3436562	赤道色そのもの
2867.1017	1.9200	overt	2867.1600	3440522	燃えるような髪があった
2870.6417	2.9400	overt	2870.7000	3444770	その振る舞いは実に慎重で秘密めいていて
2874.5117	2.5800	overt	2874.5700	3449414	まるで目につかない小動物のようだった
2879.9717	3.1200	overt	2880.0300	3455966	母親は娘のこの奇妙な
2883.8117	1.8600	overt	2883.8700	3460574	あるように不安を覚えて
2896.1717	2.3100	overt	2896.2300	3475406	この器用なありように不安を覚えて
2899.1717	4.3200	overt	2899.2300	3479006	家の闇の中でも少女がどこにいるのか
2904.3917	3.8100	overt	2904.4500	3485270	分かるように手首に鈴をくくりつけていた
