onset	duration	trial_type	wav_onset	sample	value
4295.5575	8.4900	overt	4295.5500	5154669	さくらんして集落の外に出たのではないかたや池やたまにはまったのではないかどこかで汚れを受けたのではないか
4310.1975	5.7000	overt	4310.1900	5172237	少なからの住人が強権的な肝臓さんに対して依頼信と
4317.6375	5.7000	overt	4317.6300	5181165	同時に潜在的な抵抗感を持っていたに違いないしかし結局肝臓さんが
4323.9375	3.3900	overt	4323.9300	5188725	武器を持ってどこかに隠れている可能性は無視できなかった
4331.3475	1.8000	overt	4331.3400	5197617	が出されることとなった
4334.9175	3.9000	overt	4334.9100	5201901	僕は匠さん知恵みもっちとともに捜索を行い
4343.8275	5.5800	overt	4343.8200	5212593	ノームの安水集落を何週も巡ったしかしカンゾウさんは見つからない
4352.4375	2.1300	overt	4352.4300	5222925	白心はないが僕も同感だった
4357.3575	2.3100	overt	4357.3500	5228829	それで広場に戻ってきた時のことだ
4380.6375	4.5300	overt	4380.6300	5256765	東大元暮らし勘三さんは確かにいた宴の会場であるお堂に
4386.3675	4.0500	overt	4386.3600	5263641	宴における彼の定位置その脇根や無造さに
4392.2175	4.4400	overt	4392.2100	5270661	おみきの一升瓶が空になって転がされていた
4397.8575	5.4000	overt	4397.8500	5277429	ビーンを跳ねろけて立ち上がるよろけることもなく眼光はむしろいつもより鋭く見えた
4405.6575	9.8100	overt	4405.6500	5286789	翻訳するならば彼がこれまで朝の見回りをしていたのははるちゃんのためだったということだろうだからもう彼にはこの場しか必要ないと
4439.6175	2.8200	overt	4439.6100	5327541	それは象徴的な場面だったと思う
4443.9975	7.4400	overt	4443.9900	5332797	彼は力による手動を行うことを決めた一撃で人を殺す供給を携えてもう昼
4454.1675	6.6000	overt	4454.1600	5345001	昼における彼の指導を止めることはできない僕はそう思ったのだが次に起きたことは予想できなかった
4461.7275	11.3700	overt	4461.7200	5354073	実際は勘蔵さんの言葉が終わるか終わらないかというタイミングだと思う匠さんが自分に向けられた時効人をパッと手でつかんだそれだけにとどまらず
4474.5675	8.9100	overt	4474.5600	5369481	重心をはねのけて一歩踏み込み肝臓さんの方をした高に殴りつけたのだまさか即座に反撃があるとは思わなかった
4484.7975	4.9800	overt	4484.7900	5381757	数秒間待たず銃を手放した肝臓さんの
4490.9775	3.9600	overt	4490.9700	5389173	肩骨が匠さんの顔面に付け刺さったのだ
4496.1675	6.3300	overt	4496.1600	5395401	血がバットチリ匠さんの顔が苦痛にゆがむが彼もただでやられはしなかった
4505.2575	8.8200	overt	4505.2500	5406309	左の張り手の一番硬い手首の付け根の部分が顎にクリーンヒットし肝臓さんの体が後ろに吹っ飛ぶ
4515.3375	13.3500	overt	4515.3300	5418405	背後の壁に倒れ込んで大きな音を立てた勘蔵さんはそれでもやり返す気満々で立ち上がろうとするそこに一瞬の隙があった僕は両銃をつかみ上げチームに渡してしまった
4531.0575	4.6200	overt	4531.0500	5437269	とっさなことで忘れていたが彼女が銃を撃てることは
4537.2675	3.3300	overt	4537.2600	5444721	今回まだ知らないはずだった
4544.2575	3.6600	overt	4544.2500	5453109	しかし僕の糸は匠さんに伝わった
4549.1775	7.5900	overt	4549.1700	5459013	ジエミは身を翻し落とした肝臓さんを僕と匠さんともっちが拒んだ
4564.4175	10.8900	overt	4564.4100	5477301	行って匠さんは僕をチラッと見たが僕はこの場では下手に同意できない肝臓さんなら話してもいいがモッチがいる場所ではダメだ
4576.8075	7.2000	overt	4576.8000	5492169	たとえさっきの匠さんとの会話が盗み撃をされていたとしてもまだオピラに宣言するタイミングじゃない
4610.4675	16.6950	overt	4610.4600	5532561	肝臓さんは不快そうにうなるが宇宅返しの前倒しにそれ以上反対することはなかった実のところ宇宙の開始時間は特に理由があって決められたものじゃない勘三さんが最初に決めた時間に順次ていただけそれまで自由の
4627.1625	16.6950	overt	4627.1550	5552595	彼が己の支配力に固執するあまりまともな判断ができなくなっているとしか思えないその根底にあるのは結局は不信誰も信じることができないがためにおそらくはこれまで自分が成功してきた方法を繰り返している
4643.8575	16.6950	overt	4643.8500	5572629	いいのだが読み意味の宴はやはりゲームだと捉えるべきなのだ必勝法が存在せず競技性があるという意味で歴史絵の意図を読むことができれば裏を書くこともできるとりわけ大神側にはそれが容易だ
4660.5525	16.6950	overt	4660.5450	5592663	だからこそハルちゃんがこのタイミングで狙われたのだ宇田家の進め方を根本的に考え直す必要がある今日の進め方が全てだ特にヘビでありながら生き残らないとならない僕にとっては
4788.3075	2.9700	overt	4788.3000	5745969	加護を受けた時と同じやり方で確かに
4819.4475	1.5300	overt	4819.4400	5783337	ああそうなのか
4839.0375	1.6200	overt	4839.0300	5806845	あれまた
