onset	duration	trial_type	wav_onset	sample	value
2836.2208	5.0000	covert	n/a	3403465	そしてシャワーで流してくれる部屋に戻ると彼女は冷蔵庫に
2843.3335	5.0200	listening	2843.4260	3412000	ここからビールを取り出す私たちはお互いにバスタオルを巻きつけたままの
2854.1267	5.0000	covert	n/a	3424952	私たちはお互いにバスタオルを巻きつけたままの
2862.0855	4.1240	listening	2862.1780	3434503	姿で隣り合って座り残りの時間を伸びると過ごすのだった
3148.8592	5.0000	covert	n/a	3778631	姿で隣り合って座り残りの時間をのんびりと過ごすのだった
3155.9095	5.0520	listening	3156.0020	3787091	商売女が客をつなぎ止めるためにの譲渡で
3162.9167	5.0000	covert	n/a	3795500	商売女が客をつなぎ止めるための上等区である
3169.9255	1.4040	listening	3170.0180	3803911	あるそのセリフも
3172.0695	2.9400	listening	3172.1620	3806483	彼女は嘘偽りなく本心で言ってくれる
3176.3692	5.0000	covert	n/a	3811643	あるそのセリフも彼女は嘘偽りなく本心で言ってくれる
3183.3975	1.5000	listening	3183.4900	3820077	私は苦しかった
3185.8615	2.6520	listening	3185.9540	3823034	私の感情が一方的なものであること
3190.4692	5.0000	covert	n/a	3828563	私は苦しかった。私の感情が一方的なものであることも、
3197.5735	3.3560	listening	3197.6660	3837088	もうやはり私の能力ゆえにごまかしようがなかった
3204.2825	5.0000	covert	n/a	3845139	やはり私の能力ゆえにごまかしようがなかった彼女は私
3211.5895	3.2920	listening	3211.6820	3853907	胸の痛みというものが全く感じられなかった
3219.5767	5.0000	covert	n/a	3863492	心臓の痛みや胸の痛みというものが全く感じられなかった。
3226.6295	4.3800	listening	3226.7220	3871955	いい客であるいい人でしかないのだしかし私の方はそうはいかない
3234.3342	5.0000	covert	n/a	3881201	いい客であるいい人でしかないのだしかし私の方はそうはいかない
3241.4135	4.9880	listening	3241.5060	3889696	これだけ体をむさぼすった後でもいやむしろその後だからこそ彼女が
3247.8617	5.0000	covert	n/a	3897434	これだけ体をむさぼった後でもいやむしろその後だからこそ彼女が
3254.9815	1.5000	listening	3255.0740	3905978	愛おしく感じられた
3257.0615	2.9400	listening	3257.1540	3908474	そして恋するもの特有の感性によって
3261.4942	5.0000	covert	n/a	3913793	愛おしく感じられたそして恋するもの特有の感性によって
3268.6455	3.5800	listening	3268.7380	3922375	彼女の顔も表情もしゃべり方もしぐさもその全てが
3275.5667	5.0000	covert	n/a	3930680	彼女の顔も表情も喋り方も仕草もその全てがキラキラと眩しくなっています
3282.6295	5.0840	listening	3282.7220	3939155	欲しいほどに輝きを放って美しく見えた
3289.4158	5.0000	covert	n/a	3947299	欲しいほどに輝きを放って美しく見えたこうして何よりも大事な
3296.4215	2.7480	listening	3296.5140	3955706	彼女とニ人で過ごす時間は幸福で
3299.7815	1.7240	listening	3299.8740	3959738	そして同時に苦しかった
3303.2317	5.0000	covert	n/a	3963878	彼女と二人で過ごす時間は幸福でそして同時に苦しかった
3310.6935	1.7880	listening	3310.7860	3972832	もし私が本気なら
3313.0615	2.3000	listening	3313.1540	3975674	彼女を自分のものにすることは可能性
3317.3342	5.0000	covert	n/a	3980801	もし私が本気なら彼女を自分のものにすることは可能かもしれません
3324.4215	4.9880	listening	3324.5140	3989306	私は出世の望みこそないとはいえそれでも同世代の
3330.9208	5.0000	covert	n/a	3997105	私は出世の望みこそないとはいえそれでも同世代の
3338.5655	2.6520	listening	3338.6580	4006279	平均的な収入は上回っている
3343.8208	5.0000	covert	n/a	4012585	平均的な収入は上回っている
3353.5735	2.3320	listening	3353.6660	4024288	彼女にこの世界から足を表せること
3357.8733	5.0000	covert	n/a	4029448	彼女にこの世界から足を現せることが
3364.9655	2.2680	listening	3365.0580	4037959	ことはできなくなかったのかもしれない
3371.4325	5.0000	covert	n/a	4045719	できなかったのかもしれない
3378.7895	2.8120	listening	3378.8820	4054547	それを何度か口に仕掛けたこともあるが
3384.9258	5.0000	covert	n/a	4061911	それを何度か口にしかけたこともあるが
3392.0055	5.0200	listening	3392.0980	4070407	彼女が断っても受け入れても今の関係が壊れてしまいそうな気がした
3398.6625	5.0000	covert	n/a	4078395	彼女が断っても受け入れても今の関係が壊れてしまいそうな気がした
3407.6535	3.1320	listening	3407.7460	4089184	ジュー歳金で体を買っているのだからやっているよ
3412.5692	5.0000	covert	n/a	4095083	10歳、金で体を買っているのだからやっているよ
3419.6855	1.3080	listening	3419.7780	4103623	私の関係は
3421.8295	2.8120	listening	3421.9220	4106195	なくなくとも私は対等の立場だと思っていた
3430.5225	5.0000	covert	n/a	4116627	私の関係は少なくとも私は対等の立場だと思っていた
3437.6055	3.9000	listening	3437.6980	4125127	それを仕事以外の時間まで金で奪おうというのは
3445.2483	5.0000	covert	n/a	4134298	それを仕事以外の時間まで金で奪おうというのは暴力
3452.2935	5.0520	listening	3452.3860	4142752	その人格を充電するのと何ら変わりがあるように
3460.2050	5.0000	covert	n/a	4152246	その人格を充電するのと何ら変わりがあるように
3467.2055	3.4840	listening	3467.2980	4160647	今の対等さを損ねてしまうように思えた
3473.8867	5.0000	covert	n/a	4168664	今の対等さを損ねてしまうように思えた
3482.2455	3.7400	listening	3482.3380	4178695	実際のところは私が十分な金を渡したりすれば彼女も喜ぶ
3487.8575	5.0000	covert	n/a	4185429	実際のところは私が十分な金を渡したりすれば彼女も喜んでくれる
3495.0135	4.9560	listening	3495.1060	4194016	金を渡すという行為は人格の縦輪でも何でもなく他社に
3503.3335	3.5160	listening	3503.4260	4204000	誠意を示したり評価する形にする確実な
3509.0600	5.0000	covert	n/a	4210872	正義を示したり評価する形にする確実な法律を
3517.7655	3.4200	listening	3517.8580	4221319	間違いでも何でもないのだが若い私はそう思えなかった
3523.5400	5.0000	covert	n/a	4228248	間違いでもなんでもないのだが若い私はそう思いなかった
3531.2375	3.1640	listening	3531.3300	4237485	全てのことを自分だったらと置き換えて考えていたのだ
3537.5658	5.0000	covert	n/a	4245079	例えば私が
3544.6135	4.9880	listening	3544.7060	4253536	私ならどこかの大病院で患者を見て金をもらうのは誇りであったが
3551.3133	5.0000	covert	n/a	4261576	私ならどこかのダイビー病院で患者を診て金をもらうのは誇りであったが
3560.3895	3.0360	listening	3560.4820	4272467	どこかの金持ちの専属の医者になって
3565.2267	5.0000	covert	n/a	4278272	どこかの金持ちの専属の医者になって
3572.2615	4.7320	listening	3572.3540	4286714	奴隷のように過ごすのはいくら大金を済まれてもとても許容できない
3578.9975	5.0000	covert	n/a	4294797	奴隷のように過ごすのはいくら大金を積まれてもとても許容できない
3587.4295	3.6760	listening	3587.5220	4304915	若者特有の潔癖症で金銭を汚れたものだ
3593.0308	5.0000	covert	n/a	4311637	若者特有の潔癖症で、腱線は汚れたものだと
3600.1335	1.8520	listening	3600.2260	4320160	と捉える価値観が強かった
3606.9792	5.0000	covert	n/a	4328375	とらえる価値観が強かった
3614.2135	3.3240	listening	3614.3060	4337056	地震に対しても神聖なイメージを抱いていたと思う
3623.4383	5.0000	covert	n/a	4348126	宮尾自身に対しても神聖なイメージを抱いていたと思う誰にでも分かる
3630.5335	5.0200	listening	3630.6260	4356640	隔てなく体を与えるその職業は私に献身的な働き
3637.5792	5.0000	covert	n/a	4365095	隔てなく体を与えるその職業は私に献身的な博士になりました
3644.6135	2.2360	listening	3644.7060	4373536	具合に似たものを感じさせたのだ
3647.3655	2.2040	listening	3647.4580	4376839	一方彼女はどう考えていたのか
3651.0733	5.0000	covert	n/a	4381288	一方彼女はどう考えていたのか
3658.5015	3.6760	listening	3658.5940	4390202	戦術したように私に対する感情は好意ではあったが
3664.7442	5.0000	covert	n/a	4397693	前述したように私に対する感情は好意ではあったが
3671.7815	2.7800	listening	3671.8740	4406138	しかした他の企画と比べて
3675.0775	1.7560	listening	3675.1700	4410093	私が特別であったのか
3678.6550	5.0000	covert	n/a	4414386	しかしたら他の企画と比べて私が特別であったのか
3685.7975	1.3720	listening	3685.8900	4422957	することはできなかった
3688.8055	1.9800	listening	3688.8980	4426567	彼女お連客にも私にして
3693.8200	5.0000	covert	n/a	4432584	することはできなかった 彼の常連客にも私にしている
3700.8695	5.0840	listening	3700.9620	4441043	私にするような接客を行っていたのかもしれないと
3708.0308	5.0000	covert	n/a	4449637	私にするような接客を行っていたのかもしれないと
3715.8455	3.5800	listening	3715.9380	4459015	想像すると息苦しくなったいやもっと冷静に
3721.2167	5.0000	covert	n/a	4465460	想像すると息苦しくなったいやもっと冷静に
3728.5815	3.5160	listening	3728.6740	4474298	観察ができていれば判別はできついたのかもしれない
3735.1317	5.0000	covert	n/a	4482158	観察ができていれば判別はできついたのかもしれない。しかし夢中。
3742.2455	3.5480	listening	3742.3380	4490695	なってしまった人間というものは判断力を奪われて
3749.2133	5.0000	covert	n/a	4499056	になってしまった人間というものは判断力を奪われて驚くほど
3757.9895	3.4200	listening	3758.0820	4509587	ほんのわずかな疑念を重大なことのように感じている
3764.0092	5.0000	covert	n/a	4516811	本の僅かな疑念を重大なことのように感じているつもりです
3772.5495	3.6440	listening	3772.6420	4527059	何のこともない小さな希望を見ただけで全て
3779.4783	5.0000	covert	n/a	4535374	何のこともない小さな希望を見ただけで全てが
3786.5655	1.9480	listening	3786.6580	4543879	うまくいくと思い込んだりする
3789.1575	2.4920	listening	3789.2500	4546989	私が人の感情を正確に盗めるという
3793.4517	5.0000	covert	n/a	4552142	私がうまくいくと思い込んだりする私が人の感情を正確に盗めると
3800.6135	1.1480	listening	3800.7060	4560736	私のノール
3802.5655	3.0680	listening	3802.6580	4563079	結局私は能力のない人間と同じように
3807.0342	5.0000	covert	n/a	4568441	結局私は能力のない人間と同じように
3814.1815	3.1960	listening	3814.2740	4577018	単純に全てを明白にしてしまう勇気もなかった
3818.0855	1.1480	listening	3818.1780	4581703	ため結局
3820.9808	5.0000	covert	n/a	4585177	単純に全てを明白にしてしまう 勇気もなかったため
3828.2295	1.2120	listening	3828.3220	4593875	質問はできなかった
3830.3415	2.7480	listening	3830.4340	4596410	もし彼女が私に対して本気になったなら
3834.8933	5.0000	covert	n/a	4601872	もし彼女が私に対して本気になったならば
3843.1095	2.4280	listening	3843.2020	4611731	という空想は眠れぬ夜の
