onset	duration	trial_type	wav_onset	sample	value
2893.7258	3.4200	listening	2893.7300	3472471	存在が目に見えるとかそういうものではないように思えた
2901.9283	5.0000	covert	n/a	3482314	存在が目に見えるとかそういうものではないように思えた彼女は
2909.0218	5.0520	listening	2909.0260	3490826	普通に感覚として神と呼ぶ何かを感じ取っているのに他人がそれを見た
2916.4283	5.0000	covert	n/a	3499714	普通に感覚として神と呼ぶ何かを感じ取っているのに他人がそれを見据えて
2923.5818	1.9160	listening	2923.5860	3508298	過ごしていることに混乱している
2930.0458	5.0000	covert	n/a	3516055	過ごしていることに混乱している
2939.4538	2.7480	listening	2939.4580	3527345	感覚を言葉で説明するのは骨が折れるし
2944.0325	5.0000	covert	n/a	3532839	感覚を言葉で説明するのは骨が折れるし
2951.1338	5.0200	listening	2951.1380	3541361	そのために感覚を飛び澄ませば恐怖と正面から向き合うこと
2970.0225	5.0000	covert	n/a	3564027	そのために感覚を飛び澄ませば恐怖と正面から向き合うことが
2979.6138	2.5560	listening	2979.6180	3575537	僕のそばからチエミの感覚に近づく
2983.7408	5.0000	covert	n/a	3580489	僕の側から知恵美の感覚に近づく。
2990.8458	5.0520	listening	2990.8500	3589015	彼女が見つけ出せないでいる適切な神様
2997.6183	5.0000	covert	n/a	3597142	彼女が見つけ出せないでいる適切な神様
3004.7018	2.6200	listening	3004.7060	3605642	今の代替語を探す必要があった
3008.6698	1.0200	listening	3008.6740	3610404	そんなつを実務
3011.3578	2.6520	listening	3011.3620	3613629	今の代替語を探す必要があった
3015.3578	1.1160	listening	3015.3620	3618429	そんなつつも
3032.5098	2.5880	listening	3032.5140	3639012	今の代替語を探す必要があった
3036.4458	1.0200	listening	3036.4500	3643735	そんなついつも
3041.2742	5.0000	covert	n/a	3649529	大体語を探す必要があった。
3048.3178	5.1160	listening	3048.3220	3657981	合わせが発言した直後の数秒の沈黙の間に脳内で行な
3060.9225	5.0000	covert	n/a	3673107	この合わせが発現した直後の数秒の沈黙の間に脳内で行われます。
3070.2058	1.6280	listening	3070.2100	3684247	なぜ彼女は黙った
3079.8692	5.0000	covert	n/a	3695843	なぜ彼女は黙った?
3089.6938	2.3320	listening	3089.6980	3707633	なぜ顔を上げて開けきった目
3280.6378	2.4280	listening	3280.6420	3936765	なぜ顔を上げて開けきった目
3284.7892	5.0000	covert	n/a	3941747	なぜ顔を上げて開ききった目
3292.8938	3.7400	listening	3292.8980	3951473	すぼまりきった瞳をこちらに向け一切の苦悩
3302.3125	5.0000	covert	n/a	3962775	すぼまりきった瞳をこちらに向け一切の苦悩を
3310.4298	1.2760	listening	3310.4340	3972516	しばし
3317.7800	5.0000	covert	n/a	3981336	をしばし止めた
3326.9418	2.9720	listening	3326.9460	3992330	もしや僕の言葉が正確を得ていたそう
3332.2067	5.0000	covert	n/a	3998648	もしや僕の言葉が正確を得ていた
3339.3578	2.3640	listening	3339.3620	4007229	遅速した瞬間僕は気づいていた
3342.3658	1.6600	listening	3342.3700	4010839	背後からの湿った冷気
3345.7275	5.0000	covert	n/a	4014873	迫速した瞬間僕は気づいていた背後からの湿った冷気
3354.8138	3.0680	listening	3354.8180	4025777	僕の肩腰に釘付けになった
3398.9558	5.0000	covert	n/a	4078747	僕の肩越しにくぎづけになった
3406.0458	3.5800	listening	3406.0500	4087255	彼女の視線それを追って振り向くべきだと
3485.0300	5.0000	covert	n/a	4182036	彼女の視線それを追って振り向くべきだと
3492.0938	4.8920	listening	3492.0980	4190513	玄関は開け放たれたのか僕は鍵をかけなかったのか
3500.6775	5.0000	covert	n/a	4200813	玄関は開け放たれたのか僕は影をかけなかったのか
3510.7818	2.0760	listening	3510.7860	4212938	それはいつからそこにいたのか
3514.8583	5.0000	covert	n/a	4217830	それはいつからそこにいたのか
3524.7658	2.1720	listening	3524.7700	4229719	月の向こう側に立つ存在
3528.5700	5.0000	covert	n/a	4234284	式の向こう側に立つ存在
3542.5608	5.0000	covert	n/a	4251073	人物人なのか
3550.0778	4.6680	listening	3550.0820	4260093	薄暗い中に浮かび上がったシルエットは手足と当たり
3557.6692	5.0000	covert	n/a	4269203	薄暗い中に浮かび上がったシルエットは手足と頭です。
3564.7338	2.5880	listening	3564.7380	4277681	様を備えた人影ではあったが
3572.5100	5.0000	covert	n/a	4287012	頭を備えた人影ではあったが
3579.7738	4.7000	listening	3579.7780	4295729	その風景は言おうと呼ぶしかなかった全身包帯
3586.4475	5.0000	covert	n/a	4303737	その風邸はイオウと呼ぶしかなかった全身包帯
3594.7498	2.1400	listening	3594.7540	4313700	今日分かなりかか
3783.2618	2.1080	listening	3783.2660	4539914	キオーブンかなりかか
3789.9117	5.0000	covert	n/a	4547894	いや、旧欧文か何かか。文字の書かれた文字。
3796.9898	8.8280	listening	3796.9940	4556388	布で織った小柄な少年少女人間なのか再度も色に疑問を抱くが僕はそれ以上の行動に出ることができない
3807.9978	5.0200	listening	3808.0020	4569597	動かせば何が起きるか分からないその緊張感の中で僕はその
3815.0758	5.0000	covert	n/a	4578091	動かせば何が起きるかわからないその緊張感の中で僕はその
3822.2378	2.0440	listening	3822.2420	4586685	存在の唇が動くのを見た
3828.6008	5.0000	covert	n/a	4594321	存在の唇が動くのを見た
3835.6778	5.0520	listening	3835.6820	4602813	断という音がして正面に向き直るとチエミが倒れている
3842.3450	5.0000	covert	n/a	4610814	音がして正面に向き直ると知恵美が倒れていきます
3856.8558	5.0000	covert	n/a	4628227	泡をくっ
3863.9018	5.0520	listening	3863.9060	4636682	近寄り抱き起こす一時的な失神のようで気を失った
3946.2378	5.0200	listening	3946.2420	4735485	近寄り抱き起こす一時的な失神のようで気を失った
3953.0967	5.0000	covert	n/a	4743716	近寄り抱き起こす一時的な失神のようで気を失った
3960.1898	2.3000	listening	3960.1940	4752228	わけではなく盛ろうとしているような
3966.5425	5.0000	covert	n/a	4759851	わけではなく、もうろうとしているような
3977.2138	1.5000	listening	3977.2180	4772657	なんだような目をして立ち
3980.4342	5.0000	covert	n/a	4776521	死んだような目をして
3987.5498	4.2200	listening	3987.5540	4785060	立ち上がる知恵 向かう玄関閉じた無人のドア
3994.1142	5.0000	covert	n/a	4792937	立ち上がる千恵美 向かう玄関 閉じた無人のドア
4002.0778	3.8360	listening	4002.0820	4802493	今は捨ておけ今大事なのはCMだ
4011.2525	5.0000	covert	n/a	4813503	今は捨て置け今大事なのは知恵美だ
4021.4378	1.9800	listening	4021.4420	4825725	このまま返してはダメだと思った
4027.3050	5.0000	covert	n/a	4832766	このまま返してはダメだと思った
4036.7658	1.7560	listening	4036.7700	4844119	チェミを抱きしめていった
