onset	duration	trial_type	wav_onset	sample	value
13.9818	1.3720	listening	13.9860	16778	手にしている扉から
18.0308	5.0000	covert	n/a	21637	手にしている扉から
25.5978	3.1320	listening	25.6020	30717	くぐもった叫びやオイツが時より漏れ出てくる
32.4067	5.0000	covert	n/a	38888	クグモッタサケビヤオイツガトキヨリモレデテクル
42.0778	2.4280	listening	42.0820	50493	踏んじばられて転がされてる
142.8983	5.0000	covert	n/a	171478	うんじばられて転がされている
149.9178	3.6120	listening	149.9220	179901	オリビカオリがサルグツアのままわめき散らしているのだ
156.8725	5.0000	covert	n/a	188247	オリヴェ香りがサルグツアのまま喚き散らしているのだ。
164.0618	4.6040	listening	164.0660	196874	扉にはつっかい棒がなされているが
170.8025	5.0000	covert	n/a	204963	動きは取れないはずだし、扉にはつっかえ棒がなされているが、
178.5258	3.0360	listening	178.5300	214231	それでも心配で数分起きに中を覗く
184.1058	5.0000	covert	n/a	220927	それでも心配で数分おきに中を覗く
191.5498	4.6360	listening	191.5540	229860	その度に変わらない光景を見て安心しつつも事情
197.8467	5.0000	covert	n/a	237416	その度に変わらない光景を見て安心しつつも、
205.4378	3.3560	listening	205.4420	246525	敵な気分になるのは避けられない
211.9117	5.0000	covert	n/a	254294	的な気分になるのは避けられない
218.9418	2.4280	listening	218.9460	262730	宴が始まってもう結構経つ
222.3018	1.7560	listening	222.3060	266762	彼らはどのような決定
227.0358	5.0000	covert	n/a	272443	宴が始まってもう結構経つ彼らはどのような決定を
234.2058	4.9240	listening	234.2100	281047	彼らがくくる泣きにするなどと叫ぶ呼ぶ
318.1738	5.0200	listening	318.1780	381809	彼らがくくる泣きにするなどと叫ぶ呼ぶ
324.8883	5.0000	covert	n/a	389866	彼らがくくる泣きにするなどと叫ぶ
332.6378	4.3800	listening	332.6420	399165	狼への死刑はこれまでなし崩し的に回避されてきたといいます
339.8875	5.0000	covert	n/a	407865	狼への死刑はこれまでなしくずし的に回避されてきたといえ、
350.3658	1.6600	listening	350.3700	420439	今日それに失敗すれば
354.0692	5.0000	covert	n/a	424883	今日それに失敗すれば
361.0858	5.1160	listening	361.0900	433303	残日数と人数から考えて人の生存の希望はほぼたたる
368.4383	5.0000	covert	n/a	442126	残日数と人数から考えて人の生存の希望はほぼ絶たれず
375.4218	1.0840	listening	375.4260	450506	と思われる
377.3418	3.1960	listening	377.3460	452810	よもやここでオリーブ香織や祭りか
382.6383	5.0000	covert	n/a	459166	思われるよもやここでオリヴェカオリア祭り
389.7258	2.0120	listening	389.7300	467671	が選ばれるようなことがあれば
397.9250	5.0000	covert	n/a	477510	選ばれるようなことがあれば
407.1338	1.4680	listening	407.1380	488561	食いがたいとしか言えない
411.4075	5.0000	covert	n/a	493689	食い難いとしか言えない
421.9498	1.5960	listening	421.9540	506340	どうから出て
425.9025	5.0000	covert	n/a	511083	音から出てきます。
433.0218	2.9720	listening	433.0260	519626	来たジュー人たちを一目見て思わず声が漏れた
440.1667	5.0000	covert	n/a	528200	来た住人たちを一目見て思わず声が漏れた。
447.6458	4.6360	listening	447.6500	537175	彼らの目は一様に座っていた彼らはこちらに近づいてきた
454.3467	5.0000	covert	n/a	545216	彼らの目は一様に座っていた彼らはこちらに近づいてきた
461.4378	3.3880	listening	461.4420	553725	僕の方へじゃない食堂の方へ
483.6633	5.0000	covert	n/a	580396	僕の方へじゃない食堂の方へ
490.6858	4.8280	listening	490.6900	588823	それでも口にしたこの場に起きる最後の正規の代表として
505.1417	5.0000	covert	n/a	606170	この場における最後の正気の代表として
513.9818	3.2600	listening	513.9860	616778	先頭を歩くの佐藤清之助に相談
525.7958	5.0000	covert	n/a	630955	先頭を歩く野里清之助に相談を行います。
534.5578	2.0440	listening	534.5620	641469	会話は成立しなかった
541.0750	5.0000	covert	n/a	649290	会話は成立しなかった。
548.0938	1.0840	listening	548.0980	657713	皆さんの彼とは
550.1738	2.4600	listening	550.1780	660209	コア色も目の色も違っていた
582.3242	5.0000	covert	n/a	698789	彼とは、頬色も目の色も違っていた清水さん。
589.3738	1.2760	listening	589.3780	707249	危険な決意のみ
595.8692	5.0000	covert	n/a	715043	危険な決意のみ
603.9018	4.0280	listening	603.9060	724682	最高尾を歩いていた名子がまあ弱しげな顔のまま
610.0858	5.0000	covert	n/a	732103	最高尾を歩いていためいこが、まあ弱しげな顔のまま
617.2458	2.3640	listening	617.2500	740695	この元へ来た僕は道を譲る
620.5738	1.2120	listening	620.5780	744689	彼らは皆で
624.0617	5.0000	covert	n/a	748874	彼らは皆で
631.6458	3.5160	listening	631.6500	757975	食堂に踏み込んでいくそして犠牲者を引きずり出す
641.4992	5.0000	covert	n/a	769799	食堂に踏み込んでいくそして犠牲者を引きずり出す
649.1178	4.4760	listening	649.1220	778941	縄をつかんで引きずる手は野里清之助と芹沢千恵美
655.4208	5.0000	covert	n/a	786505	縄を掴んで引きずる手は野里清之助と芹澤千恵美
662.6858	4.8280	listening	662.6900	795223	追いすがって犠牲者をたけぼうきで畑ようにする山脇隊
669.4167	5.0000	covert	n/a	803300	追いすがって犠牲者を竹棒機で叩くようにする山脇隊
676.7978	4.7640	listening	676.8020	812157	不明を漏らす母をオリベ安永はマキシマ春の手を引いて追う
699.5775	5.0000	covert	n/a	839493	不明を漏らす母をオリベ・ヤスナガはマキシマ・ハルの手を引いて追う。
707.9338	3.6760	listening	707.9380	849521	亡くしマハルは号泣しているその手を引くオリメヤソナ
714.2017	5.0000	covert	n/a	857042	泣きしマハルは号泣しているその手を引くオリビアスナ
721.2138	5.0840	listening	721.2180	865457	我がも肩を震わせてお越を隠そうともせず顔面すべてをゆがめて泣いている
728.6625	5.0000	covert	n/a	874395	おやすみなさい
736.8938	3.9000	listening	736.8980	884273	遠ざから一段サルブツアーが外れたのだろう犠牲
745.0108	5.0000	covert	n/a	894013	遠ざかる一段猿靴が外れたのだろう犠牲
752.3498	2.5560	listening	752.3540	902820	車のうめき声が急に鮮明になる
758.6708	5.0000	covert	n/a	910405	死者のうめき声が急に鮮明になる
766.3978	4.3160	listening	766.4020	919677	そこにはおよそ理性は存在せずあるとすれば純然
772.7025	5.0000	covert	n/a	927243	そこにはおよそ理性は存在せずあるとすれば純然です。
779.8698	1.0200	listening	779.8740	935844	タル恐怖か
782.5258	2.3320	listening	782.5300	939031	あるいはよくあだりかたのか
786.9017	5.0000	covert	n/a	944282	あるいは誰か頼むから
793.9178	1.8840	listening	793.9220	952701	助けてくれと言ってくれ
797.6298	1.4360	listening	797.6340	957156	悔いを求める声は
801.5275	5.0000	covert	n/a	961833	救いを求める声は
808.5738	4.0280	listening	808.5780	970289	しかし最後まで唱えられることはなく僕は思い知るのだ
828.8675	5.0000	covert	n/a	994641	しかし最後まで唱えられることはなく僕は思い知るのだ
835.9658	4.9880	listening	835.9700	1003159	僕は宴に参加していないのだと異界の起きてが支配する命の鮮明
860.2667	5.0000	covert	n/a	1032320	僕は宴に参加していないのだと異界の掟が支配する命の宣伝
867.3578	2.3960	listening	867.3620	1040829	別の現場に僕は今いないのだと
875.0617	5.0000	covert	n/a	1050074	特別の現場に僕は今いないのだと
882.0778	2.6840	listening	882.0820	1058493	こう振り向かせて抱きしめ耳を塞いだ
885.5978	1.5640	listening	885.6020	1062717	子どもの耳を下げたみに
888.9258	5.0000	covert	n/a	1066711	子供の耳を塞ぐために
895.9978	2.4600	listening	896.0020	1075197	手を使えば自分の耳は捨てない
899.5818	1.4360	listening	899.5860	1079498	おやじめた謙信
903.8600	5.0000	covert	n/a	1084632	手を使えば自分の耳は防げない親じめた献身
913.1498	2.7480	listening	913.1540	1095780	細かく一段が霧の向こうへ遠ざかっていく
918.9275	5.0000	covert	n/a	1102713	妙なアイデア。細かく一段が霧の向こうへ遠ざかっていくにもかかわらず、
927.4218	2.8760	listening	927.4260	1112906	悲鳴あるいは交渉が鮮明になっていく
933.8992	5.0000	covert	n/a	1120679	につれ悲鳴あるいは交渉が鮮明 になっていく
942.5578	3.4200	listening	942.5620	1131069	その錯覚を僕は最後まで味わい続ける羽目になる
955.4292	5.0000	covert	n/a	1146515	その錯覚を僕は最後まで味わい続ける羽目になる
963.2618	3.0360	listening	963.2660	1155914	最後の時母は息子の名前を叫んでいた
973.3650	5.0000	covert	n/a	1168038	最後の時、母は息子の名前を叫んでいた。
980.4458	4.6040	listening	980.4500	1176535	長男の名前であり呼ばれた本人も母のことを繰り返し
991.7067	5.0000	covert	n/a	1190048	これは長男の名前であり呼ばれた本人も母のことを繰り返し
999.3258	1.3400	listening	999.3300	1199191	呼び叫んでいた
1001.5018	2.3000	listening	1001.5060	1201802	最後一瞬犠牲者は別の人間
1013.1233	5.0000	covert	n/a	1215748	呼び叫んでいた最後一瞬犠牲者は別の人間だった
1020.1258	2.4600	listening	1020.1300	1224151	名前を呼んだような気がしたが
1023.5498	1.6600	listening	1023.5540	1228260	何か音がしてその後
1026.2698	2.0760	listening	1026.2740	1231524	お叫び声は一切消えた
1028.9898	2.3640	listening	1028.9940	1234788	抱きしめている子どもの体温は高い
1034.0667	5.0000	covert	n/a	1240880	叫び声は一切消えた抱きしめている子供の体温は高い
1041.1498	2.4600	listening	1041.1540	1249380	返事の代わりに迷子はわずかにうなずく
1048.2500	5.0000	covert	n/a	1257900	返事の代わりに冥子はわずかにうなずく
1055.9658	1.2440	listening	1055.9700	1267159	たたびのうなどき
1057.8538	1.5960	listening	1057.8580	1269425	名子は泣き出した
1063.9608	5.0000	covert	n/a	1276753	再びのうなずき、めいこは泣き出した。
1072.0298	3.9640	listening	1072.0340	1286436	僕は彼女を解放するとその手を引いているようまで戻った
1077.6267	5.0000	covert	n/a	1293152	僕は彼女を解放すると、その手を引いて寮まで戻った。
1084.7338	3.3240	listening	1084.7380	1301681	そして丸々残っていた固形食料を拾い上げた
1092.6950	5.0000	covert	n/a	1311234	そして丸々残っていた固形食料を拾い上げた。
1100.0618	1.6600	listening	1100.0660	1320074	その後また彼女の
1102.3978	1.6600	listening	1102.4020	1322877	ロックを撮って返す
1106.8817	5.0000	covert	n/a	1328258	その後また彼女の6強へ取って返す
1117.4698	1.5320	listening	1117.4740	1340964	なきゃめきながらもメイク
1122.1067	5.0000	covert	n/a	1346528	泣き喚きながらもめいこ
1132.1578	2.0760	listening	1132.1620	1358589	果たして頭をなでドアを押します
1137.2825	5.0000	covert	n/a	1364739	頭をなでドアを閉め
1144.7978	1.1800	listening	1144.8020	1373757	振り向くと彼らが
1147.4538	1.9160	listening	1147.4580	1376945	正規も感情も書いた
1151.7542	5.0000	covert	n/a	1382105	振り向くと彼らが正気も感情も欠いた
1161.2458	2.6520	listening	1161.2500	1393495	宴の中にいない僕は
1166.2867	5.0000	covert	n/a	1399544	冷たい声宴の中にいない僕は
1173.3738	2.0440	listening	1173.3780	1408049	何も用語もすることができない
1176.5418	1.8520	listening	1176.5460	1411850	僕の返事を聞いたか
1180.5733	5.0000	covert	n/a	1416688	何も用語もすることができない僕の返事を聞いたか
1189.1498	3.5160	listening	1189.1540	1426980	入る方向が一緒であるサン名と肩を並べて歩く
1195.4617	5.0000	covert	n/a	1434554	帰る方向が一緒である3名と肩を並べて歩く形。
1202.7498	4.8280	listening	1202.7540	1443300	僕は黙って彼らの背中を狙み続けた自分の無力者を
1219.9475	5.0000	covert	n/a	1463937	僕は黙って彼らの背中を睨み続けた自分の無力さを
1227.1338	1.0200	listening	1227.1380	1472561	痛感しながら
1230.3658	1.6920	listening	1230.3700	1476439	とりあえず明日死ぬものと
1233.9892	5.0000	covert	n/a	1480787	痛感しながらとりあえず明日死ぬものと
1243.6138	2.5240	listening	1243.6180	1492337	その上で住人たちがそろって
1247.9400	5.0000	covert	n/a	1497528	その上で住人たちが揃ってきました。
1255.1018	4.9560	listening	1255.1060	1506122	近畿とみる霧の中のサラナが下りの血行を
1262.0575	5.0000	covert	n/a	1514469	近畿と見る霧の中の更長下りの結構を
1276.3083	5.0000	covert	n/a	1531570	検討する
1283.3578	2.6840	listening	1283.3620	1540029	あるいは化け物に食い殺されるか
1287.4218	1.0520	listening	1287.4260	1544906	なぜか僕には
1290.4367	5.0000	covert	n/a	1548524	あるいは化け物に食い殺されるかなぜか僕には
1297.5978	3.8360	listening	1297.6020	1557117	その記憶があるのでその可能性だけ角度が高くなるが
1314.4300	5.0000	covert	n/a	1577316	その記憶があるのでその可能性だけ角度が高くなるが
1321.5658	4.2200	listening	1321.5700	1585879	死んだ記憶は持ち得ない道は怖いものだが
1328.8842	5.0000	covert	n/a	1594661	通信だけよくは持ち得ない道は怖いものだが
1335.9978	4.8280	listening	1336.0020	1603197	道に向かっていくことは恐怖の克服に他ならないので
1342.8200	5.0000	covert	n/a	1611384	道に向かっていくことは恐怖の克服に他ならないので
1350.6858	2.4600	listening	1350.6900	1620823	死ぬこと自体は前向きに捉えられた
1356.8317	5.0000	covert	n/a	1628198	死ぬこと自体は前向きに捉えられたしかし
1363.8698	3.9960	listening	1363.8740	1636644	ああ死ぬことが確実ならあれはごめんこうむりたいな
1371.0708	5.0000	covert	n/a	1645285	死ぬことが確実ならあれはごめんこうむりたいな
1378.4938	4.0600	listening	1378.4980	1654193	あれはひどく痛いし痛がっている間はやはり生物としての
1385.3733	5.0000	covert	n/a	1662448	あれはひどく痛いし、痛がっている間はやはり生物としての
1393.0218	2.7800	listening	1393.0260	1671626	恐怖を感じないではいられないから
1399.3767	5.0000	covert	n/a	1679252	恐怖を感じないではいられないから
1409.3738	2.1080	listening	1409.3780	1691249	例えば年葉も行かない子ども
1413.8650	5.0000	covert	n/a	1696638	例えば年半もいかない子どもを
1420.8938	1.6600	listening	1420.8980	1705073	どうだけを助けるとかな
1423.6778	2.3640	listening	1423.6820	1708413	さて自分の命はベッドした後
1428.3818	1.6600	listening	1428.3860	1714058	だけを助けるとかな
1431.1338	2.3960	listening	1431.1380	1717361	さて自分の命はベッドした後
1435.3542	5.0000	covert	n/a	1722425	このだけは助けるとかなさて自分の命は別途した
1442.5258	1.4360	listening	1442.5300	1731031	賛同車をどうするか
1449.3642	5.0000	covert	n/a	1739237	参道者をどうするか名目視
1456.4458	2.7480	listening	1456.4500	1747735	深呼吸した後渇目
1463.4767	5.0000	covert	n/a	1756172	深呼吸した後、鎮静止め。
1470.5898	2.5880	listening	1470.5940	1764708	僕は壁に向かってヤクザキックをかました
1477.5917	5.0000	covert	n/a	1773110	僕は壁に向かってヤクザキックをかました。さらに、
1484.6378	1.6600	listening	1484.6420	1781565	なしでローキックを見舞う
1643.7600	5.0000	covert	n/a	1972512	な足でローキックを見舞う
1652.5418	3.3880	listening	1652.5460	1983050	ブッシャリロックに合わせて壁に血アタックを
1659.4233	5.0000	covert	n/a	1991308	ブッシャルロックに合わせて壁にケツアタックを
1666.7818	1.1160	listening	1666.7860	2000138	先発していると
1668.9258	2.6200	listening	1668.9300	2002711	霊出からドタドタドタドタ
1673.6792	5.0000	covert	n/a	2008415	連発していると連出からドタドタドタ
1680.9578	1.7880	listening	1680.9620	2017149	気配があった
1689.4308	5.0000	covert	n/a	2027317	と気配があった玄関
1696.4778	2.5560	listening	1696.4820	2035773	ドア越しに鎮火の土星が響く
1709.3508	5.0000	covert	n/a	2051221	ドア越しにチェーブの怒声が響く。
1718.1418	3.1320	listening	1718.1460	2061770	壁は薄く声はだいぶ筒抜けらしい
1725.7625	5.0000	covert	n/a	2070915	壁は薄く声はだいぶ筒抜けらしい
1732.8298	5.0520	listening	1732.8340	2079396	まだハチ時安全な時間僕はドアに近づき鍵は
1739.9825	5.0000	covert	n/a	2087979	外でチームは黙るまだ8時安全な時間僕はドアに近づき鍵を開け
1748.4138	2.5560	listening	1748.4180	2098097	この部屋にニ人アグラを描いて対面
1754.1983	5.0000	covert	n/a	2105038	何者に部屋に二人あぐらをかいて対面
1761.3098	4.9880	listening	1761.3140	2113572	とした理由付けに基づく死刑は一度も行われ
1768.4400	5.0000	covert	n/a	2122128	このような理由付けに基づく死刑は一度も行われません。
1775.4538	3.3560	listening	1775.4580	2130545	運良くオカミを排除できた感じもしない
1781.9275	5.0000	covert	n/a	2138313	運よく狼を排除できた感じもしない。
1790.0778	1.3720	listening	1790.0820	2148093	しかしだからといって
1792.4778	1.5000	listening	1792.4820	2150973	安永君勝ちへみぬ
1805.6975	5.0000	covert	n/a	2166837	しかしだからといって安永君が知恵実り
1816.6698	1.0840	listening	1816.6740	2180004	おはようございます
1819.6683	5.0000	covert	n/a	2183602	言うように 狼で母親を7年
1826.7178	5.0840	listening	1826.7220	2192061	やって平然と演技しきるほど冷血感かと言われると
1833.6025	5.0000	covert	n/a	2200323	やって平然と演技しきるほど冷血感かと言われると
1843.2618	2.4600	listening	1843.2660	2211914	後から血みが示したように香り
1959.9775	5.0000	covert	n/a	2351973	首をかしげる後からちえみが示したように
1967.0378	4.6360	listening	1967.0420	2360445	さんの行動は純粋に息子を持ってのことだと考えた方が自然だ
1985.1292	5.0000	covert	n/a	2382155	お父さんの行動は純粋に息子をもってのことだと考えた方が自然だ
1995.9018	1.3400	listening	1995.9060	2395082	一人残して全員
1999.3500	5.0000	covert	n/a	2399220	一人残して全員殺して
2006.4298	5.0520	listening	2006.4340	2407716	殺せばその一人は狼でも人でもヒャク%勝利できる
2013.2575	5.0000	covert	n/a	2415909	その一人は狼でも人でも100%勝利できる
2020.7978	4.5720	listening	2020.8020	2424957	とにかく重要なのはこの件で安永君を狼だと信じる
2105.7967	5.0000	covert	n/a	2526956	とにかく重要なのはこの件で安永くんを狼だと信じる話です
2112.8618	2.3320	listening	2112.8660	2535434	感じるのは数字違いってことだ
2120.1867	5.0000	covert	n/a	2544224	感じるのは数字違いってことだ
2127.2938	5.0200	listening	2127.2980	2552753	オリビ香りを錯乱した頭で自分を含む他人を全て犠牲にして
2134.2725	5.0000	covert	n/a	2561127	オリーブ香りを錯乱した頭で自分含む他人を全て犠牲にして
2144.4778	1.8520	listening	2144.4820	2573373	息子を助ける策を練った
2148.0900	5.0000	covert	n/a	2577708	息子を助ける柵を練った
2158.2058	1.5960	listening	2158.2100	2589847	ゲニス様時期は
2177.7342	5.0000	covert	n/a	2613281	現に凄まじきは
2186.2058	1.6920	listening	2186.2100	2623447	母親の愛ってところか
2209.6658	5.0000	covert	n/a	2651599	母親の愛ってところか
2220.0938	1.6920	listening	2220.0980	2664113	それが僕がハルちゃんと
2223.8475	5.0000	covert	n/a	2668617	それが僕がはるちゃんと
2231.0378	4.8920	listening	2231.0420	2677245	ニ階にやったことで予定が狂ったとすると恨みは変わってるかもしれない
2238.1767	5.0000	covert	n/a	2685812	2回にやったことで予定が狂ったとすると恨みは変わってるかもしれない
2245.4058	2.6200	listening	2245.4100	2694487	その後直接押さえつけたのも僕だしな
2248.7338	1.5960	listening	2248.7380	2698481	私社の恨みを買うってのは
2541.7898	2.6200	listening	2541.7940	3050148	その後直接押さえつけたのも僕だしな
2545.0858	1.5960	listening	2545.0900	3054103	私社の恨みを買うってのは
2548.3975	5.0000	covert	n/a	3058077	その後直接抑えつけたのも僕だしな死者の恨みを買うってのは
2555.7418	1.8200	listening	2555.7460	3066890	そうない経験かと思うが
2558.2058	1.9480	listening	2558.2100	3069847	なんとも居心地の悪いもんだ
2562.0133	5.0000	covert	n/a	3074416	そうない経験かと思うがなんとも居心地の悪いもんだ
2569.1498	3.3240	listening	2569.1540	3082980	僕の存在はチームに悪影響を与えているんだろうか
2576.1400	5.0000	covert	n/a	3091368	僕の存在はチームに悪影響を与えているんだろうか
2584.1898	4.0920	listening	2584.1940	3101028	塾料の上行動するのは悪いことではないはずなのだ絶対
2590.1192	5.0000	covert	n/a	3108143	熟慮の上行動するのは悪いことではないはずなのだ絶対
2598.4298	3.8040	listening	2598.4340	3118116	それに脅すことを脅すようなことを言うやすな
2604.0608	5.0000	covert	n/a	3124873	それに脅すことを脅すようなことを言うやすの
2611.2298	2.4920	listening	2611.2340	3133476	中君がらしくないというチームの感覚は
2614.5898	1.5640	listening	2614.5940	3137508	重視すべきだと思う
2617.6867	5.0000	covert	n/a	3141224	長くんがらしくないという知恵味の感覚は重視すべきだと思う
2626.0778	3.7400	listening	2626.0820	3151293	彼の他には完全に熱心に標準
2631.8550	5.0000	covert	n/a	3158226	彼の他には完全に熱心に矯正しています
2640.2218	2.6200	listening	2640.2260	3168266	対老人と安永君に
2644.7200	5.0000	covert	n/a	3173664	する 対老人と安永君に
2652.0618	3.5800	listening	2652.0660	3182474	賛同するはるちゃんと香織さんの死を決め
2662.5792	5.0000	covert	n/a	3195095	賛同するはるちゃんとかおりさんの死を決め手付け
2669.6618	1.1800	listening	2669.6660	3203594	ベータメコ
2677.1958	5.0000	covert	n/a	3212635	見えためいこ
2684.2538	1.7880	listening	2684.2580	3221105	うつもいてしまうチーム
2694.2400	5.0000	covert	n/a	3233088	俯いてしまうチーム
2701.5338	4.3160	listening	2701.5380	3241841	日常会話の口調で回想しなければ何かが壊れる
2709.9958	5.0000	covert	n/a	3251995	日常会話の口調で回想しなければ何かが壊れる
2719.9338	1.0520	listening	2719.9380	3263921	難しいなども
2724.5200	5.0000	covert	n/a	3269424	難しいなどうも
2732.1898	4.4760	listening	2732.1940	3278628	小さく本当に小さく多大な遠慮と躊躇をにじませなぐ
2747.1992	5.0000	covert	n/a	3296639	小さく本当に小さく多大な遠慮と躊躇を滲ませながら
2754.2378	1.6600	listening	2754.2420	3305085	これからチレミやうなずく
2763.0492	5.0000	covert	n/a	3315659	これから千恵美はうなずく、沈黙している。
2770.0778	5.0840	listening	2770.0820	3324093	神も皇帝もないじゃあ神富士吉の人間沈黙を守る知恵も
2800.5167	5.0000	covert	n/a	3360620	神不自由主義の人間、沈黙を守る知恵み
2808.6378	1.6920	listening	2808.6420	3370365	肩がわずかに震えている
2814.0683	5.0000	covert	n/a	3376882	肩がわずかに震えている
2823.9338	1.6920	listening	2823.9380	3388721	やっぱりダメか
2827.7242	5.0000	covert	n/a	3393269	くそ、やっぱりダメか。
2834.8458	4.9880	listening	2834.8500	3401815	特に考えていった言葉じゃなかったチームは明らかに
2841.9833	5.0000	covert	n/a	3410380	特に考えて言った言葉じゃなかった。ちえみは明らかに混乱していた。
2849.0538	1.5640	listening	2849.0580	3418865	して取り乱していた
2851.5498	2.5240	listening	2851.5540	3421860	状況に対する絶望感も手伝って
2857.7083	5.0000	covert	n/a	3429250	状況に対する絶望感も手伝って
2864.7658	2.6840	listening	2864.7700	3437719	が混乱の主因は
2868.2858	1.5640	listening	2868.2900	3441943	自分の年識を足りて
2872.4150	5.0000	covert	n/a	3446898	コンランの主因は自分の年式を種に
2879.5498	2.6840	listening	2879.5540	3455460	と共有できないことによるものに見えた
2883.1018	1.4680	listening	2883.1060	3459722	それは単純にレイテク
2886.6200	5.0000	covert	n/a	3463944	と共有できないことによるもの に見えたそれは単純にレーティクス
