onset	duration	trial_type	wav_onset	sample	value
1577.8900	2.0100	overt	1577.8500	1893468	調整かなんとね
1583.1400	2.0400	overt	1583.1000	1899768	山下社会社の決勝を行います
1586.1100	2.1600	overt	1586.0700	1903332	どうかという事故に遭つかるか
1589.8000	3.5700	overt	1589.7600	1907760	これっぽいのがよしよしよしいよこっちもなんともないです
1598.9500	1.0500	overt	1598.9100	1918740	そういうとこそっちがいる
1602.8500	1.5000	overt	1602.8100	1923420	相手もテストまで勝ち上がってきてね
1605.0100	2.9400	overt	1604.9700	1926012	やっぱりこういうかわざわざアペルスチャンスクエスクッターを
1609.6600	1.8900	overt	1609.6200	1931592	大丈夫どうってことねスリヤードチェンジ
1612.3300	3.2400	overt	1612.2900	1934796	少しくられないために知ってたもらって
1617.1600	1.3500	overt	1617.1200	1940592	そうなんですよ
1619.9200	3.8700	overt	1619.8800	1943904	ハイタースにゴ試合連続その他のスタンドマスタンドまで運ぶのかチートスリードキヨサク
1628.3200	7.3800	overt	1628.2800	1953984	イチ目切れなかったってのかな
1644.4300	4.8600	overt	1644.3900	1973316	今日が証拠の回も無得点か気をつくの一発以外はやっぱりもランナー出してもよく押されてるよな
1650.8800	7.2600	overt	1650.8400	1981056	スワイクパッターとカラビュー写真にたくらしくないとか何ていうのは自分のピッチングを集中することまた痛み出したらここでつまずいてられるというのは
1659.9400	6.8400	overt	1659.9000	1991928	抜けるランナーにはヨン枚のイチ枚目だからここで打ちたいよね逆のやつ通知しようってた
1673.0500	2.1900	overt	1673.0100	2007660	としてば公明完璧だったのに一体一同点だ
1680.4000	2.7900	overt	1680.3600	2016480	じゃあなきゃ言うとだったら
1683.8800	5.6400	overt	1683.8400	2020656	だったら前もこれだしこしかしなか痛めてるからいつものスイングじゃない本当が気をする感動かさせる
1690.3600	2.6100	overt	1690.3200	2028432	てめえの前人面にあるんざりだ
1695.5800	1.8900	overt	1695.5400	2034696	お前だって強いわちじゃない
1700.2600	1.4100	overt	1700.2200	2040312	だから力さなっちゃいけないんだろう
1703.6500	9.3300	overt	1703.6100	2044380	別にこいつもベタベタ気色悪い
1714.4800	4.5300	overt	1714.4400	2057376	どうやって失敗してもいいのかそんなのはみだとしても失敗して自分を自分が許せるのかよ
1724.4100	2.0400	overt	1724.3700	2069292	これが俺の力だ
1729.4500	3.3000	overt	1729.4100	2075340	昼前流れ場所みたいにやからまるで誰も邪魔すんじゃない
1735.7500	4.5000	overt	1735.7100	2082900	大丈夫かおいむしないわダメに心配されたくない
1743.3700	2.4000	overt	1743.3300	2092044	ちょっと心配していいんじゃないか
1750.1500	5.1000	overt	1750.1100	2100180	思い通りにならない俺がぶっ倒れて満足感情じゃてめんも俺と同じ自分のことだし考えすんだ
1755.8800	2.2800	overt	1755.8400	2107056	間違ってなんか今の俺は良かっただけだ
1763.4400	3.9300	overt	1763.4000	2116128	つないでかしこしたなうるせえなお前らが手にかかったと俺は横ばいんで
1769.8600	1.3500	overt	1769.8200	2123832	これは高額の監督
1774.4500	1.0500	overt	1774.4100	2129340	どこまでおられる
1777.8400	12.1200	overt	1777.8000	2133408	まいったあいつにふざけんな俺の言葉はここじゃねえだ言ったんだやごいって止められちゃくちゃ怖くて強さか怖くて強さか怖くて強さか行きたかったんだあいつが悪い次だ
1791.1000	5.2800	overt	1791.0600	2149320	腰が痛いお父さんも見るからみたいなこと言ってもそしたら腰も上部になるぞ
1796.9500	3.3600	overt	1796.9100	2156340	この中目の見えてるんだこの辺本当に育ったらなくです
1802.5300	2.9700	overt	1802.4900	2163036	私たちも聞かせてください
1816.9600	3.0900	overt	1816.9200	2180352	なんでそんな人が合うってやつやつなんでそんなに違うのうちに
1822.2400	3.3300	overt	1822.2000	2186688	自分はそんな話がかつは去年の夏の気温室のベストレートに狙える
1828.2700	1.2600	overt	1828.2300	2193924	全員しております
1836.3700	1.8000	overt	1836.3300	2203644	特にもっともきなはだねこれでは
1841.1100	2.2500	overt	1841.0700	2209332	なんだこのがついて日給みたいなまめして
1845.6700	1.3800	overt	1845.6300	2214804	あんたの自分だよな
1848.7900	2.2500	overt	1848.7500	2218548	なんでかくの知らなきゃだけですね
1863.1900	4.8000	overt	1863.1500	2235828	でも召喚しとるための先輩でも大きくじゃないです
1869.9100	3.4500	overt	1869.8700	2243892	黒原院っていうのって僕は一応一年たちに対戦したことあるの覚えてる
1876.2100	3.7800	overt	1876.1700	2251452	僕は当て届かないと相手の方も相手の方の知りた気持ちが良かった
1882.6900	6.9600	overt	1882.6500	2259228	平日の恐怖を行くと思って腰に見た目の話本当に何ともねさっき食べたけどあれはジュー個だな
1890.2800	6.6600	overt	1890.2400	2268336	なかしやくやってやって最近まで席まで席に残してなかったけどもやっぱり去年の金曜戦
1897.7500	8.1000	overt	1897.7100	2277300	元々のチームの守備の形で一人で試合を変わりヨン番錦先輩の爆発力アクアドって効率高でEニストレートまで勝ち上がったんで
1917.2500	1.1700	overt	1917.2100	2300700	それに送られてきた
1921.8400	1.2600	overt	1921.8000	2306208	今度もひたすら勝ちやるだな
1923.6400	1.8600	overt	1923.6000	2308368	じゃあいつにご紹介してくれ
1929.3100	1.9800	overt	1929.2700	2315172	一気にしてる前
1932.6700	2.5500	overt	1932.6300	2319204	ブリザに終わりの場合のバカにしちゃった
1936.0300	1.7700	overt	1935.9900	2323236	よかった聞いてるんでしょ去年イチ年
1938.3100	3.1500	overt	1938.2700	2325972	今日のチェネーション俺走りとしてもいいですか
1942.2100	3.4800	overt	1942.1700	2330652	吉田君は道一人邪魔が欲しいんで志村さんにはよろしく
1946.8000	2.4000	overt	1946.7600	2336160	西の前でホームランを打ちかましてやりたい
1949.7100	4.1100	overt	1949.6700	2339652	神奈川の夏の気圧何個出るか知っているか知りませんそんなことも知らず戦う気があきれた
1954.6000	3.7800	overt	1954.5600	2345520	センゴヒャク円キャラが優勝していくつもり夏の暑い時に最大ナナ試合からなっちゃいけない
1959.8800	6.2400	overt	1959.8400	2351856	しんどくてもついたくなるようなピッチャーだけでいいじゃないですか俺はバッティングの練習したいですよがん着物
1967.1100	3.9300	overt	1967.0700	2360532	今日の練習じゃないか一つでも俺に語ったらてめえの好きにさせてやる
1972.4500	2.2500	overt	1972.4100	2366940	データは気になつアプロクレーナー用意したと
1978.1200	3.5700	overt	1978.0800	2373744	この打ち切って何してるか分かってるのこのオペラも出発力だけあったって
1982.9200	3.0900	overt	1982.8800	2379504	力入れてるような走り方のクソハイ
1986.8500	3.4200	overt	1986.8100	2384220	知っちゃいと虫なんてきなやつがその誰か地下りだった
1991.4400	7.2000	overt	1991.4000	2389728	どうしたくちょうどにもねえな気も切らしてねえなきゃいけないなかつく前のとごめんだまだっす
2001.2500	1.8300	overt	2001.2100	2401500	人の捨て方とかレスラーかよ
2003.7700	4.0500	overt	2003.7300	2404524	キュージューニ自給よりだとちなって君もちが目でせめて脱落しない
2008.5400	15.0900	overt	2008.5000	2410248	こういう人が伝えてるのか友達がこれ伝われてもっと楽だと思ってたから居宿の力が厳しいなか暑くの力が絶対に必要なんだピッチョンに連投させないとか練習のややっぱりあんねやとかうるせやとかうるいもんなと一緒だ
2024.2300	5.4000	overt	2024.1900	2429076	自分の夢のために帰られたのは最高だろこちゃこちゃやつは体力と根性でそれが倒すよね
2032.4800	2.7900	overt	2032.4400	2438976	ちょっとまあね一井先輩持ちそうだなホマディオンシェ
2035.7800	2.7900	overt	2035.7400	2442936	どうしてってことにかピチャバチリするんですよ
2039.5600	4.5300	overt	2039.5200	2447472	先輩に多分そんな気安く打ちやがって大切なマントなら手狙うことが打つる弾じゃないの
2044.9000	4.0500	overt	2044.8600	2453880	やくなぜお召し上がりしてみてんですけども全然全然やってんだ
2049.5500	7.7700	overt	2049.5100	2459460	俺少し言ってくれなかったら最下位がヘバラはそこを狙うチームのために誰かおりにはいなかったですよ
2057.8300	4.6500	overt	2057.7900	2469396	うちは速くしなくゴロゴロ入っていくしスタチオが強いてみんな自信がやめなくて背中見るつもりやない
2063.2900	4.9800	overt	2063.2500	2475948	俺はココナンバースになるとかお前たるでも猫つまみあげるみたいな型で楽にしてあげてやる
2069.0500	1.9800	overt	2069.0100	2482860	お前の周りに立つことにしみするね
2072.7400	1.1700	overt	2072.7000	2487288	面倒くせえから倒れんな
2074.7800	4.3800	overt	2074.7400	2489736	何言ってもないと簡単だけどバッティングだけはみんな耳吸いできようで
2093.8600	4.2300	overt	2093.8200	2512632	自分の場合は自分から学びたいと言えたら間に行ってみやか
2098.7500	3.8400	overt	2098.7100	2518500	俺はこの人一緒になってる
2103.1300	5.4600	overt	2103.0900	2523756	倒れながらいろいろ頭で見ただけは点滅を繰り返すほったらみたいな光だ
2109.6400	6.6300	overt	2109.6000	2531568	そのとこのレッドバスの走り込みじゃがさにし去年は夏は土地で回ってしまったからなその夏は立ち止まらわけに行かないんで
2126.2000	9.5100	overt	2126.1600	2551440	練習終了
2136.5800	9.8700	overt	2136.5400	2563896	続いてあの人には打ちてねえ当初の黒チームの部屋出しそうとして触ってないで片付けろいなとか言ったらつかかったくる
2146.9600	4.4700	overt	2146.9200	2576352	いかだと調整力が速してるかって自分のやつにたそもったやつにかまったらいいか
2152.9600	3.8400	overt	2152.9200	2583552	明日試合するぞニサン年対イチ年で怖くせんな
2159.4400	2.1300	overt	2159.4000	2591328	これなんだよどかしてみてよろしいですか
2162.2300	6.0600	overt	2162.1900	2594676	気に入ってたら夏の神奈川県のツンペストイトだらビビってる勝手にもらえますかまあ頑張れ
2168.9200	2.0700	overt	2168.8800	2602704	なんで力してんだ
2171.6500	9.8100	overt	2171.6100	2605980	ホームランサン本って言えば野菜を使えるのはニジュー人でもキュー人でもゴ週間でもゴ時も使ってもニ時までニ時にかけてもイチつのせばゴ点をお手に入れちゃうのチャンスです
2182.1500	4.0500	overt	2182.1100	2618580	誰かに失敗戦波みたいな人にイケのこと言ったら降りやがって
2187.1000	4.6500	overt	2187.0600	2624520	今からどこから作成会してないかもしれない
2192.8600	2.4300	overt	2192.8200	2631432	今日のセネスやかに仕方からです
2199.0700	4.3500	overt	2199.0300	2638884	その時からアディシャム行ってたっての天が山に帰りな
2204.0800	4.8300	overt	2204.0400	2644896	おごりなら付き合ってやるだから金のやつなの僕出す僕たちから行こう大変だなくり
2209.5400	2.9100	overt	2209.5000	2651448	いつまで今日はそうだ
2213.3800	2.3700	overt	2213.3400	2656056	どうだましたか
2216.4400	7.2600	overt	2216.4000	2659728	俺の一生持ち帰りはやっぱりやっぱりやっぱりやっぱりねんしトミネット栗原さんさんサンつ目にも一方に対する自宅は俺の方が上だ
2224.3900	6.6300	overt	2224.3500	2669268	オラエバンセンターオライバンサード ゆざらねえさんにして今までそれにしてんぱいたまるカブレーション
2233.3300	2.7000	overt	2233.2900	2679996	まだ言ったいチャンスらかどっちかゆうばんかよばんね
2236.9600	5.9400	overt	2236.9200	2684352	要するだけねててめんの英語でチームを壊すのやつにも野球やらないのは迷惑で勝ってくれいい
2244.2200	2.0100	overt	2244.1800	2693064	腹いっぱい食ってからなもういけない
2249.3800	8.2200	overt	2249.3400	2699256	俺が野蛮だ今一大丈夫か何か何かとってるの嫌いじゃないけどそうでもしたらきゃ勝手が相手じゃないしな逃げなかったけどまたぶっつぱしてやりちゃうね
2258.1700	4.4400	overt	2258.1300	2709804	先輩がなきゃ今日俺はピッチャーはお出やらかに一年中この人がキャプテン
2263.1200	1.0800	overt	2263.0800	2715744	です 難しい
2266.8700	2.3400	overt	2266.8300	2720244	イチ日イチ年対ゴ日さようかな
2270.4100	1.7700	overt	2270.3700	2724492	そんなに多分っていうほどじゃないけどな
2275.4800	3.3600	overt	2275.4400	2730576	その代わり俺は一年と寝すりも落ち着かだしてるから
2282.7100	3.7200	overt	2282.6700	2739252	俺が誤明日の人たちに変わったんだってそれじゃあマイフェリートで
2287.2100	3.6600	overt	2287.1700	2744652	こいつはチェブの中ニ年平時代で見張るカメラを見張るけどショートナイスの道
2291.4400	2.7300	overt	2291.4000	2749728	今のおばっちゃい方がおらしいです
2295.1300	2.7000	overt	2295.0900	2754156	あんまり勝手に水が行きたいってまっすぐ行ってこい
2301.6100	2.3400	overt	2301.5700	2761932	片も残念な家のチームの元々潰してやる
2304.5200	4.1400	overt	2304.4800	2765424	チームメートなんかこの人に割れてないとみず力は下に取っておくまんダメ
2309.8900	1.0500	overt	2309.8500	2771868	全然違えてダメです
2311.5700	4.0200	overt	2311.5300	2773884	ちょっとですければちゃんとり合い先生もちゃんと言われちゃうの辺り合ってくれ
2334.3100	1.9800	overt	2334.2700	2801172	僕は今相撲かかってんな
2337.1600	2.8800	overt	2337.1200	2804592	全然ピッツァルムの沿岸ピッツァが見てるじゃないか
2340.7300	1.4400	overt	2340.6900	2808876	高いのかもしれない
2342.8900	1.1400	overt	2342.8500	2811468	この人なばいこうな
2347.0000	1.2000	overt	2346.9600	2816400	立ち回った感じが違う
2352.5500	1.6500	overt	2352.5100	2823060	じゃあこいつくらつけていくってんじゃない
2354.8000	1.3800	overt	2354.7600	2825760	ミッドホリクスマジカイ
2357.0500	3.2400	overt	2357.0100	2828460	肩の頭に腰引いてるのに打つ気になるんですよ
2361.4000	2.3700	overt	2361.3600	2833680	ごちゃごちゃうるさい
2367.8800	1.3800	overt	2367.8400	2841456	そうですよね
2371.7200	4.2000	overt	2371.6800	2846064	そしたら真っすぐにかせてもらって大きい狙うので攻めて前に飛ばしてやる
2376.7900	1.9500	overt	2376.7500	2852148	挑戦者のビビったらマジなんです
2379.6400	1.0800	overt	2379.6000	2855568	そういうかと
2382.2800	2.1900	overt	2382.2400	2858736	下向くの面白い絶対打ってる
2387.8900	2.0400	overt	2387.8500	2865468	バットサンか
2394.0400	1.6500	overt	2394.0000	2872848	全然正解です
2400.1000	1.5000	overt	2400.0600	2880120	見たら誰一人がされるしない
2402.5000	3.7800	overt	2402.4600	2883000	俺は早く俺ら落ちてるんだよさっさと撮って撮って終わらせろ
2406.7900	1.8600	overt	2406.7500	2888148	じゃあ帰ってきてやった
2409.6100	1.4100	overt	2409.5700	2891532	これだったら後に経験で
2415.3100	2.8200	overt	2415.2700	2898372	こんなにしゃくてないかこんな尺点とか表す
2419.0000	1.2900	overt	2418.9600	2902800	いってみんな
2428.2100	1.3800	overt	2428.1700	2913852	でもいいペンスに行く
2434.1800	1.7100	overt	2434.1400	2921016	社員からも見せてまさかになった
2442.4300	3.4500	overt	2442.3900	2930916	それぎらい相手とはいきなりの終わったうちにかせんしても丁寧に見えないけど
2446.4200	1.0500	overt	2446.3800	2935704	真面目にやってんのか
2451.9100	3.4800	overt	2451.8700	2942292	そうですねこれ一礼もそこだったりだもんのピッチャーに集まったりぶつかる
2455.9300	3.6300	overt	2455.8900	2947116	とにかくて声が届かないといえばできたら
2460.3400	2.1000	overt	2460.3000	2952408	感じたことはない
2464.9300	1.0500	overt	2464.8900	2957916	だろうございます
2466.4900	1.6800	overt	2466.4500	2959788	センターまでライナーで
2470.1200	3.4800	overt	2470.0800	2964144	シャリー先輩の楽しい楽しみなんて楽しい
2478.7600	1.7400	overt	2478.7200	2974512	もしやないかく言われていて
2493.1900	2.1000	overt	2493.1500	2991828	そうですよね大丈夫だった
2823.7900	2.4900	overt	2823.7500	3388548	その弾くたたいてる
2826.9100	2.0700	overt	2826.8700	3392292	外で見てるとついてみる方がちょっと
2831.2300	3.9900	overt	2831.1900	3397476	確かにそういう話をしていた
2836.0300	2.4000	overt	2835.9900	3403236	失礼します
2840.7100	4.2300	overt	2840.6700	3408852	さっさとやってほしくお願いします
2845.7800	4.6200	overt	2845.7400	3414936	ご覧になるまで聞いません
2851.3900	3.6600	overt	2851.3500	3421668	私に入りの試合の検証をぶったりというようなことを思い出します
2855.9200	2.8800	overt	2855.8800	3427104	自分の様子をお知らせた場所じゃないか
2860.3600	2.0400	overt	2860.3200	3432432	どんな例わせだろうね
2863.9000	1.3800	overt	2863.8600	3436680	すいませんでした
2865.9400	2.1000	overt	2865.9000	3439128	何してましたか
2869.3300	2.7600	overt	2869.2900	3443196	俺だと撃たれるってのかさと
2873.4400	2.8800	overt	2873.4000	3448128	あまりおくべ物だとケニー解除しちゃう
2876.9200	3.3300	overt	2876.8800	3452304	この覚悟が日本ってながらやばなりやばらしい仕事なんですよこの覚えばか
2882.1400	1.1400	overt	2882.1000	3458568	白かった
2885.1100	6.2400	overt	2885.0700	3462132	私自分の話しか考えてられてたとおさしくは見てなかったからそいらっしゃるんですけども一人に場所に戻ってただけか
2891.8600	5.8200	overt	2891.8200	3470232	この場所には敵が本当に強くなる気にする気がする気にならざいくらいにあふれて
2898.7600	4.0200	overt	2898.7200	3478512	参戦した俺もここに達人の力を消滅してみせないと
2903.7400	1.6800	overt	2903.7000	3484488	気はないですよこの振り切れ
2906.0500	1.9200	overt	2906.0100	3487260	マヨウィーズムをちとばさえ全部
2909.5600	2.0100	overt	2909.5200	3491472	西に合わないとニジューセットがいると
2912.8900	1.2300	overt	2912.8500	3495468	それは無理だな
2921.3200	1.3200	overt	2921.2800	3505584	これさとらえみたいじゃないか
2928.7900	2.2500	overt	2928.7500	3514548	悔しいのは自分で結構楽しい
2955.5500	2.2500	overt	2955.5100	3546660	逆転差でいかなかったゴ回ホルドには十分だね
2964.6700	4.1700	overt	2964.6300	3557604	本当に話しないんだな
2969.3800	2.1300	overt	2969.3400	3563256	倍じゃ夏を戦いなきゃジュー倍に増やそう
2972.5000	11.0100	overt	2972.4600	3567000	本当に完敗なホームランはイチ本持ってなかったあちの全力で臨むのはいい心配置ですがこちらもしか新規大会という人に抽選から新規制度で出せるだけでありませんでしたね
2984.0500	2.9700	overt	2984.0100	3580860	監督宇都宮監督おくさいそうです
2987.8300	1.0800	overt	2987.7900	3585396	組み合わせてまりました
2991.6700	3.9000	overt	2991.6300	3590004	逆ブロック決勝まで行かないと当たらないかだったら全部ぶつぶすのいいだけな
2996.4400	12.4200	overt	2996.4000	3595728	選択育圏内関東京都ジューロク号と選抜に出場したイチ個ヒャクロクジューロク個最大ナナ位のトーナメントかねジューニ号は坂の東大会主張だけど京子が上手者のベストジューロク権がいられるかだ
3010.7200	2.6700	overt	3010.6800	3612864	シルラムの価値の人に両方手に入れられます
3014.5600	4.8600	overt	3014.5200	3617472	今年の夏金曜戦全員決勝で先発表戦で先輩はベストヨンヒャクキュージュー年のこのチャーチャー
3020.0500	3.8700	overt	3020.0100	3624060	エンジン組みましょう
3025.4800	2.8200	overt	3025.4400	3630576	チームのため勝利のために保護をつなげる
3030.1300	3.1500	overt	3030.0900	3636156	気持ちで殴りやがったんですけど
3036.8500	3.0300	overt	3036.8100	3644220	手すり前に美しい仕事も経てないと体しまってるの本当かい
3040.5700	3.8100	overt	3040.5300	3648684	それにしてもやっぱり苦労してないにして
3045.3100	1.4700	overt	3045.2700	3654372	さあ俺見てんじゃねえそっちか
3047.8900	2.3400	overt	3047.8500	3657468	チェスチを人の体のアメラに見てるから
3051.5200	2.3700	overt	3051.4800	3661824	ついてくんじゃないの
3056.1100	2.4600	overt	3056.0700	3667332	宮根さんと俺はただ調査しただけで
3059.8900	1.3500	overt	3059.8500	3671868	全てみるそうかな
3064.8100	1.5600	overt	3064.7700	3677772	この楽しいのかも
3069.1300	4.1700	overt	3069.0900	3682956	今外にも後ですぐ上に帰るお前着地上作ってみようなところもいっちゃう
3074.0200	4.5900	overt	3073.9800	3688824	今から一瞬間無駄なことが俺がいる限りかなわからこしに行くの
3079.4500	2.7600	overt	3079.4100	3695340	それだけ登録しようという意味だなとは完全に楽しんだこと
3082.7500	2.3400	overt	3082.7100	3699300	おめでとうさんでもらって こんなことに倒してやる
3086.1100	3.9300	overt	3086.0700	3703332	仕方作業はイチ枚当たらなかったんですよなメリックスタンバーです
3090.7300	2.2800	overt	3090.6900	3708876	やめかさに今までやってたパッチして
3093.6100	3.3900	overt	3093.5700	3712332	ここに行ってもこの辺り
3098.2600	2.9400	overt	3098.2200	3717912	性格我が今日もして殺すあんたの性格のことにな
3101.8900	8.0700	overt	3101.8500	3722268	もやみなさん幸福に呼ばれたことはけんなに最強の場だったってことか
3111.4000	7.3500	overt	3111.3600	3733680	俺がこうなきゃじゃない壁がすぐ目の前しでもちろん人をすすぐに近くに白口おきょうが頭から花やなら俺は恵まれてる
3122.5300	4.3200	overt	3122.4900	3747036	俺にアニシ先輩でいますから 私はそっちなのかそういう意味じゃないです
3127.5100	7.1100	overt	3127.4700	3753012	何か俺みたいなみたいなタイプがちがくないからな
3135.4300	4.1400	overt	3135.3900	3762516	でかいファウルというのあのスティングが肩の力が出て背筋が伸びた方がいいで視野も広がって
3141.5200	2.0400	overt	3141.4800	3769824	まだできないサードが出たけど
3144.1600	1.2900	overt	3144.1200	3772992	お邪魔します
3147.1300	3.2400	overt	3147.0900	3776556	それどうなんですか
3151.7200	1.1700	overt	3151.6800	3782064	サンチンベリですか
3155.2900	4.8300	overt	3155.2500	3786348	センターに前着までやってハチめてハチメートであのセロットに見たら誇らしくて誇らしくてさなかった
3160.9000	4.9200	overt	3160.8600	3793080	こっちへ行くじゃないお前みたいになりたくねさまざまなできるんだ
3166.4200	3.2100	overt	3166.3800	3799704	誰かが止めてやらないと迷惑だな
3173.7100	5.2500	overt	3173.6700	3808452	イチ回の第イチ試合から今日の夏のベストヨンの富士倉でスティーティングの年は当たるから登場だとリベンチが楽しみで
3179.9500	2.4900	overt	3179.9100	3815940	では次は平均さんのくちゃいけ
3183.6100	3.9600	overt	3183.5700	3820332	この人たちみたいな気持ちいいかもしれません
3188.7700	4.3800	overt	3188.7300	3826524	次回ピッチャーの試合は全然パフォースやったら変わりません
3193.9900	4.6800	overt	3193.9500	3832788	ロク番後ろナナ番ライト奥行かないと
3199.6300	3.7500	overt	3199.5900	3839556	俺しか言ったことないから分かんないです
3205.3900	3.5700	overt	3205.3500	3846468	顔やめろ派にしろ
3210.0100	5.1900	overt	3209.9700	3852012	当たり前の治療にもあるということですね
3215.9200	1.4700	overt	3215.8800	3859104	ベンチになりしてさあ行こうか
3218.6500	8.0700	overt	3218.6100	3862380	どうしたら家庭をイチ時間暴れるやっぱり間違いねえたのに一番急速油断
