onset	duration	trial_type	wav_onset	sample	value
6.9400	12.3000	overt	6.9000	8328	この種の複数の感覚にまたがっては手が引きなしに立てられているペンについては金具を外向きに反らせすべて指先を離れるのを感じた時には神奈川ペンの温帯に当たるパスイントを追跡する
23.8600	16.4250	overt	23.8200	28632	この音が聞こえないと私は驚くだろうとそれがいつ聞こすればそれがどんな音がどんな音があるかもは正確に予測しているこれができるのは情報が大切感覚への情報が出ていいからその結果パチンと一度急ぐできる
40.2850	16.4250	overt	40.2450	48342	そんな朝は車庫に入り電車をつかみ向きを超え外の道まで押していくこの作業の間四角聴覚聴覚長数の力を受け取って自転車が戸口の柱にぶつかりチェーンが横たって空転する
64.7500	4.2000	overt	64.7100	77700	最後から出すまでに私ののはついついと四角触覚触覚の刺激を受ける
71.4700	10.2900	overt	71.4300	85764	ただの感覚の絵馬内にいるか驚くほど強調的な他の感覚を予測する私が見たことは増えることと聞くことを正確に予測するしおかんの感覚を最初に受け取った場合も同じた
82.4500	2.4000	overt	82.4100	98940	前輪が土口の柱にぶつかるのを見れば
88.5700	19.3200	overt	88.5300	106284	自転車が跳ね上がる感覚を感覚するペダルが判定を予測するペダルが見えることを予測しながら足元に目を向き合う高野の予測は極める性格だから入力のどれかがすくしたら情報は感覚への回数を同時に体験すられる感覚を予測する
108.4300	2.0400	overt	108.3900	130116	同じ気をしてみようしばらく読書
111.1900	17.1450	overt	111.1500	133428	やめて立ち上がり何でもいいかカードを操作する動作をしてみてほしい
128.3350	17.1450	overt	128.2950	154002	上下のレバーも足に待ち合いする時にはのまま皮膚が受ける圧力が感じると予測しているレバーの動きを目と手で感じることを予測することを予測すること予測すると水が流れ落ちた時は別の種の音が聞くしぶきが目と鼻で感じること予測されずだ
146.0200	4.6500	overt	145.9800	175224	ブース歩くたびに貸し音がすることは意識しているかどうか別にして必ず予測されている
151.8700	16.1400	overt	151.8300	182244	電話を待ち歩いたつもりでも音で音も聞こえたのに目の前の方が開いていたら驚いているトーズを悪くするだろうと大きくするだろうな第ゴ章でドアの改造の試行事件を使用してみやれる感覚にまたがる強調的な予測に
168.9100	11.5050	overt	168.8700	202692	大切な感覚の全ての意思を集中させてみると感覚の予測がいかに完全に統合されていいかが分かり驚かされるそういうの予測が単純な平凡なことで覚えるかもしれないがある場合におくなれる
180.4150	11.5050	overt	180.3750	216498	新室の改正を常時するパターンの大規模な強調だけから目指されていることはここに止めておいてほしい観光所につながりかいかに見せるかに見せれば進出のあらゆる感覚屋と連合は一体となって機能している
193.6000	6.5100	overt	193.5600	232320	結論付けてたくなるしかしとら実はしかに存在する我がれる感覚を含んだ体システムの一様子ではありすぎない
212.8900	3.9600	overt	212.8500	255468	近く中核職さらにあほかな感覚の出場を据えてくれ
219.2500	10.4400	overt	219.2100	263100	値段からした単一の改正構造の中を常時する際にもう一年全ての経験にそれから経験にって学生されたものであることも知っておりその音を聞いたからだ
233.3200	16.1700	overt	233.2800	279984	生まれた時にはこれは知識をもに持ち合わせていない筆質が感じないなら多くのパターンは記録できるわけにだなと学習されたものなんだのに流れ込む入力に一貫したパターンさえやがて人質はそれを使っていないがそれを含めるようになるようになる
250.3600	19.3650	overt	250.3200	300432	感覚の一つと同じように積み重ね電子屋で観覚屋とつなげる細かくやとつながりとつながりがつながらこのように位置づけると運動屋はほとんど感覚屋の一つのように機能がいずればいずれの回想やの入力も連合でいずれの回想像やの場合わけ
269.7250	19.3650	overt	269.6850	323670	中学園の入力や体制感覚が下回っていくパターンと同じように運動屋を下向きに流れるパターンを下向きに流れるパターンを下向きに流れるパターンは運動のメールは運動のメールと考えれば相手はそれが指摘するように運動体と感覚やと関係は運動のメールは同じていると同じだ
290.9500	12.2400	overt	290.9100	349140	人には純粋な感覚やも純粋な感覚やもないことを簡単なバターンある場所から同時に流れ込み解散のいかなら場所にも流れ込み予測の命令となる運動はいくつかの特別な性質も備えているが記憶にあるそこ
303.1900	12.2400	overt	303.1500	363828	単位置の巨大な改造システムの一部とみなすのが正しい
319.5700	5.7300	overt	319.5300	383484	最近は確かにかくにくまでロクセンサンビャクロクジューサンつぶりやっぱりやっぱり一応
326.3200	16.3050	overt	326.2800	391584	イチ位が最も下にアイティアが次に部位置に下がらずに関与に描かれずでもそれに描かれずでもそれに描かれる情報はVヒャクニジューヨンとの上がらがどんどん複雑などの特徴分析されてそしてITAで買うのに分体と指摘され
342.6250	16.3050	overt	342.5850	411150	それぞれの領域にはニ種類以上の領域から入力を受けた場合入力を受けた場合には連合の領域にはジュー以上の領域からの入力が食べれているものもあるところが従来の議論では関係の領域がイチ本しかない
363.4000	5.7900	overt	363.3600	436080	普通の要領には入力を受け取るだけだったら全然複数の入力が集まってくる時代集まってこない時期が済んでしょうか
369.8200	4.1400	overt	369.7800	443784	共産のような存在で明らかに明らかに見せてそこで私はついのに考えるようになった
374.8000	13.6500	overt	374.7600	449760	最大の領域を見やすべきは後ろタッシュの地質の薬が集まったものと考えるべきだなナプキンタイルの全体大量の量域を囲む世界最大の量域はVニだ嘘つやVニだ
397.1200	15.4050	overt	397.0800	476544	ここで私か天然の分野は実際は多数の小さな蒸気からできているという考えで何匹の上で普通の小さな部屋に立ててが同じ範囲を占める多数の小さな空気に集まれています
412.5250	15.4050	overt	412.4850	495030	分野は気持ちの量と最多数の複用金を持つことになる
433.3000	4.3800	overt	433.2600	519960	感覚の回数を私が提案した構造に変えて
450.2500	1.0800	overt	450.2100	540300	ごめんなさい
463.1500	7.2000	overt	463.1100	555780	図鑑と同じ階層構造を示しているのもこの半角円の海藻は私が提案した構造に書いてある
488.2000	14.1000	overt	488.1600	585840	複用機の情報滅ぶちで進出の道路に研究を成し上がったことになった後入力同士の関係を除してその記憶に持ってその記憶に持ってその記憶の変化を予測するどこも可視化の処理を行うことになります
521.0800	5.4600	overt	521.0400	625296	社会社の標準が見らせる課程を解説を解説していらっしゃる
530.8000	3.2700	overt	530.7600	636960	本当に来られる間に言われる間に入りたいなと思って
537.8200	6.4800	overt	537.7800	645384	部屋の人生それぞれで処理する領域が似たような強固定させない人生において両者がリティアなパターンされていたからすぎない
544.8400	7.2900	overt	544.8000	653808	私が感覚が感覚して異なるなどにVMアンドやスカ国のセンサリーザーの調査で結びつきゃい
552.6700	1.7400	overt	552.6300	663204	別の部屋骨折するくり置きや
555.9400	17.0850	overt	555.9000	667128	複量行って同時には何もあるがそれによって基本的な働きが変わるわけではない四国屋の中の連合という会社がこれまでの説明するそれに変更を加えることではない情報開設的な記憶のあるいらではない
573.0250	17.0850	overt	572.9850	687630	ちょうど猫の首に近いと鈴の音によって部屋に入ってくる姿が誤測できるように最も重要な電話はありても重要な表現は有とやれとやるな表現は入力が相手に立てて始めてもこのように洗うの表現であるような部屋の階屋の階層が送ってくりによりかしられるものだ
594.5500	8.2500	overt	594.5100	713460	最初には基本的な特徴しか表現できないがショートな相手やとかなりとかさに相手や上に上に上がらない時も普通の感覚のパターンが不変の表現を見出している
603.3700	5.2200	overt	603.3300	724044	一緒になれるよっちゃ海の下位の表情が使う世界の表現象を打ち合わせなんて美しい陳出だろう
612.0700	4.0500	overt	612.0300	734484	前の回数も負担状がいかに計済されていかという必要がない
616.7200	4.4400	overt	616.6800	740064	ニ人なられる単越の領域でFの要因がいかに小さいとか問題じゃない
629.5000	6.7800	overt	629.4600	755400	農家のジャフルの症状を設設設するとこの回数の解説を出すことこの回数の当たり前なかよね
638.8300	10.8600	overt	638.7900	766596	現世界のことを考えられるのもこの中の動き回りのことが不足できるのは寝室の中に現世界の世界のモデルが記憶できることにある
653.6800	3.4500	overt	653.6400	784416	新羅場の入れ子構造は寝室の入れ子構造に反映されている
755.3500	1.5900	overt	755.3100	906420	速報剤レゴ構造とは
758.6200	12.3900	overt	758.5800	910344	音楽を考えてみ音が組み合わさってばいい音手になる音程が続いてフレーズになるのでメロディーが続いてフレーズが鳴らんでメロディーあるいは書き言葉を思い出す文字が組み合わせて音声になる
771.7300	9.4200	overt	771.6900	926076	今度は周りを見えたし逆に考えてみようあなたの近くに多分同僚が多分同僚がある
781.7200	3.5400	overt	781.6800	938064	そのそれぞれもまたさらに小さな部分に分割できる窓を終わります
786.3700	16.7550	overt	786.3300	943644	窓枠掛け切り金が根にはもっと小さなネジなどの日にがある読書を一緒に見てみる門幕から分野に入ってくるパターンには多数の線分が含まれている線分が組み合わせもう少し複雑な物件ができる複雑な物件ができる複雑な物体が出る
803.1250	16.7550	overt	803.0850	963750	そして顔が体の他の部分と一緒になり部屋の中で目の前に座っている人になる人間が認識する世界のやれる物体が分けることができるそして常に一緒に現れる部分にある部分に掲示されるものができるのはいくつかの特徴が存在するからだ
822.5500	11.3400	overt	822.5100	987060	メガメであるのは同行交際まぶたなどがついに同然存在するからに他ならない椅子にも椅子にも声に効果にもあるそして歌にも一度飲んでかなり時間の神経素のも自分に歩いてること言うたという
851.1700	4.3500	overt	851.1300	1021404	全体的な構造は最上位の回数ニ分的な構図はそれぞれの海の構想に
856.2400	5.1900	overt	856.2000	1027488	新室には全世界の活動構造が極めてしてなきゃできるような構造と学習するのがそうなっている
861.9400	1.8300	overt	861.9000	1034328	無事の人間は言葉や
864.7000	8.9100	overt	864.6600	1037640	音楽の知識を持っていないシンスには高めの学習アルゴリジもあるのでどんな改造の存在も当然のように見つけた獲得してしまう
874.3900	3.4500	overt	874.3500	1049268	そんなりしないとコマークシックさくらん状態に落ちることさ
879.7300	13.6200	overt	879.6900	1055676	瞬間に今までどこかの辺りでその方向を見ているだけだところが寝室の改装構造の影で視線がたまた窓の角い切りが止まっている瞬間で自分が言うのでどの窓を見ているのか分かっている
894.2800	12.0000	overt	894.2400	1073136	上位の領域に自宅の表現が保持されていて下位の領域には部屋の表現がありさらに階の領域が実際に窓を見ている状態にこの階層構造があるからこそある一瞬に聞こえる音にや
906.2800	12.0000	overt	906.2400	1087536	どのシーリーなんていう曲を聴いているか知人と一緒にいることを集中していることも分かっている進出の会員の領域が頻繁に変化する細かな情報特徴の処理に
918.9400	3.9600	overt	918.9000	1102728	防砂されている間も上位の海藻は全体増を出されている
941.2300	3.2700	overt	941.1900	1129476	頭の瞬間にも見たり聞いたり触れたりできる
945.0400	9.8700	overt	945.0000	1134048	異性関係病だけがそこで脳に流れくる情報を覗すとパターンスンケンスという形にある種子はたびたび繰り返さが駆使用とすると例えばメルディングの場合にはパターンスティケンスは一定の順序
956.2900	10.6350	overt	956.2500	1147548	しかしシーケンスということはもう少し一般的に数学用語のジューゴに近い身で使えた人間パターンの集合で決まって一緒に発生するが順川がいつも同じとは限らない
966.9250	10.6350	overt	966.8850	1160310	重要なテンマンスに含まれるパターンがもしまた順序でなくても時間的について起こることだそれになれる手をこの手を明確にしちゃおく私があなたの顔を見ると人のシーケンスに含まれるパターンの
978.4300	18.9900	overt	978.3900	1174116	順次は決まっていたわけ自然の動きに依存する目は次の瞬間かもしれない次の瞬間には次の瞬間には次の方が口や口で使える傾向だから順次は様々でもいいもしも顔に意識していて視線が鼻にあるような順次は様ではない
997.9900	7.3500	overt	997.9500	1197588	もしやパターン同士に関連性が見つかりそうによって次に起こるパターンを急ぐできるような時はそのシーキンスの継続的になれる
1005.8500	1.1700	overt	1005.8100	1207020	記憶を忠説する
1008.2500	2.7900	overt	1008.2100	1209900	最初の世界の表情を乱すうちの最も強いの力が
1012.2100	6.8700	overt	1012.1700	1214652	特殊な対象的な対象的な対象的な対象的な対象的な対象的な対象的な可能な情報ですか
1019.5900	11.4600	overt	1019.5500	1223508	実感の経過度ミッションによることが促進することが進出の領域あるいは何度も繰り返し合成すること自術のまと実の体験が人世界の対象によって引き起こされるものと判断することには
1031.6800	3.7200	overt	1031.6400	1238016	視線を描いたり指でいじったり一連の顔の動きな全力パターンを
1035.9100	9.3600	overt	1035.8700	1243092	確実活用クログに変えられたりする時とかを構成功する音のように次の瞬間パターンを正確に予測できる時のそのパターンの違和感知があるものと解釈する
1053.1300	7.8900	overt	1053.0900	1263756	それがいつも当たるならそれは別のべきことじゃなく人生か実際に結びいてるはずある顔には両面両耳口肌がある目が
1062.2500	14.8200	overt	1062.2100	1274700	胸をかすともう一つの身が見つからもう一度動かすと口が見つかったなら半身して顔見ていると判断できると判断できるもしれませんも新室のリオキにしゃべる能力があったらこんなふうにつぶりゃいけるかもしれないたくさん違ったパターンが出る
1077.0700	14.8200	overt	1077.0300	1292484	でも今回のパターン同士は確実に関連を持っているいつも一緒にやってくるし自分の同じで変えることもできるだからこのパターンの集合を見せた時に同じ名前で呼ぶことにしよこのパターンではなくグループに名前を出すことにしよ
1095.8500	4.6800	overt	1095.8100	1315020	ジョンのように脳はシーケンスのシーケンスを蓄えるといっている
1101.1600	3.0300	overt	1101.1200	1321392	それに私が名前という名前でそれを一つの勇気に渡している
1107.5200	9.3900	overt	1107.4800	1329024	シンケンスの上りよりイチ時間かけに入った状況が工事の間隔へと上にした場合変化の頻度は低くなるVTRではイチ秒に何回か
1134.3400	2.4900	overt	1134.3000	1361208	気をつけてみんなにやってやる
1137.9100	3.0600	overt	1137.8700	1365492	薬するのでまだ全然黙ってる
1141.4800	3.6900	overt	1141.4400	1369776	その時で俺は外の格好が必要だ自分の意思だけが周りの人間の巻き込む覚悟だ
1145.7700	1.1400	overt	1145.7300	1374924	俺の初音やタブジーサー
1147.6300	4.7100	overt	1147.5900	1377156	お前たちはわしの娘と孫何度もおかし上げく腹を裂いてメザーに残した
1153.4500	2.2800	overt	1153.4100	1384140	それはもうニジュー年前なんだしね
1157.3500	5.6100	overt	1157.3100	1388820	私らはこのニジュー年前はマスクラの姿を思い出してあの素晴らしい姿で一年うちも欠かさず思い出して
1165.1800	1.9500	overt	1165.1400	1398216	痩せなくて一層何も違ってね
1167.8500	6.4500	overt	1167.8100	1401420	ダメが消えるのは人それぞれだイチ年なのかジュー年なのかこの時さんニジュー年前のことをお前で急なのことに感じてるんだ
1176.6100	7.4700	overt	1176.5700	1411932	他の住民まで巻き込むか仲間しろってのは暖房だそれができる人間は山がそんなことまで考えない人間もいる人間もいる
1184.7400	9.6600	overt	1184.7000	1421688	今のがお前ら人美兵だってやれたかもしれないんでそこで美兵が殺されてたらメラで帰り待っててる夢の透明なんていうんだお前それはそうならねえよ気をつけるしかねえ
1195.1500	10.0500	overt	1195.1100	1434180	そんなことをしていたら取り返しにつかないことがこれで制圧したそれは支配だそらは中古での統一に全土支配がしたいわけだな神話みたいな世界を作りたいんだ
1206.0400	8.1600	overt	1206.0000	1447248	新人だかじゃなくて新出身の信頼何種種の信頼とかだっていって混ざり合っていつかより痛みも 共有して生きていくきっとそんな世界を作りたいんだ
1214.7400	17.6100	overt	1214.7000	1457688	そのためにきっと今の俺たちは難しいことをしなくちゃならね戦場の外には信用をやることは思える必要があって痛みを持つ者たちはその怒り意味を抱えたまま前に進む必要があるそしてそれはきっと俺たちの何倍も厳しい難しいことはだから俺はこの班班班班を取り上げることはしない
1232.8900	18.2700	overt	1232.8500	1479468	俺はあなたが痛みを抱えたもの前に住むようになればそれまで何度でもさしに来ていいんだ俺はそれを何度でもさしに来ていいんだろうらあなたのせい度はもうとくにそこにいるんだからあんたらのせんどこにそこにいるんだからあんたらのせんどくにそこに二人は今のそばあなたのそばあに
1252.6000	3.6900	overt	1252.5600	1503120	頑張って前に進め 俺なんかに言われなくないがニ人合わせて
1258.3900	2.5800	overt	1258.3500	1510068	この階でお開けだいいような
1261.8700	1.7400	overt	1261.8300	1514244	体調時々かっこいいのを買いに
1266.6400	10.2300	overt	1266.6000	1519968	真の将軍である信用大事件でこのことは詐欺として読むのことはなかったその辺りとしているそれもなく驚きランドしたそしてその辺りからどこか
1277.6200	3.2100	overt	1277.5800	1533144	なよね主人たちの距離が少しで近づいたように感じられた
1282.6900	2.5200	overt	1282.6500	1539228	なんかガル抜いており俺の考えはいろいろ
1285.9900	8.8500	overt	1285.9500	1543188	こっちが武装解除してたから向こうも一応武器の検査すべきだったから本当にビフェットが刺されていればもう収拾がつかなかったと思うだよね
1295.3800	6.7800	overt	1295.3400	1554456	でもそれをしたらお前の言葉ジューニ月の方にそこまで低め響かなかったと思う
1302.7300	3.4800	overt	1302.6900	1563276	先が思いやないのはブラック統一したこれが全土で起こると思うと
1306.7800	14.9700	overt	1306.7400	1568136	だから何を理想郷にしようと言ったんだろうとお将軍はできたら要は隣の女王させてまた隣の女王ってその仕方ないと一つ言っていいかこの問題でお前の頭で答えが出るならばあまり真面目にも貸しておけ
1322.5600	2.9700	overt	1322.5200	1587072	でもあの夜のことあれではよかったと思うし
1326.4600	3.2700	overt	1326.4200	1591752	何かすでに名前呼ばれてちょっと呼ばれて
1330.6000	1.4400	overt	1330.5600	1596720	体重兵器の連鎖ついてる
1337.1400	2.5800	overt	1337.1000	1604568	特な人はみんなを 知られてあると
1342.2700	3.3900	overt	1342.2300	1610724	そしてあれが馬の時代にやつれるケンバーゼル彼らはまたしゃべれると
1346.9200	8.8200	overt	1346.8800	1616304	さらにあれは西の息子すいから言えば判明の一度の一番目の位置なのですがそこが悪すぎてお金字だけと何度もらんと
1361.7700	1.3800	overt	1361.7300	1634124	いつのまとめて進展にかかってこれ
1364.3200	5.0700	overt	1364.2800	1637184	分かったよ
1378.3600	1.0200	overt	1378.3200	1654032	だいと思っている
1385.5900	1.2900	overt	1385.5500	1662708	よろしいでしょうか
1387.6900	4.0800	overt	1387.6500	1665228	できた 今から名前はあげるものみんな集めて新対話してください
1459.5700	1.2300	overt	1459.5300	1751484	おかればあれじゃないのか
1461.4000	1.2300	overt	1461.3600	1753680	てめえが魂込めた
1468.6000	1.5900	overt	1468.5600	1762320	全て説得として
1472.1100	3.0600	overt	1472.0700	1766532	長ニ本目の神奈川宮村市の一番地を咲くよ
1475.8300	2.2500	overt	1475.7900	1770996	ヨン世代のあれ本当に抽選はないです
1479.4300	4.9500	overt	1479.3900	1775316	神奈川甲子園のスカウトはこの試合にしているこの辺りの感動がアピールするのが一番近道なかった
1485.1300	1.1100	overt	1485.0900	1782156	あとなったらするわけ
1487.4100	9.3600	overt	1487.3700	1784892	この週の注目に金山下に高瀬はまだ細いが最速ヒャクヨンジューニキロの砂丘と切れ右サイドアバーキにコーミナのピッチングするエースの永堀を打ち
1498.1200	2.6400	overt	1498.0800	1797744	また行ったか
1502.0500	4.3800	overt	1502.0100	1802460	毎日は結晶してあそこに行くような
1507.2100	8.9700	overt	1507.1700	1808652	そういう言い方は守備の見せてやるときゃ俺が取ってやるそういう言い方はないだらに小さくやくざかをかんどお前のレベルまで下がるぞお前のことだけは認めてやってるんだから
1518.2800	2.3400	overt	1518.2400	1821936	ただ今笑えた
1521.2500	2.8200	overt	1521.2100	1825500	ニ組目のエネルギー炭水化をつけた
1524.6700	4.1100	overt	1524.6300	1829604	ここで一歩一歩近づいて俺の勝負を勝負するなに一足すぎも人売りしたくない
1530.4000	4.8900	overt	1530.3600	1836480	気を遅く腹休めていいのかよ
1548.1000	6.6300	overt	1548.0600	1857720	おかげでうちまで負けたな人のためだとか全日の骨格で被害を受けるの場面なんで明日のケッションをこんなバッケーターが見に行く
1556.2900	6.6000	overt	1556.2500	1867548	C線で入れば高額で甲子園であればプロに行けるかもしれないそれじゃまあ彼のためにやってるみたいじゃないか違いすんな
1565.0500	4.0800	overt	1565.0100	1878060	俺は野球を続けたのも野球で勝手時代だけなかったそれだけなんだ
1570.6300	4.6500	overt	1570.5900	1884756	お前の得点力の期待してるお前の期待なんかやねん俺は自分自身のために映るんだよ
