onset	duration	trial_type	wav_onset	sample	value
3227.2900	4.5900	overt	3227.2500	3872748	全然落ちてたかしらやっぱりねあっちのサン年間できた力で落ちてるからね
3232.3900	4.1100	overt	3232.3500	3878868	私の上についなきゃいけないんだろ
3237.2800	4.5000	overt	3237.2400	3884736	なぜのサン週たちにかかってるからイチ回戻してたことなんでいつもならイチ週間それ潰してください
3242.3500	1.8000	overt	3242.3100	3890820	柔らかに減らしたら今らしいわ
3250.5700	4.0800	overt	3250.5300	3900684	貴重なさって言っているんですけどこれがフェリカム大丈夫
3256.0600	1.3500	overt	3256.0200	3907272	分かん作るのか
3260.2900	11.3100	overt	3260.2500	3912348	昨年は午前ロク時ごめんなさいなかったロク時だったのによくそうなったらよくそうなったらつめてみたことがさいや去年と同じように部屋にバレバレジャーサンとバレバレジャー
3272.5600	5.4300	overt	3272.5200	3927072	だんだったらこのイチイチイチ枚だけできてフジクラティックラットしてペッチャーに一緒にかけてスタミナ暴やばいけでベストゴまで勝ちなかったんだ
3279.1000	1.9800	overt	3279.0600	3934920	それなら監督してビーチャルですかはい
3282.1300	5.8500	overt	3282.0900	3938556	あれが急ぐに足りないもの
3289.0900	6.7200	overt	3289.0500	3946908	昨日の夏藤倉までに熱心に練習してたイチ時君西空門命のシニアはしてますかね
3297.4000	1.4700	overt	3297.3600	3956880	今年も勝つのは俺だ
3299.8600	1.3200	overt	3299.8200	3959832	じゃあさらせていただきます
3302.9500	1.8600	overt	3302.9100	3963540	こいつの多分こんなに重かった
3310.3900	1.5000	overt	3310.3500	3972468	説当な彼女性にしている
3312.6700	4.6500	overt	3312.6300	3975204	またベストホーでもあるんですけどしてね
3318.0700	1.4100	overt	3318.0300	3981684	ニ番セカンド宮高
3321.6400	3.8400	overt	3321.6000	3985968	いつも通りだし全然セットしていて回して回してましたよ
3326.7100	3.3300	overt	3326.6700	3992052	昨日のサバーの主に書きよりペレスが去年大切さがきて明らかに違う
3332.4100	2.9100	overt	3332.3700	3998892	日本だって目だろこっちもいつまで見てんだ
3336.8800	2.3400	overt	3336.8400	4004256	ありがとうございます
3344.4400	1.0800	overt	3344.4000	4013328	土壌一馬センター
3346.7800	2.5500	overt	3346.7400	4016136	私は早が力ニジューナナ歳
3350.6500	5.0400	overt	3350.6100	4020780	セキバントボールこいつお時間を置かせてもらっておかしいなしてもらって
3358.8400	3.3000	overt	3358.8000	4030608	正解出時なら知らんなニ番ショート日だし
3364.3900	4.5000	overt	3364.3500	4037268	そこへと西の爆発を逆にそれが手形にすると確実に
3370.5100	1.7100	overt	3370.4700	4044612	寝たまんじゃないの
3378.1900	1.0200	overt	3378.1500	4053828	ワンなどにさんで
3380.3200	4.1400	overt	3380.2800	4056384	東昇の方が落ちてるんじゃないかって
3386.1100	2.6400	overt	3386.0700	4063332	今日のベストで満足してねえと
3389.7700	3.1500	overt	3389.7300	4067724	あの顔にならず同じことして
3393.7000	1.0500	overt	3393.6600	4072440	おばあさんです
3395.3500	3.1200	overt	3395.3100	4074420	私は彼女に来てなかったよ
3399.2200	3.3300	overt	3399.1800	4079064	あいつの辺りに勤めされたの
3403.9600	3.2100	overt	3403.9200	4084752	確かに早いらしいです
3408.0700	5.0100	overt	3408.0300	4089684	大事に聞いてあらだらしてのことよりされそれにくれ
3413.9800	1.8900	overt	3413.9400	4096776	今日の話聞こえちゃいました
3417.3700	5.8200	overt	3417.3300	4100844	本当に聞かせませんものでそういうことにそういう人は一緒にしてもらってもあるさえからな
3423.7000	7.0800	overt	3423.6600	4108440	投手はチケチーム全体が何かしらホームランのテネットは踏んだ相手が使ってきてもかしらどうな手を使っているので
3431.8300	1.7700	overt	3431.7900	4118196	それでは使ってらっしゃるか
3434.8300	1.7700	overt	3434.7900	4121796	ちょっと待ってください
3438.3400	4.2000	overt	3438.3000	4126008	そうだったら強きで行け私の方が分かっているんだけど 気さらかにしい
3444.3400	4.4100	overt	3444.3000	4133208	待ってニつ勝負するなここまで振りちゃったのか藤黒岡来ましたね
3450.5500	1.2000	overt	3450.5100	4140660	はいた先生そうやん
3453.7600	2.6700	overt	3453.7200	4144512	去年一緒に延びたし俺がこさえ君のぜ一応一年だろばかり
3457.2100	3.4500	overt	3457.1700	4148652	うちお前らみたいに全員同じことやらさったってみんなでは赤のつやつばっかりだから
3462.5800	4.7400	overt	3462.5400	4155096	今の前でスイランとかざけんのやっぱりねやっぱりねん俺になって言ってた先生する
3471.0400	8.0700	overt	3471.0000	4165248	脳筋のトレといえばパークライだから生を褒めたようなビスネスのすごいバンターになるとしかどうしてられない俺も一発かましてやっぱりしたら僕はスタートは僕
3479.8300	1.4100	overt	3479.7900	4175796	おめでとうございます
3482.9800	5.7900	overt	3482.9400	4179576	それ 去年と同じとこにやってた人たちともにやってた人だよね
3490.9600	4.3200	overt	3490.9200	4189152	ダイエットが足りないんじゃないか
3496.4500	1.5000	overt	3496.4100	4195740	役に目様したんじゃないか
3498.5500	3.2100	overt	3498.5100	4198260	このクイッチはどこかで感じちゃう
3503.4700	4.4400	overt	3503.4300	4204164	いつまで行ったってんだ後ろに初めてのが当職運転してはなかった
3508.9000	1.3200	overt	3508.8600	4210680	分かってまず一転使ってくる
3510.8500	3.9000	overt	3510.8100	4213020	連絡を取るチームが当初みたいにパツはないし一時の調子がいい車両で解散
3524.2600	4.5900	overt	3524.2200	4229112	あんなにさつくもしか嫌いなやつがせんじゃ 検事急ぐらかったんだよなといったの頃とか
3529.9300	1.2600	overt	3529.8900	4235916	クラチューだよ
3535.9600	2.0700	overt	3535.9200	4243152	大丈夫かな
3544.4200	2.6400	overt	3544.3800	4253304	まあそれいつものことだからな
3547.9000	1.0800	overt	3547.8600	4257480	そうやってるんだよ
3550.3000	1.0200	overt	3550.2600	4260360	どんな時代だよ
3552.7900	7.2900	overt	3552.7500	4263348	貴様など未来のパートナーに見構えないだろ
3562.0900	4.3200	overt	3562.0500	4274508	だからニ人とも抗体ですよ
3567.4600	2.2200	overt	3567.4200	4280952	民同士のブルクイでご出演ってごめんですから
3571.5400	3.4800	overt	3571.5000	4285848	僕も俺もまだ少し体をだから死に込めって言ったな
3577.2100	3.6300	overt	3577.1700	4292652	空気あの二人で外に出てるもんじゃないって
3581.9200	1.2600	overt	3581.8800	4298304	彼に気をつけんごわすと
3586.9000	2.1000	overt	3586.8600	4304280	俺のファーストミット作り来た先輩
3590.2300	3.9900	overt	3590.1900	4308276	選手の抗体気を遅くていいのなんていじゃないか
3597.1300	6.7200	overt	3597.0900	4316556	ちょっと当てが外れたなおかえりにし先輩の弟も引っ込んでたし
3604.4800	2.5200	overt	3604.4400	4325376	私が勝ってきゃ最後にうちが勝つのしようかな
3608.0800	3.7200	overt	3608.0400	4329696	急速と強くて強くても前とジーミュートだったよね
3613.1500	4.1100	overt	3613.1100	4335780	ちょっと焦ってしまいました
3618.6400	1.5600	overt	3618.6000	4342368	だから当然攻撃を一発すれば
3621.1300	3.3000	overt	3621.0900	4345356	これなら僕のデッドのための一応はセテムの相撲と誰も気にしない
3625.3600	1.3200	overt	3625.3200	4350432	前に靴たちないとこ見せろ
3629.1400	1.2600	overt	3629.1000	4354968	ファーストです
3631.0000	4.2900	overt	3630.9600	4357200	確かに今はまだベンツの中のごちゃうしに一回出さないとベンツにすらいいね
3636.6400	6.3300	overt	3636.6000	4363968	私はこれだかつたらジューイチ時のためにもう決めち前に見えておくそ天然の力見せてもらうじゃないか
3643.6000	2.4000	overt	3643.5600	4372320	皆上の力勢に認めさせてやる
3647.3500	1.9500	overt	3647.3100	4376820	ちなみに比べられないな俺とバレー
3650.4400	4.7700	overt	3650.4000	4380528	チェンセントリーは一番勝手に上昇してたんだけどそんな彼らに試合にしてる
3656.0200	5.4900	overt	3655.9800	4387224	仕組みんな間違いはもうきゃご苦労さないお時間になっていい時間が出てきたほかについて足りなきゃいけないぞ
3662.4400	2.8800	overt	3662.4000	4394928	あいつ何かだかに本当に飛ばすのはまだチームへと
3666.0400	2.3100	overt	3666.0000	4399248	今はどうですかね
3668.8600	1.4100	overt	3668.8200	4402632	力切ってたのか
3670.9000	3.0600	overt	3670.8600	4405080	俺なら次は
3675.8500	4.3800	overt	3675.8100	4411020	ナイスボール外に言わへん勝手で空振りついやアウトコースに邪魔してこいつは
3680.8000	1.2300	overt	3680.7600	4416960	判断できるようか
3685.1800	2.0700	overt	3685.1400	4422216	この男性は何かは内緒です
3689.0200	3.3000	overt	3688.9800	4426824	こうなんじゃないの
3693.1600	2.2500	overt	3693.1200	4431792	あんたのかな
3696.9700	3.0900	overt	3696.9300	4436364	肩の力が抜く
3701.6200	3.9300	overt	3701.5800	4441944	できないと体が滑らずにもかねそれじゃあお前は抱きを飛ばせないから散々力なきゃ
3707.8900	3.0000	overt	3707.8500	4449468	サクちゃん力だけで書き続けると思っているのに目に見せてやる
3711.8500	3.8100	overt	3711.8100	4454220	なぜかさかつ急にでかく見えたらあのコメのあれで打つのよバーにし一似てるな
3719.2000	3.9300	overt	3719.1600	4463040	マイナーアイスどうされます
3724.2100	5.9400	overt	3724.1700	4469052	そういうことに決まってるんですか 決まってるでしょうかみなさんインコースチブしくせな
3731.4700	2.4900	overt	3731.4300	4477764	やっぱりちょっと楽しそうですね
3735.0400	2.0400	overt	3735.0000	4482048	どいつもこいつも
3737.5900	1.3800	overt	3737.5500	4485108	もちなんとおりしたい
3739.5100	3.2100	overt	3739.4700	4487412	ビリオくれてる
3750.1900	3.0600	overt	3750.1500	4500228	そういう間に気持ちの間に気持ちない
3754.2400	4.6800	overt	3754.2000	4505088	もしかして本当にこうな
3759.5500	3.6900	overt	3759.5100	4511460	初出は困らっちゃいかったの中でこれくらい負けたことじゃととしろ強いんじゃないか
3768.0100	3.3600	overt	3767.9700	4521612	これ分かりたいなやつだ
3773.2300	4.5000	overt	3773.1900	4527876	投げすぎてないんだよ確かと押しちゃったら決勝まで当たらないんだったら立ちでこけんなよ
3778.8100	4.8000	overt	3778.7700	4534572	ナナ対レーで当たったのに向かってナナ対レーでどうしよう
3785.2300	7.0800	overt	3785.1900	4542276	今日のお前たちのおかげで強くないとありがとう彼がすぐに返してる夏の汚染だなあの感覚
3793.7200	3.0900	overt	3793.6800	4552464	僕まで言ったのに分かりません
3797.5000	1.2300	overt	3797.4600	4557000	その方法をさせていただいていくぞ
3800.4400	3.2400	overt	3800.4000	4560528	駒駅スタジアムでこんなわけにの試合もあるんだって
3806.2000	6.7500	overt	3806.1600	4567440	俺たちだけじゃなくていろんなここの警察に来てるです
3814.0300	1.2000	overt	3813.9900	4576836	ここなんかくり
3816.1600	1.9800	overt	3816.1200	4579392	すでさすが決戦からも絶対欲しい
3826.9000	2.1000	overt	3826.8600	4592280	すんばんはさっきゃバッタリッチ
3830.6200	1.2000	overt	3830.5800	4596744	全然するわけで
3833.0500	7.3500	overt	3833.0100	4599660	昨日亀井さんが汚地で表彰の試合見に行ってきました
3841.1800	3.0900	overt	3841.1400	4609416	笑わしいがないっていう余裕の笑いだ
3845.3500	6.9600	overt	3845.3100	4614420	ホームラックはホームラン手掛けになっていらない
3855.5500	2.4300	overt	3855.5100	4626660	ちょっと気をつけてるか
3860.5300	4.6800	overt	3860.4900	4632636	全然緊張して中止しちゃかったんだそっちのカーパー絶対売って
3871.8700	5.4900	overt	3871.8300	4646244	完全にスポネケだと思ったあの高さキュー時にしか乗れました 背中からからもう一撃落ちてきた
3879.6400	2.7300	overt	3879.6000	4655568	たった一で転んでいる道
3884.2300	1.4100	overt	3884.1900	4661076	一番大変かってみて
3887.1400	1.5000	overt	3887.1000	4664568	三宅見ながらしい
3890.2600	1.9800	overt	3890.2200	4668312	おかしい
3893.9500	2.7300	overt	3893.9100	4672740	おはようございます
3897.6700	2.5800	overt	3897.6300	4677204	この子で一番ライト上田君
3903.0400	2.1900	overt	3903.0000	4683648	この中な先取りつわんのなりくい
3908.7100	3.9900	overt	3908.6700	4690452	あんたらオクシャンスタンボって
3913.9600	3.0000	overt	3913.9200	4696752	自分に回った方向こうらんなまさんでもあって くらなんて
3917.9200	3.1500	overt	3917.8800	4701504	うちなりら何言うことの長らしいのはあるのか
3922.7200	3.9900	overt	3922.6800	4707264	この込みと毎回してはかなりヒャク人以上分離社前に年が下から付き合ってくるか
3927.5500	3.2400	overt	3927.5100	4713060	そこにそういう意味どこにいても中心になる人は
3931.7500	1.0800	overt	3931.7100	4718100	違和的なのか
3938.4700	3.7800	overt	3938.4300	4726164	一応反応だけ合いな実は今確実に時間しなかったよ
3945.4900	3.3600	overt	3945.4500	4734588	どっちが作ってお前はバッタかしておくでしょぶら
3951.5200	1.7700	overt	3951.4800	4741824	バックスクリーン直撃のツーラー
3953.9800	2.0400	overt	3953.9400	4744776	牛さんの前に食いちまれてすごい忙しい
3964.9000	2.4300	overt	3964.8600	4757880	実は誰だったら同じすることでしょうね
3969.2500	4.2300	overt	3969.2100	4763100	それじゃあ卵が分かっちゃうみたいなけどかれちゃう
3986.2900	3.4500	overt	3986.2500	4783548	スタジアム中にアリスメント公園みたいにあれを打ち取れる選手はなんていう
3991.0900	2.8800	overt	3991.0500	4789308	リムセットのビクトリーのアイスピッチングに来たね
3994.8100	3.9600	overt	3994.7700	4793772	サン階の家族の電話で見られないでください
3999.9700	3.9300	overt	3999.9300	4799964	あと一つかればつなげさればなかったですからね
4005.4900	2.7900	overt	4005.4500	4806588	俺は言わないのに今水満が気になるんだ
4009.3000	3.8400	overt	4009.2600	4811160	前の試合を見てきました
4013.7700	3.0600	overt	4013.7300	4816524	お兄さんはお前のためにほう
4017.9400	3.3900	overt	4017.9000	4821528	この中には万事自一俺が言いかれるからこうしに行くな上等だ
4023.0400	4.3500	overt	4023.0000	4827648	いつまで肌になったのかといやそんなすぐにしてもらった
4028.7100	3.0300	overt	4028.6700	4834452	大丈夫かそうしたら熱心までまた入るし
4033.9600	3.5700	overt	4033.9200	4840752	髪って嫌いだから口の中の水分を持ってこれだけであげる
4038.3700	4.2600	overt	4038.3300	4846044	体調が暮らしで中から親父が散々騒がされてるから勝手に手を出すと痛みました
4046.7400	3.1800	overt	4046.7000	4856088	サンドリッチ来ないでしょ
4054.7800	3.8400	overt	4054.7400	4865736	結局はこれやらず頭ともどっちの話ですか
4059.3700	3.4200	overt	4059.3300	4871244	それというか著作権中分だったのが全館のためにまともっているなと思って
4064.4400	3.4200	overt	4064.4000	4877328	静かにしません
4069.1200	3.9600	overt	4069.0800	4882944	もっともともとは俺の腹のせいなんで岩かっこいいな
4074.1000	10.7700	overt	4074.0600	4888920	何だその関係として天然かなかったら口の体つきやな終わり不良と思ったら応援長の試合で行ったなかとねニ年の来先輩彼彼の授業中だなやったら
4085.5300	2.2200	overt	4085.4900	4902636	地元の試合の暇なら見に行ってみようかな
4088.3800	8.6400	overt	4088.3400	4906056	クイクイ学校にも行かない犬がなずにされてるみたいな
4100.0500	1.7700	overt	4100.0100	4920060	こちらに弾かせてもらってんだ
4102.9900	3.6900	overt	4102.9500	4923588	だから知らせてほんまにかれば やってみてよってよってよって
4107.7000	6.4500	overt	4107.6600	4929240	ここで足で引っ掛いた時の上から気が入っててどこにあるかどうなると思ったらさまではちゃんと回らないとなって
4115.3200	3.3900	overt	4115.2800	4938384	あれ恥ずかしかったそれ以来グランダー帰省しちゃってたの正確になっちゃうな
4119.3700	2.6400	overt	4119.3300	4943244	僕勉強にしても電話がなかったから
4123.6900	1.3500	overt	4123.6500	4948428	あれで試合が決まったんだから
4127.0500	9.5700	overt	4127.0100	4952460	最初の時から一面ヒット打ってびったりする距離距離が伸びてもらったね最初によくねその中逆らかいでその中途絡では俺が死ぬとしてになったんだかそれ寂しいね
4138.4200	10.8300	overt	4138.3800	4966104	ここがないブリキなんだよ誰かが裏を刺してないサビに行って動けなくなっちゃんだオズのマホつくり知らない場合ここがないブリキのないライライン子の旅の音もおそらんサビで動けない心のないブリキか
4151.1100	4.0500	overt	4151.0700	4981332	知恵なりかかしあの規模屋されてる西先輩お前の身も繰り返してやく
4156.8700	4.4100	overt	4156.8300	4988244	ような手間が取れた方で積み合わせるならキードメイクンブルスステムを動かしてやるよ
4162.0900	4.6800	overt	4162.0500	4994508	今の子たちがみんな認めてほしいと思う
4167.6400	2.9100	overt	4167.6000	5001168	東昇から甲子園休んで急がないと昼休み終わる
4173.6700	6.3000	overt	4173.6300	5008404	結構可能性を足してくればいいのでやっぱり慣れてきたりする練習に戻らない
4181.0200	2.3100	overt	4180.9800	5017224	じゃあのバレンショナの強速オブ先輩
4190.2900	3.4500	overt	4190.2500	5028348	普通に粘りされてやすくちゃうまともなと思って
4194.6100	4.2600	overt	4194.5700	5033532	何だそれ言い方ダメだよ俺とこ私出てたら藤倉さんにもらったかって調子になってるんじゃないんだよな
4200.1000	3.7800	overt	4200.0600	5040120	それが入れたらいいことが違う手間がちと同じ情報知でこうなった合わせると思ってるのか
4205.3800	4.9800	overt	4205.3400	5046456	魚がそろたらと同じよね
4210.9000	5.4900	overt	4210.8600	5053080	ちょっと違ってみんな踊ってものを知っている
4217.9800	4.3200	overt	4217.9400	5061576	ニサン年の工学生で一緒にネット声をもらってあそこに伺ったんだ
4222.8700	2.6100	overt	4222.8300	5067444	俺はやつだったらこうやったことがない
4226.5900	2.9100	overt	4226.5500	5071908	やっぱりジュー日も絶対に力を責めつけられる気持ちがある
4230.9700	5.1000	overt	4230.9300	5077164	応援をしていて自分の機体を期待するようなってな
4237.2100	4.9800	overt	4237.1700	5084652	俺みたいなことも期待してけどそれに答えないから期待することだけやめたほぼな手を取ると
4244.4700	2.4300	overt	4244.4300	5093364	先輩にも本人で答えておしてたちじゃないかね
4247.8900	3.5400	overt	4247.8500	5097468	あの人のポルダチに見かけられませんでした
4252.5400	5.8800	overt	4252.5000	5103048	そういう間にもできるみたいなそんな感じでもなきゃいけない
4259.2600	1.9200	overt	4259.2200	5111112	初手は練習得に始まってんぞ
4264.6300	4.9200	overt	4264.5900	5117556	それで調査君だでも帰ってきたら俺じゃないしあの人って後で締め上げてやる
4273.2700	2.2200	overt	4273.2300	5127924	翌日の試合はあそらに勝ち上がってくる
4277.8900	6.7800	overt	4277.8500	5133468	手の取りに臨むとか万歳の脳機なら問題にならない何でも背景と腰を膝を吸ってられてることができません
4286.7100	3.3900	overt	4286.6700	5144052	私は私が使ってきたけどまだやってるのかちこそばに取り返してるんだよ
4291.2400	2.8500	overt	4291.2000	5149488	確かに自分たちなとばっかりしないけど
4299.1000	1.9500	overt	4299.0600	5158920	最後はヨン対レーこれでベストジューロクだ
4301.8300	4.4100	overt	4301.7900	5162196	私の試合にてねてくれなちにしちゃってみてやるんだ
4307.2300	2.2500	overt	4307.1900	5168676	朝に食さんしてみます
4310.0800	2.1900	overt	4310.0400	5172096	なんだこいつは一緒なんて飲まわけだと思う
4313.3500	1.3500	overt	4313.3100	5176020	それが一緒になるぞ
4315.6900	2.4000	overt	4315.6500	5178828	職効率のエバンバッターその自服
4318.7800	2.1000	overt	4318.7400	5182536	気持ちいいかもしれない
4321.9600	2.0100	overt	4321.9200	5186352	まだ自分の背中を打ったらフェンク質になる
4325.8600	2.9100	overt	4325.8200	5191032	ジューナナ対ゴランド参戦したらいい衆国
4334.2300	2.2500	overt	4334.1900	5201076	僕も今の人で捕まらなくちゃ
4338.5200	3.2400	overt	4338.4800	5206224	お前さんの手段に取材してもらってやっぱり怖いし
4495.1500	2.2200	overt	4495.1100	5394180	頭に閉じてまた一番強いとこ行ってると思った
4499.8900	3.9000	overt	4499.8500	5399868	超高の話も先頭までかばしてるかもしれません
4504.5100	3.0600	overt	4504.4700	5405412	千田の時にやってられてるんですか
4508.2000	2.5800	overt	4508.1600	5409840	やっぱり確かに確かに出てるんだって
4511.8600	1.3200	overt	4511.8200	5414232	大学典を撮ってる判明
4518.9700	3.6300	overt	4518.9300	5422764	イチ回戦はジューサン対ゴにニ回戦を切れたら覚めにしてもいい
4524.6700	6.3900	overt	4524.6300	5429604	毎回一人以上まるべくさいけどな私の懸命にしか育てない
4531.8400	2.5200	overt	4531.8000	5438208	これでちょうどしない気をするだけないけど
4535.7400	1.9200	overt	4535.7000	5442888	中国のピッチャーがつなぎく
4540.6900	6.2400	overt	4540.6500	5448828	一緒に出して僕と同じと合意的にあるんだんを勝つためにそれを打ちまくり一緒に僕でも最悩めてくれる
4549.1800	6.1500	overt	4549.1400	5459016	誰も乾いたグランドの土地で水を求めて土を折り返すマンドバッタボクス内容がそこに才能ノノイズを求めておって
4555.9000	3.0900	overt	4555.8600	5467080	けどどれだけ落ったところにはないとしても限らないし
4559.6500	1.6500	overt	4559.6100	5471580	ネスチューで気になるかとか
4563.2500	2.2200	overt	4563.2100	5475900	ピーラストラほどでもない
4567.0000	3.4800	overt	4566.9600	5480400	私たらなわちも前につもらって 気にしながら
4571.8900	1.8600	overt	4571.8500	5486268	一応これ引いていくかな
4577.8600	2.3100	overt	4577.8200	5493432	私は気持ちいい瞬間にバッターに集中
4590.1900	1.8900	overt	4590.1500	5508228	センゴヒャク%だけで初めて見せなかった
4593.1300	1.5000	overt	4593.0900	5511756	そうです
4595.3800	2.5800	overt	4595.3400	5514456	ほんまサン試合でほんまよ
4599.4300	3.3300	overt	4599.3900	5519316	確かにそれ一気によって
4603.9000	2.9400	overt	4603.8600	5524680	マンリテチにマジかとられてやねんこいつら
4608.4000	9.0600	overt	4608.3600	5530080	このチャレンジのもう一度でもいいってことはいや全然臭いことはないといけばかんないな
4618.3300	5.0700	overt	4618.2900	5541996	私たちの同じには自分の作りは決まるというタイプだと思わせて
4624.6300	3.1800	overt	4624.5900	5549556	それ違いです
4631.5600	1.1700	overt	4631.5200	5557872	思い出すまで
4633.3600	3.5700	overt	4633.3200	5560032	ラジオラチュー撮ったのは初めてないとか僕でよかったです
4637.6500	3.1200	overt	4637.6100	5565180	検索には回したくないな店内の方に考えてるかよ
4641.7000	2.5800	overt	4641.6600	5570040	確かに打て目だ
4652.4400	2.4600	overt	4652.4000	5582928	サン点目はせいだ大丈夫じゃない
4655.9500	2.6400	overt	4655.9100	5587140	これだけのエネルギー保存の底体感する場面になると
4659.9100	4.0200	overt	4659.8700	5591892	それ以上です職人してノートの問題が少ないわだついてるぞ今日
4665.7300	2.5500	overt	4665.6900	5598876	イチ回なら修行に一番雇用だから
