onset	duration	trial_type	wav_onset	sample	value
5927.9500	7.7400	overt	5927.9100	7113540	ニ試合でトホームランに思ってるし相手はニ試合もして連続コールドカツの裁理だからな格好相手が終わりやっとも勝てないとするんで
5936.7100	1.0500	overt	5936.6700	7124052	パツナはいて
5944.4500	5.0700	overt	5944.4100	7133340	大臣のサン番ヨン番に使ってたんだけどまだヨン番になれば満足しない
5950.1500	2.4900	overt	5950.1100	7140180	総称高校出社でご本人の決勝を行います
5953.1500	4.3200	overt	5953.1100	7143780	私たまここで知る名だもんまちゃんの汚職によってくれたからの体に汚れさればいい
5958.5200	2.9700	overt	5958.4800	7150224	分かんなこと言っていたらあんた俺が立ててやら思われてやった
5963.1700	1.9800	overt	5963.1300	7155804	あいつなのはあんた見てらいいのか
5967.6100	8.4600	overt	5967.5700	7161132	すごい線ですねここまで後時の違い立ち上がってるかなチームを引っ張ってねナイスのサン年バンドの積みステートで出したの前に通うのだけは遠のない
5980.9300	4.8300	overt	5980.8900	7177116	もちろんだと言わせやかなばったらもちろん俺だけは近づかりくれるほど
5986.3600	3.4500	overt	5986.3200	7183632	全自然の答えでこその燃え上がるニ人の間にも消せはしない
5990.8900	6.1500	overt	5990.8500	7189068	ヒャクゴジューキャンネル休息がジューキュー以上増してる全開弾キャン入ったらジョンソーの筋肉だけにしておけ
5999.0800	2.7000	overt	5999.0400	7198896	大事な顔かがらざまなオリーブトバスやらせて
6002.9800	1.8600	overt	6002.9400	7203576	もう私は一緒に仕上がってじゃない
6005.8300	2.8200	overt	6005.7900	7206996	彼は全然言うなかねえ場合もちこんで
6009.9400	3.1500	overt	6009.9000	7211928	筋肉なんて昔とか昔とか言ったか
6017.1100	1.3200	overt	6017.0700	7220532	アルト
6019.0000	2.9700	overt	6018.9600	7222800	ナイスプレーを言うか ナイスプレーホーム
6023.2900	1.8900	overt	6023.2500	7227948	そういうところに
6025.7500	1.1400	overt	6025.7100	7230900	そんな気をするか
6029.5000	1.1100	overt	6029.4600	7235400	腹を透かしてるかな
6032.2300	6.6600	overt	6032.1900	7238676	清作君やつのパワーなんじゃまだ手がしびれてるぐらいだあいつは自分だけじゃねえだ俺に出席を待つねてしまうからな
6039.9400	9.4500	overt	6039.9000	7247928	弾の力が出てば弱になるためのアピールになるんだこの町を知らない忘れられるからバトの愛のことが受けるのは俺一人だけだ誰のところにもだけやらん
6049.9600	3.3600	overt	6049.9200	7259952	全然難しいな方が俺一人でするとかっており一人で片付けて
6054.5500	2.2800	overt	6054.5100	7265460	アイランチャネクの手袋でいいっぱい
6068.3800	2.6700	overt	6068.3400	7282056	お空が俺が愛のために戦ってるからだ
6075.6700	3.3600	overt	6075.6300	7290804	しかも絶対ゴ点目だなしかも立った方が打ち出すりやった
6079.7800	4.7700	overt	6079.7400	7295736	なんて思うんだあの弾見てくれたかもな
6085.9600	1.2000	overt	6085.9200	7303152	ちまつはだからずきか
6087.8800	5.1600	overt	6087.8400	7305456	これは捨てる時点数転換えないとちついから一緒に間違いない
6093.9400	2.2800	overt	6093.9000	7312728	ストーリーはしに行かないんだよストライク
6096.8200	2.8200	overt	6096.7800	7316184	ニ人ともバンドというニ人もすごいな
6100.5700	3.2700	overt	6100.5300	7320684	ストライクバターと大事好きなイモンとして同じだと思うね
6104.3500	2.5200	overt	6104.3100	7325220	最近の体力得なかったですよ
6107.7100	1.6200	overt	6107.6700	7329252	つなのにした人がおる
6110.5900	2.5200	overt	6110.5500	7332708	わずかにバンドの方が甘く入ったらいただくし
6113.6200	1.5900	overt	6113.5800	7336344	前から泣けたらここから行きに
6119.2000	1.4700	overt	6119.1600	7343040	あると思いのかなSプレー
6121.8400	3.6900	overt	6121.8000	7346208	そのうちの筋肉が身勝て倒したなりだがさすがあようになるから
6126.3100	4.0800	overt	6126.2700	7351572	今日もサロだったなニヒャクナナジューイチ 去年の春季大会対抗難戦
6130.9300	5.1000	overt	6130.8900	7357116	ホームランを打たれた屈辱
6136.5700	2.9700	overt	6136.5300	7363884	あの時俺らしかったニ人に邪魔する認識や断罪すると
6140.0800	3.3300	overt	6140.0400	7368096	お茶の愛の職人って作れたものからだ前にも下がりはしない
6145.5100	6.6000	overt	6145.4700	7374612	何かかんばってないのかに分かってないぜら下手だかかっているんですってやねえだよ
6153.0100	4.9800	overt	6152.9700	7383612	気についてたばなつまらないですし 気についてみなければバンドネーズのパワーリークで
6161.6800	6.2100	overt	6161.6400	7394016	ニ回目と一生の攻撃バンサードに石木くんがやってたまらされてトップピッチをフェアにしてんぱいならどうする
6176.8600	2.2500	overt	6176.8200	7412232	俺の一人の間に待ちと
6184.6900	3.0000	overt	6184.6500	7421628	お前ちゃんとしてパラシーやったりする
6189.0100	1.8000	overt	6188.9700	7426812	私もじゃなくても絶対になってない
6193.5100	4.6500	overt	6193.4700	7432212	何かいる際にくるつのくせんぺくりなかったら
6200.7400	4.1700	overt	6200.7000	7440888	おかしい目の前を勝手なさいと聞いたようにトラトにサン人にヨン番のカスタイルになれるよね
6205.6600	2.3700	overt	6205.6200	7446792	俺の近いちょっと今更先輩とらすんじゃない
6209.9800	4.7700	overt	6209.9400	7451976	バンドってみんなさえならさじてみんなさい
6215.4400	2.3700	overt	6215.4000	7458528	どんだけスペクトルさんの聴かせられると思うね
6219.4600	8.2200	overt	6219.4200	7463352	監督はもうヨン月あっての人の姿を見せたかと見せたらかと言うとサン年卒業したけど新鮮の中にバンドのことを嫌っている人もうちは悪いだろうな
6230.0500	3.1500	overt	6230.0100	7476060	ただこそいかのおにじいちゃんがおつままに戦う
6233.9200	2.7900	overt	6233.8800	7480704	おはようございますねバンスの私が入っていっちゃうのも同じです
6237.4600	3.8100	overt	6237.4200	7484952	これは私で食べるのもとに違います
6242.1700	3.9600	overt	6242.1300	7490604	そぼってるやつを面倒見る必要なといかもごめん仕事やって何でだけやり
6247.0600	1.6200	overt	6247.0200	7496472	そういう感じじゃないじゃないですか
6249.3700	2.9400	overt	6249.3300	7499244	愛情報はせっかくの財団が台無しになっちゃう
6253.0600	1.3800	overt	6253.0200	7503672	ただいましてるの中身だ
6255.0100	2.6100	overt	6254.9700	7506012	これじゃがついこの守りこのやはりの世界やばいだ
6258.5800	1.8000	overt	6258.5400	7510296	そうしたら俺にほんとくれた方がちゃんに
6261.4300	4.4400	overt	6261.3900	7513716	あの瞬間は心入れ替えて 心当たらしく入れ替えたのかもしれないそして誓った
6266.5000	4.5900	overt	6266.4600	7519800	この体の採してみどりやしたやつそんなもんちゃんを気にさらしたとしてさまを殺す
6273.1300	1.5000	overt	6273.0900	7527756	ディクエンセダバンド
6278.0200	2.9100	overt	6277.9800	7533624	たくさんの正しいと思ったのか
6282.1600	1.7700	overt	6282.1200	7538592	この体を履くするはさない
6284.5900	1.0200	overt	6284.5500	7541508	絶対知ってる
6293.8000	2.0400	overt	6293.7600	7552560	勝ち上げやすいとここのように膝を使うと
6296.3500	3.2400	overt	6296.3100	7555620	俺にしちゃうごないと聞いて先ほどプレッシャー的に涙出してはないな
6300.5500	5.2800	overt	6300.5100	7560660	だからアウトはアウトだ一緒にすると言ってながらうるせえよなんだくさてても何か痛そうだな
6308.6500	5.7300	overt	6308.6100	7570380	あいつの球はそこまで飛ばさんでもしか戦先輩かもしれないのかといけないのをしてていいってならしめるぞ
6314.8900	8.3700	overt	6314.8500	7577868	投手はニ回は待ってもサン者番タイム得点かちょっとこのまま当選にはならないのニ回のサン回の攻撃はヨン番しようとヨン番ホールライパートで注目のバンド
6323.8300	1.5300	overt	6323.7900	7588596	ついでしょうかあったか
6329.5900	3.3300	overt	6329.5500	7595508	何が無駄目ない何を主張している
6335.8600	2.2800	overt	6335.8200	7603032	なんだよあいつ俺を見たいや著作
6339.9100	1.7100	overt	6339.8700	7607892	セントロークスに出してるのか
6342.3400	2.7900	overt	6342.3000	7610808	確かに気をつけてたくなったわ
6345.9400	3.2700	overt	6345.9000	7615128	それと違い強いけどねマスクで髪やしようとなストライクゾーンだそんな
6361.9300	1.9500	overt	6361.8900	7634316	彼らさまで知ってたまたまただいた
6364.6000	4.2900	overt	6364.5600	7637520	俺が打たれると思ってたんだからセンターが下がってなければサン人狙えたら
6370.4500	5.9100	overt	6370.4100	7644540	例えば今まで盛り取ってやると思ったのにキャンチャンのセンター弾製団爆撃機にあったんだけどその辺は軽いようなしない
6377.3800	1.8300	overt	6377.3400	7652856	ごめんなさいと思うけど
6379.7500	2.5500	overt	6379.7100	7655700	ただそうするかお前が来たらさんって俺はももちゃん一筋
6383.4700	4.2900	overt	6383.4300	7660164	もう後に先制のチャンスのバンドまだ自分のカルティーガタクリバント聞いてるかバンド
6388.9900	3.5100	overt	6388.9500	7666788	チョプルのお金を鳴らすごとく天天下にカニを響かせてやる
6393.0100	1.4700	overt	6392.9700	7671612	寝れをほぼらなんて
6395.1400	5.1600	overt	6395.1000	7674168	ボタンを外けないんだからさすがに注意されたんだよ
6400.9300	3.2100	overt	6400.8900	7681116	ニ本も脱いでこんなところで大胆な頭をつけるだけだから
6405.8800	2.7300	overt	6405.8400	7687056	あれとお前ちゃんがそう思ってくる 待ってばんどくる
6409.6000	3.9600	overt	6409.5600	7691520	そんなやつにあの形でゴ番に入ってるかにはニ匹と同じパータイプのスラッカーで
6414.1900	10.8900	overt	6414.1500	7697028	クリバントの場面ならばタイル得点を買ってきてる才能君は今日公公かバンドー君は確実に送った方がいいんじゃないか
6425.6500	1.7100	overt	6425.6100	7710780	そっち置くのは難しいのかな
6427.9600	4.5300	overt	6427.9200	7713552	コロナ禍でおしゃれなことはありえない
6433.3600	3.1800	overt	6433.3200	7720032	ニ人の挨拶だなバンドはまだサン人
6437.5300	5.1600	overt	6437.4900	7725036	ナイスバンドのやつもそんなことしか聞かねえから文字使いじゃないのそのことはないか
6445.6900	1.3500	overt	6445.6500	7734828	よく分かっちゃいマジか
6448.6300	3.0300	overt	6448.5900	7738356	ガイフやら見てたまちそんな簡単にやすいか
6452.3200	2.1600	overt	6452.2800	7742784	そういうか当たれば飛びする子の落ちてや
6455.7100	4.8600	overt	6455.6700	7746852	体をもう一度少しでいてもお兄ちゃんの言うとに見合いでついていく
6463.2100	1.4100	overt	6463.1700	7755852	スクリスクイズ
6465.4300	1.8600	overt	6465.3900	7758516	ナイスマネージャー
6469.0900	2.3400	overt	6469.0500	7762908	クイズ施行二階裁理が一転先生だ
6472.1800	5.1600	overt	6472.1400	7766616	今作戦内出際にもおもちゃのなるなるシューズを俺のおもちゃ
6478.2700	2.2500	overt	6478.2300	7773924	そういう人たちになった大事に
6482.1100	3.5700	overt	6482.0700	7778532	スクイズを警戒するだけ俺のさ
6486.7300	3.7200	overt	6486.6900	7784076	ストライクを調子してるとかHKも入ってるんじゃないのかストライクバットアウト
6491.2000	3.1500	overt	6491.1600	7789440	マンド降りても厳しいかな
6495.6700	2.7000	overt	6495.6300	7794804	そうしてやればやりくいってしてもダメがしない
6499.0000	1.3200	overt	6498.9600	7798800	スクイズしたら俺だぞ
6500.8900	2.5200	overt	6500.8500	7801068	サン回目とちょうどこういうことになろうかスターボーク
6504.6400	5.4600	overt	6504.6000	7805568	最初の坂田山保さんのパワーがあるから気をつけてください
6510.7900	1.0200	overt	6510.7500	7812948	パンドになりた
6516.2800	3.3000	overt	6516.2400	7819536	一応ピザクシックのビジョフメダネイティング
6520.4800	3.6000	overt	6520.4400	7824576	今日の場のいつも以前最初のイチハチ勝点ならこの頂中君にある
6524.7400	2.0100	overt	6524.7000	7829688	だって言わないと会ってたのに出てやる
6528.6700	2.2500	overt	6528.6300	7834404	これがバンドの玉田中さん
6540.1900	1.0200	overt	6540.1500	7848228	大丈夫ですよ
6542.4700	2.0400	overt	6542.4300	7850964	大丈夫ですか
6545.7700	1.2600	overt	6545.7300	7854924	ご連勝お願いいたします
6549.2200	2.5500	overt	6549.1800	7859064	最下のサリコココケはハチ番レフト松口
6552.5200	3.6000	overt	6552.4800	7863024	私たちにしなかったから一年もバンドに向きも気持ちがいいです
6556.9900	1.5900	overt	6556.9500	7868388	こんな気にしてるわけ
6559.5100	1.4700	overt	6559.4700	7871412	何だそうじゃないですか
6563.7100	2.5200	overt	6563.6700	7876452	サン回ならなやつが多いな
6567.2800	2.2800	overt	6567.2400	7880736	自分たか自分とかよかった
6576.2200	2.7000	overt	6576.1800	7891464	皆さんの相撲は今も一緒になるんだろう
6581.2900	5.4000	overt	6581.2500	7897548	今ブルクの帰宅に型を作ってもらってます
6587.5900	4.1100	overt	6587.5500	7905108	写真が強いなきゃ一人なんて思いやがらないでくださいそれが私は作品みたいですよ
6905.4700	11.1000	overt	6905.4300	8286564	急に来たの大丈夫というのはその言葉を信じますのでジューキュー時間もみんなを信じて頼ってください
6917.2900	4.2600	overt	6917.2500	8300748	こうやってパーフェクトにされてるから
6922.4800	2.7600	overt	6922.4400	8306976	トレートレーカーだったトルスならかで楽天するぞ
6926.1100	5.4900	overt	6926.0700	8311332	私たちはたまにビート見ながらさしいお前きしこち行っちゃもなさけないメート作らない俺の仕事食べてろこします
6932.4700	3.5700	overt	6932.4300	8318964	メンスキャー絶対につらみたくないけど勝負だからな
6938.2000	4.8000	overt	6938.1600	8325840	一番だったらそんな飛行機に行かないって言っても安心しておきゃいけない
6944.3200	3.1800	overt	6944.2800	8333184	ここから書き回してやるよ
6948.4900	3.6000	overt	6948.4500	8338188	バンの歌もそいつだけ大丈夫な顔じゃなくそう言ってますけど
6953.0200	1.2900	overt	6952.9800	8343624	ちょっとでも
6955.3900	1.8900	overt	6955.3500	8346468	ただいまして確かにマッセリアで
6959.2300	4.0800	overt	6959.1900	8351076	この試合ランナーはファーストタイムかいぜみたいなワインでワインアップドルピッチングといかねる
6964.6000	4.7700	overt	6964.5600	8357520	はいどうされますねベンチにももちゃんのそばに行かせてもらう
6973.7800	3.5700	overt	6973.7400	8368536	一緒にかくらぶか分かることがそっちです
6978.5800	3.9000	overt	6978.5400	8374296	なんなりとったんばんのくぜとまた一つ君の目の前だ
6987.6100	2.1300	overt	6987.5700	8385132	一切かまとらえています
6990.5200	1.0500	overt	6990.4800	8388624	様にやらまだもな
6994.4800	1.9200	overt	6994.4400	8393376	超圧のショートに遅れはとな
6997.1200	2.2200	overt	6997.0800	8396544	一応待つの前行ったかと思ってよさも行かないなら
6999.9400	3.4200	overt	6999.9000	8399928	セットポジションカードリスピダンしてる球を削って受けずって
7006.3900	2.9100	overt	7006.3500	8407668	全然バッチリバッチリバンドウィッチリ
7010.4700	1.4400	overt	7010.4300	8412564	本当にイチセークル
7018.3300	3.0600	overt	7018.2900	8421996	あとどんどん感じがしてたかもしれませんスイングサイジアンチ様と一緒にする
7022.3500	3.1800	overt	7022.3100	8426820	言わない決めてくるのさくちゃん頼んだぞ 著作
7027.0000	1.8300	overt	7026.9600	8432400	様子にとっていますか
7029.8800	5.0400	overt	7029.8400	8435856	ワンアウトランナーさんはめっちゃ好きな俺とももちゃんの愛肉して年ぐらいだったんだとおしまいけね
7036.5100	10.9800	overt	7036.4700	8443812	こっちも話のゴールドホームに突っ込むだろうな僕こう思いにさないと何か前か何らか全員の方がバッター出演出できるというか
7054.8700	4.6500	overt	7054.8300	8465844	俺とってはむしろ手を取られることで考えてるピッチャーはどこにしたらストライク
7060.4800	1.5300	overt	7060.4400	8472576	今もちょっと寝らったのか
7064.7100	4.0500	overt	7064.6700	8477652	なんだこの感じ緊張じゃない体重が熱いまるで
7069.6000	1.2300	overt	7069.5600	8483520	ほらこらちょうど
7074.0100	1.4400	overt	7073.9700	8488812	分かりたいなこと
7078.6300	4.5900	overt	7078.5900	8494356	ちゃんとバンド君そうか心配によだわち全て同じで君のもとに帰る
7088.3500	3.5700	overt	7088.3100	8506020	俺の方が確かに思うけどもちろん
7098.8800	1.4400	overt	7098.8400	8518656	捜査まそうじゃない
7102.0900	2.7900	overt	7102.0500	8522508	自分の多分倒してしまうのにしてみてる
7119.5500	12.2100	overt	7119.5100	8543460	次のパターンに連続できると分かりやすいのパターンを持っているのはいつも一緒にやってくるし自分の動作でパターンを切り替えることもできるからこのパターンの集合を見せるときは同じ名前で呼ぶことにしようここのパターンにはなくグループ
7131.7600	12.2100	overt	7131.7200	8558112	そして上位の階層にはこの名前を出すことでしょう
7144.6000	15.2400	overt	7144.5600	8573520	一時間隔に入った情報が高知の感覚へと上に従来変化の頻度はほとんど低くなる分野でイチ秒に何回か目が何回か目に何回か網脈が新しいパターンを捉えるために興奮するニューローの集合が面丸く変われなどこのようなことが起こるなのか
7159.8400	15.2400	overt	7159.8000	8591808	ちょうど歌詞にも中断レパートリーがあるようなものだ
7175.0800	15.2400	overt	7175.0400	8610096	またに局面をつけるように進出の隔離を機や認識できるシーケンスのそれぞれに名前の名前の事態はニューロンの集団でそれらが同時に感染することによってあるシーケンスの中にいることを実現するどの細胞がシーケンスを超えることを実現する
7190.3200	15.2400	overt	7190.2800	8628384	今の手な神経がついてる間興奮状態を保持してそれによって表現される名前が回想構造の次の領域に渡される名前が回想構造の次の領域に渡される領域が入力パターンを推測できるシーケンスの一部とみなしている
7214.1100	17.6800	overt	7214.0700	8656932	こんなふうに伝えてるのは僕が聴いてるみたりさわったりしているし今のところここの音楽や手弁護や手触りや任せくれ何かあったらしいことが起こったらしいことが起こったらその時は連絡するともっと具体的な例を挙げれば四角辺の相手やならさらにこんなことを言うのだろう
7231.7900	17.6800	overt	7231.7500	8678148	顔のあちこちが全然見えるだがずっと同じ顔がちこちが全然に見えるだがずっと同じ顔だ何か違うものが見えたらその時は連絡するとこのようにして予測できる出来事の異論の一点の興奮パターンによって識別されるこの手順はピラミッド型の一手によって識別される
7249.4700	17.6800	overt	7249.4300	8699364	ある領域が音楽を抗戦する音のシーケンスを認識しその音楽を公言するパターンを上位の領域に渡しているもの上位の領域は音鎖のシーケンスを認識して単語に対応するパターンさらに上位の領域に当たすその領域は単語のシースを表すパターン
7267.7800	7.7100	overt	7267.7400	8721336	最下位のレベルの領域ではシーケンスはかなり単純で視覚の場合なら何かの輪郭の一部が動いているといった程度になる
7276.2100	14.0400	overt	7276.1700	8731452	各層構造の確率で予測できるシーケンスが名前のついた対象に縮められることについて回想を登ることに変わりていくこのようにして不変の表現が出来上がるその逆の性がパターンが海藻を下るときに起こるつまり不変の表現がシーケンスに
7290.7600	15.1200	overt	7290.7200	8748912	中学イチ年生の時に暗記したリンカーのゲリスパークの演説を今から了承するマートシューマートシュの上位にある言語やこの有名な演説を表現するパターンが近く入れられてこのパターンがこのパターンのシーケンスに展開されるその一つの回応期では
7306.7800	13.0800	overt	7306.7400	8768136	最後の力が単語のシーケンスの記憶に展開されるこの時点でパターンの展開を二手に分かれ超過系と運動屋の両方下の方でそれぞれの単語が記録された音ソンのシーケンスに展開され最後に一番回の領域で
7319.8600	13.0800	overt	7319.8200	8783832	それぞれの音声を発するための筋肉への命令の神経総に展開される海藻を下にしたかいパターンの変化が目まぐるしくなっていく動み出す海藻の上にある一つの安定な複雑で長い神経質ができる
7350.3700	17.4700	overt	7350.3300	8820444	ゲリスパークの演説を露唱することは何も違います
7367.8400	17.4700	overt	7367.8000	8841408	単語は文字に展開する文字はタイプするために指の筋肉への命令に展開されるハチジュー年とナナジュー年の昔は始まる演説の記憶が不変の表現になっていてそれを話す時にもタイプする時にもあるいは手書くするときにもあるいは手書くするときにもあるいは手が出ることができる
7385.3100	17.4700	overt	7385.2700	8862372	つまり話すために記憶する必要がない点に注意しはその一つの記憶がさまざまな行動として現れる可能性を持っていることなどの領域においても起こりよる記憶の効率性を高めているのは記憶の効率を下に高めているのは記憶の効率を高めてくりある
7402.7800	17.4700	overt	7402.7400	8883336	ケリジバーグの演説のマンティングの私の夢がある実は異なる記憶の集合室はするわけではないシーケンスの回想を始めや低い回想の対象を超える世界でその構造の情報多くは極めて効率的でありコンピューターが演説を記録する場合とは一律しく異なる
7420.2500	17.4700	overt	7420.2100	8904300	シンケースの展開は感覚あるものにようだって同じように起こる人間は人間は対象さまざまな視点から認識して理解できるアイスクリームを食べようとすると冷蔵庫に向かって歩んでいく時あなたの仕掛けが様々なレベルで興奮している
7437.7200	17.4700	overt	7437.6800	8925264	もう少し階の領域では近くの流測は複数の特徴的な視覚情報に展開されている冷蔵庫を見ていることはドアの取り出し口ドアに張ってある磁などに次々と目を止めることができる冷蔵庫のある特徴から別の特徴で関係を受かすためにその動作されている
7468.9300	18.8800	overt	7468.8900	8962716	目が何か動こうとも予測が当たっている限り上位の時は冷蔵庫を見ている時は冷蔵庫を見ていることに満足し続けるこの冷蔵庫の演説では単語の順序が決まっていたのに対して冷蔵庫を見る時のシーケンスは固定でなく四角への流動が行って変われている点だ
7487.8100	18.8800	overt	7487.7700	8985372	しかしあまり変化しないく高いレベルのパターンから苦しくかは低いレベルのパターンに展開されるという意味で同じ結果がもたらされているシーケンスを記録しそれを名前で表現する方法は審室の回想情報が常時する様子と相まって軍隊での命令の回想を思い分かせるかもしれない
