onset	duration	trial_type	wav_onset	sample	value
1.2725	3.7500	overt	1.2900	1527	第ジューハチ章知らぬ恩人に対する感謝
5.5625	3.3900	overt	5.5800	6675	英国積学のみたる新党の養子
9.7325	12.4650	overt	9.7500	11679	先年高官教授として渡米するにつきその準備の一つとして研究というほどの深いこともないが少しく調査したいことがあって新党に関心
22.1975	12.4650	overt	22.2150	26637	そのうちに英国の積学ごとに日本の古代宗教及び文学に精通せるアストン先生の書中に
35.9525	4.6200	overt	35.9700	43143	新党は地温と愛情の宗教なりという一句があった
41.2625	5.6100	overt	41.2800	49515	これが僕の目に大いに止まったまた同志の説明を見て
47.8625	3.1500	overt	47.8800	57435	ますますこの一句の味わいが理解せられた
51.5825	15.3900	overt	51.6000	61899	その後ある友人が日本の新党を研究するには必ず黒ずみ宗忠の説を伺わねばならぬと注意してくれて年頃にもこの偉人に関する出版物を送ってくれた
67.6925	18.2100	overt	67.7100	81231	これを読んで一層アストン氏の詐欺の言の謝らざるどころでない実によくうがっていることを感じてその後ますます恩義を知るの感を深めることについて心の内に努めている
