onset	duration	trial_type	wav_onset	sample	value
2122.6667	11.6400	overt	2122.6500	2547200	無関係ってわけでもないよ定期的にね会合とかに連れて行かれて幹部と挨拶したりその子どもらと付き合ったりもしている
2143.9667	13.2450	overt	2143.9500	2572760	いわば定食屋の息子との二重生活だよバカバカしりょうは顔をしかめて言うとまあ身の上話はこんなものかな話が長くなったが今日道を来てもらったのはこんな時代
2157.2117	13.2450	overt	2157.1950	2588654	そんな自分のクソみたいな境遇を話すのが目的ってわけじゃないんだじゃあ何が本題なんだい道は習氏イライラとしているように苦笑しながら問い返すそれは
2232.6767	4.5600	overt	2232.6600	2679212	寮は珍しく口ごもり人に会うたびそうめいそうだと言われる
2237.8967	4.9500	overt	2237.8800	2685476	気敏に動く目でメチオの顔をじっと見つめてから
2245.0367	17.3700	overt	2245.0200	2694044	道夫に聞きたいことがあるんだよいいよ何でも答えてやろうじゃないか道夫が相手を安心させるような微笑みを浮かべてそう返事をすると寮は立ち上がるそして横たわる母親のそばに立ってその独り言を続ける顔を見下ろした
2263.4567	6.1500	overt	2263.4400	2716148	さっき言った通り偽証のじいさんたちは冷単だんだ発症してからはさらに露骨になった
2270.1767	3.0900	overt	2270.1600	2724212	治療やけ屋にも積極的じゃなくてね
2279.0567	1.3500	overt	2279.0400	2734868	それで僕は
2283.8567	10.4400	overt	2283.8400	2740628	ここのところ毎日母さんの面倒を見ているんだ食事を食べさせたり体を拭いたりおむつを取り替えたりすごいななかなかできることじゃない
2295.5267	15.3600	overt	2295.5100	2754632	日曜が今日一番の驚きを見せてそういうが竜は首を横に振るどうってことないよ今はもう暴れるわけじゃないからね寮は和美の手首を拘束する白いベルトの間に指を差し入れた
2315.2667	7.8600	overt	2315.2500	2778320	ベルトがきつすぎれば受血してしまうし許すぎれば外れて事故につながるその具合よ指を入れて確認するのだ
2324.4767	11.1300	overt	2324.4600	2789372	寮は介護生活でこの動作は癖になっているのだろう頭では言葉の続きを考えながらほとんど無意識のままその動作をしているように見えた
2338.6967	2.7000	overt	2338.6800	2806436	日曜はこの母を大事に
2343.4367	14.4100	overt	2343.4200	2812124	美しむ寮の後ろ姿を見て寂しげに目を細める本当にどうってことないんだでも普通なら色々と考えちゃうのかなでも僕にとってはずっとこの人は遠い存在だったから
2357.8467	14.4100	overt	2357.8300	2829416	僕は定食屋母さんはこの屋敷でほとんど会う機会がなかった父さんは昔よくここに来ていたそうだから僕以外のサン人はよく家族らしいことをしてたらしいけど僕はそう
2372.2567	14.4100	overt	2372.2400	2846708	今日はよく自分のことを話す寮がこのように自分の心境を話すのは本当におにまりのことだ顔には出さないがとてつもなく疲れ果てているとみちゅうは思った
2388.1067	4.8300	overt	2388.0900	2865728	妹ともこうなってから初めてまともに話したくらいだ
2393.5067	10.1700	overt	2393.4900	2872208	その妹は母さんがおむつの中にソソをしたり誰か別人の名前で妹を呼んだりよくあるタイプBの症状を見せるために泣きじゃく
2403.6767	10.1700	overt	2403.6600	2884412	そして今は変わり果てた母さんを見ることが恐ろしくてここに入れなくなっているでもそれじゃいけないっていう気持ちはあるらしいね
2418.3467	4.0800	overt	2418.3300	2902016	まだちっちゃいのに自分を責めているらしくて
2424.3167	4.9800	overt	2424.3000	2909180	よくドアの外で震えて泣いているよそんなに気にすることはないのにね
2435.6267	11.0400	overt	2435.6100	2922752	妹はまともな時の母さんの印象が強いからボロボロになった姿が見てられないんだ本当に親しいってのはそういうことなんだろう
2460.9467	2.1900	overt	2460.9300	2953136	僕にはそんな感情はない
2465.3267	18.9950	overt	2465.3100	2958392	飼い主がペットのフンをスコップで拾って処分するのと大切な作業だよで聞きたいことってのはさ寮は立ったまま道を振り返る何の感情の揺らげもないはずなのになんだか胸がぽっかりと空虚な感じがするんだよ
2484.3217	18.9950	overt	2484.3050	2981186	こんなの初めてなんだろう単性な顔上げな顔上げが浮かんでいる道端で突然対抗チームの不良少年に取り囲まれても傍観者のようにせせら笑っている見えっぱりでプライドの高い量がこうした勇気の表情を顔に出すのままおう
2503.3167	18.9950	overt	2503.3000	3003980	みつよは眉を片方しかめて軽減な自分を見つめる相手の顔をじろじろと見ていたが徐々にその唇がわなわなと震え母ついにこらえ切れずに笑ってしまった
2522.3117	18.9950	overt	2522.2950	3026774	まったくお前は本当にバカだな笑顔のまましみじめと言うとどういう意味だよ両は顔をあからめてそう返すそんなの分かれ切ったことだろうに別れきったって悲しいってだけだろうお前はとても悲しんでいるんだそれだけだよ
2541.3067	18.9950	overt	2541.2900	3049568	なんで悲しむ必要があるんだろうだよそれはお前がお母さんのこと好きだからだろう道を開けたように笑う寮は反論したいがいつものようにすらすらと言葉が出てこずに口をもっている道をはいつから立ち上がり顔を両に近づけるとうまく
2560.3017	18.9950	overt	2560.2850	3072362	なあ一度言おうと思ってたことを言わせてもらうぜお前さよく末望のことを常々欠落人間とか言ってからかってるよなあお前は結落してるわけじゃないんだろうが幼いおさないだと
2580.4967	13.2150	overt	2580.4800	3096596	そうだ頭よさげなことをくっちゃべるからみんな誤解しがちだがお前は口が達者だけで心はベイビーちゃんだよだから思い通りに行かないとすぐ腹を立ててむずがるし空気を
2593.7117	13.2150	overt	2593.6950	3112454	大前な寮は移動しようとしたようだがよほど慌てていたのかベッドが太ももに当たってよろける
2608.1567	17.6850	overt	2608.1400	3129788	これからなお前は心で物事を受け止めるんだじゃないともっとひどいことになっちゃうぜひどいってどういう意味だよ両は顔を真っ赤にしてみちよみつけるお前は何でも頭を使って理屈だけで解決してきたから心が全然
2625.8417	17.6850	overt	2625.8250	3151010	人の感情や心を読み取るのは甘いくせに自分の悲しみが分からないなんて重傷だぜ妹さんみたいに泣けばいいんだよだって悲しいことって世の中にそうそうないぜこんな悲しいことって
2650.3067	6.0600	overt	2650.2900	3180368	壁裂かれ恋焦がれたお母さんとやっと一緒にいられると思ったら夢と
2657.4167	15.3150	overt	2657.4000	3188900	戦うれてこっちを見てくれないんだ号泣したっていいくらいだろう少なくともすまし顔で何にも感じないなんてくだらないことを言っている場合じゃないそれとももう泣いたのか
2672.7317	15.3150	overt	2672.7150	3207278	じゃあ泣け今ここで泣け赤ん坊のように声を立てて泣け俺は向こう向いててやるからそして道は言葉通りくるりと背を向ける無理に決まってるだろう
2688.7367	13.8750	overt	2688.7200	3226484	ルーは同様で顔を引きつらせながら部屋の中を移動し道を離れた場所にある窓枠に手をかけたそうかまあそうだな
2702.6117	13.8750	overt	2702.5950	3243134	一応あっさりと撤回しまたこちらを向くいつの間にか遠くに逃げている寮を見て軽減そうな顔をしてからでもお前のお母さんは幸せだなそう言って和美の顔を見た
2727.6167	17.9400	overt	2727.6000	3273140	彼女は目の前の騒ぎには無関心で相変わらず彼女だけにしか見えない誰かと小声で話を笑っているお前お母さんの世話の仕方とかさしっかり看護の人に教わったのかあと自分でも調べてそっくりそのままままねしているはずだけど
2745.5567	17.9400	overt	2745.5400	3294668	何かおかしなところあるかいやとても清潔にしているなと思ってさ嫌な匂いが全然しないこんな発症者はなかなかいないよその時みちよの目に寂しそうな色が浮かんだ能量は見逃さなかったがどういう意味なのかまでは分からなかった
2764.1267	4.3500	overt	2764.1100	3316952	未知は母親が発症した後死んだということ
2770.1567	13.2300	overt	2770.1400	3324188	は伝えていたもののその詳しい状況などは何も話していないそれは両にということではなく母が死に住んでいたアパートを出てから誰にも一言も話したことがない
